text,query,country,city,userId,username,quote_count,reply_count,retweet_count,favorite_count,timestamp,createdAt
RT @Bebebotao: Nem o secretário da cultura é a favor do Museu da Bíblia e Ibaneis insiste nesse projeto. É uma heresia gastar 26 milhões em…,ibaneis,,,28374930,jjcarlossouza,,,2,0,Fri Aug 13 2021 09:26:57 GMT-0300 (Brasilia Standard Time),Fri Aug 13 2021 09:14:19 GMT-0300 (Brasilia Standard Time)
RT @leandrograss: Os metroviários estão de greve há quatro meses e Ibaneis é incapaz de negociar com eles. Não cumpriu a convenção coletiva…,ibaneis,,,1321339616,CaioLealDF,,,4,0,Fri Aug 13 2021 09:26:57 GMT-0300 (Brasilia Standard Time),Fri Aug 13 2021 09:11:56 GMT-0300 (Brasilia Standard Time)
"RT @neuzaortiz: O governador do Distrito Federal, IBANEIS ROCHA, pretende gastar R$ 26 milhões na construção do MUSEU DA BÍBLIA. Entretanto…",ibaneis,,,1209904749291724800,SoledadeCOSTA2,,,27,0,Fri Aug 13 2021 09:26:57 GMT-0300 (Brasilia Standard Time),Fri Aug 13 2021 09:09:25 GMT-0300 (Brasilia Standard Time)
RT @leandrograss: Os metroviários estão de greve há quatro meses e Ibaneis é incapaz de negociar com eles. Não cumpriu a convenção coletiva…,ibaneis,,,549267461,lurdsmila,,,4,0,Fri Aug 13 2021 09:26:57 GMT-0300 (Brasilia Standard Time),Fri Aug 13 2021 09:06:50 GMT-0300 (Brasilia Standard Time)
NOVE escolas do DF com surto de covid. A volta aulas do Ibaneis é um sucesso :/,ibaneis,,,14780848,fjunior,,,0,0,Fri Aug 13 2021 09:26:57 GMT-0300 (Brasilia Standard Time),Fri Aug 13 2021 09:06:33 GMT-0300 (Brasilia Standard Time)
RT @leandrograss: Os metroviários estão de greve há quatro meses e Ibaneis é incapaz de negociar com eles. Não cumpriu a convenção coletiva…,ibaneis,,,1411533350,fernando_rdoss,,,4,0,Fri Aug 13 2021 09:26:57 GMT-0300 (Brasilia Standard Time),Fri Aug 13 2021 09:05:06 GMT-0300 (Brasilia Standard Time)
Os metroviários estão de greve há quatro meses e Ibaneis é incapaz de negociar com eles. Não cumpriu a convenção co… https://t.co/j7dvqb4YQc,ibaneis,,,63507573,leandrograss,,,4,30,Fri Aug 13 2021 09:26:57 GMT-0300 (Brasilia Standard Time),Fri Aug 13 2021 09:03:53 GMT-0300 (Brasilia Standard Time)
"Lançado em outubro de 2020 pelo governador Ibaneis Rocha, o GDF Saúde atende atualmente cerca de 40 mil vidas https://t.co/y2jRDqb7cM",ibaneis,,,49825011,OficialJBr,,,0,0,Fri Aug 13 2021 09:26:57 GMT-0300 (Brasilia Standard Time),Fri Aug 13 2021 08:58:32 GMT-0300 (Brasilia Standard Time)
po ibaneis anuncia aí a vacinação +17 plmds,ibaneis,,,913500781642436600,Leonardoms__,,,0,0,Fri Aug 13 2021 09:26:57 GMT-0300 (Brasilia Standard Time),Fri Aug 13 2021 08:55:05 GMT-0300 (Brasilia Standard Time)
"RT @neuzaortiz: O governador do Distrito Federal, IBANEIS ROCHA, pretende gastar R$ 26 milhões na construção do MUSEU DA BÍBLIA. Entretanto…",ibaneis,,,1241927775801561000,Gilbertolegumax,,,27,0,Fri Aug 13 2021 09:26:57 GMT-0300 (Brasilia Standard Time),Fri Aug 13 2021 08:54:22 GMT-0300 (Brasilia Standard Time)
"RT @GlaucoS41843642: Bolsonaro nunca tem culpa de nada, os culpados pela inflação, segundo o presidente nazifascista, são governadores dos…",ibaneis,,,2800888529,carlosmouramelo,,,3,0,Fri Aug 13 2021 09:26:57 GMT-0300 (Brasilia Standard Time),Fri Aug 13 2021 08:51:44 GMT-0300 (Brasilia Standard Time)
"RT @neuzaortiz: O governador do Distrito Federal, IBANEIS ROCHA, pretende gastar R$ 26 milhões na construção do MUSEU DA BÍBLIA. Entretanto…",ibaneis,,,782079051867496400,Din2Diniz,,,27,0,Fri Aug 13 2021 09:26:57 GMT-0300 (Brasilia Standard Time),Fri Aug 13 2021 08:46:39 GMT-0300 (Brasilia Standard Time)
"RT @GlaucoS41843642: Bolsonaro nunca tem culpa de nada, os culpados pela inflação, segundo o presidente nazifascista, são governadores dos…",ibaneis,,,163696775,KrenRG,,,3,0,Fri Aug 13 2021 09:26:57 GMT-0300 (Brasilia Standard Time),Fri Aug 13 2021 08:38:59 GMT-0300 (Brasilia Standard Time)
"RT @GlaucoS41843642: Bolsonaro nunca tem culpa de nada, os culpados pela inflação, segundo o presidente nazifascista, são governadores dos…",ibaneis,,,1110181345,eri_leite,,,3,0,Fri Aug 13 2021 09:26:57 GMT-0300 (Brasilia Standard Time),Fri Aug 13 2021 08:37:01 GMT-0300 (Brasilia Standard Time)
"Bolsonaro nunca tem culpa de nada, os culpados pela inflação, segundo o presidente nazifascista, são governadores d… https://t.co/iSrrxnZXXt",ibaneis,,,1074421743102689300,GlaucoS41843642,,,3,5,Fri Aug 13 2021 09:26:57 GMT-0300 (Brasilia Standard Time),Fri Aug 13 2021 08:36:13 GMT-0300 (Brasilia Standard Time)
"@Metropoles O CHORO DOS FILHOS DO JOCKEY

Por Marcos Mendanha
As crianças choram e suas famílias, de moradores e tr… https://t.co/itT8Urb53X",ibaneis,,,880542455799697400,AnymsblakAbdias,,,0,0,Fri Aug 13 2021 09:26:57 GMT-0300 (Brasilia Standard Time),Fri Aug 13 2021 08:35:47 GMT-0300 (Brasilia Standard Time)
"Lançado na última terça-feira (10) pelo governador Ibaneis Rocha, o programa ""Cartão Gás"" segue com o cadastro aber… https://t.co/RmrOPIBnLk",ibaneis,,,1232977121808703500,RADARDF6,,,0,0,Fri Aug 13 2021 09:26:57 GMT-0300 (Brasilia Standard Time),Fri Aug 13 2021 08:27:25 GMT-0300 (Brasilia Standard Time)
"RT @neuzaortiz: O governador do Distrito Federal, IBANEIS ROCHA, pretende gastar R$ 26 milhões na construção do MUSEU DA BÍBLIA. Entretanto…",ibaneis,,,194645058,MariaLCAb,,,27,0,Fri Aug 13 2021 09:26:57 GMT-0300 (Brasilia Standard Time),Fri Aug 13 2021 08:22:05 GMT-0300 (Brasilia Standard Time)
"Eu não agradeço ao Ibaneis pela vacinação estar avançando no DF, eu agradeço aos profissionais de saúde, aos jornal… https://t.co/QGoAawycPw",ibaneis,,,1211467978463559700,RodrigoCabralBR,,,0,1,Fri Aug 13 2021 09:26:57 GMT-0300 (Brasilia Standard Time),Fri Aug 13 2021 08:12:51 GMT-0300 (Brasilia Standard Time)
RT @Bebebotao: Nem o secretário da cultura é a favor do Museu da Bíblia e Ibaneis insiste nesse projeto. É uma heresia gastar 26 milhões em…,ibaneis,,,140537719,mapavieira,,,2,0,Fri Aug 13 2021 09:26:57 GMT-0300 (Brasilia Standard Time),Fri Aug 13 2021 08:05:30 GMT-0300 (Brasilia Standard Time)
Nem o secretário da cultura é a favor do Museu da Bíblia e Ibaneis insiste nesse projeto. É uma heresia gastar 26 m… https://t.co/3eKaE4geNQ,ibaneis,,,16875360,Bebebotao,,,2,4,Fri Aug 13 2021 09:26:57 GMT-0300 (Brasilia Standard Time),Fri Aug 13 2021 07:59:01 GMT-0300 (Brasilia Standard Time)
"RT @biafribeiro: ibaneis não deixa o doria passar na sua frente não, vacina os adolescentes logo 🗣🗣🗣",ibaneis,,,1125450009355411500,helenabernardo_,,,5,0,Fri Aug 13 2021 09:26:57 GMT-0300 (Brasilia Standard Time),Fri Aug 13 2021 07:43:58 GMT-0300 (Brasilia Standard Time)
Agora o Caiado fica furioso com o Ibaneis! Brasília bateu todos os recordes de vacina nas últimas 24 horas. https://t.co/AU307V6oQj,ibaneis,,,299397588,Fabricio_Carva,,,0,0,Fri Aug 13 2021 09:26:57 GMT-0300 (Brasilia Standard Time),Fri Aug 13 2021 07:35:56 GMT-0300 (Brasilia Standard Time)
"@IbaneisOficial DE REPENTE, depois de 7 meses de vacinação o queridão resolveu ligar pro ranking nacional de vacina… https://t.co/JZudB6BqIp",ibaneis,,,442933226,SaintJackie_,,,0,12,Fri Aug 13 2021 09:26:57 GMT-0300 (Brasilia Standard Time),Fri Aug 13 2021 07:29:52 GMT-0300 (Brasilia Standard Time)
"RT @neuzaortiz: O governador do Distrito Federal, IBANEIS ROCHA, pretende gastar R$ 26 milhões na construção do MUSEU DA BÍBLIA. Entretanto…",ibaneis,,,1269391309489520600,Luiz_Antonio_S,,,27,0,Fri Aug 13 2021 09:26:57 GMT-0300 (Brasilia Standard Time),Fri Aug 13 2021 07:29:11 GMT-0300 (Brasilia Standard Time)
"RT @biafribeiro: ibaneis não deixa o doria passar na sua frente não, vacina os adolescentes logo 🗣🗣🗣",ibaneis,,,1017183694552010800,bixalocona1,,,5,0,Fri Aug 13 2021 09:26:57 GMT-0300 (Brasilia Standard Time),Fri Aug 13 2021 07:18:38 GMT-0300 (Brasilia Standard Time)
"RT @biafribeiro: ibaneis não deixa o doria passar na sua frente não, vacina os adolescentes logo 🗣🗣🗣",ibaneis,,,1011314635235086300,juhgalvaoo,,,5,0,Fri Aug 13 2021 09:26:57 GMT-0300 (Brasilia Standard Time),Fri Aug 13 2021 07:10:31 GMT-0300 (Brasilia Standard Time)
"Vai Ibaneis, libera os de 18+ pra vacinação logo pufavô",ibaneis,,,1206332209893916700,kamymoliv,,,0,3,Fri Aug 13 2021 09:26:57 GMT-0300 (Brasilia Standard Time),Fri Aug 13 2021 07:04:43 GMT-0300 (Brasilia Standard Time)
"RT @MPdeLimaa: A gente critica o governo Ibaneis quase sempre, mas precisamos celebrar as coisas boas: A nova iluminação pública do Cruzeir…",ibaneis,,,1404469839050297300,cruzeirozip,,,1,0,Fri Aug 13 2021 09:26:57 GMT-0300 (Brasilia Standard Time),Fri Aug 13 2021 06:26:56 GMT-0300 (Brasilia Standard Time)
"A gente critica o governo Ibaneis quase sempre, mas precisamos celebrar as coisas boas: A nova iluminação pública d… https://t.co/3H48ug4rLK",ibaneis,,,38935859,MPdeLimaa,,,1,1,Fri Aug 13 2021 09:26:57 GMT-0300 (Brasilia Standard Time),Fri Aug 13 2021 06:26:51 GMT-0300 (Brasilia Standard Time)
"RT @neuzaortiz: O governador do Distrito Federal, IBANEIS ROCHA, pretende gastar R$ 26 milhões na construção do MUSEU DA BÍBLIA. Entretanto…",ibaneis,,,278306424,anabernardi,,,27,0,Fri Aug 13 2021 09:26:57 GMT-0300 (Brasilia Standard Time),Fri Aug 13 2021 05:43:41 GMT-0300 (Brasilia Standard Time)
"RT @neuzaortiz: O governador do Distrito Federal, IBANEIS ROCHA, pretende gastar R$ 26 milhões na construção do MUSEU DA BÍBLIA. Entretanto…",ibaneis,,,2885471575,maryrepresenta1,,,27,0,Fri Aug 13 2021 09:26:57 GMT-0300 (Brasilia Standard Time),Fri Aug 13 2021 05:40:15 GMT-0300 (Brasilia Standard Time)
Primeira pauta da tentativa de reeleição do ibaneis bem aqui https://t.co/ya7mv8wZez,ibaneis,,,1109876520514916400,BeteRaaba,,,0,0,Fri Aug 13 2021 09:26:57 GMT-0300 (Brasilia Standard Time),Fri Aug 13 2021 05:22:37 GMT-0300 (Brasilia Standard Time)
"RT @zaupa_df: E é por isso que eu falo, nosso problema sempre foi a incompetência dos governos Bolsonaro e Ibaneis na compra de vacinas, lo…",ibaneis,,,66860195,GustavoLimaxD,,,2,0,Fri Aug 13 2021 09:26:57 GMT-0300 (Brasilia Standard Time),Fri Aug 13 2021 03:17:22 GMT-0300 (Brasilia Standard Time)
"RT @distopi: Puxa, essa foi bem rápida. A @neoenergiabsb conseguiu destruir a CEB automaticamente. Será que, além de Ibaneis, esse bolsonar…",ibaneis,,,715364459099856900,odio_nao,,,3,0,Fri Aug 13 2021 09:26:57 GMT-0300 (Brasilia Standard Time),Fri Aug 13 2021 02:57:39 GMT-0300 (Brasilia Standard Time)
"RT @neuzaortiz: O governador do Distrito Federal, IBANEIS ROCHA, pretende gastar R$ 26 milhões na construção do MUSEU DA BÍBLIA. Entretanto…",ibaneis,,,111169034,ajmpir,,,27,0,Fri Aug 13 2021 09:26:57 GMT-0300 (Brasilia Standard Time),Fri Aug 13 2021 01:59:57 GMT-0300 (Brasilia Standard Time)
@rak_zingara SIMMMM!!! Ibaneis é o suprassumo do que a gente NÃO quer na política,ibaneis,,,192946974,bellt0wer,,,0,0,Fri Aug 13 2021 09:26:57 GMT-0300 (Brasilia Standard Time),Fri Aug 13 2021 01:23:22 GMT-0300 (Brasilia Standard Time)
"ibaneis escroto enchendo a boca pra comemorar, aff  https://t.co/tXuVnNBUEc",ibaneis,,,192946974,bellt0wer,,,0,1,Fri Aug 13 2021 09:26:57 GMT-0300 (Brasilia Standard Time),Fri Aug 13 2021 01:18:49 GMT-0300 (Brasilia Standard Time)
"Certeza que o Ibaneis estocou vacina todo esse tempo pra poder vacinar todo mundo junto
Ibaneis é um ícone a frente do tempo dele",ibaneis,,,1144298886808383500,FadaYas,,,0,1,Fri Aug 13 2021 09:26:57 GMT-0300 (Brasilia Standard Time),Fri Aug 13 2021 00:36:54 GMT-0300 (Brasilia Standard Time)
"E é por isso que eu falo, nosso problema sempre foi a incompetência dos governos Bolsonaro e Ibaneis na compra de v… https://t.co/EtCQCxU2O3",ibaneis,,,81950500,zaupa_df,,,2,8,Fri Aug 13 2021 09:26:57 GMT-0300 (Brasilia Standard Time),Fri Aug 13 2021 00:16:59 GMT-0300 (Brasilia Standard Time)
"RT @neuzaortiz: O governador do Distrito Federal, IBANEIS ROCHA, pretende gastar R$ 26 milhões na construção do MUSEU DA BÍBLIA. Entretanto…",ibaneis,,,92645011,johanpdr,,,27,0,Fri Aug 13 2021 09:26:57 GMT-0300 (Brasilia Standard Time),Fri Aug 13 2021 00:08:53 GMT-0300 (Brasilia Standard Time)
"RT @neuzaortiz: O governador do Distrito Federal, IBANEIS ROCHA, pretende gastar R$ 26 milhões na construção do MUSEU DA BÍBLIA. Entretanto…",ibaneis,,,1252013433752559600,crazyfogo,,,27,0,Fri Aug 13 2021 09:26:57 GMT-0300 (Brasilia Standard Time),Fri Aug 13 2021 00:08:44 GMT-0300 (Brasilia Standard Time)
"@opiordegabriel mais um ENORME motivo pro Ibaneis dormir sorrindo do Caiado
https://t.co/SZ8LyXCK2T",ibaneis,,,726592665295401000,yan_lucax,,,0,0,Fri Aug 13 2021 09:26:57 GMT-0300 (Brasilia Standard Time),Fri Aug 13 2021 00:02:55 GMT-0300 (Brasilia Standard Time)
@cbnbrasilia Ibaneis é o principal responsável pela privatização da CEB. Que nenhum brasiliense se esqueça disso. C… https://t.co/IeD9KC61Rq,ibaneis,,,1310705435775729700,JooCarl06063915,,,0,0,Fri Aug 13 2021 09:26:57 GMT-0300 (Brasilia Standard Time),Thu Aug 12 2021 23:39:11 GMT-0300 (Brasilia Standard Time)
"RT @regissoliver: IMPORTANTE!!!!!!!!
Meu tio é secretário de governo e a informação que tá rodando em relação ao braço dos jovens que vacin…",ibaneis,,,935290714652659700,gabrielmlx,,,2,0,Fri Aug 13 2021 09:26:57 GMT-0300 (Brasilia Standard Time),Thu Aug 12 2021 23:32:25 GMT-0300 (Brasilia Standard Time)
"RT @neuzaortiz: O governador do Distrito Federal, IBANEIS ROCHA, pretende gastar R$ 26 milhões na construção do MUSEU DA BÍBLIA. Entretanto…",ibaneis,,,1299122553131335700,LRoger_Arq,,,27,0,Fri Aug 13 2021 09:26:57 GMT-0300 (Brasilia Standard Time),Thu Aug 12 2021 23:16:43 GMT-0300 (Brasilia Standard Time)
"RT @neuzaortiz: O governador do Distrito Federal, IBANEIS ROCHA, pretende gastar R$ 26 milhões na construção do MUSEU DA BÍBLIA. Entretanto…",ibaneis,,,1521551455,ZabucaRodrigo,,,27,0,Fri Aug 13 2021 09:26:57 GMT-0300 (Brasilia Standard Time),Thu Aug 12 2021 23:15:43 GMT-0300 (Brasilia Standard Time)
"Só por curiosidade, qual a avaliação de vocês do governo Ibaneis?",ibaneis,,,863812402680397800,rodrigodiasbsb,,,0,3,Fri Aug 13 2021 09:26:57 GMT-0300 (Brasilia Standard Time),Thu Aug 12 2021 23:14:52 GMT-0300 (Brasilia Standard Time)
Olha agora o ibaneis é obrigado a colocar o povo de +18 pra vacinar semana que vem pois eu não aguento mais ver todo mundo vacinado menos eu,ibaneis,,,1921783956,gis3lladr,,,0,1,Fri Aug 13 2021 09:26:57 GMT-0300 (Brasilia Standard Time),Thu Aug 12 2021 23:14:46 GMT-0300 (Brasilia Standard Time)
"RT @neuzaortiz: O governador do Distrito Federal, IBANEIS ROCHA, pretende gastar R$ 26 milhões na construção do MUSEU DA BÍBLIA. Entretanto…",ibaneis,,,131756203,anakonar,,,27,0,Fri Aug 13 2021 09:26:57 GMT-0300 (Brasilia Standard Time),Thu Aug 12 2021 23:08:43 GMT-0300 (Brasilia Standard Time)
RT @fa_albuquerq: bora ibaneis abra pra 18 anos agora msm 😭,ibaneis,,,2961151263,yasminrossini,,,18,0,Fri Aug 13 2021 09:26:57 GMT-0300 (Brasilia Standard Time),Thu Aug 12 2021 23:07:14 GMT-0300 (Brasilia Standard Time)
RT @frasesrodrigob: Ibaneis meteu o jato da vacinacao,ibaneis,,,256261668,vitorcuaio,,,1,0,Fri Aug 13 2021 09:26:57 GMT-0300 (Brasilia Standard Time),Thu Aug 12 2021 22:58:04 GMT-0300 (Brasilia Standard Time)
Ibaneis meteu o jato da vacinacao,ibaneis,,,1425201770733650000,frasesrodrigob,,,1,0,Fri Aug 13 2021 09:26:57 GMT-0300 (Brasilia Standard Time),Thu Aug 12 2021 22:57:20 GMT-0300 (Brasilia Standard Time)
"RT @leandrograss: O governador segue imóvel em relação ao caos da saúde pública. Se mexa, Ibaneis! Tome providências para melhorar a saúde.…",ibaneis,,,198181485,heliomdoyle,,,9,0,Fri Aug 13 2021 09:26:57 GMT-0300 (Brasilia Standard Time),Thu Aug 12 2021 22:56:38 GMT-0300 (Brasilia Standard Time)
"RT @neuzaortiz: O governador do Distrito Federal, IBANEIS ROCHA, pretende gastar R$ 26 milhões na construção do MUSEU DA BÍBLIA. Entretanto…",ibaneis,,,129901863,lucianogodoy1,,,27,0,Fri Aug 13 2021 09:26:57 GMT-0300 (Brasilia Standard Time),Thu Aug 12 2021 22:55:15 GMT-0300 (Brasilia Standard Time)
@oarthureduardo @Diegocomenta hoje ibaneis vacinou 20+,ibaneis,,,1193257980092960800,_ananoronha,,,0,1,Fri Aug 13 2021 09:26:57 GMT-0300 (Brasilia Standard Time),Thu Aug 12 2021 22:44:20 GMT-0300 (Brasilia Standard Time)
"RT @regissoliver: IMPORTANTE!!!!!!!!
Meu tio é secretário de governo e a informação que tá rodando em relação ao braço dos jovens que vacin…",ibaneis,,,2771420098,brunasousa___,,,2,0,Fri Aug 13 2021 09:26:57 GMT-0300 (Brasilia Standard Time),Thu Aug 12 2021 22:36:51 GMT-0300 (Brasilia Standard Time)
"RT @neuzaortiz: O governador do Distrito Federal, IBANEIS ROCHA, pretende gastar R$ 26 milhões na construção do MUSEU DA BÍBLIA. Entretanto…",ibaneis,,,1134979858772176900,cynthiafontesl2,,,27,0,Fri Aug 13 2021 09:26:57 GMT-0300 (Brasilia Standard Time),Thu Aug 12 2021 22:34:53 GMT-0300 (Brasilia Standard Time)
RT @carolrodrigc: mais uma vez o ibaneis agradecendo aos voluntários. ver o trabalho incrível que os voluntários tem feito sendo reconhecid…,ibaneis,,,2772725163,abrantesluizz,,,1,0,Fri Aug 13 2021 09:26:57 GMT-0300 (Brasilia Standard Time),Thu Aug 12 2021 22:22:02 GMT-0300 (Brasilia Standard Time)
Vlw ibaneis tmj https://t.co/96ceqKmHsM,ibaneis,,,1231019345842667500,euodeioaoii,,,0,0,Fri Aug 13 2021 09:26:57 GMT-0300 (Brasilia Standard Time),Thu Aug 12 2021 22:17:09 GMT-0300 (Brasilia Standard Time)
"RT @neuzaortiz: O governador do Distrito Federal, IBANEIS ROCHA, pretende gastar R$ 26 milhões na construção do MUSEU DA BÍBLIA. Entretanto…",ibaneis,,,1300216533743030300,Kamale1971,,,27,0,Fri Aug 13 2021 09:26:57 GMT-0300 (Brasilia Standard Time),Thu Aug 12 2021 22:16:40 GMT-0300 (Brasilia Standard Time)
"Empresas no DF já podem se cadastrar para o Programa Cartão Gás

#CartãoGás #ValeGás #VulnerabilidadeSocial #BRB… https://t.co/WEIJPqNNdy",ibaneis,,,25091081,kleberkarpov,,,0,0,Fri Aug 13 2021 09:26:57 GMT-0300 (Brasilia Standard Time),Thu Aug 12 2021 22:13:44 GMT-0300 (Brasilia Standard Time)
mais uma vez o ibaneis agradecendo aos voluntários. ver o trabalho incrível que os voluntários tem feito sendo reco… https://t.co/KKkcyIMc8u,ibaneis,,,1406471874,carolrodrigc,,,1,5,Fri Aug 13 2021 09:26:57 GMT-0300 (Brasilia Standard Time),Thu Aug 12 2021 22:11:48 GMT-0300 (Brasilia Standard Time)
já estão vacinando o pessoal da casa dos 20 aqui em bsb aí mds falta tão pouco pra mim acelere ibaneis,ibaneis,,,1146950221374656500,ahabibiis,,,0,0,Fri Aug 13 2021 09:26:57 GMT-0300 (Brasilia Standard Time),Thu Aug 12 2021 22:11:10 GMT-0300 (Brasilia Standard Time)
"RT @neuzaortiz: O governador do Distrito Federal, IBANEIS ROCHA, pretende gastar R$ 26 milhões na construção do MUSEU DA BÍBLIA. Entretanto…",ibaneis,,,2848333876,coelhovanderle1,,,27,0,Fri Aug 13 2021 09:26:57 GMT-0300 (Brasilia Standard Time),Thu Aug 12 2021 22:11:01 GMT-0300 (Brasilia Standard Time)
RT @PedroJos32: Porra Ibaneis abre logo pra 19 anos vacinar🥺🥺🥺,ibaneis,,,787109220932091900,_liimmaa,,,20,0,Fri Aug 13 2021 09:26:57 GMT-0300 (Brasilia Standard Time),Thu Aug 12 2021 22:08:39 GMT-0300 (Brasilia Standard Time)
"RT @sabilisacrf: Se o Ibaneis soubesse que vacinação dos jovens de 20 anos seria do jeito que tá sendo, ele tinha largado de mão a vacinaçã…",ibaneis,,,1663633164,_erikaan,,,3,0,Fri Aug 13 2021 09:26:57 GMT-0300 (Brasilia Standard Time),Thu Aug 12 2021 22:06:56 GMT-0300 (Brasilia Standard Time)
RT @leandrograss: Nem o secretário da cultura é a favor do Museu da Bíblia e Ibaneis insiste nesse projeto. É uma heresia gastar tanto em a…,ibaneis,,,311027708,Pedro_cnm,,,28,0,Fri Aug 13 2021 09:26:57 GMT-0300 (Brasilia Standard Time),Thu Aug 12 2021 21:56:29 GMT-0300 (Brasilia Standard Time)
RT @leandrograss: Nem o secretário da cultura é a favor do Museu da Bíblia e Ibaneis insiste nesse projeto. É uma heresia gastar tanto em a…,ibaneis,,,935913421417144300,opolles,,,28,0,Fri Aug 13 2021 09:26:57 GMT-0300 (Brasilia Standard Time),Thu Aug 12 2021 21:47:59 GMT-0300 (Brasilia Standard Time)
"@maxmacieldf se o Ibaneis não quis entrar na rixa de vacina com os outros governadores, oo povo quer!!!!! Duvido gl… https://t.co/aDqJ7DjTRT",ibaneis,,,266121944,barrossbeatriz,,,0,5,Fri Aug 13 2021 09:26:57 GMT-0300 (Brasilia Standard Time),Thu Aug 12 2021 21:46:21 GMT-0300 (Brasilia Standard Time)
tô sonhando com o dia que o ibaneis vai liberar a vacina pra +17 🥺,ibaneis,,,981700501170458600,Larislps,,,0,2,Fri Aug 13 2021 09:26:57 GMT-0300 (Brasilia Standard Time),Thu Aug 12 2021 21:46:16 GMT-0300 (Brasilia Standard Time)
@opiordegabriel CARALHO KKKKKK ENTÃO O IBANEIS DEVE TÁ CHORANDO DE RIR MESMO DO CAI*DO,ibaneis,,,726592665295401000,yan_lucax,,,0,1,Fri Aug 13 2021 09:26:57 GMT-0300 (Brasilia Standard Time),Thu Aug 12 2021 21:41:45 GMT-0300 (Brasilia Standard Time)
"To parecendo até partidário do Ibaneis KKKKK mas pô, a cezar o que é de cezar, meteu-lhe a agulhada em geral memo e é isto",ibaneis,,,1150592419190190100,phil99_,,,0,1,Fri Aug 13 2021 09:26:57 GMT-0300 (Brasilia Standard Time),Thu Aug 12 2021 21:41:25 GMT-0300 (Brasilia Standard Time)
RT @raemmundo: VAI SE FUDE BOLSONARO E IBANEIS 🐊🐊🐊🐊🐊🐊🐊🐊🐊 https://t.co/lrVX8pJMn9,ibaneis,,,1089600677456891900,_anaavaz,,,2,0,Fri Aug 13 2021 09:26:57 GMT-0300 (Brasilia Standard Time),Thu Aug 12 2021 21:36:28 GMT-0300 (Brasilia Standard Time)
14% do df vacinou no goiás 👏🏽 ibaneis canalha genocida https://t.co/uyHJGkzA4p,ibaneis,,,2756717138,lovaticstrouxie,,,0,6,Fri Aug 13 2021 09:26:57 GMT-0300 (Brasilia Standard Time),Thu Aug 12 2021 21:36:24 GMT-0300 (Brasilia Standard Time)
"IMPORTANTE!!!!!!!!
Meu tio é secretário de governo e a informação que tá rodando em relação ao braço dos jovens que… https://t.co/kpslhnW27h",ibaneis,,,2314383698,regissoliver,,,2,9,Fri Aug 13 2021 09:26:57 GMT-0300 (Brasilia Standard Time),Thu Aug 12 2021 21:34:08 GMT-0300 (Brasilia Standard Time)
@ibaneix @ComentCrakNeto tmnc ibaneis eu tava achando que era sério kkkkkkk,ibaneis,,,839190409217720300,_dudarrc,,,0,0,Fri Aug 13 2021 09:26:57 GMT-0300 (Brasilia Standard Time),Thu Aug 12 2021 21:32:16 GMT-0300 (Brasilia Standard Time)
"RT @neuzaortiz: O governador do Distrito Federal, IBANEIS ROCHA, pretende gastar R$ 26 milhões na construção do MUSEU DA BÍBLIA. Entretanto…",ibaneis,,,1245350556014649300,SeArlindo,,,27,0,Fri Aug 13 2021 09:26:57 GMT-0300 (Brasilia Standard Time),Thu Aug 12 2021 21:31:33 GMT-0300 (Brasilia Standard Time)
@joyycefreitas Vamo ficar vivo pra tirar o salnorabo do poder!!! (Ibaneis eu já não crio esperança),ibaneis,,,71090100,11deoutubro_,,,0,0,Fri Aug 13 2021 09:26:57 GMT-0300 (Brasilia Standard Time),Thu Aug 12 2021 21:26:13 GMT-0300 (Brasilia Standard Time)
RT @PedroJos32: Porra Ibaneis abre logo pra 19 anos vacinar🥺🥺🥺,ibaneis,,,887066199049285600,virnacb_,,,20,0,Fri Aug 13 2021 09:26:57 GMT-0300 (Brasilia Standard Time),Thu Aug 12 2021 21:24:51 GMT-0300 (Brasilia Standard Time)
RT @fa_albuquerq: bora ibaneis abra pra 18 anos agora msm 😭,ibaneis,,,4836363837,gi_marangoni_,,,18,0,Fri Aug 13 2021 09:26:57 GMT-0300 (Brasilia Standard Time),Thu Aug 12 2021 21:24:24 GMT-0300 (Brasilia Standard Time)
RT @clarammalmeida: o silêncio do ibaneis sobre vacinar a galera de 18 e 19 é ensurdecedor,ibaneis,,,1196815997111537700,nriptjde,,,3,0,Fri Aug 13 2021 09:26:57 GMT-0300 (Brasilia Standard Time),Thu Aug 12 2021 21:23:32 GMT-0300 (Brasilia Standard Time)
RT @leandrograss: Nem o secretário da cultura é a favor do Museu da Bíblia e Ibaneis insiste nesse projeto. É uma heresia gastar tanto em a…,ibaneis,,,1102001720165654500,soueuadiana,,,28,0,Fri Aug 13 2021 09:26:57 GMT-0300 (Brasilia Standard Time),Thu Aug 12 2021 21:23:28 GMT-0300 (Brasilia Standard Time)
@gabideoliveiram @correio ibaneis veja isso,ibaneis,,,1092090136974839800,l_ucasalves,,,0,1,Fri Aug 13 2021 09:26:57 GMT-0300 (Brasilia Standard Time),Thu Aug 12 2021 21:20:06 GMT-0300 (Brasilia Standard Time)
@BrunnoMeloCBN Parabéns para nós que xingamos o Ibaneis para acabar com o agendamento.,ibaneis,,,1211467978463559700,RodrigoCabralBR,,,0,33,Fri Aug 13 2021 09:26:57 GMT-0300 (Brasilia Standard Time),Thu Aug 12 2021 21:14:59 GMT-0300 (Brasilia Standard Time)
"RT @neuzaortiz: O governador do Distrito Federal, IBANEIS ROCHA, pretende gastar R$ 26 milhões na construção do MUSEU DA BÍBLIA. Entretanto…",ibaneis,,,925147721530597400,ReginaldoDosRe9,,,27,0,Fri Aug 13 2021 09:26:57 GMT-0300 (Brasilia Standard Time),Thu Aug 12 2021 21:11:03 GMT-0300 (Brasilia Standard Time)
"RT @neuzaortiz: O governador do Distrito Federal, IBANEIS ROCHA, pretende gastar R$ 26 milhões na construção do MUSEU DA BÍBLIA. Entretanto…",ibaneis,,,712763531410718700,luizpaulotexugo,,,27,0,Fri Aug 13 2021 09:26:57 GMT-0300 (Brasilia Standard Time),Thu Aug 12 2021 21:04:17 GMT-0300 (Brasilia Standard Time)
"Eu só não postei pq já me vacinei há um tempo por conta de comorbidade, aí fiquei com medo de me perguntarem como q… https://t.co/wQkJnEglc5",ibaneis,,,800824316770316300,ingridsilvs_,,,0,4,Fri Aug 13 2021 09:26:57 GMT-0300 (Brasilia Standard Time),Thu Aug 12 2021 20:58:09 GMT-0300 (Brasilia Standard Time)
RT @sarahmarcelos: Eu tô chorando de emoção de como anda a organização das vacinas e toda criatividade das equipes pra chamar atenção e aum…,ibaneis,,,1169611739132059600,Yngridas,,,5,0,Fri Aug 13 2021 09:26:57 GMT-0300 (Brasilia Standard Time),Thu Aug 12 2021 20:49:58 GMT-0300 (Brasilia Standard Time)
"RT @neuzaortiz: O governador do Distrito Federal, IBANEIS ROCHA, pretende gastar R$ 26 milhões na construção do MUSEU DA BÍBLIA. Entretanto…",ibaneis,,,234503399,RoGinez,,,27,0,Fri Aug 13 2021 09:26:57 GMT-0300 (Brasilia Standard Time),Thu Aug 12 2021 20:48:42 GMT-0300 (Brasilia Standard Time)
