text,query,country,city,userId,username,quote_count,reply_count,retweet_count,favorite_count,timestamp,createdAt
"Como o gov Paulo Câmara não toma providências a fim de conter a corrida da morte nas estradas, à precariedade das r… https://t.co/JWBlQ1HCW4","""paulo câmara""",,,1375624143245283300,JosBenignoDaSi1,,,0,0,Thu Aug 19 2021 20:16:43 GMT-0300 (Brasilia Standard Time),Thu Aug 19 2021 19:45:08 GMT-0300 (Brasilia Standard Time)
"RT @mzconteudo: 👉Dezessete meses depois, deputados aprovam lei que proíbe despejos na pandemia em Pernambuco

✒️De autoria das codeputadas…","""paulo câmara""",,,221180823,smbuarque,,,4,0,Thu Aug 19 2021 20:16:43 GMT-0300 (Brasilia Standard Time),Thu Aug 19 2021 19:18:07 GMT-0300 (Brasilia Standard Time)
Deputada Roberta Arraes e governador Paulo Câmara oficializam cedência do prédio onde funcionará o Hospital do Cânc… https://t.co/QlwkX32muu,"""paulo câmara""",,,53175849,EdmarLyra,,,0,0,Thu Aug 19 2021 20:16:43 GMT-0300 (Brasilia Standard Time),Thu Aug 19 2021 18:49:30 GMT-0300 (Brasilia Standard Time)
Governador Paulo Câmara PSB PERNAMBUCO. Inútil https://t.co/rX6kdNbYlv,"""paulo câmara""",,,1284618852630962200,CarlosR68909486,,,0,0,Thu Aug 19 2021 20:16:43 GMT-0300 (Brasilia Standard Time),Thu Aug 19 2021 18:41:22 GMT-0300 (Brasilia Standard Time)
"nada como um brt entupido pra alinhas os chakras no fim do dia 
obrigado paulo câmara pelos mimos 🥰🥰❤️❤️❤️👊🏻👊🏻👊🏻😍😍😍😍👍🏻👍🏻👍🏻","""paulo câmara""",,,934393261992697900,daniloveig,,,0,2,Thu Aug 19 2021 20:16:43 GMT-0300 (Brasilia Standard Time),Thu Aug 19 2021 18:36:13 GMT-0300 (Brasilia Standard Time)
O motivo de eu ter vendido minha moto foi por causa dos ipva's atrasados q eu não tava podendo pagar. Eu já tinha m… https://t.co/ldmTWiERHS,"""paulo câmara""",,,54728447,DarthHeyder,,,0,1,Thu Aug 19 2021 20:16:43 GMT-0300 (Brasilia Standard Time),Thu Aug 19 2021 18:17:43 GMT-0300 (Brasilia Standard Time)
"RT @cavalcanti_jo: Agora que o mais difícil passou, nossa nossa PL segue para sanção do Governador Paulo Câmara, não podemos deixar para de…","""paulo câmara""",,,204146777,Tomaz_ribeiro,,,4,0,Thu Aug 19 2021 20:16:43 GMT-0300 (Brasilia Standard Time),Thu Aug 19 2021 18:14:53 GMT-0300 (Brasilia Standard Time)
"RT @CentralEleicoes: 🍝🗳️ O ex-Presidente Lula jantou hoje no palácio Campos das Princesas, em Recife, com o governador Paulo Câmara e prefe…","""paulo câmara""",,,1087882294931656700,zenetolacerda,,,32,0,Thu Aug 19 2021 20:16:43 GMT-0300 (Brasilia Standard Time),Thu Aug 19 2021 18:14:36 GMT-0300 (Brasilia Standard Time)
"RT @mzconteudo: 👉Dezessete meses depois, deputados aprovam lei que proíbe despejos na pandemia em Pernambuco

✒️De autoria das codeputadas…","""paulo câmara""",,,56354687,guscherubina,,,4,0,Thu Aug 19 2021 20:16:43 GMT-0300 (Brasilia Standard Time),Thu Aug 19 2021 18:13:43 GMT-0300 (Brasilia Standard Time)
"RT @jc_pe: Mendonça Filho diz que o PSB, de Paulo Câmara, ''já deu o que tinha de dar'' em Pernambuco

https://t.co/bwyLzhaWeG","""paulo câmara""",,,1057705832199176200,Maroca54303142,,,2,0,Thu Aug 19 2021 20:16:43 GMT-0300 (Brasilia Standard Time),Thu Aug 19 2021 18:12:56 GMT-0300 (Brasilia Standard Time)
"RT @mzconteudo: 👉Dezessete meses depois, deputados aprovam lei que proíbe despejos na pandemia em Pernambuco

✒️De autoria das codeputadas…","""paulo câmara""",,,88472965,kleber_nunes,,,4,0,Thu Aug 19 2021 20:16:43 GMT-0300 (Brasilia Standard Time),Thu Aug 19 2021 18:09:22 GMT-0300 (Brasilia Standard Time)
"A idéia das pulserinhas pra Fernando de Noronha (cinza para o morador, verde para o ambientalista correto, preto pa… https://t.co/GXlCQS27cY","""paulo câmara""",,,36344483,claudiocanuto,,,0,0,Thu Aug 19 2021 20:16:43 GMT-0300 (Brasilia Standard Time),Thu Aug 19 2021 18:01:38 GMT-0300 (Brasilia Standard Time)
"RT @mzconteudo: 👉Dezessete meses depois, deputados aprovam lei que proíbe despejos na pandemia em Pernambuco

✒️De autoria das codeputadas…","""paulo câmara""",,,55066053,MairaColorada,,,4,0,Thu Aug 19 2021 20:16:43 GMT-0300 (Brasilia Standard Time),Thu Aug 19 2021 17:59:38 GMT-0300 (Brasilia Standard Time)
"👉Dezessete meses depois, deputados aprovam lei que proíbe despejos na pandemia em Pernambuco

✒️De autoria das code… https://t.co/YJ2snVLnKf","""paulo câmara""",,,2701260192,mzconteudo,,,4,6,Thu Aug 19 2021 20:16:43 GMT-0300 (Brasilia Standard Time),Thu Aug 19 2021 17:57:40 GMT-0300 (Brasilia Standard Time)
"RT @antonio85684615: Foto de antonio da costa toinho SR GOVERNADOR PAULO CÂMARA, O SR EMBOLSOU QUANTO DO GOVERNO CHINÊS POR ESSE ACORDO, DI…","""paulo câmara""",,,978384746819522600,antonio85684615,,,1,0,Thu Aug 19 2021 20:16:43 GMT-0300 (Brasilia Standard Time),Thu Aug 19 2021 17:48:29 GMT-0300 (Brasilia Standard Time)
"Foto de antonio da costa toinho SR GOVERNADOR PAULO CÂMARA, O SR EMBOLSOU QUANTO DO GOVERNO CHINÊS POR ESSE ACORDO,… https://t.co/vvztN04sI8","""paulo câmara""",,,978384746819522600,antonio85684615,,,1,1,Thu Aug 19 2021 20:16:43 GMT-0300 (Brasilia Standard Time),Thu Aug 19 2021 17:48:17 GMT-0300 (Brasilia Standard Time)
Paulo Câmara anuncia ampliação de anistia de dívidas para motos até 162 cilindradas https://t.co/dMPznSWXCQ,"""paulo câmara""",,,3024436931,p_prefeitura,,,0,0,Thu Aug 19 2021 20:16:43 GMT-0300 (Brasilia Standard Time),Thu Aug 19 2021 17:28:46 GMT-0300 (Brasilia Standard Time)
@BolsonaroSP Aqui em Pernambuco o senhor Paulo Câmara também AUMENTOU! Pernambuco DESEJA e a partir de 2023 vai ter… https://t.co/PzyfoIDZUS,"""paulo câmara""",,,50487449,kildarejohnson,,,0,0,Thu Aug 19 2021 20:16:43 GMT-0300 (Brasilia Standard Time),Thu Aug 19 2021 17:14:57 GMT-0300 (Brasilia Standard Time)
"RT @jc_pe: Mendonça Filho diz que o PSB, de Paulo Câmara, ''já deu o que tinha de dar'' em Pernambuco

https://t.co/bwyLzhaWeG","""paulo câmara""",,,929022718665740300,WendelTorccoral,,,2,0,Thu Aug 19 2021 20:16:43 GMT-0300 (Brasilia Standard Time),Thu Aug 19 2021 17:10:09 GMT-0300 (Brasilia Standard Time)
@eloizescfc 130 real pra paulo câmara,"""paulo câmara""",,,910972319752912900,teozin13,,,0,0,Thu Aug 19 2021 20:16:43 GMT-0300 (Brasilia Standard Time),Thu Aug 19 2021 17:07:54 GMT-0300 (Brasilia Standard Time)
Governo comunista chinês investe no setor de comunicação do governo socialista Paulo Câmara - Blog Trend https://t.co/7dXjMcEmkA,"""paulo câmara""",,,50506009,Pedriell,,,0,1,Thu Aug 19 2021 20:16:43 GMT-0300 (Brasilia Standard Time),Thu Aug 19 2021 16:52:07 GMT-0300 (Brasilia Standard Time)
Paulo Câmara anuncia ampliação de anistia de dívidas para motos até 162 cilindradas https://t.co/1nLCCektkO,"""paulo câmara""",,,72960566,blogmarioflavio,,,0,0,Thu Aug 19 2021 20:16:43 GMT-0300 (Brasilia Standard Time),Thu Aug 19 2021 16:09:18 GMT-0300 (Brasilia Standard Time)
Paulo Câmara anuncia ampliação de anistia de dívidas para motos até 162 cilindradas https://t.co/VfeKOYxCnZ,"""paulo câmara""",,,53025607,Nill_Junior,,,0,0,Thu Aug 19 2021 20:16:43 GMT-0300 (Brasilia Standard Time),Thu Aug 19 2021 15:48:01 GMT-0300 (Brasilia Standard Time)
"RT @joaopaulo_pcdob: Vitória! Finalmente o projeto que proíbe despejos durante a pandemia foi aprovado, depois de longos 17 meses e muita d…","""paulo câmara""",,,1071832320242536400,ZoandoOWhatsapp,,,1,0,Thu Aug 19 2021 20:16:43 GMT-0300 (Brasilia Standard Time),Thu Aug 19 2021 15:44:04 GMT-0300 (Brasilia Standard Time)
"RT @jc_pe: Cena Política | @igorpmaciel | Secretária na gestão Paulo Câmara, ela entrou no governo por indicação de Geraldo Julio, está int…","""paulo câmara""",,,55263106,igorpmaciel,,,1,0,Thu Aug 19 2021 20:16:43 GMT-0300 (Brasilia Standard Time),Thu Aug 19 2021 15:26:35 GMT-0300 (Brasilia Standard Time)
"Cena Política | @igorpmaciel | Secretária na gestão Paulo Câmara, ela entrou no governo por indicação de Geraldo Ju… https://t.co/L812qtqyBy","""paulo câmara""",,,245896728,jc_pe,,,1,5,Thu Aug 19 2021 20:16:43 GMT-0300 (Brasilia Standard Time),Thu Aug 19 2021 15:25:49 GMT-0300 (Brasilia Standard Time)
"Mendonça Filho diz que o PSB, de Paulo Câmara, ''já deu o que tinha de dar'' em Pernambuco

https://t.co/bwyLzhaWeG","""paulo câmara""",,,245896728,jc_pe,,,2,33,Thu Aug 19 2021 20:16:43 GMT-0300 (Brasilia Standard Time),Thu Aug 19 2021 15:21:13 GMT-0300 (Brasilia Standard Time)
"Em Araripina, Paulo Câmara anuncia ampliação de anistia de dívidas para motos até 162 cilindradas https://t.co/BizAI3Hbxf","""paulo câmara""",,,53175849,EdmarLyra,,,0,0,Thu Aug 19 2021 20:16:43 GMT-0300 (Brasilia Standard Time),Thu Aug 19 2021 15:14:19 GMT-0300 (Brasilia Standard Time)
"RT @NellyYumi: Governadores q assinaram apoio ao STF: Rui Costa, Flávio Dino, Paulo Câmara, João Doria, Eduardo Leite, Camilo Santana, João…","""paulo câmara""",,,1029850932677361700,Julioslima2,,,836,0,Thu Aug 19 2021 20:16:43 GMT-0300 (Brasilia Standard Time),Thu Aug 19 2021 15:08:45 GMT-0300 (Brasilia Standard Time)
"RT @cavalcanti_jo: Agora que o mais difícil passou, nossa nossa PL segue para sanção do Governador Paulo Câmara, não podemos deixar para de…","""paulo câmara""",,,2800888529,carlosmouramelo,,,4,0,Thu Aug 19 2021 20:16:43 GMT-0300 (Brasilia Standard Time),Thu Aug 19 2021 14:14:46 GMT-0300 (Brasilia Standard Time)
"RT @cavalcanti_jo: Agora que o mais difícil passou, nossa nossa PL segue para sanção do Governador Paulo Câmara, não podemos deixar para de…","""paulo câmara""",,,168256817,malusolano,,,4,0,Thu Aug 19 2021 20:16:43 GMT-0300 (Brasilia Standard Time),Thu Aug 19 2021 14:12:23 GMT-0300 (Brasilia Standard Time)
"E ainda tem quem acredite que Geraldo Julio não é o candidato do PSB à sucessão de Paulo Câmara. Piada, né? Dizer q… https://t.co/sUAokouabI","""paulo câmara""",,,179655979,NoeliaBritoBlog,,,0,14,Thu Aug 19 2021 20:16:43 GMT-0300 (Brasilia Standard Time),Thu Aug 19 2021 14:06:42 GMT-0300 (Brasilia Standard Time)
Com Paulo Câmara como vice? 🙆🙄 https://t.co/uDvJ6VDziw,"""paulo câmara""",Brazil,"Garanhuns, Brasil",45470641,emmaaraujo_,,,0,3,Thu Aug 19 2021 20:16:43 GMT-0300 (Brasilia Standard Time),Thu Aug 19 2021 14:05:11 GMT-0300 (Brasilia Standard Time)
"Vitória! Finalmente o projeto que proíbe despejos durante a pandemia foi aprovado, depois de longos 17 meses e muit… https://t.co/pnrlrG9mG0","""paulo câmara""",,,109657263,joaopaulo_pcdob,,,1,18,Thu Aug 19 2021 20:16:43 GMT-0300 (Brasilia Standard Time),Thu Aug 19 2021 13:57:37 GMT-0300 (Brasilia Standard Time)
que calor do cão eh esse nessa cidade??? Eh o capeta do Paulo câmara q vem aqui https://t.co/Ex3n22auuB,"""paulo câmara""",,,1172211944000016400,natxilocio,,,0,1,Thu Aug 19 2021 20:16:43 GMT-0300 (Brasilia Standard Time),Thu Aug 19 2021 13:39:58 GMT-0300 (Brasilia Standard Time)
"👀🟠 A OPOSIÇÃO AO GOVERNADOR DE ESQUERDA DE PERNAMBUCO PAULO CAMARA VENCE DISPARADA A VAGA AO SENADO EM 2022.
Lei no… https://t.co/c07Je4gLn1","""paulo câmara""",Brazil,"Recife, Brazil",1193431503264473000,CarlosC31205583,,,0,2,Thu Aug 19 2021 20:16:43 GMT-0300 (Brasilia Standard Time),Thu Aug 19 2021 13:20:48 GMT-0300 (Brasilia Standard Time)
Eu ouvindo o Paulo Câmara falar mais uma mentira. https://t.co/9a8T1r9e3e,"""paulo câmara""",,,1365793064497909800,jeanroxha,,,0,0,Thu Aug 19 2021 20:16:43 GMT-0300 (Brasilia Standard Time),Thu Aug 19 2021 13:07:55 GMT-0300 (Brasilia Standard Time)
"O deputado Robinho se indignou com a avaliação do governador Rui Costa, de que o seu colega de Casa, Paulo Câmara d… https://t.co/lgHpmM9XPp","""paulo câmara""",,,1376655362300985300,OffNewsNoticias,,,0,0,Thu Aug 19 2021 20:16:43 GMT-0300 (Brasilia Standard Time),Thu Aug 19 2021 12:59:15 GMT-0300 (Brasilia Standard Time)
"RT @AninhaBolsonaro: Segue abaixo os governadores comunistas que emitiram uma nota de solidariedade pro STF:

Rui Costa                 PT/…","""paulo câmara""",,,1417337347260178400,JohnsonAzevedo7,,,15,0,Thu Aug 19 2021 20:16:43 GMT-0300 (Brasilia Standard Time),Thu Aug 19 2021 12:54:36 GMT-0300 (Brasilia Standard Time)
"O presidente da #ALBA, Adolfo Menezes, prometeu questionar a #Sefaz da Bahia acerca das alegações do deputado estad… https://t.co/kOCFwHrAI7","""paulo câmara""",,,1376655362300985300,OffNewsNoticias,,,0,0,Thu Aug 19 2021 20:16:43 GMT-0300 (Brasilia Standard Time),Thu Aug 19 2021 12:54:14 GMT-0300 (Brasilia Standard Time)
"O dep. @DepSandroRegis repudiou nesta quinta a declaração, em tom de ameaça, dada pelo governador Rui Costa contra… https://t.co/rkgGkc6zYW","""paulo câmara""",,,1376655362300985300,OffNewsNoticias,,,0,0,Thu Aug 19 2021 20:16:43 GMT-0300 (Brasilia Standard Time),Thu Aug 19 2021 12:47:37 GMT-0300 (Brasilia Standard Time)
Será que Paulo Câmara vai tentar senado? Será que Marília Arraes vai tentar governo (e pelo PT)? Quem será que o PS… https://t.co/ukiy1B6JGX,"""paulo câmara""",,,1289621687617691600,arrobaLK,,,0,1,Thu Aug 19 2021 20:16:43 GMT-0300 (Brasilia Standard Time),Thu Aug 19 2021 12:32:23 GMT-0300 (Brasilia Standard Time)
"Agora que o mais difícil passou, nossa nossa PL segue para sanção do Governador Paulo Câmara, não podemos deixar pa… https://t.co/p8761c8d8k","""paulo câmara""",,,1159415630740828200,cavalcanti_jo,,,4,21,Thu Aug 19 2021 20:16:43 GMT-0300 (Brasilia Standard Time),Thu Aug 19 2021 11:58:40 GMT-0300 (Brasilia Standard Time)
"@senadorhumberto O único desserviço ao estado é essa apoio acrítico ao governo do Paulo Câmara, que continua castig… https://t.co/aXDnMarh0k","""paulo câmara""",,,180459738,yochanbeck,,,0,0,Thu Aug 19 2021 20:16:43 GMT-0300 (Brasilia Standard Time),Thu Aug 19 2021 11:57:21 GMT-0300 (Brasilia Standard Time)
"Ta aí o governo Desse Paulo Câmara
 https://t.co/OlTz55EaGK","""paulo câmara""",Brazil,"Recife, Brazil",2533500863,jaccoletti,,,0,0,Thu Aug 19 2021 20:16:43 GMT-0300 (Brasilia Standard Time),Thu Aug 19 2021 11:43:36 GMT-0300 (Brasilia Standard Time)
"Agenda hoje no Sertão do Araripe, acompanhando o governador Paulo Câmara em ações importantes para o desenvolviment… https://t.co/IWCeMW44eT","""paulo câmara""",Brazil,"Araripina, Brasil",1311027268844744700,DepEriberto,,,0,0,Thu Aug 19 2021 20:16:43 GMT-0300 (Brasilia Standard Time),Thu Aug 19 2021 11:12:02 GMT-0300 (Brasilia Standard Time)
"Cogitado para o Senado pela Frente Popular, André de Paula diz que retira seu nome do páreo “na hora” que Paulo Câm… https://t.co/hW02LEvzXe","""paulo câmara""",,,3024436931,p_prefeitura,,,0,0,Thu Aug 19 2021 20:16:43 GMT-0300 (Brasilia Standard Time),Thu Aug 19 2021 10:50:39 GMT-0300 (Brasilia Standard Time)
@ricardoayperes @CentralEleicoes Marília não vai tolerar pedir voto pra Paulo câmara senador kkkkkk,"""paulo câmara""",,,1034194052323979300,cleecioj,,,0,0,Thu Aug 19 2021 20:16:43 GMT-0300 (Brasilia Standard Time),Thu Aug 19 2021 10:50:26 GMT-0300 (Brasilia Standard Time)
RT @OAntagoniza11: Dep Paulo Câmara prova p/população baiana de quem é a culpa do preço da gasolina no estado e desmente agências de checag…,"""paulo câmara""",,,418075393,rbs7batista,,,54,0,Thu Aug 19 2021 20:16:43 GMT-0300 (Brasilia Standard Time),Thu Aug 19 2021 10:49:16 GMT-0300 (Brasilia Standard Time)
"@troublelara @CentralEleicoes Tem o José Neto também

https://t.co/KLy3sXw2M5","""paulo câmara""",,,1001584233759100900,batataliberal,,,0,0,Thu Aug 19 2021 20:16:43 GMT-0300 (Brasilia Standard Time),Thu Aug 19 2021 10:42:12 GMT-0300 (Brasilia Standard Time)
André de Paula afirma que retira candidatura se Paulo Câmara decidir entrar na disputa pelo senado https://t.co/SPfOUJoVVF,"""paulo câmara""",,,72960566,blogmarioflavio,,,0,1,Thu Aug 19 2021 20:16:43 GMT-0300 (Brasilia Standard Time),Thu Aug 19 2021 10:41:07 GMT-0300 (Brasilia Standard Time)
Eu já suspeitava disso quando Geju não foi ao encontro do Lula para articular a própria candidatura. Tem gente que… https://t.co/f0v5H92cJf,"""paulo câmara""",,,1001584233759100900,batataliberal,,,0,1,Thu Aug 19 2021 20:16:43 GMT-0300 (Brasilia Standard Time),Thu Aug 19 2021 10:41:05 GMT-0300 (Brasilia Standard Time)
@Fabi2022H @1bertoTargaryen @CentralEleicoes E o Paulo Câmara hein? Vai ser candidato a alguma coisa aí?,"""paulo câmara""",,,458875424,LB_Farias,,,0,1,Thu Aug 19 2021 20:16:43 GMT-0300 (Brasilia Standard Time),Thu Aug 19 2021 10:25:02 GMT-0300 (Brasilia Standard Time)
Sandro Régis rebate críticas de Rui Costa contra Paulo Câmara: 'Atitude abominável' https://t.co/ZxWV2Ylcvz,"""paulo câmara""",,,71344413,Acordacidade,,,0,0,Thu Aug 19 2021 20:16:43 GMT-0300 (Brasilia Standard Time),Thu Aug 19 2021 10:01:27 GMT-0300 (Brasilia Standard Time)
Sandro Régis rebate críticas de Rui Costa contra Paulo Câmara: 'Atitude abominável' - https://t.co/FmBHmSUeAT https://t.co/GMRJIPDGaz,"""paulo câmara""",,,3523906335,pontoBA,,,0,0,Thu Aug 19 2021 20:16:43 GMT-0300 (Brasilia Standard Time),Thu Aug 19 2021 09:35:29 GMT-0300 (Brasilia Standard Time)
"O Secretário de Saúde Estadual, André Longo, anúnciou nesta quarta-feira, 18, que a variante Delta já circula no te… https://t.co/78AhOpSvr4","""paulo câmara""",,,161678642,jornalgranderec,,,0,0,Thu Aug 19 2021 20:16:43 GMT-0300 (Brasilia Standard Time),Thu Aug 19 2021 09:34:45 GMT-0300 (Brasilia Standard Time)
"Em mais um giro por municípios pernambucanos, o governador Paulo Câmara (PSB) visita o Sertão do Araripe nesta quin… https://t.co/QsuWyrTTr9","""paulo câmara""",,,278713625,LeiaJaOnline,,,0,0,Thu Aug 19 2021 20:16:43 GMT-0300 (Brasilia Standard Time),Thu Aug 19 2021 09:02:17 GMT-0300 (Brasilia Standard Time)
Sandro Régis repudia ataque de Rui Costa contra Paulo Câmara: ‘Atitude abominável’ https://t.co/DBDq5kyg4V,"""paulo câmara""",,,39566949,politicalivre,,,0,0,Thu Aug 19 2021 20:16:43 GMT-0300 (Brasilia Standard Time),Thu Aug 19 2021 09:01:58 GMT-0300 (Brasilia Standard Time)
RT @OAntagoniza11: Dep Paulo Câmara prova p/população baiana de quem é a culpa do preço da gasolina no estado e desmente agências de checag…,"""paulo câmara""",,,1378544387819516000,CoutinhoHulk38,,,54,0,Thu Aug 19 2021 20:16:43 GMT-0300 (Brasilia Standard Time),Thu Aug 19 2021 08:21:33 GMT-0300 (Brasilia Standard Time)
RT @OAntagoniza11: Dep Paulo Câmara prova p/população baiana de quem é a culpa do preço da gasolina no estado e desmente agências de checag…,"""paulo câmara""",,,984985970536796200,deiadejeus,,,54,0,Thu Aug 19 2021 20:16:43 GMT-0300 (Brasilia Standard Time),Thu Aug 19 2021 07:35:26 GMT-0300 (Brasilia Standard Time)
RT @OAntagoniza11: Dep Paulo Câmara prova p/população baiana de quem é a culpa do preço da gasolina no estado e desmente agências de checag…,"""paulo câmara""",,,917074155748634600,lyra0702,,,54,0,Thu Aug 19 2021 20:16:43 GMT-0300 (Brasilia Standard Time),Thu Aug 19 2021 07:29:17 GMT-0300 (Brasilia Standard Time)
RT @OAntagoniza11: Dep Paulo Câmara prova p/população baiana de quem é a culpa do preço da gasolina no estado e desmente agências de checag…,"""paulo câmara""",,,152362287,Prof_AlexAlves,,,54,0,Thu Aug 19 2021 20:16:43 GMT-0300 (Brasilia Standard Time),Thu Aug 19 2021 07:27:10 GMT-0300 (Brasilia Standard Time)
RT @OAntagoniza11: Dep Paulo Câmara prova p/população baiana de quem é a culpa do preço da gasolina no estado e desmente agências de checag…,"""paulo câmara""",,,534488152,Carla_Margarete,,,54,0,Thu Aug 19 2021 20:16:43 GMT-0300 (Brasilia Standard Time),Thu Aug 19 2021 07:17:30 GMT-0300 (Brasilia Standard Time)
RT @OAntagoniza11: Dep Paulo Câmara prova p/população baiana de quem é a culpa do preço da gasolina no estado e desmente agências de checag…,"""paulo câmara""",,,2727480426,alexynunes,,,54,0,Thu Aug 19 2021 20:16:43 GMT-0300 (Brasilia Standard Time),Thu Aug 19 2021 07:17:01 GMT-0300 (Brasilia Standard Time)
RT @OAntagoniza11: Dep Paulo Câmara prova p/população baiana de quem é a culpa do preço da gasolina no estado e desmente agências de checag…,"""paulo câmara""",,,219768802,alvarobohana1,,,54,0,Thu Aug 19 2021 20:16:43 GMT-0300 (Brasilia Standard Time),Thu Aug 19 2021 07:15:36 GMT-0300 (Brasilia Standard Time)
Paulo Câmara cumpre agenda intensa no Sertão do Araripe https://t.co/dYSuSVu06S,"""paulo câmara""",,,72960566,blogmarioflavio,,,0,1,Thu Aug 19 2021 20:16:43 GMT-0300 (Brasilia Standard Time),Thu Aug 19 2021 07:10:50 GMT-0300 (Brasilia Standard Time)
RT @OAntagoniza11: Dep Paulo Câmara prova p/população baiana de quem é a culpa do preço da gasolina no estado e desmente agências de checag…,"""paulo câmara""",,,1242068555165810700,brunocesarjaime,,,54,0,Thu Aug 19 2021 20:16:43 GMT-0300 (Brasilia Standard Time),Thu Aug 19 2021 06:27:11 GMT-0300 (Brasilia Standard Time)
RT @Claudiojmello: @DouglasGarcia Aqui em Pernambuco o Governador Paulo Câmara disse que vai autorizar a ser aplicada a CoronaVac em menore…,"""paulo câmara""",,,1114976824008806400,CastanhoLuiz,,,1,0,Thu Aug 19 2021 20:16:43 GMT-0300 (Brasilia Standard Time),Thu Aug 19 2021 06:07:45 GMT-0300 (Brasilia Standard Time)
"RT @NellyYumi: Governadores q assinaram apoio ao STF: Rui Costa, Flávio Dino, Paulo Câmara, João Doria, Eduardo Leite, Camilo Santana, João…","""paulo câmara""",,,1645736942,arte_prima,,,836,0,Thu Aug 19 2021 20:16:43 GMT-0300 (Brasilia Standard Time),Thu Aug 19 2021 05:42:47 GMT-0300 (Brasilia Standard Time)
RT @OAntagoniza11: Dep Paulo Câmara prova p/população baiana de quem é a culpa do preço da gasolina no estado e desmente agências de checag…,"""paulo câmara""",,,1164934619973726200,AndrAra51165759,,,54,0,Thu Aug 19 2021 20:16:43 GMT-0300 (Brasilia Standard Time),Thu Aug 19 2021 04:57:28 GMT-0300 (Brasilia Standard Time)
"RT @Guilher29880805: Ai PAULO CÂMARA/LULA AINDA TEM IDIOTA VENDENDO O VOTO POR R$ 50,00 REAIS,  ENTÃO SE FODA MAIS AINDA CARALHO. https://t…","""paulo câmara""",,,1270442667017724000,BrasilUP2,,,1,0,Thu Aug 19 2021 20:16:43 GMT-0300 (Brasilia Standard Time),Thu Aug 19 2021 02:37:43 GMT-0300 (Brasilia Standard Time)
RT @OAntagoniza11: Dep Paulo Câmara prova p/população baiana de quem é a culpa do preço da gasolina no estado e desmente agências de checag…,"""paulo câmara""",,,916243192621695000,SVerdeAmarelo,,,54,0,Thu Aug 19 2021 20:16:43 GMT-0300 (Brasilia Standard Time),Thu Aug 19 2021 02:37:09 GMT-0300 (Brasilia Standard Time)
@DouglasGarcia Aqui em Pernambuco o Governador Paulo Câmara disse que vai autorizar a ser aplicada a CoronaVac em m… https://t.co/HRIJ3og1nx,"""paulo câmara""",,,71084673,Claudiojmello,,,1,3,Thu Aug 19 2021 20:16:43 GMT-0300 (Brasilia Standard Time),Thu Aug 19 2021 00:57:27 GMT-0300 (Brasilia Standard Time)
saudades de quando minha preocupação era só saber o dia q o paulo câmara ia botar passagem no meu vem,"""paulo câmara""",,,4205993776,gatomaconhaa,,,0,0,Thu Aug 19 2021 20:16:43 GMT-0300 (Brasilia Standard Time),Thu Aug 19 2021 00:34:03 GMT-0300 (Brasilia Standard Time)
RT @OAntagoniza11: Dep Paulo Câmara prova p/população baiana de quem é a culpa do preço da gasolina no estado e desmente agências de checag…,"""paulo câmara""",,,263003270,Ledajoao,,,54,0,Thu Aug 19 2021 20:16:43 GMT-0300 (Brasilia Standard Time),Thu Aug 19 2021 00:32:30 GMT-0300 (Brasilia Standard Time)
RT @OAntagoniza11: Dep Paulo Câmara prova p/população baiana de quem é a culpa do preço da gasolina no estado e desmente agências de checag…,"""paulo câmara""",,,1123055030985273300,AlexCalzolari2,,,54,0,Thu Aug 19 2021 20:16:43 GMT-0300 (Brasilia Standard Time),Wed Aug 18 2021 23:54:55 GMT-0300 (Brasilia Standard Time)
"Você pode achar bom ou ruim esses programas de emprego, mas por apenas um detalhe, dá para saber que não vai ter re… https://t.co/QQsFYGjgfp","""paulo câmara""",,,1111082566893871100,TVTOON2,,,0,0,Thu Aug 19 2021 20:16:43 GMT-0300 (Brasilia Standard Time),Wed Aug 18 2021 23:52:54 GMT-0300 (Brasilia Standard Time)
RT @OAntagoniza11: Dep Paulo Câmara prova p/população baiana de quem é a culpa do preço da gasolina no estado e desmente agências de checag…,"""paulo câmara""",,,184650592,TValonso,,,54,0,Thu Aug 19 2021 20:16:43 GMT-0300 (Brasilia Standard Time),Wed Aug 18 2021 23:50:22 GMT-0300 (Brasilia Standard Time)
RT @OAntagoniza11: Dep Paulo Câmara prova p/população baiana de quem é a culpa do preço da gasolina no estado e desmente agências de checag…,"""paulo câmara""",,,1370589392188928000,Sete42142987,,,54,0,Thu Aug 19 2021 20:16:43 GMT-0300 (Brasilia Standard Time),Wed Aug 18 2021 23:47:11 GMT-0300 (Brasilia Standard Time)
RT @OAntagoniza11: Dep Paulo Câmara prova p/população baiana de quem é a culpa do preço da gasolina no estado e desmente agências de checag…,"""paulo câmara""",,,1314931292388176000,MNF41389943,,,54,0,Thu Aug 19 2021 20:16:43 GMT-0300 (Brasilia Standard Time),Wed Aug 18 2021 23:33:04 GMT-0300 (Brasilia Standard Time)
RT @OAntagoniza11: Dep Paulo Câmara prova p/população baiana de quem é a culpa do preço da gasolina no estado e desmente agências de checag…,"""paulo câmara""",,,52903457,rubenssilvas,,,54,0,Thu Aug 19 2021 20:16:43 GMT-0300 (Brasilia Standard Time),Wed Aug 18 2021 23:30:45 GMT-0300 (Brasilia Standard Time)
RT @OAntagoniza11: Dep Paulo Câmara prova p/população baiana de quem é a culpa do preço da gasolina no estado e desmente agências de checag…,"""paulo câmara""",,,864406723553001500,JoacyFrancisco,,,54,0,Thu Aug 19 2021 20:16:43 GMT-0300 (Brasilia Standard Time),Wed Aug 18 2021 23:30:16 GMT-0300 (Brasilia Standard Time)
RT @OAntagoniza11: Dep Paulo Câmara prova p/população baiana de quem é a culpa do preço da gasolina no estado e desmente agências de checag…,"""paulo câmara""",,,1067819827400712200,MacielAlves2021,,,54,0,Thu Aug 19 2021 20:16:43 GMT-0300 (Brasilia Standard Time),Wed Aug 18 2021 23:23:51 GMT-0300 (Brasilia Standard Time)
