text,query,country,city,userId,username,quote_count,reply_count,retweet_count,favorite_count,timestamp,createdAt
"@Lidy_Monteiro @xmanuzoca Mirandiba tá em +18 tem dias já, Camutanga chegou em +22 antes de Recife, Arcoverde tava… https://t.co/N8yIq3rkXg","""paulo câmara""",,,1203972419691712500,ricardoayperes,,,0,0,Thu Aug 12 2021 09:36:24 GMT-0300 (Brasilia Standard Time),Thu Aug 12 2021 09:23:04 GMT-0300 (Brasilia Standard Time)
"Lula desembarca em Pernambuco no domingo,15. Tem encontro com o governador Paulo Câmara e movimento sociais, na seg… https://t.co/Qy0AwZtUcr","""paulo câmara""",,,161678642,jornalgranderec,,,0,0,Thu Aug 12 2021 09:36:24 GMT-0300 (Brasilia Standard Time),Thu Aug 12 2021 09:22:06 GMT-0300 (Brasilia Standard Time)
"#NoArNaCBN - Governador Paulo Câmara encaminha, à assembleia legislativa, projeto para  implantar cobrança de pedág… https://t.co/BVM2hqnmS2","""paulo câmara""",,,1633338246,cbnrecife,,,0,0,Thu Aug 12 2021 09:36:24 GMT-0300 (Brasilia Standard Time),Thu Aug 12 2021 09:15:36 GMT-0300 (Brasilia Standard Time)
"Olha! O #PauloBosta
Colocando sem cuspe no pessoal de Recife. 

https://t.co/1kIgrAKCpD","""paulo câmara""",Brazil,"Jaboatão dos Guararapes, Brasil",1264686371781959700,MarlyBarbosa202,,,1,1,Thu Aug 12 2021 09:36:24 GMT-0300 (Brasilia Standard Time),Thu Aug 12 2021 09:03:10 GMT-0300 (Brasilia Standard Time)
Paulo Câmara inicia agenda no Sertão do São Francisco https://t.co/noMhjsLy7k,"""paulo câmara""",,,1064709993126158300,BlogANascimento,,,0,0,Thu Aug 12 2021 09:36:24 GMT-0300 (Brasilia Standard Time),Thu Aug 12 2021 09:02:24 GMT-0300 (Brasilia Standard Time)
Governador Paulo Câmara cumpre agenda no Sertão do São Francisco; Petrolina é a primeira parada… https://t.co/vxNsnAubJN,"""paulo câmara""",,,2828247885,Cartazdacidade,,,0,0,Thu Aug 12 2021 09:36:24 GMT-0300 (Brasilia Standard Time),Thu Aug 12 2021 09:01:12 GMT-0300 (Brasilia Standard Time)
"RT @jc_pe: Paulo Câmara manda à Alepe projeto com requisitos para cobrança de pedágio nas estradas estaduais
https://t.co/yT8hr3lZsG","""paulo câmara""",,,2917594132,mvchaves15,,,5,0,Thu Aug 12 2021 09:36:24 GMT-0300 (Brasilia Standard Time),Thu Aug 12 2021 08:37:24 GMT-0300 (Brasilia Standard Time)
@recifeordinario Primeira coisa boa que Paulo Câmara fez em 7 anos de  mandato.,"""paulo câmara""",,,2551211479,aboutlusca,,,0,0,Thu Aug 12 2021 09:36:24 GMT-0300 (Brasilia Standard Time),Thu Aug 12 2021 08:35:42 GMT-0300 (Brasilia Standard Time)
"Oh paulo Camara pq a merenda das escolas tá tão ruim ein?? pelo amor de deus não tem nem uma farofa, uma charque no… https://t.co/28fTtmST3e","""paulo câmara""",,,815970144174374900,nininhss,,,0,1,Thu Aug 12 2021 09:36:24 GMT-0300 (Brasilia Standard Time),Thu Aug 12 2021 08:33:55 GMT-0300 (Brasilia Standard Time)
RT @folhape: #POLITICA - por Edmar Lyra | Paulo Câmara intensifica agenda no estado - https://t.co/twRNwKigGD https://t.co/7aPXLTW8pC,"""paulo câmara""",,,53175849,EdmarLyra,,,1,0,Thu Aug 12 2021 09:36:24 GMT-0300 (Brasilia Standard Time),Thu Aug 12 2021 08:10:55 GMT-0300 (Brasilia Standard Time)
#POLITICA - por Edmar Lyra | Paulo Câmara intensifica agenda no estado - https://t.co/twRNwKigGD https://t.co/7aPXLTW8pC,"""paulo câmara""",,,61752537,folhape,,,1,2,Thu Aug 12 2021 09:36:24 GMT-0300 (Brasilia Standard Time),Thu Aug 12 2021 08:10:04 GMT-0300 (Brasilia Standard Time)
Lula janta com Paulo Câmara e vai à assentamento do MST em Moreno https://t.co/jUppYWZHg6,"""paulo câmara""",,,354350293,marcosalmeidape,,,0,0,Thu Aug 12 2021 09:36:24 GMT-0300 (Brasilia Standard Time),Thu Aug 12 2021 07:54:42 GMT-0300 (Brasilia Standard Time)
"@MarimDim Em Recife não tem não, já começa com Paulo Câmara esse filho da puta e dps o menino prefeito","""paulo câmara""",,,1135195008355721200,gabirupoeta,,,0,0,Thu Aug 12 2021 09:36:24 GMT-0300 (Brasilia Standard Time),Thu Aug 12 2021 07:46:13 GMT-0300 (Brasilia Standard Time)
"Bora Paulo câmara, agiliza essa pe","""paulo câmara""",,,2998614159,manso_larissa,,,0,0,Thu Aug 12 2021 09:36:24 GMT-0300 (Brasilia Standard Time),Thu Aug 12 2021 07:31:56 GMT-0300 (Brasilia Standard Time)
#POLITICA - por Carlos Britto | Paulo Câmara vai a Petrolina em momento de tensão com Miguel -… https://t.co/9nCfzv0QA6,"""paulo câmara""",,,61752537,folhape,,,1,2,Thu Aug 12 2021 09:36:24 GMT-0300 (Brasilia Standard Time),Thu Aug 12 2021 07:30:05 GMT-0300 (Brasilia Standard Time)
"Uma Máquina 

https://t.co/K6Q6ExVjsO","""paulo câmara""",,,393905137,AgeFighter75,,,0,0,Thu Aug 12 2021 09:36:24 GMT-0300 (Brasilia Standard Time),Thu Aug 12 2021 07:23:24 GMT-0300 (Brasilia Standard Time)
FOLHA #POLITICA - por @rbzerrademelo | Lula janta com Paulo Câmara e vai à assentamento do MST em Moreno -… https://t.co/mHqYn8mT3y,"""paulo câmara""",,,61752537,folhape,,,0,9,Thu Aug 12 2021 09:36:24 GMT-0300 (Brasilia Standard Time),Thu Aug 12 2021 07:20:03 GMT-0300 (Brasilia Standard Time)
Coluna da Folha: Paulo Câmara vai a Petrolina em momento de tensão com Miguel https://t.co/MPz0lf25JX,"""paulo câmara""",,,60770211,carlosbritto1,,,0,0,Thu Aug 12 2021 09:36:24 GMT-0300 (Brasilia Standard Time),Thu Aug 12 2021 07:10:34 GMT-0300 (Brasilia Standard Time)
Paulo Câmara inicia agenda no Sertão do São Francisco https://t.co/9RCzUgzWTw,"""paulo câmara""",,,142641128,andrelbento,,,0,0,Thu Aug 12 2021 09:36:24 GMT-0300 (Brasilia Standard Time),Thu Aug 12 2021 07:07:16 GMT-0300 (Brasilia Standard Time)
Paulo Câmara inicia agenda no Sertão do São Francisco https://t.co/01Vrefs4gp,"""paulo câmara""",,,53025607,Nill_Junior,,,0,0,Thu Aug 12 2021 09:36:24 GMT-0300 (Brasilia Standard Time),Thu Aug 12 2021 07:07:12 GMT-0300 (Brasilia Standard Time)
"RT @folhape: FOLHA #POLÍTICA, por @rbezerrademelo| Lula janta com Paulo Câmara e vai à assentamento do MST em Moreno https://t.co/2DY57tzZv…","""paulo câmara""",,,1513082046,FerreirahelioF,,,1,0,Thu Aug 12 2021 09:36:24 GMT-0300 (Brasilia Standard Time),Thu Aug 12 2021 06:44:39 GMT-0300 (Brasilia Standard Time)
"FOLHA #POLÍTICA, por @rbezerrademelo| Lula janta com Paulo Câmara e vai à assentamento do MST em Moreno… https://t.co/cjexEOJoum","""paulo câmara""",,,61752537,folhape,,,1,20,Thu Aug 12 2021 09:36:24 GMT-0300 (Brasilia Standard Time),Thu Aug 12 2021 06:33:03 GMT-0300 (Brasilia Standard Time)
"RT @jc_pe: Cena Política | @igorpmaciel  | Professor Lupércio estava falando à Rádio Jornal sobre os potenciais candidatos ao Palácio e, do…","""paulo câmara""",,,1233021739573096400,OlindaBot,,,3,0,Thu Aug 12 2021 09:36:24 GMT-0300 (Brasilia Standard Time),Thu Aug 12 2021 04:11:11 GMT-0300 (Brasilia Standard Time)
RT @thofafor: .@anipal150: Prefeito de Olinda professor Lupércio e Governador de Estado de Pernambuco - Paulo Câmara: Justiça para Vitória…,"""paulo câmara""",,,275793550,soldier_777,,,155,0,Thu Aug 12 2021 09:36:24 GMT-0300 (Brasilia Standard Time),Thu Aug 12 2021 00:38:50 GMT-0300 (Brasilia Standard Time)
@vitorsolto @lucasboleno Quem distribui as vacinas tbm é o governo do estado. Se questionem pq em Recife a fila and… https://t.co/3DGZbbAmcc,"""paulo câmara""",,,352787278,Lidy_Monteiro,,,0,4,Thu Aug 12 2021 09:36:24 GMT-0300 (Brasilia Standard Time),Wed Aug 11 2021 23:05:10 GMT-0300 (Brasilia Standard Time)
@xmanuzoca Incrível como as vacinas chegam mais rápido em Recife. Vou fingir que Paulo câmara não é pau mandado do… https://t.co/Phz0CSD3k2,"""paulo câmara""",,,352787278,Lidy_Monteiro,,,0,2,Thu Aug 12 2021 09:36:24 GMT-0300 (Brasilia Standard Time),Wed Aug 11 2021 22:59:50 GMT-0300 (Brasilia Standard Time)
@milicianjaa VERGONHA EDUARDO CAMPOS E PAULO CÂMARA NINGUÉM APROVOU MAS GANHARAM GANHARAM OU  BARROSO TOMOU AS ELEI… https://t.co/48RdZWEYxy,"""paulo câmara""",,,861927892632076300,SantosRivany,,,0,0,Thu Aug 12 2021 09:36:24 GMT-0300 (Brasilia Standard Time),Wed Aug 11 2021 22:33:44 GMT-0300 (Brasilia Standard Time)
"@peupsiqueira Errado não estaria. 
Cadê Paulo Câmara para aprender com o Twitter?","""paulo câmara""",,,1394703607128371200,Dan_Fontes11,,,0,1,Thu Aug 12 2021 09:36:24 GMT-0300 (Brasilia Standard Time),Wed Aug 11 2021 22:31:46 GMT-0300 (Brasilia Standard Time)
voces tao reclamando do preço da gasosa nas refinarias porque não devem ter visto o projeto de paulo câmara em mete… https://t.co/AbZcpsr9m0,"""paulo câmara""",,,150384196,ruangouveiaf,,,0,0,Thu Aug 12 2021 09:36:24 GMT-0300 (Brasilia Standard Time),Wed Aug 11 2021 22:24:28 GMT-0300 (Brasilia Standard Time)
gt meu irmão foi vítima do racismo  policial pela milésima vez domingo espancaram ele e quebraram sua moto q ele co… https://t.co/8QI7PX6uCU,"""paulo câmara""",,,1269696647476523000,isaianevirginia,,,0,3,Thu Aug 12 2021 09:36:24 GMT-0300 (Brasilia Standard Time),Wed Aug 11 2021 21:33:01 GMT-0300 (Brasilia Standard Time)
paulo câmara ficou feliz https://t.co/Owd8x2nq8P,"""paulo câmara""",,,1185294959605436400,clealbuquerquee,,,0,2,Thu Aug 12 2021 09:36:24 GMT-0300 (Brasilia Standard Time),Wed Aug 11 2021 21:01:32 GMT-0300 (Brasilia Standard Time)
@renatorbarros Cobra de paulo câmara,"""paulo câmara""",,,3341191773,miguel14_vital,,,0,1,Thu Aug 12 2021 09:36:24 GMT-0300 (Brasilia Standard Time),Wed Aug 11 2021 20:53:03 GMT-0300 (Brasilia Standard Time)
Paulo Câmara envio projeto à ALEPE que regulamenta a cobrança de pedágio nas rodovias de Pernambuco https://t.co/jxncbwgwvO,"""paulo câmara""",,,100603510,Almirdasneves,,,0,0,Thu Aug 12 2021 09:36:24 GMT-0300 (Brasilia Standard Time),Wed Aug 11 2021 20:12:55 GMT-0300 (Brasilia Standard Time)
Paulo Câmara manda à Alepe projeto com requisitos para cobrança de pedágio nas estradas estaduaisMais Cobrança pra… https://t.co/qscLl2nvDP,"""paulo câmara""",,,1600884655,EDSONCAMPOSFBI,,,0,0,Thu Aug 12 2021 09:36:24 GMT-0300 (Brasilia Standard Time),Wed Aug 11 2021 20:07:52 GMT-0300 (Brasilia Standard Time)
"*Paulo Câmara manda à Alepe projeto com requisitos para cobrança de pedágio nas estradas estaduais*

*O projeto já… https://t.co/ByRUtlv50F","""paulo câmara""",,,1291443087575744500,anymas7,,,0,1,Thu Aug 12 2021 09:36:24 GMT-0300 (Brasilia Standard Time),Wed Aug 11 2021 20:07:00 GMT-0300 (Brasilia Standard Time)
"@brasil247 @Pollima36 Menina, fica por aí mesmo, ou espera o mandato do Paulo Câmara terminar! Basta!!!","""paulo câmara""",,,229445275,samucabks,,,0,0,Thu Aug 12 2021 09:36:24 GMT-0300 (Brasilia Standard Time),Wed Aug 11 2021 19:59:21 GMT-0300 (Brasilia Standard Time)
Obg Paulo Câmara era só o que eu queria mesmo kkkk https://t.co/MoLrGVbfyk,"""paulo câmara""",,,1417944910821527600,AgnesFreitasde1,,,0,1,Thu Aug 12 2021 09:36:24 GMT-0300 (Brasilia Standard Time),Wed Aug 11 2021 19:59:16 GMT-0300 (Brasilia Standard Time)
"Paulo Câmara aumentou a um tempinho atrás o imposto sobre carnes. Ningueeeeem pra reclamar, protestar... aff population, aff. Mas é isso...","""paulo câmara""",,,80874131,mr_nillo,,,0,0,Thu Aug 12 2021 09:36:24 GMT-0300 (Brasilia Standard Time),Wed Aug 11 2021 19:57:01 GMT-0300 (Brasilia Standard Time)
"Mais uma pérola provinda do Sr governador de Pernambuco.
O Sr está com a pôrra, governador?
Vejamos agora a atitude… https://t.co/PbmlFgTT0B","""paulo câmara""",,,229445275,samucabks,,,0,0,Thu Aug 12 2021 09:36:24 GMT-0300 (Brasilia Standard Time),Wed Aug 11 2021 19:56:54 GMT-0300 (Brasilia Standard Time)
"@Cardinot
Os alimentos vão subir de preço pra pagar aos pedágios.. https://t.co/HIxmeuq4GJ","""paulo câmara""",,,71084673,Claudiojmello,,,0,0,Thu Aug 12 2021 09:36:24 GMT-0300 (Brasilia Standard Time),Wed Aug 11 2021 19:52:30 GMT-0300 (Brasilia Standard Time)
"RT @fabiocmaya: @jdoriajr Ainda reclamam do Sr. Em PE, além de omisso, o Governador só sabe criar imposto. O povo que se F.
https://t.co/eN…","""paulo câmara""",,,1393596056261251000,RolimVan,,,1,0,Thu Aug 12 2021 09:36:24 GMT-0300 (Brasilia Standard Time),Wed Aug 11 2021 19:45:37 GMT-0300 (Brasilia Standard Time)
vc me prometeu paulo camara,"""paulo câmara""",,,1150541012927950800,Ups_camix,,,0,0,Thu Aug 12 2021 09:36:24 GMT-0300 (Brasilia Standard Time),Wed Aug 11 2021 19:41:06 GMT-0300 (Brasilia Standard Time)
"RT @radiojornalpe: Lula volta a Pernambuco no domingo (15) e se reunirá com governador Paulo Câmara
https://t.co/AyH0kaDKW2 https://t.co/H0…","""paulo câmara""",,,476367643,Erivaldo_M,,,2,0,Thu Aug 12 2021 09:36:24 GMT-0300 (Brasilia Standard Time),Wed Aug 11 2021 19:39:40 GMT-0300 (Brasilia Standard Time)
"@S_unSunshine @CezarNetoSCR @FelipeMHLins @brutchurubei @lucasboleno Não? KKKKKK psb sempre apoiou lula, dilma e to… https://t.co/r3XTwVkoeP","""paulo câmara""",,,1261798838073012200,Skolzinn87,,,0,1,Thu Aug 12 2021 09:36:24 GMT-0300 (Brasilia Standard Time),Wed Aug 11 2021 18:57:30 GMT-0300 (Brasilia Standard Time)
"paulo camara mandando as vacinas só pra recife e esquecendo dos outros municípios, mas que inferno eu quero vacinar https://t.co/M8DsZFX32v","""paulo câmara""",,,4277072015,bridstyles,,,0,0,Thu Aug 12 2021 09:36:24 GMT-0300 (Brasilia Standard Time),Wed Aug 11 2021 18:48:20 GMT-0300 (Brasilia Standard Time)
Paulo Câmara manda projeto para cobrança de pedágio nas estradas estaduais https://t.co/ywFOKojvYO @teamocaruaru https://t.co/5s65DQb7sS,"""paulo câmara""",,,57403456,wendele_,,,0,0,Thu Aug 12 2021 09:36:24 GMT-0300 (Brasilia Standard Time),Wed Aug 11 2021 18:35:33 GMT-0300 (Brasilia Standard Time)
"RT @radiojornalpe: Lula volta a Pernambuco no domingo (15) e se reunirá com governador Paulo Câmara
https://t.co/AyH0kaDKW2 https://t.co/H0…","""paulo câmara""",,,3388558210,marvindarocha,,,2,0,Thu Aug 12 2021 09:36:24 GMT-0300 (Brasilia Standard Time),Wed Aug 11 2021 18:32:44 GMT-0300 (Brasilia Standard Time)
"Na próxima segunda-feira, o governador Paulo Câmara não estará no Estado. Terá agenda em Brasília com o ministro Ta… https://t.co/U7k4xb1ctK","""paulo câmara""",,,61021484,rbezerrademelo,,,0,1,Thu Aug 12 2021 09:36:24 GMT-0300 (Brasilia Standard Time),Wed Aug 11 2021 18:32:44 GMT-0300 (Brasilia Standard Time)
"No domingo, quando chega a Pernambuco, o ex-presidente Lula estará com o governador Paulo Câmara. Na segunda, há pr… https://t.co/hnn5FG5qoo","""paulo câmara""",,,61021484,rbezerrademelo,,,0,2,Thu Aug 12 2021 09:36:24 GMT-0300 (Brasilia Standard Time),Wed Aug 11 2021 18:20:00 GMT-0300 (Brasilia Standard Time)
"@jdoriajr Ainda reclamam do Sr. Em PE, além de omisso, o Governador só sabe criar imposto. O povo que se F.
https://t.co/eNXIVDBYe3","""paulo câmara""",,,477907408,fabiocmaya,,,1,2,Thu Aug 12 2021 09:36:24 GMT-0300 (Brasilia Standard Time),Wed Aug 11 2021 18:05:37 GMT-0300 (Brasilia Standard Time)
"@AlepeOficial Deputados inúteis.
https://t.co/eNXIVDBYe3","""paulo câmara""",,,477907408,fabiocmaya,,,0,0,Thu Aug 12 2021 09:36:24 GMT-0300 (Brasilia Standard Time),Wed Aug 11 2021 18:01:10 GMT-0300 (Brasilia Standard Time)
"@PauloCamara40 Seja solidário tbm com quem votou no Sr, que só quer matar o povo de fome.
https://t.co/eNXIVDBYe3","""paulo câmara""",,,477907408,fabiocmaya,,,0,0,Thu Aug 12 2021 09:36:24 GMT-0300 (Brasilia Standard Time),Wed Aug 11 2021 17:59:15 GMT-0300 (Brasilia Standard Time)
"@PauloCamara40 Tá achando pouco pow? Trabalho viajando. Já basta emplacamento adiantado, ICMS alti e agora pedágio?… https://t.co/dpJElIDL06","""paulo câmara""",,,477907408,fabiocmaya,,,0,0,Thu Aug 12 2021 09:36:24 GMT-0300 (Brasilia Standard Time),Wed Aug 11 2021 17:57:57 GMT-0300 (Brasilia Standard Time)
"Ex-presidente Lula confirma agenda em Pernambuco neste domingo e segunda, incluindo encontro com Paulo Câmara e mov… https://t.co/cgRqDlMpSH","""paulo câmara""",,,3024436931,p_prefeitura,,,0,0,Thu Aug 12 2021 09:36:24 GMT-0300 (Brasilia Standard Time),Wed Aug 11 2021 17:24:08 GMT-0300 (Brasilia Standard Time)
"RT @Indiabonora: DESgovernador Paulo Câmara, apronta mais uma vez com sua trupe. Dessa vez, pede que a Câmara vote sobre a inserção de pedá…","""paulo câmara""",,,1347304330253242400,PhenosL,,,6,0,Thu Aug 12 2021 09:36:24 GMT-0300 (Brasilia Standard Time),Wed Aug 11 2021 17:01:53 GMT-0300 (Brasilia Standard Time)
"Lula volta a Pernambuco no domingo (15) e se reunirá com governador Paulo Câmara
https://t.co/AyH0kaDKW2 https://t.co/H084lf9Csi","""paulo câmara""",,,43774330,radiojornalpe,,,2,18,Thu Aug 12 2021 09:36:24 GMT-0300 (Brasilia Standard Time),Wed Aug 11 2021 16:48:16 GMT-0300 (Brasilia Standard Time)
"RT @Indiabonora: DESgovernador Paulo Câmara, apronta mais uma vez com sua trupe. Dessa vez, pede que a Câmara vote sobre a inserção de pedá…","""paulo câmara""",,,1147891522186223600,VovoDireita,,,6,0,Thu Aug 12 2021 09:36:24 GMT-0300 (Brasilia Standard Time),Wed Aug 11 2021 16:34:55 GMT-0300 (Brasilia Standard Time)
"RT @Indiabonora: DESgovernador Paulo Câmara, apronta mais uma vez com sua trupe. Dessa vez, pede que a Câmara vote sobre a inserção de pedá…","""paulo câmara""",,,1416735395665043500,Ederson13686321,,,6,0,Thu Aug 12 2021 09:36:24 GMT-0300 (Brasilia Standard Time),Wed Aug 11 2021 16:29:07 GMT-0300 (Brasilia Standard Time)
"ok obg joao campos agr vc ja pode falar pro seu amigo paulo camara pra abrir tudo já e a nojeira começar, dar play no game porraaaaaaaaaa","""paulo câmara""",,,1280500033763369000,caiovgm,,,0,2,Thu Aug 12 2021 09:36:24 GMT-0300 (Brasilia Standard Time),Wed Aug 11 2021 16:00:22 GMT-0300 (Brasilia Standard Time)
"Ai PAULO CÂMARA/LULA AINDA TEM IDIOTA VENDENDO O VOTO POR R$ 50,00 REAIS,  ENTÃO SE FODA MAIS AINDA CARALHO. https://t.co/7jZ6tw1BLb","""paulo câmara""",,,1409329084681834500,Guilher29880805,,,0,1,Thu Aug 12 2021 09:36:24 GMT-0300 (Brasilia Standard Time),Wed Aug 11 2021 15:56:47 GMT-0300 (Brasilia Standard Time)
Paulo Câmara manda à Alepe projeto com requisitos para cobrança de pedágio nas estradas estaduais - Por Dárcio Rabe… https://t.co/lqcMacOlEs,"""paulo câmara""",,,131681651,darciorabelo,,,0,0,Thu Aug 12 2021 09:36:24 GMT-0300 (Brasilia Standard Time),Wed Aug 11 2021 15:30:41 GMT-0300 (Brasilia Standard Time)
Paulo Câmara manda à Alepe projeto com requisitos para cobrança de pedágio nas estradas estaduais - Por Dárcio Rabe… https://t.co/Xj8d8GfBti,"""paulo câmara""",,,131681651,darciorabelo,,,0,0,Thu Aug 12 2021 09:36:24 GMT-0300 (Brasilia Standard Time),Wed Aug 11 2021 15:30:15 GMT-0300 (Brasilia Standard Time)
"RT @Indiabonora: DESgovernador Paulo Câmara, apronta mais uma vez com sua trupe. Dessa vez, pede que a Câmara vote sobre a inserção de pedá…","""paulo câmara""",,,1244301656747016200,Souza43419194,,,6,0,Thu Aug 12 2021 09:36:24 GMT-0300 (Brasilia Standard Time),Wed Aug 11 2021 15:26:48 GMT-0300 (Brasilia Standard Time)
"RT @Indiabonora: DESgovernador Paulo Câmara, apronta mais uma vez com sua trupe. Dessa vez, pede que a Câmara vote sobre a inserção de pedá…","""paulo câmara""",,,171735807,Leandroerosana,,,6,0,Thu Aug 12 2021 09:36:24 GMT-0300 (Brasilia Standard Time),Wed Aug 11 2021 15:26:10 GMT-0300 (Brasilia Standard Time)
"RT @Indiabonora: DESgovernador Paulo Câmara, apronta mais uma vez com sua trupe. Dessa vez, pede que a Câmara vote sobre a inserção de pedá…","""paulo câmara""",,,1122516562756419600,CsarTeixeiraCo2,,,6,0,Thu Aug 12 2021 09:36:24 GMT-0300 (Brasilia Standard Time),Wed Aug 11 2021 15:13:47 GMT-0300 (Brasilia Standard Time)
"DESgovernador Paulo Câmara, apronta mais uma vez com sua trupe. Dessa vez, pede que a Câmara vote sobre a inserção… https://t.co/iTJukzecaE","""paulo câmara""",,,1235692074625912800,Indiabonora,,,6,10,Thu Aug 12 2021 09:36:24 GMT-0300 (Brasilia Standard Time),Wed Aug 11 2021 15:06:07 GMT-0300 (Brasilia Standard Time)
Governador de Pernambuco Paulo Câmara visita Petrolina nesta quinta (12) | https://t.co/ZiA770qBDW https://t.co/h7tPUqS3fZ,"""paulo câmara""",,,1228288845835317200,RedeGn,,,0,0,Thu Aug 12 2021 09:36:24 GMT-0300 (Brasilia Standard Time),Wed Aug 11 2021 15:02:03 GMT-0300 (Brasilia Standard Time)
"RT @iodelson: O PR @jairbolsonaro editou MP que autoriza a venda direta de etanol aos postos, objetivando estimular a competitividade e atr…","""paulo câmara""",,,1134477010296877000,Thereza12979987,,,1,0,Thu Aug 12 2021 09:36:24 GMT-0300 (Brasilia Standard Time),Wed Aug 11 2021 15:01:35 GMT-0300 (Brasilia Standard Time)
"O PR @jairbolsonaro editou MP que autoriza a venda direta de etanol aos postos, objetivando estimular a competitivi… https://t.co/6S1t9GnYrg","""paulo câmara""",,,86200942,iodelson,,,1,1,Thu Aug 12 2021 09:36:24 GMT-0300 (Brasilia Standard Time),Wed Aug 11 2021 14:52:57 GMT-0300 (Brasilia Standard Time)
"@JanainaDoBrasil @WolfConservador Impressionante:

Até o filho (Fernando Coelho) do Fernando Bezerra Coelho (FBC) d… https://t.co/bH6H7IqyAB","""paulo câmara""",,,1300833069784543200,modelpernambuco,,,0,0,Thu Aug 12 2021 09:36:24 GMT-0300 (Brasilia Standard Time),Wed Aug 11 2021 14:52:22 GMT-0300 (Brasilia Standard Time)
RT @matheuscomunica: Paulo Câmara manda à Assembleia Legislativa um projeto com requisitos para cobrança de pedágio nas estradas estaduais…,"""paulo câmara""",,,368717244,RaniereMarcelo,,,2,0,Thu Aug 12 2021 09:36:24 GMT-0300 (Brasilia Standard Time),Wed Aug 11 2021 14:42:32 GMT-0300 (Brasilia Standard Time)
"@folha É culpa de Paulo câmara, ele tá indo na Petrobras subir a gasolina a cada semana.","""paulo câmara""",,,1254883772216074200,TiagoAraujo___,,,0,0,Thu Aug 12 2021 09:36:24 GMT-0300 (Brasilia Standard Time),Wed Aug 11 2021 14:38:28 GMT-0300 (Brasilia Standard Time)
"RT @jc_pe: Paulo Câmara manda à Alepe projeto com requisitos para cobrança de pedágio nas estradas estaduais
https://t.co/yT8hr3lZsG","""paulo câmara""",,,1168587529949458400,Rafaelpu7rbq,,,5,0,Thu Aug 12 2021 09:36:24 GMT-0300 (Brasilia Standard Time),Wed Aug 11 2021 14:16:52 GMT-0300 (Brasilia Standard Time)
"RT @jc_pe: Cena Política | @igorpmaciel  | Professor Lupércio estava falando à Rádio Jornal sobre os potenciais candidatos ao Palácio e, do…","""paulo câmara""",,,55263106,igorpmaciel,,,3,0,Thu Aug 12 2021 09:36:24 GMT-0300 (Brasilia Standard Time),Wed Aug 11 2021 13:44:02 GMT-0300 (Brasilia Standard Time)
"RT @DiarioPE: Paulo Câmara terá agenda no Sertão do Pajeú, começando por Petrolina https://t.co/8SsXH3Sf0T","""paulo câmara""",,,1916115823,JornalistaEmo,,,1,0,Thu Aug 12 2021 09:36:24 GMT-0300 (Brasilia Standard Time),Wed Aug 11 2021 13:42:03 GMT-0300 (Brasilia Standard Time)
RT @mvchaves15: Fora Lula e Fora Paulo câmara! 👊👊 https://t.co/kL08EleVwQ,"""paulo câmara""",,,1322295835925819400,CarlosMartinsjm,,,2,0,Thu Aug 12 2021 09:36:24 GMT-0300 (Brasilia Standard Time),Wed Aug 11 2021 13:33:26 GMT-0300 (Brasilia Standard Time)
@mateushenriq9 JC: (2 min) Paulo Câmara manda à Alepe projeto com requisitos para cobrança de pedágio nas estradas… https://t.co/uBJmjPl89D,"""paulo câmara""",,,1251625471659425800,XeuleBot,,,0,0,Thu Aug 12 2021 09:36:24 GMT-0300 (Brasilia Standard Time),Wed Aug 11 2021 13:15:29 GMT-0300 (Brasilia Standard Time)
"RT @jc_pe: Cena Política | @igorpmaciel  | Professor Lupércio estava falando à Rádio Jornal sobre os potenciais candidatos ao Palácio e, do…","""paulo câmara""",,,142835897,portalne10,,,3,0,Thu Aug 12 2021 09:36:24 GMT-0300 (Brasilia Standard Time),Wed Aug 11 2021 13:07:29 GMT-0300 (Brasilia Standard Time)
Cena Política | @igorpmaciel  | Professor Lupércio estava falando à Rádio Jornal sobre os potenciais candidatos ao… https://t.co/dMgK9oy2nw,"""paulo câmara""",,,245896728,jc_pe,,,3,3,Thu Aug 12 2021 09:36:24 GMT-0300 (Brasilia Standard Time),Wed Aug 11 2021 13:07:20 GMT-0300 (Brasilia Standard Time)
Cada dia mais tranquilo em saber quem não votei em Paulo Câmara nem fiz campanha. Essa vergonha eu não carrego.,"""paulo câmara""",,,1061190296,thiargonauta,,,1,3,Thu Aug 12 2021 09:36:24 GMT-0300 (Brasilia Standard Time),Wed Aug 11 2021 12:29:16 GMT-0300 (Brasilia Standard Time)
"Paulo Câmara terá agenda no Sertão do Pajeú, começando por Petrolina https://t.co/8SsXH3Sf0T","""paulo câmara""",,,24237705,DiarioPE,,,1,6,Thu Aug 12 2021 09:36:24 GMT-0300 (Brasilia Standard Time),Wed Aug 11 2021 12:20:00 GMT-0300 (Brasilia Standard Time)
E Paulo Câmara manda projeto de lei pra cobrar pedágio nas estradas estaduais em Pernambuco. Qual é a diferença entre isso e privatização?,"""paulo câmara""",,,2842382062,lgsilvafilho,,,0,1,Thu Aug 12 2021 09:36:24 GMT-0300 (Brasilia Standard Time),Wed Aug 11 2021 12:18:59 GMT-0300 (Brasilia Standard Time)
"Paulo Câmara terá agenda no Sertão, começando por Petrolina - Por Dárcio Rabelo https://t.co/7kiNk6fyn3","""paulo câmara""",,,131681651,darciorabelo,,,0,0,Thu Aug 12 2021 09:36:24 GMT-0300 (Brasilia Standard Time),Wed Aug 11 2021 11:53:27 GMT-0300 (Brasilia Standard Time)
Paulo Câmara toma segunda dose de vacina contra a Covid-19 dois meses após a primeira aplicação… https://t.co/aKAMVcrBau,"""paulo câmara""",,,1633338246,cbnrecife,,,0,1,Thu Aug 12 2021 09:36:24 GMT-0300 (Brasilia Standard Time),Wed Aug 11 2021 11:28:54 GMT-0300 (Brasilia Standard Time)
todo mundo se vacinando e eu não BORA PAULO CÂMARA https://t.co/iLCvIgPKAI,"""paulo câmara""",,,521610409,nickftinita,,,0,0,Thu Aug 12 2021 09:36:24 GMT-0300 (Brasilia Standard Time),Wed Aug 11 2021 11:14:01 GMT-0300 (Brasilia Standard Time)
RT @mvchaves15: Fora Lula e Fora Paulo câmara! 👊👊 https://t.co/kL08EleVwQ,"""paulo câmara""",,,1030995434536415200,fabio001batista,,,2,0,Thu Aug 12 2021 09:36:24 GMT-0300 (Brasilia Standard Time),Wed Aug 11 2021 11:06:44 GMT-0300 (Brasilia Standard Time)
"RT @jc_pe: Paulo Câmara manda à Alepe projeto com requisitos para cobrança de pedágio nas estradas estaduais
https://t.co/yT8hr3lZsG","""paulo câmara""",,,2804385048,Odon_Neto,,,5,0,Thu Aug 12 2021 09:36:24 GMT-0300 (Brasilia Standard Time),Wed Aug 11 2021 10:54:21 GMT-0300 (Brasilia Standard Time)
