text,query,country,city,userId,username,quote_count,reply_count,retweet_count,favorite_count,timestamp,createdAt
Fora Lula e Fora Paulo câmara! 👊👊 https://t.co/kL08EleVwQ,"""paulo câmara""",,,2917594132,mvchaves15,,,2,16,Thu Aug 12 2021 09:36:24 GMT-0300 (Brasilia Standard Time),Wed Aug 11 2021 10:43:43 GMT-0300 (Brasilia Standard Time)
"RT @folhape: FOLHA #POLITICA - por @rbezerrademelo | Paulo Câmara leva comitiva, amanhã, a Petrolina, reduto dos Coelho - https://t.co/vYnn…","""paulo câmara""",,,61021484,rbezerrademelo,,,1,0,Thu Aug 12 2021 09:36:24 GMT-0300 (Brasilia Standard Time),Wed Aug 11 2021 10:18:28 GMT-0300 (Brasilia Standard Time)
"Paulo Câmara manda à Alepe projeto com requisitos para cobrança de pedágio nas estradas estaduais
https://t.co/16oDq1aCSM","""paulo câmara""",,,142835897,portalne10,,,0,2,Thu Aug 12 2021 09:36:24 GMT-0300 (Brasilia Standard Time),Wed Aug 11 2021 10:03:18 GMT-0300 (Brasilia Standard Time)
"Paulo Câmara manda à Alepe projeto com requisitos para cobrança de pedágio nas estradas estaduais
https://t.co/yT8hr3lZsG","""paulo câmara""",,,245896728,jc_pe,,,5,17,Thu Aug 12 2021 09:36:24 GMT-0300 (Brasilia Standard Time),Wed Aug 11 2021 10:02:46 GMT-0300 (Brasilia Standard Time)
"Paulo Câmara manda à Alepe projeto com requisitos para cobrança de pedágio nas estradas estaduais
https://t.co/ypEkKOZQaP","""paulo câmara""",,,27097758,blogdejamildo,,,0,2,Thu Aug 12 2021 09:36:24 GMT-0300 (Brasilia Standard Time),Wed Aug 11 2021 10:02:29 GMT-0300 (Brasilia Standard Time)
Paulo Câmara manda à Assembleia Legislativa um projeto com requisitos para cobrança de pedágio nas estradas estadua… https://t.co/ivhNNNynEO,"""paulo câmara""",,,1021371600233467900,matheuscomunica,,,2,9,Thu Aug 12 2021 09:36:24 GMT-0300 (Brasilia Standard Time),Wed Aug 11 2021 09:54:03 GMT-0300 (Brasilia Standard Time)
"Depois do Pajeú, Paulo Câmara vem ao Sertão do São Francisco https://t.co/yCaZGUZ6QW","""paulo câmara""",,,60770211,carlosbritto1,,,0,0,Thu Aug 12 2021 09:36:24 GMT-0300 (Brasilia Standard Time),Wed Aug 11 2021 08:04:46 GMT-0300 (Brasilia Standard Time)
TRABALHOS EM SÃO PAULO | Câmara Municipal de SP retorna de recesso com 19 pedidos de CPIs e projetos polêmicos. https://t.co/ilTyaI5zJz,"""paulo câmara""",,,40261159,RBandeirantes,,,1,1,Thu Aug 12 2021 09:36:24 GMT-0300 (Brasilia Standard Time),Wed Aug 11 2021 08:04:27 GMT-0300 (Brasilia Standard Time)
O fundeb está sendo saqueado pelo PSB Gov de Pernambuco com o apoio do TCU. Lembrando q a esposa do Paulo Câmara fa… https://t.co/t4tN4G2Aar,"""paulo câmara""",,,992868385267634200,klima801,,,1,1,Thu Aug 12 2021 09:36:24 GMT-0300 (Brasilia Standard Time),Wed Aug 11 2021 07:38:43 GMT-0300 (Brasilia Standard Time)
"FOLHA #POLITICA - por @rbezerrademelo | Paulo Câmara leva comitiva, amanhã, a Petrolina, reduto dos Coelho -… https://t.co/saDa5gmtHo","""paulo câmara""",,,61752537,folhape,,,1,4,Thu Aug 12 2021 09:36:24 GMT-0300 (Brasilia Standard Time),Wed Aug 11 2021 07:20:03 GMT-0300 (Brasilia Standard Time)
"O governador Paulo Câmara recebeu, hoje (10), a segunda dose da vacina contra a Covid-19, no posto de vacinação dri… https://t.co/YukGx9Z65A","""paulo câmara""",Brazil,"Taquaritinga do Norte, Brasil",62346201,andrealobrasil,,,1,0,Thu Aug 12 2021 09:36:24 GMT-0300 (Brasilia Standard Time),Tue Aug 10 2021 20:55:57 GMT-0300 (Brasilia Standard Time)
e eu me humilhando pra paulo câmara liberar vacinação pra menor https://t.co/AKHJ8PuyuK,"""paulo câmara""",,,1386419939888730000,sankthorn,,,0,0,Thu Aug 12 2021 09:36:24 GMT-0300 (Brasilia Standard Time),Tue Aug 10 2021 20:45:13 GMT-0300 (Brasilia Standard Time)
"RT @governope: O governador Paulo Câmara enviou, hoje (9),  proposta de emenda à Constituição Estadual que concede ao Estado competência pa…","""paulo câmara""",,,2648466021,sena_geo,,,2,0,Thu Aug 12 2021 09:36:24 GMT-0300 (Brasilia Standard Time),Tue Aug 10 2021 16:54:01 GMT-0300 (Brasilia Standard Time)
