text,query,country,city,userId,username,quote_count,reply_count,retweet_count,favorite_count,timestamp,createdAt
"A privatização de empresas públicas, como a CEEE, parte da firme convicção de que os investimentos privados vão ani… https://t.co/n4CAOL7Owe",123891446,,,123891446,EduardoLeite_,,,45,1746,Thu Aug 19 2021 20:27:17 GMT-0300 (Brasilia Standard Time),Fri Jul 16 2021 13:37:39 GMT-0300 (Brasilia Standard Time)
"A @cpflenergia venceu o leilão de privatização da CEEE-T, realizado na manhã de hoje, aqui em São Paulo. Com uma pr… https://t.co/cZz80zaE2D",123891446,,,123891446,EduardoLeite_,,,39,1276,Thu Aug 19 2021 20:27:17 GMT-0300 (Brasilia Standard Time),Fri Jul 16 2021 12:07:19 GMT-0300 (Brasilia Standard Time)
"Instalamos agora um Comitê de Contingência, que ficará sob a coordenação do vice-governador e secretário da Seguran… https://t.co/Gmq99jgnzu",123891446,,,123891446,EduardoLeite_,,,17,217,Thu Aug 19 2021 20:27:17 GMT-0300 (Brasilia Standard Time),Thu Jul 15 2021 18:29:31 GMT-0300 (Brasilia Standard Time)
Chamei o vice-governador @DelegadoRanolfo e secretários para uma reunião de atualização sobre o trágico incêndio no… https://t.co/5UBC8SruRa,123891446,,,123891446,EduardoLeite_,,,10,329,Thu Aug 19 2021 20:27:17 GMT-0300 (Brasilia Standard Time),Thu Jul 15 2021 17:36:09 GMT-0300 (Brasilia Standard Time)
"Viemos visitar a sede do 9º Batalhão da Brigada Militar, onde está funcionando provisoriamente o atendimento do 190… https://t.co/1Jf1OJQM20",123891446,,,123891446,EduardoLeite_,,,12,391,Thu Aug 19 2021 20:27:17 GMT-0300 (Brasilia Standard Time),Thu Jul 15 2021 11:52:08 GMT-0300 (Brasilia Standard Time)
"Por enquanto, sabemos que o incêndio começou no 4º andar do prédio. Mais de 70 servidores foram deslocados para o c… https://t.co/0vciJForXv",123891446,,,123891446,EduardoLeite_,,,4,189,Thu Aug 19 2021 20:27:17 GMT-0300 (Brasilia Standard Time),Thu Jul 15 2021 11:03:59 GMT-0300 (Brasilia Standard Time)
"O prédio da @ssp_rs tinha PPCI e, inclusive, o @governo_rs investiu R$ 1 milhão na expansão desse plano, p/ ampliar… https://t.co/7NNIy91bqc",123891446,,,123891446,EduardoLeite_,,,5,174,Thu Aug 19 2021 20:27:17 GMT-0300 (Brasilia Standard Time),Thu Jul 15 2021 11:03:58 GMT-0300 (Brasilia Standard Time)
Estamos trabalhando p/ q ñ haja dissolução de continuidade dos serviços da @ssp_rs. Já demos solução emergencial p/… https://t.co/v9BBvpBTmj,123891446,,,123891446,EduardoLeite_,,,2,82,Thu Aug 19 2021 20:27:17 GMT-0300 (Brasilia Standard Time),Thu Jul 15 2021 11:03:58 GMT-0300 (Brasilia Standard Time)
As características construtivas do prédio tornaram difícil o combate ao incêndio. Não há indícios de que tenha sido… https://t.co/z5N98MaNxg,123891446,,,123891446,EduardoLeite_,,,4,92,Thu Aug 19 2021 20:27:17 GMT-0300 (Brasilia Standard Time),Thu Jul 15 2021 11:03:57 GMT-0300 (Brasilia Standard Time)
"Como já dissemos, é um dia triste para o @governo_rs. Todo nosso foco está na busca dos dois bombeiros desaparecido… https://t.co/BAJC59yhir",123891446,,,123891446,EduardoLeite_,,,24,707,Thu Aug 19 2021 20:27:17 GMT-0300 (Brasilia Standard Time),Thu Jul 15 2021 11:03:57 GMT-0300 (Brasilia Standard Time)
"Em seguida, o vice-governador @DelegadoRanolfo, o coronel Bonfanti e eu, além de demais chefes das forças de segura… https://t.co/yL5lwyYc8t",123891446,,,123891446,EduardoLeite_,,,9,86,Thu Aug 19 2021 20:27:17 GMT-0300 (Brasilia Standard Time),Thu Jul 15 2021 10:14:34 GMT-0300 (Brasilia Standard Time)
"Estou acompanhando os trabalhos das nossas equipes no combate ao incêndio no prédio da SSP, com prioridade absoluta… https://t.co/5TidPv2tZd",123891446,,,123891446,EduardoLeite_,,,14,292,Thu Aug 19 2021 20:27:17 GMT-0300 (Brasilia Standard Time),Thu Jul 15 2021 10:01:41 GMT-0300 (Brasilia Standard Time)
"Reunimos o gabinete de crise para traçarmos as estratégias que serão tomadas daqui pra frente, como a alocação dos… https://t.co/5p4nfaQB6t",123891446,,,123891446,EduardoLeite_,,,11,307,Thu Aug 19 2021 20:27:17 GMT-0300 (Brasilia Standard Time),Thu Jul 15 2021 09:55:10 GMT-0300 (Brasilia Standard Time)
"Estamos acompanhando o trabalho que foi feito pelas nossas equipes, mas a prioridade absoluta é buscar os dois serv… https://t.co/dWQxtYcaJw",123891446,,,123891446,EduardoLeite_,,,20,610,Thu Aug 19 2021 20:27:17 GMT-0300 (Brasilia Standard Time),Thu Jul 15 2021 09:33:49 GMT-0300 (Brasilia Standard Time)
"Já na @ssp_rs, em contato com as equipes que seguem trabalhando para controlar o fogo. Todo meu agradecimento a ess… https://t.co/LhFLcHJ2lt",123891446,,,123891446,EduardoLeite_,,,15,378,Thu Aug 19 2021 20:27:17 GMT-0300 (Brasilia Standard Time),Thu Jul 15 2021 08:57:35 GMT-0300 (Brasilia Standard Time)
Acabo de desembarcar em Porto Alegre. Já estou em contato com o @DelegadoRanolfo e me deslocando para o prédio da… https://t.co/s3qPIB3l5F,123891446,,,123891446,EduardoLeite_,,,21,873,Thu Aug 19 2021 20:27:17 GMT-0300 (Brasilia Standard Time),Thu Jul 15 2021 08:49:28 GMT-0300 (Brasilia Standard Time)
"Naturalmente, as perícias serão feitas no sentido de apurar as causas do incêndio. Nossa equipe de governo trabalha… https://t.co/6D02lKuUIv",123891446,,,123891446,EduardoLeite_,,,19,875,Thu Aug 19 2021 20:27:17 GMT-0300 (Brasilia Standard Time),Wed Jul 14 2021 23:33:37 GMT-0300 (Brasilia Standard Time)
"Estou retornando a Porto Alegre, para acompanhar o terrível incêndio que consumiu o prédio sede da SSP. O vice-gove… https://t.co/GNUbTynk5x",123891446,,,123891446,EduardoLeite_,,,78,2575,Thu Aug 19 2021 20:27:17 GMT-0300 (Brasilia Standard Time),Wed Jul 14 2021 23:33:37 GMT-0300 (Brasilia Standard Time)
"Agora estou também no TikTok. Vou mostrar o meu trabalho, as minhas ideias e a minha vida de forma descontraída nes… https://t.co/kYaf6i1cNv",123891446,,,123891446,EduardoLeite_,,,52,2280,Thu Aug 19 2021 20:27:17 GMT-0300 (Brasilia Standard Time),Tue Jul 13 2021 21:46:38 GMT-0300 (Brasilia Standard Time)
"Com alegria, informo que os salários dos servidores serão pagos em dia até dezembro! Com as contas mais ajustadas,… https://t.co/cGb5ts6Bze",123891446,,,123891446,EduardoLeite_,,,47,1650,Thu Aug 19 2021 20:27:17 GMT-0300 (Brasilia Standard Time),Tue Jul 13 2021 19:38:57 GMT-0300 (Brasilia Standard Time)
"No nosso cronograma original, a previsão era de que eu seria vacinado na primeira semana de agosto. Mas a vacinação… https://t.co/y1A9HVolid",123891446,,,123891446,EduardoLeite_,,,240,11869,Thu Aug 19 2021 20:27:17 GMT-0300 (Brasilia Standard Time),Tue Jul 13 2021 12:52:02 GMT-0300 (Brasilia Standard Time)
O RS esteve por muitas semanas na liderança nas duas doses. Os colegas @jdoriajr e @Reinaldo45psdb apertaram o pass… https://t.co/orp6GYVY5s,123891446,,,123891446,EduardoLeite_,,,140,3127,Thu Aug 19 2021 20:27:17 GMT-0300 (Brasilia Standard Time),Sun Jul 11 2021 23:47:57 GMT-0300 (Brasilia Standard Time)
https://t.co/ODJezouwKg,123891446,,,123891446,EduardoLeite_,,,19,506,Thu Aug 19 2021 20:27:17 GMT-0300 (Brasilia Standard Time),Sun Jul 11 2021 20:54:10 GMT-0300 (Brasilia Standard Time)
"A nossa causa é a promoção da igualdade, do respeito e da tolerância. Confere algumas das ações promovidas pelo… https://t.co/lwWbGDIEzp",123891446,,,123891446,EduardoLeite_,,,54,1194,Thu Aug 19 2021 20:27:17 GMT-0300 (Brasilia Standard Time),Sun Jul 11 2021 20:53:45 GMT-0300 (Brasilia Standard Time)
Eu votei em Bolsonaro em 18 e admito que errei. A manifestante detida hoje admite que se excedeu. E confio que aque… https://t.co/VclCGGJYT1,123891446,,,123891446,EduardoLeite_,,,311,4144,Thu Aug 19 2021 20:27:17 GMT-0300 (Brasilia Standard Time),Sun Jul 11 2021 00:16:03 GMT-0300 (Brasilia Standard Time)
"E que, com a vacinação avançando, nossas rodas de sambas voltem com força! https://t.co/0VFdT4sWx1",123891446,,,123891446,EduardoLeite_,,,127,4167,Thu Aug 19 2021 20:27:17 GMT-0300 (Brasilia Standard Time),Sat Jul 10 2021 20:43:40 GMT-0300 (Brasilia Standard Time)
@traumann No estado democrático de direito que defendemos não há espaço para punição sumária. O Estado do RS irá ap… https://t.co/6fqzhARvP6,123891446,,,123891446,EduardoLeite_,,,18,473,Thu Aug 19 2021 20:27:17 GMT-0300 (Brasilia Standard Time),Sat Jul 10 2021 15:38:31 GMT-0300 (Brasilia Standard Time)
O Estado irá apurar com rigor as condições em que se deu o recolhimento de manifestante hoje em Porto Alegre. https://t.co/UHoVv89TgO,123891446,,,123891446,EduardoLeite_,,,73,1095,Thu Aug 19 2021 20:27:17 GMT-0300 (Brasilia Standard Time),Sat Jul 10 2021 15:33:37 GMT-0300 (Brasilia Standard Time)
"A mulher foi contida por policiais femininas no local e conduzida à delegacia. Foi o único incidente registrado, on… https://t.co/PP4kOasbP0",123891446,,,123891446,EduardoLeite_,,,36,844,Thu Aug 19 2021 20:27:17 GMT-0300 (Brasilia Standard Time),Sat Jul 10 2021 15:19:21 GMT-0300 (Brasilia Standard Time)
"Relatos são que a manifestante foi abordada e solicitada por diversas vezes a se afastar do leito da via, de forma… https://t.co/Kh8CJy4fhf",123891446,,,123891446,EduardoLeite_,,,37,714,Thu Aug 19 2021 20:27:17 GMT-0300 (Brasilia Standard Time),Sat Jul 10 2021 15:19:21 GMT-0300 (Brasilia Standard Time)
A Brigada Militar atuou hoje para garantir a ordem e a segurança a manifestantes de ambos os lados - como pode ser… https://t.co/CA7oyp0dPb,123891446,,,123891446,EduardoLeite_,,,152,1783,Thu Aug 19 2021 20:27:17 GMT-0300 (Brasilia Standard Time),Sat Jul 10 2021 15:19:20 GMT-0300 (Brasilia Standard Time)
"Dica pro FDS: a nova música de @JorgeDrexler 
Haveremos de vencer o ódio covarde com a coragem do amor.… https://t.co/ueAdrUSqDL",123891446,,,123891446,EduardoLeite_,,,51,920,Thu Aug 19 2021 20:27:17 GMT-0300 (Brasilia Standard Time),Sat Jul 10 2021 12:04:20 GMT-0300 (Brasilia Standard Time)
"@BetoAlbuquerque Meus sentimentos, amigo @BetoAlbuquerque, pela perda dos seus pais para essa doença maldita. Que t… https://t.co/vAAZKPjxrE",123891446,,,123891446,EduardoLeite_,,,5,718,Thu Aug 19 2021 20:27:17 GMT-0300 (Brasilia Standard Time),Fri Jul 09 2021 21:59:06 GMT-0300 (Brasilia Standard Time)
@felipeneto Tratar o arrependimento do voto dado em outras circunstâncias e chamar isso de “APOIO ao presidente na… https://t.co/H7oRe8Tjkc,123891446,,,123891446,EduardoLeite_,,,27,1289,Thu Aug 19 2021 20:27:17 GMT-0300 (Brasilia Standard Time),Fri Jul 09 2021 20:10:00 GMT-0300 (Brasilia Standard Time)
