text,query,country,city,userId,username,quote_count,reply_count,retweet_count,favorite_count,timestamp,createdAt
"A preservação ambiental é um dos principais desafios para o nosso País, ao lado da educação e inovação tecnológica.… https://t.co/WljIzgICS1",123891446,,,123891446,EduardoLeite_,,,5,188,Thu Aug 19 2021 20:27:17 GMT-0300 (Brasilia Standard Time),Fri Jul 30 2021 18:11:53 GMT-0300 (Brasilia Standard Time)
"Importante encontro, nesta tarde, entre a coalizão Governadores pelo Clima e o enviado especial para o clima dos EU… https://t.co/9pgop2N4zR",123891446,,,123891446,EduardoLeite_,,,19,506,Thu Aug 19 2021 20:27:17 GMT-0300 (Brasilia Standard Time),Fri Jul 30 2021 18:11:52 GMT-0300 (Brasilia Standard Time)
Vem ajudar a esquentar o corpo e o coração de alguém que está precisando muito. Te esperamos em frente ao Palácio P… https://t.co/nit0XOv7Iz,123891446,,,123891446,EduardoLeite_,,,31,284,Thu Aug 19 2021 20:27:17 GMT-0300 (Brasilia Standard Time),Fri Jul 30 2021 10:35:14 GMT-0300 (Brasilia Standard Time)
Triste momento para a cultura brasileira com a queima da história da televisão e do cinema nacional na Cinemateca.… https://t.co/lcaLpUZWpy,123891446,,,123891446,EduardoLeite_,,,82,1917,Thu Aug 19 2021 20:27:17 GMT-0300 (Brasilia Standard Time),Thu Jul 29 2021 22:16:29 GMT-0300 (Brasilia Standard Time)
"Entre uma reunião e outra, uma parada pra ver esse momento histórico pro esporte e pra ginástica do nosso Brasil! P… https://t.co/8UrrQf9yBE",123891446,,,123891446,EduardoLeite_,,,29,1894,Thu Aug 19 2021 20:27:17 GMT-0300 (Brasilia Standard Time),Thu Jul 29 2021 10:01:31 GMT-0300 (Brasilia Standard Time)
"Parabéns, Mayra Aguiar, uma lutadora, a terceira medalha para o Rio Grande do Sul! Como disseste depois da luta: “a… https://t.co/4ZXz7Qc3Zh",123891446,,,123891446,EduardoLeite_,,,37,2091,Thu Aug 19 2021 20:27:17 GMT-0300 (Brasilia Standard Time),Thu Jul 29 2021 08:05:35 GMT-0300 (Brasilia Standard Time)
Este é o Brasil que está aí. E não vamos resolver o que “tá aí” com o que “já foi”. É hora de fazer o país que pode… https://t.co/Jr6jFwzphy,123891446,,,123891446,EduardoLeite_,,,84,1360,Thu Aug 19 2021 20:27:17 GMT-0300 (Brasilia Standard Time),Wed Jul 28 2021 22:26:45 GMT-0300 (Brasilia Standard Time)
"Vamos manter e ampliar fortemente esse programa, liberando mais recursos para que possamos atender à demanda de out… https://t.co/4iuaYxq73v",123891446,,,123891446,EduardoLeite_,,,4,64,Thu Aug 19 2021 20:27:17 GMT-0300 (Brasilia Standard Time),Wed Jul 28 2021 18:36:59 GMT-0300 (Brasilia Standard Time)
"Entregamos hoje uma linha de distribuição trifásica de energia elétrica. Outras duas já estão prontas, em Santo Ant… https://t.co/kjdfIJ8uVk",123891446,,,123891446,EduardoLeite_,,,2,76,Thu Aug 19 2021 20:27:17 GMT-0300 (Brasilia Standard Time),Wed Jul 28 2021 18:36:58 GMT-0300 (Brasilia Standard Time)
Não é só em infraestrutura viária que estamos avançando! Acabamos de inaugurar a primeira obra do programa Energia… https://t.co/U4U2j6bxK5,123891446,,,123891446,EduardoLeite_,,,7,262,Thu Aug 19 2021 20:27:17 GMT-0300 (Brasilia Standard Time),Wed Jul 28 2021 17:49:17 GMT-0300 (Brasilia Standard Time)
"Outra grande notícia para Passo Fundo. Vamos destinar R$ 9,1 milhões para o Hospital Beneficente Dr. César Santos.… https://t.co/CbmVJOQW4u",123891446,,,123891446,EduardoLeite_,,,10,167,Thu Aug 19 2021 20:27:17 GMT-0300 (Brasilia Standard Time),Wed Jul 28 2021 13:35:21 GMT-0300 (Brasilia Standard Time)
"Foi assim, com trabalho, que construíram sua história e sua grandeza. Parabéns e obrigado aos nossos agricultores. Vocês são o Brasil!",123891446,,,123891446,EduardoLeite_,,,6,668,Thu Aug 19 2021 20:27:17 GMT-0300 (Brasilia Standard Time),Wed Jul 28 2021 12:43:53 GMT-0300 (Brasilia Standard Time)
Será essa a melhor ferramenta para representar o agricultor brasileiro? Será dessa forma que nosso agronegócio quer… https://t.co/W4oAwaMWno,123891446,,,123891446,EduardoLeite_,,,157,3603,Thu Aug 19 2021 20:27:17 GMT-0300 (Brasilia Standard Time),Wed Jul 28 2021 12:43:52 GMT-0300 (Brasilia Standard Time)
"É uma alegria estar em Passo Fundo e anunciar que faremos o repasse de R$ 5,8 milhões para as obras de ampliação do… https://t.co/WhdO1e6qYL",123891446,,,123891446,EduardoLeite_,,,5,259,Thu Aug 19 2021 20:27:17 GMT-0300 (Brasilia Standard Time),Wed Jul 28 2021 12:07:11 GMT-0300 (Brasilia Standard Time)
"Visitei há pouco as obras do Aeroporto Lauro Kortz, em Passo Fundo. São investidos R$ 49 milhões na ampliação e mod… https://t.co/630FCLpByI",123891446,,,123891446,EduardoLeite_,,,8,272,Thu Aug 19 2021 20:27:17 GMT-0300 (Brasilia Standard Time),Wed Jul 28 2021 10:45:16 GMT-0300 (Brasilia Standard Time)
A nossa judoca Maria Portela honrou as bandeiras gaúcha e brasileira com o suor e as lágrimas de quem não foge à lu… https://t.co/zkhG5aEOJb,123891446,,,123891446,EduardoLeite_,,,61,1716,Thu Aug 19 2021 20:27:17 GMT-0300 (Brasilia Standard Time),Wed Jul 28 2021 01:40:25 GMT-0300 (Brasilia Standard Time)
Minha solidariedade à população afetada pela chuva de granizo desta madrugada. A @defesacivildors segue atendendo a… https://t.co/yskfZH9w2z,123891446,,,123891446,EduardoLeite_,,,7,371,Thu Aug 19 2021 20:27:17 GMT-0300 (Brasilia Standard Time),Tue Jul 27 2021 13:33:53 GMT-0300 (Brasilia Standard Time)
Mais uma medalha gaúcha nas olimpíadas de Tóquio! Parabéns Fernando Scheffer pelo bronze nos 200m livre!! Orgulho p… https://t.co/O2p6CmOyc9,123891446,,,123891446,EduardoLeite_,,,151,5959,Thu Aug 19 2021 20:27:17 GMT-0300 (Brasilia Standard Time),Mon Jul 26 2021 22:58:59 GMT-0300 (Brasilia Standard Time)
"Uma grande onda de frio está chegando ao RS e, mais do que nunca, é hora de estender a mão ao próximo. A Campanha d… https://t.co/NpRgZCRpy3",123891446,,,123891446,EduardoLeite_,,,55,435,Thu Aug 19 2021 20:27:17 GMT-0300 (Brasilia Standard Time),Mon Jul 26 2021 19:09:38 GMT-0300 (Brasilia Standard Time)
"Que demais!!! @Rayssa_Leal_Sk8 , 13 anos, fazendo a semana dos brasileiros começar com enorme alegria! Parabéns e o… https://t.co/4XCE5BQL8U",123891446,,,123891446,EduardoLeite_,,,83,3402,Thu Aug 19 2021 20:27:17 GMT-0300 (Brasilia Standard Time),Mon Jul 26 2021 01:46:19 GMT-0300 (Brasilia Standard Time)
"Parabéns, @dadscargnin, pela medalha em tua primeira olimpíada! Um orgulho para o RS! Acreditamos na capacidade de… https://t.co/iSHf0atEif",123891446,,,123891446,EduardoLeite_,,,52,2726,Thu Aug 19 2021 20:27:17 GMT-0300 (Brasilia Standard Time),Sun Jul 25 2021 09:04:01 GMT-0300 (Brasilia Standard Time)
"Pavimentando uma vida melhor! Alegria em ver como podemos tocar nas vidas das pessoas, em nossas andanças na Zona S… https://t.co/Qz3yeQca9x",123891446,,,123891446,EduardoLeite_,,,9,364,Thu Aug 19 2021 20:27:17 GMT-0300 (Brasilia Standard Time),Sat Jul 24 2021 18:20:00 GMT-0300 (Brasilia Standard Time)
"Conheci a Dona Eloína num momento muito especial. Ela foi uma das primeiras vacinadas contra a Covid-19, em 18 de j… https://t.co/QSu5lR5Bjy",123891446,,,123891446,EduardoLeite_,,,15,527,Thu Aug 19 2021 20:27:17 GMT-0300 (Brasilia Standard Time),Sat Jul 24 2021 15:44:13 GMT-0300 (Brasilia Standard Time)
"Vistoriei também as obras de acesso asfáltico ao município de Cerrito, na ERS-706. Mais um investimento do nosso Pl… https://t.co/png9Isr2n2",123891446,,,123891446,EduardoLeite_,,,2,121,Thu Aug 19 2021 20:27:17 GMT-0300 (Brasilia Standard Time),Fri Jul 23 2021 18:19:55 GMT-0300 (Brasilia Standard Time)
"Em Piratini, celebramos uma ponte que muda a realidade do município. Investimos mais de R$ 7 milhões na estrutura,… https://t.co/xXNuRoCleK",123891446,,,123891446,EduardoLeite_,,,13,286,Thu Aug 19 2021 20:27:17 GMT-0300 (Brasilia Standard Time),Fri Jul 23 2021 18:19:55 GMT-0300 (Brasilia Standard Time)
"Turismo se faz com um conjunto de ações em que o turista se sinta feliz, confortável e tenha o desejo de voltar. Is… https://t.co/XSCa6qw7Yf",123891446,,,123891446,EduardoLeite_,,,3,80,Thu Aug 19 2021 20:27:17 GMT-0300 (Brasilia Standard Time),Fri Jul 23 2021 16:39:00 GMT-0300 (Brasilia Standard Time)
Os convênios estão relacionados principalmente à sinalização viária e turística dos municípios. A região Costa Doce… https://t.co/bZevYWZUgr,123891446,,,123891446,EduardoLeite_,,,1,78,Thu Aug 19 2021 20:27:17 GMT-0300 (Brasilia Standard Time),Fri Jul 23 2021 16:39:00 GMT-0300 (Brasilia Standard Time)
"Ainda em Pelotas, assinamos sete convênios da Consulta Popular do Turismo do Corede Sul, contemplando as cidades de… https://t.co/BlKJEVZKtL",123891446,,,123891446,EduardoLeite_,,,4,224,Thu Aug 19 2021 20:27:17 GMT-0300 (Brasilia Standard Time),Fri Jul 23 2021 16:38:59 GMT-0300 (Brasilia Standard Time)
"Visitei hoje pela manhã, ao lado da prefeita @paulaschild, o drive-thru da vacinação contra Covid-19 em Pelotas. É… https://t.co/ErOMbefXJQ",123891446,,,123891446,EduardoLeite_,,,9,324,Thu Aug 19 2021 20:27:17 GMT-0300 (Brasilia Standard Time),Fri Jul 23 2021 10:08:28 GMT-0300 (Brasilia Standard Time)
"Por fim, o @governo_rs e a prefeitura de Rio Grande assinaram um protocolo de intenções para a instalação de uma ag… https://t.co/F9WXqqybNa",123891446,,,123891446,EduardoLeite_,,,4,111,Thu Aug 19 2021 20:27:17 GMT-0300 (Brasilia Standard Time),Thu Jul 22 2021 22:08:12 GMT-0300 (Brasilia Standard Time)
"Além disso, acompanhei a assinatura do termo de cooperação entre a Portos RS e a prefeitura de Rio Grande para a re… https://t.co/azODoHQR1P",123891446,,,123891446,EduardoLeite_,,,5,130,Thu Aug 19 2021 20:27:17 GMT-0300 (Brasilia Standard Time),Thu Jul 22 2021 22:08:12 GMT-0300 (Brasilia Standard Time)
"Em Rio Grande, pude destacar a importância do ajuste fiscal que conduzimos durante a primeira metade da gestão. Só… https://t.co/7mf6CBJIOc",123891446,,,123891446,EduardoLeite_,,,9,292,Thu Aug 19 2021 20:27:17 GMT-0300 (Brasilia Standard Time),Thu Jul 22 2021 22:08:11 GMT-0300 (Brasilia Standard Time)
O investimento da Yara indica que é muito promissora a parceria entre empresas privadas e setor público com o objet… https://t.co/Q7PSAzoeQf,123891446,,,123891446,EduardoLeite_,,,1,125,Thu Aug 19 2021 20:27:17 GMT-0300 (Brasilia Standard Time),Thu Jul 22 2021 20:00:12 GMT-0300 (Brasilia Standard Time)
"Ainda em Rio Grande, participei da inauguração simbólica da nova linha de transmissão de energia da @YaraBrOficial.… https://t.co/caarrvJKUh",123891446,,,123891446,EduardoLeite_,,,6,217,Thu Aug 19 2021 20:27:17 GMT-0300 (Brasilia Standard Time),Thu Jul 22 2021 20:00:11 GMT-0300 (Brasilia Standard Time)
"Tudo isso depois de termos em 2021 o melhor primeiro semestre da história do Porto do Rio Grande, com uma movimenta… https://t.co/TYq3rpqFlr",123891446,,,123891446,EduardoLeite_,,,3,101,Thu Aug 19 2021 20:27:17 GMT-0300 (Brasilia Standard Time),Thu Jul 22 2021 19:00:22 GMT-0300 (Brasilia Standard Time)
"O projeto faz parte do programa transversal Avançar e pode atingir 434 lotes, 338 hectares com sistema viário impla… https://t.co/7FCacuHXpn",123891446,,,123891446,EduardoLeite_,,,2,96,Thu Aug 19 2021 20:27:17 GMT-0300 (Brasilia Standard Time),Thu Jul 22 2021 19:00:21 GMT-0300 (Brasilia Standard Time)
"Abri a série de compromissos no sul do RS com ótimas notícias. Em visita ao Tecon Rio Grande, conheci o projeto Rio… https://t.co/YJrqnmcreG",123891446,,,123891446,EduardoLeite_,,,12,312,Thu Aug 19 2021 20:27:17 GMT-0300 (Brasilia Standard Time),Thu Jul 22 2021 19:00:21 GMT-0300 (Brasilia Standard Time)
O RS está oficialmente de luto por três dias. Acabei de assinar o decreto. É uma justa e singela homenagem ao tenen… https://t.co/VdJdVIiC9F,123891446,,,123891446,EduardoLeite_,,,58,1772,Thu Aug 19 2021 20:27:17 GMT-0300 (Brasilia Standard Time),Thu Jul 22 2021 11:58:59 GMT-0300 (Brasilia Standard Time)
"Além da entrega física que tem início hoje e deverá ser concluída em até 8 meses, celebramos o acordo feito com… https://t.co/lbGCZNM6Rh",123891446,,,123891446,EduardoLeite_,,,4,89,Thu Aug 19 2021 20:27:17 GMT-0300 (Brasilia Standard Time),Thu Jul 22 2021 10:37:52 GMT-0300 (Brasilia Standard Time)
"Obra fundamental para acabar com a custódia de presos em viaturas, o Nugesp terá 708 vagas para pessoas detidas. Te… https://t.co/I4frmsAwjT",123891446,,,123891446,EduardoLeite_,,,5,96,Thu Aug 19 2021 20:27:17 GMT-0300 (Brasilia Standard Time),Thu Jul 22 2021 10:37:51 GMT-0300 (Brasilia Standard Time)
"Após muito diálogo, assinamos hoje a parceria entre o @governo_rs, demais Poderes e diversos órgãos para a construç… https://t.co/7abi5eR9rY",123891446,,,123891446,EduardoLeite_,,,12,226,Thu Aug 19 2021 20:27:17 GMT-0300 (Brasilia Standard Time),Thu Jul 22 2021 10:37:50 GMT-0300 (Brasilia Standard Time)
"Os bombeiros gaúchos deram um grande exemplo de lealdade, força e dedicação nas buscas aos colegas Deroci de Almeid… https://t.co/bNL4fWwRAf",123891446,,,123891446,EduardoLeite_,,,62,1609,Thu Aug 19 2021 20:27:17 GMT-0300 (Brasilia Standard Time),Thu Jul 22 2021 01:32:30 GMT-0300 (Brasilia Standard Time)
"O corpo do 2° sargento Lúcio Ubirajara de Freitas Munhós foi encontrado no final da noite desta quarta, 4 horas apó… https://t.co/liIPHOHMiT",123891446,,,123891446,EduardoLeite_,,,43,790,Thu Aug 19 2021 20:27:17 GMT-0300 (Brasilia Standard Time),Thu Jul 22 2021 00:55:28 GMT-0300 (Brasilia Standard Time)
"RT @governo_rs: ""Infelizmente tivemos a perda dum companheiro, um grande herói nosso. E nós vamos continuar trabalhando, pois é assim que e…",123891446,,,123891446,EduardoLeite_,,,27,0,Thu Aug 19 2021 20:27:17 GMT-0300 (Brasilia Standard Time),Wed Jul 21 2021 22:38:12 GMT-0300 (Brasilia Standard Time)
"RT @governo_rs: O vice-governador, @DelegadoRanolfo, agradece o imenso esforço do @CBM_RS nas buscas ao corpo do tenente Deroci de Almeida…",123891446,,,123891446,EduardoLeite_,,,10,0,Thu Aug 19 2021 20:27:17 GMT-0300 (Brasilia Standard Time),Wed Jul 21 2021 22:27:32 GMT-0300 (Brasilia Standard Time)
"Quero expressar à família do tenente Deroci de Almeida da Costa, ao Corpo de Bombeiros Militar, aos seus amigos e c… https://t.co/JDz8Vkt9R8",123891446,,,123891446,EduardoLeite_,,,22,465,Thu Aug 19 2021 20:27:17 GMT-0300 (Brasilia Standard Time),Wed Jul 21 2021 21:57:46 GMT-0300 (Brasilia Standard Time)
"Nossa gratidão, nossa homenagem e nossos pêsames aos familiares e amigos do tenente Almeida. Quero reforçar que o t… https://t.co/us8357TXRO",123891446,,,123891446,EduardoLeite_,,,15,811,Thu Aug 19 2021 20:27:17 GMT-0300 (Brasilia Standard Time),Wed Jul 21 2021 21:12:00 GMT-0300 (Brasilia Standard Time)
"Informamos que foi encontrado no começo da noite o corpo do primeiro-tenente Deroci de Almeida da Costa, em meio ao… https://t.co/JmzVbDQXqW",123891446,,,123891446,EduardoLeite_,,,53,2106,Thu Aug 19 2021 20:27:17 GMT-0300 (Brasilia Standard Time),Wed Jul 21 2021 21:12:00 GMT-0300 (Brasilia Standard Time)
A Dona Eloína Gonçalves Born foi uma das 5 primeiras pessoas vacinadas contra a Covid-19 no RS. Eu estava lá no Clí… https://t.co/v9bld2jydp,123891446,,,123891446,EduardoLeite_,,,33,1580,Thu Aug 19 2021 20:27:17 GMT-0300 (Brasilia Standard Time),Wed Jul 21 2021 16:47:13 GMT-0300 (Brasilia Standard Time)
"Parabéns @fabloisi, @fredtrajano
@alexandrebirman e @Gui_Benchimol pelo prêmio Executivo de Valor! 
4 provas vivas… https://t.co/jsJc5dwU4A",123891446,,,123891446,EduardoLeite_,,,7,184,Thu Aug 19 2021 20:27:17 GMT-0300 (Brasilia Standard Time),Wed Jul 21 2021 11:57:43 GMT-0300 (Brasilia Standard Time)
"@fabloisi
@fredtrajano
@alexandrebirman
@Gui_Benchimol parabéns pelo prêmio Executivo de Valor! 
4 provas vivas que… https://t.co/wqJcsC5Kol",123891446,,,123891446,EduardoLeite_,,,0,0,Thu Aug 19 2021 20:27:17 GMT-0300 (Brasilia Standard Time),Wed Jul 21 2021 10:10:31 GMT-0300 (Brasilia Standard Time)
Parabéns à jornalista @veramagalhaes por mostrar os arroubos autoritários de ambos os lados - Lula e Bolsonaro - qu… https://t.co/gNPmnnlMsv,123891446,,,123891446,EduardoLeite_,,,51,1146,Thu Aug 19 2021 20:27:17 GMT-0300 (Brasilia Standard Time),Wed Jul 21 2021 09:23:08 GMT-0300 (Brasilia Standard Time)
"Ao encerrar a agenda em Santa Cruz do Sul, recebemos a notícia de que a JTI investirá mais R$ 126 milhões na amplia… https://t.co/9yuj1dagAO",123891446,,,123891446,EduardoLeite_,,,9,307,Thu Aug 19 2021 20:27:17 GMT-0300 (Brasilia Standard Time),Tue Jul 20 2021 18:31:01 GMT-0300 (Brasilia Standard Time)
Estamos investindo em estrutura adequada para qualificação desses jovens a fim de garantirmos que voltem ao convívi… https://t.co/1j0ra3cA5A,123891446,,,123891446,EduardoLeite_,,,3,92,Thu Aug 19 2021 20:27:17 GMT-0300 (Brasilia Standard Time),Tue Jul 20 2021 17:57:18 GMT-0300 (Brasilia Standard Time)
"Visitei as obras do Centro de Atendimento Socioeducativo (Case) que está sendo erguido em Santa Cruz do Sul, com in… https://t.co/xWUKYi7qfm",123891446,,,123891446,EduardoLeite_,,,8,169,Thu Aug 19 2021 20:27:17 GMT-0300 (Brasilia Standard Time),Tue Jul 20 2021 17:57:17 GMT-0300 (Brasilia Standard Time)
"Precisamos que o sistema prisional cumpra sua missão, que é o duplo caráter da pena: o de restringir de liberdade e… https://t.co/mOKcQ4zpGZ",123891446,,,123891446,EduardoLeite_,,,7,149,Thu Aug 19 2021 20:27:17 GMT-0300 (Brasilia Standard Time),Tue Jul 20 2021 15:35:46 GMT-0300 (Brasilia Standard Time)
"Assinamos hoje, na @unisc, acordo de cooperação com a Associação Pró-Ensino em Santa Cruz do Sul (Apesc) para ofert… https://t.co/98hsVegwh0",123891446,,,123891446,EduardoLeite_,,,12,211,Thu Aug 19 2021 20:27:17 GMT-0300 (Brasilia Standard Time),Tue Jul 20 2021 15:35:45 GMT-0300 (Brasilia Standard Time)
"Ninguém chuta cachorro morto. Se não existe 3º via, não sei porque Lula e Bolsonaro estão se preocupando.
Depois do… https://t.co/3b0tgB8KTm",123891446,,,123891446,EduardoLeite_,,,807,10073,Thu Aug 19 2021 20:27:17 GMT-0300 (Brasilia Standard Time),Tue Jul 20 2021 14:10:31 GMT-0300 (Brasilia Standard Time)
"Dia histórico para o RS! Assinamos, em Sta Cruz do Sul, a 1ª concessão da nossa gestão. A RSC-287, ligação entre a… https://t.co/hHH0FdXjm8",123891446,,,123891446,EduardoLeite_,,,11,251,Thu Aug 19 2021 20:27:17 GMT-0300 (Brasilia Standard Time),Tue Jul 20 2021 14:04:49 GMT-0300 (Brasilia Standard Time)
Notícia boa: antecipamos de 20 para 7 de setembro a conclusão da aplicação da 1ª dose da vacina nos adultos. É hora… https://t.co/0tO5fNe9ck,123891446,,,123891446,EduardoLeite_,,,116,2655,Thu Aug 19 2021 20:27:17 GMT-0300 (Brasilia Standard Time),Tue Jul 20 2021 13:55:03 GMT-0300 (Brasilia Standard Time)
Só alcançamos este ritmo de vacinação devido à excelência do trabalho dos municípios. A premiação serve justamente… https://t.co/Qyegx9gy1t,123891446,,,123891446,EduardoLeite_,,,3,140,Thu Aug 19 2021 20:27:17 GMT-0300 (Brasilia Standard Time),Tue Jul 20 2021 11:02:57 GMT-0300 (Brasilia Standard Time)
O papel dos municípios é muito importante neste processo. O êxito da vacinação é resultado dessa combinação de agil… https://t.co/p0MNsvlrI1,123891446,,,123891446,EduardoLeite_,,,3,112,Thu Aug 19 2021 20:27:17 GMT-0300 (Brasilia Standard Time),Tue Jul 20 2021 11:02:56 GMT-0300 (Brasilia Standard Time)
O RS está sempre entre os primeiros Estados que vacinam no Brasil. É um orgulho para todos nós e fruto do esforço d… https://t.co/lKy1ifgzAw,123891446,,,123891446,EduardoLeite_,,,0,64,Thu Aug 19 2021 20:27:17 GMT-0300 (Brasilia Standard Time),Tue Jul 20 2021 11:02:56 GMT-0300 (Brasilia Standard Time)
"Parabéns aos prefeitos de Passo Fundo, Uruguaiana, Santa Rosa, São Borja, Tenente Portela, Arroio do Sal, Vila Flor… https://t.co/TBuLO1ovV7",123891446,,,123891446,EduardoLeite_,,,19,706,Thu Aug 19 2021 20:27:17 GMT-0300 (Brasilia Standard Time),Tue Jul 20 2021 11:02:55 GMT-0300 (Brasilia Standard Time)
O PSDB não faz prévias para não ter candidato; faz para ter o melhor candidato. Não faz prévias para ser o dono da… https://t.co/wilbD7TvBa,123891446,,,123891446,EduardoLeite_,,,15,865,Thu Aug 19 2021 20:27:17 GMT-0300 (Brasilia Standard Time),Tue Jul 20 2021 09:06:26 GMT-0300 (Brasilia Standard Time)
"O PSDB em 2022 fará o que é melhor para o Brasil, e não o que é melhor para o partido. Candidatura à presidência de… https://t.co/Ut6jnYonK3",123891446,,,123891446,EduardoLeite_,,,86,2640,Thu Aug 19 2021 20:27:17 GMT-0300 (Brasilia Standard Time),Tue Jul 20 2021 09:06:26 GMT-0300 (Brasilia Standard Time)
Aproveitamos para entregar as primeiras Carteiras de Identificação da Pessoa com Transtorno do Espectro Autista (Ci… https://t.co/QHQebC2TV8,123891446,,,123891446,EduardoLeite_,,,4,125,Thu Aug 19 2021 20:27:17 GMT-0300 (Brasilia Standard Time),Mon Jul 19 2021 16:25:12 GMT-0300 (Brasilia Standard Time)
"Serão alguns milhões anuais investidos pelo governo para ajudar a sustentar esse atendimento especializado e, assim… https://t.co/HyKallZeRY",123891446,,,123891446,EduardoLeite_,,,3,124,Thu Aug 19 2021 20:27:17 GMT-0300 (Brasilia Standard Time),Mon Jul 19 2021 16:25:11 GMT-0300 (Brasilia Standard Time)
"Além disso, vamos auxiliar na criação de 30 centros regionais de referência em autismo. Todas as prefeituras seleci… https://t.co/2zBcTC773L",123891446,,,123891446,EduardoLeite_,,,0,62,Thu Aug 19 2021 20:27:17 GMT-0300 (Brasilia Standard Time),Mon Jul 19 2021 16:25:11 GMT-0300 (Brasilia Standard Time)
19 de julho de 2021 é um marco para o RS em termos de inclusão. Oficializamos a criação dos primeiros centros de re… https://t.co/R0s8lddZVu,123891446,,,123891446,EduardoLeite_,,,27,584,Thu Aug 19 2021 20:27:17 GMT-0300 (Brasilia Standard Time),Mon Jul 19 2021 16:25:10 GMT-0300 (Brasilia Standard Time)
"Temos um olhar muito atento às prefeituras. Tudo o que puder ser feito para ajudar a melhorar os municípios vai, co… https://t.co/0rbwQfERRH",123891446,,,123891446,EduardoLeite_,,,3,73,Thu Aug 19 2021 20:27:17 GMT-0300 (Brasilia Standard Time),Mon Jul 19 2021 12:39:14 GMT-0300 (Brasilia Standard Time)
"Desde que foi possível equilibrarmos as contas, o Estado tem investido fortemente neste apoio aos municípios - lanç… https://t.co/UGplQj84jT",123891446,,,123891446,EduardoLeite_,,,4,90,Thu Aug 19 2021 20:27:17 GMT-0300 (Brasilia Standard Time),Mon Jul 19 2021 12:39:13 GMT-0300 (Brasilia Standard Time)
"Lançamos hoje, por meio do @Banrisul, o Programa de Financiamento Especial para o Setor Público. O banco disponibil… https://t.co/herQlmiroA",123891446,,,123891446,EduardoLeite_,,,7,194,Thu Aug 19 2021 20:27:17 GMT-0300 (Brasilia Standard Time),Mon Jul 19 2021 12:39:13 GMT-0300 (Brasilia Standard Time)
Parabéns Hospital de Clínicas de Porto Alegre pelos 50 anos! Graças ao excelente trabalho e à dedicação de seus fun… https://t.co/TzyKDLEfQv,123891446,,,123891446,EduardoLeite_,,,34,1068,Thu Aug 19 2021 20:27:17 GMT-0300 (Brasilia Standard Time),Mon Jul 19 2021 10:27:52 GMT-0300 (Brasilia Standard Time)
As buscas aos bombeiros desaparecidos no incêndio do prédio da @SSP_RS contam com o apoio de um grupo de engenheiro… https://t.co/VTsMz6vMoh,123891446,,,123891446,EduardoLeite_,,,15,440,Thu Aug 19 2021 20:27:17 GMT-0300 (Brasilia Standard Time),Sat Jul 17 2021 18:51:47 GMT-0300 (Brasilia Standard Time)
RT @governo_rs: As buscas aos bombeiros desaparecidos no incêndio do prédio da @SSP_RS prosseguem sem interrupção nessa madrugada. Estamos…,123891446,,,123891446,EduardoLeite_,,,18,0,Thu Aug 19 2021 20:27:17 GMT-0300 (Brasilia Standard Time),Sat Jul 17 2021 00:07:03 GMT-0300 (Brasilia Standard Time)
"Em Salvador, tive uma excelente conversa com @acmneto_, referência na boa política, que alia capacidade de articula… https://t.co/iDnMrLsvhO",123891446,,,123891446,EduardoLeite_,,,25,1550,Thu Aug 19 2021 20:27:17 GMT-0300 (Brasilia Standard Time),Fri Jul 16 2021 22:43:23 GMT-0300 (Brasilia Standard Time)
"Ao mesmo tempo que estamos muito felizes com o leilão da CEEE-T, estamos tristes e consternados com o incêndio no p… https://t.co/DorjNPvMzS",123891446,,,123891446,EduardoLeite_,,,9,251,Thu Aug 19 2021 20:27:17 GMT-0300 (Brasilia Standard Time),Fri Jul 16 2021 14:29:50 GMT-0300 (Brasilia Standard Time)
"Aqui não é discurso, é prática! Ação e  modernização do Estado. https://t.co/I922ypvCHZ",123891446,,,123891446,EduardoLeite_,,,115,2760,Thu Aug 19 2021 20:27:17 GMT-0300 (Brasilia Standard Time),Fri Jul 16 2021 13:52:21 GMT-0300 (Brasilia Standard Time)
Parabéns à @cpflenergia. Agradeço a vocês pela confiança que estão depositando novamente no Rio Grande do Sul. https://t.co/K60jDlfgdH,123891446,,,123891446,EduardoLeite_,,,8,297,Thu Aug 19 2021 20:27:17 GMT-0300 (Brasilia Standard Time),Fri Jul 16 2021 13:39:43 GMT-0300 (Brasilia Standard Time)
A economia que fizemos com ajuste de contas e modernização da receita permite que esses recursos sejam revertidos e… https://t.co/D8b5l2nfIb,123891446,,,123891446,EduardoLeite_,,,7,299,Thu Aug 19 2021 20:27:17 GMT-0300 (Brasilia Standard Time),Fri Jul 16 2021 13:37:40 GMT-0300 (Brasilia Standard Time)
Estamos modernizando o Estado pq há homens e mulheres que estão fazendo a lição de casa. Esse debate veio do govern… https://t.co/qovxwP8NDA,123891446,,,123891446,EduardoLeite_,,,5,226,Thu Aug 19 2021 20:27:17 GMT-0300 (Brasilia Standard Time),Fri Jul 16 2021 13:37:40 GMT-0300 (Brasilia Standard Time)
"O papel do setor público, nesta parceria com o setor privado, é o de regular, orientar e fiscalizar, e não o de ope… https://t.co/STCoF4PbIR",123891446,,,123891446,EduardoLeite_,,,5,291,Thu Aug 19 2021 20:27:17 GMT-0300 (Brasilia Standard Time),Fri Jul 16 2021 13:37:39 GMT-0300 (Brasilia Standard Time)
