text,query,country,city,userId,username,quote_count,reply_count,retweet_count,favorite_count,timestamp,createdAt
Populismo fiscal e a população paga a conta da inflação e da taxa de juros. https://t.co/jlYDOLOAiQ,35260027,,,35260027,RodrigoMaia,,,45,486,Mon Sep 20 2021 20:28:09 GMT-0300 (Brasilia Standard Time),Sat Aug 07 2021 18:59:22 GMT-0300 (Brasilia Standard Time)
E continua o populismo fiscal. https://t.co/Z6BmhSZ0Ox,35260027,,,35260027,RodrigoMaia,,,45,756,Mon Sep 20 2021 20:28:09 GMT-0300 (Brasilia Standard Time),Fri Aug 06 2021 21:15:03 GMT-0300 (Brasilia Standard Time)
Vale lembrar que por menos o STF já declarou a inconstitucionalidade de adiamento de precatórios. Em outras palavra… https://t.co/rwsv6bmAoc,35260027,,,35260027,RodrigoMaia,,,39,394,Mon Sep 20 2021 20:28:09 GMT-0300 (Brasilia Standard Time),Fri Aug 06 2021 20:34:10 GMT-0300 (Brasilia Standard Time)
"Na segunda-feira, o governo vai colocar em prática com a PEC dos precatórios o POPULISMO FISCAL, copiando o que oco… https://t.co/cRk9KIjgd4",35260027,,,35260027,RodrigoMaia,,,91,1044,Mon Sep 20 2021 20:28:09 GMT-0300 (Brasilia Standard Time),Fri Aug 06 2021 20:34:10 GMT-0300 (Brasilia Standard Time)
Vida que segue. A obsessão esotérica do Bolsonaro foi enterrada hoje pelo processo democrático. https://t.co/GInFvIaBgv,35260027,,,35260027,RodrigoMaia,,,532,11810,Mon Sep 20 2021 20:28:09 GMT-0300 (Brasilia Standard Time),Thu Aug 05 2021 21:14:46 GMT-0300 (Brasilia Standard Time)
"AUSTIN RATING. Registrem o nome da agência de risco. Depois ficam desmoralizados e não sabem o motivo. Aliás, quem… https://t.co/rd8AosOX4C",35260027,,,35260027,RodrigoMaia,,,49,335,Mon Sep 20 2021 20:28:09 GMT-0300 (Brasilia Standard Time),Wed Aug 04 2021 23:26:18 GMT-0300 (Brasilia Standard Time)
Isso é uma palhaçada. O sistema nunca foi invadido. https://t.co/slqm6boWbX,35260027,,,35260027,RodrigoMaia,,,546,6975,Mon Sep 20 2021 20:28:09 GMT-0300 (Brasilia Standard Time),Wed Aug 04 2021 21:35:05 GMT-0300 (Brasilia Standard Time)
Teto do Paulo Guedes 👇 https://t.co/KxXdcckQK0,35260027,,,35260027,RodrigoMaia,,,205,3498,Mon Sep 20 2021 20:28:09 GMT-0300 (Brasilia Standard Time),Wed Aug 04 2021 19:50:46 GMT-0300 (Brasilia Standard Time)
Vídeo agora com áudio.,35260027,,,35260027,RodrigoMaia,,,2,50,Mon Sep 20 2021 20:28:09 GMT-0300 (Brasilia Standard Time),Wed Aug 04 2021 19:09:06 GMT-0300 (Brasilia Standard Time)
"PRECATÓRIOS - Capítulo 2!

Paulo Guedes que no passado defendeu o uso das chamadas moedas “podres” nas privatizaçõe… https://t.co/maxIxiS3yi",35260027,,,35260027,RodrigoMaia,,,19,229,Mon Sep 20 2021 20:28:09 GMT-0300 (Brasilia Standard Time),Wed Aug 04 2021 19:06:58 GMT-0300 (Brasilia Standard Time)
"É um eterno “não-tenho-nada-ver-com-isso”. A Câmara precisa enfrentar a realidade como ela é, e não como o Bolsonaro acha que é.",35260027,,,35260027,RodrigoMaia,,,30,561,Mon Sep 20 2021 20:28:09 GMT-0300 (Brasilia Standard Time),Wed Aug 04 2021 09:34:18 GMT-0300 (Brasilia Standard Time)
"Querer proibir pesquisa de opinião em véspera de eleição é tentar fugir da realidade, tapar o sol com a peneira! Es… https://t.co/qzRAeMcrvL",35260027,,,35260027,RodrigoMaia,,,46,636,Mon Sep 20 2021 20:28:09 GMT-0300 (Brasilia Standard Time),Wed Aug 04 2021 09:34:17 GMT-0300 (Brasilia Standard Time)
"O bolsonarismo é um maquiador da realidade. Se existe um fato, inventa-se uma teoria qualquer. O debate inócuo do v… https://t.co/MpSISSDT5a",35260027,,,35260027,RodrigoMaia,,,249,3128,Mon Sep 20 2021 20:28:09 GMT-0300 (Brasilia Standard Time),Wed Aug 04 2021 09:34:17 GMT-0300 (Brasilia Standard Time)
@claudioangelo Não é verdade. O texto aprovado hoje evitou que o texto da grilagem defendido pelo governo Bolsonaro… https://t.co/F2EJQGhKWW,35260027,,,35260027,RodrigoMaia,,,2,62,Mon Sep 20 2021 20:28:09 GMT-0300 (Brasilia Standard Time),Tue Aug 03 2021 21:05:05 GMT-0300 (Brasilia Standard Time)
"2. A não entrada dessa despesa paga pelo Sistema S configura burla ao teto de gastos (NRF), já que essa despesa não… https://t.co/3ZXxudJVzy",35260027,,,35260027,RodrigoMaia,,,23,449,Mon Sep 20 2021 20:28:09 GMT-0300 (Brasilia Standard Time),Tue Aug 03 2021 13:28:27 GMT-0300 (Brasilia Standard Time)
"1. Pedalada por retirar do orçamento despesa que deveria constar, uma vez que é despesa da União, tanto que parte p… https://t.co/sl3AWZFdzn",35260027,,,35260027,RodrigoMaia,,,22,464,Mon Sep 20 2021 20:28:09 GMT-0300 (Brasilia Standard Time),Tue Aug 03 2021 13:28:27 GMT-0300 (Brasilia Standard Time)
"GRAVE! O relatório da MP 1045, dá forma como está, faz parecer que os recursos que serão usados do Sistema S não pa… https://t.co/ZrO7QrVCXU",35260027,,,35260027,RodrigoMaia,,,78,902,Mon Sep 20 2021 20:28:09 GMT-0300 (Brasilia Standard Time),Tue Aug 03 2021 13:28:27 GMT-0300 (Brasilia Standard Time)
"Com todo o respeito, o ministro da Economia enlouqueceu. Assim vai acabar desmoralizando de vez o país. https://t.co/F1ogrlWevj",35260027,,,35260027,RodrigoMaia,,,73,837,Mon Sep 20 2021 20:28:09 GMT-0300 (Brasilia Standard Time),Tue Aug 03 2021 11:59:32 GMT-0300 (Brasilia Standard Time)
Ministro Maílson tem razão. https://t.co/UMcLGx3cXc,35260027,,,35260027,RodrigoMaia,,,29,289,Mon Sep 20 2021 20:28:09 GMT-0300 (Brasilia Standard Time),Tue Aug 03 2021 09:38:04 GMT-0300 (Brasilia Standard Time)
O populismo fiscal vai criar uma pressão enorme na inflação e na taxa de juros. E quem vai pagar essa conta serão o… https://t.co/TZu8BekTjh,35260027,,,35260027,RodrigoMaia,,,39,403,Mon Sep 20 2021 20:28:09 GMT-0300 (Brasilia Standard Time),Mon Aug 02 2021 18:15:32 GMT-0300 (Brasilia Standard Time)
Uma péssima sinalização para um país que pretende estar entre as grandes economias do mundo.,35260027,,,35260027,RodrigoMaia,,,13,217,Mon Sep 20 2021 20:28:09 GMT-0300 (Brasilia Standard Time),Mon Aug 02 2021 15:34:18 GMT-0300 (Brasilia Standard Time)
"Só pra ver se entendemos: o ministro da Economia está propondo que o Brasil diga ao investidor, aqueles que acredit… https://t.co/QEMy41t7oS",35260027,,,35260027,RodrigoMaia,,,66,471,Mon Sep 20 2021 20:28:09 GMT-0300 (Brasilia Standard Time),Mon Aug 02 2021 15:34:17 GMT-0300 (Brasilia Standard Time)
Governo vai acabar com o teto de gastos. Previsão de pagamentos de precatórios está no anexo V da LDO.  Não há desc… https://t.co/xuilYCP0iH,35260027,,,35260027,RodrigoMaia,,,83,853,Mon Sep 20 2021 20:28:09 GMT-0300 (Brasilia Standard Time),Mon Aug 02 2021 07:42:05 GMT-0300 (Brasilia Standard Time)
"O governo que queria esconder o número das mortes por Covid, as vacinas e que impõe sigilo de 100 anos em tudo, ago… https://t.co/c4l7aHCHa8",35260027,,,35260027,RodrigoMaia,,,317,4650,Mon Sep 20 2021 20:28:09 GMT-0300 (Brasilia Standard Time),Sun Aug 01 2021 18:48:27 GMT-0300 (Brasilia Standard Time)
"Das 4 iniciativas citadas (PIX , duplicata eletrônica, cadastro positivo e open banking) duas foram construídas na… https://t.co/KpJcV0gjbX",35260027,,,35260027,RodrigoMaia,,,14,240,Mon Sep 20 2021 20:28:09 GMT-0300 (Brasilia Standard Time),Sun Aug 01 2021 17:26:42 GMT-0300 (Brasilia Standard Time)
A LGPD representou um grande avanço e precisamos continuar pensando em modernizar nossas leis para essa nova realid… https://t.co/kWwVtiGKd2,35260027,,,35260027,RodrigoMaia,,,4,57,Mon Sep 20 2021 20:28:09 GMT-0300 (Brasilia Standard Time),Sun Aug 01 2021 17:14:21 GMT-0300 (Brasilia Standard Time)
"A partir de hoje, depois de um período de adaptação, penalidades poderão ser aplicadas em razão de descumprimento d… https://t.co/Qm2w34aYOF",35260027,,,35260027,RodrigoMaia,,,5,72,Mon Sep 20 2021 20:28:09 GMT-0300 (Brasilia Standard Time),Sun Aug 01 2021 17:14:20 GMT-0300 (Brasilia Standard Time)
"Com ela, os brasileiros passaram a ter seus dados e sua privacidade protegidos por meio de uma legislação que coloc… https://t.co/v6ZNaKMscY",35260027,,,35260027,RodrigoMaia,,,3,30,Mon Sep 20 2021 20:28:09 GMT-0300 (Brasilia Standard Time),Sun Aug 01 2021 17:14:20 GMT-0300 (Brasilia Standard Time)
A data de hoje entrará na história para a proteção de dados pessoais no país. Aprovada em 2018 durante a minha gest… https://t.co/ceB2z2JmGi,35260027,,,35260027,RodrigoMaia,,,19,213,Mon Sep 20 2021 20:28:09 GMT-0300 (Brasilia Standard Time),Sun Aug 01 2021 17:14:20 GMT-0300 (Brasilia Standard Time)
"RT @traumann: “Guedes foi vendido como um liberal entre os bolsonaristas, mas nunca passou de um bolsonarista entre os liberais” ⁦@Bernardo…",35260027,,,35260027,RodrigoMaia,,,271,0,Mon Sep 20 2021 20:28:09 GMT-0300 (Brasilia Standard Time),Sun Aug 01 2021 11:53:05 GMT-0300 (Brasilia Standard Time)
O criminoso está enviando mensagens para os meus contatos se passando por mim pelo Telegram. Já entrei em contato c… https://t.co/sXL4SncSyR,35260027,,,35260027,RodrigoMaia,,,17,595,Mon Sep 20 2021 20:28:09 GMT-0300 (Brasilia Standard Time),Fri Jul 30 2021 22:27:22 GMT-0300 (Brasilia Standard Time)
Acabo de descobrir que o chip do meu telefone foi hackeado. Desconsiderem quaisquer mensagens que possam ser enviad… https://t.co/kyhXDcMwrS,35260027,,,35260027,RodrigoMaia,,,264,4403,Mon Sep 20 2021 20:28:09 GMT-0300 (Brasilia Standard Time),Fri Jul 30 2021 19:24:56 GMT-0300 (Brasilia Standard Time)
E pra serve o anexo V da LDO? Onde estão as causas judiciais que o governo pode perder e com previsão  de valores p… https://t.co/EJYV9FXIuq,35260027,,,35260027,RodrigoMaia,,,17,243,Mon Sep 20 2021 20:28:09 GMT-0300 (Brasilia Standard Time),Fri Jul 30 2021 18:46:14 GMT-0300 (Brasilia Standard Time)
Não é verdade. Apenas o governo federal está trabalhando para acabar com o órgão. O ministro esqueceu o acordo que… https://t.co/ag9M3d6VhJ,35260027,,,35260027,RodrigoMaia,,,53,509,Mon Sep 20 2021 20:28:09 GMT-0300 (Brasilia Standard Time),Fri Jul 30 2021 14:02:32 GMT-0300 (Brasilia Standard Time)
A minha posição sobre o voto democrático 👇 https://t.co/VDcvB3DQxO,35260027,,,35260027,RodrigoMaia,,,376,4273,Mon Sep 20 2021 20:28:09 GMT-0300 (Brasilia Standard Time),Thu Jul 29 2021 21:46:03 GMT-0300 (Brasilia Standard Time)
Bolsonaro acaba de criar emprego no governo dele!!!! Faltam apenas vagas para 20% de brasileiros: uma parte de dese… https://t.co/uup5jI4NUk,35260027,,,35260027,RodrigoMaia,,,204,2014,Mon Sep 20 2021 20:28:09 GMT-0300 (Brasilia Standard Time),Wed Jul 28 2021 18:34:32 GMT-0300 (Brasilia Standard Time)
Continuando no assunto do Imposto de Renda: daqui a pouco só serão punidos aqueles que pagam pela declaração simplificada.,35260027,,,35260027,RodrigoMaia,,,38,735,Mon Sep 20 2021 20:28:09 GMT-0300 (Brasilia Standard Time),Wed Jul 28 2021 16:02:57 GMT-0300 (Brasilia Standard Time)
"Pelo menos deveriam zerar a alíquota da CSLL e não reduzir a alíquota do IRPJ, assim não prejudicariam estados e municípios.",35260027,,,35260027,RodrigoMaia,,,9,164,Mon Sep 20 2021 20:28:09 GMT-0300 (Brasilia Standard Time),Wed Jul 28 2021 14:40:20 GMT-0300 (Brasilia Standard Time)
"Com o anúncio do presidente da Câmara de excluir o Simples da tributação do Projeto do IR, daqui a pouco também vão… https://t.co/4JWpcFDuFe",35260027,,,35260027,RodrigoMaia,,,50,663,Mon Sep 20 2021 20:28:09 GMT-0300 (Brasilia Standard Time),Wed Jul 28 2021 14:40:20 GMT-0300 (Brasilia Standard Time)
Um erro o governo brasileiro não valorizar e divulgar a decisão de investimento da Huawei no Brasil. Será a princip… https://t.co/qlZSW3CmMT,35260027,,,35260027,RodrigoMaia,,,116,1830,Mon Sep 20 2021 20:28:09 GMT-0300 (Brasilia Standard Time),Tue Jul 27 2021 20:17:27 GMT-0300 (Brasilia Standard Time)
Estive no ano passado num jantar na embaixada americana. O embaixador Todd Chapman disse que apresentaria as denúnc… https://t.co/mVErtrmtCQ,35260027,,,35260027,RodrigoMaia,,,35,620,Mon Sep 20 2021 20:28:09 GMT-0300 (Brasilia Standard Time),Tue Jul 27 2021 13:25:03 GMT-0300 (Brasilia Standard Time)
Bolsonaro tomou a decisão correta. Agora esperamos que a ANS seja mais ágil ao decidir sobre a inclusão ou não de n… https://t.co/foi0UJG1PT,35260027,,,35260027,RodrigoMaia,,,9,123,Mon Sep 20 2021 20:28:09 GMT-0300 (Brasilia Standard Time),Tue Jul 27 2021 07:30:17 GMT-0300 (Brasilia Standard Time)
Esta isenção vai ampliar ainda mais a distorção e reduzir a alíquota para as empresas do Simples. Vale ler o editor… https://t.co/6uDuNGLGn0,35260027,,,35260027,RodrigoMaia,,,10,104,Mon Sep 20 2021 20:28:09 GMT-0300 (Brasilia Standard Time),Mon Jul 26 2021 16:40:48 GMT-0300 (Brasilia Standard Time)
"Como a coordenação do SUS é do governo federal, Bolsonaro assume mais um crime. https://t.co/jONMpLL5Mt",35260027,,,35260027,RodrigoMaia,,,351,4182,Mon Sep 20 2021 20:28:09 GMT-0300 (Brasilia Standard Time),Sat Jul 24 2021 19:50:23 GMT-0300 (Brasilia Standard Time)
"Aliás, vamos pensar alto. Um profissional liberal que fature R$ 400 mil/ mês, no pior cenário, vai pagar 14% de imposto de renda.",35260027,,,35260027,RodrigoMaia,,,11,241,Mon Sep 20 2021 20:28:09 GMT-0300 (Brasilia Standard Time),Sat Jul 24 2021 09:47:46 GMT-0300 (Brasilia Standard Time)
Deixa ver se entendi. Quem vai escrever a proposta de isenção de profissionais liberais no projeto de IR é o advoga… https://t.co/92Vr8s9p9q,35260027,,,35260027,RodrigoMaia,,,52,614,Mon Sep 20 2021 20:28:09 GMT-0300 (Brasilia Standard Time),Sat Jul 24 2021 09:47:46 GMT-0300 (Brasilia Standard Time)
"Agora? Mas o impacto do projeto de IR só acontece em 2022 e 2023, se for aprovado. https://t.co/1iT0RkP9LI",35260027,,,35260027,RodrigoMaia,,,26,335,Mon Sep 20 2021 20:28:09 GMT-0300 (Brasilia Standard Time),Fri Jul 23 2021 20:44:31 GMT-0300 (Brasilia Standard Time)
Isso é fácil de resolver. Ele pode reduzir a alíquota da CBS de 12% para 5%. A mesma generosidade dele com os super… https://t.co/ADnm3eJVba,35260027,,,35260027,RodrigoMaia,,,23,381,Mon Sep 20 2021 20:28:09 GMT-0300 (Brasilia Standard Time),Fri Jul 23 2021 11:14:34 GMT-0300 (Brasilia Standard Time)
A confusão do IR e o abandono da CBS são as provas de que o governo só tem um assunto no tema tributário: a volta d… https://t.co/lKEF5hibM9,35260027,,,35260027,RodrigoMaia,,,43,582,Mon Sep 20 2021 20:28:09 GMT-0300 (Brasilia Standard Time),Thu Jul 22 2021 20:12:20 GMT-0300 (Brasilia Standard Time)
"E ela insiste em se repetir. Lá, um dos epicentros da crise que levou ao golpe foi a mudança no comando do Exército… https://t.co/EmNRgXjOMm",35260027,,,35260027,RodrigoMaia,,,79,1605,Mon Sep 20 2021 20:28:09 GMT-0300 (Brasilia Standard Time),Thu Jul 22 2021 09:34:38 GMT-0300 (Brasilia Standard Time)
O Brasil espera uma manifestação do ministro da Defesa e dos comandantes das Forças Armadas sobre a grave reportage… https://t.co/CVVeRcOZjz,35260027,,,35260027,RodrigoMaia,,,419,6210,Mon Sep 20 2021 20:28:09 GMT-0300 (Brasilia Standard Time),Thu Jul 22 2021 09:34:37 GMT-0300 (Brasilia Standard Time)
Alguém poderia me dar um exemplo de alguma coisa boa que o Onyx fez à frente da Casa Civil e do Ministério da Cidad… https://t.co/bLWQIZQkF6,35260027,,,35260027,RodrigoMaia,,,725,13004,Mon Sep 20 2021 20:28:09 GMT-0300 (Brasilia Standard Time),Wed Jul 21 2021 15:42:44 GMT-0300 (Brasilia Standard Time)
Perder parte do ministério para o Onyx é uma humilhação. https://t.co/LLNGZPvk9c,35260027,,,35260027,RodrigoMaia,,,481,5306,Mon Sep 20 2021 20:28:09 GMT-0300 (Brasilia Standard Time),Wed Jul 21 2021 15:11:07 GMT-0300 (Brasilia Standard Time)
Deputado @marceloramosam tem razão https://t.co/9LMlod63mz,35260027,,,35260027,RodrigoMaia,,,51,582,Mon Sep 20 2021 20:28:09 GMT-0300 (Brasilia Standard Time),Tue Jul 20 2021 11:38:58 GMT-0300 (Brasilia Standard Time)
Vamos aguardar a sanção da LDO pra ver se o presidente Bolsonaro está falando a verdade ou apenas tentando transfer… https://t.co/CNLSMAOWMm,35260027,,,35260027,RodrigoMaia,,,168,1835,Mon Sep 20 2021 20:28:09 GMT-0300 (Brasilia Standard Time),Sun Jul 18 2021 13:25:21 GMT-0300 (Brasilia Standard Time)
"@BolsonaroSP Já a TV Globo, agora vai ganhar mais dinheiro, pois só vai contratar os jogos com maior audiência.",35260027,,,35260027,RodrigoMaia,,,8,435,Mon Sep 20 2021 20:28:09 GMT-0300 (Brasilia Standard Time),Thu Jul 15 2021 15:21:23 GMT-0300 (Brasilia Standard Time)
"@BolsonaroSP Deputado, este projeto não prejudica a TV Globo e, sim, os médios e pequenos clubes. Uma pena a visão… https://t.co/LxY70KGwZ3",35260027,,,35260027,RodrigoMaia,,,17,844,Mon Sep 20 2021 20:28:09 GMT-0300 (Brasilia Standard Time),Thu Jul 15 2021 15:21:12 GMT-0300 (Brasilia Standard Time)
Não é hora de o Congresso tratar do aumento do valor do fundo eleitoral. Estamos vivendo uma pandemia com recorde d… https://t.co/AZ6aDlFBFY,35260027,,,35260027,RodrigoMaia,,,46,628,Mon Sep 20 2021 20:28:09 GMT-0300 (Brasilia Standard Time),Thu Jul 15 2021 15:07:22 GMT-0300 (Brasilia Standard Time)
Contabilidade criativa.,35260027,,,35260027,RodrigoMaia,,,8,205,Mon Sep 20 2021 20:28:09 GMT-0300 (Brasilia Standard Time),Thu Jul 15 2021 11:08:19 GMT-0300 (Brasilia Standard Time)
O governo vai burlar a LRF para viabilizar o Bolsa Família. https://t.co/UXAyurcPv5,35260027,,,35260027,RodrigoMaia,,,62,507,Mon Sep 20 2021 20:28:09 GMT-0300 (Brasilia Standard Time),Thu Jul 15 2021 10:39:11 GMT-0300 (Brasilia Standard Time)
Olha o tamanho da confusão. O relator do PL do Imposto de Renda usa o projeto do PIS/Cofins pra fechar a conta. https://t.co/pNw8rBvJA5,35260027,,,35260027,RodrigoMaia,,,26,274,Mon Sep 20 2021 20:28:09 GMT-0300 (Brasilia Standard Time),Tue Jul 13 2021 19:03:26 GMT-0300 (Brasilia Standard Time)
"Com a sanção, o presidente Bolsonaro acaba de transferir uma conta de R$ 84 BILHÕES para os consumidores de energia. https://t.co/T3m0zjz2XB",35260027,,,35260027,RodrigoMaia,,,193,963,Mon Sep 20 2021 20:28:09 GMT-0300 (Brasilia Standard Time),Tue Jul 13 2021 13:19:41 GMT-0300 (Brasilia Standard Time)
Acabei de receber uma minuta do texto da relatora sobre a mudança do sistema eleitoral. O texto propõe a criação do… https://t.co/bJP7Yntd9a,35260027,,,35260027,RodrigoMaia,,,216,4226,Mon Sep 20 2021 20:28:09 GMT-0300 (Brasilia Standard Time),Mon Jul 12 2021 19:02:05 GMT-0300 (Brasilia Standard Time)
"Hoje, acrescentou à lista de ataques a urna eletrônica e o presidente do TSE porque sabe que a derrota é inevitável… https://t.co/EcuMe19pjZ",35260027,,,35260027,RodrigoMaia,,,147,3353,Mon Sep 20 2021 20:28:09 GMT-0300 (Brasilia Standard Time),Sat Jul 10 2021 16:31:15 GMT-0300 (Brasilia Standard Time)
"Bolsonaro é um covarde. Sempre foi um pusilânime. Em 2018, atacava homossexuais, mulheres e qualquer um que pensasse diferente.",35260027,,,35260027,RodrigoMaia,,,813,14403,Mon Sep 20 2021 20:28:09 GMT-0300 (Brasilia Standard Time),Sat Jul 10 2021 16:31:15 GMT-0300 (Brasilia Standard Time)
Chocante. Absurdo o advogado do presidente ameaçar uma jornalista. Minha solidariedade à Juliana Dal Piva. O ataque… https://t.co/NhUtkQmYJt,35260027,,,35260027,RodrigoMaia,,,414,5505,Mon Sep 20 2021 20:28:09 GMT-0300 (Brasilia Standard Time),Fri Jul 09 2021 21:41:17 GMT-0300 (Brasilia Standard Time)
"É um presidente com mentalidade infantil, cercado por aduladores que só reforçam os instintos infantis de quem não… https://t.co/qK7DFb4bRE",35260027,,,35260027,RodrigoMaia,,,77,1574,Mon Sep 20 2021 20:28:09 GMT-0300 (Brasilia Standard Time),Fri Jul 09 2021 18:45:22 GMT-0300 (Brasilia Standard Time)
"Bolsonaro é uma criança mimada que nunca ouviu um não na vida. Quando muitos nãos aparecem à frente, ele revela o m… https://t.co/XA42GS3gH7",35260027,,,35260027,RodrigoMaia,,,307,4616,Mon Sep 20 2021 20:28:09 GMT-0300 (Brasilia Standard Time),Fri Jul 09 2021 18:45:22 GMT-0300 (Brasilia Standard Time)
"RT @alexandre: Os brasileiros podem confiar nas Instituições, na certeza de que, soberanamente, escolherão seus dirigentes nas eleições de…",35260027,,,35260027,RodrigoMaia,,,6049,0,Mon Sep 20 2021 20:28:09 GMT-0300 (Brasilia Standard Time),Fri Jul 09 2021 18:34:29 GMT-0300 (Brasilia Standard Time)
"Bolsonaro no seu ataque diário à nossa democracia, trabalhando para desmoralizar o Congresso e o STF, o que faz des… https://t.co/OhhJvRa2tL",35260027,,,35260027,RodrigoMaia,,,313,4878,Mon Sep 20 2021 20:28:09 GMT-0300 (Brasilia Standard Time),Thu Jul 08 2021 19:42:10 GMT-0300 (Brasilia Standard Time)
Ótima análise. O Congresso não pode aceitar a tutela do Ministro da Defesa. https://t.co/U5s87YPFEB,35260027,,,35260027,RodrigoMaia,,,75,709,Mon Sep 20 2021 20:28:09 GMT-0300 (Brasilia Standard Time),Thu Jul 08 2021 11:29:23 GMT-0300 (Brasilia Standard Time)
O voto impresso é um tema apenas no mundo Bolsonarista. Não podemos aceitar a tentativa de enfraquecer a nossa demo… https://t.co/2rdgNDpSkC,35260027,,,35260027,RodrigoMaia,,,446,6375,Mon Sep 20 2021 20:28:09 GMT-0300 (Brasilia Standard Time),Wed Jul 07 2021 09:50:52 GMT-0300 (Brasilia Standard Time)
Agora enrolou mesmo. Trouxe a indústria química e a de bebidas para o debate da renda. https://t.co/T2zAwEskPQ,35260027,,,35260027,RodrigoMaia,,,20,319,Mon Sep 20 2021 20:28:09 GMT-0300 (Brasilia Standard Time),Tue Jul 06 2021 18:53:48 GMT-0300 (Brasilia Standard Time)
Mais competitvidade ? Deveria estar relatando o PL da CBS. https://t.co/seENlRmo6x,35260027,,,35260027,RodrigoMaia,,,7,78,Mon Sep 20 2021 20:28:09 GMT-0300 (Brasilia Standard Time),Mon Jul 05 2021 16:25:44 GMT-0300 (Brasilia Standard Time)
@AnaibelNovas Eu votei contra! Veja meus tuítes anteriores. Fiz várias críticas à aprovação do negócio das termelétricas.,35260027,,,35260027,RodrigoMaia,,,2,12,Mon Sep 20 2021 20:28:09 GMT-0300 (Brasilia Standard Time),Mon Jul 05 2021 16:24:28 GMT-0300 (Brasilia Standard Time)
Agora o Bolsonaro não pode mais culpar o presidente da empresa. Silva e Luna é 100% Bolsonaro. https://t.co/ZlojbHZtPZ,35260027,,,35260027,RodrigoMaia,,,123,1310,Mon Sep 20 2021 20:28:09 GMT-0300 (Brasilia Standard Time),Mon Jul 05 2021 15:43:08 GMT-0300 (Brasilia Standard Time)
Ótimo artigo do Samuel Pessoa. Deixa claro que haverá aumento de carga tributária e que há espaço no Parlamento pra… https://t.co/qD96dLxguf,35260027,,,35260027,RodrigoMaia,,,20,273,Mon Sep 20 2021 20:28:09 GMT-0300 (Brasilia Standard Time),Sun Jul 04 2021 13:39:52 GMT-0300 (Brasilia Standard Time)
"RT @VEJA: Rodrigo Maia flerta com o PT, mas ainda aposta que o centro pode derrubar Bolsonaro #PáginasAmerelas #VEJA 
https://t.co/9Kmx6m5H…",35260027,,,35260027,RodrigoMaia,,,35,0,Mon Sep 20 2021 20:28:09 GMT-0300 (Brasilia Standard Time),Fri Jul 02 2021 17:31:28 GMT-0300 (Brasilia Standard Time)
Entrevista do senador Flávio Bolsonaro para O Globo. Grave esta declaração. Senador admite que não há sistema de co… https://t.co/Cm1dwdfAbw,35260027,,,35260027,RodrigoMaia,,,183,1591,Mon Sep 20 2021 20:28:09 GMT-0300 (Brasilia Standard Time),Fri Jul 02 2021 10:00:46 GMT-0300 (Brasilia Standard Time)
"A partir de agora, a política vai decidir quais são os medicamentos que devem estar no rol de medicamentos dos plan… https://t.co/EfAgGFRKnj",35260027,,,35260027,RodrigoMaia,,,33,343,Mon Sep 20 2021 20:28:09 GMT-0300 (Brasilia Standard Time),Thu Jul 01 2021 18:34:09 GMT-0300 (Brasilia Standard Time)
A Câmara de Deputados aprovou o PL 6330/19. O Congresso está cometendo o mesmo erro que cometeu na aprovação da fam… https://t.co/4sMsfYNUHv,35260027,,,35260027,RodrigoMaia,,,45,451,Mon Sep 20 2021 20:28:09 GMT-0300 (Brasilia Standard Time),Thu Jul 01 2021 18:34:09 GMT-0300 (Brasilia Standard Time)
Bolsonaro colocou a corrupção no colo do Exército hoje!!! As Forças Armadas devem estar bem arrependidas do apoio q… https://t.co/hVwec3VeBk,35260027,,,35260027,RodrigoMaia,,,1296,18525,Mon Sep 20 2021 20:28:09 GMT-0300 (Brasilia Standard Time),Thu Jul 01 2021 16:59:13 GMT-0300 (Brasilia Standard Time)
Boa notícia! A nossa bancada do Rio destinou mais de R$ 32 milhões em emendas para a saúde do município. O recurso… https://t.co/SpwxLksnS7,35260027,,,35260027,RodrigoMaia,,,5,94,Mon Sep 20 2021 20:28:09 GMT-0300 (Brasilia Standard Time),Thu Jul 01 2021 16:44:15 GMT-0300 (Brasilia Standard Time)
Muito interessante o depoimento de hoje na CPI do Senado. Governo entregando a cabeça dos militares do Ministério d… https://t.co/tbycdxqG7T,35260027,,,35260027,RodrigoMaia,,,1484,21049,Mon Sep 20 2021 20:28:09 GMT-0300 (Brasilia Standard Time),Thu Jul 01 2021 12:21:26 GMT-0300 (Brasilia Standard Time)
Secretário do Tesouro confirma que HAVERÁ aumento de carga tributária no projeto de lei do Imposto de Renda. https://t.co/dF9SqAYZ5K,35260027,,,35260027,RodrigoMaia,,,31,270,Mon Sep 20 2021 20:28:09 GMT-0300 (Brasilia Standard Time),Wed Jun 30 2021 16:19:06 GMT-0300 (Brasilia Standard Time)
"Da forma como o projeto foi encaminhado, resolvemos um problema ampliando a isenção, mas por outro lado estamos des… https://t.co/FgjgEuwwjL",35260027,,,35260027,RodrigoMaia,,,7,184,Mon Sep 20 2021 20:28:09 GMT-0300 (Brasilia Standard Time),Mon Jun 28 2021 18:16:38 GMT-0300 (Brasilia Standard Time)
A discussão está no caminho errado. Não devemos de forma nenhuma aumentar a carga tributária de médias e grandes em… https://t.co/k3SoyrCeZ6,35260027,,,35260027,RodrigoMaia,,,19,309,Mon Sep 20 2021 20:28:09 GMT-0300 (Brasilia Standard Time),Mon Jun 28 2021 18:16:38 GMT-0300 (Brasilia Standard Time)
Decisão importante dos 11 partidos. Defesa forte da nossa democracia. https://t.co/fQfHPnvp9j,35260027,,,35260027,RodrigoMaia,,,272,3432,Mon Sep 20 2021 20:28:09 GMT-0300 (Brasilia Standard Time),Sat Jun 26 2021 16:25:16 GMT-0300 (Brasilia Standard Time)
Outro dia eu falei para o mercado não se preocupar com a posição do presidente Lula sobre o teto de gastos. Olha aí… https://t.co/uuGa5KMRlm,35260027,,,35260027,RodrigoMaia,,,30,349,Mon Sep 20 2021 20:28:09 GMT-0300 (Brasilia Standard Time),Fri Jun 25 2021 19:20:22 GMT-0300 (Brasilia Standard Time)
