text,query,country,city,userId,username,quote_count,reply_count,retweet_count,favorite_count,timestamp,createdAt
"Não satisfeito em matar os brasileiros, o governo Bolsonaro, agora através de sua reforma tributária, quer matar as… https://t.co/uTi5FEt0lu",35260027,,,35260027,RodrigoMaia,,,409,6624,Mon Sep 20 2021 20:28:09 GMT-0300 (Brasilia Standard Time),Fri Jun 25 2021 17:52:34 GMT-0300 (Brasilia Standard Time)
Então o ministro da saúde confirma que há algo errado no contrato entre o governo e a empresa? Se o governo não com… https://t.co/AyPvljTlS1,35260027,,,35260027,RodrigoMaia,,,144,1905,Mon Sep 20 2021 20:28:09 GMT-0300 (Brasilia Standard Time),Thu Jun 24 2021 15:01:55 GMT-0300 (Brasilia Standard Time)
"Fui informado há pouco sobre o falecimento do nosso amigo, o vereador Tostão. Era o atual Presidente da Câmara de V… https://t.co/8UEWWMw9aA",35260027,,,35260027,RodrigoMaia,,,16,605,Mon Sep 20 2021 20:28:09 GMT-0300 (Brasilia Standard Time),Tue Jun 22 2021 20:52:21 GMT-0300 (Brasilia Standard Time)
"No dia 9 de janeiro eu fiz um tuíte afirmando que Bolsonaro era covarde. Hoje, depois do episódio lamentável com a… https://t.co/EX2v5NP4N3",35260027,,,35260027,RodrigoMaia,,,1142,18981,Mon Sep 20 2021 20:28:09 GMT-0300 (Brasilia Standard Time),Mon Jun 21 2021 17:31:41 GMT-0300 (Brasilia Standard Time)
Mais uma vez quem pagará essa conta será o contribuinte. 👇 https://t.co/jS3zvGQTyc,35260027,,,35260027,RodrigoMaia,,,44,380,Mon Sep 20 2021 20:28:09 GMT-0300 (Brasilia Standard Time),Mon Jun 21 2021 17:17:28 GMT-0300 (Brasilia Standard Time)
Lembrando que o teto de gastos tem o seu valor corrigido no meio do ano e o gasto do governo corrigido no final do ano.,35260027,,,35260027,RodrigoMaia,,,2,61,Mon Sep 20 2021 20:28:09 GMT-0300 (Brasilia Standard Time),Mon Jun 21 2021 15:16:05 GMT-0300 (Brasilia Standard Time)
"A demora do Copom em ajustar a taxa de juros devido à forte inflação dos últimos meses, queiramos ou não, pode acab… https://t.co/pRRRjECZnu",35260027,,,35260027,RodrigoMaia,,,6,76,Mon Sep 20 2021 20:28:09 GMT-0300 (Brasilia Standard Time),Mon Jun 21 2021 15:16:05 GMT-0300 (Brasilia Standard Time)
A Câmara vota novamente amanhã a MP do setor elétrico. O relato feito pelo secretário de Desestatização do Ministér… https://t.co/OJIGsifaYK,35260027,,,35260027,RodrigoMaia,,,72,527,Mon Sep 20 2021 20:28:09 GMT-0300 (Brasilia Standard Time),Sun Jun 20 2021 22:44:20 GMT-0300 (Brasilia Standard Time)
Importante análise do deputado @DepDaniloForte falando da MP da Eletrobras e dos seus jabutis. https://t.co/w6daVRRdLg,35260027,,,35260027,RodrigoMaia,,,49,265,Mon Sep 20 2021 20:28:09 GMT-0300 (Brasilia Standard Time),Sun Jun 20 2021 15:01:10 GMT-0300 (Brasilia Standard Time)
Forte e verdadeiro o editorial do @jornalnacional. https://t.co/Gv2hVFBB3j,35260027,,,35260027,RodrigoMaia,,,698,6565,Mon Sep 20 2021 20:28:09 GMT-0300 (Brasilia Standard Time),Sat Jun 19 2021 23:13:16 GMT-0300 (Brasilia Standard Time)
Hoje sabemos que a vacinação evitou a morte de 43 mil idosos. Quantas vidas já teriam sido salvas se tivéssemos um… https://t.co/TgJd4FyDTQ,35260027,,,35260027,RodrigoMaia,,,32,781,Mon Sep 20 2021 20:28:09 GMT-0300 (Brasilia Standard Time),Sat Jun 19 2021 14:40:07 GMT-0300 (Brasilia Standard Time)
São 100 mil novas mortes por Covid-19 em 50 dias. O Brasil atinge a trágica marca de 500 mil mortes. Um número que… https://t.co/m0aS18phfe,35260027,,,35260027,RodrigoMaia,,,300,5015,Mon Sep 20 2021 20:28:09 GMT-0300 (Brasilia Standard Time),Sat Jun 19 2021 14:40:07 GMT-0300 (Brasilia Standard Time)
"O dia de hoje também é uma data especial por ser aniversário do meu pai, @cesarmaia. Alguém que tenho como principa… https://t.co/tEYl0JDFco",35260027,,,35260027,RodrigoMaia,,,21,823,Mon Sep 20 2021 20:28:09 GMT-0300 (Brasilia Standard Time),Fri Jun 18 2021 12:37:42 GMT-0300 (Brasilia Standard Time)
Hoje presto minha homenagem aos 90 anos do ex-presidente @FHC. Alguns homens públicos me inspiraram na minha trajet… https://t.co/yUE2HRnWE9,35260027,,,35260027,RodrigoMaia,,,31,892,Mon Sep 20 2021 20:28:09 GMT-0300 (Brasilia Standard Time),Fri Jun 18 2021 12:36:34 GMT-0300 (Brasilia Standard Time)
Acho que o jornal não entendeu. A minha declaração foi na defesa do teto de gastos. https://t.co/qtCTZOX9mF,35260027,,,35260027,RodrigoMaia,,,16,520,Mon Sep 20 2021 20:28:09 GMT-0300 (Brasilia Standard Time),Fri Jun 18 2021 09:24:33 GMT-0300 (Brasilia Standard Time)
A proposta do Lula não precisa assustar o mercado. O próprio Paulo Guedes fez pior do que revogar o teto de gastos:… https://t.co/ub2gCvpcH8,35260027,,,35260027,RodrigoMaia,,,527,6172,Mon Sep 20 2021 20:28:09 GMT-0300 (Brasilia Standard Time),Thu Jun 17 2021 12:17:33 GMT-0300 (Brasilia Standard Time)
"Também ao prefeito @eduardopaes, que antecipou o calendário de vacinação. E agradecer ainda ao governador @jdoriajr… https://t.co/jLgQ2kOvsg",35260027,,,35260027,RodrigoMaia,,,37,1025,Mon Sep 20 2021 20:28:09 GMT-0300 (Brasilia Standard Time),Thu Jun 17 2021 10:36:07 GMT-0300 (Brasilia Standard Time)
"Hoje chegou o meu dia!! Muita emoção. Fui vacinado no Centro Muncipal Píndaro de Carvalho, coordenado pela diretora… https://t.co/rvMHd4CnaA",35260027,,,35260027,RodrigoMaia,,,54,3365,Mon Sep 20 2021 20:28:09 GMT-0300 (Brasilia Standard Time),Thu Jun 17 2021 10:36:06 GMT-0300 (Brasilia Standard Time)
Uma ótima iniciativa. Um passo importante seria a criação de um bloco de oposição ao governo Bolsonaro no Congresso… https://t.co/n61MHG3cc1,35260027,,,35260027,RodrigoMaia,,,40,907,Mon Sep 20 2021 20:28:09 GMT-0300 (Brasilia Standard Time),Thu Jun 17 2021 06:59:20 GMT-0300 (Brasilia Standard Time)
