text,query,country,city,userId,username,quote_count,reply_count,retweet_count,favorite_count,timestamp,createdAt
"É muito simples. Basta cumprir o teto de gastos, cortar despesas e escolher prioridades. https://t.co/K33khh7tEf",35260027,,,35260027,RodrigoMaia,,,11,200,Mon Sep 20 2021 20:28:09 GMT-0300 (Brasilia Standard Time),Mon Sep 20 2021 16:06:07 GMT-0300 (Brasilia Standard Time)
"RT @Baleia_Rossi: A PEC dos Precatórios tem jeito de calote, cara de calote e cheiro de calote.  

Por isso, eu votei CONTRA na Comissão de…",35260027,,,35260027,RodrigoMaia,,,35,0,Mon Sep 20 2021 20:28:09 GMT-0300 (Brasilia Standard Time),Fri Sep 17 2021 15:13:01 GMT-0300 (Brasilia Standard Time)
"Depois do texto aprovado do IR, não foi surpresa o desastroso texto apresentado pelo relator da Reforma Administrat… https://t.co/kJc9iPm1m4",35260027,,,35260027,RodrigoMaia,,,35,457,Mon Sep 20 2021 20:28:09 GMT-0300 (Brasilia Standard Time),Fri Sep 17 2021 11:46:12 GMT-0300 (Brasilia Standard Time)
E dá-lhe Bolsonaro. https://t.co/CcnKxaHnSa,35260027,,,35260027,RodrigoMaia,,,175,1891,Mon Sep 20 2021 20:28:09 GMT-0300 (Brasilia Standard Time),Thu Sep 16 2021 23:00:11 GMT-0300 (Brasilia Standard Time)
O relator conseguiu piorar o texto do governo que já não era bom. Ainda bem que indiquei o Samuel Moreira para rela… https://t.co/AsaOEItoPg,35260027,,,35260027,RodrigoMaia,,,11,149,Mon Sep 20 2021 20:28:09 GMT-0300 (Brasilia Standard Time),Thu Sep 16 2021 15:11:42 GMT-0300 (Brasilia Standard Time)
"E quando o ministro fala em politização da Justiça, ele está denunciando o Supremo Tribunal Federal? Está querendo… https://t.co/x3kqgidbhk",35260027,,,35260027,RodrigoMaia,,,38,490,Mon Sep 20 2021 20:28:09 GMT-0300 (Brasilia Standard Time),Thu Sep 16 2021 13:26:35 GMT-0300 (Brasilia Standard Time)
"Desonesto. Guedes foi alertado do assunto pelo STF em novembro de 2018, antes mesmo da sua posse. No ministério, pr… https://t.co/J4s3chrJo7",35260027,,,35260027,RodrigoMaia,,,152,1283,Mon Sep 20 2021 20:28:09 GMT-0300 (Brasilia Standard Time),Thu Sep 16 2021 13:26:34 GMT-0300 (Brasilia Standard Time)
Precisa ficar claro que BOLSONARO está defendendo a volta da CPMF. https://t.co/kpMaTfqrAx,35260027,,,35260027,RodrigoMaia,,,72,614,Mon Sep 20 2021 20:28:09 GMT-0300 (Brasilia Standard Time),Wed Sep 15 2021 15:28:41 GMT-0300 (Brasilia Standard Time)
"Quando li a matéria do presidente do BC, achei, em um primeiro momento, que era uma declaração do presidente da Cai… https://t.co/IKFUWDuhCb",35260027,,,35260027,RodrigoMaia,,,30,350,Mon Sep 20 2021 20:28:09 GMT-0300 (Brasilia Standard Time),Tue Sep 14 2021 14:51:13 GMT-0300 (Brasilia Standard Time)
RT @EduardoLeite_: A esse cidadão que queriam que eu desse “boas vindas” na expointer? https://t.co/Nsu4jbZBnn,35260027,,,35260027,RodrigoMaia,,,1119,0,Mon Sep 20 2021 20:28:09 GMT-0300 (Brasilia Standard Time),Sat Sep 11 2021 22:20:46 GMT-0300 (Brasilia Standard Time)
Alguém tinha alguma dúvida que o Paulo Guedes iria transferir a responsabilidade de sua incompetência? https://t.co/axSx82cRP4,35260027,,,35260027,RodrigoMaia,,,286,3797,Mon Sep 20 2021 20:28:09 GMT-0300 (Brasilia Standard Time),Sat Sep 11 2021 09:54:13 GMT-0300 (Brasilia Standard Time)
"RT @JornalDaGlobo: .@renataloprete analisa a verdadeira intenção do presidente Jair Bolsonaro ao divulgar um texto intitulado ""Declaração à…",35260027,,,35260027,RodrigoMaia,,,1826,0,Mon Sep 20 2021 20:28:09 GMT-0300 (Brasilia Standard Time),Fri Sep 10 2021 10:41:53 GMT-0300 (Brasilia Standard Time)
"Minha defesa é que TODOS são iguais perante a lei, sem qualquer tipo de discriminação. Bem diferente de você, presi… https://t.co/tY81gj8LTL",35260027,,,35260027,RodrigoMaia,,,58,2694,Mon Sep 20 2021 20:28:09 GMT-0300 (Brasilia Standard Time),Thu Sep 09 2021 21:03:58 GMT-0300 (Brasilia Standard Time)
"Fique tranquilo, presidente, eu defendo os direitos humanos da comunidade LGBTI+ há muito tempo. Na Presidência da… https://t.co/PNXT6TqFEd",35260027,,,35260027,RodrigoMaia,,,59,2555,Mon Sep 20 2021 20:28:09 GMT-0300 (Brasilia Standard Time),Thu Sep 09 2021 21:03:57 GMT-0300 (Brasilia Standard Time)
Bolsonaro tem alguma fixação em mim. Não me esquece. Já recomendei ao presidente fazer terapia. Ele tem traumas mal… https://t.co/2TFKp8QZhr,35260027,,,35260027,RodrigoMaia,,,218,6095,Mon Sep 20 2021 20:28:09 GMT-0300 (Brasilia Standard Time),Thu Sep 09 2021 21:03:57 GMT-0300 (Brasilia Standard Time)
"O evento de terça foi um desastre pro Bolsonaro, e a nota agora uma humilhação.",35260027,,,35260027,RodrigoMaia,,,117,2139,Mon Sep 20 2021 20:28:09 GMT-0300 (Brasilia Standard Time),Thu Sep 09 2021 16:58:31 GMT-0300 (Brasilia Standard Time)
Frouxo e covarde. https://t.co/Rz3JcsezKm,35260027,,,35260027,RodrigoMaia,,,670,8329,Mon Sep 20 2021 20:28:09 GMT-0300 (Brasilia Standard Time),Thu Sep 09 2021 16:55:52 GMT-0300 (Brasilia Standard Time)
Manchete errada. Michel Temer não foi almoçar para discutir a crise. Ele almoçou com a própria crise. https://t.co/8q7Acw6cDN,35260027,,,35260027,RodrigoMaia,,,215,3138,Mon Sep 20 2021 20:28:09 GMT-0300 (Brasilia Standard Time),Thu Sep 09 2021 16:52:27 GMT-0300 (Brasilia Standard Time)
"Ouvi agora o áudio do Bolsonaro falando para os caminheiros. Pelo tom, parece bastante deprimido com o resultado de… https://t.co/QKPIodT4Bh",35260027,,,35260027,RodrigoMaia,,,655,13293,Mon Sep 20 2021 20:28:09 GMT-0300 (Brasilia Standard Time),Thu Sep 09 2021 09:01:48 GMT-0300 (Brasilia Standard Time)
"Bem lembrado. Quando terminou meu mandato à frente da Presidência da Câmara, o CDI de 10 anos estava a 7,20% a.a https://t.co/MAe4hPqvhI",35260027,,,35260027,RodrigoMaia,,,17,265,Mon Sep 20 2021 20:28:09 GMT-0300 (Brasilia Standard Time),Wed Sep 08 2021 16:16:52 GMT-0300 (Brasilia Standard Time)
E dá-lhe Bolsonaro. https://t.co/v6h32gblI8,35260027,,,35260027,RodrigoMaia,,,768,11710,Mon Sep 20 2021 20:28:09 GMT-0300 (Brasilia Standard Time),Wed Sep 08 2021 13:24:53 GMT-0300 (Brasilia Standard Time)
"RT @UOLNoticias: 🔴 Ao vivo
Bolsonaro perde força após discursos em 7 de setembro? @blogdojosias analisa repercussão

Veja também: @RodrigoM…",35260027,,,35260027,RodrigoMaia,,,10,0,Mon Sep 20 2021 20:28:09 GMT-0300 (Brasilia Standard Time),Wed Sep 08 2021 08:22:41 GMT-0300 (Brasilia Standard Time)
Está na hora do comando do Congresso enquadrar o Bolsonaro.,35260027,,,35260027,RodrigoMaia,,,297,5785,Mon Sep 20 2021 20:28:09 GMT-0300 (Brasilia Standard Time),Tue Sep 07 2021 15:15:48 GMT-0300 (Brasilia Standard Time)
Gosto da humildade do Bolsonaro. Ele assumindo que está desrespeitando a Constituição. https://t.co/4iT87k2TGk,35260027,,,35260027,RodrigoMaia,,,432,7253,Mon Sep 20 2021 20:28:09 GMT-0300 (Brasilia Standard Time),Tue Sep 07 2021 15:00:02 GMT-0300 (Brasilia Standard Time)
"RT @AndreiaSadi: Leitura do dia é a entrevista do Marcos Nobre na FSP hoje. Mas não vale ler dois parágrafos, precisa ler até o fim. Bom di…",35260027,,,35260027,RodrigoMaia,,,410,0,Mon Sep 20 2021 20:28:09 GMT-0300 (Brasilia Standard Time),Tue Sep 07 2021 11:16:40 GMT-0300 (Brasilia Standard Time)
Vamos esperar que a Anvisa tenha a mesma firmeza em relação às regras sanitárias nos eventos promovidos pelo presid… https://t.co/JtdceAnRi5,35260027,,,35260027,RodrigoMaia,,,1811,22756,Mon Sep 20 2021 20:28:09 GMT-0300 (Brasilia Standard Time),Sun Sep 05 2021 17:11:08 GMT-0300 (Brasilia Standard Time)
Freud explica a obsessão com o tema. Acho que acertei! https://t.co/pwYCwbJoFq,35260027,,,35260027,RodrigoMaia,,,878,12368,Mon Sep 20 2021 20:28:09 GMT-0300 (Brasilia Standard Time),Sat Sep 04 2021 20:32:57 GMT-0300 (Brasilia Standard Time)
O filho do presidente Trump tem muita coragem. Atacar o governo do Bolsonaro na frente do filho dele. https://t.co/TAFoRtOGlH,35260027,,,35260027,RodrigoMaia,,,799,7828,Mon Sep 20 2021 20:28:09 GMT-0300 (Brasilia Standard Time),Sat Sep 04 2021 14:09:29 GMT-0300 (Brasilia Standard Time)
"e, logo em seguida, o ministro da Economia confirma que o governo terá perda de arrecadação. Eu repito o que falei… https://t.co/dp3C1jQwtY",35260027,,,35260027,RodrigoMaia,,,45,728,Mon Sep 20 2021 20:28:09 GMT-0300 (Brasilia Standard Time),Sat Sep 04 2021 13:23:43 GMT-0300 (Brasilia Standard Time)
A confusão não é pequena no Ministério da Economia. Secretário do Tesouro anunciou perda de arrecadação de R$ 20 bi… https://t.co/cKlOf2zT6o,35260027,,,35260027,RodrigoMaia,,,137,1667,Mon Sep 20 2021 20:28:09 GMT-0300 (Brasilia Standard Time),Sat Sep 04 2021 13:23:41 GMT-0300 (Brasilia Standard Time)
"RT @depaguinaldo11: A verdadeira reforma precisa ser norteada pelos princípios da simplificação, desburocratização e desoneração do setor p…",35260027,,,35260027,RodrigoMaia,,,6,0,Mon Sep 20 2021 20:28:09 GMT-0300 (Brasilia Standard Time),Fri Sep 03 2021 14:26:24 GMT-0300 (Brasilia Standard Time)
RT @depaguinaldo11: A complexidade do sistema acarreta custos de conformidade às empresas brasileiras da ordem de R$ 280 bilhões ao ano aci…,35260027,,,35260027,RodrigoMaia,,,3,0,Mon Sep 20 2021 20:28:09 GMT-0300 (Brasilia Standard Time),Fri Sep 03 2021 14:26:23 GMT-0300 (Brasilia Standard Time)
RT @depaguinaldo11: Não dá pra tratar um tema tão relevante com tamanha irresponsabilidade. a dimensão tributária é hoje um dos principais…,35260027,,,35260027,RodrigoMaia,,,2,0,Mon Sep 20 2021 20:28:09 GMT-0300 (Brasilia Standard Time),Fri Sep 03 2021 14:26:21 GMT-0300 (Brasilia Standard Time)
"RT @depaguinaldo11: A aprovação da proposta do IR representa a combinação da mediocridade, insensatez, vaidade e falta de espírito público.…",35260027,,,35260027,RodrigoMaia,,,5,0,Mon Sep 20 2021 20:28:09 GMT-0300 (Brasilia Standard Time),Fri Sep 03 2021 14:26:19 GMT-0300 (Brasilia Standard Time)
Excelente artigo da Vanessa Canado. https://t.co/Z4Nueu4Iiz,35260027,,,35260027,RodrigoMaia,,,15,177,Mon Sep 20 2021 20:28:09 GMT-0300 (Brasilia Standard Time),Thu Sep 02 2021 22:58:29 GMT-0300 (Brasilia Standard Time)
"@jeanwyllys_real Jean, você pode ter razão.",35260027,,,35260027,RodrigoMaia,,,7,528,Mon Sep 20 2021 20:28:09 GMT-0300 (Brasilia Standard Time),Thu Sep 02 2021 22:31:47 GMT-0300 (Brasilia Standard Time)
"Saldo do relatório do projeto de IR: 
1) mantido os benefícios fiscais de aeronaves e embarcações, 
2)fundos de inv… https://t.co/k4j6St188r",35260027,,,35260027,RodrigoMaia,,,40,464,Mon Sep 20 2021 20:28:09 GMT-0300 (Brasilia Standard Time),Thu Sep 02 2021 09:25:45 GMT-0300 (Brasilia Standard Time)
"RT @DuquesaDetax: Atenção para o resumo gratuito do projeto aprovado ATÉ O MOMENTO:
.
.
.
.
.
Vamos pagar mais imposto.
Sigam este perfil p…",35260027,,,35260027,RodrigoMaia,,,148,0,Mon Sep 20 2021 20:28:09 GMT-0300 (Brasilia Standard Time),Wed Sep 01 2021 23:03:00 GMT-0300 (Brasilia Standard Time)
Exemplo parecido com a atuação do governo no caso da vacina Covaxin que está sendo investigado pela CPI da covid no… https://t.co/45DewM3FAX,35260027,,,35260027,RodrigoMaia,,,59,714,Mon Sep 20 2021 20:28:09 GMT-0300 (Brasilia Standard Time),Tue Aug 31 2021 14:17:52 GMT-0300 (Brasilia Standard Time)
Populismo continua avançando no governo Bolsonaro. https://t.co/LjISKVzB1d,35260027,,,35260027,RodrigoMaia,,,25,470,Mon Sep 20 2021 20:28:09 GMT-0300 (Brasilia Standard Time),Tue Aug 31 2021 12:46:29 GMT-0300 (Brasilia Standard Time)
"Na entrevista ao Estadão, Eduardo Giannetti deixa claro como o governo está perdido na agenda econômica e, ainda, o… https://t.co/1EBUFU0qmu",35260027,,,35260027,RodrigoMaia,,,82,903,Mon Sep 20 2021 20:28:09 GMT-0300 (Brasilia Standard Time),Sun Aug 29 2021 12:56:04 GMT-0300 (Brasilia Standard Time)
"Vitória? Depende dos eleitores, que hoje querem comida, emprego, estabilidade, tudo o que ele não consegue entregar… https://t.co/FwCFtpC6IS",35260027,,,35260027,RodrigoMaia,,,78,1327,Mon Sep 20 2021 20:28:09 GMT-0300 (Brasilia Standard Time),Sat Aug 28 2021 19:39:09 GMT-0300 (Brasilia Standard Time)
"Bolsonaro disse que há 3 opções pro futuro dele: estar preso, ser morto ou a vitória. Não desejo que seja morto, po… https://t.co/34LMvrUwDi",35260027,,,35260027,RodrigoMaia,,,210,4588,Mon Sep 20 2021 20:28:09 GMT-0300 (Brasilia Standard Time),Sat Aug 28 2021 19:39:09 GMT-0300 (Brasilia Standard Time)
"RT @eduardopaes: Para facilitar o trabalho da assessoria, seguem as providências a serem tomadas:
Providência nº 1: tomar a 1ª dose!
Provid…",35260027,,,35260027,RodrigoMaia,,,1236,0,Mon Sep 20 2021 20:28:09 GMT-0300 (Brasilia Standard Time),Sat Aug 28 2021 13:44:31 GMT-0300 (Brasilia Standard Time)
INCOMPETÊNCIA!!! Não cuidaram do assunto na hora certa. Agora não tem jeito. Tarifa alta ou apagão. E a população v… https://t.co/N4Km20Flzt,35260027,,,35260027,RodrigoMaia,,,116,1171,Mon Sep 20 2021 20:28:09 GMT-0300 (Brasilia Standard Time),Fri Aug 27 2021 16:55:35 GMT-0300 (Brasilia Standard Time)
Grande notícia!!! Ajudou a derrotar o pai (Trump) e agora vai ajudar a derrotar o Bolsonaro. https://t.co/Yi816qJnZm,35260027,,,35260027,RodrigoMaia,,,218,2876,Mon Sep 20 2021 20:28:09 GMT-0300 (Brasilia Standard Time),Fri Aug 27 2021 12:38:12 GMT-0300 (Brasilia Standard Time)
Tenho certeza que o STF não vai fazer um acordo que desrespeite a Constituição. https://t.co/4093IAiRFx,35260027,,,35260027,RodrigoMaia,,,28,353,Mon Sep 20 2021 20:28:09 GMT-0300 (Brasilia Standard Time),Thu Aug 26 2021 16:09:55 GMT-0300 (Brasilia Standard Time)
Um negacionismo energético.,35260027,,,35260027,RodrigoMaia,,,12,231,Mon Sep 20 2021 20:28:09 GMT-0300 (Brasilia Standard Time),Thu Aug 26 2021 09:09:42 GMT-0300 (Brasilia Standard Time)
"No mês de maio, Wagner Victer alertou sobre os riscos. Ninguém fez nada. Caminhamos para um racionamento de energia. https://t.co/JrSdC4uIQk",35260027,,,35260027,RodrigoMaia,,,24,323,Mon Sep 20 2021 20:28:09 GMT-0300 (Brasilia Standard Time),Thu Aug 26 2021 08:38:48 GMT-0300 (Brasilia Standard Time)
"Ministro, chega de conversa fiada. VAMOS CORTAR DESPESAS. Você não tem coragem de enfrentar o tema. https://t.co/nlJMs5db2y",35260027,,,35260027,RodrigoMaia,,,122,1671,Mon Sep 20 2021 20:28:09 GMT-0300 (Brasilia Standard Time),Wed Aug 25 2021 17:18:00 GMT-0300 (Brasilia Standard Time)
Neutra? Então precisa acabar com o benefício das empresas do Simples e do Lucro Presumido. https://t.co/TKgiz3Hmvg,35260027,,,35260027,RodrigoMaia,,,22,387,Mon Sep 20 2021 20:28:09 GMT-0300 (Brasilia Standard Time),Wed Aug 25 2021 07:28:03 GMT-0300 (Brasilia Standard Time)
"Então por que pressionou o governo para sancionar as emendas de relator? Sem emenda de relator, de bancada e parte… https://t.co/g2OojnEUHe",35260027,,,35260027,RodrigoMaia,,,27,282,Mon Sep 20 2021 20:28:09 GMT-0300 (Brasilia Standard Time),Wed Aug 25 2021 07:20:04 GMT-0300 (Brasilia Standard Time)
Cara de pau!!!! Oportunista e mentiroso. https://t.co/igQUnaRqCY,35260027,,,35260027,RodrigoMaia,,,158,2099,Mon Sep 20 2021 20:28:09 GMT-0300 (Brasilia Standard Time),Fri Aug 20 2021 21:14:50 GMT-0300 (Brasilia Standard Time)
A mesma besteira de 2019. Ideia requentada. Fim melancólico. https://t.co/wrk3CBlRnS,35260027,,,35260027,RodrigoMaia,,,47,1023,Mon Sep 20 2021 20:28:09 GMT-0300 (Brasilia Standard Time),Fri Aug 20 2021 19:37:36 GMT-0300 (Brasilia Standard Time)
"Como podemos ter à frente da Educação alguém tão despreparado, ignorante e preconceituoso? Mais um louco do governo… https://t.co/CuMuIF6Jce",35260027,,,35260027,RodrigoMaia,,,448,6444,Mon Sep 20 2021 20:28:09 GMT-0300 (Brasilia Standard Time),Thu Aug 19 2021 20:58:33 GMT-0300 (Brasilia Standard Time)
"Falam em simplificação, neutralidade e progressividade. Deixar tantos contribuintes do Simples e do lucro presumido… https://t.co/5Msm5qyuNK",35260027,,,35260027,RodrigoMaia,,,8,161,Mon Sep 20 2021 20:28:09 GMT-0300 (Brasilia Standard Time),Thu Aug 19 2021 20:39:26 GMT-0300 (Brasilia Standard Time)
"RT @tvcultura: Fake news, política e economia farão parte do debate de hoje no #ManhattanConnection, com o deputado federal @RodrigoMaia, o…",35260027,,,35260027,RodrigoMaia,,,7,0,Mon Sep 20 2021 20:28:09 GMT-0300 (Brasilia Standard Time),Wed Aug 18 2021 21:02:58 GMT-0300 (Brasilia Standard Time)
Bolsonaro tranquilizando os investidores. É um estadista. https://t.co/zi8pbzEXmS,35260027,,,35260027,RodrigoMaia,,,308,3066,Mon Sep 20 2021 20:28:09 GMT-0300 (Brasilia Standard Time),Wed Aug 18 2021 20:25:55 GMT-0300 (Brasilia Standard Time)
Não é verdade. https://t.co/ZtXnfrga8k,35260027,,,35260027,RodrigoMaia,,,18,243,Mon Sep 20 2021 20:28:09 GMT-0300 (Brasilia Standard Time),Tue Aug 17 2021 22:08:19 GMT-0300 (Brasilia Standard Time)
Está na hora de arquivar este PL do Imposto de Renda. https://t.co/4jk5kfH02j,35260027,,,35260027,RodrigoMaia,,,22,478,Mon Sep 20 2021 20:28:09 GMT-0300 (Brasilia Standard Time),Tue Aug 17 2021 21:23:13 GMT-0300 (Brasilia Standard Time)
Esta matéria desmonta o discurso do relator. https://t.co/lzeiUbSQXx,35260027,,,35260027,RodrigoMaia,,,17,213,Mon Sep 20 2021 20:28:09 GMT-0300 (Brasilia Standard Time),Tue Aug 17 2021 21:11:46 GMT-0300 (Brasilia Standard Time)
Pelo jeito o relator não sabe o que está fazendo https://t.co/FpGXKRToYr,35260027,,,35260027,RodrigoMaia,,,9,222,Mon Sep 20 2021 20:28:09 GMT-0300 (Brasilia Standard Time),Tue Aug 17 2021 20:47:26 GMT-0300 (Brasilia Standard Time)
"Relator do IR falando no plenário há pouco, quanta besteira. Quem não paga imposto no Brasil são as empresas do Sim… https://t.co/NQmBHGTGFr",35260027,,,35260027,RodrigoMaia,,,52,1236,Mon Sep 20 2021 20:28:09 GMT-0300 (Brasilia Standard Time),Tue Aug 17 2021 20:22:20 GMT-0300 (Brasilia Standard Time)
A convite da @CNNBrasil estarei hoje no programa “O Grande Debate” para falar sobre o semipresidencialismo. Às 22h3… https://t.co/8EQyIe6LDr,35260027,,,35260027,RodrigoMaia,,,16,256,Mon Sep 20 2021 20:28:09 GMT-0300 (Brasilia Standard Time),Tue Aug 17 2021 19:38:12 GMT-0300 (Brasilia Standard Time)
Caminhando para o descontrole total das contas do governo federal. Um desastre. https://t.co/gYzDDFXNDq,35260027,,,35260027,RodrigoMaia,,,53,541,Mon Sep 20 2021 20:28:09 GMT-0300 (Brasilia Standard Time),Tue Aug 17 2021 17:08:49 GMT-0300 (Brasilia Standard Time)
Apresentei hoje uma emenda à PEC dos precatórios propondo a retomada da discussão da redução global de despesas. Es… https://t.co/AOUIsn5SUd,35260027,,,35260027,RodrigoMaia,,,4,115,Mon Sep 20 2021 20:28:09 GMT-0300 (Brasilia Standard Time),Tue Aug 17 2021 15:25:10 GMT-0300 (Brasilia Standard Time)
"Apesar de todos os méritos do programa, a solução não pode ser o calote nos precatórios e o aumento da carga tribut… https://t.co/S7PpwPtah7",35260027,,,35260027,RodrigoMaia,,,4,124,Mon Sep 20 2021 20:28:09 GMT-0300 (Brasilia Standard Time),Tue Aug 17 2021 15:25:10 GMT-0300 (Brasilia Standard Time)
O foco da reforma tributária deixou de ser a simplificação do sistema e a sua neutralidade e passou a ser buscar um… https://t.co/zgP7YlPaIb,35260027,,,35260027,RodrigoMaia,,,23,226,Mon Sep 20 2021 20:28:09 GMT-0300 (Brasilia Standard Time),Tue Aug 17 2021 15:25:10 GMT-0300 (Brasilia Standard Time)
O projeto de lei do Imposto de Renda e a emenda dos precatórios são projetos polêmicos e completamente equivocados… https://t.co/qfMdabAySs,35260027,,,35260027,RodrigoMaia,,,31,387,Mon Sep 20 2021 20:28:09 GMT-0300 (Brasilia Standard Time),Tue Aug 17 2021 15:25:09 GMT-0300 (Brasilia Standard Time)
Fim das ilusões https://t.co/1SvHbJExKU,35260027,,,35260027,RodrigoMaia,,,19,200,Mon Sep 20 2021 20:28:09 GMT-0300 (Brasilia Standard Time),Mon Aug 16 2021 09:06:50 GMT-0300 (Brasilia Standard Time)
"Assim atuam os populistas. Depois de eleitos, atacam as instituições democráticas e tentam destruir a democracia re… https://t.co/NlOgpQSQp0",35260027,,,35260027,RodrigoMaia,,,333,5023,Mon Sep 20 2021 20:28:09 GMT-0300 (Brasilia Standard Time),Sat Aug 14 2021 08:57:02 GMT-0300 (Brasilia Standard Time)
"RT @Baleia_Rossi: Em entrevista hoje, Paulo Guedes disse fakenews sobre a reforma tributária ampla, que sempre teve enorme apoio de diferen…",35260027,,,35260027,RodrigoMaia,,,26,0,Mon Sep 20 2021 20:28:09 GMT-0300 (Brasilia Standard Time),Fri Aug 13 2021 20:21:15 GMT-0300 (Brasilia Standard Time)
"Brasil é o sexto país do mundo com mais habitantes, mas o último em termos de gestão da pandemia
https://t.co/pR6n7OCg8n",35260027,,,35260027,RodrigoMaia,,,48,572,Mon Sep 20 2021 20:28:09 GMT-0300 (Brasilia Standard Time),Fri Aug 13 2021 11:58:28 GMT-0300 (Brasilia Standard Time)
RT @fabiolacidral: Bom dia! o UOL News já começou. Teremos entrevista ao vivo com @RodrigoMaia,35260027,,,35260027,RodrigoMaia,,,1,0,Mon Sep 20 2021 20:28:09 GMT-0300 (Brasilia Standard Time),Fri Aug 13 2021 08:17:04 GMT-0300 (Brasilia Standard Time)
Vale ler esse trecho do artigo do Samuel Pessoa👇 https://t.co/Pdkb9Eblgg,35260027,,,35260027,RodrigoMaia,,,29,484,Mon Sep 20 2021 20:28:09 GMT-0300 (Brasilia Standard Time),Thu Aug 12 2021 22:19:49 GMT-0300 (Brasilia Standard Time)
Este Bolsonaro é uma piada. A culpa da inflação é da equipe dele. Deixaram o câmbio desvalorizado e isso contaminou… https://t.co/WnPwrklv8O,35260027,,,35260027,RodrigoMaia,,,387,4000,Mon Sep 20 2021 20:28:09 GMT-0300 (Brasilia Standard Time),Thu Aug 12 2021 22:19:47 GMT-0300 (Brasilia Standard Time)
Na PEC da reforma (contra reforma?) política também destruíram a regra da cláusula de desempenho.,35260027,,,35260027,RodrigoMaia,,,39,695,Mon Sep 20 2021 20:28:09 GMT-0300 (Brasilia Standard Time),Thu Aug 12 2021 20:46:12 GMT-0300 (Brasilia Standard Time)
"Ora, ora, não ia cortar gastos? Não ia tirar o Estado do cangote do povo brasileiro? Falastrão. https://t.co/ywllgoE2jl",35260027,,,35260027,RodrigoMaia,,,222,2249,Mon Sep 20 2021 20:28:09 GMT-0300 (Brasilia Standard Time),Thu Aug 12 2021 12:26:37 GMT-0300 (Brasilia Standard Time)
"Tirararam o bode da sala (distritão) e agora estão querendo voltar com as coligações. Se passar, será um grande retrocesso.",35260027,,,35260027,RodrigoMaia,,,224,3914,Mon Sep 20 2021 20:28:09 GMT-0300 (Brasilia Standard Time),Wed Aug 11 2021 22:23:55 GMT-0300 (Brasilia Standard Time)
A votação do distritão é um erro histórico. Atende apenas aos interesses da base bolsonarista.,35260027,,,35260027,RodrigoMaia,,,466,8004,Mon Sep 20 2021 20:28:09 GMT-0300 (Brasilia Standard Time),Wed Aug 11 2021 20:21:10 GMT-0300 (Brasilia Standard Time)
Brasil de Bolsonaro. Empresas abandonando o nosso país. Reforço o que disse anteriormente: investidor de longo praz… https://t.co/NihDKGLXjB,35260027,,,35260027,RodrigoMaia,,,228,1856,Mon Sep 20 2021 20:28:09 GMT-0300 (Brasilia Standard Time),Wed Aug 11 2021 17:30:09 GMT-0300 (Brasilia Standard Time)
BOLSONARO PERDEU. Espero que agora ele cuide dos verdadeiros problemas do Brasil. https://t.co/5l4RQ4HlM8,35260027,,,35260027,RodrigoMaia,,,451,7455,Mon Sep 20 2021 20:28:09 GMT-0300 (Brasilia Standard Time),Tue Aug 10 2021 22:05:09 GMT-0300 (Brasilia Standard Time)
Um absurdo esta PEC. https://t.co/1m1CzuyYpi,35260027,,,35260027,RodrigoMaia,,,26,292,Mon Sep 20 2021 20:28:09 GMT-0300 (Brasilia Standard Time),Tue Aug 10 2021 14:37:50 GMT-0300 (Brasilia Standard Time)
Receitas e despesas fora do orçamento na PEC dos precatórios. Bela pedalada fiscal. E uma grande desmoralização para os técnicos do Tesouro.,35260027,,,35260027,RodrigoMaia,,,208,2135,Mon Sep 20 2021 20:28:09 GMT-0300 (Brasilia Standard Time),Tue Aug 10 2021 12:23:21 GMT-0300 (Brasilia Standard Time)
Agora entendi. É uma parada da Disney. https://t.co/cteVQB5XIr,35260027,,,35260027,RodrigoMaia,,,1715,21814,Mon Sep 20 2021 20:28:09 GMT-0300 (Brasilia Standard Time),Tue Aug 10 2021 10:13:41 GMT-0300 (Brasilia Standard Time)
"Bolsonarismo e chavismo são irmãos. São populistas, irresponsáveis, paranóicos e inconsequentes.",35260027,,,35260027,RodrigoMaia,,,55,701,Mon Sep 20 2021 20:28:09 GMT-0300 (Brasilia Standard Time),Tue Aug 10 2021 08:53:10 GMT-0300 (Brasilia Standard Time)
Não é acaso. É semelhança e método idênticos. Estamos vivendo um chavismo de direita. https://t.co/CFg27HdVNJ,35260027,,,35260027,RodrigoMaia,,,124,1436,Mon Sep 20 2021 20:28:09 GMT-0300 (Brasilia Standard Time),Tue Aug 10 2021 08:52:47 GMT-0300 (Brasilia Standard Time)
No dia de hoje lembro do meu discurso no dia da votação da Previdência: “investidor de longo prazo não investe em p… https://t.co/cOH7wbXod1,35260027,,,35260027,RodrigoMaia,,,352,6335,Mon Sep 20 2021 20:28:09 GMT-0300 (Brasilia Standard Time),Tue Aug 10 2021 08:38:14 GMT-0300 (Brasilia Standard Time)
"O último presidente que inventou ficar passeando de tanque terminou mal o governo e foi preso: Alberto Fujimori, no Peru.",35260027,,,35260027,RodrigoMaia,,,1547,24021,Mon Sep 20 2021 20:28:09 GMT-0300 (Brasilia Standard Time),Mon Aug 09 2021 20:25:08 GMT-0300 (Brasilia Standard Time)
O que seria o meio termo em relação ao voto impresso? A urna eletrônica é meio séria e meio fraude? Esse debate hoj… https://t.co/ej7yZ1LSmZ,35260027,,,35260027,RodrigoMaia,,,7,226,Mon Sep 20 2021 20:28:09 GMT-0300 (Brasilia Standard Time),Mon Aug 09 2021 19:20:38 GMT-0300 (Brasilia Standard Time)
Espero que o presidente Bolsonaro entenda que há limites na Constituição e que as Forças Armadas possam recuar dest… https://t.co/dHRThMFCH1,35260027,,,35260027,RodrigoMaia,,,29,432,Mon Sep 20 2021 20:28:09 GMT-0300 (Brasilia Standard Time),Mon Aug 09 2021 17:59:58 GMT-0300 (Brasilia Standard Time)
Agora há pouco à @CNNBrasil reafirmei que o governo Bolsonaro caminha a passos largos para o populismo fiscal. Essa… https://t.co/1DgIcm3vic,35260027,,,35260027,RodrigoMaia,,,131,1284,Mon Sep 20 2021 20:28:09 GMT-0300 (Brasilia Standard Time),Mon Aug 09 2021 17:54:49 GMT-0300 (Brasilia Standard Time)
