text,query,country,city,userId,username,quote_count,reply_count,retweet_count,favorite_count,timestamp,createdAt
"TODA TERÇA, 19h30, este é nosso compromisso em todas as redes!

Mande sua pergunta aqui nos comentários e diga de q… https://t.co/8opheVY4GU",33374761,,,33374761,cirogomes,,,62,446,Mon Sep 20 2021 20:30:15 GMT-0300 (Brasilia Standard Time),Mon Sep 20 2021 19:08:25 GMT-0300 (Brasilia Standard Time)
Adivinha quem está passando por um 'intensivão' de games com Giselle e Gael? 😅 É pra fazer bonito na CIRO GAMES - A… https://t.co/v4ZeFqKOX9,33374761,,,33374761,cirogomes,,,193,1219,Mon Sep 20 2021 20:30:15 GMT-0300 (Brasilia Standard Time),Mon Sep 20 2021 19:08:25 GMT-0300 (Brasilia Standard Time)
Vai ter mais game e estreia da @thabataganga para comentar sobre esse universo. Vai ter mais interação ao vivo e do… https://t.co/0fHueIFhMD,33374761,,,33374761,cirogomes,,,544,2488,Mon Sep 20 2021 20:30:15 GMT-0300 (Brasilia Standard Time),Mon Sep 20 2021 12:01:07 GMT-0300 (Brasilia Standard Time)
"Bolsonaro virou as costas para os caminhoneiros. O preço do diesel aumenta toda semana, o que é uma tremenda injust… https://t.co/SwgRxD7TKQ",33374761,,,33374761,cirogomes,,,1539,5594,Mon Sep 20 2021 20:30:15 GMT-0300 (Brasilia Standard Time),Mon Sep 20 2021 09:02:47 GMT-0300 (Brasilia Standard Time)
Aqui treinando para o próximo #CiroGames. Pronto para qualquer desafio ! https://t.co/K19EokgDMT,33374761,,,33374761,cirogomes,,,357,3093,Mon Sep 20 2021 20:30:15 GMT-0300 (Brasilia Standard Time),Sun Sep 19 2021 16:57:36 GMT-0300 (Brasilia Standard Time)
"Bom dia, turma! Todo mundo já tomou seu bom café com cuscuz pra começar esse domingo? https://t.co/osY9GPaCX2",33374761,,,33374761,cirogomes,,,381,5734,Mon Sep 20 2021 20:30:15 GMT-0300 (Brasilia Standard Time),Sun Sep 19 2021 08:53:32 GMT-0300 (Brasilia Standard Time)
"Quem aí já assistiu Dark, da @NetflixBrasil? O @BelemJameson fez uma analogia super bacana do roteiro da série com… https://t.co/SehAlxGgRR",33374761,,,33374761,cirogomes,,,415,2376,Mon Sep 20 2021 20:30:15 GMT-0300 (Brasilia Standard Time),Sat Sep 18 2021 12:02:42 GMT-0300 (Brasilia Standard Time)
Surpreendi @RicaPerrone ao revelar meu passado de comentarista esportivo em Sobral. Também revelei qual meu time do… https://t.co/BMq8MnLNox,33374761,,,33374761,cirogomes,,,520,3300,Mon Sep 20 2021 20:30:15 GMT-0300 (Brasilia Standard Time),Sat Sep 18 2021 09:00:02 GMT-0300 (Brasilia Standard Time)
"Hoje vou conversar com @antonionetopdt, presidente nacional da Central dos Sindicatos Brasileiros, @marceloramosam,… https://t.co/gQcuHvCFW0",33374761,,,33374761,cirogomes,,,294,1540,Mon Sep 20 2021 20:30:15 GMT-0300 (Brasilia Standard Time),Fri Sep 17 2021 17:59:39 GMT-0300 (Brasilia Standard Time)
"Por fim, Ciro aumentou a sua vantagem num eventual segundo turno com Bolsonaro. Ele venceria a disputa por 52% a 33… https://t.co/6bdLtNx9Me",33374761,,,33374761,cirogomes,,,143,1264,Mon Sep 20 2021 20:30:15 GMT-0300 (Brasilia Standard Time),Fri Sep 17 2021 13:11:04 GMT-0300 (Brasilia Standard Time)
"Num dos cenários, Ciro chega a 12%, crescimento de três pontos em relação à pesquisa anterior. Ele também tem a men… https://t.co/P5YDVIKXYE",33374761,,,33374761,cirogomes,,,156,1272,Mon Sep 20 2021 20:30:15 GMT-0300 (Brasilia Standard Time),Fri Sep 17 2021 13:11:04 GMT-0300 (Brasilia Standard Time)
Uma leitura mais apurada da pesquisa Datafolha divulgada hoje revela boas notícias para Ciro. Ele se mantém em terc… https://t.co/KZclk2JxiU,33374761,,,33374761,cirogomes,,,616,3666,Mon Sep 20 2021 20:30:15 GMT-0300 (Brasilia Standard Time),Fri Sep 17 2021 13:11:03 GMT-0300 (Brasilia Standard Time)
MAIS UMA QUE VAI PRO LIXO! Fake News bolsonarista aqui não se cria. Agora é assim: a gente desmente na hora e com p… https://t.co/I5PkgQOVEg,33374761,,,33374761,cirogomes,,,496,2370,Mon Sep 20 2021 20:30:15 GMT-0300 (Brasilia Standard Time),Fri Sep 17 2021 12:46:47 GMT-0300 (Brasilia Standard Time)
Muita gente conhece a Banda Didá que se apresenta em shows e grava clipes ao lado de grandes estrelas da música. Ma… https://t.co/Z17bjhcmVP,33374761,,,33374761,cirogomes,,,716,2653,Mon Sep 20 2021 20:30:15 GMT-0300 (Brasilia Standard Time),Fri Sep 17 2021 09:00:02 GMT-0300 (Brasilia Standard Time)
"Respondi quais são minhas propostas para ajudar milhares de estudantes endividados com o FIES. No vídeo, falo da im… https://t.co/GFYhHd3Ole",33374761,,,33374761,cirogomes,,,460,2183,Mon Sep 20 2021 20:30:15 GMT-0300 (Brasilia Standard Time),Thu Sep 16 2021 20:18:19 GMT-0300 (Brasilia Standard Time)
É o aumento criminoso da marcha da insensatez ou a velha técnica da cortina de fumaça de uma polêmica para encobrir… https://t.co/AJOy8myACQ,33374761,,,33374761,cirogomes,,,273,2846,Mon Sep 20 2021 20:30:15 GMT-0300 (Brasilia Standard Time),Thu Sep 16 2021 18:31:32 GMT-0300 (Brasilia Standard Time)
"No mesmo dia em que a CPI revela o escândalo da ocultação, em estudo divulgado pelo governo, de mortes causadas pel… https://t.co/GjS7e4qOSR",33374761,,,33374761,cirogomes,,,694,5405,Mon Sep 20 2021 20:30:15 GMT-0300 (Brasilia Standard Time),Thu Sep 16 2021 18:31:32 GMT-0300 (Brasilia Standard Time)
"'Bom dia, Vietnã', ops, 'boa noite, Brasil'! Só quem assistiu a live desta terça-feira vai pegar essa referência. P… https://t.co/mem4QSNSGB",33374761,,,33374761,cirogomes,,,286,1679,Mon Sep 20 2021 20:30:15 GMT-0300 (Brasilia Standard Time),Thu Sep 16 2021 12:02:05 GMT-0300 (Brasilia Standard Time)
"A crise que vivemos levou milhões à pobreza, está causando uma crise alimentar sem precedentes e provocando o maior… https://t.co/H12zWqadQN",33374761,,,33374761,cirogomes,,,681,2363,Mon Sep 20 2021 20:30:15 GMT-0300 (Brasilia Standard Time),Thu Sep 16 2021 09:00:02 GMT-0300 (Brasilia Standard Time)
"@trabalove @gisellebezerra Obrigado, @trabalove ! Muito bom ter esse retorno. Estamos recebendo muitas sugestões e… https://t.co/TsnBfVVWk2",33374761,,,33374761,cirogomes,,,57,904,Mon Sep 20 2021 20:30:15 GMT-0300 (Brasilia Standard Time),Wed Sep 15 2021 11:23:09 GMT-0300 (Brasilia Standard Time)
"Para quem ainda tem dúvidas sobre me apoiar ou não, só peço uma coisa: pesquise a minha biografia e conheça as minh… https://t.co/MQfGSaiT0l",33374761,,,33374761,cirogomes,,,599,2513,Mon Sep 20 2021 20:30:15 GMT-0300 (Brasilia Standard Time),Wed Sep 15 2021 09:00:03 GMT-0300 (Brasilia Standard Time)
"E viva, também, por antecipação, nosso Dia da Democracia, o 25 de outubro. Ele assinala a morte horrenda de Vladimi… https://t.co/74J6hrARET",33374761,,,33374761,cirogomes,,,173,1387,Mon Sep 20 2021 20:30:15 GMT-0300 (Brasilia Standard Time),Wed Sep 15 2021 08:10:54 GMT-0300 (Brasilia Standard Time)
"Para um democrata, todo dia é dia da democracia . Todo minuto também. Ela é o ar que respiramos. Mas é bom ter data… https://t.co/iAMiodmRpk",33374761,,,33374761,cirogomes,,,434,3190,Mon Sep 20 2021 20:30:15 GMT-0300 (Brasilia Standard Time),Wed Sep 15 2021 08:10:53 GMT-0300 (Brasilia Standard Time)
"Nossa live de hoje foi incrível, com mulheres de muita garra e força! Meus agradecimentos às duas convidadas especi… https://t.co/0fHdmzaQ4M",33374761,,,33374761,cirogomes,,,245,1611,Mon Sep 20 2021 20:30:15 GMT-0300 (Brasilia Standard Time),Tue Sep 14 2021 20:57:55 GMT-0300 (Brasilia Standard Time)
"""O impeachment de Bolsonaro é uma necessidade. Nós estamos vivendo o pior exemplo do exercício da direita no mundo.… https://t.co/brNH04iRkc",33374761,,,33374761,cirogomes,,,305,2007,Mon Sep 20 2021 20:30:15 GMT-0300 (Brasilia Standard Time),Tue Sep 14 2021 20:44:31 GMT-0300 (Brasilia Standard Time)
"Poderá ter um colapso na oferta de energia elétrica! Enquanto isso, o preço da energia elétrica está explodindo e o… https://t.co/EisRm4cCCs",33374761,,,33374761,cirogomes,,,235,2046,Mon Sep 20 2021 20:30:15 GMT-0300 (Brasilia Standard Time),Tue Sep 14 2021 20:39:17 GMT-0300 (Brasilia Standard Time)
Se prepare! A conta de energia elétrica deve piorar! Dia 15 de outubro as usinas hidrelétricas brasileiras vão come… https://t.co/roLZj5bZT3,33374761,,,33374761,cirogomes,,,860,6669,Mon Sep 20 2021 20:30:15 GMT-0300 (Brasilia Standard Time),Tue Sep 14 2021 20:39:17 GMT-0300 (Brasilia Standard Time)
"Todo mundo no game? Ciro conversa agora com @lucianasantos, vice-governadora de Pernambuco e presidente nacional do… https://t.co/wQLAPLhasb",33374761,,,33374761,cirogomes,,,153,968,Mon Sep 20 2021 20:30:15 GMT-0300 (Brasilia Standard Time),Tue Sep 14 2021 20:35:02 GMT-0300 (Brasilia Standard Time)
A cultura pra mim é um elemento absolutamente central e isso pode ser visto nos orçamentos que eu pratiquei como pr… https://t.co/JWbevivbfK,33374761,,,33374761,cirogomes,,,234,1504,Mon Sep 20 2021 20:30:15 GMT-0300 (Brasilia Standard Time),Tue Sep 14 2021 20:28:29 GMT-0300 (Brasilia Standard Time)
"""Meu ideal é ver esse Brasil como um país todo realizado financeiramente, com saúde e com educação para todo mundo""… https://t.co/UHG75iP84d",33374761,,,33374761,cirogomes,,,207,1391,Mon Sep 20 2021 20:30:15 GMT-0300 (Brasilia Standard Time),Tue Sep 14 2021 20:22:52 GMT-0300 (Brasilia Standard Time)
"Bolsonaro atenta contra o regular funcionamento da instituições, expôs a sociedade brasileira ao genocídio, comete… https://t.co/gv8pFqlkHX",33374761,,,33374761,cirogomes,,,114,892,Mon Sep 20 2021 20:30:15 GMT-0300 (Brasilia Standard Time),Tue Sep 14 2021 20:21:56 GMT-0300 (Brasilia Standard Time)
O impeachment do Bolsonaro é uma tarefa absolutamente necessária por uma coisa muito simples: ele tem cometido sist… https://t.co/Ebw6hWKFhc,33374761,,,33374761,cirogomes,,,373,3108,Mon Sep 20 2021 20:30:15 GMT-0300 (Brasilia Standard Time),Tue Sep 14 2021 20:21:55 GMT-0300 (Brasilia Standard Time)
"Vem que agora a @gisellebezerra tá ON! #CiroGames

Já enviou sua pergunta pra live de hoje? https://t.co/nVT7lax6ma",33374761,,,33374761,cirogomes,,,148,1037,Mon Sep 20 2021 20:30:15 GMT-0300 (Brasilia Standard Time),Tue Sep 14 2021 20:05:40 GMT-0300 (Brasilia Standard Time)
https://t.co/HBmSJnSJAw,33374761,,,33374761,cirogomes,,,51,329,Mon Sep 20 2021 20:30:15 GMT-0300 (Brasilia Standard Time),Tue Sep 14 2021 19:56:54 GMT-0300 (Brasilia Standard Time)
Nossa querida @alcione_marrom está ON na #CiroGames! Vem conferir! https://t.co/jOlhlrKjAI,33374761,,,33374761,cirogomes,,,217,1446,Mon Sep 20 2021 20:30:15 GMT-0300 (Brasilia Standard Time),Tue Sep 14 2021 19:51:43 GMT-0300 (Brasilia Standard Time)
Quem viu Ciro e Gael jogando Minecraft na #CiroGames? Estamos ON! https://t.co/vsVGuU7rCO,33374761,,,33374761,cirogomes,,,299,3108,Mon Sep 20 2021 20:30:15 GMT-0300 (Brasilia Standard Time),Tue Sep 14 2021 19:44:04 GMT-0300 (Brasilia Standard Time)
CIRO GAMES | 14/09/21 com Alcione e Luciana Santos https://t.co/vELBhlkdtF,33374761,,,33374761,cirogomes,,,310,1343,Mon Sep 20 2021 20:30:15 GMT-0300 (Brasilia Standard Time),Tue Sep 14 2021 19:04:03 GMT-0300 (Brasilia Standard Time)
"CIRO GAMES - A LIVE DO CIRÃO começa logo mais, às 19h30! 

Vcs podem escolher aqui onde querem ver:… https://t.co/HjExXD4YgF",33374761,,,33374761,cirogomes,,,306,1239,Mon Sep 20 2021 20:30:15 GMT-0300 (Brasilia Standard Time),Tue Sep 14 2021 16:10:36 GMT-0300 (Brasilia Standard Time)
Considero esta uma das melhores e mais completas conversas que tive nos últimos tempos. A íntegra está em:… https://t.co/gSJpjH4Bcj,33374761,,,33374761,cirogomes,,,130,834,Mon Sep 20 2021 20:30:15 GMT-0300 (Brasilia Standard Time),Tue Sep 14 2021 12:28:13 GMT-0300 (Brasilia Standard Time)
"Tive a honra de participar de um debate com o grupo Parlatório, que reúne algumas das pessoas mais competentes e in… https://t.co/lhmZXlZUxt",33374761,,,33374761,cirogomes,,,528,2365,Mon Sep 20 2021 20:30:15 GMT-0300 (Brasilia Standard Time),Tue Sep 14 2021 12:27:31 GMT-0300 (Brasilia Standard Time)
"Alcione, grande voz da música brasileira, e Luciana Santos, vice-governadora de Pernambuco e presidente nacional do… https://t.co/0dytAODGCa",33374761,,,33374761,cirogomes,,,312,1887,Mon Sep 20 2021 20:30:15 GMT-0300 (Brasilia Standard Time),Tue Sep 14 2021 11:38:23 GMT-0300 (Brasilia Standard Time)
Ciro e Gael passando pra lembrar que nesta terça-feira tem CIRO GAMES - A LIVE DO CIRÃO! Quer participar do nosso b… https://t.co/GsL9FpmRud,33374761,,,33374761,cirogomes,,,219,1487,Mon Sep 20 2021 20:30:15 GMT-0300 (Brasilia Standard Time),Tue Sep 14 2021 10:19:16 GMT-0300 (Brasilia Standard Time)
"Você apoia Lula? Pensa em votar nele em 2022? Tudo bem, respeito a sua opção. TEM UM POUCO DE DÚVIDA? NORMAL. Só pe… https://t.co/TWOgWZebcv",33374761,,,33374761,cirogomes,,,713,4137,Mon Sep 20 2021 20:30:15 GMT-0300 (Brasilia Standard Time),Tue Sep 14 2021 09:00:00 GMT-0300 (Brasilia Standard Time)
"Participo agora de um debate com os professores Darc Costa, Bresser-Pereira, Helid Raphael de Carvalho e Eurico Fig… https://t.co/1b5YzN1bSu",33374761,,,33374761,cirogomes,,,305,1672,Mon Sep 20 2021 20:30:15 GMT-0300 (Brasilia Standard Time),Mon Sep 13 2021 19:17:10 GMT-0300 (Brasilia Standard Time)
"No canal Politizando, Willian Jacob afirma que “Ciro sai fortalecido dos protestos contra Bolsonaro”. #CiroNaPaulista",33374761,,,33374761,cirogomes,,,156,1465,Mon Sep 20 2021 20:30:15 GMT-0300 (Brasilia Standard Time),Mon Sep 13 2021 12:54:49 GMT-0300 (Brasilia Standard Time)
A presença de Ciro gerou mais reações positivas. @antoniotabet postou que Ciro foi “o vencedor” do ato. “Foi aplaud… https://t.co/AU42Di5W9k,33374761,,,33374761,cirogomes,,,148,1305,Mon Sep 20 2021 20:30:15 GMT-0300 (Brasilia Standard Time),Mon Sep 13 2021 12:54:48 GMT-0300 (Brasilia Standard Time)
"Ciro liderou a pesquisa com 16%, seguido por Lula (14%), Sérgio Moro (11%), João Amoedo (8%) e João Doria (7%). #CiroNaPaulista",33374761,,,33374761,cirogomes,,,92,663,Mon Sep 20 2021 20:30:15 GMT-0300 (Brasilia Standard Time),Mon Sep 13 2021 12:54:48 GMT-0300 (Brasilia Standard Time)
Levantamento realizado por professores da Universidade de São Paulo (USP) apontou Ciro Gomes como o candidato prefe… https://t.co/69fqBLTR6v,33374761,,,33374761,cirogomes,,,510,4557,Mon Sep 20 2021 20:30:15 GMT-0300 (Brasilia Standard Time),Mon Sep 13 2021 12:54:47 GMT-0300 (Brasilia Standard Time)
Tirar uma fala do contexto ou editar o conteúdo para mostrar só um lado da história são marcas registradas das fake… https://t.co/pgOPHRTi1a,33374761,,,33374761,cirogomes,,,676,3039,Mon Sep 20 2021 20:30:15 GMT-0300 (Brasilia Standard Time),Mon Sep 13 2021 09:00:03 GMT-0300 (Brasilia Standard Time)
Foi emocionante participar do ato na Paulista e ver que é possível superar eventuais divergências em nome da democr… https://t.co/FBLh2T2b6y,33374761,,,33374761,cirogomes,,,861,5558,Mon Sep 20 2021 20:30:15 GMT-0300 (Brasilia Standard Time),Sun Sep 12 2021 22:38:57 GMT-0300 (Brasilia Standard Time)
"Participo agora de um debate sobre o futuro da nação brasileira, a convite do Grupo Parlatório. Acompanhe!… https://t.co/paoX0tjGB5",33374761,,,33374761,cirogomes,,,372,2291,Mon Sep 20 2021 20:30:15 GMT-0300 (Brasilia Standard Time),Sun Sep 12 2021 18:13:42 GMT-0300 (Brasilia Standard Time)
"""Isso é só começo"" - trecho do discurso de #CiroNaPaulista 

Foto: Karen Lusvardi https://t.co/1YkY7eIyBs",33374761,,,33374761,cirogomes,,,385,3668,Mon Sep 20 2021 20:30:15 GMT-0300 (Brasilia Standard Time),Sun Sep 12 2021 17:30:49 GMT-0300 (Brasilia Standard Time)
“Assumo qualquer risco e qualquer contradição para defender o povo brasileiro”. Trecho do discurso de… https://t.co/Dq2FSequU9,33374761,,,33374761,cirogomes,,,503,4402,Mon Sep 20 2021 20:30:15 GMT-0300 (Brasilia Standard Time),Sun Sep 12 2021 16:18:25 GMT-0300 (Brasilia Standard Time)
Senti um carinho enome na Paulista. As diferenças foram superadas em nome da defesa da democracia. #ForaBolsonaro… https://t.co/p59vp4Q6yo,33374761,,,33374761,cirogomes,,,504,3367,Mon Sep 20 2021 20:30:15 GMT-0300 (Brasilia Standard Time),Sun Sep 12 2021 16:10:06 GMT-0300 (Brasilia Standard Time)
O que vi na Paulista foi uma vibração imensa de militantes das mais diversas correntes ideológicas. Todos unidos pe… https://t.co/XYvbnTqZt7,33374761,,,33374761,cirogomes,,,422,3145,Mon Sep 20 2021 20:30:15 GMT-0300 (Brasilia Standard Time),Sun Sep 12 2021 16:08:29 GMT-0300 (Brasilia Standard Time)
Ciro empolga a Paulista! #ForaBolsonaro #CiroNaPaulista https://t.co/dZ9TR3FGIb,33374761,,,33374761,cirogomes,,,712,10464,Mon Sep 20 2021 20:30:15 GMT-0300 (Brasilia Standard Time),Sun Sep 12 2021 16:06:05 GMT-0300 (Brasilia Standard Time)
"Autografando o livro ""Projeto Nacional - Dever da Esperança"" no meio da multidão. #CiroNaPaulista https://t.co/HLMZIjqc8i",33374761,,,33374761,cirogomes,,,318,2749,Mon Sep 20 2021 20:30:15 GMT-0300 (Brasilia Standard Time),Sun Sep 12 2021 16:02:51 GMT-0300 (Brasilia Standard Time)
Eu e @gisellebezerra também recebemos esse carinho muito especial. 😍🌹 #CiroNaPaulista #ForaBolsonaro https://t.co/r07mPg6EyN,33374761,,,33374761,cirogomes,,,283,2503,Mon Sep 20 2021 20:30:15 GMT-0300 (Brasilia Standard Time),Sun Sep 12 2021 15:50:05 GMT-0300 (Brasilia Standard Time)
"Já na chegada, recebi o carinho da militância do PDT. Muito obrigado a toda essa Turma Boa! #CiroNaPaulista https://t.co/PKKCmlcEyI",33374761,,,33374761,cirogomes,,,324,2968,Mon Sep 20 2021 20:30:15 GMT-0300 (Brasilia Standard Time),Sun Sep 12 2021 15:46:38 GMT-0300 (Brasilia Standard Time)
O ato da Paulista me encheu de esperança no futuro do Brasil. Deixamos de lado nossas diferenças e nos unimos pela… https://t.co/olCNGow57I,33374761,,,33374761,cirogomes,,,1084,6432,Mon Sep 20 2021 20:30:15 GMT-0300 (Brasilia Standard Time),Sun Sep 12 2021 15:40:29 GMT-0300 (Brasilia Standard Time)
RT @APrimeiraVia: ATENÇÃO! CIRO GOMES ACABA DE SUBIR NO PALANQUE #CiroNaPaulista  https://t.co/ezt3awN9e1,33374761,,,33374761,cirogomes,,,343,0,Mon Sep 20 2021 20:30:15 GMT-0300 (Brasilia Standard Time),Sun Sep 12 2021 15:32:10 GMT-0300 (Brasilia Standard Time)
RT @APrimeiraVia: CIRO ACABA DE CHEGAR! ARREPIANTE! HISTÓRICO! #CiroNaPaulista  https://t.co/YObm5K6HUM,33374761,,,33374761,cirogomes,,,291,0,Mon Sep 20 2021 20:30:15 GMT-0300 (Brasilia Standard Time),Sun Sep 12 2021 15:30:15 GMT-0300 (Brasilia Standard Time)
Aumenta a multidão que clama #ForaBolsonaro na Paulista! #CiroNaPaulista https://t.co/pYD2FSSt3U,33374761,,,33374761,cirogomes,,,732,7374,Mon Sep 20 2021 20:30:15 GMT-0300 (Brasilia Standard Time),Sun Sep 12 2021 15:05:19 GMT-0300 (Brasilia Standard Time)
"Militância do PDT já marca presença no ato #ForaBolsonaro, que vai reunindo muita gente na Avenida Paulista. Daqui… https://t.co/yNK6xe53KQ",33374761,,,33374761,cirogomes,,,654,4666,Mon Sep 20 2021 20:30:15 GMT-0300 (Brasilia Standard Time),Sun Sep 12 2021 14:50:44 GMT-0300 (Brasilia Standard Time)
"Admiro e respeito o setor do agronegócio, sem o qual o Brasil não teria atravessado este e outros períodos tão difí… https://t.co/HSbklPwTc5",33374761,,,33374761,cirogomes,,,228,2341,Mon Sep 20 2021 20:30:15 GMT-0300 (Brasilia Standard Time),Sat Sep 11 2021 15:44:08 GMT-0300 (Brasilia Standard Time)
"Qdo usei a expressão ""de bandidos do agro"", estava me referindo a uma minoria ínfima da categoria: aqueles poucos q… https://t.co/O851nOdsNC",33374761,,,33374761,cirogomes,,,273,2648,Mon Sep 20 2021 20:30:15 GMT-0300 (Brasilia Standard Time),Sat Sep 11 2021 15:44:07 GMT-0300 (Brasilia Standard Time)
"Considero os empreendedores do agronegócios como grandes responsáveis pelo progresso do país. Não admito, portanto,… https://t.co/jiDxT2iFHt",33374761,,,33374761,cirogomes,,,578,5011,Mon Sep 20 2021 20:30:15 GMT-0300 (Brasilia Standard Time),Sat Sep 11 2021 15:44:07 GMT-0300 (Brasilia Standard Time)
O Projeto Nacional para o nosso país deve ser desenhado a muitas mãos e dizer com transparência seus objetivos e co… https://t.co/3by7if1nUm,33374761,,,33374761,cirogomes,,,150,1132,Mon Sep 20 2021 20:30:15 GMT-0300 (Brasilia Standard Time),Sat Sep 11 2021 13:26:32 GMT-0300 (Brasilia Standard Time)
Tive uma manhã de muito aprendizado e aprofundamento de ideias e projetos para o Brasil com os amigos Paulo Rabelo… https://t.co/Z2eEmiZKq8,33374761,,,33374761,cirogomes,,,297,2642,Mon Sep 20 2021 20:30:15 GMT-0300 (Brasilia Standard Time),Sat Sep 11 2021 13:26:32 GMT-0300 (Brasilia Standard Time)
"Já contei que na adolescência, pra conseguir uma rendinha a mais, aprendi a fazer artesanato? E dias desses, partic… https://t.co/8lNfxXNYpu",33374761,,,33374761,cirogomes,,,438,2420,Mon Sep 20 2021 20:30:15 GMT-0300 (Brasilia Standard Time),Sat Sep 11 2021 09:00:00 GMT-0300 (Brasilia Standard Time)
@leolupi_rio @PDT_Nacional 👏👏👏,33374761,,,33374761,cirogomes,,,9,370,Mon Sep 20 2021 20:30:15 GMT-0300 (Brasilia Standard Time),Sat Sep 11 2021 06:46:59 GMT-0300 (Brasilia Standard Time)
"Muito obrigado pelo convite para o diálogo, @RicaPerrone. Agradeço também a todos e todas que acompanharam a live d… https://t.co/dKlB7giS0T",33374761,,,33374761,cirogomes,,,428,5109,Mon Sep 20 2021 20:30:15 GMT-0300 (Brasilia Standard Time),Fri Sep 10 2021 20:07:56 GMT-0300 (Brasilia Standard Time)
"Eu tenho um amor profundo pelo Brasil, tenho experiência e um Projeto Nacional de Desenvolvimento. Quero entrar par… https://t.co/tgTSMCVPhB",33374761,,,33374761,cirogomes,,,478,4245,Mon Sep 20 2021 20:30:15 GMT-0300 (Brasilia Standard Time),Fri Sep 10 2021 19:56:31 GMT-0300 (Brasilia Standard Time)
Se a gente entra num processo de banditismo internacional eles fazem um embargo e podem nos liquidar. O Bolsonaro é… https://t.co/L6OIpXfhyE,33374761,,,33374761,cirogomes,,,119,836,Mon Sep 20 2021 20:30:15 GMT-0300 (Brasilia Standard Time),Fri Sep 10 2021 19:23:09 GMT-0300 (Brasilia Standard Time)
"O Brasil depende vitalmente, como a gente depende para respirar, das relações internacionais. Todo o aparato que us… https://t.co/7Udg6tUMo3",33374761,,,33374761,cirogomes,,,256,1710,Mon Sep 20 2021 20:30:15 GMT-0300 (Brasilia Standard Time),Fri Sep 10 2021 19:23:09 GMT-0300 (Brasilia Standard Time)
"Bolsonaro tentou, pessoalmente, um golpe nesse 7 de setembro com muita grana pública, envolvimento de bandidos do a… https://t.co/ycJDhoi3fP",33374761,,,33374761,cirogomes,,,439,4850,Mon Sep 20 2021 20:30:15 GMT-0300 (Brasilia Standard Time),Fri Sep 10 2021 19:21:23 GMT-0300 (Brasilia Standard Time)
"Ao vivo com @RicaPerrone! Assista e compartilhe: #CiroNoRicaPerrone

➡️ https://t.co/vF1hQtbIRN https://t.co/ozT3BsPKzE",33374761,,,33374761,cirogomes,,,244,1187,Mon Sep 20 2021 20:30:15 GMT-0300 (Brasilia Standard Time),Fri Sep 10 2021 18:15:51 GMT-0300 (Brasilia Standard Time)
"ATENÇÃO!
Link atualizado: https://t.co/vF1hQtbIRN

Compartilhe e use a hashtag #CiroNoRicaPerrone",33374761,,,33374761,cirogomes,,,128,569,Mon Sep 20 2021 20:30:15 GMT-0300 (Brasilia Standard Time),Fri Sep 10 2021 17:35:37 GMT-0300 (Brasilia Standard Time)
"Turma, logo mais vou conversar com @RicaPerrone. Assista ao vivo pelo YouTube: https://t.co/nP5HOwgRE3

De qual lug… https://t.co/Bnl7kg8Z1P",33374761,,,33374761,cirogomes,,,297,1812,Mon Sep 20 2021 20:30:15 GMT-0300 (Brasilia Standard Time),Fri Sep 10 2021 17:22:26 GMT-0300 (Brasilia Standard Time)
Me coloquei à disposição para qualquer debate no sentido de proteger a Democracia brasileira e que tenha mediação d… https://t.co/dX9pnUNORg,33374761,,,33374761,cirogomes,,,116,1211,Mon Sep 20 2021 20:30:15 GMT-0300 (Brasilia Standard Time),Fri Sep 10 2021 13:09:49 GMT-0300 (Brasilia Standard Time)
"Sinto uma grande alegria de ver essa renovação que a UNE experimenta. Bruna, Flávia e tantas outras e outros que es… https://t.co/KMdM9a08I6",33374761,,,33374761,cirogomes,,,106,1234,Mon Sep 20 2021 20:30:15 GMT-0300 (Brasilia Standard Time),Fri Sep 10 2021 13:09:49 GMT-0300 (Brasilia Standard Time)
"A UNE, que participará da manifestação desse dia 12, tem um papel importante e sensível de debate e mobilização da… https://t.co/sm5E3H6hAW",33374761,,,33374761,cirogomes,,,198,1665,Mon Sep 20 2021 20:30:15 GMT-0300 (Brasilia Standard Time),Fri Sep 10 2021 13:09:48 GMT-0300 (Brasilia Standard Time)
"Me encontrei esta manhã com @brunabrelaz, presidenta da @uneoficial, e com @FlaviaCale, presidenta da Associação Na… https://t.co/uCibkBFRLO",33374761,,,33374761,cirogomes,,,415,2649,Mon Sep 20 2021 20:30:15 GMT-0300 (Brasilia Standard Time),Fri Sep 10 2021 13:09:47 GMT-0300 (Brasilia Standard Time)
"E aí, turma? Ainda não viu ou quer rever alguns dos momentos mais divertidos de CIRO GAMES – A LIVE DO CIRÃO com os… https://t.co/h1b4spidfT",33374761,,,33374761,cirogomes,,,366,2106,Mon Sep 20 2021 20:30:15 GMT-0300 (Brasilia Standard Time),Fri Sep 10 2021 12:01:11 GMT-0300 (Brasilia Standard Time)
Agora caiu a ficha até entre os mais ferrenhos bolsonaristas: o homem é um traidor completo. Venho avisando há temp… https://t.co/8KVpQ5J5Pa,33374761,,,33374761,cirogomes,,,1652,10332,Mon Sep 20 2021 20:30:15 GMT-0300 (Brasilia Standard Time),Fri Sep 10 2021 09:00:00 GMT-0300 (Brasilia Standard Time)
"AO VIVO! Entrevista para Campos dos Goytacazes (RJ). Acompanhe! #CiroNaFolhaFM

➡️ https://t.co/XhuBJ928TI

➡️ https://t.co/8gGN83CSRv",33374761,,,33374761,cirogomes,,,136,673,Mon Sep 20 2021 20:30:15 GMT-0300 (Brasilia Standard Time),Fri Sep 10 2021 07:42:18 GMT-0300 (Brasilia Standard Time)
"Gente querida, amanhã vou participar do Folha no Ar, na Folha FM 98,3. Espero vocês a partir das 7h! #CiroNaFolhaFM
https://t.co/YCtHZLqdNk",33374761,,,33374761,cirogomes,,,288,1620,Mon Sep 20 2021 20:30:15 GMT-0300 (Brasilia Standard Time),Thu Sep 09 2021 22:58:37 GMT-0300 (Brasilia Standard Time)
