text,query,country,city,userId,username,quote_count,reply_count,retweet_count,favorite_count,timestamp,createdAt
Estamos ao vivo! Live com a jornalista @DaniellaZupo sobre o livro 'Projeto Nacional: O Dever da Esperança'. Acompa… https://t.co/77MVYaIYOM,33374761,,,33374761,cirogomes,,,238,1101,Mon Sep 20 2021 20:30:15 GMT-0300 (Brasilia Standard Time),Thu Sep 09 2021 20:03:02 GMT-0300 (Brasilia Standard Time)
Só uma coisa é certa : este homem acaba de produzir  a mais sensata insensatez de toda a história política brasilei… https://t.co/0YQGRrqDkH,33374761,,,33374761,cirogomes,,,317,4216,Mon Sep 20 2021 20:30:15 GMT-0300 (Brasilia Standard Time),Thu Sep 09 2021 18:33:28 GMT-0300 (Brasilia Standard Time)
"De qualquer sorte fiquemos bem atentos porque tudo que vem de Bolsonaro não se pode acreditar.
Tudo que vem de Bols… https://t.co/jBxTdob0W0",33374761,,,33374761,cirogomes,,,302,4020,Mon Sep 20 2021 20:30:15 GMT-0300 (Brasilia Standard Time),Thu Sep 09 2021 18:33:28 GMT-0300 (Brasilia Standard Time)
"Um fato que não mais surpreenderia nem mesmo os incautos seguidores que, hoje, ele empurrou para a desgraça e o rid… https://t.co/SpBhwvXWfB",33374761,,,33374761,cirogomes,,,234,2939,Mon Sep 20 2021 20:30:15 GMT-0300 (Brasilia Standard Time),Thu Sep 09 2021 18:33:27 GMT-0300 (Brasilia Standard Time)
"Sendo assim, não me surpreenderá se no futuro viermos a descobrir  algum tenebroso e imoral acordo por baixo das letras desta nota.",33374761,,,33374761,cirogomes,,,230,3062,Mon Sep 20 2021 20:30:15 GMT-0300 (Brasilia Standard Time),Thu Sep 09 2021 18:33:25 GMT-0300 (Brasilia Standard Time)
Porém nos traz uma imensa vergonha porque é a confirmação final de que nosso amado Brasil tem -ou tinha- como presi… https://t.co/V9AxaC53NL,33374761,,,33374761,cirogomes,,,214,3007,Mon Sep 20 2021 20:30:15 GMT-0300 (Brasilia Standard Time),Thu Sep 09 2021 18:33:24 GMT-0300 (Brasilia Standard Time)
"Sinceramente não sei se sua nota traz mais alívio ou vergonha. Não deixa de trazer certo alívio momentâneo,  porque… https://t.co/SV4wByelWG",33374761,,,33374761,cirogomes,,,275,3653,Mon Sep 20 2021 20:30:15 GMT-0300 (Brasilia Standard Time),Thu Sep 09 2021 18:33:24 GMT-0300 (Brasilia Standard Time)
A nota que Bolsonaro divulgou há pouco é a rendição mais ridícula e humilhante de um presidente em toda  história m… https://t.co/kS31nrmcHm,33374761,,,33374761,cirogomes,,,2080,20057,Mon Sep 20 2021 20:30:15 GMT-0300 (Brasilia Standard Time),Thu Sep 09 2021 18:33:23 GMT-0300 (Brasilia Standard Time)
"Foi um sucesso a estreia de CIRO GAMES - A LIVE DO CIRÃO! Milhares e milhares de visualizações, comentários, reperc… https://t.co/4LvEvz0YrM",33374761,,,33374761,cirogomes,,,318,2196,Mon Sep 20 2021 20:30:15 GMT-0300 (Brasilia Standard Time),Thu Sep 09 2021 17:06:31 GMT-0300 (Brasilia Standard Time)
"Temos que enfrentar as duas, mesmo que, em alguns momentos, as táticas de vencê-las se conflitem. Iremos para as ru… https://t.co/blFbFSME5C",33374761,,,33374761,cirogomes,,,276,3722,Mon Sep 20 2021 20:30:15 GMT-0300 (Brasilia Standard Time),Thu Sep 09 2021 14:20:19 GMT-0300 (Brasilia Standard Time)
"Esta luta não é mais um símbolo ou uma metáfora, mas um embate real em defesa da justiça e da liberdade. Ela está a… https://t.co/i5cRga9w7Z",33374761,,,33374761,cirogomes,,,315,4124,Mon Sep 20 2021 20:30:15 GMT-0300 (Brasilia Standard Time),Thu Sep 09 2021 14:20:19 GMT-0300 (Brasilia Standard Time)
Irei à manifestação do dia 12 na Avenida Paulista e sempre tentarei ir a outras manifestações que forem convocadas… https://t.co/dQ6S405zVQ,33374761,,,33374761,cirogomes,,,1597,18368,Mon Sep 20 2021 20:30:15 GMT-0300 (Brasilia Standard Time),Thu Sep 09 2021 14:20:18 GMT-0300 (Brasilia Standard Time)
Meus sentimentos ao querido @robertocarlos pela perda precoce de seu filho Dudu. Que Deus o receba em graça e que d… https://t.co/rKPfIrPOxf,33374761,,,33374761,cirogomes,,,137,2463,Mon Sep 20 2021 20:30:15 GMT-0300 (Brasilia Standard Time),Thu Sep 09 2021 13:24:21 GMT-0300 (Brasilia Standard Time)
"Turma, hoje vou conversar com a jornalista @DaniellaZupo sobre meu novo livro 'Projeto Nacional: O Dever da Esperan… https://t.co/miKeNbQlVQ",33374761,,,33374761,cirogomes,,,246,1118,Mon Sep 20 2021 20:30:15 GMT-0300 (Brasilia Standard Time),Thu Sep 09 2021 12:01:16 GMT-0300 (Brasilia Standard Time)
"As estatísticas que mostram um país em crise não traduzem todo o sofrimento de quem enfrenta pandemia, desemprego,… https://t.co/p2GyppthJg",33374761,,,33374761,cirogomes,,,894,3158,Mon Sep 20 2021 20:30:15 GMT-0300 (Brasilia Standard Time),Thu Sep 09 2021 09:00:01 GMT-0300 (Brasilia Standard Time)
"Revelei quais seriam as principais medidas de curto e médio prazos em meu governo. Entre elas, recuperar o crédito… https://t.co/RnVka1KxNs",33374761,,,33374761,cirogomes,,,611,3023,Mon Sep 20 2021 20:30:15 GMT-0300 (Brasilia Standard Time),Wed Sep 08 2021 17:00:01 GMT-0300 (Brasilia Standard Time)
Estreia amanhã aqui nas minhas redes a série “A Crise Dentro de Casa”. Ela mostra encontros que tive na periferia d… https://t.co/zVcwdwS3Tz,33374761,,,33374761,cirogomes,,,456,2343,Mon Sep 20 2021 20:30:15 GMT-0300 (Brasilia Standard Time),Wed Sep 08 2021 15:04:33 GMT-0300 (Brasilia Standard Time)
"Turma, vejam só que explicação didática do @FeCastanhari sobre o que é a tão polêmica taxação das grandes fortunas.… https://t.co/autQXXXaDh",33374761,,,33374761,cirogomes,,,1788,8744,Mon Sep 20 2021 20:30:15 GMT-0300 (Brasilia Standard Time),Wed Sep 08 2021 12:10:20 GMT-0300 (Brasilia Standard Time)
É importante que o poder político desloque esse conflito do ambiente de confrontação com o judiciário. Esse conflit… https://t.co/d60HE929os,33374761,,,33374761,cirogomes,,,273,1647,Mon Sep 20 2021 20:30:15 GMT-0300 (Brasilia Standard Time),Wed Sep 08 2021 10:56:48 GMT-0300 (Brasilia Standard Time)
"Eu estou incomodado com essa história de ver o judiciário sozinho defendendo a democracia. Isso é tarefa nossa, é r… https://t.co/4VFCtjgGqB",33374761,,,33374761,cirogomes,,,746,7732,Mon Sep 20 2021 20:30:15 GMT-0300 (Brasilia Standard Time),Wed Sep 08 2021 10:53:33 GMT-0300 (Brasilia Standard Time)
"A prisão, ele diz que em nenhuma circunstância aceitará. Portanto, Bolsonaro está ameaçando a nação brasileira com o suicídio. #CiroNoUol",33374761,,,33374761,cirogomes,,,104,993,Mon Sep 20 2021 20:30:15 GMT-0300 (Brasilia Standard Time),Wed Sep 08 2021 10:51:32 GMT-0300 (Brasilia Standard Time)
"Os covardes costumam blefar. Quando Bolsonaro diz: ""o futuro da minha vida são três: preso, morto ou a vitória"", mo… https://t.co/QUk5xwda3J",33374761,,,33374761,cirogomes,,,130,1200,Mon Sep 20 2021 20:30:15 GMT-0300 (Brasilia Standard Time),Wed Sep 08 2021 10:51:32 GMT-0300 (Brasilia Standard Time)
O Brasil do dia 8 de setembro é outro! Eu espero que todos nós nos compenetremos. Bolsonaro está fazendo uma aposta… https://t.co/sPj9RCRhTv,33374761,,,33374761,cirogomes,,,277,2373,Mon Sep 20 2021 20:30:15 GMT-0300 (Brasilia Standard Time),Wed Sep 08 2021 10:51:31 GMT-0300 (Brasilia Standard Time)
"Eu vou participar de todo e qualquer movimento, qualquer que seja a convocatória, que tenha por premissa a defesa d… https://t.co/B2KJuf7dIw",33374761,,,33374761,cirogomes,,,931,11537,Mon Sep 20 2021 20:30:15 GMT-0300 (Brasilia Standard Time),Wed Sep 08 2021 10:35:41 GMT-0300 (Brasilia Standard Time)
Nós precisamos ler com muita humildade por um lado e muita coragem e determinação por outro lado: as manifestações… https://t.co/JKX0EqR2Cx,33374761,,,33374761,cirogomes,,,296,2350,Mon Sep 20 2021 20:30:15 GMT-0300 (Brasilia Standard Time),Wed Sep 08 2021 10:31:43 GMT-0300 (Brasilia Standard Time)
"AO VIVO! Uma conversa sobre o Brasil, o desastre do governo Bolsonaro e os caminhos para sairmos dessa crise.

Acom… https://t.co/l42EsfkOJp",33374761,,,33374761,cirogomes,,,209,1033,Mon Sep 20 2021 20:30:15 GMT-0300 (Brasilia Standard Time),Wed Sep 08 2021 10:06:50 GMT-0300 (Brasilia Standard Time)
Não estou querendo desmerecer ninguém quando critico Lula e Bolsonaro. Mas tenho a obrigação de apontar os erros do… https://t.co/Rhr7C2MG8Z,33374761,,,33374761,cirogomes,,,730,3988,Mon Sep 20 2021 20:30:15 GMT-0300 (Brasilia Standard Time),Wed Sep 08 2021 09:00:02 GMT-0300 (Brasilia Standard Time)
"Bom dia, turma! Logo mais, às 10h, vou conversar com @fabiolacidral, @KennedyAlencar e @blogdojosias no @UOL. Esper… https://t.co/zCUJaTfSMp",33374761,,,33374761,cirogomes,,,278,1236,Mon Sep 20 2021 20:30:15 GMT-0300 (Brasilia Standard Time),Wed Sep 08 2021 08:33:00 GMT-0300 (Brasilia Standard Time)
"Carta ao Futuro é a nova música da banda @detonautas, que o querido amigo @Ticostacruz nos presenteou com um trecho… https://t.co/Wck87GjP8B",33374761,,,33374761,cirogomes,,,274,1707,Mon Sep 20 2021 20:30:15 GMT-0300 (Brasilia Standard Time),Tue Sep 07 2021 21:43:33 GMT-0300 (Brasilia Standard Time)
"Muito obrigado a todos que acompanharam a estreia de #CiroGames. Forte abraço aos convidados de hoje: @Ticostacruz,… https://t.co/6HwFZiWPLR",33374761,,,33374761,cirogomes,,,473,5369,Mon Sep 20 2021 20:30:15 GMT-0300 (Brasilia Standard Time),Tue Sep 07 2021 21:16:14 GMT-0300 (Brasilia Standard Time)
"RT @_hey_jude: já que o assunto é games, seguem imagens reais da felicidade do homi ao capturar seu primeiro pokemon #CiroGames https://t.c…",33374761,,,33374761,cirogomes,,,298,0,Mon Sep 20 2021 20:30:15 GMT-0300 (Brasilia Standard Time),Tue Sep 07 2021 21:14:44 GMT-0300 (Brasilia Standard Time)
Bolsonaro agora diz que as redes sociais não podem mais tirar as fakes news do ar. Ele está querendo proteger a si… https://t.co/kG3cXuQzcr,33374761,,,33374761,cirogomes,,,475,4332,Mon Sep 20 2021 20:30:15 GMT-0300 (Brasilia Standard Time),Tue Sep 07 2021 20:55:45 GMT-0300 (Brasilia Standard Time)
"Todo mundo no game?
O @randolfeap tá ON na #CiroGames! https://t.co/7DrLmFWMd5",33374761,,,33374761,cirogomes,,,384,4954,Mon Sep 20 2021 20:30:15 GMT-0300 (Brasilia Standard Time),Tue Sep 07 2021 20:52:05 GMT-0300 (Brasilia Standard Time)
"""Se eu posso falar alguma coisa para as pessoas que estão nos assistindo agora, é o seguinte: façam a sua parte e n… https://t.co/83BEoizRxs",33374761,,,33374761,cirogomes,,,113,907,Mon Sep 20 2021 20:30:15 GMT-0300 (Brasilia Standard Time),Tue Sep 07 2021 20:45:17 GMT-0300 (Brasilia Standard Time)
"""Precisamos ter consciência de que a mudança depende da gente. Essa questão eu trago porque li seu livro 'Projeto N… https://t.co/AkbRLWqPWp",33374761,,,33374761,cirogomes,,,276,1962,Mon Sep 20 2021 20:30:15 GMT-0300 (Brasilia Standard Time),Tue Sep 07 2021 20:45:16 GMT-0300 (Brasilia Standard Time)
Agora o @lhmandetta tá ON no #CiroGames! https://t.co/we4A4BBFew,33374761,,,33374761,cirogomes,,,269,2888,Mon Sep 20 2021 20:30:15 GMT-0300 (Brasilia Standard Time),Tue Sep 07 2021 20:40:29 GMT-0300 (Brasilia Standard Time)
"Vem que agora a @gisellebezerra tá ON! #CiroGames

Enviou sua pergunta pra nossa live?",33374761,,,33374761,cirogomes,,,149,1346,Mon Sep 20 2021 20:30:15 GMT-0300 (Brasilia Standard Time),Tue Sep 07 2021 20:25:46 GMT-0300 (Brasilia Standard Time)
"Bolsonaro parece que queimou os navios. Ele está dizendo com clareza que seu destino é a cadeia, a morte ou é a vit… https://t.co/jYOoIN3GoC",33374761,,,33374761,cirogomes,,,988,11278,Mon Sep 20 2021 20:30:15 GMT-0300 (Brasilia Standard Time),Tue Sep 07 2021 20:08:07 GMT-0300 (Brasilia Standard Time)
"O @Ticostacruz tá ON!
Vem conferir a estreia de #CiroGames - A live do Cirão! https://t.co/VoDyShX2Rb",33374761,,,33374761,cirogomes,,,328,2580,Mon Sep 20 2021 20:30:15 GMT-0300 (Brasilia Standard Time),Tue Sep 07 2021 20:04:12 GMT-0300 (Brasilia Standard Time)
#CIROGAMES https://t.co/kDJlyqf8lw,33374761,,,33374761,cirogomes,,,855,3438,Mon Sep 20 2021 20:30:15 GMT-0300 (Brasilia Standard Time),Tue Sep 07 2021 19:21:03 GMT-0300 (Brasilia Standard Time)
"Hoje tem estreia! 
CIRO GAMES - A LIVE DO CIRÃO começa logo mais, às 19h30! 

Acompanhe pelo meu Facebook, YouTube,… https://t.co/Z6jP7dmV1y",33374761,,,33374761,cirogomes,,,724,4109,Mon Sep 20 2021 20:30:15 GMT-0300 (Brasilia Standard Time),Tue Sep 07 2021 18:06:49 GMT-0300 (Brasilia Standard Time)
Me solidarizei também pelas violentas e descabidas agressões e ameaças que vem sofrendo.,33374761,,,33374761,cirogomes,,,221,5378,Mon Sep 20 2021 20:30:15 GMT-0300 (Brasilia Standard Time),Tue Sep 07 2021 12:03:34 GMT-0300 (Brasilia Standard Time)
"Telefonei ontem para o ministro do STF Alexandre de Morais. Disse a ele que eu, como um simples cidadão brasileiro… https://t.co/98Op7nSe7y",33374761,,,33374761,cirogomes,,,1138,22923,Mon Sep 20 2021 20:30:15 GMT-0300 (Brasilia Standard Time),Tue Sep 07 2021 12:03:34 GMT-0300 (Brasilia Standard Time)
"@_danymaia Fico feliz que tenha gostado, @_danymaia. É exatamente isso, precisamos avançar muito. É hora de debater… https://t.co/sFovyYOBLo",33374761,,,33374761,cirogomes,,,18,121,Mon Sep 20 2021 20:30:15 GMT-0300 (Brasilia Standard Time),Tue Sep 07 2021 11:14:13 GMT-0300 (Brasilia Standard Time)
"@Teresapse @gisellebezerra @Ticostacruz Taí uma coisa que não me preocupa! Já com o futuro do nosso país, eu não só… https://t.co/crdocfq39O",33374761,,,33374761,cirogomes,,,63,419,Mon Sep 20 2021 20:30:15 GMT-0300 (Brasilia Standard Time),Tue Sep 07 2021 11:13:19 GMT-0300 (Brasilia Standard Time)
"@IanToledoLemos1 É isso aí, meu amigo. O ensino em tempo integral é uma das soluções mais eficazes. Temos experiênc… https://t.co/2iRdaN0k4y",33374761,,,33374761,cirogomes,,,66,313,Mon Sep 20 2021 20:30:15 GMT-0300 (Brasilia Standard Time),Tue Sep 07 2021 11:12:14 GMT-0300 (Brasilia Standard Time)
A maioria esmagadora do povo brasileiro é contra qualquer tentativa de golpe. Neste 7 de Setembro renovamos nosso c… https://t.co/1yPDg4N7OR,33374761,,,33374761,cirogomes,,,4054,19580,Mon Sep 20 2021 20:30:15 GMT-0300 (Brasilia Standard Time),Tue Sep 07 2021 08:00:02 GMT-0300 (Brasilia Standard Time)
"A espera acabou! Hoje, às 19h30, estreia CIRO GAMES – A LIVE DO CIRÃO. Vou comentar, e muito, tudo o que aconteceu… https://t.co/CIGPuIKcGA",33374761,,,33374761,cirogomes,,,396,2146,Mon Sep 20 2021 20:30:15 GMT-0300 (Brasilia Standard Time),Tue Sep 07 2021 03:34:51 GMT-0300 (Brasilia Standard Time)
"Como todo fascista,ele se mexe sempre invertendo a verdade dos fatos e das intenções. Faz um ato nas ruas a favor d… https://t.co/GfsRi8sLwW",33374761,,,33374761,cirogomes,,,382,3097,Mon Sep 20 2021 20:30:15 GMT-0300 (Brasilia Standard Time),Mon Sep 06 2021 19:23:01 GMT-0300 (Brasilia Standard Time)
"O teatro que ele fará nas ruas vai se dissolver no ar, como espumas ao vento. Mas esta MP,cuja urgência demonstra o… https://t.co/Uxx3f2udwB",33374761,,,33374761,cirogomes,,,309,2771,Mon Sep 20 2021 20:30:15 GMT-0300 (Brasilia Standard Time),Mon Sep 06 2021 19:23:00 GMT-0300 (Brasilia Standard Time)
A descabida e questionável MP de Bolsonaro que modifica o Marco Civil da Internet tem efeito mais deletério sobre a… https://t.co/rC4sFh9ixl,33374761,,,33374761,cirogomes,,,1035,9329,Mon Sep 20 2021 20:30:15 GMT-0300 (Brasilia Standard Time),Mon Sep 06 2021 19:22:59 GMT-0300 (Brasilia Standard Time)
"Acabei de abrir uma caixa de perguntas no Telegram pra vocês mandarem comentários, sugestões e dúvidas para eu resp… https://t.co/d0Pf2qhTuD",33374761,,,33374761,cirogomes,,,219,1525,Mon Sep 20 2021 20:30:15 GMT-0300 (Brasilia Standard Time),Mon Sep 06 2021 19:13:22 GMT-0300 (Brasilia Standard Time)
"Ciro vai fazer um importante pronunciamento sobre o 7 de Setembro amanhã, a partir das 8 horas, nas suas redes. Ser… https://t.co/R9yLyZUsIB",33374761,,,33374761,cirogomes,,,781,5055,Mon Sep 20 2021 20:30:15 GMT-0300 (Brasilia Standard Time),Mon Sep 06 2021 17:01:16 GMT-0300 (Brasilia Standard Time)
"DUZENTOS E QUARENTA E TRÊS MILHÕES DE REAIS JOGADOS NO LIXO ! Em materiais de saúde... Meu Deus, o mal que um gover… https://t.co/toVIzrqNhi",33374761,,,33374761,cirogomes,,,743,3867,Mon Sep 20 2021 20:30:15 GMT-0300 (Brasilia Standard Time),Mon Sep 06 2021 16:03:16 GMT-0300 (Brasilia Standard Time)
Todos prontos pra live de amanhã? CIRO GAMES- A LIVE DO CIRÃO começa às 19h30 e já ganhou uma chamada especial pela… https://t.co/QsvKQk8aVr,33374761,,,33374761,cirogomes,,,574,2544,Mon Sep 20 2021 20:30:15 GMT-0300 (Brasilia Standard Time),Mon Sep 06 2021 14:42:01 GMT-0300 (Brasilia Standard Time)
"Participei do programa Diálogo, com @EdmoBernardes. Conversamos sobre os caminhos para unir o Brasil. Acompanhe: https://t.co/6DQMF8OaAW",33374761,,,33374761,cirogomes,,,216,1004,Mon Sep 20 2021 20:30:15 GMT-0300 (Brasilia Standard Time),Mon Sep 06 2021 11:57:24 GMT-0300 (Brasilia Standard Time)
Meus adversários ignoram qualquer limite. Foram capazes de inventar que eu e minha família temos empresas de carros… https://t.co/J9L8tb8pfm,33374761,,,33374761,cirogomes,,,906,3388,Mon Sep 20 2021 20:30:15 GMT-0300 (Brasilia Standard Time),Mon Sep 06 2021 09:00:01 GMT-0300 (Brasilia Standard Time)
"Turma, logo mais, às 9h, estarei ao vivo na Rádio Difusora Pai Eterno, de Goiânia!

Acompanhe pelo site:… https://t.co/9sC5uahaYg",33374761,,,33374761,cirogomes,,,203,1069,Mon Sep 20 2021 20:30:15 GMT-0300 (Brasilia Standard Time),Mon Sep 06 2021 08:41:30 GMT-0300 (Brasilia Standard Time)
"Vamos lembrar, turma boa: amanhã, dia 7, às 19h30, estreia CIRO GAMES – A LIVE DO CIRÃO nas minhas redes. Na pauta,… https://t.co/67f1r7bi9m",33374761,,,33374761,cirogomes,,,345,1696,Mon Sep 20 2021 20:30:15 GMT-0300 (Brasilia Standard Time),Mon Sep 06 2021 00:32:51 GMT-0300 (Brasilia Standard Time)
"Cabe uma pergunta final : não teria o exemplo de um presidente desequilibrado, que anda sem máscara e rompe todos p… https://t.co/bjKyeX3MTX",33374761,,,33374761,cirogomes,,,232,2538,Mon Sep 20 2021 20:30:15 GMT-0300 (Brasilia Standard Time),Sun Sep 05 2021 17:29:12 GMT-0300 (Brasilia Standard Time)
"Pois, em um país em que o estado do direito sofre abalos e ameaças, as irrupções de turbulência e anarquia ocorrem… https://t.co/AO6ARYr8Oa",33374761,,,33374761,cirogomes,,,155,2025,Mon Sep 20 2021 20:30:15 GMT-0300 (Brasilia Standard Time),Sun Sep 05 2021 17:29:11 GMT-0300 (Brasilia Standard Time)
"Tentou-se,  sob o beneplácito de certas autoridades, encontrar  um jeitinho, à margem da lei, para ceder à pressão… https://t.co/a9DtwzsQpU",33374761,,,33374761,cirogomes,,,109,1279,Mon Sep 20 2021 20:30:15 GMT-0300 (Brasilia Standard Time),Sun Sep 05 2021 17:29:11 GMT-0300 (Brasilia Standard Time)
Não há dúvida de que houve erro grave dos dirigentes esportivos da Argentina. Mas não haveria o vexame explícito no… https://t.co/zdMzMx0XWA,33374761,,,33374761,cirogomes,,,139,1481,Mon Sep 20 2021 20:30:15 GMT-0300 (Brasilia Standard Time),Sun Sep 05 2021 17:29:10 GMT-0300 (Brasilia Standard Time)
"Se estivéssemos em um momento de plena normalidade da vida nacional, com cada autoridade cumprindo suas funções com… https://t.co/hn4WGheY1c",33374761,,,33374761,cirogomes,,,589,6344,Mon Sep 20 2021 20:30:15 GMT-0300 (Brasilia Standard Time),Sun Sep 05 2021 17:29:09 GMT-0300 (Brasilia Standard Time)
"A melhor campanha do Brasil nas Paralimpíadas resultou na extraordinária 7ª colocação, igual a Londres, e em 72 med… https://t.co/zw3uX0rH6u",33374761,,,33374761,cirogomes,,,261,2611,Mon Sep 20 2021 20:30:15 GMT-0300 (Brasilia Standard Time),Sun Sep 05 2021 11:05:33 GMT-0300 (Brasilia Standard Time)
"Um território vivo  de  novas tecnologias na área da saúde, nutrição e da defesa ambiental, com novas oportunidades… https://t.co/r5cIQEJrLC",33374761,,,33374761,cirogomes,,,124,892,Mon Sep 20 2021 20:30:15 GMT-0300 (Brasilia Standard Time),Sun Sep 05 2021 10:04:26 GMT-0300 (Brasilia Standard Time)
Mas é preciso uma reflexão profunda. Até quando o Brasil relegará a questão amazônica a uma espécie de enigma entre… https://t.co/MX004Rk8nI,33374761,,,33374761,cirogomes,,,146,1083,Mon Sep 20 2021 20:30:15 GMT-0300 (Brasilia Standard Time),Sun Sep 05 2021 10:04:26 GMT-0300 (Brasilia Standard Time)
"Hoje, Dia da Amazônia, temos que  celebrar a força inquebrantável  dos povos indígenas que lutam pela manutenção e… https://t.co/i8AgpYRrZH",33374761,,,33374761,cirogomes,,,356,2021,Mon Sep 20 2021 20:30:15 GMT-0300 (Brasilia Standard Time),Sun Sep 05 2021 10:04:25 GMT-0300 (Brasilia Standard Time)
"O Brasil fez sua melhor campanha nestas Paralimpíadas que se encerram hoje no Japão. Mas, tão importante quanto, fo… https://t.co/RcG2Xbc6Rc",33374761,,,33374761,cirogomes,,,428,2229,Mon Sep 20 2021 20:30:15 GMT-0300 (Brasilia Standard Time),Sun Sep 05 2021 09:00:00 GMT-0300 (Brasilia Standard Time)
"Agora falta pouco! CIRO GAMES – A LIVE DO CIRÃO estreia nesta terça-feira, às 19h30, nas minhas redes. Posso garant… https://t.co/HwpiZ2Q34G",33374761,,,33374761,cirogomes,,,358,1781,Mon Sep 20 2021 20:30:15 GMT-0300 (Brasilia Standard Time),Sun Sep 05 2021 07:59:43 GMT-0300 (Brasilia Standard Time)
"O Brasil chega nessa reta final com 68 medalhas – 22 de ouro, 17 de prata e 29 de bronze – e o sétimo lugar na clas… https://t.co/klhhVrJcmN",33374761,,,33374761,cirogomes,,,42,510,Mon Sep 20 2021 20:30:15 GMT-0300 (Brasilia Standard Time),Sat Sep 04 2021 10:33:37 GMT-0300 (Brasilia Standard Time)
"No atletismo, o Brasil fez uma dobradinha no pódio dos 200m rasos T11 (para atletas com deficiências visuais) com T… https://t.co/C28657q6A0",33374761,,,33374761,cirogomes,,,37,484,Mon Sep 20 2021 20:30:15 GMT-0300 (Brasilia Standard Time),Sat Sep 04 2021 10:33:37 GMT-0300 (Brasilia Standard Time)
"O Brasil é pentacampeão nessa modalidade, e o que é mais incrível, todos os títulos vieram de forma invicta. Antes,… https://t.co/beRVAFHnQC",33374761,,,33374761,cirogomes,,,19,146,Mon Sep 20 2021 20:30:15 GMT-0300 (Brasilia Standard Time),Sat Sep 04 2021 10:33:37 GMT-0300 (Brasilia Standard Time)
O Brasil confirmou sua melhor participação nas Paralimpíadas nesse penúltimo dia da competição ao conquistar a sua… https://t.co/ZhkXnjAbXx,33374761,,,33374761,cirogomes,,,164,1443,Mon Sep 20 2021 20:30:15 GMT-0300 (Brasilia Standard Time),Sat Sep 04 2021 10:33:36 GMT-0300 (Brasilia Standard Time)
"Em relação à pesquisa realizada no início de agosto, Lula perdeu seis pontos no potencial de votos e Ciro ganhou se… https://t.co/FRQRzSeYmT",33374761,,,33374761,cirogomes,,,161,1465,Mon Sep 20 2021 20:30:15 GMT-0300 (Brasilia Standard Time),Sat Sep 04 2021 09:25:38 GMT-0300 (Brasilia Standard Time)
"A pesquisa PoderData, realizada entre 30 de agosto e 1º de setembro, revelou que Ciro está em empate técnico com Lu… https://t.co/zApqBxTik3",33374761,,,33374761,cirogomes,,,181,1739,Mon Sep 20 2021 20:30:15 GMT-0300 (Brasilia Standard Time),Sat Sep 04 2021 09:25:38 GMT-0300 (Brasilia Standard Time)
São poucos os que ainda relutam em admitir que Ciro é o pré-candidato que mais se consolida entre os eleitores. Ago… https://t.co/LVK3IQPIs3,33374761,,,33374761,cirogomes,,,934,7429,Mon Sep 20 2021 20:30:15 GMT-0300 (Brasilia Standard Time),Sat Sep 04 2021 09:25:37 GMT-0300 (Brasilia Standard Time)
"Estamos chegando lá! CIRO GAMES – A LIVE DO CIRÃO estreia nesta terça-feira, às 19h30. Vai ter comentário sobre o q… https://t.co/BisuHSSTu5",33374761,,,33374761,cirogomes,,,334,1620,Mon Sep 20 2021 20:30:15 GMT-0300 (Brasilia Standard Time),Sat Sep 04 2021 00:02:00 GMT-0300 (Brasilia Standard Time)
"Oi, Turma Boa! Começa hoje a contagem regressiva pra estreia de CIRO GAMES – A LIVE DO CIRÃO. Não vão esquecer, hei… https://t.co/Fa3xclQptT",33374761,,,33374761,cirogomes,,,469,2169,Mon Sep 20 2021 20:30:15 GMT-0300 (Brasilia Standard Time),Fri Sep 03 2021 17:10:04 GMT-0300 (Brasilia Standard Time)
Tivemos também as pratas de Luis Carlos Cardoso nos 200 metros do caiaque e os bronzes de João Victor no lançamento… https://t.co/66HGlQdqOD,33374761,,,33374761,cirogomes,,,45,458,Mon Sep 20 2021 20:30:15 GMT-0300 (Brasilia Standard Time),Fri Sep 03 2021 10:25:04 GMT-0300 (Brasilia Standard Time)
"O Brasil segue conquistando muitas medalhas nesta reta final das Paralimpíadas. Agora há pouco, a seleção masculina… https://t.co/4ZizExQgHd",33374761,,,33374761,cirogomes,,,120,1041,Mon Sep 20 2021 20:30:15 GMT-0300 (Brasilia Standard Time),Fri Sep 03 2021 10:25:03 GMT-0300 (Brasilia Standard Time)
"O Brasil perdeu hoje um grande artista, uma grande alma, que encantou diversas gerações. Lutou pelo nosso país, pel… https://t.co/AgPCLX6Yqb",33374761,,,33374761,cirogomes,,,250,3842,Mon Sep 20 2021 20:30:15 GMT-0300 (Brasilia Standard Time),Fri Sep 03 2021 09:48:17 GMT-0300 (Brasilia Standard Time)
Empreender é duro para todo o mundo. Mas para a população negra é ainda mais difícil porque o racismo dita muitas r… https://t.co/HSxT3hPWKC,33374761,,,33374761,cirogomes,,,598,2240,Mon Sep 20 2021 20:30:15 GMT-0300 (Brasilia Standard Time),Fri Sep 03 2021 09:00:02 GMT-0300 (Brasilia Standard Time)
"@fabricionobre07 @gisellebezerra Feliz aniversário, querido @fabricionobre07! 👏👏👏 Muita saúde, bênçãos e força para… https://t.co/aaUJ5JxV2R",33374761,,,33374761,cirogomes,,,5,95,Mon Sep 20 2021 20:30:15 GMT-0300 (Brasilia Standard Time),Thu Sep 02 2021 16:30:08 GMT-0300 (Brasilia Standard Time)
Um alerta do amigo @felipeneto revelou que estão financiando uma campanha suja contra mim. Estou entrando na Justiç… https://t.co/jwpZGg5DpH,33374761,,,33374761,cirogomes,,,1298,8828,Mon Sep 20 2021 20:30:15 GMT-0300 (Brasilia Standard Time),Thu Sep 02 2021 16:06:50 GMT-0300 (Brasilia Standard Time)
