text,query,country,city,userId,username,quote_count,reply_count,retweet_count,favorite_count,timestamp,createdAt
"Turma, logo mais estarei ao vivo na @98FMNatal. Começa às 12h! 

Vocês também podem acompanhar pelo YouTube:… https://t.co/Px0NaZNPjw",33374761,,,33374761,cirogomes,,,171,996,Mon Sep 20 2021 20:30:15 GMT-0300 (Brasilia Standard Time),Thu Sep 02 2021 11:42:33 GMT-0300 (Brasilia Standard Time)
"No tênis de mesa, a seleção feminina conquistou o bronze por equipes com Bruna Alexandre, Jennyfer Parinos e Daniel… https://t.co/1BGQEK6ym8",33374761,,,33374761,cirogomes,,,36,374,Mon Sep 20 2021 20:30:15 GMT-0300 (Brasilia Standard Time),Thu Sep 02 2021 10:13:52 GMT-0300 (Brasilia Standard Time)
"Nas piscinas, Gabriel dos Santos, o Gabrielzinho, venceu o 50m costas (classe S2) e agora tem dois ouros e uma prat… https://t.co/ssyNQSZUI8",33374761,,,33374761,cirogomes,,,36,381,Mon Sep 20 2021 20:30:15 GMT-0300 (Brasilia Standard Time),Thu Sep 02 2021 10:13:52 GMT-0300 (Brasilia Standard Time)
"Mais medalhas nas Paralimpíadas de Tóquio! Alessandro da Silva, o Gigante, foi bicampeão no lançamento de disco (cl… https://t.co/blDghyxJT9",33374761,,,33374761,cirogomes,,,122,1070,Mon Sep 20 2021 20:30:15 GMT-0300 (Brasilia Standard Time),Thu Sep 02 2021 10:13:51 GMT-0300 (Brasilia Standard Time)
"Ao contrário de Bolsonaro e Lula, nunca fui acusado de corrupção em 40 anos de vida pública. E tenho um projeto cap… https://t.co/toWhmlJ4YR",33374761,,,33374761,cirogomes,,,896,4197,Mon Sep 20 2021 20:30:15 GMT-0300 (Brasilia Standard Time),Thu Sep 02 2021 09:00:01 GMT-0300 (Brasilia Standard Time)
"AO VIVO! Participo do simpósio acadêmico em homenagem aos 60 anos da Campanha da Legalidade, a convite da Universid… https://t.co/1EDKJWcHcx",33374761,,,33374761,cirogomes,,,212,1210,Mon Sep 20 2021 20:30:15 GMT-0300 (Brasilia Standard Time),Wed Sep 01 2021 17:14:05 GMT-0300 (Brasilia Standard Time)
"Quando quase ninguém falava da gravidade da crise hídrica e elétrica que enfrentaríamos, e o governo, como sempre,… https://t.co/5qpnxtMEUY",33374761,,,33374761,cirogomes,,,1008,4617,Mon Sep 20 2021 20:30:15 GMT-0300 (Brasilia Standard Time),Wed Sep 01 2021 16:02:31 GMT-0300 (Brasilia Standard Time)
Grande destaque para a despedida do maior medalhista da nossa história: Daniel Dias encerrou sua carreira em 4º lug… https://t.co/r5B0p0oN2g,33374761,,,33374761,cirogomes,,,32,389,Mon Sep 20 2021 20:30:15 GMT-0300 (Brasilia Standard Time),Wed Sep 01 2021 10:28:01 GMT-0300 (Brasilia Standard Time)
"Ainda na natação, o Brasil ganhou uma prata com Maria Cecília de Araújo e um bronze com Talisson Glock. Da bocha, v… https://t.co/S5h2osdJnl",33374761,,,33374761,cirogomes,,,32,399,Mon Sep 20 2021 20:30:15 GMT-0300 (Brasilia Standard Time),Wed Sep 01 2021 10:28:01 GMT-0300 (Brasilia Standard Time)
A nadadora Carol Santiago se tornou a mulher brasileira com maior número de medalhas numa edição paralímpica. Ela v… https://t.co/azy52W4AO8,33374761,,,33374761,cirogomes,,,124,1158,Mon Sep 20 2021 20:30:15 GMT-0300 (Brasilia Standard Time),Wed Sep 01 2021 10:28:00 GMT-0300 (Brasilia Standard Time)
Esse foi o convite à reflexão que eu fiz ontem a todos vocês: o que acham que será do Brasil se Bolsonaro for reele… https://t.co/nYkzV5SIqd,33374761,,,33374761,cirogomes,,,220,1074,Mon Sep 20 2021 20:30:15 GMT-0300 (Brasilia Standard Time),Wed Sep 01 2021 09:47:39 GMT-0300 (Brasilia Standard Time)
"Ontem, postei um vídeo convidando você a imaginar o que será do Brasil se Bolsonaro ganhar. Hoje, peço que você sig… https://t.co/ytvz4u8kHn",33374761,,,33374761,cirogomes,,,712,3407,Mon Sep 20 2021 20:30:15 GMT-0300 (Brasilia Standard Time),Wed Sep 01 2021 09:00:02 GMT-0300 (Brasilia Standard Time)
"Aqui o link, turma boa: https://t.co/eRItqbpEbE",33374761,,,33374761,cirogomes,,,55,541,Mon Sep 20 2021 20:30:15 GMT-0300 (Brasilia Standard Time),Tue Aug 31 2021 20:09:11 GMT-0300 (Brasilia Standard Time)
Obrigado a todos que acompanharam essa conversa inadiável sobre o Brasil. Precisamos debater as raízes desses probl… https://t.co/PIjM0NQXCh,33374761,,,33374761,cirogomes,,,309,2423,Mon Sep 20 2021 20:30:15 GMT-0300 (Brasilia Standard Time),Tue Aug 31 2021 20:09:11 GMT-0300 (Brasilia Standard Time)
Assista aqui: https://t.co/gOGQSSLmDm,33374761,,,33374761,cirogomes,,,58,399,Mon Sep 20 2021 20:30:15 GMT-0300 (Brasilia Standard Time),Tue Aug 31 2021 19:08:58 GMT-0300 (Brasilia Standard Time)
"Estamos ao vivo no Instagram! Uma conversa sobre o Brasil que queremos e apresento meu novo livro, que agora está d… https://t.co/UrlBlUTZBf",33374761,,,33374761,cirogomes,,,189,1262,Mon Sep 20 2021 20:30:15 GMT-0300 (Brasilia Standard Time),Tue Aug 31 2021 19:08:45 GMT-0300 (Brasilia Standard Time)
A @MaraLuquet é uma das jornalistas mais respeitadas e bem informadas do país. Tenho conversado com todos os setore… https://t.co/ZF2G2TzSVg,33374761,,,33374761,cirogomes,,,553,2523,Mon Sep 20 2021 20:30:15 GMT-0300 (Brasilia Standard Time),Tue Aug 31 2021 18:00:36 GMT-0300 (Brasilia Standard Time)
"Sua participação pode começar agora enviando perguntas, opiniões e sugestões. Eu e @gisellebezerra estamos aqui pra… https://t.co/llW6mxOHPh",33374761,,,33374761,cirogomes,,,106,1075,Mon Sep 20 2021 20:30:15 GMT-0300 (Brasilia Standard Time),Tue Aug 31 2021 16:33:24 GMT-0300 (Brasilia Standard Time)
"Anota aí, turma! CIRO GAMES – A LIVE DO CIRÃO estreia num dia muito especial: 7 de Setembro, às 19h30. Toda semana… https://t.co/XCX7cmt1Ub",33374761,,,33374761,cirogomes,,,639,3827,Mon Sep 20 2021 20:30:15 GMT-0300 (Brasilia Standard Time),Tue Aug 31 2021 16:33:24 GMT-0300 (Brasilia Standard Time)
"AO VIVO! Entrevista para o jornal @5diasPY, do Paraguai. Acompanhe: https://t.co/hj6behNoaw https://t.co/L8hBROG0Tf",33374761,,,33374761,cirogomes,,,199,1169,Mon Sep 20 2021 20:30:15 GMT-0300 (Brasilia Standard Time),Tue Aug 31 2021 14:08:36 GMT-0300 (Brasilia Standard Time)
"Turma, espero vocês hoje à noite, às 19h, no Instagram! Vou conversar sobre o Brasil que queremos e apresentar meu… https://t.co/97g23gJz2Z",33374761,,,33374761,cirogomes,,,341,1605,Mon Sep 20 2021 20:30:15 GMT-0300 (Brasilia Standard Time),Tue Aug 31 2021 12:54:00 GMT-0300 (Brasilia Standard Time)
Faço um convite sincero à reflexão. O que vocês acham que será do Brasil se Bolsonaro for reeleito?… https://t.co/aBx4oN82Wk,33374761,,,33374761,cirogomes,,,602,2714,Mon Sep 20 2021 20:30:15 GMT-0300 (Brasilia Standard Time),Tue Aug 31 2021 11:00:03 GMT-0300 (Brasilia Standard Time)
"Hoje converso com Víctor González para o jornal Paraguaio @5diasPY. Acompanhe às 14h, horário de Brasília! https://t.co/GPk5xaDd5W",33374761,,,33374761,cirogomes,,,208,992,Mon Sep 20 2021 20:30:15 GMT-0300 (Brasilia Standard Time),Tue Aug 31 2021 10:05:22 GMT-0300 (Brasilia Standard Time)
"Na natação, o Brasil conquistou ouro com Carol Santiago (segundo ouro dela), prata com Gabriel Bandeira (que já tin… https://t.co/ka3vb9POLk",33374761,,,33374761,cirogomes,,,34,397,Mon Sep 20 2021 20:30:15 GMT-0300 (Brasilia Standard Time),Tue Aug 31 2021 09:02:24 GMT-0300 (Brasilia Standard Time)
A 99ª medalha de ouro do Brasil também veio de forma muito emocionante. Ela foi conquistada pela lançadora de disco… https://t.co/8vBHLwq9ab,33374761,,,33374761,cirogomes,,,31,429,Mon Sep 20 2021 20:30:15 GMT-0300 (Brasilia Standard Time),Tue Aug 31 2021 09:02:23 GMT-0300 (Brasilia Standard Time)
"Antes, Yeltsin, que é guiado por Antonio Carlos dos Santos, o “Bira”, havia vencido os 5.000m. E olha que sábado ele ainda corre a maratona.",33374761,,,33374761,cirogomes,,,15,122,Mon Sep 20 2021 20:30:15 GMT-0300 (Brasilia Standard Time),Tue Aug 31 2021 09:02:23 GMT-0300 (Brasilia Standard Time)
"Yeltsin Jacques fez história, ontem à noite, ao conquistar a 100ª medalha de ouro do Brasil na história das Paralim… https://t.co/t99Eu39gy8",33374761,,,33374761,cirogomes,,,107,1174,Mon Sep 20 2021 20:30:15 GMT-0300 (Brasilia Standard Time),Tue Aug 31 2021 09:02:22 GMT-0300 (Brasilia Standard Time)
"Para nós, o dado mais relevante - e ainda sem o devido destaque -  é a crescente vantagem de Ciro, que se consolida… https://t.co/nIMxZE09ye",33374761,,,33374761,cirogomes,,,109,1255,Mon Sep 20 2021 20:30:15 GMT-0300 (Brasilia Standard Time),Mon Aug 30 2021 15:48:51 GMT-0300 (Brasilia Standard Time)
