text,query,country,city,userId,username,quote_count,reply_count,retweet_count,favorite_count,timestamp,createdAt
@stoibinho toda hora tem perola dessa pm de goias do fascista do caiado consegue ser acima da media na filha da putisse,caiado,,,1184052626830385200,gabrielnenop,,,0,0,Tue Aug 10 2021 10:15:03 GMT-0300 (Brasilia Standard Time),Tue Aug 10 2021 10:06:26 GMT-0300 (Brasilia Standard Time)
Uns 10 storys seguidos de gente conhecida se vacinando obrigada papai caiado tô mt emocionada,caiado,,,1225423821039165400,mihstan,,,0,1,Tue Aug 10 2021 10:15:03 GMT-0300 (Brasilia Standard Time),Tue Aug 10 2021 10:03:12 GMT-0300 (Brasilia Standard Time)
"Renato Damásio e as lideranças palmelinas reafirmaram parceria com Caíado, e apresentaram reivindicações.
#palmelo… https://t.co/4guR8lpUEB",caiado,,,129002495,sdnewscatalao,,,0,0,Tue Aug 10 2021 10:15:03 GMT-0300 (Brasilia Standard Time),Tue Aug 10 2021 10:00:02 GMT-0300 (Brasilia Standard Time)
"#CaldasNovas: O programa foi anunciado na última segunda-feira, 09, pelo Governador Ronaldo Caiado, e contou com à… https://t.co/VI1ILZwX8Y",caiado,,,59325873,jovempangoiania,,,0,0,Tue Aug 10 2021 10:15:03 GMT-0300 (Brasilia Standard Time),Tue Aug 10 2021 09:54:56 GMT-0300 (Brasilia Standard Time)
"Candidato à reeleição, Caiado tem tudo para ser um aliado importante em 2022, sobretudo pelas pontes com o agronegó… https://t.co/lZzTVdSVvn",caiado,,,17598453,Relatorio,,,0,0,Tue Aug 10 2021 10:15:03 GMT-0300 (Brasilia Standard Time),Tue Aug 10 2021 09:51:01 GMT-0300 (Brasilia Standard Time)
"#Politica  Jair Bolsonaro tem sido aconselhado a dar mais atenção aos pleitos do governador de Goiás, Ronaldo Caiado.",caiado,,,17598453,Relatorio,,,0,0,Tue Aug 10 2021 10:15:03 GMT-0300 (Brasilia Standard Time),Tue Aug 10 2021 09:51:01 GMT-0300 (Brasilia Standard Time)
@CaioPeres18 @LatinoCrente O mundo dele é um sepulcro Caiado. O menosprezo aos pobres levará muita gente ao inferno… https://t.co/WcW9XUvXrt,caiado,,,55679609,thiagolleone,,,0,1,Tue Aug 10 2021 10:15:03 GMT-0300 (Brasilia Standard Time),Tue Aug 10 2021 09:45:38 GMT-0300 (Brasilia Standard Time)
"RT @Fabricio_Carva: Esperando o Governador Caiado falar que não admite abuso de autoridade e excesso por parte da ""sua Polícia Militar"". O…",caiado,,,3290533521,eamunizz,,,6,0,Tue Aug 10 2021 10:15:03 GMT-0300 (Brasilia Standard Time),Tue Aug 10 2021 09:37:08 GMT-0300 (Brasilia Standard Time)
"Tiveram que mandar o cavalao que não sabe beber pro hospital, e no final de todo o rolê, Ibaneis mandou a conta de… https://t.co/i1ymCD8kiE",caiado,,,1031206510335090700,letsresendee,,,0,0,Tue Aug 10 2021 10:15:03 GMT-0300 (Brasilia Standard Time),Tue Aug 10 2021 09:34:45 GMT-0300 (Brasilia Standard Time)
"Pra quem quer saber da tour, o toda vez que o Ibaneis ingere bebidinha alcoólicas passa mal (inclusive quase toda s… https://t.co/IveZIdMu9d",caiado,,,1031206510335090700,letsresendee,,,0,0,Tue Aug 10 2021 10:15:03 GMT-0300 (Brasilia Standard Time),Tue Aug 10 2021 09:33:09 GMT-0300 (Brasilia Standard Time)
"A treta dos 80 mil reaix do Ronaldo Caiado com o Ibaneis tá servindo de alguma coisa,  tô amando essa corrida pra v… https://t.co/x889gBRqgv",caiado,,,1031206510335090700,letsresendee,,,0,0,Tue Aug 10 2021 10:15:03 GMT-0300 (Brasilia Standard Time),Tue Aug 10 2021 09:28:30 GMT-0300 (Brasilia Standard Time)
"RT @aredacao: Caiado pagará R$ 250 a mães goianas em situação de vulnerabilidade social. Ação deve atender cerca de 100 mil famílias.
https…",caiado,,,67361943,luizbrunororiz,,,3,0,Tue Aug 10 2021 10:15:03 GMT-0300 (Brasilia Standard Time),Tue Aug 10 2021 09:25:57 GMT-0300 (Brasilia Standard Time)
RT @rbgoiania: O governador Ronaldo Caiado e a presidente de honra da Organização das Voluntárias de Goiás (OVG) e coordenadora do Gabinete…,caiado,,,67361943,luizbrunororiz,,,2,0,Tue Aug 10 2021 10:15:03 GMT-0300 (Brasilia Standard Time),Tue Aug 10 2021 09:25:54 GMT-0300 (Brasilia Standard Time)
"É quando um céu de estrelas me serve de casa,que meus sonhos se libertam a criar asas e voam até o mais alto vestíg… https://t.co/a03IWrqxFm",caiado,,,1276852651674742800,caiado_rosa,,,0,0,Tue Aug 10 2021 10:15:03 GMT-0300 (Brasilia Standard Time),Tue Aug 10 2021 09:24:51 GMT-0300 (Brasilia Standard Time)
"Para que vou dormir, se tenho que acordar,
antes do meu sonho começar?",caiado,,,1276852651674742800,caiado_rosa,,,0,0,Tue Aug 10 2021 10:15:03 GMT-0300 (Brasilia Standard Time),Tue Aug 10 2021 09:24:38 GMT-0300 (Brasilia Standard Time)
"Quase sempre, o maior Sonho de um homem
e ter uma boa casa,um bom carro,uma bela moto,mas o meu maior sonho
é ficar… https://t.co/D83MEjWi6P",caiado,,,1276852651674742800,caiado_rosa,,,0,0,Tue Aug 10 2021 10:15:03 GMT-0300 (Brasilia Standard Time),Tue Aug 10 2021 09:24:26 GMT-0300 (Brasilia Standard Time)
pra mim soa como recado https://t.co/BzDzjL29Pk,caiado,,,23633769,camila_caiado,,,0,1,Tue Aug 10 2021 10:15:03 GMT-0300 (Brasilia Standard Time),Tue Aug 10 2021 09:23:19 GMT-0300 (Brasilia Standard Time)
O quê? Eu deveria matar todo mundo e fugir? Desculpem. As vozes... Estou brincando! Calma! Não foi isso que elas falaram.,caiado,,,1276852651674742800,caiado_rosa,,,0,0,Tue Aug 10 2021 10:15:03 GMT-0300 (Brasilia Standard Time),Tue Aug 10 2021 09:22:25 GMT-0300 (Brasilia Standard Time)
"Eu me lembrei que fugir, às vezes é necessário para recuperar o fôlego. Para restaurar a força.",caiado,,,1276852651674742800,caiado_rosa,,,0,0,Tue Aug 10 2021 10:15:03 GMT-0300 (Brasilia Standard Time),Tue Aug 10 2021 09:22:08 GMT-0300 (Brasilia Standard Time)
Para fugir ou para buscar. Os fugitivos cedo ou tarde descobrem que seus problemas são de natureza geográfica.,caiado,,,1276852651674742800,caiado_rosa,,,0,0,Tue Aug 10 2021 10:15:03 GMT-0300 (Brasilia Standard Time),Tue Aug 10 2021 09:21:56 GMT-0300 (Brasilia Standard Time)
"Não há escape que para sempre salve, nem covardia que para sempre proteja.
Não há como fugir para sempre. Ainda que… https://t.co/q90OlRiG7b",caiado,,,1276852651674742800,caiado_rosa,,,0,0,Tue Aug 10 2021 10:15:03 GMT-0300 (Brasilia Standard Time),Tue Aug 10 2021 09:21:45 GMT-0300 (Brasilia Standard Time)
"O pior de fugir de si mesmo é que cedo ou tarde, você se encontra. E quando se encontra, percebe que aquilo que voc… https://t.co/rMFjYsQTpZ",caiado,,,1276852651674742800,caiado_rosa,,,0,0,Tue Aug 10 2021 10:15:03 GMT-0300 (Brasilia Standard Time),Tue Aug 10 2021 09:21:32 GMT-0300 (Brasilia Standard Time)
"A felicidade é uma obra-prima: o menor erro falseia-a, a menor hesitação altera-a, a menor falta de delicadeza desf… https://t.co/RDWGaDGcyY",caiado,,,1276852651674742800,caiado_rosa,,,0,0,Tue Aug 10 2021 10:15:03 GMT-0300 (Brasilia Standard Time),Tue Aug 10 2021 09:20:43 GMT-0300 (Brasilia Standard Time)
"Que obra prima é o homem!
Como é nobre em sua razão!
Que capacidade infinita!
Como é preciso e bem-feito em forma e… https://t.co/hiURbXs7MR",caiado,,,1276852651674742800,caiado_rosa,,,0,0,Tue Aug 10 2021 10:15:03 GMT-0300 (Brasilia Standard Time),Tue Aug 10 2021 09:20:31 GMT-0300 (Brasilia Standard Time)
Uma corrente de ouro só serve para prender seu portão de ouro da sua casa de ouro.,caiado,,,1276852651674742800,caiado_rosa,,,0,0,Tue Aug 10 2021 10:15:03 GMT-0300 (Brasilia Standard Time),Tue Aug 10 2021 09:19:20 GMT-0300 (Brasilia Standard Time)
"Dirigir? Claro que pode. Depois que fizer 16, for pra autoescola, tirar sua carteira, se formar no colégio, arranja… https://t.co/j0PIa821y1",caiado,,,1276852651674742800,caiado_rosa,,,0,0,Tue Aug 10 2021 10:15:03 GMT-0300 (Brasilia Standard Time),Tue Aug 10 2021 09:19:02 GMT-0300 (Brasilia Standard Time)
"Uma coisa que aprendi em relação às mulheres é que mesmo quando você tá certo, você tá errado",caiado,,,1276852651674742800,caiado_rosa,,,0,0,Tue Aug 10 2021 10:15:03 GMT-0300 (Brasilia Standard Time),Tue Aug 10 2021 09:18:53 GMT-0300 (Brasilia Standard Time)
"Ningué marca um gol sentado no banco de reservas. No jogo da vida, você tem que estar ativo, em campo, chamando a responsabilidade pra si.",caiado,,,1276852651674742800,caiado_rosa,,,0,0,Tue Aug 10 2021 10:15:03 GMT-0300 (Brasilia Standard Time),Tue Aug 10 2021 09:17:39 GMT-0300 (Brasilia Standard Time)
"No palco, na praça, no circo, num banco de jardim, correndo no escuro, pichado no muro... Você vai saber de mim.",caiado,,,1276852651674742800,caiado_rosa,,,0,0,Tue Aug 10 2021 10:15:03 GMT-0300 (Brasilia Standard Time),Tue Aug 10 2021 09:17:20 GMT-0300 (Brasilia Standard Time)
"Nenhuma seita gosta da doutrina do pecado; e isso pelo forte motivo de que você jamais ficará popular, se pregar a… https://t.co/Pt48ifUpCd",caiado,,,1276852651674742800,caiado_rosa,,,0,0,Tue Aug 10 2021 10:15:03 GMT-0300 (Brasilia Standard Time),Tue Aug 10 2021 09:16:21 GMT-0300 (Brasilia Standard Time)
Aquele que começa a amar o cristianismo mais do que a verdade acabará por amar a sua seita ou a sua igreja mais do… https://t.co/crwpKOoy66,caiado,,,1276852651674742800,caiado_rosa,,,0,0,Tue Aug 10 2021 10:15:03 GMT-0300 (Brasilia Standard Time),Tue Aug 10 2021 09:16:06 GMT-0300 (Brasilia Standard Time)
"Quase toda a seita do cristianismo representa uma perversão da sua essência, com a finalidade de adaptá-lo aos preconceitos do mundo.",caiado,,,1276852651674742800,caiado_rosa,,,0,0,Tue Aug 10 2021 10:15:03 GMT-0300 (Brasilia Standard Time),Tue Aug 10 2021 09:15:48 GMT-0300 (Brasilia Standard Time)
"E via bichinhos, bolas, aviões
Fortes apaches com os seus canhões
E soldadinhos prontos para atirar
E via trens, ca… https://t.co/yk0Oera0PV",caiado,,,1276852651674742800,caiado_rosa,,,0,0,Tue Aug 10 2021 10:15:03 GMT-0300 (Brasilia Standard Time),Tue Aug 10 2021 09:14:26 GMT-0300 (Brasilia Standard Time)
"O NATAL MAIS FELIZ DA MINHA VIDA

Lembro que Papai Noel estava na esquina
Em frente àquela loja fina
Onde meninos p… https://t.co/EydTkra5Vs",caiado,,,1276852651674742800,caiado_rosa,,,0,0,Tue Aug 10 2021 10:15:03 GMT-0300 (Brasilia Standard Time),Tue Aug 10 2021 09:14:12 GMT-0300 (Brasilia Standard Time)
Você não pode estar totalmente acordado enquanto está pensando. Pensar é outra forma de estar num estado de sonho.… https://t.co/6Hx8d4Vw1g,caiado,,,1276852651674742800,caiado_rosa,,,0,0,Tue Aug 10 2021 10:15:03 GMT-0300 (Brasilia Standard Time),Tue Aug 10 2021 09:12:44 GMT-0300 (Brasilia Standard Time)
DF e SP vacinando galera de 20/21 anos já vambora Caiado faz alguma coisa,caiado,,,1339670497,Olimelc,,,0,6,Tue Aug 10 2021 10:15:03 GMT-0300 (Brasilia Standard Time),Tue Aug 10 2021 09:12:23 GMT-0300 (Brasilia Standard Time)
"O que mais odeio é gente complicada e preconceituosa, hipocrisia e ser acordado. Nenhuma outra coisa consegue ser pior do que isso.",caiado,,,1276852651674742800,caiado_rosa,,,0,0,Tue Aug 10 2021 10:15:03 GMT-0300 (Brasilia Standard Time),Tue Aug 10 2021 09:12:19 GMT-0300 (Brasilia Standard Time)
@rosiane122 @alexandre Esse ministro se é que pode ser chamado assim não pode nem sair na rua tem medo ser caiado a… https://t.co/eiDL7ISgHE,caiado,,,2680316148,amsflamengo,,,0,0,Tue Aug 10 2021 10:15:03 GMT-0300 (Brasilia Standard Time),Tue Aug 10 2021 09:12:14 GMT-0300 (Brasilia Standard Time)
"Há quem diga que todas as noites são de sonhos.
Mas há também quem garanta que nem todas, só as de verão. No fundo,… https://t.co/9tCrZ0agJV",caiado,,,1276852651674742800,caiado_rosa,,,0,0,Tue Aug 10 2021 10:15:03 GMT-0300 (Brasilia Standard Time),Tue Aug 10 2021 09:12:04 GMT-0300 (Brasilia Standard Time)
"Não é que todos os homens sejam safados, são a mulheres que sempre escolhem os homens errados.",caiado,,,1276852651674742800,caiado_rosa,,,0,0,Tue Aug 10 2021 10:15:03 GMT-0300 (Brasilia Standard Time),Tue Aug 10 2021 09:10:59 GMT-0300 (Brasilia Standard Time)
"Há uma demanda hoje por homens capazes de fazer o errado parecer certo e de demonstrar que o branco é preto e o preto, branco.",caiado,,,1276852651674742800,caiado_rosa,,,0,0,Tue Aug 10 2021 10:15:03 GMT-0300 (Brasilia Standard Time),Tue Aug 10 2021 09:10:40 GMT-0300 (Brasilia Standard Time)
"Confie em si mesmo, ninguém é forte o bastante para derrubar um coração destemido.",caiado,,,1276852651674742800,caiado_rosa,,,0,0,Tue Aug 10 2021 10:15:03 GMT-0300 (Brasilia Standard Time),Tue Aug 10 2021 09:09:43 GMT-0300 (Brasilia Standard Time)
"Não quero rezar para me proteger dos perigos, mas para ser destemido ao encará-los. Não quero implorar para que me… https://t.co/L4tyhQMpOP",caiado,,,1276852651674742800,caiado_rosa,,,0,0,Tue Aug 10 2021 10:15:03 GMT-0300 (Brasilia Standard Time),Tue Aug 10 2021 09:09:26 GMT-0300 (Brasilia Standard Time)
"Apesar de aparecer na forma terrena,sua essência é pura consciência. Você é o destemido guardião da luz divina.",caiado,,,1276852651674742800,caiado_rosa,,,0,0,Tue Aug 10 2021 10:15:03 GMT-0300 (Brasilia Standard Time),Tue Aug 10 2021 09:09:13 GMT-0300 (Brasilia Standard Time)
"RT @Fabricio_Carva: Esperando o Governador Caiado falar que não admite abuso de autoridade e excesso por parte da ""sua Polícia Militar"". O…",caiado,,,2983152867,line_lorenzo,,,6,0,Tue Aug 10 2021 10:15:03 GMT-0300 (Brasilia Standard Time),Tue Aug 10 2021 09:08:47 GMT-0300 (Brasilia Standard Time)
@_natiihribeiro Caiado pagou ou outdoor na cabeça de Ibaneis kakakaka a,caiado,,,1303766723011674000,hicaami,,,0,0,Tue Aug 10 2021 10:15:03 GMT-0300 (Brasilia Standard Time),Tue Aug 10 2021 09:08:34 GMT-0300 (Brasilia Standard Time)
Às vezes gastamos uma vida toda pra descobrir que o nosso verdadeiro tesouro estava debaixo do nosso próprio travesseiro.,caiado,,,1276852651674742800,caiado_rosa,,,0,0,Tue Aug 10 2021 10:15:03 GMT-0300 (Brasilia Standard Time),Tue Aug 10 2021 09:08:15 GMT-0300 (Brasilia Standard Time)
"O maior Tesouro que um homem pode acumular na vida ""é o amor ao próximo"", e a maior virtude deste milionário ""é o Temor a Deus"".",caiado,,,1276852651674742800,caiado_rosa,,,0,0,Tue Aug 10 2021 10:15:03 GMT-0300 (Brasilia Standard Time),Tue Aug 10 2021 09:07:59 GMT-0300 (Brasilia Standard Time)
O governador Ronaldo Caiado e a presidente de honra da Organização das Voluntárias de Goiás (OVG) e coordenadora do… https://t.co/NuunMgq9UW,caiado,,,318429573,AGMGoias,,,0,0,Tue Aug 10 2021 10:15:03 GMT-0300 (Brasilia Standard Time),Tue Aug 10 2021 09:07:06 GMT-0300 (Brasilia Standard Time)
"gente só é votar direito para o poder legislativo uai, num adiada só por culpa no bolsonaro ne o cara eh um ladrao… https://t.co/qNR1GBkR03",caiado,,,56788629,lobento_,,,0,3,Tue Aug 10 2021 10:15:03 GMT-0300 (Brasilia Standard Time),Tue Aug 10 2021 09:03:07 GMT-0300 (Brasilia Standard Time)
"RT @Fabricio_Carva: Esperando o Governador Caiado falar que não admite abuso de autoridade e excesso por parte da ""sua Polícia Militar"". O…",caiado,,,737252698886701000,eeeitamari,,,6,0,Tue Aug 10 2021 10:15:03 GMT-0300 (Brasilia Standard Time),Tue Aug 10 2021 08:59:56 GMT-0300 (Brasilia Standard Time)
"RT @Fabricio_Carva: Esperando o Governador Caiado falar que não admite abuso de autoridade e excesso por parte da ""sua Polícia Militar"". O…",caiado,,,1098358574475026400,augustopaiero1,,,6,0,Tue Aug 10 2021 10:15:03 GMT-0300 (Brasilia Standard Time),Tue Aug 10 2021 08:52:49 GMT-0300 (Brasilia Standard Time)
"RT @Fabricio_Carva: Esperando o Governador Caiado falar que não admite abuso de autoridade e excesso por parte da ""sua Polícia Militar"". O…",caiado,,,973743303702216700,cansadaMelo,,,6,0,Tue Aug 10 2021 10:15:03 GMT-0300 (Brasilia Standard Time),Tue Aug 10 2021 08:48:45 GMT-0300 (Brasilia Standard Time)
"RT @Fabricio_Carva: Esperando o Governador Caiado falar que não admite abuso de autoridade e excesso por parte da ""sua Polícia Militar"". O…",caiado,,,130315998,carambaferrou,,,6,0,Tue Aug 10 2021 10:15:03 GMT-0300 (Brasilia Standard Time),Tue Aug 10 2021 08:38:31 GMT-0300 (Brasilia Standard Time)
Acabei de ver Ronaldo Caiado lamenta morte do ex-governador Ary Valadão - Clique para ver também ☛  https://t.co/lo48CYzgB7,caiado,,,68451332,SenhorFranklin,,,0,0,Tue Aug 10 2021 10:15:03 GMT-0300 (Brasilia Standard Time),Tue Aug 10 2021 08:27:33 GMT-0300 (Brasilia Standard Time)
Caiado está sendo top em fazer a obrigação do que se é esperado de um governador.,caiado,,,887090610695540700,larissasouzag21,,,0,0,Tue Aug 10 2021 10:15:03 GMT-0300 (Brasilia Standard Time),Tue Aug 10 2021 08:15:22 GMT-0300 (Brasilia Standard Time)
vei que inferno morar no goias viu vai tomar no cu caiado,caiado,,,1308843034428276700,evsrmre,,,0,1,Tue Aug 10 2021 10:15:03 GMT-0300 (Brasilia Standard Time),Tue Aug 10 2021 07:53:47 GMT-0300 (Brasilia Standard Time)
@CNNBrasil Minha avó n operou hj aqui em Goiânia por falta de UTI. Ronaldo Caiado e o prefeito abriram tdo ligatam o fds.,caiado,,,2400635137,Seep_oitnb,,,0,0,Tue Aug 10 2021 10:15:03 GMT-0300 (Brasilia Standard Time),Tue Aug 10 2021 07:41:01 GMT-0300 (Brasilia Standard Time)
@nereucrispim @ronaldocaiado Caiado nunca foi frouxo nem covarde.,caiado,,,1192646050890342400,denize3000,,,0,0,Tue Aug 10 2021 10:15:03 GMT-0300 (Brasilia Standard Time),Tue Aug 10 2021 07:40:40 GMT-0300 (Brasilia Standard Time)
"Caiado lança Mães de Goiás, programa de transferência de renda que destinará R$ 250 mensais a 100 mil famílias em v… https://t.co/JuBRJnWU8m",caiado,,,965569527688978400,lancefmgoias,,,0,0,Tue Aug 10 2021 10:15:03 GMT-0300 (Brasilia Standard Time),Tue Aug 10 2021 07:19:03 GMT-0300 (Brasilia Standard Time)
"Esperando o Governador Caiado falar que não admite abuso de autoridade e excesso por parte da ""sua Polícia Militar""… https://t.co/g1eOmKOvai",caiado,,,299397588,Fabricio_Carva,,,6,29,Tue Aug 10 2021 10:15:03 GMT-0300 (Brasilia Standard Time),Tue Aug 10 2021 07:01:15 GMT-0300 (Brasilia Standard Time)
@ronaldocaiado Ronaldo caiado  vc disse em 2019 que iria acabar com.a industria da multa e hoje o que vemos e vc au… https://t.co/tdoN7dZtv4,caiado,,,1366541038224048000,GledsonCoelhoG1,,,0,0,Tue Aug 10 2021 10:15:03 GMT-0300 (Brasilia Standard Time),Tue Aug 10 2021 06:19:53 GMT-0300 (Brasilia Standard Time)
"A pedido de Lissauer, Chico KGL e Paulo do Vale, Caiado libera R$ 27 milhões em investimentos para Rio Verde -… https://t.co/kRHTZFnnNE",caiado,,,1215681016813310000,TempoDiario,,,0,0,Tue Aug 10 2021 10:15:03 GMT-0300 (Brasilia Standard Time),Tue Aug 10 2021 05:28:00 GMT-0300 (Brasilia Standard Time)
Já vem o Caiado de novo!  Haja saco!!! https://t.co/VPkgbUfWzC,caiado,Brazil,"Belo Horizonte, Brazil",1048231184969420800,DraEliana1,,,0,0,Tue Aug 10 2021 10:15:03 GMT-0300 (Brasilia Standard Time),Tue Aug 10 2021 05:15:33 GMT-0300 (Brasilia Standard Time)
"RT @aredacao: Caiado pagará R$ 250 a mães goianas em situação de vulnerabilidade social. Ação deve atender cerca de 100 mil famílias.
https…",caiado,,,57123119,Joao_Unes,,,3,0,Tue Aug 10 2021 10:15:03 GMT-0300 (Brasilia Standard Time),Tue Aug 10 2021 04:54:48 GMT-0300 (Brasilia Standard Time)
RT @ANA_PAULA_FONS: Hacker invade sistema da Justiça Federal de SP e altera sentença em processo - RecordTV - R7 Fala Brasil https://t.co/C…,caiado,,,520988000,joviano_caiado,,,179,0,Tue Aug 10 2021 10:15:03 GMT-0300 (Brasilia Standard Time),Tue Aug 10 2021 02:29:07 GMT-0300 (Brasilia Standard Time)
@randolfeap Seu reino é o seu ventre sepulcro caiado,caiado,Brazil,"Boituva, Brasil",1059367713833914400,Carlos45008954,,,0,0,Tue Aug 10 2021 10:15:03 GMT-0300 (Brasilia Standard Time),Tue Aug 10 2021 01:00:28 GMT-0300 (Brasilia Standard Time)
@mello1400 @Metropoles @ronaldocaiado Família Caiado fez fortuna usando a polícia como capangas. Ele acha bonito.,caiado,,,357654870,agfaria,,,0,0,Tue Aug 10 2021 10:15:03 GMT-0300 (Brasilia Standard Time),Tue Aug 10 2021 00:52:48 GMT-0300 (Brasilia Standard Time)
@minimonistan Geovana quando o caiado mandar vacinar nois avisa pra mim   mt triste a noticia,caiado,,,1186876484469870600,kimroludo,,,0,0,Tue Aug 10 2021 10:15:03 GMT-0300 (Brasilia Standard Time),Tue Aug 10 2021 00:29:37 GMT-0300 (Brasilia Standard Time)
"Caiado lança Mães de Goiás, programa de transferência de renda que destinará R$ 250 mensais a 100 mil famílias
https://t.co/a0zTvd10BB",caiado,,,2427773448,Vivergoias,,,0,0,Tue Aug 10 2021 10:15:03 GMT-0300 (Brasilia Standard Time),Tue Aug 10 2021 00:25:12 GMT-0300 (Brasilia Standard Time)
"@joicehasselmann Sua traíra, tu chega a ser pior do que a esquerda, porque a esquerda vai ser sempre o que é, e tu… https://t.co/TI5h3hghi1",caiado,,,1416196641833562000,LinaMariaBruno1,,,0,0,Tue Aug 10 2021 10:15:03 GMT-0300 (Brasilia Standard Time),Tue Aug 10 2021 00:16:20 GMT-0300 (Brasilia Standard Time)
"RT @resende_fabi: @yasmin_calmet @rennatodutra @GeanLoureiro Falta de empenho dos governantes locais, até em Goiás a vacinação de adolescen…",caiado,,,1251318936945275000,rennatodutra,,,1,0,Tue Aug 10 2021 10:15:03 GMT-0300 (Brasilia Standard Time),Mon Aug 09 2021 23:51:20 GMT-0300 (Brasilia Standard Time)
Cumpri agenda ao lado do governador Caiado em Hidrolândia. Vistoriamos as obras do Colégio Militar Professora Augus… https://t.co/2nmeo4TJXf,caiado,,,1096099002762870800,lissauervieira,,,0,1,Tue Aug 10 2021 10:15:03 GMT-0300 (Brasilia Standard Time),Mon Aug 09 2021 23:33:18 GMT-0300 (Brasilia Standard Time)
"@g1 O rapaz já vinha sendo treinado pelo pai há muito tempo, assim como o Bruno foi morar com avô Mário Covas, bem… https://t.co/QIfJGbq9mc",caiado,,,1307636532,DonaIzilda,,,0,4,Tue Aug 10 2021 10:15:03 GMT-0300 (Brasilia Standard Time),Mon Aug 09 2021 23:33:00 GMT-0300 (Brasilia Standard Time)
RT @deluca_joao: @Metropoles A polícia de Goiás é podre!!! Vários episódios absurdos estão sendo cometidos diariamente por esses milicianos…,caiado,,,66665354,nuckythompson47,,,4,0,Tue Aug 10 2021 10:15:03 GMT-0300 (Brasilia Standard Time),Mon Aug 09 2021 23:22:28 GMT-0300 (Brasilia Standard Time)
@loka_costa Sou Lula 2022 e Anti-Caiado 2022.,caiado,,,176618654,Warley_Lopes,,,0,1,Tue Aug 10 2021 10:15:03 GMT-0300 (Brasilia Standard Time),Mon Aug 09 2021 23:20:26 GMT-0300 (Brasilia Standard Time)
@Caiado__ kkkkkkkkkkk só observo,caiado,,,1353872764982206500,mariaa___L,,,0,1,Tue Aug 10 2021 10:15:03 GMT-0300 (Brasilia Standard Time),Mon Aug 09 2021 23:12:40 GMT-0300 (Brasilia Standard Time)
"RT @regiancordeiro: Caro @minc_rj , o Vereador Carlo Caiado parece estar interessado em  ajudar os animaizinhos. Pelo menos pediu à Secretá…",caiado,,,1322543828440670200,MARCOAU27217508,,,1,0,Tue Aug 10 2021 10:15:03 GMT-0300 (Brasilia Standard Time),Mon Aug 09 2021 23:03:19 GMT-0300 (Brasilia Standard Time)
@Alessan15151371 @Metropoles @ronaldocaiado Caiado é só o sintoma de uma sociedade doente que se informa apenas atr… https://t.co/gaFIGoujEb,caiado,,,1147957178592059400,resende_fabi,,,0,0,Tue Aug 10 2021 10:15:03 GMT-0300 (Brasilia Standard Time),Mon Aug 09 2021 22:56:27 GMT-0300 (Brasilia Standard Time)
@Caiado__ kkkkkkkk pse sô,caiado,,,1178052070705913900,LuizaSilva57,,,0,1,Tue Aug 10 2021 10:15:03 GMT-0300 (Brasilia Standard Time),Mon Aug 09 2021 22:47:13 GMT-0300 (Brasilia Standard Time)
@DelfinoTuito Pra caiar o caiado,caiado,,,28177528,lndrjm,,,0,2,Tue Aug 10 2021 10:15:03 GMT-0300 (Brasilia Standard Time),Mon Aug 09 2021 22:40:45 GMT-0300 (Brasilia Standard Time)
@Aninhaa_frn tbm amo você mb,caiado,,,1074659485564715000,Caiado__,,,0,1,Tue Aug 10 2021 10:15:03 GMT-0300 (Brasilia Standard Time),Mon Aug 09 2021 22:39:19 GMT-0300 (Brasilia Standard Time)
"@marconiperillo @nytimes Coninho, o Caiado conseguiu ganhar de você na ruindade.",caiado,,,228103950,juliocezar_adv,,,0,0,Tue Aug 10 2021 10:15:03 GMT-0300 (Brasilia Standard Time),Mon Aug 09 2021 22:27:08 GMT-0300 (Brasilia Standard Time)
@le_caiado KKKKKKKK meu senhor,caiado,,,959052316304388100,__anamurad,,,0,0,Tue Aug 10 2021 10:15:03 GMT-0300 (Brasilia Standard Time),Mon Aug 09 2021 22:23:45 GMT-0300 (Brasilia Standard Time)
"RT @JornalGoyaz: EXTRA | Caiado lança Mães de Goiás, programa de transferência de renda que destinará R$ 250 mensais a 100 mil famílias em…",caiado,,,1329216122701435000,LordCarlLord,,,2,0,Tue Aug 10 2021 10:15:03 GMT-0300 (Brasilia Standard Time),Mon Aug 09 2021 22:19:43 GMT-0300 (Brasilia Standard Time)
"RT @JornalGoyaz: FOTOS | Primeira-dama Gracinha Caiado é homenageada durante prestação de contas da Santa Casa - 

Fotos 📸: Wesley Costa SE…",caiado,,,1329216122701435000,LordCarlLord,,,1,0,Tue Aug 10 2021 10:15:03 GMT-0300 (Brasilia Standard Time),Mon Aug 09 2021 22:19:34 GMT-0300 (Brasilia Standard Time)
"Se é deputada, deveria estar pensando em uma forma decente de ajudar quem precisa.  @JanainaDoBrasil, a fariseia go… https://t.co/jNYNyloZNy",caiado,,,1062418676459192300,MozSimone,,,0,0,Tue Aug 10 2021 10:15:03 GMT-0300 (Brasilia Standard Time),Mon Aug 09 2021 22:15:53 GMT-0300 (Brasilia Standard Time)
seu perfil foi visto por 5 pessoas nas últimas 4 horas https://t.co/KrHqIovGA4,caiado,,,363850507,lucas_caiado,,,0,0,Tue Aug 10 2021 10:15:03 GMT-0300 (Brasilia Standard Time),Mon Aug 09 2021 22:15:08 GMT-0300 (Brasilia Standard Time)
"@Caiado__ VEM, VEM AGORA",caiado,,,1239581534149058600,Aninhaa_frn,,,0,1,Tue Aug 10 2021 10:15:03 GMT-0300 (Brasilia Standard Time),Mon Aug 09 2021 22:04:56 GMT-0300 (Brasilia Standard Time)
@Aninhaa_frn TÔ INDO CARMA,caiado,,,1074659485564715000,Caiado__,,,0,0,Tue Aug 10 2021 10:15:03 GMT-0300 (Brasilia Standard Time),Mon Aug 09 2021 22:04:06 GMT-0300 (Brasilia Standard Time)
@Caiado__ Oo meu amor,caiado,,,1239581534149058600,Aninhaa_frn,,,0,0,Tue Aug 10 2021 10:15:03 GMT-0300 (Brasilia Standard Time),Mon Aug 09 2021 22:03:22 GMT-0300 (Brasilia Standard Time)
@le_caiado pq amiga ???,caiado,,,959052316304388100,__anamurad,,,0,0,Tue Aug 10 2021 10:15:03 GMT-0300 (Brasilia Standard Time),Mon Aug 09 2021 22:01:07 GMT-0300 (Brasilia Standard Time)
