text,query,country,city,userId,username,quote_count,reply_count,retweet_count,favorite_count,timestamp,createdAt
Caiado acaba com “indústria da multa” que completa 2 anos e 7 meses sem radares móveis https://t.co/gD4JkhYAws,caiado,,,191237188,radioimprensa,,,0,0,Mon Aug 09 2021 13:39:09 GMT-0300 (Brasilia Standard Time),Mon Aug 09 2021 06:33:13 GMT-0300 (Brasilia Standard Time)
"Caiado e primeira-dama, Gracinha Caiado, lançam programa Mães de Goiás https://t.co/GjlUF6rPXt",caiado,,,191237188,radioimprensa,,,0,0,Mon Aug 09 2021 13:39:09 GMT-0300 (Brasilia Standard Time),Mon Aug 09 2021 06:30:45 GMT-0300 (Brasilia Standard Time)
Esse Caiado adora aparecer! https://t.co/kFNQXGecF9,caiado,Brazil,"Belo Horizonte, Brazil",1048231184969420800,DraEliana1,,,0,0,Mon Aug 09 2021 13:39:09 GMT-0300 (Brasilia Standard Time),Mon Aug 09 2021 05:43:01 GMT-0300 (Brasilia Standard Time)
"Portal Goiás – Caiado acaba com “indústria da multa”, em Goiás, que completa 2 anos e 7 meses sem radares móveis… https://t.co/XPZ2ZTxb4Q",caiado,,,3987222365,AdeCardoso,,,0,0,Mon Aug 09 2021 13:39:09 GMT-0300 (Brasilia Standard Time),Mon Aug 09 2021 04:03:55 GMT-0300 (Brasilia Standard Time)
@DeputadoFederal A caserna é um sepulcro caiado... https://t.co/mYqu7ayMGF,caiado,,,1394461393773113300,acm1065,,,1,10,Mon Aug 09 2021 13:39:09 GMT-0300 (Brasilia Standard Time),Mon Aug 09 2021 03:18:30 GMT-0300 (Brasilia Standard Time)
JSD (03/07/17) - Senador Ronaldo Caiado pede que a JBS devolva 1 bilhão ao Estado de Goiás https://t.co/1nL9gtkbv1 https://t.co/X6uZ1aA7Ux,caiado,,,714229184,Juliana_Barman,,,0,0,Mon Aug 09 2021 13:39:09 GMT-0300 (Brasilia Standard Time),Mon Aug 09 2021 03:09:17 GMT-0300 (Brasilia Standard Time)
"@CentralEleicoes Não sei qual a surpresa de vocês. Tirando os que já tão de saída, como Pacheco, os principais nome… https://t.co/QIUKXmPOXD",caiado,,,33375814,matheusantana,,,0,1,Mon Aug 09 2021 13:39:09 GMT-0300 (Brasilia Standard Time),Mon Aug 09 2021 02:36:10 GMT-0300 (Brasilia Standard Time)
"Quando o veto foi derrubado, o hoje governador Ronaldo Caiado (DEM-GO), disse que o voto impresso era a “consolidaç… https://t.co/G7hD6t0jLp",caiado,,,47002181,fellipebambam,,,1,3,Mon Aug 09 2021 13:39:09 GMT-0300 (Brasilia Standard Time),Mon Aug 09 2021 02:00:36 GMT-0300 (Brasilia Standard Time)
