text,query,country,city,userId,username,quote_count,reply_count,retweet_count,favorite_count,timestamp,createdAt
@Metropoles Essa não era a polícia fodástica do Caiado? 🤔,caiado,,,48509717,MariePires,,,0,0,Mon Aug 09 2021 13:39:09 GMT-0300 (Brasilia Standard Time),Mon Aug 09 2021 13:19:55 GMT-0300 (Brasilia Standard Time)
@Caiado__ @RilkoSthephanny @gimedeiross__ giovanna é chata ela não vai não,caiado,,,1353872764982206500,mariaa___L,,,0,0,Mon Aug 09 2021 13:39:09 GMT-0300 (Brasilia Standard Time),Mon Aug 09 2021 13:14:15 GMT-0300 (Brasilia Standard Time)
@JamilChade @pejulio @JanainaDoBrasil São vagabundos que vivem da miséria alheia como você que mantém essas desgraç… https://t.co/uBfgWJ13gg,caiado,,,1400194217411022800,JotaFQueiroz,,,0,0,Mon Aug 09 2021 13:39:09 GMT-0300 (Brasilia Standard Time),Mon Aug 09 2021 13:14:06 GMT-0300 (Brasilia Standard Time)
"Para Felipe a contemplação do município com estes investimentos, apresentados e solicitados por ele, será de grande… https://t.co/TNI2kIq1ai",caiado,,,129002495,sdnewscatalao,,,0,0,Mon Aug 09 2021 13:39:09 GMT-0300 (Brasilia Standard Time),Mon Aug 09 2021 13:03:06 GMT-0300 (Brasilia Standard Time)
@RilkoSthephanny @gimedeiross__ venham,caiado,,,1074659485564715000,Caiado__,,,0,2,Mon Aug 09 2021 13:39:09 GMT-0300 (Brasilia Standard Time),Mon Aug 09 2021 13:00:34 GMT-0300 (Brasilia Standard Time)
@Mariada74492517 Caiado bancando essa M toda…,caiado,,,842164437587005400,gferrassidu,,,0,1,Mon Aug 09 2021 13:39:09 GMT-0300 (Brasilia Standard Time),Mon Aug 09 2021 12:50:44 GMT-0300 (Brasilia Standard Time)
"Caiado acaba com “indústria da multa”, em Goiás, que completa 2 anos e 7 meses sem radares móveis… https://t.co/YxnI1xebvv",caiado,,,216792995,sandrogianelli,,,0,0,Mon Aug 09 2021 13:39:09 GMT-0300 (Brasilia Standard Time),Mon Aug 09 2021 12:48:40 GMT-0300 (Brasilia Standard Time)
@favalterlove ela queria q eu botasse um texto e no começo agradecendo “gratidão governo te amo 🙈🙈❤️❤️💘💘😻✨✨ caiado gostoso🥰🥰🥰”,caiado,,,930112631188402200,g9owon,,,0,0,Mon Aug 09 2021 13:39:09 GMT-0300 (Brasilia Standard Time),Mon Aug 09 2021 12:46:00 GMT-0300 (Brasilia Standard Time)
RT @MarceloJGonca: Nesses últimos meses foram varios  crimes cometidos pela PM do Ronaldo Caiado. https://t.co/dDce7GB0Zz,caiado,,,80668668,ADEMIRSANTOS10,,,2,0,Mon Aug 09 2021 13:39:09 GMT-0300 (Brasilia Standard Time),Mon Aug 09 2021 12:44:22 GMT-0300 (Brasilia Standard Time)
"“Não mudei o nome da corrupção em Goiás”, diz Caiado, em evento de lançamento do Mães de Goiás https://t.co/8FDilk8C07",caiado,,,2778765463,almeidacm3,,,0,0,Mon Aug 09 2021 13:39:09 GMT-0300 (Brasilia Standard Time),Mon Aug 09 2021 12:42:28 GMT-0300 (Brasilia Standard Time)
Nesses últimos meses foram varios  crimes cometidos pela PM do Ronaldo Caiado. https://t.co/dDce7GB0Zz,caiado,Brazil,"Rio de Janeiro, Brazil",131716054,MarceloJGonca,,,2,2,Mon Aug 09 2021 13:39:09 GMT-0300 (Brasilia Standard Time),Mon Aug 09 2021 12:32:22 GMT-0300 (Brasilia Standard Time)
"@brunnosarttori a milícia do fedorento caiado, putinha do jair. não bastasse música bosta, agora pm idem !",caiado,,,28776536,tompaixao,,,0,0,Mon Aug 09 2021 13:39:09 GMT-0300 (Brasilia Standard Time),Mon Aug 09 2021 12:32:20 GMT-0300 (Brasilia Standard Time)
"@MatheusLeone_ É a puliça do Caiado, a mesma que demorou 20 dias pra capturar Lázaro e comete arbitrariedades um dia sim o outro também.",caiado,,,482487502,sensata_em,,,0,0,Mon Aug 09 2021 13:39:09 GMT-0300 (Brasilia Standard Time),Mon Aug 09 2021 12:26:40 GMT-0300 (Brasilia Standard Time)
Cadê o Caiado correndo pra não perder a corrida da vacinação ein?? https://t.co/3v4v90dj5U,caiado,,,2291008992,pqprafelz,,,0,2,Mon Aug 09 2021 13:39:09 GMT-0300 (Brasilia Standard Time),Mon Aug 09 2021 12:26:11 GMT-0300 (Brasilia Standard Time)
"@douglasprotazio @Metropoles É a puliça do Caiado, a mesma que demorou 20 dias pra capturar Lázaro.",caiado,,,482487502,sensata_em,,,0,1,Mon Aug 09 2021 13:39:09 GMT-0300 (Brasilia Standard Time),Mon Aug 09 2021 12:24:34 GMT-0300 (Brasilia Standard Time)
"@Metropoles @PsylockeK Isso aí não são Policiais, são MARGINAIS pagos com dinheiro do Povo... Goiás do Ronaldo Caiado continua o mesmo...",caiado,,,1191811218215964700,LusMellodosRei2,,,0,9,Mon Aug 09 2021 13:39:09 GMT-0300 (Brasilia Standard Time),Mon Aug 09 2021 12:23:07 GMT-0300 (Brasilia Standard Time)
Caiado está sendo RIDÍCULO,caiado,Brazil,"Catalão, Brasil",69307621,jardelsebba45,,,0,0,Mon Aug 09 2021 13:39:09 GMT-0300 (Brasilia Standard Time),Mon Aug 09 2021 12:19:56 GMT-0300 (Brasilia Standard Time)
"Caiado não respeit o momento de dor da família Íris . Entrou na sala sem ser chamado, numa cirurgia q não sabe. Ago… https://t.co/uGomtn9HLY",caiado,Brazil,"Catalão, Brasil",69307621,jardelsebba45,,,0,1,Mon Aug 09 2021 13:39:09 GMT-0300 (Brasilia Standard Time),Mon Aug 09 2021 12:19:55 GMT-0300 (Brasilia Standard Time)
"Encontro Municipalista promovido no último sábado (07) em Rio Verde. O evento, numa iniciativa do Presidente da ALE… https://t.co/co12ACr7Rq",caiado,,,318429573,AGMGoias,,,0,0,Mon Aug 09 2021 13:39:09 GMT-0300 (Brasilia Standard Time),Mon Aug 09 2021 12:17:28 GMT-0300 (Brasilia Standard Time)
"todo mundo ficou bnt nesse uniforme e eu fiquei horrível
RONALDO CAIADO FAÇA ALGUMA COISA!!!!!!",caiado,,,1399842793930072000,stayssa_,,,0,0,Mon Aug 09 2021 13:39:09 GMT-0300 (Brasilia Standard Time),Mon Aug 09 2021 12:14:15 GMT-0300 (Brasilia Standard Time)
"RT @fpulcineli: Mesmo com aparelhos, Iris já controla respiração, diz Caiado https://t.co/U68ec6kZAO",caiado,,,2778765463,almeidacm3,,,3,0,Mon Aug 09 2021 13:39:09 GMT-0300 (Brasilia Standard Time),Mon Aug 09 2021 12:12:57 GMT-0300 (Brasilia Standard Time)
"Continuamos em oração a Deus e certos de que nosso Iris Rezende, logo estará totalmente recuperado e de volta aos s… https://t.co/8hKiQ79mGV",caiado,Brazil,"Goiânia, Brazil",57670916,rodrigodiprado,,,0,0,Mon Aug 09 2021 13:39:09 GMT-0300 (Brasilia Standard Time),Mon Aug 09 2021 12:10:06 GMT-0300 (Brasilia Standard Time)
"Prefeitos consolidam apoio à gestão de Ronaldo Caiado
https://t.co/3W9El6U7RO https://t.co/jtZ3y6Dzx0",caiado,,,43229821,diariodamanha,,,0,0,Mon Aug 09 2021 13:39:09 GMT-0300 (Brasilia Standard Time),Mon Aug 09 2021 12:06:15 GMT-0300 (Brasilia Standard Time)
"Iris controla a respiração e tem bom prognóstico, afirma o governador Ronaldo Caiado https://t.co/0yM7mto41D via @nthgoias",caiado,,,1354181810083815400,nthgoias,,,0,0,Mon Aug 09 2021 13:39:09 GMT-0300 (Brasilia Standard Time),Mon Aug 09 2021 12:01:54 GMT-0300 (Brasilia Standard Time)
"@ronaldocaiado Controle sua polícia, Caiado!

https://t.co/YyAPxX4smS",caiado,,,781526644766937300,Leocsc7,,,0,8,Mon Aug 09 2021 13:39:09 GMT-0300 (Brasilia Standard Time),Mon Aug 09 2021 11:55:49 GMT-0300 (Brasilia Standard Time)
"Mesmo com aparelhos, Iris já controla respiração, diz Caiado https://t.co/9wRMcBNOQ6",caiado,,,56770341,Regesmaia,,,0,7,Mon Aug 09 2021 13:39:09 GMT-0300 (Brasilia Standard Time),Mon Aug 09 2021 11:52:08 GMT-0300 (Brasilia Standard Time)
"“Não mudei o nome da corrupção em Goiás”, diz Caiado, em evento de lançamento do Mães de Goiás https://t.co/hGVTyJtNuh",caiado,,,198307839,sandronezi,,,0,1,Mon Aug 09 2021 13:39:09 GMT-0300 (Brasilia Standard Time),Mon Aug 09 2021 11:51:18 GMT-0300 (Brasilia Standard Time)
ficando off daqui mds praticamente todo mundo se vacinando e só nós goianos em situação de barril empacado de vdd e… https://t.co/t0xhdbdWRP,caiado,,,1371250875834990600,thedunphyfam,,,0,0,Mon Aug 09 2021 13:39:09 GMT-0300 (Brasilia Standard Time),Mon Aug 09 2021 11:50:58 GMT-0300 (Brasilia Standard Time)
"Mesmo com aparelhos, Iris já controla respiração, diz Caiado https://t.co/fnfS3ikkPK",caiado,Brazil,"Goiânia, Brazil",198307839,sandronezi,,,0,3,Mon Aug 09 2021 13:39:09 GMT-0300 (Brasilia Standard Time),Mon Aug 09 2021 11:50:16 GMT-0300 (Brasilia Standard Time)
RT @acm1065: @DeputadoFederal A caserna é um sepulcro caiado... https://t.co/mYqu7ayMGF,caiado,,,473215138,SicTadeu,,,1,0,Mon Aug 09 2021 13:39:09 GMT-0300 (Brasilia Standard Time),Mon Aug 09 2021 11:49:10 GMT-0300 (Brasilia Standard Time)
"@mello1400 @Metropoles @ronaldocaiado Mafiosos não contestam a polícia. Ronaldo Caiado, na categoria de mega mafios… https://t.co/HMhInvuqzX",caiado,,,58125388,emoraz,,,0,11,Mon Aug 09 2021 13:39:09 GMT-0300 (Brasilia Standard Time),Mon Aug 09 2021 11:41:59 GMT-0300 (Brasilia Standard Time)
RT @pedraozao_: ibaneis x caiado o embate silencioso,caiado,,,1032662708565553200,BrenoDanielindo,,,2,0,Mon Aug 09 2021 13:39:09 GMT-0300 (Brasilia Standard Time),Mon Aug 09 2021 11:37:13 GMT-0300 (Brasilia Standard Time)
Ronaldo Caiado anuncia mais 155.900 doses para o início desta semana - via @podergoias https://t.co/Cd1CAE6S7n https://t.co/tsH4WH8dHD,caiado,Brazil,"Goiânia, Brazil",969285079792013300,podergoias,,,0,0,Mon Aug 09 2021 13:39:09 GMT-0300 (Brasilia Standard Time),Mon Aug 09 2021 11:35:47 GMT-0300 (Brasilia Standard Time)
"RT @fpulcineli: Mesmo com aparelhos, Iris já controla respiração, diz Caiado https://t.co/U68ec6kZAO",caiado,,,69172882,JoseLuizIN,,,3,0,Mon Aug 09 2021 13:39:09 GMT-0300 (Brasilia Standard Time),Mon Aug 09 2021 11:32:09 GMT-0300 (Brasilia Standard Time)
@fpulcineli Enquanto isso Caiado colocando professores na sala de aula so com 1 dose,caiado,,,3384787559,Ceceucm,,,0,1,Mon Aug 09 2021 13:39:09 GMT-0300 (Brasilia Standard Time),Mon Aug 09 2021 11:28:22 GMT-0300 (Brasilia Standard Time)
@vinci_holanda @padilhando Aqui em Goiás PSDB fechou mais de vinte escolas e com o caiado que hoje é DEM muitas esc… https://t.co/ZgHHLYNVZ8,caiado,,,2308451519,taly_chann,,,0,0,Mon Aug 09 2021 13:39:09 GMT-0300 (Brasilia Standard Time),Mon Aug 09 2021 11:23:01 GMT-0300 (Brasilia Standard Time)
@Rubao_CRF @Leocsc7 @Metropoles A família Caiado está na lista suja do trabalho escravo nas suas minas de carvão.… https://t.co/JdUXHTKlNH,caiado,,,1311102943,jademabreu,,,0,2,Mon Aug 09 2021 13:39:09 GMT-0300 (Brasilia Standard Time),Mon Aug 09 2021 11:22:43 GMT-0300 (Brasilia Standard Time)
RT @Rubao_CRF: @Leocsc7 @Metropoles Essa policia já matava muito e depois que o Caiado virou governador eles estão matando 3 x mais.,caiado,,,1311102943,jademabreu,,,2,0,Mon Aug 09 2021 13:39:09 GMT-0300 (Brasilia Standard Time),Mon Aug 09 2021 11:20:46 GMT-0300 (Brasilia Standard Time)
Caiado e Daniel visitam família de Iris e se mantém positivos para recuperação de ex-prefeito https://t.co/TrDxCXzs7G,caiado,,,126390210,jornalopcao,,,0,0,Mon Aug 09 2021 13:39:09 GMT-0300 (Brasilia Standard Time),Mon Aug 09 2021 11:15:12 GMT-0300 (Brasilia Standard Time)
"@ronaldocaiado Essa sua PM, hein, Caiado?! Aproveita e conta em que resultou o caso dos policiais envolvidos na abo… https://t.co/inDu5wv0OX",caiado,,,1254604129357508600,GoretteBrandao,,,0,0,Mon Aug 09 2021 13:39:09 GMT-0300 (Brasilia Standard Time),Mon Aug 09 2021 11:13:01 GMT-0300 (Brasilia Standard Time)
queria uma rinha de velho caiado x ibaneis pra ver quem vacina jovem mais rápido,caiado,,,1410371607244193800,savio39979,,,0,5,Mon Aug 09 2021 13:39:09 GMT-0300 (Brasilia Standard Time),Mon Aug 09 2021 11:09:50 GMT-0300 (Brasilia Standard Time)
"Em lançamento de programa social, Caiado diz que não mudou o nome da corrupção em Goiás https://t.co/EQQKS3Lj2p",caiado,,,10710422,vonivar,,,0,0,Mon Aug 09 2021 13:39:09 GMT-0300 (Brasilia Standard Time),Mon Aug 09 2021 11:08:05 GMT-0300 (Brasilia Standard Time)
"O governador visitou o emedebista na manhã desta segunda-feira (09/08), no Instituto Neurológicos de Goiânia (ING).

https://t.co/kvnGVpvPZR",caiado,,,133725078,jornalohoje,,,0,0,Mon Aug 09 2021 13:39:09 GMT-0300 (Brasilia Standard Time),Mon Aug 09 2021 11:06:46 GMT-0300 (Brasilia Standard Time)
"RT @aredacao: Caiado e Daniel confirmam melhora no quadro de Iris Rezende. Ex-prefeito controla respiração, diz Caiado https://t.co/USK4pYY…",caiado,,,57123119,Joao_Unes,,,1,0,Mon Aug 09 2021 13:39:09 GMT-0300 (Brasilia Standard Time),Mon Aug 09 2021 11:05:24 GMT-0300 (Brasilia Standard Time)
"“Não mudei o nome da corrupção em Goiás”, diz Caiado, em evento de lançamento do Mães de Goiás https://t.co/ylQtuYx6Ef",caiado,,,1125896887477915600,ElisamaXimenes,,,0,0,Mon Aug 09 2021 13:39:09 GMT-0300 (Brasilia Standard Time),Mon Aug 09 2021 11:05:19 GMT-0300 (Brasilia Standard Time)
Governador disse isso em resposta às alegações da oposição de que ele apenas reedita o nome de programas lançados p… https://t.co/OGLDDBn7qI,caiado,,,54527239,jornal_opopular,,,0,4,Mon Aug 09 2021 13:39:09 GMT-0300 (Brasilia Standard Time),Mon Aug 09 2021 11:03:14 GMT-0300 (Brasilia Standard Time)
"O 🔰 governador Ronaldo Caiado acabou com a chamada “indústria da multa”, em Goiás. O fim dos radares móveis nas 🛣 r… https://t.co/jIVmkQNfT5",caiado,,,345359013,casacivilgoias,,,0,0,Mon Aug 09 2021 13:39:09 GMT-0300 (Brasilia Standard Time),Mon Aug 09 2021 11:00:00 GMT-0300 (Brasilia Standard Time)
"Caiado e Daniel confirmam melhora no quadro de Iris Rezende. Ex-prefeito controla respiração, diz Caiado… https://t.co/4DS8i5cBCB",caiado,,,245894432,aredacao,,,1,2,Mon Aug 09 2021 13:39:09 GMT-0300 (Brasilia Standard Time),Mon Aug 09 2021 10:59:54 GMT-0300 (Brasilia Standard Time)
"Iris Rezende segue em UTI, mas já controla a própria respiração com ajuda de aparelhos, diz Caiado https://t.co/4BJx3aayU7",caiado,,,1275548206320009200,nagenciabr,,,0,0,Mon Aug 09 2021 13:39:09 GMT-0300 (Brasilia Standard Time),Mon Aug 09 2021 10:53:21 GMT-0300 (Brasilia Standard Time)
RT @Rubao_CRF: @Leocsc7 @Metropoles Essa policia já matava muito e depois que o Caiado virou governador eles estão matando 3 x mais.,caiado,,,1249364123802120200,andante40428500,,,2,0,Mon Aug 09 2021 13:39:09 GMT-0300 (Brasilia Standard Time),Mon Aug 09 2021 10:52:43 GMT-0300 (Brasilia Standard Time)
RT @Rubao_CRF: @mello1400 @Metropoles @ronaldocaiado Cara eu moro em Brasília e o que separa minha cidade das cidades é só uma pista e essa…,caiado,,,1249364123802120200,andante40428500,,,1,0,Mon Aug 09 2021 13:39:09 GMT-0300 (Brasilia Standard Time),Mon Aug 09 2021 10:52:26 GMT-0300 (Brasilia Standard Time)
"RT @aredacao: Caiado anuncia chegada de mais 155,9 mil vacinas contra covid-19 a Goiás https://t.co/hdsrq9eNSA https://t.co/GcxYzBwG0u",caiado,,,57123119,Joao_Unes,,,1,0,Mon Aug 09 2021 13:39:09 GMT-0300 (Brasilia Standard Time),Mon Aug 09 2021 10:50:01 GMT-0300 (Brasilia Standard Time)
O Ibaneis e o Caiado competindo pra ver quem termina de vacinar o estado primeiro https://t.co/7BKI8l8hlR,caiado,,,934933455649034200,pinguinzitu,,,0,0,Mon Aug 09 2021 13:39:09 GMT-0300 (Brasilia Standard Time),Mon Aug 09 2021 10:46:32 GMT-0300 (Brasilia Standard Time)
Lissauer mostra força e larga na frente na disputa por vaga em chapa de Caiado https://t.co/1URhHiM1Ge via @nthgoias,caiado,,,1354181810083815400,nthgoias,,,0,0,Mon Aug 09 2021 13:39:09 GMT-0300 (Brasilia Standard Time),Mon Aug 09 2021 10:45:05 GMT-0300 (Brasilia Standard Time)
"Iris Rezende segue em UTI, mas já controla a própria respiração com ajuda de aparelhos, diz Caiado ==&gt;… https://t.co/qzKqeo1xYm",caiado,,,249285134,g1goias,,,0,7,Mon Aug 09 2021 13:39:09 GMT-0300 (Brasilia Standard Time),Mon Aug 09 2021 10:44:20 GMT-0300 (Brasilia Standard Time)
"Após visitar Iris, Caiado relata boa recuperação do ex-prefeito: “não o classificaria como crítico” 

https://t.co/1iicJcFoFF",caiado,,,57438355,rbgoiania,,,0,0,Mon Aug 09 2021 13:39:09 GMT-0300 (Brasilia Standard Time),Mon Aug 09 2021 10:42:57 GMT-0300 (Brasilia Standard Time)
RT @bibiakk: E o desgraçado do Caiado na época do Lázaro batendo no peito pra dizer que era a melhor polícia do país.,caiado,,,1171173876233048000,rafa_c_ramos,,,2,0,Mon Aug 09 2021 13:39:09 GMT-0300 (Brasilia Standard Time),Mon Aug 09 2021 10:41:29 GMT-0300 (Brasilia Standard Time)
"@Mikalins Isso é que é tomar o nome do Senhor em vão. 
Ou: sepulcro caiado.",caiado,,,3582668117,eusouumoutro,,,0,0,Mon Aug 09 2021 13:39:09 GMT-0300 (Brasilia Standard Time),Mon Aug 09 2021 10:40:37 GMT-0300 (Brasilia Standard Time)
RT @bibiakk: E o desgraçado do Caiado na época do Lázaro batendo no peito pra dizer que era a melhor polícia do país.,caiado,,,164315483,nmirsrs,,,2,0,Mon Aug 09 2021 13:39:09 GMT-0300 (Brasilia Standard Time),Mon Aug 09 2021 10:40:10 GMT-0300 (Brasilia Standard Time)
"RT @fpulcineli: Mesmo com aparelhos, Iris já controla respiração, diz Caiado https://t.co/U68ec6kZAO",caiado,,,128046818,xandinhamc,,,3,0,Mon Aug 09 2021 13:39:09 GMT-0300 (Brasilia Standard Time),Mon Aug 09 2021 10:39:43 GMT-0300 (Brasilia Standard Time)
"Mesmo com aparelhos, Iris já controla respiração, diz Caiado https://t.co/qcWiMBtJXm",caiado,,,10710422,vonivar,,,0,0,Mon Aug 09 2021 13:39:09 GMT-0300 (Brasilia Standard Time),Mon Aug 09 2021 10:38:34 GMT-0300 (Brasilia Standard Time)
"@SandraB47000748 É verdade @RomeuZema , o Sr contra o voto auditável? Se for verdade, não passa de mais um sepulcro Caiado!",caiado,,,89206522,BrasilDeCristo,,,0,0,Mon Aug 09 2021 13:39:09 GMT-0300 (Brasilia Standard Time),Mon Aug 09 2021 10:38:07 GMT-0300 (Brasilia Standard Time)
E o desgraçado do Caiado na época do Lázaro batendo no peito pra dizer que era a melhor polícia do país. https://t.co/tTC0xXyzsR,caiado,,,1001991389662629900,bibiakk,,,2,8,Mon Aug 09 2021 13:39:09 GMT-0300 (Brasilia Standard Time),Mon Aug 09 2021 10:36:55 GMT-0300 (Brasilia Standard Time)
"Mesmo com aparelhos, Iris já controla respiração, diz Caiado https://t.co/U68ec6kZAO",caiado,,,36849552,fpulcineli,,,3,16,Mon Aug 09 2021 13:39:09 GMT-0300 (Brasilia Standard Time),Mon Aug 09 2021 10:36:41 GMT-0300 (Brasilia Standard Time)
@Metropoles Segundo o Caiado essa é a melhor polícia do Brasil. Imagina se fosse a pior?,caiado,,,1409708354361073700,Samuca45215412,,,0,8,Mon Aug 09 2021 13:39:09 GMT-0300 (Brasilia Standard Time),Mon Aug 09 2021 10:36:04 GMT-0300 (Brasilia Standard Time)
@mello1400 @Metropoles @ronaldocaiado Cara eu moro em Brasília e o que separa minha cidade das cidades é só uma pis… https://t.co/LGc1pVlZ5s,caiado,,,1017940218,Rubao_CRF,,,1,16,Mon Aug 09 2021 13:39:09 GMT-0300 (Brasilia Standard Time),Mon Aug 09 2021 10:34:22 GMT-0300 (Brasilia Standard Time)
@Metropoles Os fardadinhos do caiado mais uma vez.,caiado,,,1529211871,RayMaronesi,,,0,1,Mon Aug 09 2021 13:39:09 GMT-0300 (Brasilia Standard Time),Mon Aug 09 2021 10:30:59 GMT-0300 (Brasilia Standard Time)
@Leocsc7 @Metropoles Essa policia já matava muito e depois que o Caiado virou governador eles estão matando 3 x mais.,caiado,,,1017940218,Rubao_CRF,,,2,85,Mon Aug 09 2021 13:39:09 GMT-0300 (Brasilia Standard Time),Mon Aug 09 2021 10:30:07 GMT-0300 (Brasilia Standard Time)
"Mesmo com aparelhos, Iris já controla respiração, diz Caiado https://t.co/bOB84ktrwv",caiado,,,2651725560,donizet_lima,,,0,0,Mon Aug 09 2021 13:39:09 GMT-0300 (Brasilia Standard Time),Mon Aug 09 2021 10:27:09 GMT-0300 (Brasilia Standard Time)
"Na última sexta-feira (6), Iris foi submetido a uma cirurgia neurológica após sofrer um acidente vascular cerebral… https://t.co/zfliQSz1th",caiado,,,54527239,jornal_opopular,,,0,5,Mon Aug 09 2021 13:39:09 GMT-0300 (Brasilia Standard Time),Mon Aug 09 2021 10:25:15 GMT-0300 (Brasilia Standard Time)
"#Goiás | “Não tem mais aquele pardal móvel, que multava às escondidas, sem nenhum objetivo de educar”, afirmou o go… https://t.co/ZrzHND7UuZ",caiado,,,302021856,Sou_NoticiasGo,,,0,0,Mon Aug 09 2021 13:39:09 GMT-0300 (Brasilia Standard Time),Mon Aug 09 2021 10:19:53 GMT-0300 (Brasilia Standard Time)
"As informações foram dadas na manhã de segunda-feira, 09/08. Para Caiado, q também é médico, esse período de acalmi… https://t.co/YeAoGUFZsg",caiado,,,56770341,Regesmaia,,,0,3,Mon Aug 09 2021 13:39:09 GMT-0300 (Brasilia Standard Time),Mon Aug 09 2021 10:18:13 GMT-0300 (Brasilia Standard Time)
ibaneis x caiado o embate silencioso,caiado,,,1025214756809068500,pedraozao_,,,2,18,Mon Aug 09 2021 13:39:09 GMT-0300 (Brasilia Standard Time),Mon Aug 09 2021 10:12:05 GMT-0300 (Brasilia Standard Time)
"Em entrevista na porta do Hospital Neurológico, o governador Ronaldo Caiado disse que o quadro de saúde do ex-gover… https://t.co/Ps1q35yBLU",caiado,,,56770341,Regesmaia,,,0,9,Mon Aug 09 2021 13:39:09 GMT-0300 (Brasilia Standard Time),Mon Aug 09 2021 10:11:12 GMT-0300 (Brasilia Standard Time)
"O 🔰 governador Ronaldo Caiado participou, neste 🗓 sábado (7/8), na sede do Sindicato Rural de Rio Verde, de encontr… https://t.co/5vi0s4AoWy",caiado,,,345359013,casacivilgoias,,,0,2,Mon Aug 09 2021 13:39:09 GMT-0300 (Brasilia Standard Time),Mon Aug 09 2021 10:00:02 GMT-0300 (Brasilia Standard Time)
CAIADO FAÇA ALGUMA COISA!!!!!!! https://t.co/UZZar8gxge,caiado,,,1174819620613697500,htpsanaa,,,0,0,Mon Aug 09 2021 13:39:09 GMT-0300 (Brasilia Standard Time),Mon Aug 09 2021 09:41:17 GMT-0300 (Brasilia Standard Time)
"Caiado anuncia chegada de mais 155,9 mil vacinas contra covid-19 a Goiás https://t.co/hdsrq9eNSA https://t.co/GcxYzBwG0u",caiado,,,245894432,aredacao,,,1,4,Mon Aug 09 2021 13:39:09 GMT-0300 (Brasilia Standard Time),Mon Aug 09 2021 09:40:28 GMT-0300 (Brasilia Standard Time)
"@salimmattarbr Perfeito, e não tenho dúvidas que o presidencialismo atendeu, acima de tudo, aos coroneis da cena po… https://t.co/WI2co3Uw8m",caiado,,,488885303,MartanJose,,,0,0,Mon Aug 09 2021 13:39:09 GMT-0300 (Brasilia Standard Time),Mon Aug 09 2021 09:39:48 GMT-0300 (Brasilia Standard Time)
"@exercitooficial Qual o fundamento nessa entrega de viaturas?

  Caiado e Humberto gados unidos na protecao total a… https://t.co/YgrVNvOvWF",caiado,,,1156261802289897500,platoon30nv,,,0,0,Mon Aug 09 2021 13:39:09 GMT-0300 (Brasilia Standard Time),Mon Aug 09 2021 09:26:36 GMT-0300 (Brasilia Standard Time)
"@antoniomaurogo2 @brasil247 Teve a comitiva do Ronaldo Caiado na Venezuela em 2015. Apesar disso, o Brasil ainda go… https://t.co/AwoH181xC0",caiado,,,1410436897684459500,AldoRebelo2022,,,0,1,Mon Aug 09 2021 13:39:09 GMT-0300 (Brasilia Standard Time),Mon Aug 09 2021 09:19:28 GMT-0300 (Brasilia Standard Time)
"Goiás recebe quase 156 mil doses de vacina contra Covid nesta segunda e terça (10)

https://t.co/GFIKtTJ9Bi… https://t.co/DApklC6lsP",caiado,,,1005072875295002600,JornalSomos,,,0,0,Mon Aug 09 2021 13:39:09 GMT-0300 (Brasilia Standard Time),Mon Aug 09 2021 09:16:41 GMT-0300 (Brasilia Standard Time)
A falta de oposição firme ao desgoverno de Ronaldo Caiado está oxigenando o maior atraso de estado chamado Marconi… https://t.co/EpcSM7RWkv,caiado,,,212920884,dhiegocoliveira,,,0,0,Mon Aug 09 2021 13:39:09 GMT-0300 (Brasilia Standard Time),Mon Aug 09 2021 09:04:18 GMT-0300 (Brasilia Standard Time)
"Caiado e primeira-dama, Gracinha Caiado, lançam programa Mães de Goiás https://t.co/p5zCVubqVS",caiado,,,68451332,SenhorFranklin,,,0,0,Mon Aug 09 2021 13:39:09 GMT-0300 (Brasilia Standard Time),Mon Aug 09 2021 09:03:02 GMT-0300 (Brasilia Standard Time)
Ronaldo Caiado sanciona lei que modifica licenciamento ambiental em Goiás https://t.co/xGsJOqnq76,caiado,,,833031378,rotajuridica,,,0,0,Mon Aug 09 2021 13:39:09 GMT-0300 (Brasilia Standard Time),Mon Aug 09 2021 08:26:00 GMT-0300 (Brasilia Standard Time)
@MarcosQuezado1 E pensar que nos tempos do pt eram bons porteiros entregadores de se tá básica e eram obrigados a b… https://t.co/ll88arFm8n,caiado,Brazil,"Marabá, Brasil",1399844417310167000,DarciCosta12,,,0,2,Mon Aug 09 2021 13:39:09 GMT-0300 (Brasilia Standard Time),Mon Aug 09 2021 08:17:31 GMT-0300 (Brasilia Standard Time)
"Caiado acaba com “indústria da multa”, em Goiás, que completa 2 anos e 7 meses sem radares móveis https://t.co/nUiviQWOIF",caiado,,,965569527688978400,lancefmgoias,,,0,0,Mon Aug 09 2021 13:39:09 GMT-0300 (Brasilia Standard Time),Mon Aug 09 2021 08:11:58 GMT-0300 (Brasilia Standard Time)
"Caiado acaba com ’indústria da multa’, em Goiás, que completa 2 anos e 7 meses sem radares móveis.… https://t.co/pE0ZWmwxAp",caiado,,,1101566681778921500,agbrasilcentral,,,0,0,Mon Aug 09 2021 13:39:09 GMT-0300 (Brasilia Standard Time),Mon Aug 09 2021 08:03:25 GMT-0300 (Brasilia Standard Time)
velho vsf sério o prefeito de aparecida vacinando os de 26 semana que vem já vai vacinar os de 19 E ESSA BOSTA AQUI… https://t.co/NPLOQI0wJb,caiado,,,1371250875834990600,thedunphyfam,,,0,0,Mon Aug 09 2021 13:39:09 GMT-0300 (Brasilia Standard Time),Mon Aug 09 2021 07:39:08 GMT-0300 (Brasilia Standard Time)
"ENTRELINHAS | Cezar Santos mostra que o atual presidente da ALEGO, Lissauer Vieira do PSB, será aclamado Vice do go… https://t.co/wwR78TWYDt",caiado,,,389484366,JornalGoyaz,,,0,1,Mon Aug 09 2021 13:39:09 GMT-0300 (Brasilia Standard Time),Mon Aug 09 2021 07:07:23 GMT-0300 (Brasilia Standard Time)
"Caiado e primeira-dama, Gracinha Caiado, lançam programa Mães de Goiás - https://t.co/8SkhjAryPe https://t.co/MipFXyOpkH",caiado,,,389484366,JornalGoyaz,,,0,0,Mon Aug 09 2021 13:39:09 GMT-0300 (Brasilia Standard Time),Mon Aug 09 2021 06:52:29 GMT-0300 (Brasilia Standard Time)
Caiado rebate críticas e garante fim da “máfia da indústria da multa” em Goiás - https://t.co/ukMU0hXJOZ https://t.co/AfhdNGa4Gv,caiado,,,53248052,sagres730,,,0,0,Mon Aug 09 2021 13:39:09 GMT-0300 (Brasilia Standard Time),Mon Aug 09 2021 06:38:56 GMT-0300 (Brasilia Standard Time)
Caiado exalta ações da AD Madureira durante visita ao bispo Oídes do Carmo https://t.co/egVjS7XsOT,caiado,,,191237188,radioimprensa,,,0,0,Mon Aug 09 2021 13:39:09 GMT-0300 (Brasilia Standard Time),Mon Aug 09 2021 06:38:03 GMT-0300 (Brasilia Standard Time)
