text,query,country,city,userId,username,quote_count,reply_count,retweet_count,favorite_count,timestamp,createdAt
"RT @JornalGGN: TV GGN 20h: Luis Nassif entrevista Flávio Dino. Assista
https://t.co/41QF6jqq4W https://t.co/baIyob6WyN","""flávio dino""",,,348776234,Denilson1silva,,,2,0,Thu Aug 12 2021 19:54:29 GMT-0300 (Brasilia Standard Time),Thu Aug 12 2021 19:49:44 GMT-0300 (Brasilia Standard Time)
"RT @JornalGGN: TV GGN 20h: Luis Nassif entrevista Flávio Dino. Assista
https://t.co/41QF6jqq4W https://t.co/baIyob6WyN","""flávio dino""",,,1027639055461306400,AllisonRoger10,,,2,0,Thu Aug 12 2021 19:54:29 GMT-0300 (Brasilia Standard Time),Thu Aug 12 2021 19:48:25 GMT-0300 (Brasilia Standard Time)
"TV GGN 20h: Luis Nassif entrevista Flávio Dino. Assista
https://t.co/41QF6jqq4W https://t.co/baIyob6WyN","""flávio dino""",,,1347385232,JornalGGN,,,2,3,Thu Aug 12 2021 19:54:29 GMT-0300 (Brasilia Standard Time),Thu Aug 12 2021 19:47:13 GMT-0300 (Brasilia Standard Time)
"RT @luisnassif: TV GGN 20h: Luis Nassif entrevista Flávio Dino. Assista
https://t.co/tvnFOiJSZw https://t.co/jnefzPXNuw","""flávio dino""",,,1236012767934648300,AlbatrozRS,,,1,0,Thu Aug 12 2021 19:54:29 GMT-0300 (Brasilia Standard Time),Thu Aug 12 2021 19:47:12 GMT-0300 (Brasilia Standard Time)
"TV GGN 20h: Luis Nassif entrevista Flávio Dino. Assista
https://t.co/tvnFOiJSZw https://t.co/jnefzPXNuw","""flávio dino""",,,14754376,luisnassif,,,1,7,Thu Aug 12 2021 19:54:29 GMT-0300 (Brasilia Standard Time),Thu Aug 12 2021 19:47:00 GMT-0300 (Brasilia Standard Time)
"@Valdecirdelecl1 Pelo amor de Deus, vê se pode uma desgraça dessas? O cara é medalhista de ouro e ganha como homena… https://t.co/UUk9eO05FU","""flávio dino""",,,1392145219647377400,JesseLimadeSou3,,,0,0,Thu Aug 12 2021 19:54:29 GMT-0300 (Brasilia Standard Time),Thu Aug 12 2021 19:43:45 GMT-0300 (Brasilia Standard Time)
"a vacinação chegou na minha idade...pode butar flavio dino
https://t.co/8Sn7opZ9Yh","""flávio dino""",,,508092204,Scottmeajuda,,,0,5,Thu Aug 12 2021 19:54:29 GMT-0300 (Brasilia Standard Time),Thu Aug 12 2021 19:31:54 GMT-0300 (Brasilia Standard Time)
"Estado Maranhão vacinando crianças de 12 anos.
Flávio Dino é mesmo O Cara.","""flávio dino""",,,186767777,gbelem,,,0,0,Thu Aug 12 2021 19:54:29 GMT-0300 (Brasilia Standard Time),Thu Aug 12 2021 19:31:35 GMT-0300 (Brasilia Standard Time)
RT @PATRIOTABR18: Quando é que a @policiafederal vai investigar a sra @elizianegama com seu chefe Flávio Dino e a compra de votos de portei…,"""flávio dino""",,,1396136764042006500,JohnnyBravoOf1,,,1,0,Thu Aug 12 2021 19:54:29 GMT-0300 (Brasilia Standard Time),Thu Aug 12 2021 19:28:11 GMT-0300 (Brasilia Standard Time)
Quando é que a @policiafederal vai investigar a sra @elizianegama com seu chefe Flávio Dino e a compra de votos de… https://t.co/OoPgpSe5X2,"""flávio dino""",,,1363551546500350000,PATRIOTABR18,,,1,1,Thu Aug 12 2021 19:54:29 GMT-0300 (Brasilia Standard Time),Thu Aug 12 2021 19:27:45 GMT-0300 (Brasilia Standard Time)
"@rubenspereirajr @camaradeputados @FlavioDino Kkkk ! Larga de puxar saco deputado , procura teu voo solo , Flávio D… https://t.co/KxbKHYoIVI","""flávio dino""",,,155694225,luis_255225,,,0,0,Thu Aug 12 2021 19:54:29 GMT-0300 (Brasilia Standard Time),Thu Aug 12 2021 19:18:51 GMT-0300 (Brasilia Standard Time)
"Me Vacinsr amanha, obg por tudo Flavio Dino o rei da vacina","""flávio dino""",,,482049081,senaslocais,,,0,1,Thu Aug 12 2021 19:54:29 GMT-0300 (Brasilia Standard Time),Thu Aug 12 2021 19:16:50 GMT-0300 (Brasilia Standard Time)
"RT @JornalGGN: Luis Nassif conversa com Flávio Dino, governador do estado do Maranhão e ex-magistrado brasileiro.

Acompanhe, ao vivo, a pa…","""flávio dino""",,,886356038781415400,MarcosI25,,,2,0,Thu Aug 12 2021 19:54:29 GMT-0300 (Brasilia Standard Time),Thu Aug 12 2021 18:53:28 GMT-0300 (Brasilia Standard Time)
"@elizianegama FALA SOBRE OS RESPIRADORES QUE FLÁVIO DINO, COMPROU DA CHINA, E NUNCA RECEBEU. 
FALSA PROFETA, HIPÓCRITA.","""flávio dino""",,,1357282185800282000,PaulinoMercio,,,0,0,Thu Aug 12 2021 19:54:29 GMT-0300 (Brasilia Standard Time),Thu Aug 12 2021 18:53:09 GMT-0300 (Brasilia Standard Time)
RT @saulolinda: @FlavioDino Esse é Flávio Dino. A essência dele é essa bem aí. Quem o conhece sabe que por trás desse gestor gigante; que é…,"""flávio dino""",,,168835890,saulolinda,,,1,0,Thu Aug 12 2021 19:54:29 GMT-0300 (Brasilia Standard Time),Thu Aug 12 2021 18:52:19 GMT-0300 (Brasilia Standard Time)
"@elizianegama Usou as igrejas evangélicas pra se eleger, depois virou SERVIÇAL DO FLÁVIO DINO. 
🐍🐍🐍🐍🐍🐍🐍🐍🐍🐍","""flávio dino""",,,1357282185800282000,PaulinoMercio,,,0,0,Thu Aug 12 2021 19:54:29 GMT-0300 (Brasilia Standard Time),Thu Aug 12 2021 18:51:52 GMT-0300 (Brasilia Standard Time)
@elizianegama SERVIÇAL DO FLÁVIO DINO.,"""flávio dino""",,,1357282185800282000,PaulinoMercio,,,0,0,Thu Aug 12 2021 19:54:29 GMT-0300 (Brasilia Standard Time),Thu Aug 12 2021 18:51:25 GMT-0300 (Brasilia Standard Time)
"@FlavioDino Bonitinho, ele queria olhar o Flávio Dino, deve ter ficado muito feliz com  o carinho do governador que é tão humano.","""flávio dino""",,,2880712391,paulistasilvana,,,0,0,Thu Aug 12 2021 19:54:29 GMT-0300 (Brasilia Standard Time),Thu Aug 12 2021 18:48:03 GMT-0300 (Brasilia Standard Time)
"RT @ricardope: Eu imaginava que a ida de Marcelo Freixo e Flávio Dino para o PSB mudaria o partido, traria ele de vez para a Esquerda, mas…","""flávio dino""",,,1148599975263318000,Sol33278102,,,74,0,Thu Aug 12 2021 19:54:29 GMT-0300 (Brasilia Standard Time),Thu Aug 12 2021 18:23:08 GMT-0300 (Brasilia Standard Time)
@brunomtx Flávio Dino?,"""flávio dino""",,,89592359,brunoventura1,,,0,1,Thu Aug 12 2021 19:54:29 GMT-0300 (Brasilia Standard Time),Thu Aug 12 2021 18:21:22 GMT-0300 (Brasilia Standard Time)
"RT @ricardope: Eu imaginava que a ida de Marcelo Freixo e Flávio Dino para o PSB mudaria o partido, traria ele de vez para a Esquerda, mas…","""flávio dino""",,,1028399447942856700,Josefaalmeida16,,,74,0,Thu Aug 12 2021 19:54:29 GMT-0300 (Brasilia Standard Time),Thu Aug 12 2021 18:18:44 GMT-0300 (Brasilia Standard Time)
"RT @JornalGGN: Luis Nassif conversa com Flávio Dino, governador do estado do Maranhão e ex-magistrado brasileiro.

Acompanhe, ao vivo, a pa…","""flávio dino""",,,1321138141667991600,PENA75318663,,,2,0,Thu Aug 12 2021 19:54:29 GMT-0300 (Brasilia Standard Time),Thu Aug 12 2021 17:48:52 GMT-0300 (Brasilia Standard Time)
"Luis Nassif conversa com Flávio Dino, governador do estado do Maranhão e ex-magistrado brasileiro.

Acompanhe, ao v… https://t.co/93gTpoJxrm","""flávio dino""",,,1347385232,JornalGGN,,,2,17,Thu Aug 12 2021 19:54:29 GMT-0300 (Brasilia Standard Time),Thu Aug 12 2021 17:38:23 GMT-0300 (Brasilia Standard Time)
"@P_droMenezes @tabataamaralsp Gente como ela serve pra confundir, ela não foi posta ali a toa, ela ou os comparsas.… https://t.co/W87VFwwPE6","""flávio dino""",,,1400212346950324200,rego_olv,,,0,0,Thu Aug 12 2021 19:54:29 GMT-0300 (Brasilia Standard Time),Thu Aug 12 2021 17:21:43 GMT-0300 (Brasilia Standard Time)
@elizianegama Falou a funcionária do Flávio Dino,"""flávio dino""",,,1404584323093827600,HenriqueDeAra20,,,0,0,Thu Aug 12 2021 19:54:29 GMT-0300 (Brasilia Standard Time),Thu Aug 12 2021 16:45:49 GMT-0300 (Brasilia Standard Time)
@quefofinho Inclusive Flávio Dino ofereceu ajudar para reformar as Brs no Maranhão mas até agora não obteve resposta do desgoverno federal,"""flávio dino""",,,123701441,aloulolo,,,0,0,Thu Aug 12 2021 19:54:29 GMT-0300 (Brasilia Standard Time),Thu Aug 12 2021 16:38:50 GMT-0300 (Brasilia Standard Time)
eu amo quando chamam o Flávio Dino de A Flávio KKKJKKJ,"""flávio dino""",,,267188991,quefofinho,,,0,0,Thu Aug 12 2021 19:54:29 GMT-0300 (Brasilia Standard Time),Thu Aug 12 2021 16:30:59 GMT-0300 (Brasilia Standard Time)
Pedetista quer suceder Flávio Dino no governo do Maranhão https://t.co/Vv1WoJzQlk,"""flávio dino""",,,28407958,radaronline,,,0,4,Thu Aug 12 2021 19:54:29 GMT-0300 (Brasilia Standard Time),Thu Aug 12 2021 16:13:26 GMT-0300 (Brasilia Standard Time)
"@apyus Dizer que na política temos só lixo é mentir. Temos nomes excelentes como Randolfe, Simone, Alessandro, Tába… https://t.co/jnDl1wZG7X","""flávio dino""",,,73943097,KleideGrava,,,0,7,Thu Aug 12 2021 19:54:29 GMT-0300 (Brasilia Standard Time),Thu Aug 12 2021 16:13:26 GMT-0300 (Brasilia Standard Time)
"Se depois de tudo que Lula passou , se ele não for para o céu, ninguém, mas ninguém vai!
Lula e Flávio Dino Presidi… https://t.co/DdCbPRgryl","""flávio dino""",,,100642054,Bibilibi,,,0,0,Thu Aug 12 2021 19:54:29 GMT-0300 (Brasilia Standard Time),Thu Aug 12 2021 16:03:38 GMT-0300 (Brasilia Standard Time)
Adote um Casarão: Flávio Dino entrega mais um prédio revitalizado no Centro Histórico de São Luís https://t.co/xW9C0l1lzL,"""flávio dino""",,,2830690949,FrancaCristiana,,,0,0,Thu Aug 12 2021 19:54:29 GMT-0300 (Brasilia Standard Time),Thu Aug 12 2021 15:27:08 GMT-0300 (Brasilia Standard Time)
"Flávio dino, por favor, eu quero relações internacionais na uema próximo ano.. pelo amor de deus.","""flávio dino""",,,701106610907775000,yoonyegji,,,0,0,Thu Aug 12 2021 19:54:29 GMT-0300 (Brasilia Standard Time),Thu Aug 12 2021 15:05:25 GMT-0300 (Brasilia Standard Time)
"RT @rubenspereirajr: Agora há pouco, na Tribuna da @camaradeputados, destaquei as muitas ações do governo @FlavioDino somente nesta semana,…","""flávio dino""",,,56796812,falecomtony,,,7,0,Thu Aug 12 2021 19:54:29 GMT-0300 (Brasilia Standard Time),Thu Aug 12 2021 14:26:20 GMT-0300 (Brasilia Standard Time)
"Tabata Amaral no PSB, ok, dá pra entender. 
Eu só continuo não entendendo o que o Flávio Dino e o Freixo estão faze… https://t.co/t0M3ETWR9P","""flávio dino""",,,53314936,marco_a_andre,,,0,0,Thu Aug 12 2021 19:54:29 GMT-0300 (Brasilia Standard Time),Thu Aug 12 2021 14:25:35 GMT-0300 (Brasilia Standard Time)
@dino_noticias Notícias da vida politica de Flávio dino:    La usurpadora (vacinas e obras ferderais),"""flávio dino""",,,1380657068462444500,DeusCleide1,,,0,0,Thu Aug 12 2021 19:54:29 GMT-0300 (Brasilia Standard Time),Thu Aug 12 2021 14:07:11 GMT-0300 (Brasilia Standard Time)
@martonolympio @ALuizCosta Flávio Dino?,"""flávio dino""",,,2546995266,gersonjose1962,,,0,0,Thu Aug 12 2021 19:54:29 GMT-0300 (Brasilia Standard Time),Thu Aug 12 2021 13:53:29 GMT-0300 (Brasilia Standard Time)
"Vou fazer um vídeo chorando falando que queria olhar Flávio Dino presidente, o Davi no nome já tenho... vai que 🥺🥺… https://t.co/znf3BEfc9f","""flávio dino""",,,1271694698051178500,davifrsantos,,,0,1,Thu Aug 12 2021 19:54:29 GMT-0300 (Brasilia Standard Time),Thu Aug 12 2021 13:45:27 GMT-0300 (Brasilia Standard Time)
"@VEJA @radaronline Estamos ferrados se isso acontecer, mas Flávio Dino está em baixa aqui, não conseguiu eleger nem… https://t.co/APGbJjshE7","""flávio dino""",,,1017654640417046500,juniesta8,,,0,0,Thu Aug 12 2021 19:54:29 GMT-0300 (Brasilia Standard Time),Thu Aug 12 2021 13:42:16 GMT-0300 (Brasilia Standard Time)
RT @VEJA: Pedetista quer suceder Flávio Dino no governo do Maranhão (via @radaronline) https://t.co/mHodXmMFin,"""flávio dino""",,,1278127966359302100,LucasSi77919841,,,1,0,Thu Aug 12 2021 19:54:29 GMT-0300 (Brasilia Standard Time),Thu Aug 12 2021 13:34:59 GMT-0300 (Brasilia Standard Time)
"#Eleições2021: ... Ou quer que desenhem?? Senador Weverton tira as dúvidas: ""Sou pré-candidato à sucessão de Flávio… https://t.co/Vw6DuBNV7T","""flávio dino""",,,294902695,rben_hur,,,0,0,Thu Aug 12 2021 19:54:29 GMT-0300 (Brasilia Standard Time),Thu Aug 12 2021 13:32:19 GMT-0300 (Brasilia Standard Time)
Cadê o Wellinton do curso pra dizer q a culpa do aumento da gasolina é do aumento do ICMS do Flávio Dino.,"""flávio dino""",,,49090433,pity_nina,,,0,9,Thu Aug 12 2021 19:54:29 GMT-0300 (Brasilia Standard Time),Thu Aug 12 2021 13:26:30 GMT-0300 (Brasilia Standard Time)
Pedetista quer suceder Flávio Dino no governo do Maranhão (via @radaronline) https://t.co/mHodXmMFin,"""flávio dino""",,,17715048,VEJA,,,1,14,Thu Aug 12 2021 19:54:29 GMT-0300 (Brasilia Standard Time),Thu Aug 12 2021 13:26:20 GMT-0300 (Brasilia Standard Time)
"@passarosErosas Aaaaaaa, que gracinha. E que legal do Flávio Dino.","""flávio dino""",,,2746849406,Barboreh,,,0,0,Thu Aug 12 2021 19:54:29 GMT-0300 (Brasilia Standard Time),Thu Aug 12 2021 13:22:33 GMT-0300 (Brasilia Standard Time)
"@Fercarlula algumas vezes li sobre isso com Flavio Dino.
não temos votos o suficiente p o impeachment, fui ali, e chorei...","""flávio dino""",,,248480076,gabybnu,,,0,1,Thu Aug 12 2021 19:54:29 GMT-0300 (Brasilia Standard Time),Thu Aug 12 2021 13:20:36 GMT-0300 (Brasilia Standard Time)
@maysaditch Ela está indo pro PSB né. Acho que vai ser interessante junto com o Flávio Dino que tem decisões parecidas,"""flávio dino""",,,1150849859341209600,igorfalconieri,,,0,2,Thu Aug 12 2021 19:54:29 GMT-0300 (Brasilia Standard Time),Thu Aug 12 2021 13:15:34 GMT-0300 (Brasilia Standard Time)
@passarosErosas É uma lindeza... o Flávio Dino também.,"""flávio dino""",,,348799518,RochaLcia,,,0,1,Thu Aug 12 2021 19:54:29 GMT-0300 (Brasilia Standard Time),Thu Aug 12 2021 13:15:26 GMT-0300 (Brasilia Standard Time)
"RT @rubenspereirajr: Agora há pouco, na Tribuna da @camaradeputados, destaquei as muitas ações do governo @FlavioDino somente nesta semana,…","""flávio dino""",,,292631147,josiepdj,,,7,0,Thu Aug 12 2021 19:54:29 GMT-0300 (Brasilia Standard Time),Thu Aug 12 2021 13:05:25 GMT-0300 (Brasilia Standard Time)
"RT @rubenspereirajr: Agora há pouco, na Tribuna da @camaradeputados, destaquei as muitas ações do governo @FlavioDino somente nesta semana,…","""flávio dino""",,,422934888,holanda_luis,,,7,0,Thu Aug 12 2021 19:54:29 GMT-0300 (Brasilia Standard Time),Thu Aug 12 2021 12:53:33 GMT-0300 (Brasilia Standard Time)
passado o episódio de Flávio dino brigando c Bolsonaro agr é Duarte brigando c Braide,"""flávio dino""",,,1105981552499048400,mrangodnordest,,,0,0,Thu Aug 12 2021 19:54:29 GMT-0300 (Brasilia Standard Time),Thu Aug 12 2021 12:46:14 GMT-0300 (Brasilia Standard Time)
Pedetista quer suceder Flávio Dino no governo do Maranhão https://t.co/1uktNfCJcJ,"""flávio dino""",,,1275548206320009200,nagenciabr,,,0,0,Thu Aug 12 2021 19:54:29 GMT-0300 (Brasilia Standard Time),Thu Aug 12 2021 12:41:55 GMT-0300 (Brasilia Standard Time)
"@NETINHOOFICIAL3 ' Antes do voo decolar, tiraria o doguinho e comprava mais assentos pra João Azevedo e Flavio Dino !!

🤣🤣🤣🤣🤣🤣🤣","""flávio dino""",,,201487634,lucasdewrich,,,0,0,Thu Aug 12 2021 19:54:29 GMT-0300 (Brasilia Standard Time),Thu Aug 12 2021 12:41:13 GMT-0300 (Brasilia Standard Time)
@jemmaftsimmons puta q pariu q ódio (se bem q lá tá mais adiantado q td mundo pq a nova variante tá rodando por lá… https://t.co/9ZyA79UPPa,"""flávio dino""",,,1320461809166487600,anyasawayama,,,0,1,Thu Aug 12 2021 19:54:29 GMT-0300 (Brasilia Standard Time),Thu Aug 12 2021 12:39:17 GMT-0300 (Brasilia Standard Time)
"RT @fuckinmadhatter: nenhum verificado dizendo que envergonha etc o PT de Lula, o PC do B de Flavio Dino e Marcelo Freixo, o PSOL de Boulos…","""flávio dino""",,,75823680,muuuuuuuuuzin,,,4,0,Thu Aug 12 2021 19:54:29 GMT-0300 (Brasilia Standard Time),Thu Aug 12 2021 12:36:00 GMT-0300 (Brasilia Standard Time)
"RT @fuckinmadhatter: nenhum verificado dizendo que envergonha etc o PT de Lula, o PC do B de Flavio Dino e Marcelo Freixo, o PSOL de Boulos…","""flávio dino""",,,438595035,sobremarina,,,4,0,Thu Aug 12 2021 19:54:29 GMT-0300 (Brasilia Standard Time),Thu Aug 12 2021 12:34:56 GMT-0300 (Brasilia Standard Time)
"RT @vitorlouredo: O partido do Marcelo Freixo e do Flávio Dino deu METADE dos votos a favor do voto impresso.

Por que ninguém os ataca?","""flávio dino""",,,1406704557909028900,ulicomw,,,23,0,Thu Aug 12 2021 19:54:29 GMT-0300 (Brasilia Standard Time),Thu Aug 12 2021 12:24:53 GMT-0300 (Brasilia Standard Time)
"Wellington diz que vai com Duarte cobrar Braide, se os dois forem também cobrar Flávio Dino | Gilberto Léda https://t.co/a3vUE7sfm8","""flávio dino""",,,54627754,gilbertoleda,,,0,0,Thu Aug 12 2021 19:54:29 GMT-0300 (Brasilia Standard Time),Thu Aug 12 2021 12:14:20 GMT-0300 (Brasilia Standard Time)
👍 on @YouTube: MARANHÃO: Flávio Dino usurpa obra federal https://t.co/BWDZtEFU8U,"""flávio dino""",,,58022411,papita75,,,0,0,Thu Aug 12 2021 19:54:29 GMT-0300 (Brasilia Standard Time),Thu Aug 12 2021 12:03:18 GMT-0300 (Brasilia Standard Time)
"RT @fuckinmadhatter: nenhum verificado dizendo que envergonha etc o PT de Lula, o PC do B de Flavio Dino e Marcelo Freixo, o PSOL de Boulos…","""flávio dino""",,,1636125590,m_leitis,,,4,0,Thu Aug 12 2021 19:54:29 GMT-0300 (Brasilia Standard Time),Thu Aug 12 2021 12:00:10 GMT-0300 (Brasilia Standard Time)
"Aí vem o governador Flávio Dino e aumenta o ICMS em 100% do etanol, aguardem! https://t.co/OThXngu9ff","""flávio dino""",,,39634352,Joni_Rocha,,,0,0,Thu Aug 12 2021 19:54:29 GMT-0300 (Brasilia Standard Time),Thu Aug 12 2021 11:47:26 GMT-0300 (Brasilia Standard Time)
RT @raissaasa: Rapaz a cada dia eu admiro mais o Flávio Dino o cara é tão foda que só o ICMS dele é responsável pela alta da gasolina no Pa…,"""flávio dino""",,,1193684392281018400,llsenq,,,1,0,Thu Aug 12 2021 19:54:29 GMT-0300 (Brasilia Standard Time),Thu Aug 12 2021 11:18:46 GMT-0300 (Brasilia Standard Time)
"Segundo minha tia bolsominion, a culpa da recessão do país todo é do Flavio Dino 😃?????????????? Que??????","""flávio dino""",,,742848170133192700,firminacorrea,,,0,2,Thu Aug 12 2021 19:54:29 GMT-0300 (Brasilia Standard Time),Thu Aug 12 2021 11:16:17 GMT-0300 (Brasilia Standard Time)
"RT @CeliaNacarato: Sugestão para a CPI do Charlatanismo: 
Flavio Dino, do Maranhão, cancelou lockdown após 13 dias e oferece kit de fármaco…","""flávio dino""",,,204494751,reclamadoria,,,1,0,Thu Aug 12 2021 19:54:29 GMT-0300 (Brasilia Standard Time),Thu Aug 12 2021 11:15:44 GMT-0300 (Brasilia Standard Time)
quer ver que quando voltar a vacinação eu não vou tá no rio? tô quase aproveitando a ida às terras de flavio dino p… https://t.co/BuZLS6DlYA,"""flávio dino""",,,1077367434317836300,manubordallo,,,0,3,Thu Aug 12 2021 19:54:29 GMT-0300 (Brasilia Standard Time),Thu Aug 12 2021 11:12:53 GMT-0300 (Brasilia Standard Time)
"RT @rubenspereirajr: Agora há pouco, na Tribuna da @camaradeputados, destaquei as muitas ações do governo @FlavioDino somente nesta semana,…","""flávio dino""",,,92144984,manoelnet_05,,,7,0,Thu Aug 12 2021 19:54:29 GMT-0300 (Brasilia Standard Time),Thu Aug 12 2021 11:10:56 GMT-0300 (Brasilia Standard Time)
"RT @rubenspereirajr: Agora há pouco, na Tribuna da @camaradeputados, destaquei as muitas ações do governo @FlavioDino somente nesta semana,…","""flávio dino""",,,1374793244366749700,CamposSahib,,,7,0,Thu Aug 12 2021 19:54:29 GMT-0300 (Brasilia Standard Time),Thu Aug 12 2021 11:09:13 GMT-0300 (Brasilia Standard Time)
"RT @rubenspereirajr: Agora há pouco, na Tribuna da @camaradeputados, destaquei as muitas ações do governo @FlavioDino somente nesta semana,…","""flávio dino""",,,68888109,RenatoSousaJr,,,7,0,Thu Aug 12 2021 19:54:29 GMT-0300 (Brasilia Standard Time),Thu Aug 12 2021 11:07:36 GMT-0300 (Brasilia Standard Time)
"Agora há pouco, na Tribuna da @camaradeputados, destaquei as muitas ações do governo @FlavioDino somente nesta sema… https://t.co/L2iBXeup9w","""flávio dino""",,,57906445,rubenspereirajr,,,7,63,Thu Aug 12 2021 19:54:29 GMT-0300 (Brasilia Standard Time),Thu Aug 12 2021 11:06:50 GMT-0300 (Brasilia Standard Time)
Obra federal no Maranhão. Flávio Dino mente sobre de onde vem os recursos para tal obra. https://t.co/CZ6DYXMwrF,"""flávio dino""",,,154009942,karinymm,,,0,0,Thu Aug 12 2021 19:54:29 GMT-0300 (Brasilia Standard Time),Thu Aug 12 2021 10:54:17 GMT-0300 (Brasilia Standard Time)
"Governador Flávio Dino vai entregar creche de tempo integral, em São Luís, nesta sexta-feira (13) - Blog do Hélcio… https://t.co/t2vEpvYgGr","""flávio dino""",,,161299354,Colunaodohelcio,,,0,0,Thu Aug 12 2021 19:54:29 GMT-0300 (Brasilia Standard Time),Thu Aug 12 2021 10:43:52 GMT-0300 (Brasilia Standard Time)
Rapaz a cada dia eu admiro mais o Flávio Dino o cara é tão foda que só o ICMS dele é responsável pela alta da gasol… https://t.co/0ATSixtksI,"""flávio dino""",,,63297281,raissaasa,,,1,24,Thu Aug 12 2021 19:54:29 GMT-0300 (Brasilia Standard Time),Thu Aug 12 2021 10:41:04 GMT-0300 (Brasilia Standard Time)
"@MarceloFreixo Faltou vc colocar q entre os 7 votos a favor da mulher acusada de mandar matar o marido,está seu cum… https://t.co/xjw1j0XRNu","""flávio dino""",,,3515822116,luizinho261009,,,0,0,Thu Aug 12 2021 19:54:29 GMT-0300 (Brasilia Standard Time),Thu Aug 12 2021 10:37:56 GMT-0300 (Brasilia Standard Time)
"RT @fuckinmadhatter: nenhum verificado dizendo que envergonha etc o PT de Lula, o PC do B de Flavio Dino e Marcelo Freixo, o PSOL de Boulos…","""flávio dino""",,,134285184,Ana_Paulinhah,,,4,0,Thu Aug 12 2021 19:54:29 GMT-0300 (Brasilia Standard Time),Thu Aug 12 2021 10:22:15 GMT-0300 (Brasilia Standard Time)
"A pureza nas palavras do Arthur, o poder das redes sociais e a sensibilidade de Flávio Dino. Tudo em um video só: https://t.co/zjk3lGMN9u","""flávio dino""",,,54067510,naalauraf,,,0,3,Thu Aug 12 2021 19:54:29 GMT-0300 (Brasilia Standard Time),Thu Aug 12 2021 10:19:44 GMT-0300 (Brasilia Standard Time)
@TerraBrasilnot @Valter_V_G_Jr 😂😂😂😂 oohh polícia Federal e o Flávio Dino quando é???,"""flávio dino""",,,1403403719505551400,KatianaArajo4,,,0,4,Thu Aug 12 2021 19:54:29 GMT-0300 (Brasilia Standard Time),Thu Aug 12 2021 10:13:35 GMT-0300 (Brasilia Standard Time)
"nenhum verificado dizendo que envergonha etc o PT de Lula, o PC do B de Flavio Dino e Marcelo Freixo, o PSOL de Bou… https://t.co/ykzBpPwHkW","""flávio dino""",,,187687371,fuckinmadhatter,,,4,33,Thu Aug 12 2021 19:54:29 GMT-0300 (Brasilia Standard Time),Thu Aug 12 2021 10:05:54 GMT-0300 (Brasilia Standard Time)
"@liliannina Não não, foi na época que Eduardo Paes e João Doria, Flávio Dino, etc estavam anunciando as faixas etár… https://t.co/pZ6MDQ8sSx","""flávio dino""",,,56135313,gustavors__,,,0,1,Thu Aug 12 2021 19:54:29 GMT-0300 (Brasilia Standard Time),Thu Aug 12 2021 10:03:06 GMT-0300 (Brasilia Standard Time)
"@veinsolo Governadores do nordeste: Camilo, Rui Costa, Paulo Câmara, Fátima Bezerra, Flávio Dino: 😤🥳😀

Wellington Dias: 🥴🤤","""flávio dino""",,,1213618650587914200,Bronco_clubista,,,0,1,Thu Aug 12 2021 19:54:29 GMT-0300 (Brasilia Standard Time),Thu Aug 12 2021 10:02:37 GMT-0300 (Brasilia Standard Time)
flávio dino tá no estreito?,"""flávio dino""",,,767388189984165900,valhaqtriste,,,0,1,Thu Aug 12 2021 19:54:29 GMT-0300 (Brasilia Standard Time),Thu Aug 12 2021 10:01:44 GMT-0300 (Brasilia Standard Time)
Que horas eu tenho que ir no palácio do leões pra dar um cheiro no Flávio Dino?,"""flávio dino""",,,1021521077665767400,ghosttownpb,,,0,0,Thu Aug 12 2021 19:54:29 GMT-0300 (Brasilia Standard Time),Thu Aug 12 2021 09:54:46 GMT-0300 (Brasilia Standard Time)
@FlavioDino Vc é lindo Flávio Dino!!,"""flávio dino""",,,979337473682747400,cidadaocomumbra,,,0,0,Thu Aug 12 2021 19:54:29 GMT-0300 (Brasilia Standard Time),Thu Aug 12 2021 09:36:25 GMT-0300 (Brasilia Standard Time)
"Alguém pra fazer a matéria ""De Flávio Dino a Tabata Amaral: o megazord do PSB""?","""flávio dino""",,,1042717940410474500,folksaturn,,,0,0,Thu Aug 12 2021 19:54:29 GMT-0300 (Brasilia Standard Time),Thu Aug 12 2021 09:36:15 GMT-0300 (Brasilia Standard Time)
"@LeilaneNeubarth Boa quinta p quem não se curva ao semi analfabeto corrupto! Ja assistiu os videos de Renan Filho,… https://t.co/H6av1B853y","""flávio dino""",,,2893486649,CeliaNacarato,,,0,2,Thu Aug 12 2021 19:54:29 GMT-0300 (Brasilia Standard Time),Thu Aug 12 2021 09:33:58 GMT-0300 (Brasilia Standard Time)
@folha E  pensar que nomes como Freixo e Flávio Dino foram para esse partido. Em vez de escolher melhor. 😅,"""flávio dino""",,,293668437,Eli_augusta,,,0,0,Thu Aug 12 2021 19:54:29 GMT-0300 (Brasilia Standard Time),Thu Aug 12 2021 09:30:32 GMT-0300 (Brasilia Standard Time)
"@dessacom2s @cirogomes Lula favorecendo família Sarney em detrimento de Flavio Dino, Lula sempre do lado serto!🤮https://t.co/UAbrQIDoYW","""flávio dino""",,,1260351804526727200,amorim_pericles,,,0,1,Thu Aug 12 2021 19:54:29 GMT-0300 (Brasilia Standard Time),Thu Aug 12 2021 09:21:09 GMT-0300 (Brasilia Standard Time)
"RT @ricardope: Eu imaginava que a ida de Marcelo Freixo e Flávio Dino para o PSB mudaria o partido, traria ele de vez para a Esquerda, mas…","""flávio dino""",,,1354793631668908000,erika_2e,,,74,0,Thu Aug 12 2021 19:54:29 GMT-0300 (Brasilia Standard Time),Thu Aug 12 2021 09:19:13 GMT-0300 (Brasilia Standard Time)
"RT @Sandroka131: Flávio Dino sobre desfile de tanques: 'é a entrega de correspondência mais cara da história brasileira' - Brasil 247
Custe…","""flávio dino""",,,1039122739200761900,Izaltinobduart1,,,17,0,Thu Aug 12 2021 19:54:29 GMT-0300 (Brasilia Standard Time),Thu Aug 12 2021 09:09:25 GMT-0300 (Brasilia Standard Time)
"RT @ricardope: Eu imaginava que a ida de Marcelo Freixo e Flávio Dino para o PSB mudaria o partido, traria ele de vez para a Esquerda, mas…","""flávio dino""",,,743439864171995100,jinconfidentes,,,74,0,Thu Aug 12 2021 19:54:29 GMT-0300 (Brasilia Standard Time),Thu Aug 12 2021 09:07:45 GMT-0300 (Brasilia Standard Time)
