text,query,country,city,userId,username,quote_count,reply_count,retweet_count,favorite_count,timestamp,createdAt
Governador Carlos Moisés conhece a primeira cerveja 100% catarinense https://t.co/fPSnJcu0hO,"""carlos moisés""",,,866770607559651300,J_Comunidade,,,0,0,Thu Aug 19 2021 19:51:35 GMT-0300 (Brasilia Standard Time),Thu Aug 19 2021 18:23:31 GMT-0300 (Brasilia Standard Time)
"#Artigo - Governador Carlos Moisés da Silva: Construindo pontes

https://t.co/CYai83dYgY","""carlos moisés""",,,968544837577343000,portalitoralsul,,,0,0,Thu Aug 19 2021 19:51:35 GMT-0300 (Brasilia Standard Time),Thu Aug 19 2021 18:08:33 GMT-0300 (Brasilia Standard Time)
"RT @PortalMakingOf: Construindo pontes. *Por Carlos Moisés da Silva - Governador de Santa Catarina.
https://t.co/fWJMUiTnWk https://t.co/xV…","""carlos moisés""",,,1318998016620155000,CarlaoBot,,,1,0,Thu Aug 19 2021 19:51:35 GMT-0300 (Brasilia Standard Time),Thu Aug 19 2021 16:41:43 GMT-0300 (Brasilia Standard Time)
"Construindo pontes. *Por Carlos Moisés da Silva - Governador de Santa Catarina.
https://t.co/fWJMUiTnWk https://t.co/xVSdscPye1","""carlos moisés""",,,25512465,PortalMakingOf,,,1,0,Thu Aug 19 2021 19:51:35 GMT-0300 (Brasilia Standard Time),Thu Aug 19 2021 16:41:38 GMT-0300 (Brasilia Standard Time)
"@OliverStuenkel O Carlos Moisés, governador de SC também faz isso. Me bloqueou e não imagino o motivo. Isso é comum… https://t.co/CGI7S5SaVX","""carlos moisés""",,,27814498,ebolsa,,,0,0,Thu Aug 19 2021 19:51:35 GMT-0300 (Brasilia Standard Time),Thu Aug 19 2021 14:12:17 GMT-0300 (Brasilia Standard Time)
A primeira cerveja produzida com ingredientes 100% catarinenses já está no mercado. O governador Carlos Moisés conh… https://t.co/L7hfPbzBwc,"""carlos moisés""",,,848484451,portaldomediova,,,0,0,Thu Aug 19 2021 19:51:35 GMT-0300 (Brasilia Standard Time),Thu Aug 19 2021 12:20:15 GMT-0300 (Brasilia Standard Time)
"Carlos Moisés, governador de Santa Catarina, falou sobre o bloqueio dos 33 milhões de reais que foram usados para c… https://t.co/alpsEWEplO","""carlos moisés""",,,78907419,jovempanuva,,,0,0,Thu Aug 19 2021 19:51:35 GMT-0300 (Brasilia Standard Time),Thu Aug 19 2021 09:19:31 GMT-0300 (Brasilia Standard Time)
"RT @brunopacedori: Na opinião do jornalista Bruno Pace Dori, o governador Carlos Moisés saiu vitorioso de mais uma batalha sobre a situação…","""carlos moisés""",,,1257078915753021400,locksmaur,,,1,0,Thu Aug 19 2021 19:51:35 GMT-0300 (Brasilia Standard Time),Wed Aug 18 2021 23:36:23 GMT-0300 (Brasilia Standard Time)
"Primeira cerveja 100% catarinense é apresentada ao governador Carlos Moisés

https://t.co/ypnMkTK7n3","""carlos moisés""",,,968544837577343000,portalitoralsul,,,0,0,Thu Aug 19 2021 19:51:35 GMT-0300 (Brasilia Standard Time),Wed Aug 18 2021 23:16:12 GMT-0300 (Brasilia Standard Time)
"Na opinião do jornalista Bruno Pace Dori, o governador Carlos Moisés saiu vitorioso de mais uma batalha sobre a sit… https://t.co/DjIUhCQqde","""carlos moisés""",,,385182098,brunopacedori,,,1,2,Thu Aug 19 2021 19:51:35 GMT-0300 (Brasilia Standard Time),Wed Aug 18 2021 23:08:57 GMT-0300 (Brasilia Standard Time)
"RT @brunopacedori: A VITÓRIA É DOS CATARINENSES

Governador @CarlosMoises foi à Brasília e garantiu acordo com o Ministério da Infraestrutu…","""carlos moisés""",,,1257078915753021400,locksmaur,,,1,0,Thu Aug 19 2021 19:51:35 GMT-0300 (Brasilia Standard Time),Wed Aug 18 2021 20:38:30 GMT-0300 (Brasilia Standard Time)
"RT @diariodoiguacu: Carlos Moisés vai à Brasília, garante acordo com ministro e vence batalha.

Governador Carlos Moisés participou da audi…","""carlos moisés""",,,164765268,LBuligon,,,3,0,Thu Aug 19 2021 19:51:35 GMT-0300 (Brasilia Standard Time),Wed Aug 18 2021 20:09:35 GMT-0300 (Brasilia Standard Time)
Governador Carlos Moisés conhece a primeira cerveja 100% catarinense https://t.co/CyI7ofuiyk #leianold #todanossa… https://t.co/igBFcDm9z8,"""carlos moisés""",,,238976808,lagesdiario,,,0,1,Thu Aug 19 2021 19:51:35 GMT-0300 (Brasilia Standard Time),Wed Aug 18 2021 19:52:39 GMT-0300 (Brasilia Standard Time)
"Governador Carlos Moisés conhece a primeira cerveja 100% catarinense #SantaCatarina
https://t.co/79nanO6YxD","""carlos moisés""",,,148352132,schojenews,,,0,0,Thu Aug 19 2021 19:51:35 GMT-0300 (Brasilia Standard Time),Wed Aug 18 2021 19:22:49 GMT-0300 (Brasilia Standard Time)
Governador Carlos Moisés conhece a primeira cerveja 100% catarinense https://t.co/WrYk3Qi0jQ,"""carlos moisés""",,,121135227,josesantana77,,,0,0,Thu Aug 19 2021 19:51:35 GMT-0300 (Brasilia Standard Time),Wed Aug 18 2021 19:21:43 GMT-0300 (Brasilia Standard Time)
"A VITÓRIA É DOS CATARINENSES

Governador @CarlosMoises foi à Brasília e garantiu acordo com o Ministério da Infraes… https://t.co/1N3PIjoozV","""carlos moisés""",,,385182098,brunopacedori,,,1,1,Thu Aug 19 2021 19:51:35 GMT-0300 (Brasilia Standard Time),Wed Aug 18 2021 19:12:55 GMT-0300 (Brasilia Standard Time)
A 1ª cerveja produzida com ingredientes 100% catarinenses já está no mercado. O governador @CarlosMoises conheceu h… https://t.co/kFeMWkgfXP,"""carlos moisés""",,,250689767,GovSC,,,0,18,Thu Aug 19 2021 19:51:35 GMT-0300 (Brasilia Standard Time),Wed Aug 18 2021 18:45:41 GMT-0300 (Brasilia Standard Time)
"INVESTIMENTOS 
Carlos Moisés garante acordo para aporte de recursos estaduais nas rodovias federais de SC… https://t.co/o8ngUP8jQp","""carlos moisés""",,,90662549,portaltrii,,,0,0,Thu Aug 19 2021 19:51:35 GMT-0300 (Brasilia Standard Time),Wed Aug 18 2021 14:25:12 GMT-0300 (Brasilia Standard Time)
RT @TiliasNews: Carlos Moisés garante acordo para aporte de recursos estaduais nas rodovias federais de SC https://t.co/9bVSprYmLR,"""carlos moisés""",,,1318998016620155000,CarlaoBot,,,1,0,Thu Aug 19 2021 19:51:35 GMT-0300 (Brasilia Standard Time),Wed Aug 18 2021 13:36:00 GMT-0300 (Brasilia Standard Time)
Carlos Moisés garante acordo para aporte de recursos estaduais nas rodovias federais de SC https://t.co/9bVSprYmLR,"""carlos moisés""",,,1094629350442520600,TiliasNews,,,1,0,Thu Aug 19 2021 19:51:35 GMT-0300 (Brasilia Standard Time),Wed Aug 18 2021 13:35:55 GMT-0300 (Brasilia Standard Time)
Carlos Moisés garante acordo para aporte de recursos - https://t.co/7i2INP8W6r https://t.co/VAQLzVbBFT,"""carlos moisés""",,,882214585209696300,DiarideSC,,,0,0,Thu Aug 19 2021 19:51:35 GMT-0300 (Brasilia Standard Time),Wed Aug 18 2021 13:04:54 GMT-0300 (Brasilia Standard Time)
"RT @taoquei1: Gente, ontem o covidao esteve em Sp e em Pará. Hoje a PF está dando bom dia para o governador de SC Carlos Moisés...
Tá acont…","""carlos moisés""",,,1284133047344955400,moreirafabio643,,,1481,0,Thu Aug 19 2021 19:51:35 GMT-0300 (Brasilia Standard Time),Wed Aug 18 2021 12:32:35 GMT-0300 (Brasilia Standard Time)
@depjesse Quem é que indicou o Carlos Moisés? Nos passa a impressão que é só um fantoche.,"""carlos moisés""",,,822104425250648000,scpablosantos,,,0,0,Thu Aug 19 2021 19:51:35 GMT-0300 (Brasilia Standard Time),Wed Aug 18 2021 08:17:36 GMT-0300 (Brasilia Standard Time)
"RT @diariodoiguacu: Carlos Moisés vai à Brasília, garante acordo com ministro e vence batalha.

Governador Carlos Moisés participou da audi…","""carlos moisés""",,,385182098,brunopacedori,,,3,0,Thu Aug 19 2021 19:51:35 GMT-0300 (Brasilia Standard Time),Wed Aug 18 2021 07:50:33 GMT-0300 (Brasilia Standard Time)
"RT @diariodoiguacu: Carlos Moisés vai à Brasília, garante acordo com ministro e vence batalha.

Governador Carlos Moisés participou da audi…","""carlos moisés""",,,1318998016620155000,CarlaoBot,,,3,0,Thu Aug 19 2021 19:51:35 GMT-0300 (Brasilia Standard Time),Wed Aug 18 2021 07:48:25 GMT-0300 (Brasilia Standard Time)
"Carlos Moisés vai à Brasília, garante acordo com ministro e vence batalha.

Governador Carlos Moisés participou da… https://t.co/thlqlaZLIY","""carlos moisés""",,,97470841,diariodoiguacu,,,3,3,Thu Aug 19 2021 19:51:35 GMT-0300 (Brasilia Standard Time),Wed Aug 18 2021 07:48:20 GMT-0300 (Brasilia Standard Time)
"Lista dos governadores contra o STF:

Gladson Cameli (AC)
Wilson Lima  (AM)
Caiado (GO)
Mauro Mendes (MT)
Reinaldo… https://t.co/FOLCdSeNO9","""carlos moisés""",,,1415046072838332400,Avery89586650,,,0,2,Thu Aug 19 2021 19:51:35 GMT-0300 (Brasilia Standard Time),Tue Aug 17 2021 18:34:26 GMT-0300 (Brasilia Standard Time)
RT @panchocombr: O governador Carlos Moisés aumentou a oferta de dinheiro a ser investido na duplicação da BR-470. De R$ 200 milhões para R…,"""carlos moisés""",,,872086958591356900,RenatoM42119039,,,2,0,Thu Aug 19 2021 19:51:35 GMT-0300 (Brasilia Standard Time),Tue Aug 17 2021 17:55:25 GMT-0300 (Brasilia Standard Time)
"200 milhões para os lotes 1 e 2 da BR 470 estaria garantido, segundo Carlos Moisés https://t.co/x6L9S00CN4 via @ClicNavegantes","""carlos moisés""",,,55867117,ClicNavegantes,,,0,0,Thu Aug 19 2021 19:51:35 GMT-0300 (Brasilia Standard Time),Tue Aug 17 2021 17:26:24 GMT-0300 (Brasilia Standard Time)
"Com mais R$ 100 milhões, Carlos Moisés quer acabar com impasse sobre recurso para a BR-470 https://t.co/NrDxddnPHw","""carlos moisés""",,,1275548206320009200,nagenciabr,,,0,0,Thu Aug 19 2021 19:51:35 GMT-0300 (Brasilia Standard Time),Tue Aug 17 2021 17:16:32 GMT-0300 (Brasilia Standard Time)
"RT @diariodoiguacu: Carlos Moisés garante acordo para aporte de recursos estaduais nas rodovias federais de SC.
Governador participou de au…","""carlos moisés""",,,385182098,brunopacedori,,,1,0,Thu Aug 19 2021 19:51:35 GMT-0300 (Brasilia Standard Time),Tue Aug 17 2021 17:12:09 GMT-0300 (Brasilia Standard Time)
"Carlos Moisés garante acordo para aporte de recursos estaduais nas rodovias federais de SC.
Governador participou d… https://t.co/QibNjcu19h","""carlos moisés""",,,97470841,diariodoiguacu,,,1,0,Thu Aug 19 2021 19:51:35 GMT-0300 (Brasilia Standard Time),Tue Aug 17 2021 17:05:05 GMT-0300 (Brasilia Standard Time)
"Com mais R$ 100 milhões, Carlos Moisés quer acabar com impasse sobre recurso para a BR-470. #NDmais https://t.co/i0smUVMW5G","""carlos moisés""",,,74800636,ndtvrecordtv,,,0,0,Thu Aug 19 2021 19:51:35 GMT-0300 (Brasilia Standard Time),Tue Aug 17 2021 17:04:19 GMT-0300 (Brasilia Standard Time)
"Com mais R$ 100 milhões, Carlos Moisés quer acabar com impasse sobre recurso para a BR-470. #NDmais https://t.co/RHr80qyLuH","""carlos moisés""",,,197491849,ND_mais_,,,1,1,Thu Aug 19 2021 19:51:35 GMT-0300 (Brasilia Standard Time),Tue Aug 17 2021 17:04:19 GMT-0300 (Brasilia Standard Time)
Carlos Moisés garante aporte milionário para rodovias federais de SC https://t.co/EAvFvNoqU5,"""carlos moisés""",,,1275548206320009200,nagenciabr,,,0,0,Thu Aug 19 2021 19:51:35 GMT-0300 (Brasilia Standard Time),Tue Aug 17 2021 16:56:43 GMT-0300 (Brasilia Standard Time)
Carlos Moisés garante aporte milionário para rodovias federais de SC. #NDmais https://t.co/Dh7tbXrbEu,"""carlos moisés""",,,74800636,ndtvrecordtv,,,0,0,Thu Aug 19 2021 19:51:35 GMT-0300 (Brasilia Standard Time),Tue Aug 17 2021 16:49:06 GMT-0300 (Brasilia Standard Time)
Carlos Moisés garante aporte milionário para rodovias federais de SC. #NDmais https://t.co/2WuN6zKvYa,"""carlos moisés""",,,197491849,ND_mais_,,,0,3,Thu Aug 19 2021 19:51:35 GMT-0300 (Brasilia Standard Time),Tue Aug 17 2021 16:49:06 GMT-0300 (Brasilia Standard Time)
"da Central de Atendimentos aos Municípios (CAM) da Casa Civil, e a vereadora Tania Larson, de Joinville. 
A lei 18.… https://t.co/FWAp2M6r2z","""carlos moisés""",,,753920486464184300,CidascOficial,,,0,1,Thu Aug 19 2021 19:51:35 GMT-0300 (Brasilia Standard Time),Tue Aug 17 2021 16:47:19 GMT-0300 (Brasilia Standard Time)
Carlos Moisés garante acordo para aporte de recursos estaduais nas rodovias federais de SC https://t.co/FaKjNOa6IJ https://t.co/O29JN4Q40l,"""carlos moisés""",,,1263425958,radiowebativida,,,0,0,Thu Aug 19 2021 19:51:35 GMT-0300 (Brasilia Standard Time),Tue Aug 17 2021 16:29:44 GMT-0300 (Brasilia Standard Time)
"Confira tudo que foi definido na audiência de Brasília👇

#GOVSCemBrasília #Brasília @MInfraestrutura @CarlosMoises… https://t.co/KYDDDW0Rbd","""carlos moisés""",,,250689767,GovSC,,,0,1,Thu Aug 19 2021 19:51:35 GMT-0300 (Brasilia Standard Time),Tue Aug 17 2021 16:19:28 GMT-0300 (Brasilia Standard Time)
"Em #Brasília, o governador @CarlosMoises garantiu acordo para aporte de recursos estaduais nas rodovias federais de… https://t.co/WPqrA8M8Fy","""carlos moisés""",,,510676665,CasaCivilSC,,,0,1,Thu Aug 19 2021 19:51:35 GMT-0300 (Brasilia Standard Time),Tue Aug 17 2021 16:11:29 GMT-0300 (Brasilia Standard Time)
Carlos Moisés garante acordo para aporte de recursos estaduais nas rodovias federais de SC https://t.co/bOJDzIIydU,"""carlos moisés""",,,33208071,sjonline,,,0,0,Thu Aug 19 2021 19:51:35 GMT-0300 (Brasilia Standard Time),Tue Aug 17 2021 16:03:02 GMT-0300 (Brasilia Standard Time)
"RT @diariodoiguacu: Carlos Moisés propõe repassar R$ 100 milhões extras ao governo federal.

Oferta foi feita pelo governador durante audiê…","""carlos moisés""",,,385182098,brunopacedori,,,1,0,Thu Aug 19 2021 19:51:35 GMT-0300 (Brasilia Standard Time),Tue Aug 17 2021 16:01:43 GMT-0300 (Brasilia Standard Time)
"Carlos Moisés propõe repassar R$ 100 milhões extras ao governo federal.

Oferta foi feita pelo governador durante a… https://t.co/ZeUR4tKDYm","""carlos moisés""",,,97470841,diariodoiguacu,,,1,0,Thu Aug 19 2021 19:51:35 GMT-0300 (Brasilia Standard Time),Tue Aug 17 2021 15:59:41 GMT-0300 (Brasilia Standard Time)
"#PeloEstado Entrevista: Carlos Moisés quer acelerar obras nas rodovias federais

Leia a entrevista completa no site… https://t.co/IEEtA9yOi9","""carlos moisés""",,,1279932298117423000,riomaframix,,,0,0,Thu Aug 19 2021 19:51:35 GMT-0300 (Brasilia Standard Time),Tue Aug 17 2021 15:51:59 GMT-0300 (Brasilia Standard Time)
"Carlos Moisés garante acordo para aporte de recursos estaduais nas rodovias federais de SC #SantaCatarina
https://t.co/J4RAzyvG6s","""carlos moisés""",,,148352132,schojenews,,,0,0,Thu Aug 19 2021 19:51:35 GMT-0300 (Brasilia Standard Time),Tue Aug 17 2021 15:51:49 GMT-0300 (Brasilia Standard Time)
Carlos Moisés garante acordo para aporte de recursos estaduais nas rodovias federais de SC https://t.co/x8xnTnEeRo,"""carlos moisés""",,,121135227,josesantana77,,,0,0,Thu Aug 19 2021 19:51:35 GMT-0300 (Brasilia Standard Time),Tue Aug 17 2021 15:51:10 GMT-0300 (Brasilia Standard Time)
"RT @curimim: Helder Barbalho (MDB) do Pará, Ratinho Júnior (PSD) do Paraná, Cláudio Castro (PL) do Rio de Janeiro, Coronel Marcos Rocha (PS…","""carlos moisés""",,,1918176578,cludio_top02,,,3,0,Thu Aug 19 2021 19:51:35 GMT-0300 (Brasilia Standard Time),Tue Aug 17 2021 15:19:57 GMT-0300 (Brasilia Standard Time)
O governador Carlos Moisés voltou a fazer críticas a obras na região. O alvo desta vez foi o Centro de Inovação que… https://t.co/w6LTEeJvlv,"""carlos moisés""",,,39758411,radiocidadetb,,,0,0,Thu Aug 19 2021 19:51:35 GMT-0300 (Brasilia Standard Time),Tue Aug 17 2021 15:00:01 GMT-0300 (Brasilia Standard Time)
"RT @curimim: Helder Barbalho (MDB) do Pará, Ratinho Júnior (PSD) do Paraná, Cláudio Castro (PL) do Rio de Janeiro, Coronel Marcos Rocha (PS…","""carlos moisés""",,,1256394769808404500,SoaresBaima,,,3,0,Thu Aug 19 2021 19:51:35 GMT-0300 (Brasilia Standard Time),Tue Aug 17 2021 14:50:44 GMT-0300 (Brasilia Standard Time)
"RT @curimim: Helder Barbalho (MDB) do Pará, Ratinho Júnior (PSD) do Paraná, Cláudio Castro (PL) do Rio de Janeiro, Coronel Marcos Rocha (PS…","""carlos moisés""",,,1254800869801017300,FabioIzFe,,,3,0,Thu Aug 19 2021 19:51:35 GMT-0300 (Brasilia Standard Time),Tue Aug 17 2021 14:46:40 GMT-0300 (Brasilia Standard Time)
"Helder Barbalho (MDB) do Pará, Ratinho Júnior (PSD) do Paraná, Cláudio Castro (PL) do Rio de Janeiro, Coronel Marco… https://t.co/7yE9R7KPUj","""carlos moisés""",,,216515869,curimim,,,3,10,Thu Aug 19 2021 19:51:35 GMT-0300 (Brasilia Standard Time),Tue Aug 17 2021 14:45:31 GMT-0300 (Brasilia Standard Time)
RT @panchocombr: O governador Carlos Moisés aumentou a oferta de dinheiro a ser investido na duplicação da BR-470. De R$ 200 milhões para R…,"""carlos moisés""",,,3303692811,Br470_SC,,,2,0,Thu Aug 19 2021 19:51:35 GMT-0300 (Brasilia Standard Time),Tue Aug 17 2021 13:54:33 GMT-0300 (Brasilia Standard Time)
O governador Carlos Moisés aumentou a oferta de dinheiro a ser investido na duplicação da BR-470. De R$ 200 milhões… https://t.co/T0LyViIqLT,"""carlos moisés""",,,16179004,panchocombr,,,2,8,Thu Aug 19 2021 19:51:35 GMT-0300 (Brasilia Standard Time),Tue Aug 17 2021 13:53:47 GMT-0300 (Brasilia Standard Time)
Finalmente o assunto BR-470 e rodovias federais de SC é tratado diretamente. Governador Carlos Moisés fala agora e… https://t.co/71yjIEqj4a,"""carlos moisés""",,,13887602,evandrodeassis,,,0,1,Thu Aug 19 2021 19:51:35 GMT-0300 (Brasilia Standard Time),Tue Aug 17 2021 13:38:41 GMT-0300 (Brasilia Standard Time)
"O presidente da comissão, senador Dário Berger, abriu para manifestações dos senadores antes de discutir as rodovia… https://t.co/DGfeQasFFo","""carlos moisés""",,,13887602,evandrodeassis,,,0,1,Thu Aug 19 2021 19:51:35 GMT-0300 (Brasilia Standard Time),Tue Aug 17 2021 12:29:44 GMT-0300 (Brasilia Standard Time)
"@pombo_miope Carlos Moises na real é bem lesado, nao sei qual o legado dele vai ser, a unica coisa boa que relacion… https://t.co/menyI49W33","""carlos moisés""",,,1038840602081808400,EadweardFrom,,,0,0,Thu Aug 19 2021 19:51:35 GMT-0300 (Brasilia Standard Time),Tue Aug 17 2021 12:19:37 GMT-0300 (Brasilia Standard Time)
"Carlos Moisés da Silva, o leonino aniversariante do dia!
Parabéns, @CarlosMoises 😊 https://t.co/2WA2rma3U5","""carlos moisés""",,,776121669559676900,stopassolimaga,,,0,1,Thu Aug 19 2021 19:51:35 GMT-0300 (Brasilia Standard Time),Tue Aug 17 2021 11:59:21 GMT-0300 (Brasilia Standard Time)
Carlos Moisés (PSL) de Santa Catarina e Mauro Carlesse (PSL) do Tocantins!,"""carlos moisés""",,,1040695592937250800,liabarroso6,,,0,1,Thu Aug 19 2021 19:51:35 GMT-0300 (Brasilia Standard Time),Tue Aug 17 2021 10:37:16 GMT-0300 (Brasilia Standard Time)
"@DINAHMRIB1 Aqui, o capacho Carlos Moisés de SC, NÃO assinou.","""carlos moisés""",,,1197109846052614100,Claudia42941931,,,0,2,Thu Aug 19 2021 19:51:35 GMT-0300 (Brasilia Standard Time),Tue Aug 17 2021 10:34:47 GMT-0300 (Brasilia Standard Time)
"Começou, com uma hora de atraso, a audiência pública na Comissão de Infraestrutura do Senado que vai tratar da dupl… https://t.co/HW9xPiGRoL","""carlos moisés""",,,13887602,evandrodeassis,,,0,2,Thu Aug 19 2021 19:51:35 GMT-0300 (Brasilia Standard Time),Tue Aug 17 2021 10:24:13 GMT-0300 (Brasilia Standard Time)
"E, claro, o aniversariante do dia: o governador Carlos Moisés. Levou com eles os secretários Thiago Vieira (Infraes… https://t.co/5sSYwlPqXb","""carlos moisés""",,,801419661762056200,upiaraonline,,,0,2,Thu Aug 19 2021 19:51:35 GMT-0300 (Brasilia Standard Time),Tue Aug 17 2021 10:15:14 GMT-0300 (Brasilia Standard Time)
Entrevista: Carlos Moisés quer acelerar obras nas rodovias federais https://t.co/US6ltl40FB,"""carlos moisés""",,,1275548206320009200,nagenciabr,,,0,0,Thu Aug 19 2021 19:51:35 GMT-0300 (Brasilia Standard Time),Tue Aug 17 2021 10:10:56 GMT-0300 (Brasilia Standard Time)
"Ratinho, Gov do PR, Carlos Moisés,  Gov de SC, Zema , Gov de MG, todos cúmplices do ditador genocida do Brasil. Não esqueceremos","""carlos moisés""",,,38661434,djalepeixoto,,,0,0,Thu Aug 19 2021 19:51:35 GMT-0300 (Brasilia Standard Time),Tue Aug 17 2021 09:09:43 GMT-0300 (Brasilia Standard Time)
"GOVERNADOR NÃO ASSINA  AO MANIFESTO ABSURDO

https://t.co/zzEjzlCmVt https://t.co/8XjgumbutH","""carlos moisés""",,,1339951193896984600,RhemaofTheGod,,,0,0,Thu Aug 19 2021 19:51:35 GMT-0300 (Brasilia Standard Time),Tue Aug 17 2021 08:47:35 GMT-0300 (Brasilia Standard Time)
"Carlos Moisés nascido em Florianópolis/SC, 17/8/1967, é advogado, bombeiro militar e político. Atual Gov. de Santa… https://t.co/9hYt3mtOMh","""carlos moisés""",,,80381345,HelvioSilva123,,,0,0,Thu Aug 19 2021 19:51:35 GMT-0300 (Brasilia Standard Time),Tue Aug 17 2021 06:08:09 GMT-0300 (Brasilia Standard Time)
@claratpccamargo @pombo_miope Posso te dizer que Carlos Moisés e ruim mais pior que ele e a vice por isso ficamos c… https://t.co/aDTWJWI4rY,"""carlos moisés""",,,1330733348,DosRigoni,,,0,2,Thu Aug 19 2021 19:51:35 GMT-0300 (Brasilia Standard Time),Tue Aug 17 2021 03:34:58 GMT-0300 (Brasilia Standard Time)
"RT @cadulorena: O coronel Carlos Moisés, governador de Santa Catarina, é um mamateiro militar aposentado desde os seus 48 anos, em 2016. Fi…","""carlos moisés""",,,715364459099856900,odio_nao,,,1,0,Thu Aug 19 2021 19:51:35 GMT-0300 (Brasilia Standard Time),Tue Aug 17 2021 00:29:57 GMT-0300 (Brasilia Standard Time)
"@AninhaBolsonaro Lista dos governadores contra o STF:

Gladson Cameli (AC)
Wilson Lima  (AM)
Caiado (GO)
Mauro Mend… https://t.co/pUEdpJjxW6","""carlos moisés""",,,1415046072838332400,Avery89586650,,,0,0,Thu Aug 19 2021 19:51:35 GMT-0300 (Brasilia Standard Time),Tue Aug 17 2021 00:14:57 GMT-0300 (Brasilia Standard Time)
"@gomes_jalmir Lista dos governadores contra o STF:

Gladson Cameli (AC)
Wilson Lima  (AM)
Caiado (GO)
Mauro Mendes… https://t.co/PYbuvxe1es","""carlos moisés""",,,1415046072838332400,Avery89586650,,,0,1,Thu Aug 19 2021 19:51:35 GMT-0300 (Brasilia Standard Time),Tue Aug 17 2021 00:13:51 GMT-0300 (Brasilia Standard Time)
"@handellan Lista dos governadores contra o STF:

Gladson Cameli (AC)
Wilson Lima  (AM)
Caiado (GO)
Mauro Mendes (MT… https://t.co/FpNEK7fUrw","""carlos moisés""",,,1415046072838332400,Avery89586650,,,0,0,Thu Aug 19 2021 19:51:35 GMT-0300 (Brasilia Standard Time),Tue Aug 17 2021 00:11:07 GMT-0300 (Brasilia Standard Time)
"@NellyYumi Lista dos governadores contra o STF:

Gladson Cameli (AC)
Wilson Lima  (AM)
Caiado (GO)
Mauro Mendes (MT… https://t.co/UKLcQ4yQDq","""carlos moisés""",,,1415046072838332400,Avery89586650,,,0,0,Thu Aug 19 2021 19:51:35 GMT-0300 (Brasilia Standard Time),Tue Aug 17 2021 00:10:02 GMT-0300 (Brasilia Standard Time)
@nathodcosta @SagatCfc @EduardoMatysiak Inveja de quem? De quem votou em Ratinho Jr? Carlos Moisés? Daniela Reinehr… https://t.co/IKB9jwY3l0,"""carlos moisés""",,,57037884,rodrigoedgard,,,0,1,Thu Aug 19 2021 19:51:35 GMT-0300 (Brasilia Standard Time),Mon Aug 16 2021 23:32:56 GMT-0300 (Brasilia Standard Time)
@SagatCfc @EduardoMatysiak Sou do Sudeste. São Paulo-SP. Tenho a honestidade suficiente para afirmar que muito dos… https://t.co/9ASlqAHbRP,"""carlos moisés""",,,57037884,rodrigoedgard,,,0,8,Thu Aug 19 2021 19:51:35 GMT-0300 (Brasilia Standard Time),Mon Aug 16 2021 23:27:07 GMT-0300 (Brasilia Standard Time)
"@NacionalLuis27 a Mesma coisa foi em Santa Catarina, Nunca que iriam eleger o Carlos Moises, um desconhecido que nu… https://t.co/MNPvz2gnPs","""carlos moisés""",,,1423367699040809000,Eximperio3,,,0,1,Thu Aug 19 2021 19:51:35 GMT-0300 (Brasilia Standard Time),Mon Aug 16 2021 22:44:50 GMT-0300 (Brasilia Standard Time)
Daniela Reinehr fala sobre rompimento com Carlos Moisés: “Me sinto orgulhosa do que eu fiz” https://t.co/JIDjJPBRt6… https://t.co/h5FRPMhbeC,"""carlos moisés""",,,1125156881515917300,noticias_hc,,,0,1,Thu Aug 19 2021 19:51:35 GMT-0300 (Brasilia Standard Time),Mon Aug 16 2021 22:35:29 GMT-0300 (Brasilia Standard Time)
Carlos Moisés se pronuncia sobre os R$ 33 milhões https://t.co/iVUlWuFCI2,"""carlos moisés""",,,539981139,Pchagasvargas,,,0,0,Thu Aug 19 2021 19:51:35 GMT-0300 (Brasilia Standard Time),Mon Aug 16 2021 21:52:01 GMT-0300 (Brasilia Standard Time)
"Ratinho Júnior (PSD) do Paraná, Cláudio Castro (PL) do Rio de Janeiro, Coronel Marcos Rocha (PSL) de Rondônia, Anto… https://t.co/eeQzZYMR6w","""carlos moisés""",,,924812138597765100,cruzdeyse70,,,0,2,Thu Aug 19 2021 19:51:35 GMT-0300 (Brasilia Standard Time),Mon Aug 16 2021 21:49:13 GMT-0300 (Brasilia Standard Time)
Carlos Moisés explica que o Samuel Rodovalho dos 300 Zentao da FENASP não será punido mesmo pelo @MPF_PGR  e que te… https://t.co/LJjsckpyav,"""carlos moisés""",,,2437579938,Ary_AntiPT,,,0,0,Thu Aug 19 2021 19:51:35 GMT-0300 (Brasilia Standard Time),Mon Aug 16 2021 21:26:07 GMT-0300 (Brasilia Standard Time)
"O https://t.co/u0N87SVUsT SC -@CarlosMoises
parece estar na busca de uma identidade politica própria. Ao não apoiar… https://t.co/KIvbJnxJPL","""carlos moisés""",,,77486307,BetoWarken,,,0,1,Thu Aug 19 2021 19:51:35 GMT-0300 (Brasilia Standard Time),Mon Aug 16 2021 21:23:25 GMT-0300 (Brasilia Standard Time)
"RT @omirantejlle: À medida que eleição de 2022 se aproxima, o STF se torna alvo do bolsonarismo. Governadores prestaram solidariedade, mas…","""carlos moisés""",,,1289700814664212500,felipolitik,,,2,0,Thu Aug 19 2021 19:51:35 GMT-0300 (Brasilia Standard Time),Mon Aug 16 2021 20:32:37 GMT-0300 (Brasilia Standard Time)
"À medida que eleição de 2022 se aproxima, o STF se torna alvo do bolsonarismo. Governadores prestaram solidariedade… https://t.co/oTCDa4oV11","""carlos moisés""",,,862380087743787000,omirantejlle,,,2,5,Thu Aug 19 2021 19:51:35 GMT-0300 (Brasilia Standard Time),Mon Aug 16 2021 20:30:06 GMT-0300 (Brasilia Standard Time)
"@pombo_miope Não tenho como votar, mas se fosse do pior eu votaria Carlos Moisés.","""carlos moisés""",,,1325962735159550000,Geancarlo1971,,,0,0,Thu Aug 19 2021 19:51:35 GMT-0300 (Brasilia Standard Time),Mon Aug 16 2021 20:09:59 GMT-0300 (Brasilia Standard Time)
A pergunta que faço é: Por que boa parte desta quantia foi para fora do Brasil ? Com a palavra o governador de Sant… https://t.co/xAw1OxBjLx,"""carlos moisés""",,,1268241374605914000,_GabrielzinhoSC,,,0,0,Thu Aug 19 2021 19:51:35 GMT-0300 (Brasilia Standard Time),Mon Aug 16 2021 20:00:08 GMT-0300 (Brasilia Standard Time)
