text,query,country,city,userId,username,quote_count,reply_count,retweet_count,favorite_count,timestamp,createdAt
"Em reunião hoje, tratamos dos projetos que queremos acelerar ainda mais para desenvolver o Amapá e ajudar a garanti… https://t.co/Zc4djeJQOW",965696565074714625,,,965696565074714600,waldezoficial,,,1,1,Thu Aug 05 2021 21:49:39 GMT-0300 (Brasilia Standard Time),Thu Aug 05 2021 20:35:24 GMT-0300 (Brasilia Standard Time)
"Olá, gente! Nesta sexta-feira, darei posse a Antônio Teles Júnior como presidente da Agência de Desenvolvimento Eco… https://t.co/JjBsrfuW3m",965696565074714625,,,965696565074714600,waldezoficial,,,2,3,Thu Aug 05 2021 21:49:39 GMT-0300 (Brasilia Standard Time),Thu Aug 05 2021 20:35:24 GMT-0300 (Brasilia Standard Time)
"Parabéns especial ao Darlan Romani, o nosso Sr. Incrível, que ganha o título de super-herói brasileiro. Darlan, voc… https://t.co/umObQZKhfH",965696565074714625,,,965696565074714600,waldezoficial,,,2,2,Thu Aug 05 2021 21:49:39 GMT-0300 (Brasilia Standard Time),Thu Aug 05 2021 14:41:15 GMT-0300 (Brasilia Standard Time)
"Olá gente. 🤝Estamos todos ligados nos Jogos Olímpicos. 

Parabéns a Pedro Barros, do skate park, por ter conquistad… https://t.co/pwEMtiOG6Y",965696565074714625,,,965696565074714600,waldezoficial,,,1,3,Thu Aug 05 2021 21:49:39 GMT-0300 (Brasilia Standard Time),Thu Aug 05 2021 14:41:13 GMT-0300 (Brasilia Standard Time)
"Cuidamos da saúde da nossa gente ao mesmo tempo em que protegemos a economia do Amapá. Juntos, iremos vencer a Covi… https://t.co/z3CMYIWlFH",965696565074714625,,,965696565074714600,waldezoficial,,,0,3,Thu Aug 05 2021 21:49:39 GMT-0300 (Brasilia Standard Time),Thu Aug 05 2021 10:48:33 GMT-0300 (Brasilia Standard Time)
"Na próxima semana, faremos o pagamento para os setores de bares, restaurantes, lanchonetes e outros importantes seg… https://t.co/6PaGFtbLHo",965696565074714625,,,965696565074714600,waldezoficial,,,0,3,Thu Aug 05 2021 21:49:39 GMT-0300 (Brasilia Standard Time),Thu Aug 05 2021 10:48:33 GMT-0300 (Brasilia Standard Time)
"Olá, gente. Hoje damos mais um passo para ajudar nossos empreendedores a vencerem a crise ocasionada pela pandemia.… https://t.co/1rhtYmACht",965696565074714625,,,965696565074714600,waldezoficial,,,1,6,Thu Aug 05 2021 21:49:39 GMT-0300 (Brasilia Standard Time),Thu Aug 05 2021 10:48:32 GMT-0300 (Brasilia Standard Time)
"A partir do programa Estado Forte, Povo Seguro, estamos investindo R$ 250 milhões em iniciativas diversas que conte… https://t.co/6GV2vXzQgB",965696565074714625,,,965696565074714600,waldezoficial,,,0,1,Thu Aug 05 2021 21:49:39 GMT-0300 (Brasilia Standard Time),Wed Aug 04 2021 20:32:08 GMT-0300 (Brasilia Standard Time)
"O CTOR também foi contemplado com um reforço em sua frota de veículos.  

Essas ações integram o maior pacote de in… https://t.co/lUNhXAMnVS",965696565074714625,,,965696565074714600,waldezoficial,,,1,1,Thu Aug 05 2021 21:49:39 GMT-0300 (Brasilia Standard Time),Wed Aug 04 2021 20:32:07 GMT-0300 (Brasilia Standard Time)
"Olá, gente! Quero parabenizar os recém-formados do II Curso Tático Operacional Rodoviário (CTOR), promovido pelo Ba… https://t.co/8B2KR3HgaA",965696565074714625,,,965696565074714600,waldezoficial,,,3,7,Thu Aug 05 2021 21:49:39 GMT-0300 (Brasilia Standard Time),Wed Aug 04 2021 20:32:04 GMT-0300 (Brasilia Standard Time)
"O Exército brasileiro é um parceiro do Amapá e muito tem nos ajudado em ações diversas, a exemplo de medidas de pre… https://t.co/ueELP6WlnV",965696565074714625,,,965696565074714600,waldezoficial,,,1,0,Thu Aug 05 2021 21:49:39 GMT-0300 (Brasilia Standard Time),Wed Aug 04 2021 14:27:36 GMT-0300 (Brasilia Standard Time)
Também deixo meus sinceros agradecimentos ao general Adilson Giovani Quint que comandou a brigada nos últimos dois anos.,965696565074714625,,,965696565074714600,waldezoficial,,,1,0,Thu Aug 05 2021 21:49:39 GMT-0300 (Brasilia Standard Time),Wed Aug 04 2021 14:27:36 GMT-0300 (Brasilia Standard Time)
"Olá, gente. Hoje prestigiei a passagem de comando da 22ª Brigada de Infantaria e Selva e reforcei as boas-vindas ao… https://t.co/JzSvrCAqKd",965696565074714625,,,965696565074714600,waldezoficial,,,2,14,Thu Aug 05 2021 21:49:39 GMT-0300 (Brasilia Standard Time),Wed Aug 04 2021 14:27:35 GMT-0300 (Brasilia Standard Time)
"Também quero parabenizo o bronze do Alison dos Santos (no atletismo) e Thiago Braz (no salto com vara).

E para nos… https://t.co/oY9RTBsubZ",965696565074714625,,,965696565074714600,waldezoficial,,,1,1,Thu Aug 05 2021 21:49:39 GMT-0300 (Brasilia Standard Time),Wed Aug 04 2021 12:07:31 GMT-0300 (Brasilia Standard Time)
"Olá, gente. Nossos herois olimpícos enchem o peito de medalhas e nosso coração de orgulho. Estamos em festa com o o… https://t.co/eey67mLNK8",965696565074714625,,,965696565074714600,waldezoficial,,,2,9,Thu Aug 05 2021 21:49:39 GMT-0300 (Brasilia Standard Time),Wed Aug 04 2021 12:07:29 GMT-0300 (Brasilia Standard Time)
"Estamos caminhando para frente, mas não podemos nos descuidar. Mantenham todos os cuidados de prevenção ao coronaví… https://t.co/5m47F7bmsW",965696565074714625,,,965696565074714600,waldezoficial,,,1,1,Thu Aug 05 2021 21:49:39 GMT-0300 (Brasilia Standard Time),Tue Aug 03 2021 11:50:11 GMT-0300 (Brasilia Standard Time)
A abertura de bares a partir da próxima sexta das 10h às 23h está condicionada à apresentação de um protocolo sanit… https://t.co/5n9VCErYWw,965696565074714625,,,965696565074714600,waldezoficial,,,1,4,Thu Aug 05 2021 21:49:39 GMT-0300 (Brasilia Standard Time),Tue Aug 03 2021 11:50:10 GMT-0300 (Brasilia Standard Time)
"Avançamos também com o retorno das atividades presenciais no setor público, ampliamos o número de participantes em… https://t.co/1LgsByuB7K",965696565074714625,,,965696565074714600,waldezoficial,,,2,4,Thu Aug 05 2021 21:49:39 GMT-0300 (Brasilia Standard Time),Tue Aug 03 2021 11:50:10 GMT-0300 (Brasilia Standard Time)
"O novo decreto de proteção à vida e à economia flexibiliza o retorno das aulas presenciais, de forma gradual, para… https://t.co/sMxA8FsmYf",965696565074714625,,,965696565074714600,waldezoficial,,,2,1,Thu Aug 05 2021 21:49:39 GMT-0300 (Brasilia Standard Time),Tue Aug 03 2021 11:50:09 GMT-0300 (Brasilia Standard Time)
"Olá, gente! Nossos esforços para garantir vacina no braço dos amapaenses e a contribuição de todos vocês no respeit… https://t.co/Jr0CahLliB",965696565074714625,,,965696565074714600,waldezoficial,,,3,8,Thu Aug 05 2021 21:49:39 GMT-0300 (Brasilia Standard Time),Tue Aug 03 2021 11:50:08 GMT-0300 (Brasilia Standard Time)
"Olá, gente. A Fortaleza de São José de Macapá é patrimônio de todo amapaense, mas queremos dividi-la com o mundo. A… https://t.co/yPaZwhJXOV",965696565074714625,,,965696565074714600,waldezoficial,,,7,20,Thu Aug 05 2021 21:49:39 GMT-0300 (Brasilia Standard Time),Mon Aug 02 2021 20:39:54 GMT-0300 (Brasilia Standard Time)
Também deixo meu agradecimento ao general Quint por ter comandado a brigada com muita competência e bravura durante dois anos.,965696565074714625,,,965696565074714600,waldezoficial,,,1,5,Thu Aug 05 2021 21:49:39 GMT-0300 (Brasilia Standard Time),Mon Aug 02 2021 19:23:32 GMT-0300 (Brasilia Standard Time)
Afirmei ao novo comandante que daremos continuidade às parcerias com o Exército. Uma delas é o avanço da regulariza… https://t.co/0szHNmixVc,965696565074714625,,,965696565074714600,waldezoficial,,,2,5,Thu Aug 05 2021 21:49:39 GMT-0300 (Brasilia Standard Time),Mon Aug 02 2021 19:23:31 GMT-0300 (Brasilia Standard Time)
"Recebi em meu gabinete o general do Exército João Roberto Albim Gobert Damasceno, que substituirá o general Adilson… https://t.co/3rHgJlaqW3",965696565074714625,,,965696565074714600,waldezoficial,,,2,10,Thu Aug 05 2021 21:49:39 GMT-0300 (Brasilia Standard Time),Mon Aug 02 2021 19:23:31 GMT-0300 (Brasilia Standard Time)
"No que depender de mim e do trabalho do @governoamapa, os moradores da capital terão cada vez mais orgulho da cidad… https://t.co/yEyAxpXTs4",965696565074714625,,,965696565074714600,waldezoficial,,,0,2,Thu Aug 05 2021 21:49:39 GMT-0300 (Brasilia Standard Time),Mon Aug 02 2021 16:29:57 GMT-0300 (Brasilia Standard Time)
"Estamos presentes em Macapá com o PPI do saneamento básico, o regime de colaboração da educação e ações de mobilida… https://t.co/j2G03KJgNb",965696565074714625,,,965696565074714600,waldezoficial,,,1,2,Thu Aug 05 2021 21:49:39 GMT-0300 (Brasilia Standard Time),Mon Aug 02 2021 16:29:57 GMT-0300 (Brasilia Standard Time)
"Também me reuni com o prefeito @dr_furlan e o senador @davialcolumbre para, agora no verão, darmos mais impulso às… https://t.co/jbLr4tc5dB",965696565074714625,,,965696565074714600,waldezoficial,,,1,0,Thu Aug 05 2021 21:49:39 GMT-0300 (Brasilia Standard Time),Mon Aug 02 2021 16:29:56 GMT-0300 (Brasilia Standard Time)
"Olá, gente. Hoje assinei o termo de doação do imóvel onde funciona a Câmara de Vereadores de Macapá para a prefeitu… https://t.co/m8oj0b6sAo",965696565074714625,,,965696565074714600,waldezoficial,,,1,12,Thu Aug 05 2021 21:49:39 GMT-0300 (Brasilia Standard Time),Mon Aug 02 2021 16:29:56 GMT-0300 (Brasilia Standard Time)
"Acredito muito na Justiça amapaense, que sempre tem procurado o melhor para nossa gente com suas ações em favor da… https://t.co/vFbOyphqTg",965696565074714625,,,965696565074714600,waldezoficial,,,1,4,Thu Aug 05 2021 21:49:39 GMT-0300 (Brasilia Standard Time),Mon Aug 02 2021 13:25:45 GMT-0300 (Brasilia Standard Time)
"Olá, gente! Prestigiei a posse do juiz Mário Maruzek, escolhido pelo critério de antiguidade para ser o novo desemb… https://t.co/eklgnajHdF",965696565074714625,,,965696565074714600,waldezoficial,,,1,9,Thu Aug 05 2021 21:49:39 GMT-0300 (Brasilia Standard Time),Mon Aug 02 2021 13:25:43 GMT-0300 (Brasilia Standard Time)
"Através do programa Estado Forte, Povo Seguro, estamos investindo R$ 250 milhões na melhoria da segurança pública d… https://t.co/nocOGiaGR2",965696565074714625,,,965696565074714600,waldezoficial,,,1,2,Thu Aug 05 2021 21:49:39 GMT-0300 (Brasilia Standard Time),Mon Aug 02 2021 11:14:41 GMT-0300 (Brasilia Standard Time)
"Olá, gente! Assistam a este vídeo e vejam porque todo o Amapá tem orgulho do Grupo Tático Aéreo que criei em 2006.… https://t.co/SqWGJQA5O9",965696565074714625,,,965696565074714600,waldezoficial,,,5,16,Thu Aug 05 2021 21:49:39 GMT-0300 (Brasilia Standard Time),Mon Aug 02 2021 11:14:40 GMT-0300 (Brasilia Standard Time)
"Olá, gente. É muito bom ver que nossos esforços para trazer as vacinas contra a Covid-19 para o Amapá estão valendo… https://t.co/J00mO2ce3t",965696565074714625,,,965696565074714600,waldezoficial,,,2,9,Thu Aug 05 2021 21:49:39 GMT-0300 (Brasilia Standard Time),Sun Aug 01 2021 18:02:25 GMT-0300 (Brasilia Standard Time)
Esta última semana olímpica será de muita emoção e eu acredito em novos pódios para fazer nossa gente sorrir.,965696565074714625,,,965696565074714600,waldezoficial,,,1,5,Thu Aug 05 2021 21:49:39 GMT-0300 (Brasilia Standard Time),Sun Aug 01 2021 13:18:14 GMT-0300 (Brasilia Standard Time)
"Parabéns e obrigado, Rebeca. Como foi bom se emocionar com sua vitória. Muito orgulho também das medalhas de bronze… https://t.co/6E2XJ52MRF",965696565074714625,,,965696565074714600,waldezoficial,,,1,5,Thu Aug 05 2021 21:49:39 GMT-0300 (Brasilia Standard Time),Sun Aug 01 2021 13:18:13 GMT-0300 (Brasilia Standard Time)
"Olá, gente! Este é um domingo feliz para o Brasil com mais uma medalha da Rebeca Andrade na ginástica. E dessa vez… https://t.co/hzVFBHGh9D",965696565074714625,,,965696565074714600,waldezoficial,,,2,31,Thu Aug 05 2021 21:49:39 GMT-0300 (Brasilia Standard Time),Sun Aug 01 2021 13:18:13 GMT-0300 (Brasilia Standard Time)
A nova praça também é a garantia que nossa gente trabalhadora terá mais conforto e segurança para vender seus produ… https://t.co/egpJ8qkt8M,965696565074714625,,,965696565074714600,waldezoficial,,,0,2,Thu Aug 05 2021 21:49:39 GMT-0300 (Brasilia Standard Time),Sun Aug 01 2021 12:02:19 GMT-0300 (Brasilia Standard Time)
Começo agosto com uma boa notícia para os amapaenses! As obras de reforma e ampliação da praça de alimentação da Ca… https://t.co/Ak866EGs3C,965696565074714625,,,965696565074714600,waldezoficial,,,3,11,Thu Aug 05 2021 21:49:39 GMT-0300 (Brasilia Standard Time),Sun Aug 01 2021 12:02:19 GMT-0300 (Brasilia Standard Time)
"Atletas de judô, natação, ciclismo, futebol, vôlei, basquete estão entre os beneficiados com esse importante auxíli… https://t.co/xh6dOiMghp",965696565074714625,,,965696565074714600,waldezoficial,,,0,2,Thu Aug 05 2021 21:49:39 GMT-0300 (Brasilia Standard Time),Sun Aug 01 2021 09:41:09 GMT-0300 (Brasilia Standard Time)
As bolsas garantem desde a compra de materiais esportivos até alimentação e passagens para torneios fora do estado.… https://t.co/FD4mq9DiSU,965696565074714625,,,965696565074714600,waldezoficial,,,1,2,Thu Aug 05 2021 21:49:39 GMT-0300 (Brasilia Standard Time),Sun Aug 01 2021 09:41:08 GMT-0300 (Brasilia Standard Time)
"Olá, gente. Apesar da pandemia, este ano investimos mais de R$ 1 milhão no Bolsa Esporte e estamos apoiando 80 jove… https://t.co/qCvDLO8Twk",965696565074714625,,,965696565074714600,waldezoficial,,,2,5,Thu Aug 05 2021 21:49:39 GMT-0300 (Brasilia Standard Time),Sun Aug 01 2021 09:41:08 GMT-0300 (Brasilia Standard Time)
E tem mais notícia boa: contribuiremos com combustível para que a prefeitura atue com máquinas na manutenção de ram… https://t.co/KPaq2i3Nie,965696565074714625,,,965696565074714600,waldezoficial,,,1,3,Thu Aug 05 2021 21:49:39 GMT-0300 (Brasilia Standard Time),Sat Jul 31 2021 20:02:12 GMT-0300 (Brasilia Standard Time)
Também assegurei o apoio para fazer do Centro de Reabilitação de Porto Porto Grande uma referência no atendimento p… https://t.co/MoTKO2G1tA,965696565074714625,,,965696565074714600,waldezoficial,,,1,3,Thu Aug 05 2021 21:49:39 GMT-0300 (Brasilia Standard Time),Sat Jul 31 2021 20:02:12 GMT-0300 (Brasilia Standard Time)
"E para garantir ainda mais avanços para a localidade assinei um convênio no valor de R$ 4,5 milhões para reforçar a… https://t.co/qXxLicCdGE",965696565074714625,,,965696565074714600,waldezoficial,,,1,0,Thu Aug 05 2021 21:49:39 GMT-0300 (Brasilia Standard Time),Sat Jul 31 2021 20:02:11 GMT-0300 (Brasilia Standard Time)
"Olá, gente. Nosso Plano de Mobilidade Urbana Estadual, que contempla Porto Grande com a pavimentação e sinalização… https://t.co/TrQwqgAjiu",965696565074714625,,,965696565074714600,waldezoficial,,,2,6,Thu Aug 05 2021 21:49:39 GMT-0300 (Brasilia Standard Time),Sat Jul 31 2021 20:02:10 GMT-0300 (Brasilia Standard Time)
Estamos no caminho certo para retomar a economia do estado e para conseguir ainda mais avanços para nossa gente.… https://t.co/YQff5Fuyy3,965696565074714625,,,965696565074714600,waldezoficial,,,1,0,Thu Aug 05 2021 21:49:39 GMT-0300 (Brasilia Standard Time),Sat Jul 31 2021 19:03:50 GMT-0300 (Brasilia Standard Time)
"Até o momento, já distribuímos mais de 530.000 doses de vacinas contra a Covid-19 e continuaremos firmes nesse trab… https://t.co/AtlsXRlPwK",965696565074714625,,,965696565074714600,waldezoficial,,,1,2,Thu Aug 05 2021 21:49:39 GMT-0300 (Brasilia Standard Time),Sat Jul 31 2021 19:03:50 GMT-0300 (Brasilia Standard Time)
"Olá, gente! A nossa luta por mais vacinas dá resultados positivos na proteção à saúde e à vida dos amapaenses. Doze… https://t.co/EvrNrAaui6",965696565074714625,,,965696565074714600,waldezoficial,,,1,9,Thu Aug 05 2021 21:49:39 GMT-0300 (Brasilia Standard Time),Sat Jul 31 2021 19:03:49 GMT-0300 (Brasilia Standard Time)
"Obrigado às meninas do futebol brasileiro, ao surfista Gabriel Medina, às skatistas Pâmela Rosa e Leticia Bufoni e… https://t.co/kzvBP0XZ16",965696565074714625,,,965696565074714600,waldezoficial,,,1,2,Thu Aug 05 2021 21:49:39 GMT-0300 (Brasilia Standard Time),Sat Jul 31 2021 17:02:18 GMT-0300 (Brasilia Standard Time)
E parabéns também para Abner Teixeira que já garantiu uma medalha de bronze no boxe e ainda terá a chance de trazer… https://t.co/avHajyYvyk,965696565074714625,,,965696565074714600,waldezoficial,,,1,2,Thu Aug 05 2021 21:49:39 GMT-0300 (Brasilia Standard Time),Sat Jul 31 2021 17:02:17 GMT-0300 (Brasilia Standard Time)
Que maravilha ver o Brasil conquistar uma medalha inédita no tênis em Jogos Olimpícos. Parabéns a Luisa Stefani e L… https://t.co/wNQKOQCpj2,965696565074714625,,,965696565074714600,waldezoficial,,,1,4,Thu Aug 05 2021 21:49:39 GMT-0300 (Brasilia Standard Time),Sat Jul 31 2021 17:02:17 GMT-0300 (Brasilia Standard Time)
"Com parceria, planejamento e trabalho melhoramos a rede de saúde em todo o Amapá.

#GovernoJuntoComAGente",965696565074714625,,,965696565074714600,waldezoficial,,,1,0,Thu Aug 05 2021 21:49:39 GMT-0300 (Brasilia Standard Time),Sat Jul 31 2021 16:23:08 GMT-0300 (Brasilia Standard Time)
Fazemos a nossa parte com investimentos e contamos com parceiros importantes nessa caminhada. Meu muito obrigado ao… https://t.co/6smWyiizFV,965696565074714625,,,965696565074714600,waldezoficial,,,1,1,Thu Aug 05 2021 21:49:39 GMT-0300 (Brasilia Standard Time),Sat Jul 31 2021 16:23:07 GMT-0300 (Brasilia Standard Time)
"Olá, gente. Estamos trabalhando para entregar o Hospital Regional Maria Lúcia no próximo ano. Visitei o andamento d… https://t.co/JdwmzPwA4D",965696565074714625,,,965696565074714600,waldezoficial,,,2,11,Thu Aug 05 2021 21:49:39 GMT-0300 (Brasilia Standard Time),Sat Jul 31 2021 16:23:05 GMT-0300 (Brasilia Standard Time)
"Se já tomou a primeira dose e está na hora de tomar a segunda, não perca tempo. E se chegou sua vez de se vacinar c… https://t.co/jDxpzgTOXF",965696565074714625,,,965696565074714600,waldezoficial,,,0,2,Thu Aug 05 2021 21:49:39 GMT-0300 (Brasilia Standard Time),Sat Jul 31 2021 14:54:37 GMT-0300 (Brasilia Standard Time)
As vacinas foram encaminhadas à Central de Imunobiológicos e nossas equipes farão a distribuição para todo o estado… https://t.co/Rscxu5tCSh,965696565074714625,,,965696565074714600,waldezoficial,,,0,3,Thu Aug 05 2021 21:49:39 GMT-0300 (Brasilia Standard Time),Sat Jul 31 2021 14:54:37 GMT-0300 (Brasilia Standard Time)
Mais um importante reforço para proteger a vida e a saúde de nossa gente chegou ao Amapá este sábado. Recebemos 14.… https://t.co/A98XKJtwri,965696565074714625,,,965696565074714600,waldezoficial,,,3,11,Thu Aug 05 2021 21:49:39 GMT-0300 (Brasilia Standard Time),Sat Jul 31 2021 14:54:37 GMT-0300 (Brasilia Standard Time)
Acompanho de perto e com bastante atenção o trabalho dos meus colegas extensionistas e dos nossos produtores rurais… https://t.co/j4nJEsjoJC,965696565074714625,,,965696565074714600,waldezoficial,,,0,1,Thu Aug 05 2021 21:49:39 GMT-0300 (Brasilia Standard Time),Sat Jul 31 2021 13:31:22 GMT-0300 (Brasilia Standard Time)
Estamos investindo mais de R$ 35 milhões para fortalecer a agricultura familiar com ações que vão além da revitaliz… https://t.co/WUumN3y9IS,965696565074714625,,,965696565074714600,waldezoficial,,,0,1,Thu Aug 05 2021 21:49:39 GMT-0300 (Brasilia Standard Time),Sat Jul 31 2021 13:31:21 GMT-0300 (Brasilia Standard Time)
Agora essa unidade passa a oferecer mais conforto para seus funcionários e mais agilidade e eficiência para os cerc… https://t.co/sS3v9AI1ko,965696565074714625,,,965696565074714600,waldezoficial,,,0,2,Thu Aug 05 2021 21:49:39 GMT-0300 (Brasilia Standard Time),Sat Jul 31 2021 13:31:21 GMT-0300 (Brasilia Standard Time)
"Olá, gente. Garantimos mais uma conquista para dinamizar o setor rural ao entregar o escritório do Rurap em Porto G… https://t.co/IswGBvwqDw",965696565074714625,,,965696565074714600,waldezoficial,,,2,9,Thu Aug 05 2021 21:49:39 GMT-0300 (Brasilia Standard Time),Sat Jul 31 2021 13:31:19 GMT-0300 (Brasilia Standard Time)
"Olá, gente. A nova sede do Quartel do Corpo de Bombeiros é um exemplo das transformações positivas que o programa E… https://t.co/yj8tqSPqWL",965696565074714625,,,965696565074714600,waldezoficial,,,7,26,Thu Aug 05 2021 21:49:39 GMT-0300 (Brasilia Standard Time),Sat Jul 31 2021 09:00:22 GMT-0300 (Brasilia Standard Time)
Agradeço aos moradores de Tartarugalzinho e ao Bruno Mineiro pela homenagem que recebi nesta sexta. Temos muitos se… https://t.co/QjLogt0e9e,965696565074714625,,,965696565074714600,waldezoficial,,,1,2,Thu Aug 05 2021 21:49:39 GMT-0300 (Brasilia Standard Time),Fri Jul 30 2021 22:51:47 GMT-0300 (Brasilia Standard Time)
"E outro para a cessão de 80 mil litros de combustível para o município. 

São ações importantes no processo da reto… https://t.co/2ZaPWHXaje",965696565074714625,,,965696565074714600,waldezoficial,,,1,1,Thu Aug 05 2021 21:49:39 GMT-0300 (Brasilia Standard Time),Fri Jul 30 2021 22:51:47 GMT-0300 (Brasilia Standard Time)
"Olá, gente. Estou trabalhando para vencer a pandemia sem me descuidar de outras frentes. Em Tartarugalzinho, ao lad… https://t.co/ssIQt8VYSb",965696565074714625,,,965696565074714600,waldezoficial,,,1,4,Thu Aug 05 2021 21:49:39 GMT-0300 (Brasilia Standard Time),Fri Jul 30 2021 22:51:47 GMT-0300 (Brasilia Standard Time)
"Com essa ação em Tartarugalzinho, avançamos ainda mais na meta de entregar 50.000 mil cestas a partir do Comida em… https://t.co/QAHB8FObDL",965696565074714625,,,965696565074714600,waldezoficial,,,1,4,Thu Aug 05 2021 21:49:39 GMT-0300 (Brasilia Standard Time),Fri Jul 30 2021 19:25:17 GMT-0300 (Brasilia Standard Time)
"Olá, gente! Estive em Tartarugalzinho e vi de perto a alegria de quem teve sua segurança alimentar garantida com a… https://t.co/hShE8ZMi3G",965696565074714625,,,965696565074714600,waldezoficial,,,3,16,Thu Aug 05 2021 21:49:39 GMT-0300 (Brasilia Standard Time),Fri Jul 30 2021 19:25:16 GMT-0300 (Brasilia Standard Time)
Já distribuímos mais de 530.000 doses de vacina e continuaremos em ritmo acelerado para vencer a pandemia. Vacina n… https://t.co/9mI1w3AzgH,965696565074714625,,,965696565074714600,waldezoficial,,,1,6,Thu Aug 05 2021 21:49:39 GMT-0300 (Brasilia Standard Time),Fri Jul 30 2021 15:23:26 GMT-0300 (Brasilia Standard Time)
"Olá, gente. Julho chegará ao fim com mais um lote de vacinas contra a Covid-19 desembarcando no Amapá. Amanhã chega… https://t.co/TMHXIEEFV2",965696565074714625,,,965696565074714600,waldezoficial,,,4,28,Thu Aug 05 2021 21:49:39 GMT-0300 (Brasilia Standard Time),Fri Jul 30 2021 15:23:25 GMT-0300 (Brasilia Standard Time)
O investimento também abrange a aquisição de viaturas e equipamentos e o reforço das forças de segurança. Na próxim… https://t.co/POXfoTLgq3,965696565074714625,,,965696565074714600,waldezoficial,,,1,0,Thu Aug 05 2021 21:49:39 GMT-0300 (Brasilia Standard Time),Fri Jul 30 2021 12:13:26 GMT-0300 (Brasilia Standard Time)
"Estamos investindo R$ 250 milhões no programa com recursos próprios e de emendas da nossa bancada federal, graças à… https://t.co/JTOPSkxmv3",965696565074714625,,,965696565074714600,waldezoficial,,,1,0,Thu Aug 05 2021 21:49:39 GMT-0300 (Brasilia Standard Time),Fri Jul 30 2021 12:13:25 GMT-0300 (Brasilia Standard Time)
"A unidade é mais um exemplo do sucesso do programa Estado Forte, Povo Seguro, que tem elevado a segurança pública d… https://t.co/QRj2cUzEsx",965696565074714625,,,965696565074714600,waldezoficial,,,1,0,Thu Aug 05 2021 21:49:39 GMT-0300 (Brasilia Standard Time),Fri Jul 30 2021 12:13:25 GMT-0300 (Brasilia Standard Time)
"Olá, gente. Vamos dar um passeio pela nova sede do 6º Batalhão da Polícia Militar, no bairro Perpétuo Socorro, em M… https://t.co/jw7XV3mMcl",965696565074714625,,,965696565074714600,waldezoficial,,,1,0,Thu Aug 05 2021 21:49:39 GMT-0300 (Brasilia Standard Time),Fri Jul 30 2021 12:13:24 GMT-0300 (Brasilia Standard Time)
Investir na educação é um compromisso que tenho desde o meu primeiro dia de governo e fico muito honrado de ver nos… https://t.co/GKdBHkq7Jk,965696565074714625,,,965696565074714600,waldezoficial,,,1,2,Thu Aug 05 2021 21:49:39 GMT-0300 (Brasilia Standard Time),Fri Jul 30 2021 09:03:28 GMT-0300 (Brasilia Standard Time)
"Olá, gente. Liberei recursos extraorçamentários para a Universidade Estadual do Amapá e com isso vamos incrementar… https://t.co/PgcYZhUWEz",965696565074714625,,,965696565074714600,waldezoficial,,,5,19,Thu Aug 05 2021 21:49:39 GMT-0300 (Brasilia Standard Time),Fri Jul 30 2021 09:03:27 GMT-0300 (Brasilia Standard Time)
Vamos continuar trabalhando sério e com muito empenho para garantir vacina no braço da nossa gente e superar essa p… https://t.co/rclgHievfj,965696565074714625,,,965696565074714600,waldezoficial,,,1,2,Thu Aug 05 2021 21:49:39 GMT-0300 (Brasilia Standard Time),Thu Jul 29 2021 20:20:59 GMT-0300 (Brasilia Standard Time)
"Olá, gente. Ultrapassamos a marca das 500 mil doses de vacina contra a Covid-19 distribuídas para todo o estado. Is… https://t.co/KJhbxcbGjR",965696565074714625,,,965696565074714600,waldezoficial,,,2,8,Thu Aug 05 2021 21:49:39 GMT-0300 (Brasilia Standard Time),Thu Jul 29 2021 20:20:59 GMT-0300 (Brasilia Standard Time)
"Durante a reunião, também tratei sobre projetos de lei de grande importância para a gestão fiscal do estado, a exem… https://t.co/OnaawSZVcG",965696565074714625,,,965696565074714600,waldezoficial,,,2,2,Thu Aug 05 2021 21:49:39 GMT-0300 (Brasilia Standard Time),Thu Jul 29 2021 19:04:42 GMT-0300 (Brasilia Standard Time)
"Assim, democratizamos as informações e decisões para o Legislativo e o Judiciário para que todos fiquem cientes do… https://t.co/5ic4qxLQje",965696565074714625,,,965696565074714600,waldezoficial,,,1,2,Thu Aug 05 2021 21:49:39 GMT-0300 (Brasilia Standard Time),Thu Jul 29 2021 19:04:41 GMT-0300 (Brasilia Standard Time)
