text,query,country,city,userId,username,quote_count,reply_count,retweet_count,favorite_count,timestamp,createdAt
Reafirmo que estamos tratando do assunto com muita transparência e seriedade para garantir a proteção da saúde da n… https://t.co/po8MtwP8OK,965696565074714625,,,965696565074714600,waldezoficial,,,2,1,Thu Aug 05 2021 21:49:39 GMT-0300 (Brasilia Standard Time),Thu Jul 29 2021 19:04:41 GMT-0300 (Brasilia Standard Time)
"Olá, gente. Me reuni com o Conselho de Gestão Fiscal e o nosso Comitê Médico e Científico apresentou as últimas inf… https://t.co/ZiKukxL5Yt",965696565074714625,,,965696565074714600,waldezoficial,,,3,5,Thu Aug 05 2021 21:49:39 GMT-0300 (Brasilia Standard Time),Thu Jul 29 2021 19:04:40 GMT-0300 (Brasilia Standard Time)
Esse investimento no Ciodes é apenas uma pequena parte da transformação que estamos fazendo na segurança pública do… https://t.co/ikCKdb8jif,965696565074714625,,,965696565074714600,waldezoficial,,,0,0,Thu Aug 05 2021 21:49:39 GMT-0300 (Brasilia Standard Time),Thu Jul 29 2021 15:31:38 GMT-0300 (Brasilia Standard Time)
"A proteção da nossa gente melhorou muito com o Ciodes e vamos avançar ainda mais. Por meio do Estado Forte, Povo Se… https://t.co/tV6B9hqCTj",965696565074714625,,,965696565074714600,waldezoficial,,,0,1,Thu Aug 05 2021 21:49:39 GMT-0300 (Brasilia Standard Time),Thu Jul 29 2021 15:31:37 GMT-0300 (Brasilia Standard Time)
"Olá, gente. Fiz questão de prestigiar as celebrações pelos 15 anos do Centro Integrado de Operações de Defesa Socia… https://t.co/eRMXx8D4v3",965696565074714625,,,965696565074714600,waldezoficial,,,5,4,Thu Aug 05 2021 21:49:39 GMT-0300 (Brasilia Standard Time),Thu Jul 29 2021 15:31:36 GMT-0300 (Brasilia Standard Time)
"Acompanhei o treinamento dessa força de elite e garanto: temos profissionais bem treinados para ações terrestres, a… https://t.co/0KRzWPJrAw",965696565074714625,,,965696565074714600,waldezoficial,,,1,0,Thu Aug 05 2021 21:49:39 GMT-0300 (Brasilia Standard Time),Thu Jul 29 2021 12:39:56 GMT-0300 (Brasilia Standard Time)
"Reafirmo meu compromisso de fazer, no ano que vem, a aquisição de outra aeronove para o GTA. Desde que foi criado,… https://t.co/THywko2QtA",965696565074714625,,,965696565074714600,waldezoficial,,,1,0,Thu Aug 05 2021 21:49:39 GMT-0300 (Brasilia Standard Time),Thu Jul 29 2021 12:39:53 GMT-0300 (Brasilia Standard Time)
"Olá, gente. Este ano comemoramos 15 anos do Grupo Tático Aéreo, criado por mim em 2006, e nada melhor para celebrar… https://t.co/rrM7NjaUAj",965696565074714625,,,965696565074714600,waldezoficial,,,2,7,Thu Aug 05 2021 21:49:39 GMT-0300 (Brasilia Standard Time),Thu Jul 29 2021 12:39:50 GMT-0300 (Brasilia Standard Time)
Eu acredito no talento e garra dos nossos atletas e ainda teremos muito mais medalhas para celebrar nos Jogos Olímp… https://t.co/1ZzgUxmXO1,965696565074714625,,,965696565074714600,waldezoficial,,,0,2,Thu Aug 05 2021 21:49:39 GMT-0300 (Brasilia Standard Time),Thu Jul 29 2021 10:48:24 GMT-0300 (Brasilia Standard Time)
De Tóquio chegam duas notícias para alegrar o coração da nossa gente. Ganhamos medalhas no judô e na ginástica artí… https://t.co/BhWuySa2su,965696565074714625,,,965696565074714600,waldezoficial,,,1,19,Thu Aug 05 2021 21:49:39 GMT-0300 (Brasilia Standard Time),Thu Jul 29 2021 10:48:23 GMT-0300 (Brasilia Standard Time)
"A nossa meta é distribuir 50 mil cestas e não vou descansar até que esse objetivo seja cumprido. Nesta sexta-feira,… https://t.co/nHZrIGQcgk",965696565074714625,,,965696565074714600,waldezoficial,,,1,0,Thu Aug 05 2021 21:49:39 GMT-0300 (Brasilia Standard Time),Thu Jul 29 2021 09:02:44 GMT-0300 (Brasilia Standard Time)
"A ação mais recente ocorreu ontem no município de Calçoene. Lá, distribuímos 656 cestas de alimentos para famílias… https://t.co/76EC0KmVmT",965696565074714625,,,965696565074714600,waldezoficial,,,1,1,Thu Aug 05 2021 21:49:39 GMT-0300 (Brasilia Standard Time),Thu Jul 29 2021 09:02:43 GMT-0300 (Brasilia Standard Time)
O que vocês vêem nestas fotos? Eu vejo nossa gente carregando esperança em dias melhores ao saber que sua segurança… https://t.co/EekYkRMjSv,965696565074714625,,,965696565074714600,waldezoficial,,,2,8,Thu Aug 05 2021 21:49:39 GMT-0300 (Brasilia Standard Time),Thu Jul 29 2021 09:02:43 GMT-0300 (Brasilia Standard Time)
Essa lista de beneficiados é apenas o pontapé inicial do Amapá Jovem Universitário. Na cerimônia de hoje já autoriz… https://t.co/oU3PpeVG7D,965696565074714625,,,965696565074714600,waldezoficial,,,2,4,Thu Aug 05 2021 21:49:39 GMT-0300 (Brasilia Standard Time),Wed Jul 28 2021 21:48:55 GMT-0300 (Brasilia Standard Time)
"O acadêmico de licenciatura em Química, Zenilton dos Santos, de 21 anos, me contou que a bolsa vai ajudar a suprir… https://t.co/HWukA4PINl",965696565074714625,,,965696565074714600,waldezoficial,,,4,6,Thu Aug 05 2021 21:49:39 GMT-0300 (Brasilia Standard Time),Wed Jul 28 2021 21:48:52 GMT-0300 (Brasilia Standard Time)
"Olá, gente. Tive a honra de participar da aula inaugural do Amapá Jovem Universitário, que já tem 700 jovens inscri… https://t.co/VqfdAR8ZtU",965696565074714625,,,965696565074714600,waldezoficial,,,5,16,Thu Aug 05 2021 21:49:39 GMT-0300 (Brasilia Standard Time),Wed Jul 28 2021 21:48:49 GMT-0300 (Brasilia Standard Time)
Essa lista de 100 beneficiados é apenas o pontapé inicial do Amapá Jovem Universitário. Aproveitei a cerimônia e au… https://t.co/29f0Uq1Jzc,965696565074714625,,,965696565074714600,waldezoficial,,,0,0,Thu Aug 05 2021 21:49:39 GMT-0300 (Brasilia Standard Time),Wed Jul 28 2021 21:02:26 GMT-0300 (Brasilia Standard Time)
"O acadêmico de licenciatura em Química, Zenilton dos Santos me contou que a bolsa vai ajudar a suprir gastos com tr… https://t.co/3FSyutoiz7",965696565074714625,,,965696565074714600,waldezoficial,,,0,0,Thu Aug 05 2021 21:49:39 GMT-0300 (Brasilia Standard Time),Wed Jul 28 2021 21:02:26 GMT-0300 (Brasilia Standard Time)
Reafirmo meu compromisso de que teremos vacina no braço de toda a população adulta do Amapá até o final de setembro… https://t.co/qOnN8CdDOf,965696565074714625,,,965696565074714600,waldezoficial,,,2,5,Thu Aug 05 2021 21:49:39 GMT-0300 (Brasilia Standard Time),Wed Jul 28 2021 19:33:06 GMT-0300 (Brasilia Standard Time)
"Olá, gente! Recebemos 14.770 doses de esperança hoje para reforçar nossa luta contra a Covid-19 no Amapá. Foram 7.7… https://t.co/aQgdMzrmGA",965696565074714625,,,965696565074714600,waldezoficial,,,3,13,Thu Aug 05 2021 21:49:39 GMT-0300 (Brasilia Standard Time),Wed Jul 28 2021 19:33:04 GMT-0300 (Brasilia Standard Time)
Continuarei a visitar outros municípios para a entrega de novos cheques do Frap e assim ajudar os trabalhadores rur… https://t.co/GPfPWgBaPQ,965696565074714625,,,965696565074714600,waldezoficial,,,1,0,Thu Aug 05 2021 21:49:39 GMT-0300 (Brasilia Standard Time),Wed Jul 28 2021 17:31:36 GMT-0300 (Brasilia Standard Time)
Esse é um justo incentivo para a nossa gente do campo que tanto nos ajuda a colocar comida na mesa e a fortalecer a… https://t.co/xJXU3ctuuA,965696565074714625,,,965696565074714600,waldezoficial,,,1,0,Thu Aug 05 2021 21:49:39 GMT-0300 (Brasilia Standard Time),Wed Jul 28 2021 17:31:35 GMT-0300 (Brasilia Standard Time)
É muito bonito ver uma nova geração tão envolvida com as tradições do Amapá e isso nos dá a certeza de que os feste… https://t.co/mbgMyEcbdi,965696565074714625,,,965696565074714600,waldezoficial,,,0,1,Thu Aug 05 2021 21:49:39 GMT-0300 (Brasilia Standard Time),Wed Jul 28 2021 16:23:03 GMT-0300 (Brasilia Standard Time)
"Olá, gente! Estou muito feliz e honrado por ter participado da missa e do círio das crianças que marcaram o encerra… https://t.co/lwq8ECm445",965696565074714625,,,965696565074714600,waldezoficial,,,1,3,Thu Aug 05 2021 21:49:39 GMT-0300 (Brasilia Standard Time),Wed Jul 28 2021 16:23:01 GMT-0300 (Brasilia Standard Time)
Agradeço a Marli por nos ajudar a cuidar tão bem das nossas crianças e jovens e também à @DepMarilia por estar à fr… https://t.co/ghgsdZ8i1q,965696565074714625,,,965696565074714600,waldezoficial,,,1,0,Thu Aug 05 2021 21:49:39 GMT-0300 (Brasilia Standard Time),Wed Jul 28 2021 11:03:23 GMT-0300 (Brasilia Standard Time)
"É um ambiente com atendimento especializado para pessoas com espectro autista que oferece assistência, orientação e… https://t.co/x3zp19D27G",965696565074714625,,,965696565074714600,waldezoficial,,,1,0,Thu Aug 05 2021 21:49:39 GMT-0300 (Brasilia Standard Time),Wed Jul 28 2021 11:03:22 GMT-0300 (Brasilia Standard Time)
"Olá, gente. Convido vocês a assistirem ao lindo depoimento de Marli Mendonça, atendente do espaço Teacolho, que ina… https://t.co/SJmi5wGhEo",965696565074714625,,,965696565074714600,waldezoficial,,,3,5,Thu Aug 05 2021 21:49:39 GMT-0300 (Brasilia Standard Time),Wed Jul 28 2021 11:03:22 GMT-0300 (Brasilia Standard Time)
"Essa ação faz parte de um investimento ainda maior no setor rural, de R$ 35 milhões. Sempre estarei ao lado dos agr… https://t.co/bbubiQkANx",965696565074714625,,,965696565074714600,waldezoficial,,,1,1,Thu Aug 05 2021 21:49:39 GMT-0300 (Brasilia Standard Time),Wed Jul 28 2021 09:35:18 GMT-0300 (Brasilia Standard Time)
"E para ir além desses merecidos parabéns, hoje iremos entregar cheques a agricultores de Mazagão e do Anauerapucu,… https://t.co/whJNqPo7v0",965696565074714625,,,965696565074714600,waldezoficial,,,1,0,Thu Aug 05 2021 21:49:39 GMT-0300 (Brasilia Standard Time),Wed Jul 28 2021 09:35:18 GMT-0300 (Brasilia Standard Time)
"Olá, gente! Hoje é dia de homenagear essa gente que não desiste perante as adversidades, que faz do plantio o seu s… https://t.co/CFqOS3qMB1",965696565074714625,,,965696565074714600,waldezoficial,,,1,8,Thu Aug 05 2021 21:49:39 GMT-0300 (Brasilia Standard Time),Wed Jul 28 2021 09:35:17 GMT-0300 (Brasilia Standard Time)
Muito obrigado aos policiais e oficiais do 6º Batalhão pelo trabalho social realizado junto aos jovens de Macapá e… https://t.co/orr1PUzKka,965696565074714625,,,965696565074714600,waldezoficial,,,1,6,Thu Aug 05 2021 21:49:39 GMT-0300 (Brasilia Standard Time),Tue Jul 27 2021 22:07:42 GMT-0300 (Brasilia Standard Time)
Graças à articulação do senador @davialcolumbre e de @LucasBarreto_AP junto a nossa bancada federal conseguimos rea… https://t.co/WIC1NHtZiH,965696565074714625,,,965696565074714600,waldezoficial,,,3,6,Thu Aug 05 2021 21:49:39 GMT-0300 (Brasilia Standard Time),Tue Jul 27 2021 22:07:41 GMT-0300 (Brasilia Standard Time)
Para que possam desempenhar seu trabalho junto à comunidade da melhor forma. Uma mudança para que vai se refletir n… https://t.co/wt8k6A9C7w,965696565074714625,,,965696565074714600,waldezoficial,,,2,3,Thu Aug 05 2021 21:49:39 GMT-0300 (Brasilia Standard Time),Tue Jul 27 2021 22:07:41 GMT-0300 (Brasilia Standard Time)
"Olá, gente. Vejam que salto de qualidade demos hoje ao 6º Batalhão da Polícia Militar, no bairro Perpétuo Socorro,… https://t.co/0HdA4t4duY",965696565074714625,,,965696565074714600,waldezoficial,,,9,30,Thu Aug 05 2021 21:49:39 GMT-0300 (Brasilia Standard Time),Tue Jul 27 2021 22:07:40 GMT-0300 (Brasilia Standard Time)
Obrigado ao senador Davi e ao prefeito @dr_furlan pelas ações junto comigo em favor da melhoria da orla da capital. https://t.co/Da0Mc55thg,965696565074714625,,,965696565074714600,waldezoficial,,,1,2,Thu Aug 05 2021 21:49:39 GMT-0300 (Brasilia Standard Time),Tue Jul 27 2021 20:17:20 GMT-0300 (Brasilia Standard Time)
"O senador @davialcolumbre junta-se a essa parceria ao destinar R$ 4,3 milhões em emendas que ajudarão a revitalizar… https://t.co/YE5Dasfp8L",965696565074714625,,,965696565074714600,waldezoficial,,,2,4,Thu Aug 05 2021 21:49:39 GMT-0300 (Brasilia Standard Time),Tue Jul 27 2021 20:17:18 GMT-0300 (Brasilia Standard Time)
"Olá, gente. Hoje demos uma importante contribuição para fortalecer o turismo do estado ao repassar para a @PMMacapa… https://t.co/6oGi7K0m6J",965696565074714625,,,965696565074714600,waldezoficial,,,2,5,Thu Aug 05 2021 21:49:39 GMT-0300 (Brasilia Standard Time),Tue Jul 27 2021 20:17:16 GMT-0300 (Brasilia Standard Time)
Parabéns aos futuros policiais militares do Amapá por integrarem essa honrada instituição que é a Polícia Militar d… https://t.co/Tg84xAWfWW,965696565074714625,,,965696565074714600,waldezoficial,,,2,8,Thu Aug 05 2021 21:49:39 GMT-0300 (Brasilia Standard Time),Tue Jul 27 2021 19:06:32 GMT-0300 (Brasilia Standard Time)
"Em agosto eles começarão o curso de formação de soldados. Essa é mais uma ação do Estado Forte, Povo Seguro, o maio… https://t.co/616CmjL7zd",965696565074714625,,,965696565074714600,waldezoficial,,,3,8,Thu Aug 05 2021 21:49:39 GMT-0300 (Brasilia Standard Time),Tue Jul 27 2021 19:06:32 GMT-0300 (Brasilia Standard Time)
A segurança pública do Amapá ganhará o reforço de mais 265 policiais militares que logo estarão nas ruas para prote… https://t.co/oTS1qtpthn,965696565074714625,,,965696565074714600,waldezoficial,,,3,22,Thu Aug 05 2021 21:49:39 GMT-0300 (Brasilia Standard Time),Tue Jul 27 2021 19:06:31 GMT-0300 (Brasilia Standard Time)
Agradeço o cuidado de todos os profissionais envolvidos na recepção e distribuição dos imunizantes. Seguiremos firm… https://t.co/53x63BFxhD,965696565074714625,,,965696565074714600,waldezoficial,,,1,8,Thu Aug 05 2021 21:49:39 GMT-0300 (Brasilia Standard Time),Tue Jul 27 2021 15:41:37 GMT-0300 (Brasilia Standard Time)
"Olá, gente! Recebemos nesta terça 16.400 doses de vacinas pra reforçar nossa batalha contra a Covid-19. E amanhã te… https://t.co/4OazzwuMnc",965696565074714625,,,965696565074714600,waldezoficial,,,6,24,Thu Aug 05 2021 21:49:39 GMT-0300 (Brasilia Standard Time),Tue Jul 27 2021 15:41:34 GMT-0300 (Brasilia Standard Time)
"@Fredfrases Assim, garantimos que nenhuma medida será tomada sem a certeza que a comunidade escolar estará fora de… https://t.co/cBpD74iGHZ",965696565074714625,,,965696565074714600,waldezoficial,,,0,1,Thu Aug 05 2021 21:49:39 GMT-0300 (Brasilia Standard Time),Tue Jul 27 2021 14:46:37 GMT-0300 (Brasilia Standard Time)
"@Fredfrases O retorno só acontecerá após análises de diversos fatores, como avanço na vacinação e diminuição no núm… https://t.co/7NuUNN7K8D",965696565074714625,,,965696565074714600,waldezoficial,,,0,0,Thu Aug 05 2021 21:49:39 GMT-0300 (Brasilia Standard Time),Tue Jul 27 2021 14:46:11 GMT-0300 (Brasilia Standard Time)
"@Fredfrases No momento trabalhamos com uma expectativa de retorno para daqui a um mês, com aulas híbridas e quantid… https://t.co/8ZVTKj1bL1",965696565074714625,,,965696565074714600,waldezoficial,,,0,1,Thu Aug 05 2021 21:49:39 GMT-0300 (Brasilia Standard Time),Tue Jul 27 2021 14:45:41 GMT-0300 (Brasilia Standard Time)
"@Fredfrases Boa tarde, Fred. É nossa responsabilidade estudar, dialogar e planejar o retorno gradual e responsável… https://t.co/zxFQkaU8kQ",965696565074714625,,,965696565074714600,waldezoficial,,,0,1,Thu Aug 05 2021 21:49:39 GMT-0300 (Brasilia Standard Time),Tue Jul 27 2021 14:45:14 GMT-0300 (Brasilia Standard Time)
"Salas de práticas pedagógicas, biblioteca com sala de leitura, refeitório, banheiros, entre outros espaços. Tudo no… https://t.co/ElUhXbUvks",965696565074714625,,,965696565074714600,waldezoficial,,,1,0,Thu Aug 05 2021 21:49:39 GMT-0300 (Brasilia Standard Time),Tue Jul 27 2021 14:28:58 GMT-0300 (Brasilia Standard Time)
"A Escola Maria Neusa Carmo de Souza tem 35 ambientes e foi revitalizada para oferecer melhores condições a alunos,… https://t.co/FU4OwvE9Ba",965696565074714625,,,965696565074714600,waldezoficial,,,1,3,Thu Aug 05 2021 21:49:39 GMT-0300 (Brasilia Standard Time),Tue Jul 27 2021 14:28:58 GMT-0300 (Brasilia Standard Time)
"O novo espaço vai beneficiar cerca de 900 alunos a exemplo de Andressa Oliveira, de 18 anos. Ver a satisfação de jo… https://t.co/6oVoZMEgKR",965696565074714625,,,965696565074714600,waldezoficial,,,1,3,Thu Aug 05 2021 21:49:39 GMT-0300 (Brasilia Standard Time),Tue Jul 27 2021 14:28:56 GMT-0300 (Brasilia Standard Time)
"Olá, gente. Hoje foi mais um dia de alegria para mim e para a nossa comunidade escolar, pois entregamos a nova Esco… https://t.co/L68j2Ee2L5",965696565074714625,,,965696565074714600,waldezoficial,,,6,21,Thu Aug 05 2021 21:49:39 GMT-0300 (Brasilia Standard Time),Tue Jul 27 2021 14:28:54 GMT-0300 (Brasilia Standard Time)
"Vocês são verdadeiros guerreiros, cheios de talento e determinação. Obrigado por nos fazer sorrir, chorar de emoção… https://t.co/EY6fFaoyM7",965696565074714625,,,965696565074714600,waldezoficial,,,1,0,Thu Aug 05 2021 21:49:39 GMT-0300 (Brasilia Standard Time),Tue Jul 27 2021 11:39:24 GMT-0300 (Brasilia Standard Time)
"E muitos aplausos também para Fernando Scheffer, da natação, e para Daniel Cargnin, do judô, pelas medalhas conquis… https://t.co/khY99LWisQ",965696565074714625,,,965696565074714600,waldezoficial,,,1,1,Thu Aug 05 2021 21:49:39 GMT-0300 (Brasilia Standard Time),Tue Jul 27 2021 11:39:24 GMT-0300 (Brasilia Standard Time)
Como é bom ver que tem brasileiro com medalha de ouro no peito nas Olimpíadas de Tóquio. Parabéns ao Ítalo Ferreira… https://t.co/xZpoaM75q2,965696565074714625,,,965696565074714600,waldezoficial,,,1,6,Thu Aug 05 2021 21:49:39 GMT-0300 (Brasilia Standard Time),Tue Jul 27 2021 11:39:22 GMT-0300 (Brasilia Standard Time)
"AO VIVO: Dando continuidade aos serviços de restruturação e modernização da Rede Estadual de Educação, estou entreg… https://t.co/UynDnwDYc5",965696565074714625,,,965696565074714600,waldezoficial,,,1,2,Thu Aug 05 2021 21:49:39 GMT-0300 (Brasilia Standard Time),Tue Jul 27 2021 10:49:45 GMT-0300 (Brasilia Standard Time)
"Agradeço a toda equipe do Mais Visão e ao senador @davialcolumbre pela parceria. É pra isso que a gente trabalha, p… https://t.co/oyyRM7IDc2",965696565074714625,,,965696565074714600,waldezoficial,,,0,1,Thu Aug 05 2021 21:49:39 GMT-0300 (Brasilia Standard Time),Mon Jul 26 2021 20:06:25 GMT-0300 (Brasilia Standard Time)
"E a família dela vai poder comemorar em dobro porque seu filho, o Antônio, em breve também poderá ser atendido pelo… https://t.co/jgupkRfeXm",965696565074714625,,,965696565074714600,waldezoficial,,,1,1,Thu Aug 05 2021 21:49:39 GMT-0300 (Brasilia Standard Time),Mon Jul 26 2021 20:06:23 GMT-0300 (Brasilia Standard Time)
"Olá, gente.

Quando vemos histórias como a da Dona Joana, do Vale do Jari, temos a certeza de que o Mais Visão já m… https://t.co/8zZaf9wbDD",965696565074714625,,,965696565074714600,waldezoficial,,,1,5,Thu Aug 05 2021 21:49:39 GMT-0300 (Brasilia Standard Time),Mon Jul 26 2021 20:06:21 GMT-0300 (Brasilia Standard Time)
"A todos os avôs e avós amapaenses, desejo que sejam abençoados com muita saúde para acompanhar de perto o crescimen… https://t.co/2aX6JxDeTB",965696565074714625,,,965696565074714600,waldezoficial,,,1,6,Thu Aug 05 2021 21:49:39 GMT-0300 (Brasilia Standard Time),Mon Jul 26 2021 18:17:26 GMT-0300 (Brasilia Standard Time)
"Gabriel, Valentina, Sophia, Antonella, Antônio Neto e Maju, vocês fazem do coração do Vô Waldez uma casa sempre che… https://t.co/4kG2vyPe4N",965696565074714625,,,965696565074714600,waldezoficial,,,0,7,Thu Aug 05 2021 21:49:39 GMT-0300 (Brasilia Standard Time),Mon Jul 26 2021 18:17:25 GMT-0300 (Brasilia Standard Time)
"Só tenho a agradecer a Deus e aos meus filhos Tom, minha nora Rosiane, Vânia, Jade e Luna por me darem o privilégio… https://t.co/8buFrwDdik",965696565074714625,,,965696565074714600,waldezoficial,,,1,2,Thu Aug 05 2021 21:49:39 GMT-0300 (Brasilia Standard Time),Mon Jul 26 2021 18:17:25 GMT-0300 (Brasilia Standard Time)
"Gente, hoje é o Dia dos Avós, uma data especial demais para mim porque celebra um dos papéis que eu e @DepMarilia m… https://t.co/FsKM9iX7K5",965696565074714625,,,965696565074714600,waldezoficial,,,1,22,Thu Aug 05 2021 21:49:39 GMT-0300 (Brasilia Standard Time),Mon Jul 26 2021 18:17:21 GMT-0300 (Brasilia Standard Time)
Ver que a escola está reformada e pronta para o retorno gradual das aulas me enche de esperança por saber que estam… https://t.co/acyGpK6Mv1,965696565074714625,,,965696565074714600,waldezoficial,,,3,9,Thu Aug 05 2021 21:49:39 GMT-0300 (Brasilia Standard Time),Mon Jul 26 2021 17:05:51 GMT-0300 (Brasilia Standard Time)
"A instituição é uma grande referência em ensino para todo o Amapá e, vem conseguindo, anos após ano, aumentar o índ… https://t.co/gXxQ0G9KxI",965696565074714625,,,965696565074714600,waldezoficial,,,3,8,Thu Aug 05 2021 21:49:39 GMT-0300 (Brasilia Standard Time),Mon Jul 26 2021 17:05:50 GMT-0300 (Brasilia Standard Time)
E essa entrega tem um significado ainda mais especial porque essa escola foi uma das primeiras a aderir à educação… https://t.co/DelI4d6Rqk,965696565074714625,,,965696565074714600,waldezoficial,,,0,1,Thu Aug 05 2021 21:49:39 GMT-0300 (Brasilia Standard Time),Mon Jul 26 2021 17:05:50 GMT-0300 (Brasilia Standard Time)
"Olá, gente! Começamos a semana entregando a nova versão da Escola do Novo Saber Maria do Carmo Viana dos Anjos, que… https://t.co/AVQtdnKXnM",965696565074714625,,,965696565074714600,waldezoficial,,,5,13,Thu Aug 05 2021 21:49:39 GMT-0300 (Brasilia Standard Time),Mon Jul 26 2021 17:05:49 GMT-0300 (Brasilia Standard Time)
"Meu muito obrigado à população de Laranjal, ao prefeito Márcio Serrão e ao vice-prefeito João Tadeu. Contem comigo sempre!",965696565074714625,,,965696565074714600,waldezoficial,,,0,3,Thu Aug 05 2021 21:49:39 GMT-0300 (Brasilia Standard Time),Mon Jul 26 2021 11:08:54 GMT-0300 (Brasilia Standard Time)
Tenho trabalhado firmemente para levar ainda mais desenvolvimento ao município e esse reconhecimento é mais um ince… https://t.co/LGdEsUiIXf,965696565074714625,,,965696565074714600,waldezoficial,,,0,3,Thu Aug 05 2021 21:49:39 GMT-0300 (Brasilia Standard Time),Mon Jul 26 2021 11:08:54 GMT-0300 (Brasilia Standard Time)
"Olá, gente. É com muito orgulho que partilho com vocês essa bela homenagem que recebi da prefeitura de Laranjal do… https://t.co/iEsZ1b7SgD",965696565074714625,,,965696565074714600,waldezoficial,,,2,12,Thu Aug 05 2021 21:49:39 GMT-0300 (Brasilia Standard Time),Mon Jul 26 2021 11:08:52 GMT-0300 (Brasilia Standard Time)
"Olá, gente! Estou entregando a ampliação dos novos ambientes da Escola do Novo Saber Maria do Carmo Viana dos Anjos… https://t.co/7HbAc4a7px",965696565074714625,,,965696565074714600,waldezoficial,,,1,4,Thu Aug 05 2021 21:49:39 GMT-0300 (Brasilia Standard Time),Mon Jul 26 2021 10:29:23 GMT-0300 (Brasilia Standard Time)
Vamos reforçar a proteção de nossa gente esta semana com mais 31.170 doses de vacina contra a Covid-19. Os primeiro… https://t.co/qdaw5P6f8c,965696565074714625,,,965696565074714600,waldezoficial,,,5,17,Thu Aug 05 2021 21:49:39 GMT-0300 (Brasilia Standard Time),Mon Jul 26 2021 09:14:48 GMT-0300 (Brasilia Standard Time)
"A luta por mais vacinas e para proteger a nossa gente é constante. Se chegou a sua vez de se vacinar, não deixe de… https://t.co/XPUcpEXNuV",965696565074714625,,,965696565074714600,waldezoficial,,,1,8,Thu Aug 05 2021 21:49:39 GMT-0300 (Brasilia Standard Time),Sun Jul 25 2021 19:19:36 GMT-0300 (Brasilia Standard Time)
"Olá, gente. Vamos começar mais uma semana fazendo a nossa parte para que em setembro toda a população adulta do Ama… https://t.co/88nJtHFCwr",965696565074714625,,,965696565074714600,waldezoficial,,,4,18,Thu Aug 05 2021 21:49:39 GMT-0300 (Brasilia Standard Time),Sun Jul 25 2021 19:19:36 GMT-0300 (Brasilia Standard Time)
"Parabéns, Raulian! O Amapá torce por você! https://t.co/dXenQdhyQN",965696565074714625,,,965696565074714600,waldezoficial,,,4,20,Thu Aug 05 2021 21:49:39 GMT-0300 (Brasilia Standard Time),Sun Jul 25 2021 14:51:49 GMT-0300 (Brasilia Standard Time)
Brado é um simpático e valente integrante do Corpo de Bombeiros que está sendo treinado para resgate. O conheci na… https://t.co/1O06yu9rzc,965696565074714625,,,965696565074714600,waldezoficial,,,1,13,Thu Aug 05 2021 21:49:39 GMT-0300 (Brasilia Standard Time),Sun Jul 25 2021 14:00:23 GMT-0300 (Brasilia Standard Time)
"Domingo em família registrado por @DepMarilia, repleto de amor na companhia da Antonella e da Sara. Recarregando as… https://t.co/kAkbuAf3AR",965696565074714625,,,965696565074714600,waldezoficial,,,1,51,Thu Aug 05 2021 21:49:39 GMT-0300 (Brasilia Standard Time),Sun Jul 25 2021 12:53:58 GMT-0300 (Brasilia Standard Time)
Hoje celebramos o Dia de São Tiago com muita esperança e fé de que no próximo ano faremos uma festa como o povo do… https://t.co/7LDD2oTuY9,965696565074714625,,,965696565074714600,waldezoficial,,,3,24,Thu Aug 05 2021 21:49:39 GMT-0300 (Brasilia Standard Time),Sun Jul 25 2021 08:00:26 GMT-0300 (Brasilia Standard Time)
E também a construção de passarelas com emenda do senador @davialcolumbre e bancada Federal junto ao… https://t.co/rKXnDVgRuA,965696565074714625,,,965696565074714600,waldezoficial,,,1,1,Thu Aug 05 2021 21:49:39 GMT-0300 (Brasilia Standard Time),Sat Jul 24 2021 16:50:08 GMT-0300 (Brasilia Standard Time)
"Os convênios possibilitarão a aquisição de combustível para manutenção de ramais, limpeza urbana, e mais mobilidade… https://t.co/DdXL9aZp6H",965696565074714625,,,965696565074714600,waldezoficial,,,1,3,Thu Aug 05 2021 21:49:39 GMT-0300 (Brasilia Standard Time),Sat Jul 24 2021 16:50:08 GMT-0300 (Brasilia Standard Time)
"Olá, gente! Em mais uma agenda no Vale do Jari, desta vez no município de Vitória do Jari. Celebramos novas conquis… https://t.co/Dga1D59nVF",965696565074714625,,,965696565074714600,waldezoficial,,,4,13,Thu Aug 05 2021 21:49:39 GMT-0300 (Brasilia Standard Time),Sat Jul 24 2021 16:50:07 GMT-0300 (Brasilia Standard Time)
