text,query,country,city,userId,username,quote_count,reply_count,retweet_count,favorite_count,timestamp,createdAt
"Aproveito para agradecer a parceria do senador @davialcolumbre, que está sempre empenhado em somar forças para traz… https://t.co/nYy9ntExuD",965696565074714625,,,965696565074714600,waldezoficial,,,1,2,Thu Aug 05 2021 21:49:39 GMT-0300 (Brasilia Standard Time),Sat Jul 24 2021 15:56:00 GMT-0300 (Brasilia Standard Time)
"Muito trabalho em todas as frentes para dar uma melhor qualidade de vida à população do Sul do nosso Estado. E, no… https://t.co/omi4lUtczq",965696565074714625,,,965696565074714600,waldezoficial,,,1,2,Thu Aug 05 2021 21:49:39 GMT-0300 (Brasilia Standard Time),Sat Jul 24 2021 15:55:59 GMT-0300 (Brasilia Standard Time)
"Além disso, acompanhamos de perto a alegria de quem é atendido pelo Mais Visão e, dessa forma, pode voltar a ver a… https://t.co/j38xpGKBpY",965696565074714625,,,965696565074714600,waldezoficial,,,1,0,Thu Aug 05 2021 21:49:39 GMT-0300 (Brasilia Standard Time),Sat Jul 24 2021 15:55:57 GMT-0300 (Brasilia Standard Time)
"Gente, ontem tivemos um dia cheio de compromissos muito especiais em Laranjal do Jari. Entregamos cadeiras de rodas… https://t.co/V2au8SdHSX",965696565074714625,,,965696565074714600,waldezoficial,,,5,9,Thu Aug 05 2021 21:49:39 GMT-0300 (Brasilia Standard Time),Sat Jul 24 2021 15:55:56 GMT-0300 (Brasilia Standard Time)
Nesta visita ao Jari tenho a satisfação de anunciar que liberamos um financiamento para que agricultores locais faç… https://t.co/tiW4AEpdVk,965696565074714625,,,965696565074714600,waldezoficial,,,6,8,Thu Aug 05 2021 21:49:39 GMT-0300 (Brasilia Standard Time),Sat Jul 24 2021 13:00:23 GMT-0300 (Brasilia Standard Time)
A usina de oxigênio que Laranjal do Jari recebeu após minha articulação e do senador @davialcolumbre junto ao… https://t.co/KiDQZJ7HnN,965696565074714625,,,965696565074714600,waldezoficial,,,1,1,Thu Aug 05 2021 21:49:39 GMT-0300 (Brasilia Standard Time),Sat Jul 24 2021 08:33:10 GMT-0300 (Brasilia Standard Time)
Os equipamentos são para os novos leitos semi-intensivos no hospital destinados aos pacientes com casos de maior gr… https://t.co/zmAvD5pENr,965696565074714625,,,965696565074714600,waldezoficial,,,1,1,Thu Aug 05 2021 21:49:39 GMT-0300 (Brasilia Standard Time),Sat Jul 24 2021 08:33:10 GMT-0300 (Brasilia Standard Time)
"Olá, gente. Estamos reforçando a estrutura do Hospital Estadual de Laranjal do Jari com novos equipamentos. Essa me… https://t.co/FhLG6A9j9X",965696565074714625,,,965696565074714600,waldezoficial,,,3,8,Thu Aug 05 2021 21:49:39 GMT-0300 (Brasilia Standard Time),Sat Jul 24 2021 08:33:09 GMT-0300 (Brasilia Standard Time)
"Assim, motoristas e pedestres ganham mais segurança para se deslocar. Uma via revitalizada evita acidentes e result… https://t.co/Cbv8ZAEx5j",965696565074714625,,,965696565074714600,waldezoficial,,,1,0,Thu Aug 05 2021 21:49:39 GMT-0300 (Brasilia Standard Time),Fri Jul 23 2021 20:53:37 GMT-0300 (Brasilia Standard Time)
"Essa é uma ação integrada entre nosso governo e o senador @davialcolumbre, capitaneando a bancada federal. 

Nosso… https://t.co/G1bXfVcbCz",965696565074714625,,,965696565074714600,waldezoficial,,,1,1,Thu Aug 05 2021 21:49:39 GMT-0300 (Brasilia Standard Time),Fri Jul 23 2021 20:53:37 GMT-0300 (Brasilia Standard Time)
"Olá, gente. Já entregamos 27km de obras de mobilidade em Laranjal do Jari e hoje avançamos ainda mais, pois garanti… https://t.co/oM4rMfKViU",965696565074714625,,,965696565074714600,waldezoficial,,,2,9,Thu Aug 05 2021 21:49:39 GMT-0300 (Brasilia Standard Time),Fri Jul 23 2021 20:53:36 GMT-0300 (Brasilia Standard Time)
"Desde setembro de 2020, o Mais Visão já realizou mais de 165 mil atendimentos. E vamos avançar dia a dia para benef… https://t.co/AxOBAeSP4o",965696565074714625,,,965696565074714600,waldezoficial,,,1,2,Thu Aug 05 2021 21:49:39 GMT-0300 (Brasilia Standard Time),Fri Jul 23 2021 18:51:06 GMT-0300 (Brasilia Standard Time)
"O Mais Visão é uma ação integrada do nosso governo com o senador @davialcolumbre, que batalhou para que não faltass… https://t.co/vRVRLjL5BP",965696565074714625,,,965696565074714600,waldezoficial,,,1,2,Thu Aug 05 2021 21:49:39 GMT-0300 (Brasilia Standard Time),Fri Jul 23 2021 18:51:05 GMT-0300 (Brasilia Standard Time)
Hoje em Laranjal do Jari testemunhei a alegria de quem receberá tratamento adequado e poderá voltar a enxergar a vi… https://t.co/poGAs7Yt0K,965696565074714625,,,965696565074714600,waldezoficial,,,2,11,Thu Aug 05 2021 21:49:39 GMT-0300 (Brasilia Standard Time),Fri Jul 23 2021 18:51:05 GMT-0300 (Brasilia Standard Time)
"No total, o Super Fácil de Laranjal do Jari reúne 26 órgãos e mais de 150 serviços que antes eram oferecidos na cap… https://t.co/eTcqIpIjQw",965696565074714625,,,965696565074714600,waldezoficial,,,2,4,Thu Aug 05 2021 21:49:39 GMT-0300 (Brasilia Standard Time),Fri Jul 23 2021 16:43:45 GMT-0300 (Brasilia Standard Time)
"A propósito, faço um agradecimento à deputada @DepMarilia, pois é uma entusiasta das políticas públicas ligadas ao… https://t.co/6kVyFqiQtJ",965696565074714625,,,965696565074714600,waldezoficial,,,1,4,Thu Aug 05 2021 21:49:39 GMT-0300 (Brasilia Standard Time),Fri Jul 23 2021 16:43:43 GMT-0300 (Brasilia Standard Time)
"Olá, gente. Inauguramos a sede revitalizada do Super Fácil em Laranjal do Jari e agregamos novos serviços para melh… https://t.co/7wCP5oqSKW",965696565074714625,,,965696565074714600,waldezoficial,,,3,12,Thu Aug 05 2021 21:49:39 GMT-0300 (Brasilia Standard Time),Fri Jul 23 2021 16:43:41 GMT-0300 (Brasilia Standard Time)
"Com o Mais Visão, que tem um importante suporte do senador @davialcolumbre, vamos realizar 10.000 mil cirurgias par… https://t.co/1CVvkmQWX0",965696565074714625,,,965696565074714600,waldezoficial,,,2,0,Thu Aug 05 2021 21:49:39 GMT-0300 (Brasilia Standard Time),Fri Jul 23 2021 13:40:50 GMT-0300 (Brasilia Standard Time)
"Olá, gente. Estou cumprindo uma extensa agenda em Laranjal do Jari para garantir melhorias para a região. Nossa açã… https://t.co/GqE4rC3s5B",965696565074714625,,,965696565074714600,waldezoficial,,,3,12,Thu Aug 05 2021 21:49:39 GMT-0300 (Brasilia Standard Time),Fri Jul 23 2021 13:40:49 GMT-0300 (Brasilia Standard Time)
Fico feliz de poder contribuir para que cada vez mais amapaenses tenham comida na mesa e esperança em dias melhores… https://t.co/V56c0qOmbr,965696565074714625,,,965696565074714600,waldezoficial,,,3,4,Thu Aug 05 2021 21:49:39 GMT-0300 (Brasilia Standard Time),Fri Jul 23 2021 10:05:49 GMT-0300 (Brasilia Standard Time)
"Olá, gente. Já entregamos cerca de 70% das 50.000 cestas de alimentos do programa Comida em Casa. Esta semana levam… https://t.co/ZbtTBRNTpF",965696565074714625,,,965696565074714600,waldezoficial,,,1,5,Thu Aug 05 2021 21:49:39 GMT-0300 (Brasilia Standard Time),Fri Jul 23 2021 10:05:48 GMT-0300 (Brasilia Standard Time)
"Olá, gente. Quero convidar vocês a reforçarem a nossa campanha de vacinação contra a Covid-19. Juntos, vamos vencer… https://t.co/7FmqK03NgN",965696565074714625,,,965696565074714600,waldezoficial,,,6,25,Thu Aug 05 2021 21:49:39 GMT-0300 (Brasilia Standard Time),Fri Jul 23 2021 08:00:20 GMT-0300 (Brasilia Standard Time)
"Também ficamos responsáveis pelo palco, tendas e sonorização das missas campais. E no domingo, dia de São Tiago, as… https://t.co/5rocyk8akv",965696565074714625,,,965696565074714600,waldezoficial,,,1,4,Thu Aug 05 2021 21:49:39 GMT-0300 (Brasilia Standard Time),Thu Jul 22 2021 22:01:47 GMT-0300 (Brasilia Standard Time)
"E para que ela ocorra da melhor forma possível, estamos dando todo o apoio à prefeitura e à comunidade de Mazagão.… https://t.co/5kVzhIjtv6",965696565074714625,,,965696565074714600,waldezoficial,,,1,6,Thu Aug 05 2021 21:49:39 GMT-0300 (Brasilia Standard Time),Thu Jul 22 2021 22:01:47 GMT-0300 (Brasilia Standard Time)
"Olá, gente. Que saudades dos encontros, abraços e da energia da festa de São Tiago. Este ano teremos uma festa rest… https://t.co/7CgxybCVDe",965696565074714625,,,965696565074714600,waldezoficial,,,1,19,Thu Aug 05 2021 21:49:39 GMT-0300 (Brasilia Standard Time),Thu Jul 22 2021 22:01:42 GMT-0300 (Brasilia Standard Time)
E nada melhor do que ter nossas competentes monitoras do Amapá Jovem à frente desse trabalho de conscientização tão… https://t.co/fxhV6sQhPV,965696565074714625,,,965696565074714600,waldezoficial,,,0,3,Thu Aug 05 2021 21:49:39 GMT-0300 (Brasilia Standard Time),Thu Jul 22 2021 21:26:26 GMT-0300 (Brasilia Standard Time)
A campanha será executada por etapas. A arrecadação e distribuição de 8.000 absorventes para mulheres em situação d… https://t.co/mNotU8AlVj,965696565074714625,,,965696565074714600,waldezoficial,,,1,3,Thu Aug 05 2021 21:49:39 GMT-0300 (Brasilia Standard Time),Thu Jul 22 2021 21:26:25 GMT-0300 (Brasilia Standard Time)
O projeto nasceu de um requerimento da deputada @DepMarilia e terá coordenação da Sejuv. Felicito a deputada pela v… https://t.co/v7WSQAFIgo,965696565074714625,,,965696565074714600,waldezoficial,,,1,1,Thu Aug 05 2021 21:49:39 GMT-0300 (Brasilia Standard Time),Thu Jul 22 2021 21:26:25 GMT-0300 (Brasilia Standard Time)
"Olá, gente! Hoje tivemos o lançamento de uma campanha para promover informação e cuidado com a saúde íntima das mul… https://t.co/mVb71mMVIs",965696565074714625,,,965696565074714600,waldezoficial,,,4,9,Thu Aug 05 2021 21:49:39 GMT-0300 (Brasilia Standard Time),Thu Jul 22 2021 21:26:24 GMT-0300 (Brasilia Standard Time)
Tenho a confiança de que ele fará um trabalho de excelência para promover o desenvolvimento urbano de nossas cidade… https://t.co/011bB8EikX,965696565074714625,,,965696565074714600,waldezoficial,,,2,1,Thu Aug 05 2021 21:49:39 GMT-0300 (Brasilia Standard Time),Thu Jul 22 2021 19:23:19 GMT-0300 (Brasilia Standard Time)
"Olá, gente. Nossa equipe foi reforçada hoje para continuar a levar o melhor para os amapaenses. Empossei em meu gab… https://t.co/qOZAA8DyoI",965696565074714625,,,965696565074714600,waldezoficial,,,3,8,Thu Aug 05 2021 21:49:39 GMT-0300 (Brasilia Standard Time),Thu Jul 22 2021 19:23:18 GMT-0300 (Brasilia Standard Time)
"Nesta semana recebemos Pfizer, Astrazeneca e Coronavac. Mas lembre-se que não existe uma vacina melhor do que a out… https://t.co/VGPfgWIr7n",965696565074714625,,,965696565074714600,waldezoficial,,,1,3,Thu Aug 05 2021 21:49:39 GMT-0300 (Brasilia Standard Time),Thu Jul 22 2021 17:38:20 GMT-0300 (Brasilia Standard Time)
Essa é a maior remessa de vacinas que já recebemos e os imunizantes estão sendo distribuídos em todos os municípios… https://t.co/B99F0JZkXA,965696565074714625,,,965696565074714600,waldezoficial,,,1,1,Thu Aug 05 2021 21:49:39 GMT-0300 (Brasilia Standard Time),Thu Jul 22 2021 17:38:19 GMT-0300 (Brasilia Standard Time)
"Olá, gente. Chegaram ao Amapá 26.910 doses da Pfizer hoje e assim concluímos o recebimento das 54.110 doses de vaci… https://t.co/BOhh2xmSiT",965696565074714625,,,965696565074714600,waldezoficial,,,4,15,Thu Aug 05 2021 21:49:39 GMT-0300 (Brasilia Standard Time),Thu Jul 22 2021 17:38:18 GMT-0300 (Brasilia Standard Time)
"E tem outra boa notícia: entregamos mais um escritório do Rurap, completamente estruturado para atender aos produto… https://t.co/H8Emf0THsl",965696565074714625,,,965696565074714600,waldezoficial,,,0,3,Thu Aug 05 2021 21:49:39 GMT-0300 (Brasilia Standard Time),Thu Jul 22 2021 16:27:43 GMT-0300 (Brasilia Standard Time)
São obras importantes para fortalecer a educação no município e formar cidadãos ainda mais preparados para o futuro… https://t.co/uDX4hpDurU,965696565074714625,,,965696565074714600,waldezoficial,,,1,3,Thu Aug 05 2021 21:49:39 GMT-0300 (Brasilia Standard Time),Thu Jul 22 2021 16:27:40 GMT-0300 (Brasilia Standard Time)
"Gente, sigo com uma agenda intensa em Itaubal em parceria com a prefeitura e o senador @davialcolumbre. Finalizamos… https://t.co/X0GJCpypOW",965696565074714625,,,965696565074714600,waldezoficial,,,3,5,Thu Aug 05 2021 21:49:39 GMT-0300 (Brasilia Standard Time),Thu Jul 22 2021 16:27:38 GMT-0300 (Brasilia Standard Time)
Essa ação faz parte do nosso Plano Rodoviário Estadual. Estamos investindo mais de R$ 156 milhões na revitalização… https://t.co/cdKetzFjdS,965696565074714625,,,965696565074714600,waldezoficial,,,2,2,Thu Aug 05 2021 21:49:39 GMT-0300 (Brasilia Standard Time),Thu Jul 22 2021 14:06:38 GMT-0300 (Brasilia Standard Time)
Vamos melhorar o deslocamento na região e alavancar o desenvolvimento econômico do leste do Amapá. https://t.co/xPU5MlEJ8V,965696565074714625,,,965696565074714600,waldezoficial,,,4,7,Thu Aug 05 2021 21:49:39 GMT-0300 (Brasilia Standard Time),Thu Jul 22 2021 14:06:37 GMT-0300 (Brasilia Standard Time)
"Olá, gente! Tenho uma ótima notícia para os moradores da comunidade de Carmo do Macacoari, em Itaubal. Ao lado do s… https://t.co/YPklfouNMf",965696565074714625,,,965696565074714600,waldezoficial,,,7,12,Thu Aug 05 2021 21:49:39 GMT-0300 (Brasilia Standard Time),Thu Jul 22 2021 14:06:34 GMT-0300 (Brasilia Standard Time)
"Ao longo da semana, entregaremos cadeiras de rodas para melhorar a acessibilidade de quem precisa, vamos inaugurar… https://t.co/IOPNlgv5u7",965696565074714625,,,965696565074714600,waldezoficial,,,2,3,Thu Aug 05 2021 21:49:39 GMT-0300 (Brasilia Standard Time),Wed Jul 21 2021 19:50:17 GMT-0300 (Brasilia Standard Time)
"Olá, gente. Estamos com uma grande ação no Vale do Jari em diversas áreas. Começamos hoje uma nova ação do Mais Vis… https://t.co/SdQ5VQ3iR0",965696565074714625,,,965696565074714600,waldezoficial,,,10,13,Thu Aug 05 2021 21:49:39 GMT-0300 (Brasilia Standard Time),Wed Jul 21 2021 19:50:16 GMT-0300 (Brasilia Standard Time)
