text,query,country,city,userId,username,quote_count,reply_count,retweet_count,favorite_count,timestamp,createdAt
"Dá pra acreditar que essa área, com capacidade para instalação de 108 módulos industriais, seria leiolada para a iniciativa privada?",32101740,,,32101740,ronaldocaiado,,,1,31,Thu Aug 05 2021 21:49:42 GMT-0300 (Brasilia Standard Time),Tue Jul 27 2021 17:37:08 GMT-0300 (Brasilia Standard Time)
Hoje foi dia de corrigir mais uma das injustiças deixadas pela gestão passada. Assinamos a transferência de uma áre… https://t.co/osJFZedHh6,32101740,,,32101740,ronaldocaiado,,,3,53,Thu Aug 05 2021 21:49:42 GMT-0300 (Brasilia Standard Time),Tue Jul 27 2021 17:37:07 GMT-0300 (Brasilia Standard Time)
@clara_plenaeco Aqui cuidamos da nossa gente. Os Quilombolas estão recebendo grandes serviços em nosso governo. Aqu… https://t.co/RZXPIzgIf9,32101740,,,32101740,ronaldocaiado,,,1,11,Thu Aug 05 2021 21:49:42 GMT-0300 (Brasilia Standard Time),Tue Jul 27 2021 10:14:45 GMT-0300 (Brasilia Standard Time)
"RT @governogoias: O perímetro urbano da GO-010, em Luziânia, não vai sofrer mais com as fortes chuvas. 💪 Isso porque o trabalho para substi…",32101740,,,32101740,ronaldocaiado,,,3,0,Thu Aug 05 2021 21:49:42 GMT-0300 (Brasilia Standard Time),Tue Jul 27 2021 10:11:55 GMT-0300 (Brasilia Standard Time)
"Tomei a Pneumo13, que ajuda a previnir complicações de doenças como pneumonia, meningite e otite. É muito important… https://t.co/jVIdHBeutG",32101740,,,32101740,ronaldocaiado,,,4,27,Thu Aug 05 2021 21:49:42 GMT-0300 (Brasilia Standard Time),Mon Jul 26 2021 18:00:04 GMT-0300 (Brasilia Standard Time)
"Minha gente, como vocês sabem, para mim saúde é coisa séria. Ao lado do meu amigo e deputado federal… https://t.co/U4vulonUfc",32101740,,,32101740,ronaldocaiado,,,3,60,Thu Aug 05 2021 21:49:42 GMT-0300 (Brasilia Standard Time),Mon Jul 26 2021 18:00:02 GMT-0300 (Brasilia Standard Time)
"Tem 386.460 novas doses de vacinas chegando ao nosso Estado, minha gente! 🙌  Vem ver nossa agenda semanal. 💉💪

Terç… https://t.co/uEXiLO3wvV",32101740,,,32101740,ronaldocaiado,,,15,213,Thu Aug 05 2021 21:49:42 GMT-0300 (Brasilia Standard Time),Mon Jul 26 2021 11:00:01 GMT-0300 (Brasilia Standard Time)
"Neste dia de Nossa Senhora de Sant’Ana volto os meus olhos a cada uma das famílias que perderam um ente querido, pe… https://t.co/ZZt4B0rDz6",32101740,,,32101740,ronaldocaiado,,,4,27,Thu Aug 05 2021 21:49:42 GMT-0300 (Brasilia Standard Time),Mon Jul 26 2021 09:06:56 GMT-0300 (Brasilia Standard Time)
"Começo a semana de um jeito especial, pedindo a Nossa Senhora de Sant’Ana, padroeira de Goiás, bênçãos e proteção p… https://t.co/F2Vqwgy9Cc",32101740,,,32101740,ronaldocaiado,,,5,67,Thu Aug 05 2021 21:49:42 GMT-0300 (Brasilia Standard Time),Mon Jul 26 2021 09:06:55 GMT-0300 (Brasilia Standard Time)
"E hoje, de joelhos dobrados, pedi a Deus e a Nossa Senhora de Sant’Ana sabedoria e forças para  continuar fazendo d… https://t.co/p5FD7z6k5Q",32101740,,,32101740,ronaldocaiado,,,2,41,Thu Aug 05 2021 21:49:42 GMT-0300 (Brasilia Standard Time),Sun Jul 25 2021 18:01:20 GMT-0300 (Brasilia Standard Time)
"Este foi o trecho que fui convidado a ler durante a missa em louvor à Nossa Senhora de Sant’Ana, na Igreja Matriz,… https://t.co/7fyGCtL2rp",32101740,,,32101740,ronaldocaiado,,,3,27,Thu Aug 05 2021 21:49:42 GMT-0300 (Brasilia Standard Time),Sun Jul 25 2021 18:01:20 GMT-0300 (Brasilia Standard Time)
"“Vos exorto a caminhardes de acordo com a vocação que recebestes, com toda a humildade e mansidão, suportando-vos u… https://t.co/9CKKuG7oJG",32101740,,,32101740,ronaldocaiado,,,5,91,Thu Aug 05 2021 21:49:42 GMT-0300 (Brasilia Standard Time),Sun Jul 25 2021 18:01:19 GMT-0300 (Brasilia Standard Time)
"Visitar este local é reviver nossas raízes e encontrar parte da identidade do nosso povo. Será que minha preta, Gra… https://t.co/ZBVUbFHB6L",32101740,,,32101740,ronaldocaiado,,,5,29,Thu Aug 05 2021 21:49:42 GMT-0300 (Brasilia Standard Time),Sun Jul 25 2021 15:40:17 GMT-0300 (Brasilia Standard Time)
"Hoje, no aniversário de 294 anos da Cidade de Goiás, tive a alegria de visitar o lugar que deu origem a tudo: o dis… https://t.co/Qsm5ZMs04v",32101740,,,32101740,ronaldocaiado,,,9,91,Thu Aug 05 2021 21:49:42 GMT-0300 (Brasilia Standard Time),Sun Jul 25 2021 15:40:16 GMT-0300 (Brasilia Standard Time)
E não tem um só dia que eu não seja grato a tudo que aprendi com o município. Viva a cidade de Goiás.,32101740,,,32101740,ronaldocaiado,,,5,39,Thu Aug 05 2021 21:49:42 GMT-0300 (Brasilia Standard Time),Sun Jul 25 2021 08:39:05 GMT-0300 (Brasilia Standard Time)
"Foi lá que aprendi com os meus antepassados a importância de voltar os olhos para as pessoas, a cuidar da nossa gen… https://t.co/EIefF8Bslg",32101740,,,32101740,ronaldocaiado,,,5,38,Thu Aug 05 2021 21:49:42 GMT-0300 (Brasilia Standard Time),Sun Jul 25 2021 08:39:05 GMT-0300 (Brasilia Standard Time)
"Eu sou suspeito para falar da minha querida cidade de Goiás. Foi lá que passei parte da minha infância, aprendi a m… https://t.co/6p0B7IgQsz",32101740,,,32101740,ronaldocaiado,,,9,93,Thu Aug 05 2021 21:49:42 GMT-0300 (Brasilia Standard Time),Sun Jul 25 2021 08:39:04 GMT-0300 (Brasilia Standard Time)
"Por isso, ter a oportunidade de reformar este espaço é tão valoroso para mim e para todos os goianos. É devolver ao… https://t.co/vD3aAFHXEX",32101740,,,32101740,ronaldocaiado,,,5,34,Thu Aug 05 2021 21:49:42 GMT-0300 (Brasilia Standard Time),Sat Jul 24 2021 22:06:52 GMT-0300 (Brasilia Standard Time)
"O prédio foi a primeira construção no estilo Art Déco do Estado, levantada entre 1928 e 1929, fruto do trabalho vis… https://t.co/EPqGD6kFbk",32101740,,,32101740,ronaldocaiado,,,4,38,Thu Aug 05 2021 21:49:42 GMT-0300 (Brasilia Standard Time),Sat Jul 24 2021 22:06:50 GMT-0300 (Brasilia Standard Time)
"Na cidade de Goiás inauguramos o Palácio da Instrução completamente revitalizado, um verdadeiro presente para os 29… https://t.co/mfcdFfWdUo",32101740,,,32101740,ronaldocaiado,,,11,70,Thu Aug 05 2021 21:49:42 GMT-0300 (Brasilia Standard Time),Sat Jul 24 2021 22:06:48 GMT-0300 (Brasilia Standard Time)
"Aos familiares e amigos, toda a nossa solidariedade, que Deus conforte o coração de cada um de vocês neste momento.",32101740,,,32101740,ronaldocaiado,,,1,29,Thu Aug 05 2021 21:49:42 GMT-0300 (Brasilia Standard Time),Sat Jul 24 2021 18:34:42 GMT-0300 (Brasilia Standard Time)
Já o Coronel da Reserva Remunerada Heber de Souza Lima exerceu várias funções de destaque na instituição. Ele estav… https://t.co/cms8kSvYI1,32101740,,,32101740,ronaldocaiado,,,1,30,Thu Aug 05 2021 21:49:42 GMT-0300 (Brasilia Standard Time),Sat Jul 24 2021 18:34:42 GMT-0300 (Brasilia Standard Time)
"O Cabo Rafael Machado Tavares ingressou na Corporação em 2014 e era lotado no 7º Batalhão de Polícia Militar, estav… https://t.co/vmttYetwGT",32101740,,,32101740,ronaldocaiado,,,0,14,Thu Aug 05 2021 21:49:42 GMT-0300 (Brasilia Standard Time),Sat Jul 24 2021 18:34:41 GMT-0300 (Brasilia Standard Time)
Foi com imenso pesar que Gracinha Caiado e eu recebemos a notícia do falecimento de dois heróis das nossas forças p… https://t.co/8B5SMnUEQI,32101740,,,32101740,ronaldocaiado,,,6,71,Thu Aug 05 2021 21:49:42 GMT-0300 (Brasilia Standard Time),Sat Jul 24 2021 18:34:41 GMT-0300 (Brasilia Standard Time)
"Está tudo prontinho para comportar formações, além de incluir um setor equipado com alojamento e laboratórios com t… https://t.co/Pl7KNyV2ux",32101740,,,32101740,ronaldocaiado,,,2,28,Thu Aug 05 2021 21:49:42 GMT-0300 (Brasilia Standard Time),Sat Jul 24 2021 12:06:26 GMT-0300 (Brasilia Standard Time)
Foram quase R$ 20 milhões investidos para a construção da nova sede e reestruturação do Centro de Treinamento e Cap… https://t.co/PGSPkHCyyl,32101740,,,32101740,ronaldocaiado,,,3,32,Thu Aug 05 2021 21:49:42 GMT-0300 (Brasilia Standard Time),Sat Jul 24 2021 12:06:23 GMT-0300 (Brasilia Standard Time)
A inauguração da nova sede da @EmaterGoias foi emblemática e faz com que aquilo que foi dilapidado em gestões anter… https://t.co/xz5rsjfi4V,32101740,,,32101740,ronaldocaiado,,,6,44,Thu Aug 05 2021 21:49:42 GMT-0300 (Brasilia Standard Time),Sat Jul 24 2021 12:06:22 GMT-0300 (Brasilia Standard Time)
Dá pra acreditar que 168.182 pessoas não retornaram para tomar a segunda dose da vacina contra a Covid-19? Uma só d… https://t.co/Rj6QeN5CXY,32101740,,,32101740,ronaldocaiado,,,22,139,Thu Aug 05 2021 21:49:42 GMT-0300 (Brasilia Standard Time),Sat Jul 24 2021 09:00:43 GMT-0300 (Brasilia Standard Time)
📚 E é claro que a nossa Educação também fez parte do roteiro. Em reunião com a secretária Fátima Gavioli e com prof… https://t.co/iwAohzDRd2,32101740,,,32101740,ronaldocaiado,,,2,22,Thu Aug 05 2021 21:49:42 GMT-0300 (Brasilia Standard Time),Fri Jul 23 2021 22:33:47 GMT-0300 (Brasilia Standard Time)
"🚔 Acompanhamos as obras de restauração do 6°Batalhão da Polícia Militar. O prédio têm importância histórica, minha… https://t.co/bYV7PqAUWe",32101740,,,32101740,ronaldocaiado,,,2,25,Thu Aug 05 2021 21:49:42 GMT-0300 (Brasilia Standard Time),Fri Jul 23 2021 22:33:45 GMT-0300 (Brasilia Standard Time)
"🏥 Visitamos a Policlínica Regional Rio Vermelho que já está quase pronta, falta só 10% para a obra ser entregue. Es… https://t.co/fKwyfm1mjX",32101740,,,32101740,ronaldocaiado,,,0,5,Thu Aug 05 2021 21:49:42 GMT-0300 (Brasilia Standard Time),Fri Jul 23 2021 22:33:43 GMT-0300 (Brasilia Standard Time)
"🛣 Fizemos vistoria nas obras da GO-070, no trecho entre Mossâmedes e a Cidade de Goiás. Durante a gestão passada a… https://t.co/06rzTkx0lT",32101740,,,32101740,ronaldocaiado,,,0,5,Thu Aug 05 2021 21:49:42 GMT-0300 (Brasilia Standard Time),Fri Jul 23 2021 22:33:42 GMT-0300 (Brasilia Standard Time)
"Vocês sabem, minha gente, a minha meta é cuidar de 7,2 milhões de goianos. No nosso governo, a maior preocupação é… https://t.co/UIHp5sTKZG",32101740,,,32101740,ronaldocaiado,,,6,67,Thu Aug 05 2021 21:49:42 GMT-0300 (Brasilia Standard Time),Fri Jul 23 2021 22:33:40 GMT-0300 (Brasilia Standard Time)
Não é à toa que já conquistamos o 7º lugar no ranking dos Estados mais digitalizados. O meu desejo é que nesses trê… https://t.co/Ukf7LwC7gl,32101740,,,32101740,ronaldocaiado,,,2,26,Thu Aug 05 2021 21:49:42 GMT-0300 (Brasilia Standard Time),Fri Jul 23 2021 12:46:12 GMT-0300 (Brasilia Standard Time)
#CampusParty O maior evento de ciência e tecnologia do mundo está em Goiás na sua 3ª edição. É notório o quanto ava… https://t.co/FqsHtnyPNJ,32101740,,,32101740,ronaldocaiado,,,6,55,Thu Aug 05 2021 21:49:42 GMT-0300 (Brasilia Standard Time),Fri Jul 23 2021 12:46:12 GMT-0300 (Brasilia Standard Time)
RT @g1goias: Quem passar trote para serviços de emergência será multado em até R$ 3 mil em Goiás ==&gt; https://t.co/bgpi3OZXgL #G1GO https://…,32101740,,,32101740,ronaldocaiado,,,5,0,Thu Aug 05 2021 21:49:42 GMT-0300 (Brasilia Standard Time),Fri Jul 23 2021 09:23:13 GMT-0300 (Brasilia Standard Time)
RT @fatimagavioli: O Governador Ronaldo Caiado segue pagando diferenças salariais da Educação devidas desde os anos 1990! Só no ano de 2021…,32101740,,,32101740,ronaldocaiado,,,2,0,Thu Aug 05 2021 21:49:42 GMT-0300 (Brasilia Standard Time),Fri Jul 23 2021 09:22:34 GMT-0300 (Brasilia Standard Time)
"Até setembro já estaremos na faixa dos 18 anos, cada dia mais perto de voltar à nossa tão sonhada normalidade. 🙏🏼",32101740,,,32101740,ronaldocaiado,,,7,56,Thu Aug 05 2021 21:49:42 GMT-0300 (Brasilia Standard Time),Fri Jul 23 2021 08:50:28 GMT-0300 (Brasilia Standard Time)
"Se tem jeito melhor de iniciar a sexta do que com uma notícia assim eu desconheço, minha gente. Graças ao nosso tra… https://t.co/tiIFa3ECBI",32101740,,,32101740,ronaldocaiado,,,11,94,Thu Aug 05 2021 21:49:42 GMT-0300 (Brasilia Standard Time),Fri Jul 23 2021 08:50:28 GMT-0300 (Brasilia Standard Time)
"🌆 Não tem nada melhor que finalizar o dia com uma imagem dessa. O pôr do sol aqui em Goiás é mesmo diferenciado, né… https://t.co/X47nxzCWMn",32101740,,,32101740,ronaldocaiado,,,6,183,Thu Aug 05 2021 21:49:42 GMT-0300 (Brasilia Standard Time),Thu Jul 22 2021 18:59:45 GMT-0300 (Brasilia Standard Time)
"Vocês, educadores, merecem todo o nosso reconhecimento.",32101740,,,32101740,ronaldocaiado,,,4,31,Thu Aug 05 2021 21:49:42 GMT-0300 (Brasilia Standard Time),Thu Jul 22 2021 15:37:22 GMT-0300 (Brasilia Standard Time)
"Mas a espera acabou, minha gente, para 3,5 mil trabalhadores. Podem saber que esse reconhecido será gradual e consi… https://t.co/K0yvMVdi9G",32101740,,,32101740,ronaldocaiado,,,4,26,Thu Aug 05 2021 21:49:42 GMT-0300 (Brasilia Standard Time),Thu Jul 22 2021 15:37:21 GMT-0300 (Brasilia Standard Time)
📚💰 A progressão dos profissionais da Educação sempre foi um desafio muito cobrado na nossa gestão. Por muitas vezes… https://t.co/6iNcqRpJn8,32101740,,,32101740,ronaldocaiado,,,7,45,Thu Aug 05 2021 21:49:42 GMT-0300 (Brasilia Standard Time),Thu Jul 22 2021 15:37:21 GMT-0300 (Brasilia Standard Time)
"RT @jornal_opopular: Segundo o governador, a Polícia Militar de Goiás já tomou as providências necessárias para averiguar o caso

📲 Leia Ag…",32101740,,,32101740,ronaldocaiado,,,5,0,Thu Aug 05 2021 21:49:42 GMT-0300 (Brasilia Standard Time),Thu Jul 22 2021 13:20:27 GMT-0300 (Brasilia Standard Time)
"RT @jornalopcao: Caiado fala sobre caso de agressão a advogado em Goiânia: “Não tenho dúvida, está nítido [que houve excesso]” https://t.co…",32101740,,,32101740,ronaldocaiado,,,5,0,Thu Aug 05 2021 21:49:42 GMT-0300 (Brasilia Standard Time),Thu Jul 22 2021 13:20:19 GMT-0300 (Brasilia Standard Time)
RT @portal6anapolis: Caiado se manifesta sobre episódio entre policiais do Giro e advogado - Portal 6 https://t.co/1HjzLIV2XD,32101740,,,32101740,ronaldocaiado,,,2,0,Thu Aug 05 2021 21:49:42 GMT-0300 (Brasilia Standard Time),Thu Jul 22 2021 12:45:18 GMT-0300 (Brasilia Standard Time)
"RT @jornalohoje: “Esses excessos, eles não serão admitidos de maneira alguma”, afirmou o governador, durante entrevista coletiva. 

https:/…",32101740,,,32101740,ronaldocaiado,,,2,0,Thu Aug 05 2021 21:49:42 GMT-0300 (Brasilia Standard Time),Thu Jul 22 2021 12:45:08 GMT-0300 (Brasilia Standard Time)
"RT @Asbraer_oficial: Em Morrinhos (GO), governador Ronaldo Caiado faz entrega de produtos do Programa de Aquisição de Alimentos (PAA Estadu…",32101740,,,32101740,ronaldocaiado,,,3,0,Thu Aug 05 2021 21:49:42 GMT-0300 (Brasilia Standard Time),Thu Jul 22 2021 12:34:07 GMT-0300 (Brasilia Standard Time)
"RT @aredacao: ""Excessos não serão admitidos"", diz Caiado sobre PM que agrediu advogado https://t.co/nW3BfojeVh https://t.co/i3uwHC00XP",32101740,,,32101740,ronaldocaiado,,,6,0,Thu Aug 05 2021 21:49:42 GMT-0300 (Brasilia Standard Time),Thu Jul 22 2021 12:26:41 GMT-0300 (Brasilia Standard Time)
"Em dose dupla é ainda melhor, minha gente! A AstraZeneca já está em solo goiano. E a gente tá como? 🕺🏻Recebemos 156… https://t.co/vvc7yZ9D4U",32101740,,,32101740,ronaldocaiado,,,7,125,Thu Aug 05 2021 21:49:42 GMT-0300 (Brasilia Standard Time),Thu Jul 22 2021 08:36:39 GMT-0300 (Brasilia Standard Time)
🖥 Nossa agenda terminou com a entrega da reforma do Vapt Vupt. Uma obra com mais de R$ 65 mil investidos e que já c… https://t.co/aa8oRr2QcO,32101740,,,32101740,ronaldocaiado,,,3,23,Thu Aug 05 2021 21:49:42 GMT-0300 (Brasilia Standard Time),Wed Jul 21 2021 19:19:49 GMT-0300 (Brasilia Standard Time)
"📚 Entregamos a reforma do Colégio Estadual Mariquita da Costa, com quase R$ 210 mil aplicados. Ainda assinamos orde… https://t.co/JkmFmOP51p",32101740,,,32101740,ronaldocaiado,,,2,32,Thu Aug 05 2021 21:49:42 GMT-0300 (Brasilia Standard Time),Wed Jul 21 2021 19:19:49 GMT-0300 (Brasilia Standard Time)
"Com investimentos de R$ 5,9 milhões, em parceria com o prefeito Joaquim Guilherme Barbosa,
entregamos 56 casas no R… https://t.co/8Hg72BvwA5",32101740,,,32101740,ronaldocaiado,,,0,5,Thu Aug 05 2021 21:49:42 GMT-0300 (Brasilia Standard Time),Wed Jul 21 2021 19:19:47 GMT-0300 (Brasilia Standard Time)
"🚨Instalamos o 36º Batalhão da PM, entregamos 13 viaturas e inauguramos a Central de Assepsia do Corpo de Bombeiros… https://t.co/a8g96milYi",32101740,,,32101740,ronaldocaiado,,,4,39,Thu Aug 05 2021 21:49:42 GMT-0300 (Brasilia Standard Time),Wed Jul 21 2021 19:19:46 GMT-0300 (Brasilia Standard Time)
"🛬 Começamos com o aeródromo de Morrinhos, um investimento de mais de R$ 45,6 mil. Esse é o 20° dos 28 que ainda ser… https://t.co/7zsKmXGMZN",32101740,,,32101740,ronaldocaiado,,,2,20,Thu Aug 05 2021 21:49:42 GMT-0300 (Brasilia Standard Time),Wed Jul 21 2021 19:19:44 GMT-0300 (Brasilia Standard Time)
"E hoje o dia foi como, minha gente? Em Morrinhos, do jeito que eu gosto, cheio de entregas pra nossa gente! Dá uma… https://t.co/s38FKFYxlU",32101740,,,32101740,ronaldocaiado,,,3,43,Thu Aug 05 2021 21:49:42 GMT-0300 (Brasilia Standard Time),Wed Jul 21 2021 19:19:42 GMT-0300 (Brasilia Standard Time)
"RT @aredacao: RESIDENCIAL CRISTINA PARK - Caiado entrega 56 moradias durante visita a Morrinhos. Investimento total foi de R$ 5,9 milhões.…",32101740,,,32101740,ronaldocaiado,,,3,0,Thu Aug 05 2021 21:49:42 GMT-0300 (Brasilia Standard Time),Wed Jul 21 2021 16:59:12 GMT-0300 (Brasilia Standard Time)
"RT @aredacao: POLÍTICA - Caiado entrega obras em Batalhão da PM, aeródromo e bombeiros de Morrinhos. Governo enviou 13 viaturas ao municípi…",32101740,,,32101740,ronaldocaiado,,,4,0,Thu Aug 05 2021 21:49:42 GMT-0300 (Brasilia Standard Time),Wed Jul 21 2021 16:18:54 GMT-0300 (Brasilia Standard Time)
RT @podergoias: Governo de Goiás cria mais três benefícios para auxílio à população impactada pela pandemia - via @podergoias https://t.co/…,32101740,,,32101740,ronaldocaiado,,,8,0,Thu Aug 05 2021 21:49:42 GMT-0300 (Brasilia Standard Time),Wed Jul 21 2021 16:18:42 GMT-0300 (Brasilia Standard Time)
"RT @portaldiaonline: A proposição pede a criação da Bolsa Qualificação, Bolsa Alfabetizador e Auxílio Alimentação, que agora segue para a s…",32101740,,,32101740,ronaldocaiado,,,3,0,Thu Aug 05 2021 21:49:42 GMT-0300 (Brasilia Standard Time),Wed Jul 21 2021 10:41:16 GMT-0300 (Brasilia Standard Time)
"A espera pela Pfizer acabou, minha gente! Recebemos 43.290 novas doses do imunizante que serão utilizados para apli… https://t.co/RwZmPubrN8",32101740,,,32101740,ronaldocaiado,,,12,119,Thu Aug 05 2021 21:49:42 GMT-0300 (Brasilia Standard Time),Wed Jul 21 2021 09:20:50 GMT-0300 (Brasilia Standard Time)
"É como eu sempre digo, sempre teremos a mão forte do Estado em cada lugar para darmos a todo cidadão que mora em Go… https://t.co/ginW4utuYZ",32101740,,,32101740,ronaldocaiado,,,1,20,Thu Aug 05 2021 21:49:42 GMT-0300 (Brasilia Standard Time),Wed Jul 21 2021 09:15:53 GMT-0300 (Brasilia Standard Time)
"As mães com filhos de até seis anos, em situação de vulnerabilidade social no cadastro único, poderão contar com benefício mensal de R$250.",32101740,,,32101740,ronaldocaiado,,,1,24,Thu Aug 05 2021 21:49:42 GMT-0300 (Brasilia Standard Time),Wed Jul 21 2021 09:15:53 GMT-0300 (Brasilia Standard Time)
"Estamos voltando nossa atenção para os mais vulneráveis, minha gente. O nosso projeto que cria o Programa Mães de G… https://t.co/nVtX1WrHg5",32101740,,,32101740,ronaldocaiado,,,6,60,Thu Aug 05 2021 21:49:42 GMT-0300 (Brasilia Standard Time),Wed Jul 21 2021 09:15:52 GMT-0300 (Brasilia Standard Time)
"RT @amiltonfilho: Benefício mensal de R$ 250 e a meta é alcançar cerca de 95 mil famílias. De autoria do @governogoias, programa mostra uma…",32101740,,,32101740,ronaldocaiado,,,3,0,Thu Aug 05 2021 21:49:42 GMT-0300 (Brasilia Standard Time),Tue Jul 20 2021 20:17:54 GMT-0300 (Brasilia Standard Time)
"É como eu sempre digo, sempre teremos a mão forte do Estado em cada lugar para darmos a todo cidadão que mora em Go… https://t.co/JbnFM3GFpI",32101740,,,32101740,ronaldocaiado,,,5,25,Thu Aug 05 2021 21:49:42 GMT-0300 (Brasilia Standard Time),Tue Jul 20 2021 20:15:32 GMT-0300 (Brasilia Standard Time)
"As mães com filhos de até seis anos, em situação de vulnerabilidade social no cadastro único, poderão contar com benefício mensal de R$250.",32101740,,,32101740,ronaldocaiado,,,5,25,Thu Aug 05 2021 21:49:42 GMT-0300 (Brasilia Standard Time),Tue Jul 20 2021 20:15:31 GMT-0300 (Brasilia Standard Time)
"Estamos voltando nossa atenção para os mais vulneráveis, minha gente. O nosso projeto que cria o Programa Mães de G… https://t.co/o6ryeadwuc",32101740,,,32101740,ronaldocaiado,,,10,46,Thu Aug 05 2021 21:49:42 GMT-0300 (Brasilia Standard Time),Tue Jul 20 2021 20:15:31 GMT-0300 (Brasilia Standard Time)
RT @portal6anapolis: Projeto de Caiado que cria auxílio financeiro para mães de baixa renda é aprovado  https://t.co/c7quPOD2eS,32101740,,,32101740,ronaldocaiado,,,2,0,Thu Aug 05 2021 21:49:42 GMT-0300 (Brasilia Standard Time),Tue Jul 20 2021 20:10:05 GMT-0300 (Brasilia Standard Time)
"RT @podergoias: ‘Estamos voltando a atenção para os mais vulneráveis’, diz Caiado sobre aprovação do Mães de Goiás - via @podergoias https:…",32101740,,,32101740,ronaldocaiado,,,8,0,Thu Aug 05 2021 21:49:42 GMT-0300 (Brasilia Standard Time),Tue Jul 20 2021 18:40:35 GMT-0300 (Brasilia Standard Time)
RT @aredacao: EXTREMA POBREZA - Caiado sobre auxílio às mães em Goiás: 'Atenção para os mais vulneráveis'. Apoio de R$ 250 foi aprovado na…,32101740,,,32101740,ronaldocaiado,,,3,0,Thu Aug 05 2021 21:49:42 GMT-0300 (Brasilia Standard Time),Tue Jul 20 2021 18:40:30 GMT-0300 (Brasilia Standard Time)
RT @JornalGoyaz: VÍDEO 🎥 | Caiado anuncia ajuda monetária de R$ 250 para mães que estiverem cadastradas no;  *Alego Agora* - Mães de Goiás…,32101740,,,32101740,ronaldocaiado,,,4,0,Thu Aug 05 2021 21:49:42 GMT-0300 (Brasilia Standard Time),Tue Jul 20 2021 18:26:57 GMT-0300 (Brasilia Standard Time)
"RT @aredacao: R$ 250 - Assembleia Legislativa de Goiás aprova auxílio para mães em extrema pobreza. Em vídeo, Caiado celebra avanço da prop…",32101740,,,32101740,ronaldocaiado,,,3,0,Thu Aug 05 2021 21:49:42 GMT-0300 (Brasilia Standard Time),Tue Jul 20 2021 18:26:51 GMT-0300 (Brasilia Standard Time)
Vamos dar capacidade e fortalecer o setor que aquece a economia e alimenta nossa gente. #ÉPorVocêQueAGenteFaz https://t.co/YrF0Lcr5Ye,32101740,,,32101740,ronaldocaiado,,,4,20,Thu Aug 05 2021 21:49:42 GMT-0300 (Brasilia Standard Time),Tue Jul 20 2021 17:34:10 GMT-0300 (Brasilia Standard Time)
"Hoje entregamos caminhões basculantes no valor de mais de R$ 4,7 milhões para 17 municípios goianos durante a abert… https://t.co/WnIVsbxQA7",32101740,,,32101740,ronaldocaiado,,,4,20,Thu Aug 05 2021 21:49:42 GMT-0300 (Brasilia Standard Time),Tue Jul 20 2021 17:34:07 GMT-0300 (Brasilia Standard Time)
Atuamos fortemente para dar infraestrutura e condições de energizar áreas que estavam totalmente desassistidas no E… https://t.co/4WhTxuqkTu,32101740,,,32101740,ronaldocaiado,,,6,41,Thu Aug 05 2021 21:49:42 GMT-0300 (Brasilia Standard Time),Tue Jul 20 2021 17:34:05 GMT-0300 (Brasilia Standard Time)
@a_limpeza Informação aí é falsa. https://t.co/UmC8C0sIRe,32101740,,,32101740,ronaldocaiado,,,0,0,Thu Aug 05 2021 21:49:42 GMT-0300 (Brasilia Standard Time),Tue Jul 20 2021 12:43:43 GMT-0300 (Brasilia Standard Time)
RT @aredacao: Caiado anuncia novo lote com quase 200 mil vacinas contra covid-19. É a segunda remessa destinada ao Estado nesta semana http…,32101740,,,32101740,ronaldocaiado,,,4,0,Thu Aug 05 2021 21:49:42 GMT-0300 (Brasilia Standard Time),Tue Jul 20 2021 12:42:45 GMT-0300 (Brasilia Standard Time)
RT @jornalopcao: Vêm mais vacina aí: Caiado anuncia a chegada de mais 199.54 doses do imunizante contra a Covid https://t.co/NaRpwW84nz,32101740,,,32101740,ronaldocaiado,,,2,0,Thu Aug 05 2021 21:49:42 GMT-0300 (Brasilia Standard Time),Tue Jul 20 2021 12:42:38 GMT-0300 (Brasilia Standard Time)
Tem mais vacina chegando hoje em nosso Estado! Vamos receber para 1ª e 2ª dose mais 156.250 imunizantes da AstraZen… https://t.co/ty1XYvY1kP,32101740,,,32101740,ronaldocaiado,,,24,265,Thu Aug 05 2021 21:49:42 GMT-0300 (Brasilia Standard Time),Tue Jul 20 2021 10:07:07 GMT-0300 (Brasilia Standard Time)
"RT @Kaamis_: Aaaoh meu Goiás terra de pequi, de sertanejo, de Caiado e de povo vacinado https://t.co/aT45ldmh4Y",32101740,,,32101740,ronaldocaiado,,,2,0,Thu Aug 05 2021 21:49:42 GMT-0300 (Brasilia Standard Time),Tue Jul 20 2021 09:43:51 GMT-0300 (Brasilia Standard Time)
"🤩 Notícia boa logo cedo? É claro que temos, minha gente! Uma nova remessa de vacinas já está em solo goiano: 37.400… https://t.co/xu89znTsMU",32101740,,,32101740,ronaldocaiado,,,14,116,Thu Aug 05 2021 21:49:42 GMT-0300 (Brasilia Standard Time),Tue Jul 20 2021 08:47:43 GMT-0300 (Brasilia Standard Time)
"📚 Ainda assinamos ordem de serviço para a construção do Colégio Estadual Germana Gomes, em Divinópolis, com investi… https://t.co/W13LBeTo74",32101740,,,32101740,ronaldocaiado,,,3,25,Thu Aug 05 2021 21:49:42 GMT-0300 (Brasilia Standard Time),Mon Jul 19 2021 20:03:10 GMT-0300 (Brasilia Standard Time)
https://t.co/FEFD1RxtVY,32101740,,,32101740,ronaldocaiado,,,3,22,Thu Aug 05 2021 21:49:42 GMT-0300 (Brasilia Standard Time),Mon Jul 19 2021 20:03:09 GMT-0300 (Brasilia Standard Time)
🛣 Ninguém precisa mais desviar pela Bahia para chegar em Goiás. Estamos investindo R$ 106 milhões para pavimentar 6… https://t.co/O6sVcQa53V,32101740,,,32101740,ronaldocaiado,,,6,64,Thu Aug 05 2021 21:49:42 GMT-0300 (Brasilia Standard Time),Mon Jul 19 2021 20:03:07 GMT-0300 (Brasilia Standard Time)
