text,query,country,city,userId,username,quote_count,reply_count,retweet_count,favorite_count,timestamp,createdAt
"O discurso do presidente na Cúpula de Líderes sobre o Clima seria ótimo para um início do mandato. Infelizmente, ho… https://t.co/6dyAATS0lb",2726301380,,,2726301380,lhmandetta,,,88,922,Thu Aug 05 2021 21:49:59 GMT-0300 (Brasilia Standard Time),Thu Apr 22 2021 14:38:07 GMT-0300 (Brasilia Standard Time)
@JoaoEnsina @VillaMarcovilla @tvcultura @arthurmoledoval @CanalMyNews @o_antagonista @sandraannenberg… https://t.co/UiCL8fpN8e,2726301380,,,2726301380,lhmandetta,,,2,178,Thu Aug 05 2021 21:49:59 GMT-0300 (Brasilia Standard Time),Wed Apr 21 2021 09:24:33 GMT-0300 (Brasilia Standard Time)
A pandemia em 2021 será muito mais letal do que foi no ano passado. A insuficiência de investimentos pode ser uma d… https://t.co/JV7BuToIML,2726301380,,,2726301380,lhmandetta,,,133,1243,Thu Aug 05 2021 21:49:59 GMT-0300 (Brasilia Standard Time),Tue Apr 20 2021 16:21:21 GMT-0300 (Brasilia Standard Time)
Minha recomendação para pais e mães: fiquem atentos aos sinais de dificuldade de enxergar dos filhos. E consultem u… https://t.co/8gDpUUjnkM,2726301380,,,2726301380,lhmandetta,,,39,630,Thu Aug 05 2021 21:49:59 GMT-0300 (Brasilia Standard Time),Tue Apr 20 2021 11:03:04 GMT-0300 (Brasilia Standard Time)
Parabenizo a iniciativa do consórcio de veículos de imprensa. Só existe um caminho para vencermos essa pandemia: a… https://t.co/HnvQpBwwFb,2726301380,,,2726301380,lhmandetta,,,63,1034,Thu Aug 05 2021 21:49:59 GMT-0300 (Brasilia Standard Time),Mon Apr 19 2021 14:05:00 GMT-0300 (Brasilia Standard Time)
"Se empresas disputarem a compra de vacinas com os governos, o resultado pode ser a inflação dos imunizantes. É por… https://t.co/k50osr7pg1",2726301380,,,2726301380,lhmandetta,,,45,586,Thu Aug 05 2021 21:49:59 GMT-0300 (Brasilia Standard Time),Mon Apr 19 2021 10:30:16 GMT-0300 (Brasilia Standard Time)
"Participo agora da @brazil_conf, no painel que debate o fortalecimento do SUS. Você pode assistir ao vivo aqui: https://t.co/2gG8Bh9Ud1",2726301380,,,2726301380,lhmandetta,,,26,410,Thu Aug 05 2021 21:49:59 GMT-0300 (Brasilia Standard Time),Sat Apr 17 2021 11:01:14 GMT-0300 (Brasilia Standard Time)
"RT @democratas: Nosso ex-ministro da Saúde @lhmandetta, @GabbardoJoao e Wanderson de Oliveira estão ao vivo para tirar dúvidas sobre a vaci…",2726301380,,,2726301380,lhmandetta,,,17,0,Thu Aug 05 2021 21:49:59 GMT-0300 (Brasilia Standard Time),Fri Apr 16 2021 17:05:59 GMT-0300 (Brasilia Standard Time)
"A Ciência traz novamente notícias muito promissoras. Estudos adicionais ainda precisam ser feitos, incluindo um núm… https://t.co/wboz8eeLix",2726301380,,,2726301380,lhmandetta,,,36,544,Thu Aug 05 2021 21:49:59 GMT-0300 (Brasilia Standard Time),Fri Apr 16 2021 10:45:55 GMT-0300 (Brasilia Standard Time)
"Como cidadão, lamento o que aparece aos nossos olhos como um desmonte das ações de combate à corrupção. A Lava Jato… https://t.co/GCqRwt68gh",2726301380,,,2726301380,lhmandetta,,,503,6755,Thu Aug 05 2021 21:49:59 GMT-0300 (Brasilia Standard Time),Thu Apr 15 2021 22:01:55 GMT-0300 (Brasilia Standard Time)
"No começo da pandemia, eu defendi um único caminho para enfrentarmos essa doença: o da Ciência. Optaram pela má pol… https://t.co/SMPOf0Xr2X",2726301380,,,2726301380,lhmandetta,,,227,2939,Thu Aug 05 2021 21:49:59 GMT-0300 (Brasilia Standard Time),Thu Apr 15 2021 11:42:42 GMT-0300 (Brasilia Standard Time)
"Vocês lembram das nossas coletivas no Ministério da Saúde? João Gabbardo (@GabbardoJoao), Wanderson de Oliveira e e… https://t.co/dnClEPFZ4C",2726301380,,,2726301380,lhmandetta,,,233,2864,Thu Aug 05 2021 21:49:59 GMT-0300 (Brasilia Standard Time),Thu Apr 15 2021 08:54:58 GMT-0300 (Brasilia Standard Time)
"Esse tipo de decisão passa uma sensação de desconexão com a realidade da maior parte dos brasileiros, especialmente… https://t.co/XR8n1HmzsY",2726301380,,,2726301380,lhmandetta,,,49,473,Thu Aug 05 2021 21:49:59 GMT-0300 (Brasilia Standard Time),Thu Apr 15 2021 08:44:13 GMT-0300 (Brasilia Standard Time)
"Famílias passando necessidade, inflação altíssima, descontrole da pandemia e desesperança. E um gestor público, que… https://t.co/P8pAtv9ciL",2726301380,,,2726301380,lhmandetta,,,241,2313,Thu Aug 05 2021 21:49:59 GMT-0300 (Brasilia Standard Time),Wed Apr 14 2021 11:43:41 GMT-0300 (Brasilia Standard Time)
"Aumentar a produção de doses, respeitando a propriedade intelectual e premiando a pesquisa, é o grande desafio da h… https://t.co/sal8mnPVW4",2726301380,,,2726301380,lhmandetta,,,30,330,Thu Aug 05 2021 21:49:59 GMT-0300 (Brasilia Standard Time),Wed Apr 14 2021 10:19:09 GMT-0300 (Brasilia Standard Time)
A pandemia trouxe impactos terríveis para os brasileiros. O auxílio emergencial nunca deveria ter sido pausado. Vol… https://t.co/iGQ89vuFJe,2726301380,,,2726301380,lhmandetta,,,84,1207,Thu Aug 05 2021 21:49:59 GMT-0300 (Brasilia Standard Time),Wed Apr 14 2021 08:42:10 GMT-0300 (Brasilia Standard Time)
Eu sou ortopedista pediátrico e esse caso do menino Henry deixa um alerta: violência contra crianças é mais comum d… https://t.co/KkNlHC1VSA,2726301380,,,2726301380,lhmandetta,,,858,10789,Thu Aug 05 2021 21:49:59 GMT-0300 (Brasilia Standard Time),Fri Apr 09 2021 17:13:43 GMT-0300 (Brasilia Standard Time)
"Longe da frieza dos números, as pessoas estão passando fome. O drama poderia ser muito menor, se o presidente e min… https://t.co/iVGjWL1Bqr",2726301380,,,2726301380,lhmandetta,,,138,1626,Thu Aug 05 2021 21:49:59 GMT-0300 (Brasilia Standard Time),Fri Apr 09 2021 12:24:24 GMT-0300 (Brasilia Standard Time)
A sociedade é quem ganha com a CPI da Covid. Precisamos esclarecer os atos praticados e as consequências tão penosa… https://t.co/eisq69LUPr,2726301380,,,2726301380,lhmandetta,,,373,4586,Thu Aug 05 2021 21:49:59 GMT-0300 (Brasilia Standard Time),Thu Apr 08 2021 22:05:01 GMT-0300 (Brasilia Standard Time)
@gilmarmendes Parabéns minha eterna capital Cuiabá!,2726301380,,,2726301380,lhmandetta,,,4,233,Thu Aug 05 2021 21:49:59 GMT-0300 (Brasilia Standard Time),Thu Apr 08 2021 18:44:55 GMT-0300 (Brasilia Standard Time)
"O projeto que permite a compra de vacinas pela iniciativa privada aprovado pelo Congresso não tem nenhum nexo, nem… https://t.co/0KouBdGsI8",2726301380,,,2726301380,lhmandetta,,,497,5727,Thu Aug 05 2021 21:49:59 GMT-0300 (Brasilia Standard Time),Thu Apr 08 2021 08:10:22 GMT-0300 (Brasilia Standard Time)
"Infelizmente, não temos muito o que celebrar neste #DiaMundialDaSaúde. São quase 350 mil vidas perdidas por causa d… https://t.co/xU30W8GZVh",2726301380,,,2726301380,lhmandetta,,,281,4415,Thu Aug 05 2021 21:49:59 GMT-0300 (Brasilia Standard Time),Wed Apr 07 2021 14:38:50 GMT-0300 (Brasilia Standard Time)
RT @andrefran: Os EUA são bom exemplo da diferença entre um presidente negacionista e um presidente de verdade. https://t.co/ecj4gGBA8p,2726301380,,,2726301380,lhmandetta,,,300,0,Thu Aug 05 2021 21:49:59 GMT-0300 (Brasilia Standard Time),Tue Apr 06 2021 07:37:24 GMT-0300 (Brasilia Standard Time)
"Hoje, às 19h, eu vou bater um papo com a @luizatrajano sobre pandemia, vacinas e o que podemos fazer para vencer es… https://t.co/tHYEapfwjN",2726301380,,,2726301380,lhmandetta,,,73,1109,Thu Aug 05 2021 21:49:59 GMT-0300 (Brasilia Standard Time),Mon Apr 05 2021 10:33:16 GMT-0300 (Brasilia Standard Time)
"RT @JotaInfo: Daqui a pouco, às 17h, @fzambeli e @manoelaal entrevistam o ex-ministro da Saúde @lhmandetta. Acompanhe pelo link: https://t.…",2726301380,,,2726301380,lhmandetta,,,13,0,Thu Aug 05 2021 21:49:59 GMT-0300 (Brasilia Standard Time),Thu Apr 01 2021 16:27:41 GMT-0300 (Brasilia Standard Time)
Em tudo o Brasil se rompeu ao meio. Fizeram picadinho da liga social. Não foram capazes de enfrentar os problemas.… https://t.co/4rtCYzONDD,2726301380,,,2726301380,lhmandetta,,,78,965,Thu Aug 05 2021 21:49:59 GMT-0300 (Brasilia Standard Time),Thu Apr 01 2021 11:33:57 GMT-0300 (Brasilia Standard Time)
"RT @guilherme_amado: ATENÇÃO: Por iniciativa de Mandetta, presidenciáveis do centro assinam manifesto pela democracia. Mandetta, Ciro, Huck…",2726301380,,,2726301380,lhmandetta,,,232,0,Thu Aug 05 2021 21:49:59 GMT-0300 (Brasilia Standard Time),Wed Mar 31 2021 19:39:41 GMT-0300 (Brasilia Standard Time)
@cirogomes @EduardoLeite_ @joaoamoedonovo @jdoriajr @LucianoHuck,2726301380,,,2726301380,lhmandetta,,,26,731,Thu Aug 05 2021 21:49:59 GMT-0300 (Brasilia Standard Time),Wed Mar 31 2021 19:37:00 GMT-0300 (Brasilia Standard Time)
"Assinam este manifesto:

CIRO GOMES, EDUARDO LEITE, JOÃO AMOEDO, JOÃO DORIA, LUCIANO HUCK, LUIZ HENRIQUE MANDETTA",2726301380,,,2726301380,lhmandetta,,,105,1899,Thu Aug 05 2021 21:49:59 GMT-0300 (Brasilia Standard Time),Wed Mar 31 2021 19:25:02 GMT-0300 (Brasilia Standard Time)
"Homens e mulheres desse país que apreciam a LIBERDADE, sejam civis ou militares, independentemente de filiação part… https://t.co/QezArQzaGX",2726301380,,,2726301380,lhmandetta,,,66,879,Thu Aug 05 2021 21:49:59 GMT-0300 (Brasilia Standard Time),Wed Mar 31 2021 19:25:01 GMT-0300 (Brasilia Standard Time)
"Exemplos não faltam para nos mostrar que o autoritarismo pode emergir das sombras, sempre que as sociedades se desc… https://t.co/rQbTyBNfEO",2726301380,,,2726301380,lhmandetta,,,17,329,Thu Aug 05 2021 21:49:59 GMT-0300 (Brasilia Standard Time),Wed Mar 31 2021 19:25:01 GMT-0300 (Brasilia Standard Time)
"Tudo isso só acontece em regimes democráticos. Fora da Democracia o que existe é o excesso, o abuso, a transgressão… https://t.co/G3ZIX0SIFM",2726301380,,,2726301380,lhmandetta,,,16,295,Thu Aug 05 2021 21:49:59 GMT-0300 (Brasilia Standard Time),Wed Mar 31 2021 19:25:01 GMT-0300 (Brasilia Standard Time)
"Não há igualdade sem respeito. Não há prosperidade sem solidariedade.
A Democracia é o melhor dos sistemas político… https://t.co/wotMPLBEeG",2726301380,,,2726301380,lhmandetta,,,18,303,Thu Aug 05 2021 21:49:59 GMT-0300 (Brasilia Standard Time),Wed Mar 31 2021 19:25:00 GMT-0300 (Brasilia Standard Time)
"A conquista do Brasil sonhado por cada um de nós não pode prescindir da Democracia. Ela é nosso legado, nosso chão,… https://t.co/ErBtnkYZbO",2726301380,,,2726301380,lhmandetta,,,21,315,Thu Aug 05 2021 21:49:59 GMT-0300 (Brasilia Standard Time),Wed Mar 31 2021 19:25:00 GMT-0300 (Brasilia Standard Time)
"possibilitou a eleição de Tancredo Neves para a Presidência da República, a volta das eleições diretas para o Execu… https://t.co/j7eRDKvsxQ",2726301380,,,2726301380,lhmandetta,,,18,323,Thu Aug 05 2021 21:49:59 GMT-0300 (Brasilia Standard Time),Wed Mar 31 2021 19:24:59 GMT-0300 (Brasilia Standard Time)
"MANIFESTO PELA
CONSCIÊNCIA DEMOCRÁTICA

Muitos brasileiros foram às ruas e lutaram pela reconquista da Democracia n… https://t.co/zpixLXUU9r",2726301380,,,2726301380,lhmandetta,,,281,4226,Thu Aug 05 2021 21:49:59 GMT-0300 (Brasilia Standard Time),Wed Mar 31 2021 19:24:59 GMT-0300 (Brasilia Standard Time)
@FMouraBrasil @siganelsonmotta O perigo é que os sucessores da saúde e da justiça embarcaram na sabotagem. Colhemos… https://t.co/MFgBEjVdda,2726301380,,,2726301380,lhmandetta,,,121,1618,Thu Aug 05 2021 21:49:59 GMT-0300 (Brasilia Standard Time),Tue Mar 30 2021 14:13:46 GMT-0300 (Brasilia Standard Time)
"O ministro da Defesa, General Azevedo e Silva é um homem extremamente equilibrado. Precisamos atentar para os motiv… https://t.co/cRBOiYo6ni",2726301380,,,2726301380,lhmandetta,,,490,6469,Thu Aug 05 2021 21:49:59 GMT-0300 (Brasilia Standard Time),Mon Mar 29 2021 16:50:03 GMT-0300 (Brasilia Standard Time)
"Somos 8 bilhões de pessoas nesse planeta, enfrentando a mesma ameaça. Se surgir uma variante do vírus resistente às… https://t.co/LAPCjg66DG",2726301380,,,2726301380,lhmandetta,,,90,1707,Thu Aug 05 2021 21:49:59 GMT-0300 (Brasilia Standard Time),Mon Mar 29 2021 15:23:45 GMT-0300 (Brasilia Standard Time)
Agora nos resta uma única alternativa: trabalhar internacionalmente para que a produção das vacinas já autorizadas… https://t.co/w7KWDSdtQe,2726301380,,,2726301380,lhmandetta,,,59,1494,Thu Aug 05 2021 21:49:59 GMT-0300 (Brasilia Standard Time),Mon Mar 29 2021 15:23:45 GMT-0300 (Brasilia Standard Time)
"Neste momento, o mais grave é que perdemos completamente o timing de compra das vacinas. A recusa à oferta da Pfize… https://t.co/A5KROQF9KZ",2726301380,,,2726301380,lhmandetta,,,47,881,Thu Aug 05 2021 21:49:59 GMT-0300 (Brasilia Standard Time),Mon Mar 29 2021 15:23:45 GMT-0300 (Brasilia Standard Time)
"A Política Externa brasileira, que já foi respeitada mundialmente, patina no terreno escorregadio da ideologia. Ina… https://t.co/qe51QX9BCi",2726301380,,,2726301380,lhmandetta,,,37,861,Thu Aug 05 2021 21:49:59 GMT-0300 (Brasilia Standard Time),Mon Mar 29 2021 15:23:44 GMT-0300 (Brasilia Standard Time)
Ernesto Araújo já vai tarde. Sua condução desastrosa da Política Externa brasileira contribuiu muito para o momento… https://t.co/8jyEjUIih2,2726301380,,,2726301380,lhmandetta,,,572,9684,Thu Aug 05 2021 21:49:59 GMT-0300 (Brasilia Standard Time),Mon Mar 29 2021 15:23:44 GMT-0300 (Brasilia Standard Time)
Esse é o resultado de decisões baseadas em fake news e cinismo. Cheiro de quem cometeu erros macabros: https://t.co/2nIWHHeyuB,2726301380,,,2726301380,lhmandetta,,,192,2345,Thu Aug 05 2021 21:49:59 GMT-0300 (Brasilia Standard Time),Mon Mar 29 2021 09:23:21 GMT-0300 (Brasilia Standard Time)
"Uma vacina 100% nacional contra o coronavírus, com tecnologia mais simples e barata é notícia que nos traz esperanç… https://t.co/WzDcM8bpLn",2726301380,,,2726301380,lhmandetta,,,2172,27776,Thu Aug 05 2021 21:49:59 GMT-0300 (Brasilia Standard Time),Fri Mar 26 2021 09:58:34 GMT-0300 (Brasilia Standard Time)
RT @democratas: Corretíssimo,2726301380,,,2726301380,lhmandetta,,,45,0,Thu Aug 05 2021 21:49:59 GMT-0300 (Brasilia Standard Time),Fri Mar 26 2021 01:44:12 GMT-0300 (Brasilia Standard Time)
"Um abraço, Sala A! https://t.co/HHD5vhk9pe",2726301380,,,2726301380,lhmandetta,,,70,4190,Thu Aug 05 2021 21:49:59 GMT-0300 (Brasilia Standard Time),Thu Mar 25 2021 21:06:49 GMT-0300 (Brasilia Standard Time)
"Outro erro se avizinha: teremos a sazonalidade da gripe comum, que começa em abril e atravessa maio. Ninguém está o… https://t.co/GJyVCUDPCQ",2726301380,,,2726301380,lhmandetta,,,59,670,Thu Aug 05 2021 21:49:59 GMT-0300 (Brasilia Standard Time),Thu Mar 25 2021 11:30:59 GMT-0300 (Brasilia Standard Time)
Transportaram pacientes de Manaus para outras cidades sem um plano de biossegurança e uma nova cepa se espalhou pel… https://t.co/lZDDEvUdwB,2726301380,,,2726301380,lhmandetta,,,252,2388,Thu Aug 05 2021 21:49:59 GMT-0300 (Brasilia Standard Time),Thu Mar 25 2021 11:30:44 GMT-0300 (Brasilia Standard Time)
"@miriamsplitter1 Miriam, especialistas pedem pelo menos 15 dias de intervalo. Mas o correto é termos uma orientação… https://t.co/QBdYNzzE7m",2726301380,,,2726301380,lhmandetta,,,5,65,Thu Aug 05 2021 21:49:59 GMT-0300 (Brasilia Standard Time),Thu Mar 25 2021 11:02:27 GMT-0300 (Brasilia Standard Time)
"300 mil mortes na conta do negacionismo. Somente a Ciência, a responsabilidade com o próximo e a vacinação em massa… https://t.co/cccbZ9ApQy",2726301380,,,2726301380,lhmandetta,,,93,1308,Thu Aug 05 2021 21:49:59 GMT-0300 (Brasilia Standard Time),Thu Mar 25 2021 10:30:33 GMT-0300 (Brasilia Standard Time)
"Se não vacinarmos contra a gripe, vai potencializar a crise do coronavírus, dentro de um sistema que não cabe mais ninguém.",2726301380,,,2726301380,lhmandetta,,,148,2414,Thu Aug 05 2021 21:49:59 GMT-0300 (Brasilia Standard Time),Wed Mar 24 2021 21:23:47 GMT-0300 (Brasilia Standard Time)
Um elemento não está sendo observado nem pela imprensa nem pelo Ministério da Saúde: a sazonalidade da gripe começa… https://t.co/2cRhfhFTYH,2726301380,,,2726301380,lhmandetta,,,385,4563,Thu Aug 05 2021 21:49:59 GMT-0300 (Brasilia Standard Time),Wed Mar 24 2021 21:23:47 GMT-0300 (Brasilia Standard Time)
Esperemos que o compromisso maior com a vida e com o Brasil prevaleça e se transforme em ações concretas.,2726301380,,,2726301380,lhmandetta,,,23,654,Thu Aug 05 2021 21:49:59 GMT-0300 (Brasilia Standard Time),Wed Mar 24 2021 11:58:52 GMT-0300 (Brasilia Standard Time)
"Estamos morrendo, sem assistência à saúde, sem vacinas, com fome, sem emprego, falências, abismo fiscal. Se os que… https://t.co/IzYTELqpBW",2726301380,,,2726301380,lhmandetta,,,47,767,Thu Aug 05 2021 21:49:59 GMT-0300 (Brasilia Standard Time),Wed Mar 24 2021 11:58:52 GMT-0300 (Brasilia Standard Time)
A sociedade clama e a classe política parece estar entendendo.,2726301380,,,2726301380,lhmandetta,,,4,210,Thu Aug 05 2021 21:49:59 GMT-0300 (Brasilia Standard Time),Wed Mar 24 2021 11:58:52 GMT-0300 (Brasilia Standard Time)
"A crise é maior do que todos, e todos perdem da maneira como está. Diante da gravidade do quadro atual, não há outr… https://t.co/ZEBTnerlXS",2726301380,,,2726301380,lhmandetta,,,6,213,Thu Aug 05 2021 21:49:59 GMT-0300 (Brasilia Standard Time),Wed Mar 24 2021 11:58:51 GMT-0300 (Brasilia Standard Time)
"E um terceiro pilar econômico e social, onde empresariado e voluntariado busquem dar o apoio necessário e urgente a… https://t.co/OhAxdp8STA",2726301380,,,2726301380,lhmandetta,,,6,207,Thu Aug 05 2021 21:49:59 GMT-0300 (Brasilia Standard Time),Wed Mar 24 2021 11:58:51 GMT-0300 (Brasilia Standard Time)
"Um de defesa da vida, onde todos se comprometam com o sistema de saúde e seus eixos. O segundo pilar é a harmonia e… https://t.co/CFnbh3di50",2726301380,,,2726301380,lhmandetta,,,4,222,Thu Aug 05 2021 21:49:59 GMT-0300 (Brasilia Standard Time),Wed Mar 24 2021 11:58:50 GMT-0300 (Brasilia Standard Time)
"Esperemos que dessa reunião dos Poderes Judiciário, Legislativo e Executivo federal, e governadores resulte um pact… https://t.co/9VXNsMwyQv",2726301380,,,2726301380,lhmandetta,,,71,1949,Thu Aug 05 2021 21:49:59 GMT-0300 (Brasilia Standard Time),Wed Mar 24 2021 11:58:50 GMT-0300 (Brasilia Standard Time)
Daqui a pouco teremos que indenizar essa quadrilha. Essa pena já havia sido ratificada até pelo STF. Retrocesso que… https://t.co/Qtw47Eo2tX,2726301380,,,2726301380,lhmandetta,,,301,3672,Thu Aug 05 2021 21:49:59 GMT-0300 (Brasilia Standard Time),Tue Mar 23 2021 18:48:24 GMT-0300 (Brasilia Standard Time)
"O que separa a sociedade da barbárie é a promoção da Justiça. Moro promoveu a Justiça, e chegou no núcleo político… https://t.co/PH471ZOhFs",2726301380,,,2726301380,lhmandetta,,,835,8072,Thu Aug 05 2021 21:49:59 GMT-0300 (Brasilia Standard Time),Tue Mar 23 2021 18:48:24 GMT-0300 (Brasilia Standard Time)
Não existe remédio que não tenha risco. Até aspirina pode matar. Só corremos esse risco quando sabemos o benefício.… https://t.co/9AEdHkvYB9,2726301380,,,2726301380,lhmandetta,,,295,2744,Thu Aug 05 2021 21:49:59 GMT-0300 (Brasilia Standard Time),Tue Mar 23 2021 15:03:17 GMT-0300 (Brasilia Standard Time)
"RT @KimKataguiri: Mandetta: Bolsonaro apostou em uma LOTERIA BIOLÓGICA PERVERSA!
https://t.co/LrTJEOv6vz",2726301380,,,2726301380,lhmandetta,,,41,0,Thu Aug 05 2021 21:49:59 GMT-0300 (Brasilia Standard Time),Tue Mar 23 2021 14:19:50 GMT-0300 (Brasilia Standard Time)
"RT @democratas: ""Deveríamos ter comprado um mix das seis vacinas, porque se tem um problema com uma, você pode usar as outras. De repente v…",2726301380,,,2726301380,lhmandetta,,,123,0,Thu Aug 05 2021 21:49:59 GMT-0300 (Brasilia Standard Time),Mon Mar 22 2021 19:42:40 GMT-0300 (Brasilia Standard Time)
"RT @democratas: ""Em agosto, os laboratórios vieram pra cá porque o Brasil vacina rápido, nossa rede está pronta. Pena é que o Brasil perdeu…",2726301380,,,2726301380,lhmandetta,,,25,0,Thu Aug 05 2021 21:49:59 GMT-0300 (Brasilia Standard Time),Mon Mar 22 2021 19:36:33 GMT-0300 (Brasilia Standard Time)
Brasil acordando para a falácia do dilema economia x saúde. Dura realidade: não há retomada econômica sem controle… https://t.co/xtPc5GKe9B,2726301380,,,2726301380,lhmandetta,,,450,3972,Thu Aug 05 2021 21:49:59 GMT-0300 (Brasilia Standard Time),Mon Mar 22 2021 09:42:44 GMT-0300 (Brasilia Standard Time)
O SUS é um dos maiores sistemas de saúde pública do mundo.  Fortalecê-lo é um dos pilares para o enfrentamento adeq… https://t.co/Ll4Mkd2Urk,2726301380,,,2726301380,lhmandetta,,,439,6746,Thu Aug 05 2021 21:49:59 GMT-0300 (Brasilia Standard Time),Sun Mar 21 2021 13:47:12 GMT-0300 (Brasilia Standard Time)
Faltou oxigênio em Manaus. Hoje está faltando em São Paulo. Prendam o fôlego. Nem o Congresso nem o STF parecem cap… https://t.co/OpheyeuBhO,2726301380,,,2726301380,lhmandetta,,,1602,16835,Thu Aug 05 2021 21:49:59 GMT-0300 (Brasilia Standard Time),Sat Mar 20 2021 20:55:15 GMT-0300 (Brasilia Standard Time)
A diferença entre um presidente negacionista e um que acredita na Ciência: https://t.co/8XniFzAzD9,2726301380,,,2726301380,lhmandetta,,,955,10219,Thu Aug 05 2021 21:49:59 GMT-0300 (Brasilia Standard Time),Sat Mar 20 2021 15:04:04 GMT-0300 (Brasilia Standard Time)
Semana que vem teremos um cenário ainda mais trágico. Em vez de virar a chave do negacionismo e coordenar o enfrent… https://t.co/IXlP0snmA3,2726301380,,,2726301380,lhmandetta,,,502,4962,Thu Aug 05 2021 21:49:59 GMT-0300 (Brasilia Standard Time),Sat Mar 20 2021 09:50:45 GMT-0300 (Brasilia Standard Time)
Ética e Verdade devem ser os pilares da atuação de um indivíduo em qualquer atividade profissional. Nessa conversa… https://t.co/9laQ1XVusA,2726301380,,,2726301380,lhmandetta,,,79,1705,Thu Aug 05 2021 21:49:59 GMT-0300 (Brasilia Standard Time),Fri Mar 19 2021 20:20:24 GMT-0300 (Brasilia Standard Time)
Major Olímpio era um homem de posições firmes. Fará falta no Senado. Mais uma vida perdida p/ a Covid-19. Minha sol… https://t.co/k19WNLy8nD,2726301380,,,2726301380,lhmandetta,,,222,6938,Thu Aug 05 2021 21:49:59 GMT-0300 (Brasilia Standard Time),Thu Mar 18 2021 22:40:44 GMT-0300 (Brasilia Standard Time)
"RT @RodrigoMaia: .@lhmandetta, o Paulo Guedes é igual ao Bolsonaro, mas com verniz. Sempre transfere para os outros a incompetência e irres…",2726301380,,,2726301380,lhmandetta,,,379,0,Thu Aug 05 2021 21:49:59 GMT-0300 (Brasilia Standard Time),Wed Mar 17 2021 16:30:07 GMT-0300 (Brasilia Standard Time)
https://t.co/Kuf3YVu5Hn,2726301380,,,2726301380,lhmandetta,,,35,572,Thu Aug 05 2021 21:49:59 GMT-0300 (Brasilia Standard Time),Wed Mar 17 2021 16:20:48 GMT-0300 (Brasilia Standard Time)
Guedes desonesto e mentiroso. Negacionismo do governo mata pessoas e empresas. CPI já! Mais postos de saúde e menos… https://t.co/UrLrAhodNr,2726301380,,,2726301380,lhmandetta,,,902,8632,Thu Aug 05 2021 21:49:59 GMT-0300 (Brasilia Standard Time),Wed Mar 17 2021 13:21:26 GMT-0300 (Brasilia Standard Time)
"RT @democratas: .@lhmandetta em entrevista para @camanpour na @CNNi: ""Vai piorar e teremos dias difíceis pela frente. Temos uma Ferrari pra…",2726301380,,,2726301380,lhmandetta,,,49,0,Thu Aug 05 2021 21:49:59 GMT-0300 (Brasilia Standard Time),Mon Mar 15 2021 18:12:59 GMT-0300 (Brasilia Standard Time)
"O Brasil preocupa o mundo. Chega de negacionismo. Defender a VIDA,o SUS e a CIÊNCIA! https://t.co/Seq1eYlYk5",2726301380,,,2726301380,lhmandetta,,,220,2451,Thu Aug 05 2021 21:49:59 GMT-0300 (Brasilia Standard Time),Mon Mar 15 2021 16:53:08 GMT-0300 (Brasilia Standard Time)
"Que o Ministério da Saúde seja pela Vida, pelo SUS e pela Ciencia. Já perdemos tempo e gente demais. A vida tem pressa!",2726301380,,,2726301380,lhmandetta,,,1212,18949,Thu Aug 05 2021 21:49:59 GMT-0300 (Brasilia Standard Time),Mon Mar 15 2021 10:14:02 GMT-0300 (Brasilia Standard Time)
RT @democratas: Sabe quem sempre defendeu a vacina? 👇 https://t.co/W16p65gDXH,2726301380,,,2726301380,lhmandetta,,,141,0,Thu Aug 05 2021 21:49:59 GMT-0300 (Brasilia Standard Time),Thu Mar 11 2021 14:27:58 GMT-0300 (Brasilia Standard Time)
O Brasil não aceita mais viver com a impunidade. Os fatos revelados pela lava jato são gravíssimos . Essa sujeira n… https://t.co/Etu6LCHeNi,2726301380,,,2726301380,lhmandetta,,,466,7125,Thu Aug 05 2021 21:49:59 GMT-0300 (Brasilia Standard Time),Wed Mar 10 2021 15:33:51 GMT-0300 (Brasilia Standard Time)
"Os extremos comemoram, pois se nutrem um do outro. A ruptura da liga social brasileira avança. Mais que nunca o pov… https://t.co/UVHZyMI3SW",2726301380,,,2726301380,lhmandetta,,,1148,14638,Thu Aug 05 2021 21:49:59 GMT-0300 (Brasilia Standard Time),Mon Mar 08 2021 16:06:58 GMT-0300 (Brasilia Standard Time)
"‘’Não deem o que é sagrado aos cães, nem atirem suas pérolas aos porcos’’ Mateus 7:6. E chega de mimimi. Ele não dá valor à vida. Se cuidem.",2726301380,,,2726301380,lhmandetta,,,1169,12756,Thu Aug 05 2021 21:49:59 GMT-0300 (Brasilia Standard Time),Thu Mar 04 2021 16:51:06 GMT-0300 (Brasilia Standard Time)
"RT @democratas: Março de 2020: Mandetta pedindo pra respeitar a ciência
Março de 2021: Mandetta pedindo pra respeitar a ciência https://t.c…",2726301380,,,2726301380,lhmandetta,,,88,0,Thu Aug 05 2021 21:49:59 GMT-0300 (Brasilia Standard Time),Thu Mar 04 2021 11:20:08 GMT-0300 (Brasilia Standard Time)
"Contra alta do dólar, pibinho , falsos dilemas econômicos,recessão, charlatoes e afins:VACINA ANTES TARDE DO QUE NUNCA!",2726301380,,,2726301380,lhmandetta,,,638,11647,Thu Aug 05 2021 21:49:59 GMT-0300 (Brasilia Standard Time),Wed Mar 03 2021 17:56:07 GMT-0300 (Brasilia Standard Time)
RT @democratas: .@lhmandetta https://t.co/P8UDUw4yCW,2726301380,,,2726301380,lhmandetta,,,50,0,Thu Aug 05 2021 21:49:59 GMT-0300 (Brasilia Standard Time),Wed Mar 03 2021 05:54:14 GMT-0300 (Brasilia Standard Time)
