text,query,country,city,userId,username,quote_count,reply_count,retweet_count,favorite_count,timestamp,createdAt
"Trabalhar para combater esse desemprego gigante, para trazer mais vacinas, para amenizar a dor por que passam hoje… https://t.co/M3PYGqIPHk",2726301380,,,2726301380,lhmandetta,,,12,290,Thu Aug 05 2021 21:49:59 GMT-0300 (Brasilia Standard Time),Thu Aug 05 2021 20:56:38 GMT-0300 (Brasilia Standard Time)
"Essencial esse posicionamento do STF. É um momento grave, e o que fica cada vez mas clara é a necessidade de pacifi… https://t.co/lzNHvF3uT9",2726301380,,,2726301380,lhmandetta,,,41,633,Thu Aug 05 2021 21:49:59 GMT-0300 (Brasilia Standard Time),Thu Aug 05 2021 20:56:37 GMT-0300 (Brasilia Standard Time)
O que me chama atenção na #CPIdaCovid é o modo como essa gente administrou o Ministério da Saúde sem critério técni… https://t.co/peYvc87OYN,2726301380,,,2726301380,lhmandetta,,,40,429,Thu Aug 05 2021 21:49:59 GMT-0300 (Brasilia Standard Time),Thu Aug 05 2021 16:50:55 GMT-0300 (Brasilia Standard Time)
"Hoje é o Dia Nacional da Saúde. Dia do nascimento de Oswaldo Cruz. Cabe uma reflexão:  
Quantas vidas - e empregos… https://t.co/C9JPxCCX1d",2726301380,,,2726301380,lhmandetta,,,177,2615,Thu Aug 05 2021 21:49:59 GMT-0300 (Brasilia Standard Time),Thu Aug 05 2021 08:35:41 GMT-0300 (Brasilia Standard Time)
@rosana @octavio_guedes https://t.co/Dx5wJlN0In,2726301380,,,2726301380,lhmandetta,,,0,53,Thu Aug 05 2021 21:49:59 GMT-0300 (Brasilia Standard Time),Mon Aug 02 2021 18:00:49 GMT-0300 (Brasilia Standard Time)
"Ouvir o hino do Brasil com a Rebeca no pódio renova nossa esperança. Rebeca é ouro, ela é o ouro! 🥇 https://t.co/edEBb6oItH",2726301380,,,2726301380,lhmandetta,,,94,3419,Thu Aug 05 2021 21:49:59 GMT-0300 (Brasilia Standard Time),Sun Aug 01 2021 12:06:19 GMT-0300 (Brasilia Standard Time)
RT @GabrielaPrioli: Hoje tem @lhmandetta no GPS Político. Já assistiu? Clica aqui 👇 https://t.co/gtAows6ejT https://t.co/Fz7hhYbDUF,2726301380,,,2726301380,lhmandetta,,,31,0,Thu Aug 05 2021 21:49:59 GMT-0300 (Brasilia Standard Time),Sat Jul 31 2021 15:04:09 GMT-0300 (Brasilia Standard Time)
Merecidíssimo esse prêmio. Margareth Dalcomo se tornou uma voz de referência contra o negacionismo e de orientação… https://t.co/SBXzHHDiP9,2726301380,,,2726301380,lhmandetta,,,271,3774,Thu Aug 05 2021 21:49:59 GMT-0300 (Brasilia Standard Time),Sat Jul 31 2021 09:10:33 GMT-0300 (Brasilia Standard Time)
O que aconteceu com o CNPq e a Cinemateca não é acaso. É sintoma da falta de respeito do governo federal com Ciênci… https://t.co/n9x82ju2eb,2726301380,,,2726301380,lhmandetta,,,123,1883,Thu Aug 05 2021 21:49:59 GMT-0300 (Brasilia Standard Time),Fri Jul 30 2021 15:49:16 GMT-0300 (Brasilia Standard Time)
O presidente sabotou todas as campanhas de comunicação para ajudar a população a se orientar em uma pandemia. Mas o… https://t.co/szFjrYEzL4,2726301380,,,2726301380,lhmandetta,,,649,9562,Thu Aug 05 2021 21:49:59 GMT-0300 (Brasilia Standard Time),Fri Jul 30 2021 09:01:25 GMT-0300 (Brasilia Standard Time)
Bolsonaro teve TODOS OS PODERES para coordenar a pandemia. Eu mesmo praticamente desenhei o que ele tinha que fazer… https://t.co/kVf7IEeVUn,2726301380,,,2726301380,lhmandetta,,,1561,13874,Thu Aug 05 2021 21:49:59 GMT-0300 (Brasilia Standard Time),Thu Jul 29 2021 12:58:13 GMT-0300 (Brasilia Standard Time)
RT @STF_oficial: O STF não proibiu o governo federal de agir na pandemia! Uma mentira contada mil vezes não vira verdade! Compartilhe este…,2726301380,,,2726301380,lhmandetta,,,13028,0,Thu Aug 05 2021 21:49:59 GMT-0300 (Brasilia Standard Time),Wed Jul 28 2021 17:42:37 GMT-0300 (Brasilia Standard Time)
"As crianças têm sido afetadas de maneira cruel. Um sofrimento invisível. A cada 5 min, uma delas fica órfã no país.… https://t.co/uBsoRtsM69",2726301380,,,2726301380,lhmandetta,,,74,869,Thu Aug 05 2021 21:49:59 GMT-0300 (Brasilia Standard Time),Tue Jul 27 2021 15:45:35 GMT-0300 (Brasilia Standard Time)
"Que orgulho, Rayssa! Que a sua medalha de prata inspire mais meninas a seguirem seus sonhos 🥈",2726301380,,,2726301380,lhmandetta,,,123,3717,Thu Aug 05 2021 21:49:59 GMT-0300 (Brasilia Standard Time),Mon Jul 26 2021 01:32:13 GMT-0300 (Brasilia Standard Time)
O país precisa cicatrizar. Pacificar. Nenhum dos dois almeja a paz para avançar. Queimar a história é a arma dos es… https://t.co/98u6YXQEnR,2726301380,,,2726301380,lhmandetta,,,150,2715,Thu Aug 05 2021 21:49:59 GMT-0300 (Brasilia Standard Time),Sun Jul 25 2021 00:36:25 GMT-0300 (Brasilia Standard Time)
A privatização do SUS é mais uma fake news. A saúde é um direito de todos e um dever do Estado. O SUS é uma polític… https://t.co/whzmomFSAU,2726301380,,,2726301380,lhmandetta,,,28,314,Thu Aug 05 2021 21:49:59 GMT-0300 (Brasilia Standard Time),Thu Jul 22 2021 10:33:25 GMT-0300 (Brasilia Standard Time)
A imprensa livre noticia um crime contra a Democracia. Crime organizado e premeditado. Que o Presidente diga a que… https://t.co/LvjwV7lUkc,2726301380,,,2726301380,lhmandetta,,,241,3128,Thu Aug 05 2021 21:49:59 GMT-0300 (Brasilia Standard Time),Thu Jul 22 2021 10:31:02 GMT-0300 (Brasilia Standard Time)
"Ia acabar com o toma lá dá cá, ia combater a corrupção, mas comete estelionato eleitoral mais uma vez. Quem valoriz… https://t.co/c7wRqu5VJ4",2726301380,,,2726301380,lhmandetta,,,602,9095,Thu Aug 05 2021 21:49:59 GMT-0300 (Brasilia Standard Time),Wed Jul 21 2021 19:10:57 GMT-0300 (Brasilia Standard Time)
Um padre precisa solicitar um serviço de proteção apenas por lamentar a morte de meio milhão de brasileiros e const… https://t.co/LsC7ekucc6,2726301380,,,2726301380,lhmandetta,,,89,891,Thu Aug 05 2021 21:49:59 GMT-0300 (Brasilia Standard Time),Wed Jul 21 2021 15:00:14 GMT-0300 (Brasilia Standard Time)
Bolsonaro e Lula querem te convencer de que não existe terceira via. Eles precisam um do outro e estão com medo. Um… https://t.co/6isc60c8vs,2726301380,,,2726301380,lhmandetta,,,514,5613,Thu Aug 05 2021 21:49:59 GMT-0300 (Brasilia Standard Time),Wed Jul 21 2021 11:58:12 GMT-0300 (Brasilia Standard Time)
"O Brasil tem que encontrar um caminho de pacificação, e é por esse projeto que eu vou lutar. Por isso, abri um cana… https://t.co/IGGpX8DWQ6",2726301380,,,2726301380,lhmandetta,,,51,885,Thu Aug 05 2021 21:49:59 GMT-0300 (Brasilia Standard Time),Tue Jul 20 2021 09:02:05 GMT-0300 (Brasilia Standard Time)
"John , eu não esqueço , (oh no , oh no, oh no) , a felicidade é uma arma quente, quente… que desastre!!! Logistica, se explique!",2726301380,,,2726301380,lhmandetta,,,110,2556,Thu Aug 05 2021 21:49:59 GMT-0300 (Brasilia Standard Time),Fri Jul 16 2021 19:58:09 GMT-0300 (Brasilia Standard Time)
"A pergunta que não cala: o que levou o governo a atrasar a compra de vacinas SEM INTERMEDIÁRIOS, em 2020, e a tenta… https://t.co/SVz3ZfH342",2726301380,,,2726301380,lhmandetta,,,353,2807,Thu Aug 05 2021 21:49:59 GMT-0300 (Brasilia Standard Time),Fri Jul 16 2021 18:04:05 GMT-0300 (Brasilia Standard Time)
"@oatila Viva o SUS! Viva a CIÊNCIA! Ótima notícia, Átila",2726301380,,,2726301380,lhmandetta,,,8,1193,Thu Aug 05 2021 21:49:59 GMT-0300 (Brasilia Standard Time),Thu Jul 15 2021 11:52:48 GMT-0300 (Brasilia Standard Time)
"Após um ano , sete meses e 536 mil mortes o Ministério da Saúde fala baixinho que ‘tratamento precoce’ não é recome… https://t.co/xOtPDL5FTz",2726301380,,,2726301380,lhmandetta,,,893,8012,Thu Aug 05 2021 21:49:59 GMT-0300 (Brasilia Standard Time),Wed Jul 14 2021 12:56:28 GMT-0300 (Brasilia Standard Time)
"Minha lembrança no #DiaMundialDoRock
Esse é o final do meu livro. Quando saí do ministério da Saúde, me despedi de… https://t.co/pHoGyguhGP",2726301380,,,2726301380,lhmandetta,,,28,831,Thu Aug 05 2021 21:49:59 GMT-0300 (Brasilia Standard Time),Tue Jul 13 2021 18:32:21 GMT-0300 (Brasilia Standard Time)
"RT @RachelSherazade: 🎙Saiu a 2a. parte da minha entrevista com o ex ministro FDS Saúde @lhmandetta para o #metrópolesentrevista
Acesse o li…",2726301380,,,2726301380,lhmandetta,,,31,0,Thu Aug 05 2021 21:49:59 GMT-0300 (Brasilia Standard Time),Sat Jul 10 2021 15:20:20 GMT-0300 (Brasilia Standard Time)
"RT @RachelSherazade: 🗯Assista à entrevista completa com @lhmandetta no @Metropoles  acessando o link abaixo 👇🏻 
https://t.co/7RqIOVENXP htt…",2726301380,,,2726301380,lhmandetta,,,58,0,Thu Aug 05 2021 21:49:59 GMT-0300 (Brasilia Standard Time),Fri Jul 09 2021 15:16:26 GMT-0300 (Brasilia Standard Time)
"RT @RachelSherazade: 🎙#MandettaNoMetrópoles
Assista agora à primeira parte da minha entrevista com o ex ministro da Saúde @lhmandetta ⬇️…",2726301380,,,2726301380,lhmandetta,,,31,0,Thu Aug 05 2021 21:49:59 GMT-0300 (Brasilia Standard Time),Fri Jul 09 2021 12:46:51 GMT-0300 (Brasilia Standard Time)
"Começou o papo com o @CanalMyNews 
#MandettaNoMyNews 
https://t.co/yPmbMujzp4",2726301380,,,2726301380,lhmandetta,,,7,111,Thu Aug 05 2021 21:49:59 GMT-0300 (Brasilia Standard Time),Wed Jul 07 2021 20:32:57 GMT-0300 (Brasilia Standard Time)
RT @CanalMyNews: Ficou com vontade de mais bate-papo depois do Segunda Chamada? Então olha aí quem te faz companhia nesta quarta-feira: @ma…,2726301380,,,2726301380,lhmandetta,,,9,0,Thu Aug 05 2021 21:49:59 GMT-0300 (Brasilia Standard Time),Mon Jul 05 2021 21:42:32 GMT-0300 (Brasilia Standard Time)
A inflação está pesando demais no bolso dos mais pobres. A realidade é cruel. Apenas prorrogar o auxílio emergencia… https://t.co/fm1skEOpEp,2726301380,,,2726301380,lhmandetta,,,316,5999,Thu Aug 05 2021 21:49:59 GMT-0300 (Brasilia Standard Time),Mon Jul 05 2021 19:10:41 GMT-0300 (Brasilia Standard Time)
A reforma política é muito necessária para que o Brasil resgate a harmonia e tenha menos confusão e divisão. Precis… https://t.co/MTmuyUbNfs,2726301380,,,2726301380,lhmandetta,,,42,915,Thu Aug 05 2021 21:49:59 GMT-0300 (Brasilia Standard Time),Sat Jul 03 2021 09:00:09 GMT-0300 (Brasilia Standard Time)
"RT @democratas: Esse país tem que se encontrar na união, no respeito, no diálogo, sem ódio, sem agressão, sem violência. O Brasil pode muit…",2726301380,,,2726301380,lhmandetta,,,13,0,Thu Aug 05 2021 21:49:59 GMT-0300 (Brasilia Standard Time),Fri Jul 02 2021 15:07:20 GMT-0300 (Brasilia Standard Time)
"O Brasil tem um potencial energético, solar e eólico que não é aproveitado. Não se pode cometer os erros de monopól… https://t.co/dxesDIktmW",2726301380,,,2726301380,lhmandetta,,,28,484,Thu Aug 05 2021 21:49:59 GMT-0300 (Brasilia Standard Time),Fri Jul 02 2021 14:10:34 GMT-0300 (Brasilia Standard Time)
A arma contra doenças causadas por vírus é VACINA! Era óbvio que o país precisaria de um planejamento. Nos privaram… https://t.co/yPFSYA1s9G,2726301380,,,2726301380,lhmandetta,,,44,563,Thu Aug 05 2021 21:49:59 GMT-0300 (Brasilia Standard Time),Fri Jul 02 2021 10:36:54 GMT-0300 (Brasilia Standard Time)
Reitero aqui a minha admiração pelo governador @EduardoLeite_. Ontem tivemos a oportunidade de debater e ficou clar… https://t.co/kR3ds5gkQr,2726301380,,,2726301380,lhmandetta,,,99,3495,Thu Aug 05 2021 21:49:59 GMT-0300 (Brasilia Standard Time),Fri Jul 02 2021 09:52:46 GMT-0300 (Brasilia Standard Time)
O atual cenário é um dos piores possíveis. Os últimos governos deixaram milhões de desempregados e a imagem do país… https://t.co/PJGeTUHfpH,2726301380,,,2726301380,lhmandetta,,,74,1511,Thu Aug 05 2021 21:49:59 GMT-0300 (Brasilia Standard Time),Fri Jul 02 2021 07:31:08 GMT-0300 (Brasilia Standard Time)
"O 1º Debate dos Presidenciáveis do Centro Democrático, realizado pelo @Estadao, já vai começar. Estaremos ao vivo e… https://t.co/qsAnW8bOCS",2726301380,,,2726301380,lhmandetta,,,24,425,Thu Aug 05 2021 21:49:59 GMT-0300 (Brasilia Standard Time),Thu Jul 01 2021 18:25:18 GMT-0300 (Brasilia Standard Time)
"Olá, meus amigos!
Hoje, estarei no 1º Debate dos Presidenciáveis do Centro Democrático realizado pelo @Estadao. Vam… https://t.co/S7KCnD4gst",2726301380,,,2726301380,lhmandetta,,,44,688,Thu Aug 05 2021 21:49:59 GMT-0300 (Brasilia Standard Time),Thu Jul 01 2021 09:52:40 GMT-0300 (Brasilia Standard Time)
"A primeira linha de defesa tem que ser do próprio órgão. Isso melhorou muitos processos internos, porque eram class… https://t.co/YV3elBNKQo",2726301380,,,2726301380,lhmandetta,,,25,396,Thu Aug 05 2021 21:49:59 GMT-0300 (Brasilia Standard Time),Wed Jun 30 2021 13:14:52 GMT-0300 (Brasilia Standard Time)
"As transferências eram feitas com códigos identificadores, que podiam ser rastreados pelo Ministério Público e pelo… https://t.co/Q7sKsGeFcT",2726301380,,,2726301380,lhmandetta,,,25,406,Thu Aug 05 2021 21:49:59 GMT-0300 (Brasilia Standard Time),Wed Jun 30 2021 13:14:52 GMT-0300 (Brasilia Standard Time)
Os mecanismos internos que criei para coibir a corrupção foram ainda mais sofisticados com o dinheiro destinado par… https://t.co/tWA5j5Q53B,2726301380,,,2726301380,lhmandetta,,,22,245,Thu Aug 05 2021 21:49:59 GMT-0300 (Brasilia Standard Time),Wed Jun 30 2021 13:14:51 GMT-0300 (Brasilia Standard Time)
"Quando ministro, estruturei um departamento inteiro para evitar a corrupção. Essa estrutura não existia. Foi o prim… https://t.co/I4RCwDEeG5",2726301380,,,2726301380,lhmandetta,,,150,1987,Thu Aug 05 2021 21:49:59 GMT-0300 (Brasilia Standard Time),Wed Jun 30 2021 13:14:51 GMT-0300 (Brasilia Standard Time)
"@OTavioFilho2 Pra vc ver a importância de exemplo e liderança. Quando ministro, estruturei um departamento inteiro… https://t.co/2tFWMGAwGO",2726301380,,,2726301380,lhmandetta,,,2,90,Thu Aug 05 2021 21:49:59 GMT-0300 (Brasilia Standard Time),Wed Jun 30 2021 10:04:54 GMT-0300 (Brasilia Standard Time)
"Cai a desculpa de que o problema na saúde era logística. Transparece o tráfico de interesses escusos, típicos do to… https://t.co/1NSCSYr0ik",2726301380,,,2726301380,lhmandetta,,,879,12640,Thu Aug 05 2021 21:49:59 GMT-0300 (Brasilia Standard Time),Tue Jun 29 2021 22:39:17 GMT-0300 (Brasilia Standard Time)
"Parabéns, governador @ronaldocaiado, pela captura de Lázaro. O Brasil precisa de pulso firme contra o crime, de rigor com os criminosos.",2726301380,,,2726301380,lhmandetta,,,49,2164,Thu Aug 05 2021 21:49:59 GMT-0300 (Brasilia Standard Time),Mon Jun 28 2021 10:16:14 GMT-0300 (Brasilia Standard Time)
RT @Estadao: &gt;@EstadaoPolitica ‘Estadão’ vai promover debates com o @CLP_Brasil; Primeira edição do 'Primárias' reúne os presidenciáveis @c…,2726301380,,,2726301380,lhmandetta,,,290,0,Thu Aug 05 2021 21:49:59 GMT-0300 (Brasilia Standard Time),Sun Jun 27 2021 10:52:56 GMT-0300 (Brasilia Standard Time)
"Imunidade de rebanho e isolamento vertical eram as vozes das trevas, entre elas Paulo Guedes. Induziram o  governo… https://t.co/DsGF8RwduQ",2726301380,,,2726301380,lhmandetta,,,523,7850,Thu Aug 05 2021 21:49:59 GMT-0300 (Brasilia Standard Time),Fri Jun 25 2021 21:48:33 GMT-0300 (Brasilia Standard Time)
"Ontem no @flowpdc me perguntaram se eu sou a favor da privatização do SUS. É pura fake news. Primeiramente, o SUS é… https://t.co/VAHIDeHID1",2726301380,,,2726301380,lhmandetta,,,36,751,Thu Aug 05 2021 21:49:59 GMT-0300 (Brasilia Standard Time),Fri Jun 25 2021 20:07:06 GMT-0300 (Brasilia Standard Time)
"RT @flowpdc: ""Quando você tem uma doença nova, uma epidemia, a regra número 1 é você falar a verdade. Transparência total. Por que através…",2726301380,,,2726301380,lhmandetta,,,33,0,Thu Aug 05 2021 21:49:59 GMT-0300 (Brasilia Standard Time),Thu Jun 24 2021 23:13:21 GMT-0300 (Brasilia Standard Time)
"RT @flowpdc: Mandetta: ""O sistema de vacinação do SUS é considerado no mundo inteiro um parâmetro de excelência. Nós somos bons para vacina…",2726301380,,,2726301380,lhmandetta,,,27,0,Thu Aug 05 2021 21:49:59 GMT-0300 (Brasilia Standard Time),Thu Jun 24 2021 23:12:46 GMT-0300 (Brasilia Standard Time)
"RT @CorteOlha: A TRAGÉDIA SERIA MUITO PIOR SE NÃO FOSSE O SUS - MANDETTA | OLHA O CORTE https://t.co/a7okk85IuV via @YouTube 
#flowpodcast…",2726301380,,,2726301380,lhmandetta,,,13,0,Thu Aug 05 2021 21:49:59 GMT-0300 (Brasilia Standard Time),Thu Jun 24 2021 23:11:42 GMT-0300 (Brasilia Standard Time)
"Começou o papo no @flowpdc 👇
https://t.co/2CZYo0fZsN",2726301380,,,2726301380,lhmandetta,,,14,202,Thu Aug 05 2021 21:49:59 GMT-0300 (Brasilia Standard Time),Thu Jun 24 2021 20:22:59 GMT-0300 (Brasilia Standard Time)
"Olá, meus amigos.
Hoje, quinta-feira, vou participar do @flowpdc às 20h! Avise todo mundo e não perca… https://t.co/Gx2qowDDSR",2726301380,,,2726301380,lhmandetta,,,94,1857,Thu Aug 05 2021 21:49:59 GMT-0300 (Brasilia Standard Time),Thu Jun 24 2021 09:37:34 GMT-0300 (Brasilia Standard Time)
"Enquanto não atacarmos as outras formas da pobreza (educação, habitação, segurança alimentar, etc), o país pode ger… https://t.co/0mWBWz34UK",2726301380,,,2726301380,lhmandetta,,,13,370,Thu Aug 05 2021 21:49:59 GMT-0300 (Brasilia Standard Time),Tue Jun 22 2021 18:07:25 GMT-0300 (Brasilia Standard Time)
"Criou-se uma porta de entrada grande para o Bolsa Família, mas não conseguimos criar estradas de saída para um sist… https://t.co/nXWX9VR9p5",2726301380,,,2726301380,lhmandetta,,,11,346,Thu Aug 05 2021 21:49:59 GMT-0300 (Brasilia Standard Time),Tue Jun 22 2021 18:07:24 GMT-0300 (Brasilia Standard Time)
"Tivemos um auxílio emergencial insuficiente e muito mal pensado, que foi interrompido e praticamente forçou uma seg… https://t.co/sriKlH6soo",2726301380,,,2726301380,lhmandetta,,,4,88,Thu Aug 05 2021 21:49:59 GMT-0300 (Brasilia Standard Time),Tue Jun 22 2021 18:07:24 GMT-0300 (Brasilia Standard Time)
"A pandemia escancarou uma mentalidade política perversa, que atravessou governos e ameaça continuar. Não temos polí… https://t.co/yh7BtsQbvQ",2726301380,,,2726301380,lhmandetta,,,84,953,Thu Aug 05 2021 21:49:59 GMT-0300 (Brasilia Standard Time),Tue Jun 22 2021 18:07:23 GMT-0300 (Brasilia Standard Time)
@ECantanhede O que eu não consegui fazer foi mostrar a gravidade do erro que se estava cometendo. Embora eu tenha d… https://t.co/G54zq9yC4K,2726301380,,,2726301380,lhmandetta,,,15,316,Thu Aug 05 2021 21:49:59 GMT-0300 (Brasilia Standard Time),Tue Jun 22 2021 17:22:48 GMT-0300 (Brasilia Standard Time)
É preciso sabedoria para liderar o país. É preciso ter respeito com a imprensa. É preciso alma para estar junto. É… https://t.co/zRZVGv6tZY,2726301380,,,2726301380,lhmandetta,,,876,13128,Thu Aug 05 2021 21:49:59 GMT-0300 (Brasilia Standard Time),Mon Jun 21 2021 17:45:25 GMT-0300 (Brasilia Standard Time)
Meio milhão de mortos. É dor demais. A ausência de liderança não apenas provocou uma tragédia muito maior do que de… https://t.co/ZwfbEkQI2O,2726301380,,,2726301380,lhmandetta,,,762,9759,Thu Aug 05 2021 21:49:59 GMT-0300 (Brasilia Standard Time),Sat Jun 19 2021 17:10:02 GMT-0300 (Brasilia Standard Time)
Parabéns Fernando Henrique Cardoso por seus 90 anos. E também por sua história de trabalho em favor do Brasil e pel… https://t.co/42Rxe9NqBK,2726301380,,,2726301380,lhmandetta,,,43,1669,Thu Aug 05 2021 21:49:59 GMT-0300 (Brasilia Standard Time),Fri Jun 18 2021 15:52:25 GMT-0300 (Brasilia Standard Time)
Os pobres têm direito à dignidade alimentar. Não se pode retroceder na política nacional de segurança alimentar. A… https://t.co/V0pfdzdH32,2726301380,,,2726301380,lhmandetta,,,175,2428,Thu Aug 05 2021 21:49:59 GMT-0300 (Brasilia Standard Time),Fri Jun 18 2021 13:42:42 GMT-0300 (Brasilia Standard Time)
"@LucianoHuck @PBiaL Amigo, conheço seu compromisso com o Brasil e sei que, em qualquer condição, você continuará tr… https://t.co/kJrmS9xpgH",2726301380,,,2726301380,lhmandetta,,,6,345,Thu Aug 05 2021 21:49:59 GMT-0300 (Brasilia Standard Time),Wed Jun 16 2021 15:36:44 GMT-0300 (Brasilia Standard Time)
@thelminha 👆,2726301380,,,2726301380,lhmandetta,,,4,101,Thu Aug 05 2021 21:49:59 GMT-0300 (Brasilia Standard Time),Tue Jun 15 2021 21:45:33 GMT-0300 (Brasilia Standard Time)
O que seria do Brasil na pandemia sem o SUS?Eu e @thelma conversamos com @lfdavilaoficial sobre o desafio. No começ… https://t.co/G6QHK3KRRK,2726301380,,,2726301380,lhmandetta,,,28,753,Thu Aug 05 2021 21:49:59 GMT-0300 (Brasilia Standard Time),Tue Jun 15 2021 20:33:23 GMT-0300 (Brasilia Standard Time)
"Comida, remédio, gás, energia elétrica. Quando esses preços sobem, quem sofre são os mais pobres. O cenário é cruel… https://t.co/fzHJ6WYa7z",2726301380,,,2726301380,lhmandetta,,,171,2262,Thu Aug 05 2021 21:49:59 GMT-0300 (Brasilia Standard Time),Tue Jun 15 2021 17:55:19 GMT-0300 (Brasilia Standard Time)
"@joaoamoedonovo Mais que nunca precisamos de lideranças como você, amigo. Sigamos juntos na construção de um projet… https://t.co/AlQ49jga1l",2726301380,,,2726301380,lhmandetta,,,93,3203,Thu Aug 05 2021 21:49:59 GMT-0300 (Brasilia Standard Time),Fri Jun 11 2021 08:17:14 GMT-0300 (Brasilia Standard Time)
RT @o_antagonista: .@lhmandetta comentou com O Antagonista a pré-candidatura de @joaoamoedonovo ao Palácio do Planalto em 2022. https://t.c…,2726301380,,,2726301380,lhmandetta,,,42,0,Thu Aug 05 2021 21:49:59 GMT-0300 (Brasilia Standard Time),Wed Jun 02 2021 11:45:35 GMT-0300 (Brasilia Standard Time)
A Cova  América chega bem mais rápido que as vacinas e o bom senso. Gol contra a vida. Só o vírus comemora.,2726301380,,,2726301380,lhmandetta,,,972,10900,Thu Aug 05 2021 21:49:59 GMT-0300 (Brasilia Standard Time),Mon May 31 2021 16:30:53 GMT-0300 (Brasilia Standard Time)
"Pandemia em expansão. Brasil é, neste momento, um grande covidário. Hoje ficamos sabendo que o Brasil vai sediar a… https://t.co/1JelBwv6Vc",2726301380,,,2726301380,lhmandetta,,,755,8075,Thu Aug 05 2021 21:49:59 GMT-0300 (Brasilia Standard Time),Mon May 31 2021 14:29:24 GMT-0300 (Brasilia Standard Time)
"Lavem as mãos. Usem máscara. Se puder, não aglomerem. Quem tiver a chance: VACINE.  Fé para nos dar forças, ciência… https://t.co/VB2fzjDlr2",2726301380,,,2726301380,lhmandetta,,,726,12488,Thu Aug 05 2021 21:49:59 GMT-0300 (Brasilia Standard Time),Thu May 20 2021 17:04:39 GMT-0300 (Brasilia Standard Time)
@Luiscmrib Porque já tem muita gente que deveria falar se escondendo em proteção judicial para ficar calado.,2726301380,,,2726301380,lhmandetta,,,40,1470,Thu Aug 05 2021 21:49:59 GMT-0300 (Brasilia Standard Time),Wed May 19 2021 14:31:48 GMT-0300 (Brasilia Standard Time)
"Dia D , hora H. Omissão cumprida.",2726301380,,,2726301380,lhmandetta,,,1637,17494,Thu Aug 05 2021 21:49:59 GMT-0300 (Brasilia Standard Time),Wed May 19 2021 14:19:59 GMT-0300 (Brasilia Standard Time)
"RT @o_antagonista: Eduardo Pazuello, em sua fala inicial na CPI da Covid, com a arrogância que lhe é característica, leu um texto previamen…",2726301380,,,2726301380,lhmandetta,,,50,0,Thu Aug 05 2021 21:49:59 GMT-0300 (Brasilia Standard Time),Wed May 19 2021 11:36:33 GMT-0300 (Brasilia Standard Time)
"Tristeza. @brunocovas, meu colega de Legislatura, homem público de valores, íntegro. Lutou o bom combate. Que possa… https://t.co/c302wuDFux",2726301380,,,2726301380,lhmandetta,,,160,8996,Thu Aug 05 2021 21:49:59 GMT-0300 (Brasilia Standard Time),Sun May 16 2021 10:29:08 GMT-0300 (Brasilia Standard Time)
Silencio para 430000 mortes? Silêncio fala. Silêncio grita. Silêncio denuncia . Silêncio confessa. Silêncio envergonha. Silêncio!,2726301380,,,2726301380,lhmandetta,,,1580,17044,Thu Aug 05 2021 21:49:59 GMT-0300 (Brasilia Standard Time),Fri May 14 2021 19:58:59 GMT-0300 (Brasilia Standard Time)
"RT @o_antagonista: Mandetta: “Bolsonaro perde no primeiro turno, perde no segundo” https://t.co/qQzytFBpvS",2726301380,,,2726301380,lhmandetta,,,216,0,Thu Aug 05 2021 21:49:59 GMT-0300 (Brasilia Standard Time),Fri May 14 2021 11:16:24 GMT-0300 (Brasilia Standard Time)
O que diferencia uma sociedade civilizada da barbárie é a promoção de justiça. Jacarezinho é a síntese da barbárie.… https://t.co/TjxgPfYijD,2726301380,,,2726301380,lhmandetta,,,256,5784,Thu Aug 05 2021 21:49:59 GMT-0300 (Brasilia Standard Time),Fri May 07 2021 13:17:09 GMT-0300 (Brasilia Standard Time)
“Há anos que o SUS precisava de um trabalho técnico. Foram muitos anos que o Ministério da Saúde foi usado como ins… https://t.co/XtmMZy8qev,2726301380,,,2726301380,lhmandetta,,,47,1086,Thu Aug 05 2021 21:49:59 GMT-0300 (Brasilia Standard Time),Thu May 06 2021 10:37:38 GMT-0300 (Brasilia Standard Time)
"Aqui é ciência.
https://t.co/HrDbMsS10b",2726301380,,,2726301380,lhmandetta,,,167,3337,Thu Aug 05 2021 21:49:59 GMT-0300 (Brasilia Standard Time),Wed May 05 2021 11:04:18 GMT-0300 (Brasilia Standard Time)
@cirogomes @alexandrekalil @antonionetopdt @marciofrancasp Projeto de nação se constrói com diálogo. Vamos nessa. Até mais tarde!,2726301380,,,2726301380,lhmandetta,,,78,1386,Thu Aug 05 2021 21:49:59 GMT-0300 (Brasilia Standard Time),Fri Apr 30 2021 17:01:38 GMT-0300 (Brasilia Standard Time)
"400 mil. Não é só um número. Não pode ser. Dentro da crença de cada um, rezem pelo conforto das famílias enlutadas.… https://t.co/7BKKADgpUO",2726301380,,,2726301380,lhmandetta,,,434,6513,Thu Aug 05 2021 21:49:59 GMT-0300 (Brasilia Standard Time),Thu Apr 29 2021 14:05:15 GMT-0300 (Brasilia Standard Time)
"@Julio_cesarcs @pedrodoria @cirogomes @camposmello Boa leitura, Cesar! Depois me diga o que achou.",2726301380,,,2726301380,lhmandetta,,,0,48,Thu Aug 05 2021 21:49:59 GMT-0300 (Brasilia Standard Time),Mon Apr 26 2021 21:50:12 GMT-0300 (Brasilia Standard Time)
"RT @o_antagonista: “A gente sabe que existe um pesadelo ali na frente, chamado Lula e Bolsonaro” https://t.co/COwMcPjPlf",2726301380,,,2726301380,lhmandetta,,,94,0,Thu Aug 05 2021 21:49:59 GMT-0300 (Brasilia Standard Time),Fri Apr 23 2021 09:52:18 GMT-0300 (Brasilia Standard Time)
