text,query,country,city,userId,username,quote_count,reply_count,retweet_count,favorite_count,timestamp,createdAt
"💉Mais uma vez vamos “sextar” amanhã com a chegada de vacina, minha gente! Às 14h15 receberemos 121.680 doses da Pfi… https://t.co/x47HQSj8Cz",32101740,,,32101740,ronaldocaiado,,,3,48,Thu Aug 05 2021 21:49:42 GMT-0300 (Brasilia Standard Time),Thu Aug 05 2021 21:29:26 GMT-0300 (Brasilia Standard Time)
O local tem capacidade para 10 mil atendimentos por mês e um totem de autoatendimento do Expresso com mais de 70 se… https://t.co/RAZB7tKnLB,32101740,,,32101740,ronaldocaiado,,,0,18,Thu Aug 05 2021 21:49:42 GMT-0300 (Brasilia Standard Time),Thu Aug 05 2021 18:14:03 GMT-0300 (Brasilia Standard Time)
"A maneira com que se trata a capital é a mesma que devemos tratar as cidades do interior, dando dignidade e cidadan… https://t.co/5MyBy4aQH4",32101740,,,32101740,ronaldocaiado,,,1,24,Thu Aug 05 2021 21:49:42 GMT-0300 (Brasilia Standard Time),Thu Aug 05 2021 18:14:02 GMT-0300 (Brasilia Standard Time)
O povo israelense é irmão dos goianos. Conte conosco!,32101740,,,32101740,ronaldocaiado,,,2,34,Thu Aug 05 2021 21:49:42 GMT-0300 (Brasilia Standard Time),Thu Aug 05 2021 15:17:40 GMT-0300 (Brasilia Standard Time)
"Não tenho dúvidas de que essa parceria vai render bons frutos para Goiás, e que teremos alternativas ainda mais efi… https://t.co/AgQ1QmvkOB",32101740,,,32101740,ronaldocaiado,,,1,32,Thu Aug 05 2021 21:49:42 GMT-0300 (Brasilia Standard Time),Thu Aug 05 2021 15:17:39 GMT-0300 (Brasilia Standard Time)
Sou um admirador do País e dessa gente que sabe se reinventar em meio às dificuldades. https://t.co/kPWFjBtXiN,32101740,,,32101740,ronaldocaiado,,,1,16,Thu Aug 05 2021 21:49:42 GMT-0300 (Brasilia Standard Time),Thu Aug 05 2021 15:17:36 GMT-0300 (Brasilia Standard Time)
"Eu acredito na pesquisa e na ciência, caminhos que os israelenses buscaram para desenvolver as tecnologias mais sof… https://t.co/6nfbffxIql",32101740,,,32101740,ronaldocaiado,,,3,46,Thu Aug 05 2021 21:49:42 GMT-0300 (Brasilia Standard Time),Thu Aug 05 2021 15:17:33 GMT-0300 (Brasilia Standard Time)
"Rio Verde nos orgulha, e ao lado do prefeito @PauloDoVale1525, temos levado ainda mais desenvolvimento e oportunida… https://t.co/Ih8uOtPaqB",32101740,,,32101740,ronaldocaiado,,,1,18,Thu Aug 05 2021 21:49:42 GMT-0300 (Brasilia Standard Time),Thu Aug 05 2021 09:21:26 GMT-0300 (Brasilia Standard Time)
"Hoje é um dia especial, minha gente! Rio Verde, a nossa potência do agronegócio, completa 173 anos. Ser referência… https://t.co/Fj9RicJXdz",32101740,,,32101740,ronaldocaiado,,,3,61,Thu Aug 05 2021 21:49:42 GMT-0300 (Brasilia Standard Time),Thu Aug 05 2021 09:21:25 GMT-0300 (Brasilia Standard Time)
"E o caminhão da alegria chegou. Recebemos hoje 119.990 doses de vacinas contra a Covid-19, sendo 41.600 da CoronaVa… https://t.co/9bKPlU1gxe",32101740,,,32101740,ronaldocaiado,,,1,82,Thu Aug 05 2021 21:49:42 GMT-0300 (Brasilia Standard Time),Wed Aug 04 2021 21:03:16 GMT-0300 (Brasilia Standard Time)
Um investimento de mais de R$ 3 MILHÕES para a melhoria no ensino público do nosso Estado que é 1º lugar no Brasil.,32101740,,,32101740,ronaldocaiado,,,2,22,Thu Aug 05 2021 21:49:42 GMT-0300 (Brasilia Standard Time),Wed Aug 04 2021 18:30:53 GMT-0300 (Brasilia Standard Time)
"A realidade agora é outra, minha gente, ao lado do prefeito Dr. Lucas entreguei o Colégio Estadual Rocha Leal, uma… https://t.co/bsT5HJoAo0",32101740,,,32101740,ronaldocaiado,,,4,37,Thu Aug 05 2021 21:49:42 GMT-0300 (Brasilia Standard Time),Wed Aug 04 2021 18:30:53 GMT-0300 (Brasilia Standard Time)
"Dá pra acreditar que Águas Lindas, uma das cidades mais populosas de Goiás, nunca teve colégio de tempo integral? P… https://t.co/NRES2SQUK0",32101740,,,32101740,ronaldocaiado,,,7,64,Thu Aug 05 2021 21:49:42 GMT-0300 (Brasilia Standard Time),Wed Aug 04 2021 18:30:50 GMT-0300 (Brasilia Standard Time)
"E por falar em Olimpíadas, Goiás só entra em campo pra levar medalha de ouro! Temos colecionado pódios, minha gente… https://t.co/Q1mKdJEGGM",32101740,,,32101740,ronaldocaiado,,,6,43,Thu Aug 05 2021 21:49:42 GMT-0300 (Brasilia Standard Time),Wed Aug 04 2021 09:11:20 GMT-0300 (Brasilia Standard Time)
RT @aredacao: ENSINO SUPERIOR - Caiado empossa novo reitor da UEG e defende autonomia da universidade. Antônio Cruvinel Borges Neto assume…,32101740,,,32101740,ronaldocaiado,,,5,0,Thu Aug 05 2021 21:49:42 GMT-0300 (Brasilia Standard Time),Wed Aug 04 2021 08:28:25 GMT-0300 (Brasilia Standard Time)
"Olha o caminhão da vacina, minha gente! Amanhã vamos receber 119.990 novas doses contra a Covid-19. Serão 41.600 do… https://t.co/sjAJsriOTu",32101740,,,32101740,ronaldocaiado,,,12,312,Thu Aug 05 2021 21:49:42 GMT-0300 (Brasilia Standard Time),Tue Aug 03 2021 20:07:27 GMT-0300 (Brasilia Standard Time)
"📚📝 Não vamos permitir que a UEG se transforme em balcão de negócios, mas sim o lugar do conhecimento, pesquisa e ci… https://t.co/sHh5Kofv5s",32101740,,,32101740,ronaldocaiado,,,4,68,Thu Aug 05 2021 21:49:42 GMT-0300 (Brasilia Standard Time),Tue Aug 03 2021 18:12:09 GMT-0300 (Brasilia Standard Time)
Todos sabem que sou um verdadeiro entusiasta dos esportes! E hoje tive a oportunidade de receber o ex-lutador Rodri… https://t.co/4Xrb3yueSF,32101740,,,32101740,ronaldocaiado,,,3,202,Thu Aug 05 2021 21:49:42 GMT-0300 (Brasilia Standard Time),Tue Aug 03 2021 16:51:27 GMT-0300 (Brasilia Standard Time)
"RT @ConsedBR: Em Goiás, o governador Ronaldo Caiado participou, no último dia 05/07, da solenidade de entrega de 210 novos Ônibus Rurais Es…",32101740,,,32101740,ronaldocaiado,,,4,0,Thu Aug 05 2021 21:49:42 GMT-0300 (Brasilia Standard Time),Tue Aug 03 2021 13:10:33 GMT-0300 (Brasilia Standard Time)
"Ainda temos um caminho longo pela frente, mas não vamos descansar até que todos os goianos estejam imunizados. Quan… https://t.co/heYBkJr4BA",32101740,,,32101740,ronaldocaiado,,,2,30,Thu Aug 05 2021 21:49:42 GMT-0300 (Brasilia Standard Time),Tue Aug 03 2021 09:01:50 GMT-0300 (Brasilia Standard Time)
Já ultrapassamos a marca de 3 milhões de goianos vacinados com a 1ª dose contra a Covid-19. A vacinação avança em t… https://t.co/WwHxoXS1qA,32101740,,,32101740,ronaldocaiado,,,9,70,Thu Aug 05 2021 21:49:42 GMT-0300 (Brasilia Standard Time),Tue Aug 03 2021 09:01:49 GMT-0300 (Brasilia Standard Time)
"Depois de três décadas, o prédio Advogado Jorge Jungmann foi completamente revitalizado, está mais moderno e pronto… https://t.co/llRRpxxNKA",32101740,,,32101740,ronaldocaiado,,,3,45,Thu Aug 05 2021 21:49:42 GMT-0300 (Brasilia Standard Time),Mon Aug 02 2021 22:54:25 GMT-0300 (Brasilia Standard Time)
"RT @governogoias: Goiás bate recorde em abertura de empresas no mês de junho 🏆 Só no primeiro semestre deste ano, foram registrados 17.321…",32101740,,,32101740,ronaldocaiado,,,3,0,Thu Aug 05 2021 21:49:42 GMT-0300 (Brasilia Standard Time),Mon Aug 02 2021 20:36:35 GMT-0300 (Brasilia Standard Time)
"🚔🚨 Pra fechar o dia em Itumbiara, inauguramos a Central de Flagrantes e Pronto Atendimento ao Cidadão, o Grupo de I… https://t.co/Dvdkx9RahU",32101740,,,32101740,ronaldocaiado,,,2,20,Thu Aug 05 2021 21:49:42 GMT-0300 (Brasilia Standard Time),Mon Aug 02 2021 20:14:19 GMT-0300 (Brasilia Standard Time)
"🏭 Também realizamos uma série de visitas, junto com o prefeito @dionedafamoveis, em fábricas que vão levar mais des… https://t.co/fvqyorVFAb",32101740,,,32101740,ronaldocaiado,,,2,18,Thu Aug 05 2021 21:49:42 GMT-0300 (Brasilia Standard Time),Mon Aug 02 2021 20:14:17 GMT-0300 (Brasilia Standard Time)
"Como recompensa, temos o olhar de felicidade no rosto das nossas crianças. Gratificante demais! https://t.co/JM6NTyPIeF",32101740,,,32101740,ronaldocaiado,,,1,8,Thu Aug 05 2021 21:49:42 GMT-0300 (Brasilia Standard Time),Mon Aug 02 2021 20:14:14 GMT-0300 (Brasilia Standard Time)
Aqui a gente trabalha 24h para garantir que nossos 530 mil alunos tenham as MELHORES condições de ensino do país. E… https://t.co/bSM2qro6ke,32101740,,,32101740,ronaldocaiado,,,5,56,Thu Aug 05 2021 21:49:42 GMT-0300 (Brasilia Standard Time),Mon Aug 02 2021 20:14:12 GMT-0300 (Brasilia Standard Time)
@Guilhermeehss Um abraço!,32101740,,,32101740,ronaldocaiado,,,0,4,Thu Aug 05 2021 21:49:42 GMT-0300 (Brasilia Standard Time),Mon Aug 02 2021 12:29:04 GMT-0300 (Brasilia Standard Time)
"📚💻 Minha gente, as aulas da rede estadual retornaram de forma híbrida hoje, e nossos investimentos para garantir um… https://t.co/fTnTza8VQU",32101740,,,32101740,ronaldocaiado,,,6,70,Thu Aug 05 2021 21:49:42 GMT-0300 (Brasilia Standard Time),Mon Aug 02 2021 09:18:51 GMT-0300 (Brasilia Standard Time)
@lauracsresende @_arcolino Até setembro chega a sua vez! Um abraço!,32101740,,,32101740,ronaldocaiado,,,0,6,Thu Aug 05 2021 21:49:42 GMT-0300 (Brasilia Standard Time),Sun Aug 01 2021 17:22:03 GMT-0300 (Brasilia Standard Time)
@MarianaLadeir Tudo bem? Qual a sua faixa etária?,32101740,,,32101740,ronaldocaiado,,,1,42,Thu Aug 05 2021 21:49:42 GMT-0300 (Brasilia Standard Time),Sun Aug 01 2021 12:58:35 GMT-0300 (Brasilia Standard Time)
Tá todo mundo em clima de Olimpíadas! Os brasileiros não brincam em serviço e assistir às competições é sempre um s… https://t.co/eLezRoAAOs,32101740,,,32101740,ronaldocaiado,,,3,87,Thu Aug 05 2021 21:49:42 GMT-0300 (Brasilia Standard Time),Sun Aug 01 2021 09:04:38 GMT-0300 (Brasilia Standard Time)
"Gostou? Então leva essa imunização para casa. Quando a sua vez chegar, vacine-se. #VacinaGoiás",32101740,,,32101740,ronaldocaiado,,,2,50,Thu Aug 05 2021 21:49:42 GMT-0300 (Brasilia Standard Time),Sat Jul 31 2021 18:03:15 GMT-0300 (Brasilia Standard Time)
"Foi aqui que pediram mais uma dobradinha de vacina? Tá aí, minha gente, dois carregamentos de 233.130 doses contra… https://t.co/QR4Ak0OKgT",32101740,,,32101740,ronaldocaiado,,,10,128,Thu Aug 05 2021 21:49:42 GMT-0300 (Brasilia Standard Time),Sat Jul 31 2021 18:03:15 GMT-0300 (Brasilia Standard Time)
@ronaldomota36 Não fui eu!,32101740,,,32101740,ronaldocaiado,,,1,77,Thu Aug 05 2021 21:49:42 GMT-0300 (Brasilia Standard Time),Sat Jul 31 2021 15:43:03 GMT-0300 (Brasilia Standard Time)
"Hoje é um dia muito especial pra mim. Neste 31 de julho, minha terra natal, a querida Anápolis, completa seus 114 a… https://t.co/CWRCv8lpLL",32101740,,,32101740,ronaldocaiado,,,6,71,Thu Aug 05 2021 21:49:42 GMT-0300 (Brasilia Standard Time),Sat Jul 31 2021 08:33:31 GMT-0300 (Brasilia Standard Time)
@NivaldoBAND Obrigado pelo carinho e reconhecimento. Um abraço!,32101740,,,32101740,ronaldocaiado,,,1,17,Thu Aug 05 2021 21:49:42 GMT-0300 (Brasilia Standard Time),Fri Jul 30 2021 22:55:35 GMT-0300 (Brasilia Standard Time)
RT @NivaldoBAND: Parabéns ao @ronaldocaiado por todo zelo demonstrado com  a população de Goiás durante esse período terrível de pandemia.…,32101740,,,32101740,ronaldocaiado,,,3,0,Thu Aug 05 2021 21:49:42 GMT-0300 (Brasilia Standard Time),Fri Jul 30 2021 22:55:08 GMT-0300 (Brasilia Standard Time)
"Não descuidamos da saúde, da segurança e não vamos permitir que a história de Goiás deixe de ser enaltecida.… https://t.co/pUBuvfFRLA",32101740,,,32101740,ronaldocaiado,,,2,19,Thu Aug 05 2021 21:49:42 GMT-0300 (Brasilia Standard Time),Fri Jul 30 2021 20:31:04 GMT-0300 (Brasilia Standard Time)
"E vocês sabem que só lanço o que já está depositado em caixa. Em qualquer evento sob minha gestão, os trabalhadores… https://t.co/SPdy92y7SI",32101740,,,32101740,ronaldocaiado,,,2,22,Thu Aug 05 2021 21:49:42 GMT-0300 (Brasilia Standard Time),Fri Jul 30 2021 20:31:01 GMT-0300 (Brasilia Standard Time)
"Hoje é um dia especial para o setor mais prejudicado pela pandemia: lançamos o programa “Retomada Cultural”, com um… https://t.co/4XqIxmZXvA",32101740,,,32101740,ronaldocaiado,,,4,41,Thu Aug 05 2021 21:49:42 GMT-0300 (Brasilia Standard Time),Fri Jul 30 2021 20:31:00 GMT-0300 (Brasilia Standard Time)
"RT @radioimprensa: “O Estado da vez é Goiás”, diz Caiado no lançamento de guia para retomada econômica https://t.co/fH5dzs8KSO",32101740,,,32101740,ronaldocaiado,,,2,0,Thu Aug 05 2021 21:49:42 GMT-0300 (Brasilia Standard Time),Fri Jul 30 2021 19:17:50 GMT-0300 (Brasilia Standard Time)
"RT @jornal_opopular: O governador Ronaldo Caiado anunciou a chegada de 127.530 imunizantes da Pfizer e 108.200 da CoronaVac

📲 Leia Agora n…",32101740,,,32101740,ronaldocaiado,,,6,0,Thu Aug 05 2021 21:49:42 GMT-0300 (Brasilia Standard Time),Fri Jul 30 2021 19:02:34 GMT-0300 (Brasilia Standard Time)
"Dinheiro público não é pra enriquecer nem pra fazer campanha eleitoral, é pra beneficiar a vida do cidadão. #ÉPorVocêQueaGenteFaz",32101740,,,32101740,ronaldocaiado,,,4,41,Thu Aug 05 2021 21:49:42 GMT-0300 (Brasilia Standard Time),Fri Jul 30 2021 18:15:23 GMT-0300 (Brasilia Standard Time)
"A antiga Agetop era utilizada como agência de propina e todo mundo sabe disso. Mas em nossa gestão, minha gente, os… https://t.co/7MBXwaGAeK",32101740,,,32101740,ronaldocaiado,,,4,51,Thu Aug 05 2021 21:49:42 GMT-0300 (Brasilia Standard Time),Fri Jul 30 2021 18:15:22 GMT-0300 (Brasilia Standard Time)
#VacinaGoiás https://t.co/k3y0oxEYF7,32101740,,,32101740,ronaldocaiado,,,11,136,Thu Aug 05 2021 21:49:42 GMT-0300 (Brasilia Standard Time),Fri Jul 30 2021 14:15:37 GMT-0300 (Brasilia Standard Time)
"💉💪 Alguém ouviu a palavra VACINA? É isso mesmo, minha gente! Amanhã vamos receber 235.730 doses, sendo 127.530 da P… https://t.co/ezws996ckM",32101740,,,32101740,ronaldocaiado,,,24,390,Thu Aug 05 2021 21:49:42 GMT-0300 (Brasilia Standard Time),Fri Jul 30 2021 14:13:32 GMT-0300 (Brasilia Standard Time)
"Para saber mais, acesse: https://t.co/ohWfcGXNsX
#ÉPorVocêQueAGenteFaz",32101740,,,32101740,ronaldocaiado,,,1,12,Thu Aug 05 2021 21:49:42 GMT-0300 (Brasilia Standard Time),Fri Jul 30 2021 09:22:43 GMT-0300 (Brasilia Standard Time)
"Apitou, começou, minha gente! O programa Jovem Aprendiz foi lançado. Serão 5 mil vagas que vão transformar a vida d… https://t.co/KRVtolThDy",32101740,,,32101740,ronaldocaiado,,,8,46,Thu Aug 05 2021 21:49:42 GMT-0300 (Brasilia Standard Time),Fri Jul 30 2021 09:22:43 GMT-0300 (Brasilia Standard Time)
"Além da bolsa salarial de R$ 516,66, eles receberão vale transporte, cartão alimentação, seguro de vida, uniformes… https://t.co/2dLmDAA8Lo",32101740,,,32101740,ronaldocaiado,,,0,14,Thu Aug 05 2021 21:49:42 GMT-0300 (Brasilia Standard Time),Fri Jul 30 2021 09:02:51 GMT-0300 (Brasilia Standard Time)
"O programa Aprendiz do Futuro vai inserir jovens entre 14 e 16 anos no mercado de trabalho, garantindo uma renda extra às suas famílias.",32101740,,,32101740,ronaldocaiado,,,0,13,Thu Aug 05 2021 21:49:42 GMT-0300 (Brasilia Standard Time),Fri Jul 30 2021 09:02:50 GMT-0300 (Brasilia Standard Time)
É aliando oportunidade profissional à educação para os jovens que nós vamos levar dignidade e qualidade de vida par… https://t.co/yHgkZo6Yny,32101740,,,32101740,ronaldocaiado,,,1,25,Thu Aug 05 2021 21:49:42 GMT-0300 (Brasilia Standard Time),Fri Jul 30 2021 09:02:50 GMT-0300 (Brasilia Standard Time)
"Além da bolsa salarial de R$ 516,66, eles receberão vale transporte, cartão alimentação, seguro de vida, uniformes… https://t.co/GRrTvQ7oNk",32101740,,,32101740,ronaldocaiado,,,1,9,Thu Aug 05 2021 21:49:42 GMT-0300 (Brasilia Standard Time),Fri Jul 30 2021 09:02:08 GMT-0300 (Brasilia Standard Time)
"O programa Aprendiz do Futuro vai inserir jovens entre 14 e 16 anos no mercado de trabalho, garantindo uma renda extra às suas famílias.",32101740,,,32101740,ronaldocaiado,,,1,8,Thu Aug 05 2021 21:49:42 GMT-0300 (Brasilia Standard Time),Fri Jul 30 2021 09:02:07 GMT-0300 (Brasilia Standard Time)
É aliando oportunidade profissional à educação para os jovens que nós vamos levar dignidade e qualidade de vida par… https://t.co/MdJxG20XQ2,32101740,,,32101740,ronaldocaiado,,,2,13,Thu Aug 05 2021 21:49:42 GMT-0300 (Brasilia Standard Time),Fri Jul 30 2021 09:02:07 GMT-0300 (Brasilia Standard Time)
O Estado da vez é Goiás! 💪🚀💉 https://t.co/tlg8GG3dtk,32101740,,,32101740,ronaldocaiado,,,2,38,Thu Aug 05 2021 21:49:42 GMT-0300 (Brasilia Standard Time),Fri Jul 30 2021 07:49:25 GMT-0300 (Brasilia Standard Time)
"@righy Chega de avião, vem de caminhão, fazemos a distribuição e a vacinação no braço de toda a população! Bom dia!",32101740,,,32101740,ronaldocaiado,,,0,0,Thu Aug 05 2021 21:49:42 GMT-0300 (Brasilia Standard Time),Fri Jul 30 2021 07:44:59 GMT-0300 (Brasilia Standard Time)
@lcastanheira2 https://t.co/cxRS76HGwp,32101740,,,32101740,ronaldocaiado,,,0,0,Thu Aug 05 2021 21:49:42 GMT-0300 (Brasilia Standard Time),Fri Jul 30 2021 07:09:36 GMT-0300 (Brasilia Standard Time)
"RT @podergoias: Em Goiânia, Caiado lança programa Retomada Cultural - via @podergoias https://t.co/gg9sYq5PUv https://t.co/VYelFYmjM7",32101740,,,32101740,ronaldocaiado,,,7,0,Thu Aug 05 2021 21:49:42 GMT-0300 (Brasilia Standard Time),Fri Jul 30 2021 07:06:07 GMT-0300 (Brasilia Standard Time)
"RT @Vivergoias: Caiado anuncia abertura de 5 mil vagas para Programa Aprendiz do Futuro
https://t.co/jJR8i7waNo",32101740,,,32101740,ronaldocaiado,,,3,0,Thu Aug 05 2021 21:49:42 GMT-0300 (Brasilia Standard Time),Fri Jul 30 2021 07:04:20 GMT-0300 (Brasilia Standard Time)
"Além da bolsa salarial de R$ 516,66, eles receberão vale transporte, cartão alimentação, seguro de vida, uniformes… https://t.co/IIw30hKJSM",32101740,,,32101740,ronaldocaiado,,,1,27,Thu Aug 05 2021 21:49:42 GMT-0300 (Brasilia Standard Time),Thu Jul 29 2021 21:23:03 GMT-0300 (Brasilia Standard Time)
"O programa Aprendiz do Futuro vai inserir jovens entre 14 e 16 anos no mercado de trabalho, garantindo uma renda extra às suas famílias.",32101740,,,32101740,ronaldocaiado,,,1,26,Thu Aug 05 2021 21:49:42 GMT-0300 (Brasilia Standard Time),Thu Jul 29 2021 21:23:03 GMT-0300 (Brasilia Standard Time)
É aliando oportunidade profissional à educação para os jovens que nós vamos levar dignidade e qualidade de vida par… https://t.co/a64xkb9UmV,32101740,,,32101740,ronaldocaiado,,,1,36,Thu Aug 05 2021 21:49:42 GMT-0300 (Brasilia Standard Time),Thu Jul 29 2021 21:23:02 GMT-0300 (Brasilia Standard Time)
RT @portal6anapolis: Caiado anuncia notebooks para alunos no retorno presencial das aulas  https://t.co/77wh1vXUIp,32101740,,,32101740,ronaldocaiado,,,2,0,Thu Aug 05 2021 21:49:42 GMT-0300 (Brasilia Standard Time),Thu Jul 29 2021 19:46:07 GMT-0300 (Brasilia Standard Time)
"5 mil jovens que estavam sem possibilidade de buscar uma profissão, mas que agora têm esperança de uma vida melhor.",32101740,,,32101740,ronaldocaiado,,,0,10,Thu Aug 05 2021 21:49:42 GMT-0300 (Brasilia Standard Time),Thu Jul 29 2021 18:59:32 GMT-0300 (Brasilia Standard Time)
"O programa não será um jovem com camiseta esperando dar a hora de ir embora. Será educativo, orientado e profission… https://t.co/wFey92Q7p5",32101740,,,32101740,ronaldocaiado,,,0,12,Thu Aug 05 2021 21:49:42 GMT-0300 (Brasilia Standard Time),Thu Jul 29 2021 18:59:32 GMT-0300 (Brasilia Standard Time)
Esse é um programa de RESGATE SOCIAL. Não é possível aceitar que um governo não trabalhe para atender as pessoas qu… https://t.co/726rlYYnTD,32101740,,,32101740,ronaldocaiado,,,1,9,Thu Aug 05 2021 21:49:42 GMT-0300 (Brasilia Standard Time),Thu Jul 29 2021 18:59:32 GMT-0300 (Brasilia Standard Time)
"Vejam só, minha gente. O jovem vai receber auxílio de R$ 550 para ter 20h semanais de aulas práticas e teóricas no… https://t.co/2AdFPizxbp",32101740,,,32101740,ronaldocaiado,,,1,7,Thu Aug 05 2021 21:49:42 GMT-0300 (Brasilia Standard Time),Thu Jul 29 2021 18:59:31 GMT-0300 (Brasilia Standard Time)
"Estamos lançando o programa Aprendiz do Futuro, que vai atender 5 mil jovens em situação de vulnerabilidade, de 14… https://t.co/pBy2tOt4oj",32101740,,,32101740,ronaldocaiado,,,1,54,Thu Aug 05 2021 21:49:42 GMT-0300 (Brasilia Standard Time),Thu Jul 29 2021 18:59:30 GMT-0300 (Brasilia Standard Time)
E podem ter certeza que não descansarei um minuto pra fazer do nosso Estado o melhor do país.,32101740,,,32101740,ronaldocaiado,,,1,16,Thu Aug 05 2021 21:49:42 GMT-0300 (Brasilia Standard Time),Thu Jul 29 2021 13:26:59 GMT-0300 (Brasilia Standard Time)
"Mesmo diante da maior crise sanitária já enfrentada no Brasil, temos sido destaque em áreas importantes 👇

🏥 Saúde:… https://t.co/hZO99dBEuX",32101740,,,32101740,ronaldocaiado,,,1,17,Thu Aug 05 2021 21:49:42 GMT-0300 (Brasilia Standard Time),Thu Jul 29 2021 13:26:58 GMT-0300 (Brasilia Standard Time)
"Minha gente, hoje durante o Lançamento do guia ""Planejamento Estratégico: Caminho para a Retomada da Economia"", na… https://t.co/jIVtYEi1EK",32101740,,,32101740,ronaldocaiado,,,3,52,Thu Aug 05 2021 21:49:42 GMT-0300 (Brasilia Standard Time),Thu Jul 29 2021 13:26:57 GMT-0300 (Brasilia Standard Time)
"Tem coisa que funciona melhor em dupla, minha gente, e eu posso provar. Eu e minha preta, então, é sucesso garantid… https://t.co/z6tvghLlsM",32101740,,,32101740,ronaldocaiado,,,6,64,Thu Aug 05 2021 21:49:42 GMT-0300 (Brasilia Standard Time),Thu Jul 29 2021 08:57:44 GMT-0300 (Brasilia Standard Time)
Aterrissou em solo goiano um total de 231.660 doses da vacina contra a Covid-19. Começamos o dia com um carregament… https://t.co/2VobCUhGOo,32101740,,,32101740,ronaldocaiado,,,16,119,Thu Aug 05 2021 21:49:42 GMT-0300 (Brasilia Standard Time),Wed Jul 28 2021 20:04:23 GMT-0300 (Brasilia Standard Time)
RT @aredacao: SEGURANÇA PÚBLICA - Caiado promete viabilizar recorde de promoções e qualificações da PM-GO. Governador celebrou aniversário…,32101740,,,32101740,ronaldocaiado,,,5,0,Thu Aug 05 2021 21:49:42 GMT-0300 (Brasilia Standard Time),Wed Jul 28 2021 19:43:51 GMT-0300 (Brasilia Standard Time)
"A todos vocês, minha gratidão por manter o abastecimento em nossas cidades, garantindo que o alimento chegue à mesa… https://t.co/Nrtqjz7B2m",32101740,,,32101740,ronaldocaiado,,,2,23,Thu Aug 05 2021 21:49:42 GMT-0300 (Brasilia Standard Time),Wed Jul 28 2021 17:08:00 GMT-0300 (Brasilia Standard Time)
"Prova do nosso cuidado com a categoria é a implantação do Projeto Cerveja de Mandioca em 24 cidades goianas, que já… https://t.co/sAdsFVoqBJ",32101740,,,32101740,ronaldocaiado,,,1,27,Thu Aug 05 2021 21:49:42 GMT-0300 (Brasilia Standard Time),Wed Jul 28 2021 17:08:00 GMT-0300 (Brasilia Standard Time)
"👩‍🌾🌾 Vivo na cidade grande, mas minhas raízes estão no campo. Sei da labuta e esforço dos trabalhadores que acordam… https://t.co/IqpIJwfMEA",32101740,,,32101740,ronaldocaiado,,,3,53,Thu Aug 05 2021 21:49:42 GMT-0300 (Brasilia Standard Time),Wed Jul 28 2021 17:07:59 GMT-0300 (Brasilia Standard Time)
"🏅E não parou por aí, viu? Gracinha e eu ainda recebemos a medalha de Ordem do Mérito Tiradentes, que reconhece a at… https://t.co/rfTDpxGg1E",32101740,,,32101740,ronaldocaiado,,,2,20,Thu Aug 05 2021 21:49:42 GMT-0300 (Brasilia Standard Time),Wed Jul 28 2021 15:16:37 GMT-0300 (Brasilia Standard Time)
"👮👮‍♂️E vejam só, minha gente, também formamos 46 alunos do 16º Curso de Habilitação de Oficiais Auxiliares da PMGO,… https://t.co/EKOaxZkNsU",32101740,,,32101740,ronaldocaiado,,,2,21,Thu Aug 05 2021 21:49:42 GMT-0300 (Brasilia Standard Time),Wed Jul 28 2021 15:16:34 GMT-0300 (Brasilia Standard Time)
"🚓 Tenho compromisso com a segurança pública de Goiás. Hoje, no aniversário de 163 anos da Polícia Militar de Goiás,… https://t.co/zSMp1quBNu",32101740,,,32101740,ronaldocaiado,,,7,55,Thu Aug 05 2021 21:49:42 GMT-0300 (Brasilia Standard Time),Wed Jul 28 2021 15:16:29 GMT-0300 (Brasilia Standard Time)
"A honraria, concedida pela prefeitura sob o comando do meu amigo @robertosnaves, representa a gratidão do município… https://t.co/qhr9Ruysl1",32101740,,,32101740,ronaldocaiado,,,2,17,Thu Aug 05 2021 21:49:42 GMT-0300 (Brasilia Standard Time),Wed Jul 28 2021 09:07:04 GMT-0300 (Brasilia Standard Time)
"Que orgulho, minha gente! Como anapolino e marido apaixonado que sou, vivenciei um momento de muita alegria ao dar… https://t.co/NfizBJlQFT",32101740,,,32101740,ronaldocaiado,,,4,63,Thu Aug 05 2021 21:49:42 GMT-0300 (Brasilia Standard Time),Wed Jul 28 2021 09:07:02 GMT-0300 (Brasilia Standard Time)
"RT @Economize_Agua: Em visita a Anápolis, Caiado volta a falar da falta d'água e deixa sério alerta sobre a pandemia da Covid-19 - Portal 6…",32101740,,,32101740,ronaldocaiado,,,5,0,Thu Aug 05 2021 21:49:42 GMT-0300 (Brasilia Standard Time),Tue Jul 27 2021 21:51:42 GMT-0300 (Brasilia Standard Time)
"O local recebeu investimentos de mais de R$ 400 milhões, tem capacidade de transportar 11 milhões de toneladas, por… https://t.co/mjWxv0v1Z3",32101740,,,32101740,ronaldocaiado,,,4,66,Thu Aug 05 2021 21:49:42 GMT-0300 (Brasilia Standard Time),Tue Jul 27 2021 21:09:19 GMT-0300 (Brasilia Standard Time)
"Em Rio Verde, ao lado do ministro @tarcisiogdf e do prefeito Paulo do Vale, inauguramos o Terminal Intermodal da Fe… https://t.co/ZQ3sI6k4hw",32101740,,,32101740,ronaldocaiado,,,6,144,Thu Aug 05 2021 21:49:42 GMT-0300 (Brasilia Standard Time),Tue Jul 27 2021 21:09:17 GMT-0300 (Brasilia Standard Time)
Antigamente a ferrovia Norte-Sul era motivo de escândalo e corrupção. Hoje é uma realidade e dá ao Centro-Oeste a p… https://t.co/VYgSq2Ro93,32101740,,,32101740,ronaldocaiado,,,20,264,Thu Aug 05 2021 21:49:42 GMT-0300 (Brasilia Standard Time),Tue Jul 27 2021 21:09:14 GMT-0300 (Brasilia Standard Time)
"Como senador, derrubei o edital que autorizava esse absurdo e mais uma vez estamos devolvendo Goiás aos goianos, fo… https://t.co/QTv0qYvGK5",32101740,,,32101740,ronaldocaiado,,,2,32,Thu Aug 05 2021 21:49:42 GMT-0300 (Brasilia Standard Time),Tue Jul 27 2021 17:37:08 GMT-0300 (Brasilia Standard Time)
