text,query,country,city,userId,username,quote_count,reply_count,retweet_count,favorite_count,timestamp,createdAt
"💚 Hoje, no #DiaNacionaldoFutebol, tenho o maior orgulho em dizer que na nossa gestão temos investido e incentivado… https://t.co/3PiwDLh2Ux",32101740,,,32101740,ronaldocaiado,,,0,17,Thu Aug 05 2021 21:49:42 GMT-0300 (Brasilia Standard Time),Mon Jul 19 2021 18:01:38 GMT-0300 (Brasilia Standard Time)
"Conseguem adivinhar quem eu sou nessa foto? 🧐 Antes de enveredar na medicina e na política, joguei como zagueiro no… https://t.co/ItZwwSoSTm",32101740,,,32101740,ronaldocaiado,,,1,70,Thu Aug 05 2021 21:49:42 GMT-0300 (Brasilia Standard Time),Mon Jul 19 2021 18:01:38 GMT-0300 (Brasilia Standard Time)
"Segundou com notícia boa! Vamos receber nesta madrugada, 00h05,  37.400 doses da Astrazeneca para 1ª aplicação e 62… https://t.co/fNgRbP0HEV",32101740,,,32101740,ronaldocaiado,,,14,219,Thu Aug 05 2021 21:49:42 GMT-0300 (Brasilia Standard Time),Mon Jul 19 2021 11:39:43 GMT-0300 (Brasilia Standard Time)
Vocês podem ter certeza que nosso trabalho para desenvolver essa região é 24h por dia e mais benefícios virão. Meus… https://t.co/cVDTZZGAFZ,32101740,,,32101740,ronaldocaiado,,,5,20,Thu Aug 05 2021 21:49:42 GMT-0300 (Brasilia Standard Time),Mon Jul 19 2021 09:09:23 GMT-0300 (Brasilia Standard Time)
"Hoje nossa querida Posse completa 149 anos de história e muita luta! Localizada no Nordeste goiano, a cidade foi a… https://t.co/0yBKdbku1w",32101740,,,32101740,ronaldocaiado,,,8,52,Thu Aug 05 2021 21:49:42 GMT-0300 (Brasilia Standard Time),Mon Jul 19 2021 09:09:23 GMT-0300 (Brasilia Standard Time)
Ela é beneficiária do Pró-Atleta e foi a única representante goiana no Campeonato Sul-Americano Sub-20 de Atletismo… https://t.co/vXxfDvSnMd,32101740,,,32101740,ronaldocaiado,,,2,22,Thu Aug 05 2021 21:49:42 GMT-0300 (Brasilia Standard Time),Sun Jul 18 2021 18:05:31 GMT-0300 (Brasilia Standard Time)
"🏅Que orgulho, minha gente! O suporte dado aos nossos atletas tem rendido boas colocações e medalhas para o Estado e… https://t.co/wfDaqM9qvW",32101740,,,32101740,ronaldocaiado,,,4,63,Thu Aug 05 2021 21:49:42 GMT-0300 (Brasilia Standard Time),Sun Jul 18 2021 18:05:30 GMT-0300 (Brasilia Standard Time)
"Com a criação do Batalhão Rural da PM e o trabalho de integração e de inteligência das forças policiais, reduzimos… https://t.co/IGm05NYdCT",32101740,,,32101740,ronaldocaiado,,,5,37,Thu Aug 05 2021 21:49:42 GMT-0300 (Brasilia Standard Time),Sun Jul 18 2021 12:05:36 GMT-0300 (Brasilia Standard Time)
🚔 Sempre tive um compromisso com os goianos que tiram seu sustento do campo. E vejam só que notícia boa. https://t.co/oA1IUKQWDE,32101740,,,32101740,ronaldocaiado,,,4,56,Thu Aug 05 2021 21:49:42 GMT-0300 (Brasilia Standard Time),Sun Jul 18 2021 12:05:36 GMT-0300 (Brasilia Standard Time)
"📈 Goiás saiu das páginas policiais para os destaques nacionais. Que diferença, não é, minha gente? Com um trabalho… https://t.co/tlKByjsCYg",32101740,,,32101740,ronaldocaiado,,,8,86,Thu Aug 05 2021 21:49:42 GMT-0300 (Brasilia Standard Time),Sat Jul 17 2021 19:01:33 GMT-0300 (Brasilia Standard Time)
Também assinei ordem de serviço no valor de R$ 374 mil para construção da quadra poliesportiva do Colégio Estadual… https://t.co/w6BaEh2dDf,32101740,,,32101740,ronaldocaiado,,,4,23,Thu Aug 05 2021 21:49:42 GMT-0300 (Brasilia Standard Time),Sat Jul 17 2021 12:01:40 GMT-0300 (Brasilia Standard Time)
Estamos resgatando a identidade  da nossa gente no Entorno e tenho certeza que vamos formar os melhores atletas des… https://t.co/XQQZV9rSG6,32101740,,,32101740,ronaldocaiado,,,6,59,Thu Aug 05 2021 21:49:42 GMT-0300 (Brasilia Standard Time),Sat Jul 17 2021 12:01:37 GMT-0300 (Brasilia Standard Time)
"E não poderia deixar de participar da inauguração do Centro de Atenção Psicossocial, do Complexo Esportivo Municipa… https://t.co/PLwLayJFIT",32101740,,,32101740,ronaldocaiado,,,3,18,Thu Aug 05 2021 21:49:42 GMT-0300 (Brasilia Standard Time),Fri Jul 16 2021 18:06:37 GMT-0300 (Brasilia Standard Time)
📚 Assinei ordem de serviço de R$ 500 mil para a reforma e ampliação do Colégio Estadual Polivalente Rui Barbosa. https://t.co/PJfnY4f8ST,32101740,,,32101740,ronaldocaiado,,,4,18,Thu Aug 05 2021 21:49:42 GMT-0300 (Brasilia Standard Time),Fri Jul 16 2021 18:06:36 GMT-0300 (Brasilia Standard Time)
"🛣 Vistoriei as obras de recuperação da GO-480, no trecho entre Santa Isabel e Rialma, que recebeu investimento tota… https://t.co/Mf0exB4uI6",32101740,,,32101740,ronaldocaiado,,,0,5,Thu Aug 05 2021 21:49:42 GMT-0300 (Brasilia Standard Time),Fri Jul 16 2021 18:06:34 GMT-0300 (Brasilia Standard Time)
"Precisamos trabalhar para realmente transformar a vida das pessoas. Ao lado do prefeito Frederico Vidigal, a agenda… https://t.co/W3sKMJIqHT",32101740,,,32101740,ronaldocaiado,,,6,48,Thu Aug 05 2021 21:49:42 GMT-0300 (Brasilia Standard Time),Fri Jul 16 2021 18:06:31 GMT-0300 (Brasilia Standard Time)
"RT @diariodamanha: Ministro garante que, em parceria com Caiado, Aeroporto de Cargas de Anápolis entrará em operação

https://t.co/MrQS7M3I…",32101740,,,32101740,ronaldocaiado,,,1,0,Thu Aug 05 2021 21:49:42 GMT-0300 (Brasilia Standard Time),Fri Jul 16 2021 13:02:45 GMT-0300 (Brasilia Standard Time)
"Olha aí, minha gente, se a gente não sextou da melhor forma possível!  Recebemos 133.500 doses de vacina contra Cov… https://t.co/NSnvV0nAt2",32101740,,,32101740,ronaldocaiado,,,10,85,Thu Aug 05 2021 21:49:42 GMT-0300 (Brasilia Standard Time),Fri Jul 16 2021 09:00:14 GMT-0300 (Brasilia Standard Time)
"RT @portal6anapolis: Centro de Excelência de Tecnologia Ferroviária deve receber R$ 60 bilhões em investimentos, diz Caiado  https://t.co/e…",32101740,,,32101740,ronaldocaiado,,,3,0,Thu Aug 05 2021 21:49:42 GMT-0300 (Brasilia Standard Time),Fri Jul 16 2021 08:51:59 GMT-0300 (Brasilia Standard Time)
RT @aredacao: TRANSPORTES - Caiado planeja investir R$ 60 bilhões em centro ferroviário de Anápolis https://t.co/qdO0VxxxrA https://t.co/ni…,32101740,,,32101740,ronaldocaiado,,,3,0,Thu Aug 05 2021 21:49:42 GMT-0300 (Brasilia Standard Time),Fri Jul 16 2021 08:51:50 GMT-0300 (Brasilia Standard Time)
"RT @radioimprensa: Caiado projeta investimentos de mais de R$ 60 bilhões em 10 anos com Centro de Excelência em Tecnologia Ferroviária, em …",32101740,,,32101740,ronaldocaiado,,,2,0,Thu Aug 05 2021 21:49:42 GMT-0300 (Brasilia Standard Time),Fri Jul 16 2021 08:47:30 GMT-0300 (Brasilia Standard Time)
"Com investimento de mais de R$ 60 BILHÕES em 10 anos, o local vai tornar Goiás mais competitivo e garantir maior ef… https://t.co/iH0dOqarfH",32101740,,,32101740,ronaldocaiado,,,3,37,Thu Aug 05 2021 21:49:42 GMT-0300 (Brasilia Standard Time),Thu Jul 15 2021 19:53:04 GMT-0300 (Brasilia Standard Time)
Ao lado do ministro @tarcisiogdf e do prefeito @robertosnaves demos um importante passo para a instalação do maior… https://t.co/EZooQhmakC,32101740,,,32101740,ronaldocaiado,,,3,48,Thu Aug 05 2021 21:49:42 GMT-0300 (Brasilia Standard Time),Thu Jul 15 2021 19:53:00 GMT-0300 (Brasilia Standard Time)
Anápolis nunca recebeu obras com tamanha relevância para o futuro da cidade como na nossa gestão. https://t.co/VkFbBNpltE,32101740,,,32101740,ronaldocaiado,,,11,157,Thu Aug 05 2021 21:49:42 GMT-0300 (Brasilia Standard Time),Thu Jul 15 2021 19:52:58 GMT-0300 (Brasilia Standard Time)
"#tbt Aô saudade do Araguaia! Eu já tô até imaginando a gente no ano que vem, todo mundo vacinado, caminhando nas ma… https://t.co/6Ytg9guOW1",32101740,,,32101740,ronaldocaiado,,,8,137,Thu Aug 05 2021 21:49:42 GMT-0300 (Brasilia Standard Time),Thu Jul 15 2021 16:02:32 GMT-0300 (Brasilia Standard Time)
"Tem mais vacina chegando hoje, 18h55, minha gente! São 133.500 doses da AstraZeneca que serão todas aplicadas como… https://t.co/Xxz5TSzAYP",32101740,,,32101740,ronaldocaiado,,,27,365,Thu Aug 05 2021 21:49:42 GMT-0300 (Brasilia Standard Time),Thu Jul 15 2021 08:13:11 GMT-0300 (Brasilia Standard Time)
Aparecida de Goiânia respira cada vez mais segurança graças às nossas forças policiais. 🚔 Entregamos hoje as novas… https://t.co/eNnhvEzekI,32101740,,,32101740,ronaldocaiado,,,10,74,Thu Aug 05 2021 21:49:42 GMT-0300 (Brasilia Standard Time),Wed Jul 14 2021 18:19:35 GMT-0300 (Brasilia Standard Time)
