text,query,country,city,userId,username,quote_count,reply_count,retweet_count,favorite_count,timestamp,createdAt
RT @ronodyy: ROUBARAM A CHUTEIRA DO WILSON LIMA KKKKKKKKKKKKKKKKKKKKKKKKJ OS CARA NÃO PERDOA,"""wilson lima""",,,1222117374423457800,DiulheM,,,1,0,Sun Aug 15 2021 20:02:02 GMT-0300 (Brasilia Standard Time),Sun Aug 15 2021 17:35:10 GMT-0300 (Brasilia Standard Time)
"RT @MascarenhasT: Papo Antagonista Aug 13, 2021
“O Leão Enjaulado”

‘O Bob Jeff - o leão do bolsonarismo - tem dois irmãos abrigados no gov…","""wilson lima""",,,53379935,MascarenhasT,,,1,0,Sun Aug 15 2021 20:02:02 GMT-0300 (Brasilia Standard Time),Sun Aug 15 2021 16:15:00 GMT-0300 (Brasilia Standard Time)
Wilson Lima também fez um apelo para que as pessoas que tomaram a primeira dose e estão no prazo de receber a segun… https://t.co/ozztlxwqpZ,"""wilson lima""",,,249234849,g1amazonas,,,0,7,Sun Aug 15 2021 20:02:02 GMT-0300 (Brasilia Standard Time),Sun Aug 15 2021 15:41:30 GMT-0300 (Brasilia Standard Time)
passaram a mão na chuteira do wilson lima kkkkkkkkkkkkkkkkkkkkkkkkkkkkkkkkkkkkkkkkkkkk,"""wilson lima""",,,3409119345,joselysandro1,,,0,0,Sun Aug 15 2021 20:02:02 GMT-0300 (Brasilia Standard Time),Sun Aug 15 2021 15:35:16 GMT-0300 (Brasilia Standard Time)
ROUBARAM A CHUTEIRA DO WILSON LIMA KKKKKKKKKKKKKKKKKKKKKKKKJ OS CARA NÃO PERDOA,"""wilson lima""",,,1358178354868936700,ronodyy,,,1,2,Sun Aug 15 2021 20:02:02 GMT-0300 (Brasilia Standard Time),Sun Aug 15 2021 14:45:45 GMT-0300 (Brasilia Standard Time)
"@marceloramosam Tu não me representa aí nessa bancada! Outra coisa, oxigênio faltou devido a péssima gestão Wilson… https://t.co/FHCj6GNW6d","""wilson lima""",,,1331630073011724300,JlioAra88431506,,,0,0,Sun Aug 15 2021 20:02:02 GMT-0300 (Brasilia Standard Time),Sun Aug 15 2021 13:35:55 GMT-0300 (Brasilia Standard Time)
Wilson Lima joga bola no CDC da Compensa e anuncia reforma do espaço https://t.co/AWpg4n83x5 https://t.co/4akXaZQiVO,"""wilson lima""",,,107751841,portalemtempo,,,0,6,Sun Aug 15 2021 20:02:02 GMT-0300 (Brasilia Standard Time),Sun Aug 15 2021 13:23:25 GMT-0300 (Brasilia Standard Time)
"Papo Antagonista Aug 13, 2021
“O Leão Enjaulado”

‘O Bob Jeff - o leão do bolsonarismo - tem dois irmãos abrigados… https://t.co/fBeSAgNm7e","""wilson lima""",,,53379935,MascarenhasT,,,1,0,Sun Aug 15 2021 20:02:02 GMT-0300 (Brasilia Standard Time),Sun Aug 15 2021 04:51:27 GMT-0300 (Brasilia Standard Time)
"@OmarAzizSenador Obrigado governador Wilson Lima, pelo início dos trabalhos de reconstrução da AM-010. Oportunistas… https://t.co/0nmR8NFROr","""wilson lima""",,,1352427393160532000,MuriloV03469096,,,0,0,Sun Aug 15 2021 20:02:02 GMT-0300 (Brasilia Standard Time),Sun Aug 15 2021 01:14:21 GMT-0300 (Brasilia Standard Time)
Amazonas | Primeiro dia de vacinação em adolescentes levou milhares de estudantes aos postos https://t.co/3XUB3EgAVE,"""wilson lima""",,,884066356299264000,blogdaamazonia,,,0,0,Sun Aug 15 2021 20:02:02 GMT-0300 (Brasilia Standard Time),Sun Aug 15 2021 00:59:25 GMT-0300 (Brasilia Standard Time)
Amazonas | O anúncio ocorreu minutos antes do governador participar de uma partida de futebol com a comunidade. https://t.co/QBpJpL8D5q,"""wilson lima""",,,884066356299264000,blogdaamazonia,,,0,0,Sun Aug 15 2021 20:02:02 GMT-0300 (Brasilia Standard Time),Sat Aug 14 2021 22:00:48 GMT-0300 (Brasilia Standard Time)
Governador Wilson Lima reforça importância da vacinação de estudantes https://t.co/gQ4NTWM03d,"""wilson lima""",,,1172114825981419500,PortalCaboco,,,0,0,Sun Aug 15 2021 20:02:02 GMT-0300 (Brasilia Standard Time),Sat Aug 14 2021 21:51:12 GMT-0300 (Brasilia Standard Time)
vsfd wilson Lima 4 enfermeiros pra atender mais de 1000 pessoas,"""wilson lima""",,,962329372957999100,odaviix,,,0,1,Sun Aug 15 2021 20:02:02 GMT-0300 (Brasilia Standard Time),Sat Aug 14 2021 19:56:38 GMT-0300 (Brasilia Standard Time)
"Governador Wilson Lima reforça importância da vacinação de estudantes
https://t.co/KAV0oYZPvt https://t.co/jBQRgmfVqq","""wilson lima""",,,364600736,PortaldoAM,,,0,0,Sun Aug 15 2021 20:02:02 GMT-0300 (Brasilia Standard Time),Sat Aug 14 2021 18:30:42 GMT-0300 (Brasilia Standard Time)
Wilson Lima reforça importância da vacinação de estudantes contra Covid-19 https://t.co/gRY5tZGkha,"""wilson lima""",,,98875202,am_noticias,,,0,0,Sun Aug 15 2021 20:02:02 GMT-0300 (Brasilia Standard Time),Sat Aug 14 2021 18:29:04 GMT-0300 (Brasilia Standard Time)
"#Notícias: A visita do ministro da Educação, Milton Ribeiro, ocorreria sem o conhecimento do governador Wilson Lima… https://t.co/LxgQgsWqcL","""wilson lima""",,,1259956625906991000,realtimeum,,,0,0,Sun Aug 15 2021 20:02:02 GMT-0300 (Brasilia Standard Time),Sat Aug 14 2021 18:27:23 GMT-0300 (Brasilia Standard Time)
"Adorei os comentários pq ninguém quer sacrificar o Amazonas
Se bem que nem precisa 
O Wilson Lima já tá fazendo isso https://t.co/daCfd7QKQI","""wilson lima""",,,919338712491839500,sincomode,,,0,5,Sun Aug 15 2021 20:02:02 GMT-0300 (Brasilia Standard Time),Sat Aug 14 2021 15:58:43 GMT-0300 (Brasilia Standard Time)
"Política | Ideia do senador, junto com Silas Câmara, era levar o ministro a Manaus e fazer evento para capitalizar… https://t.co/CacuVfD2uO","""wilson lima""",,,884066356299264000,blogdaamazonia,,,0,0,Sun Aug 15 2021 20:02:02 GMT-0300 (Brasilia Standard Time),Sat Aug 14 2021 15:00:34 GMT-0300 (Brasilia Standard Time)
"RT @matheuxcaxtrox: em pouco tempo wilson lima fez geral esquecer de todas as crises do governo, inclusive, que ele e bolsonaro são os prin…","""wilson lima""",,,706178464953540600,ElizaDiva1,,,2,0,Sun Aug 15 2021 20:02:02 GMT-0300 (Brasilia Standard Time),Sat Aug 14 2021 14:30:52 GMT-0300 (Brasilia Standard Time)
rindo mt da história que roubaram a chuteira do wilson lima la no cdc ontem 😂😂😂,"""wilson lima""",,,1594776649,cabeyobrk,,,0,1,Sun Aug 15 2021 20:02:02 GMT-0300 (Brasilia Standard Time),Sat Aug 14 2021 13:00:27 GMT-0300 (Brasilia Standard Time)
"em pouco tempo wilson lima fez geral esquecer de todas as crises do governo, inclusive, que ele e bolsonaro são os… https://t.co/Q7ne7XQFt7","""wilson lima""",,,807242649807810600,matheuxcaxtrox,,,2,4,Sun Aug 15 2021 20:02:02 GMT-0300 (Brasilia Standard Time),Sat Aug 14 2021 12:56:42 GMT-0300 (Brasilia Standard Time)
Wilson Lima anuncia revitalização do Centro Desportivo da Compensa https://t.co/pfeldLDXSR,"""wilson lima""",,,515540998,reporterpin,,,0,0,Sun Aug 15 2021 20:02:02 GMT-0300 (Brasilia Standard Time),Sat Aug 14 2021 09:53:32 GMT-0300 (Brasilia Standard Time)
TERREIRO DA FAZENDA COM WILSON LIMA 14/08/2021 https://t.co/w79xG22mbP,"""wilson lima""",,,111124471,87FMNatal,,,0,0,Sun Aug 15 2021 20:02:02 GMT-0300 (Brasilia Standard Time),Sat Aug 14 2021 05:22:29 GMT-0300 (Brasilia Standard Time)
"RT @SrtaLee123: @OmarAzizSenador Omar, toma vergonha nessa tua cara ..... Quer fazer média , pede pro Wilson Lima reduzir o valor do ICMS,…","""wilson lima""",,,1412533814530879500,bolson_c,,,1,0,Sun Aug 15 2021 20:02:02 GMT-0300 (Brasilia Standard Time),Sat Aug 14 2021 02:17:49 GMT-0300 (Brasilia Standard Time)
"@OmarAzizSenador Omar, toma vergonha nessa tua cara ..... Quer fazer média , pede pro Wilson Lima reduzir o valor d… https://t.co/YipvtUQKZq","""wilson lima""",,,843110905542000600,SrtaLee123,,,1,2,Sun Aug 15 2021 20:02:02 GMT-0300 (Brasilia Standard Time),Sat Aug 14 2021 01:56:36 GMT-0300 (Brasilia Standard Time)
"Segundo Wilson Lima, a aproximação do Ministério da Educação e Prefeituras, reforçando a aplicação de recursos do F… https://t.co/MtO19Sife2","""wilson lima""",,,1179818624485396500,amazoniapress_,,,0,0,Sun Aug 15 2021 20:02:02 GMT-0300 (Brasilia Standard Time),Sat Aug 14 2021 00:26:46 GMT-0300 (Brasilia Standard Time)
@sacha_faria É ter como governador o Wilson lima também.. é de phoder tudo.,"""wilson lima""",,,83776580,rogerio_aguiarc,,,0,1,Sun Aug 15 2021 20:02:02 GMT-0300 (Brasilia Standard Time),Fri Aug 13 2021 23:23:02 GMT-0300 (Brasilia Standard Time)
"RT @AmazonasGoverno: O governador Wilson Lima anunciou, nesta sexta-feira (13/08), a completa revitalização do Centro Desportivo da Compens…","""wilson lima""",,,1054576002360361000,FilhoIziel,,,1,0,Sun Aug 15 2021 20:02:02 GMT-0300 (Brasilia Standard Time),Fri Aug 13 2021 22:59:34 GMT-0300 (Brasilia Standard Time)
"Diretor indicado por Wilson Lima é alvo do TCE, TJAM e da Polícia Civil; veja vídeo

https://t.co/MbjQ99jpn7… https://t.co/bU77HydnMC","""wilson lima""",,,134931511,portald24am,,,0,0,Sun Aug 15 2021 20:02:02 GMT-0300 (Brasilia Standard Time),Fri Aug 13 2021 22:45:00 GMT-0300 (Brasilia Standard Time)
"Diretor indicado por Wilson Lima é alvo do TCE, TJAM e da Polícia Civil; veja vídeo

https://t.co/Eq7K0seAHO… https://t.co/e1sjHbODXp","""wilson lima""",,,31291626,DEZMinutos,,,0,0,Sun Aug 15 2021 20:02:02 GMT-0300 (Brasilia Standard Time),Fri Aug 13 2021 22:45:00 GMT-0300 (Brasilia Standard Time)
"O governador Wilson Lima anunciou, nesta sexta-feira (13/08), a completa revitalização do Centro Desportivo da Comp… https://t.co/LcLi3Ao9rq","""wilson lima""",,,1067412276884488200,AmazonasGoverno,,,1,3,Sun Aug 15 2021 20:02:02 GMT-0300 (Brasilia Standard Time),Fri Aug 13 2021 22:26:17 GMT-0300 (Brasilia Standard Time)
"@PagodeiroMaster @princesinhadac3 @mel88__88 @GildeOliveira14 @Metropoles Sim, mas morte teve em todos os países, f… https://t.co/bKYATbpqJ4","""wilson lima""",,,1413290794941919200,S__Tavin,,,0,0,Sun Aug 15 2021 20:02:02 GMT-0300 (Brasilia Standard Time),Fri Aug 13 2021 22:15:16 GMT-0300 (Brasilia Standard Time)
Governador Wilson Lima anuncia revitalização do Centro Desportivo da Compensa https://t.co/SOVpbJ4iGJ,"""wilson lima""",,,98875202,am_noticias,,,0,0,Sun Aug 15 2021 20:02:02 GMT-0300 (Brasilia Standard Time),Fri Aug 13 2021 22:05:05 GMT-0300 (Brasilia Standard Time)
Governador Wilson Lima anuncia revitalização do Centro Desportivo da Compensa https://t.co/VzzW5fu5z8,"""wilson lima""",,,1172114825981419500,PortalCaboco,,,0,1,Sun Aug 15 2021 20:02:02 GMT-0300 (Brasilia Standard Time),Fri Aug 13 2021 22:01:09 GMT-0300 (Brasilia Standard Time)
Clique no link para ver os detalhes da notícia https://t.co/otGQq3vwVe,"""wilson lima""",,,48510806,MarcosSantosAM,,,0,1,Sun Aug 15 2021 20:02:02 GMT-0300 (Brasilia Standard Time),Fri Aug 13 2021 21:41:10 GMT-0300 (Brasilia Standard Time)
wilson lima nunca te critiquei ta,"""wilson lima""",,,1372538508766806000,chasenchant,,,0,0,Sun Aug 15 2021 20:02:02 GMT-0300 (Brasilia Standard Time),Fri Aug 13 2021 21:35:03 GMT-0300 (Brasilia Standard Time)
Governador do Amazonas Wilson Lima participa de uma partida de futebol em um campo na Compensa https://t.co/ajZTLtqYOz,"""wilson lima""",,,1353889716098236400,fiqueisabendoam,,,0,0,Sun Aug 15 2021 20:02:02 GMT-0300 (Brasilia Standard Time),Fri Aug 13 2021 21:13:31 GMT-0300 (Brasilia Standard Time)
"Governador anuncia revitalização do Centro Desportivo da Compensa

Wilson Lima participou de uma partida de futebol… https://t.co/MJOJYis2J0","""wilson lima""",,,2943018159,portalampost,,,0,0,Sun Aug 15 2021 20:02:02 GMT-0300 (Brasilia Standard Time),Fri Aug 13 2021 20:58:30 GMT-0300 (Brasilia Standard Time)
Governador Wilson lima e Dep. Saullo jogando bola no CDC da compensa.,"""wilson lima""",,,1257508927190769700,fofoqueiam,,,0,0,Sun Aug 15 2021 20:02:02 GMT-0300 (Brasilia Standard Time),Fri Aug 13 2021 20:58:11 GMT-0300 (Brasilia Standard Time)
"Wilson Lima investe na reconstrução da AM-010, mostra novo momento político e força de seu governo

A obra marca um… https://t.co/cEAgi0iYnA","""wilson lima""",,,2943018159,portalampost,,,0,0,Sun Aug 15 2021 20:02:02 GMT-0300 (Brasilia Standard Time),Fri Aug 13 2021 20:57:38 GMT-0300 (Brasilia Standard Time)
"Governador Wilson Lima anuncia revitalização do Centro Desportivo da Compensa
FOTO: Diego Peres/Secom… https://t.co/4VsKq1hRMC","""wilson lima""",,,364600736,PortaldoAM,,,0,0,Sun Aug 15 2021 20:02:02 GMT-0300 (Brasilia Standard Time),Fri Aug 13 2021 20:54:40 GMT-0300 (Brasilia Standard Time)
RT @fernandapsol: Bolsonaro deveria sair algemado do Palácio do Planalto neste exato momento! O vice-gov do AM confirmou que o presidente e…,"""wilson lima""",,,1380450639239581700,GilvanaSchulz,,,528,0,Sun Aug 15 2021 20:02:02 GMT-0300 (Brasilia Standard Time),Fri Aug 13 2021 19:52:29 GMT-0300 (Brasilia Standard Time)
"Wilson Lima destaca importância do FNDE para o desenvolvimento da educação, em reunião com ministro Milton Ribeiro… https://t.co/YEnVXfvlZC","""wilson lima""",,,364600736,PortaldoAM,,,0,0,Sun Aug 15 2021 20:02:02 GMT-0300 (Brasilia Standard Time),Fri Aug 13 2021 19:29:05 GMT-0300 (Brasilia Standard Time)
Governador do Amazonas Wilson Lima veta projeto de lei de combate a corrupção https://t.co/dBlXzPfBeA,"""wilson lima""",,,53735328,EmersonMirandda,,,0,1,Sun Aug 15 2021 20:02:02 GMT-0300 (Brasilia Standard Time),Fri Aug 13 2021 19:21:15 GMT-0300 (Brasilia Standard Time)
Governador do Amazonas Wilson Lima veta projeto de lei de combate a corrupção https://t.co/Km9F40pKBi,"""wilson lima""",,,194828250,AgenciaWebNews,,,0,0,Sun Aug 15 2021 20:02:02 GMT-0300 (Brasilia Standard Time),Fri Aug 13 2021 19:19:58 GMT-0300 (Brasilia Standard Time)
"Wilson Lima destaca importância do FNDE para o desenvolvimento da educação, em reunião com ministro Milton Ribeiro… https://t.co/OcUgALNjvm","""wilson lima""",,,2943018159,portalampost,,,0,0,Sun Aug 15 2021 20:02:02 GMT-0300 (Brasilia Standard Time),Fri Aug 13 2021 18:45:59 GMT-0300 (Brasilia Standard Time)
"Em reunião com ministro Milton Ribeiro, Wilson Lima destaca importância do FNDE para o desenvolvimento da educação… https://t.co/jU4IzV0dKx","""wilson lima""",,,2188416542,fatoamazonico,,,0,0,Sun Aug 15 2021 20:02:02 GMT-0300 (Brasilia Standard Time),Fri Aug 13 2021 18:11:57 GMT-0300 (Brasilia Standard Time)
"Política estadual, com o programa Educa+Amazonas, e reforço de recursos do FNDE impulsionam educação no estado.… https://t.co/lLUgqHLfoe","""wilson lima""",,,1246548901936709600,oantenado_,,,0,0,Sun Aug 15 2021 20:02:02 GMT-0300 (Brasilia Standard Time),Fri Aug 13 2021 17:56:10 GMT-0300 (Brasilia Standard Time)
"O governador Wilson Lima destacou, durante reunião com ministro da Educação, Milton Ribeiro, e prefeitos do interio… https://t.co/mmKwzZBWIp","""wilson lima""",,,1376281683251564500,informe_manaus,,,0,0,Sun Aug 15 2021 20:02:02 GMT-0300 (Brasilia Standard Time),Fri Aug 13 2021 17:49:57 GMT-0300 (Brasilia Standard Time)
"Wilson Lima destaca importância do FNDE para o desenvolvimento da educação, em reunião com ministro Milton Ribeiro https://t.co/oAN5gn762K","""wilson lima""",,,98875202,am_noticias,,,0,0,Sun Aug 15 2021 20:02:02 GMT-0300 (Brasilia Standard Time),Fri Aug 13 2021 17:33:06 GMT-0300 (Brasilia Standard Time)
"Wilson Lima destaca importância do FNDE para o desenvolvimento da educação, em reunião com ministro Milton Ribeiro https://t.co/u1EyE0xA8k","""wilson lima""",,,515540998,reporterpin,,,0,0,Sun Aug 15 2021 20:02:02 GMT-0300 (Brasilia Standard Time),Fri Aug 13 2021 17:19:41 GMT-0300 (Brasilia Standard Time)
"Wilson Lima destacou, em reunião com ministro da Educação e prefeitos do interior do Amazonas, a importância dos mu… https://t.co/P6cPN3S19u","""wilson lima""",,,385485570,JCommercio,,,0,0,Sun Aug 15 2021 20:02:02 GMT-0300 (Brasilia Standard Time),Fri Aug 13 2021 17:04:29 GMT-0300 (Brasilia Standard Time)
Passagem de Lupi por Manaus confirma interesse de Ricardo Nicolau em suceder Wilson Lima https://t.co/nKpnKOmz9W vi… https://t.co/AJhuMydvoM,"""wilson lima""",,,1376917910363463700,oconvergente_,,,0,1,Sun Aug 15 2021 20:02:02 GMT-0300 (Brasilia Standard Time),Fri Aug 13 2021 16:52:51 GMT-0300 (Brasilia Standard Time)
"Braga tenta isolar Wilson Lima do ministro da Educação, mas toma revestrés
https://t.co/Aa7MkGY5Yr","""wilson lima""",,,742469390642368500,bncplay,,,0,1,Sun Aug 15 2021 20:02:02 GMT-0300 (Brasilia Standard Time),Fri Aug 13 2021 15:22:01 GMT-0300 (Brasilia Standard Time)
Amazonas | O encontro ocorreu por meio de videoconferência e os membros dos conselhos definiram diretrizes e priori… https://t.co/5wYtQr3KpC,"""wilson lima""",,,884066356299264000,blogdaamazonia,,,0,0,Sun Aug 15 2021 20:02:02 GMT-0300 (Brasilia Standard Time),Fri Aug 13 2021 15:00:31 GMT-0300 (Brasilia Standard Time)
"RT @AmazonasGoverno: OPORTUNIDADES! O Processo Seletivo contratará profissionais para atuação na @fhemoam. 

Os selecionados serão lotados…","""wilson lima""",,,1283406241235075000,saude_am,,,4,0,Sun Aug 15 2021 20:02:02 GMT-0300 (Brasilia Standard Time),Fri Aug 13 2021 14:32:46 GMT-0300 (Brasilia Standard Time)
"O governador do Amazonas, Wilson Lima, voltou a confirmar os novos concursos AM, com previsão de editais para novem… https://t.co/B5fsqsGqHP","""wilson lima""",,,37995409,folhadirigida,,,0,3,Sun Aug 15 2021 20:02:02 GMT-0300 (Brasilia Standard Time),Fri Aug 13 2021 13:14:04 GMT-0300 (Brasilia Standard Time)
"A reforma e modernização da rodovia AM-010, com os trabalhos iniciados nesta quinta-feira (12/08) pelo governador W… https://t.co/cCDf6jJbfH","""wilson lima""",,,152484640,generosomarcelo,,,0,0,Sun Aug 15 2021 20:02:02 GMT-0300 (Brasilia Standard Time),Fri Aug 13 2021 13:01:09 GMT-0300 (Brasilia Standard Time)
@julio__ly @ADAUT1N n era tu que é o Julio Cesar do Wilson Lima? kkkkk,"""wilson lima""",,,1311902887610638300,Vini_cancelado,,,0,0,Sun Aug 15 2021 20:02:02 GMT-0300 (Brasilia Standard Time),Fri Aug 13 2021 12:50:44 GMT-0300 (Brasilia Standard Time)
É NESSA HORA QUE EU VIRO AMIGA DO WILSON LIMA PRA ELE LIBERAR MINHA ENTRADA https://t.co/TiNvoGlgMw,"""wilson lima""",,,1315762000652316700,othercams,,,0,0,Sun Aug 15 2021 20:02:02 GMT-0300 (Brasilia Standard Time),Fri Aug 13 2021 12:41:41 GMT-0300 (Brasilia Standard Time)
Saúde | A imunização desse público-alvo foi anunciada pelo governador Wilson Lima https://t.co/Qc28pahI8L,"""wilson lima""",,,884066356299264000,blogdaamazonia,,,0,0,Sun Aug 15 2021 20:02:02 GMT-0300 (Brasilia Standard Time),Fri Aug 13 2021 12:00:21 GMT-0300 (Brasilia Standard Time)
ontem eu descobri que o marcelo meu patrão já foi professor da nilton lins e deu aula pro WILSON LIMA KKKKKKKKKKKKKK,"""wilson lima""",,,1350317883440689200,vukagabriele,,,0,0,Sun Aug 15 2021 20:02:02 GMT-0300 (Brasilia Standard Time),Fri Aug 13 2021 11:41:09 GMT-0300 (Brasilia Standard Time)
"‘É a pavimentação de um caminho para o desenvolvimento’, diz Wilson Lima sobre modernização da AM-010 https://t.co/P6EfZRiqH9","""wilson lima""",,,515540998,reporterpin,,,0,0,Sun Aug 15 2021 20:02:02 GMT-0300 (Brasilia Standard Time),Fri Aug 13 2021 10:24:14 GMT-0300 (Brasilia Standard Time)
"Manaus e Região Metropolitana terão gás do Campo de Azulão, anuncia Wilson Lima https://t.co/TspSzaMTZf","""wilson lima""",,,515540998,reporterpin,,,0,0,Sun Aug 15 2021 20:02:02 GMT-0300 (Brasilia Standard Time),Fri Aug 13 2021 10:19:50 GMT-0300 (Brasilia Standard Time)
Wilson Lima participa de reunião da Sudam que definiu temas prioritários para aplicação de recursos de fundos estra… https://t.co/XpBXTsRntJ,"""wilson lima""",,,515540998,reporterpin,,,0,0,Sun Aug 15 2021 20:02:02 GMT-0300 (Brasilia Standard Time),Fri Aug 13 2021 10:18:10 GMT-0300 (Brasilia Standard Time)
"“É a pavimentação de um caminho para o desenvolvimento”, diz Wilson Lima sobre modernização da AM-010 https://t.co/hKA7944fN5","""wilson lima""",,,1329077387301056500,oprimeiroportal,,,0,0,Sun Aug 15 2021 20:02:02 GMT-0300 (Brasilia Standard Time),Fri Aug 13 2021 08:03:14 GMT-0300 (Brasilia Standard Time)
"eu tenho uma foto com o Wilson Lima na minha escola do ensino fundamental, em 2013 sei la","""wilson lima""",,,983552263905075200,pastelzinhoXR13,,,0,0,Sun Aug 15 2021 20:02:02 GMT-0300 (Brasilia Standard Time),Fri Aug 13 2021 02:04:19 GMT-0300 (Brasilia Standard Time)
Wilson Lima participa de reunião da Sudam que definiu temas prioritários para aplicação de recursos de fundos estra… https://t.co/m6cr3XiMmo,"""wilson lima""",,,1172114825981419500,PortalCaboco,,,0,0,Sun Aug 15 2021 20:02:02 GMT-0300 (Brasilia Standard Time),Fri Aug 13 2021 00:43:37 GMT-0300 (Brasilia Standard Time)
"O governador do Amazonas, Wilson Lima, deu início às obras de revitalização e modernização da rodovia AM-010, que i… https://t.co/3XlS1LqIsY","""wilson lima""",,,1179818624485396500,amazoniapress_,,,0,0,Sun Aug 15 2021 20:02:02 GMT-0300 (Brasilia Standard Time),Thu Aug 12 2021 23:56:08 GMT-0300 (Brasilia Standard Time)
RT @realtimeum: #Notícias: Governador Wilson Lima anunciou que a empresa que detém os direitos de exploração comercial do gás natural elevo…,"""wilson lima""",,,374581656,viictor_juan,,,1,0,Sun Aug 15 2021 20:02:02 GMT-0300 (Brasilia Standard Time),Thu Aug 12 2021 22:55:35 GMT-0300 (Brasilia Standard Time)
Sudam: Wilson Lima participa de reunião que definiu temas prioritários para aplicação de recursos de fundos estraté… https://t.co/XDLuJJ0RJF,"""wilson lima""",,,98875202,am_noticias,,,0,0,Sun Aug 15 2021 20:02:02 GMT-0300 (Brasilia Standard Time),Thu Aug 12 2021 20:01:07 GMT-0300 (Brasilia Standard Time)
"“É a pavimentação de um caminho para o desenvolvimento”, diz Wilson Lima sobre modernização da AM-010
Fotos: Lucas… https://t.co/sQfqpuioKL","""wilson lima""",,,364600736,PortaldoAM,,,0,0,Sun Aug 15 2021 20:02:02 GMT-0300 (Brasilia Standard Time),Thu Aug 12 2021 19:52:36 GMT-0300 (Brasilia Standard Time)
Wilson Lima participa de reunião da Sudam que definiu temas prioritários para aplicação de recursos de fundos estra… https://t.co/ec0HKepY4X,"""wilson lima""",,,364600736,PortaldoAM,,,0,0,Sun Aug 15 2021 20:02:02 GMT-0300 (Brasilia Standard Time),Thu Aug 12 2021 19:24:07 GMT-0300 (Brasilia Standard Time)
@UEAmazonas VOCES DEVERIAM E MELHORAR OS SALARIOS DOS ADMISTRATIVOS QUE CARREGAM ESSA UEA NAS COSTAS E ESTÃO A MAIS… https://t.co/RdgAEadftA,"""wilson lima""",,,472309488,manausetica,,,0,0,Sun Aug 15 2021 20:02:02 GMT-0300 (Brasilia Standard Time),Thu Aug 12 2021 19:06:38 GMT-0300 (Brasilia Standard Time)
"Manaus e Região Metropolitana terão gás do Campo de Azulão, anuncia Wilson Lima

Segundo o governador, a Eneva info… https://t.co/jXpiDTjZ5C","""wilson lima""",,,2943018159,portalampost,,,0,0,Sun Aug 15 2021 20:02:02 GMT-0300 (Brasilia Standard Time),Thu Aug 12 2021 18:43:06 GMT-0300 (Brasilia Standard Time)
Wilson Lima e David Almeida ‘reeditam’ ação conjunta durante lançamento de obras na AM-010 https://t.co/XCpCjXbbo2 via @O Convergente,"""wilson lima""",,,1376917910363463700,oconvergente_,,,0,2,Sun Aug 15 2021 20:02:02 GMT-0300 (Brasilia Standard Time),Thu Aug 12 2021 18:28:09 GMT-0300 (Brasilia Standard Time)
"RT @fausto_macedo: A denúncia contra Wilson Lima e outras 16 pessoas, entre elas o vice-governador, Carlos Almeida, foi enviada ao Superior…","""wilson lima""",,,50066201,gustavola,,,4,0,Sun Aug 15 2021 20:02:02 GMT-0300 (Brasilia Standard Time),Thu Aug 12 2021 18:01:32 GMT-0300 (Brasilia Standard Time)
"Amazonas | Obra é a maior intervenção na rodovia estadual em 40 anos, vai gerar 10 mil empregos e impulsionar a eco… https://t.co/NQm2OoUyZH","""wilson lima""",,,884066356299264000,blogdaamazonia,,,0,0,Sun Aug 15 2021 20:02:02 GMT-0300 (Brasilia Standard Time),Thu Aug 12 2021 18:00:42 GMT-0300 (Brasilia Standard Time)
"O governador Wilson Lima anunciou, nesta quinta-feira (12/08), que a produção de gás natural do Campo de Azulão, em… https://t.co/EYKluq8ZeH","""wilson lima""",,,385485570,JCommercio,,,0,0,Sun Aug 15 2021 20:02:02 GMT-0300 (Brasilia Standard Time),Thu Aug 12 2021 17:51:08 GMT-0300 (Brasilia Standard Time)
Coluna Remada Política: David Almeida e Wilson Lima se aproximam https://t.co/udnhXv9NEr via @portalremador,"""wilson lima""",,,68537386,portalremador,,,0,0,Sun Aug 15 2021 20:02:02 GMT-0300 (Brasilia Standard Time),Thu Aug 12 2021 17:32:18 GMT-0300 (Brasilia Standard Time)
"Com investimento de mais de R$ 366 milhões, os serviços vão contemplar os 250 quilômetros da rodovia estadual https://t.co/f1rOX0ZvtS","""wilson lima""",,,152484640,generosomarcelo,,,0,0,Sun Aug 15 2021 20:02:02 GMT-0300 (Brasilia Standard Time),Thu Aug 12 2021 17:26:00 GMT-0300 (Brasilia Standard Time)
"Manaus e Região Metropolitana terão gás do Campo de Azulão, anuncia Wilson Lima https://t.co/INFBW95aP1","""wilson lima""",,,98875202,am_noticias,,,0,0,Sun Aug 15 2021 20:02:02 GMT-0300 (Brasilia Standard Time),Thu Aug 12 2021 17:11:02 GMT-0300 (Brasilia Standard Time)
Wilson Lima dá início à reconstrução e modernização da AM-010 https://t.co/3dApDSImTU,"""wilson lima""",,,98875202,am_noticias,,,0,0,Sun Aug 15 2021 20:02:02 GMT-0300 (Brasilia Standard Time),Thu Aug 12 2021 16:27:05 GMT-0300 (Brasilia Standard Time)
"⭐👉🏽 Como não sou adepto do ""GRUPO DAS PUTAS VIRGENS"" ...

Afirmo : Tudo indica q o governo federal vai marchar com… https://t.co/JbxEui7iJ6","""wilson lima""",,,1357860559803285500,CapitaoAte2026,,,0,0,Sun Aug 15 2021 20:02:02 GMT-0300 (Brasilia Standard Time),Thu Aug 12 2021 16:09:46 GMT-0300 (Brasilia Standard Time)
"⭕ Manaus e Região Metropolitana terão gás do Campo de Azulão, anuncia @wilsonlimaAM 

O governador anunciou, nesta… https://t.co/0ISRju5Qsc","""wilson lima""",,,956927146974502900,diretoaoponto1_,,,0,0,Sun Aug 15 2021 20:02:02 GMT-0300 (Brasilia Standard Time),Thu Aug 12 2021 16:04:04 GMT-0300 (Brasilia Standard Time)
"⭕ Governador @wilsonlimaAM dá início à reconstrução e modernização da AM-010

Com investimento de mais de R$ 366 mi… https://t.co/PncMLwLFHH","""wilson lima""",,,956927146974502900,diretoaoponto1_,,,0,0,Sun Aug 15 2021 20:02:02 GMT-0300 (Brasilia Standard Time),Thu Aug 12 2021 16:02:06 GMT-0300 (Brasilia Standard Time)
