text,query,country,city,userId,username,quote_count,reply_count,retweet_count,favorite_count,timestamp,createdAt
@Sen_Alessandro @janainalimasp @PriscilaFCruz Olha o inútil o verdadeiro parasita! Trabalhar pelo povo de Sergipe n… https://t.co/mh1RnXFCQ2,belivaldo,,,1392136431649366000,Marina650302531,,,0,0,Wed Aug 04 2021 22:13:59 GMT-0300 (Brasilia Standard Time),Wed Aug 04 2021 21:18:00 GMT-0300 (Brasilia Standard Time)
O petista sabe que fará oposição ao governador Belivaldo Chagas (PSD) https://t.co/pcOgoQlWPd,belivaldo,,,29148889,nenoticias,,,0,0,Wed Aug 04 2021 22:13:59 GMT-0300 (Brasilia Standard Time),Wed Aug 04 2021 18:40:01 GMT-0300 (Brasilia Standard Time)
Belivaldo cria programa em benefício de pequenos produtores de leite do Alto Sertão https://t.co/Lh7VIRgRoQ,belivaldo,,,57341747,governosergipe,,,0,2,Wed Aug 04 2021 22:13:59 GMT-0300 (Brasilia Standard Time),Wed Aug 04 2021 16:46:55 GMT-0300 (Brasilia Standard Time)
Belivaldo envia PL à Alese para prorrogação do benefício do CMais https://t.co/lFoRDOBFRa,belivaldo,,,57341747,governosergipe,,,0,2,Wed Aug 04 2021 22:13:59 GMT-0300 (Brasilia Standard Time),Wed Aug 04 2021 16:36:45 GMT-0300 (Brasilia Standard Time)
Belivaldo envia à Alese PL que garante auxílio emergencial. Leia no https://t.co/LB0EZZE5J3,belivaldo,,,305585197,JoedsonTelles,,,0,0,Wed Aug 04 2021 22:13:59 GMT-0300 (Brasilia Standard Time),Wed Aug 04 2021 14:41:37 GMT-0300 (Brasilia Standard Time)
"RT @governosergipe: ""Somos ricos em gás e minérios e seremos referência para o país agora e nos próximos anos"", diz Belivaldo na inauguraçã…",belivaldo,,,1422548809096302600,SandroC02883611,,,3,0,Wed Aug 04 2021 22:13:59 GMT-0300 (Brasilia Standard Time),Tue Aug 03 2021 11:54:59 GMT-0300 (Brasilia Standard Time)
Belivaldo elogia trabalho de André e diz que Edvaldo foi feliz na parceria https://t.co/OItQngTmzX https://t.co/eou9WxNxiR,belivaldo,,,40384615,clicksergipe,,,0,1,Wed Aug 04 2021 22:13:59 GMT-0300 (Brasilia Standard Time),Tue Aug 03 2021 09:14:49 GMT-0300 (Brasilia Standard Time)
"@cuzcuzdearroz @juzweifel @medoedeliriobr Belivaldo Chagas também, é a porra mesmo viu",belivaldo,,,1404762578677547000,nathyproblema_,,,0,0,Wed Aug 04 2021 22:13:59 GMT-0300 (Brasilia Standard Time),Tue Aug 03 2021 06:49:58 GMT-0300 (Brasilia Standard Time)
"O superintendente de Comunicação do Governo de Sergipe, Givaldo Ricardo, afirmou no Jornal da Fan que o governador… https://t.co/SREizbgB0R",belivaldo,,,893116265098862600,portalfanf1,,,0,1,Wed Aug 04 2021 22:13:59 GMT-0300 (Brasilia Standard Time),Tue Aug 03 2021 06:24:54 GMT-0300 (Brasilia Standard Time)
"RT @EvidencieSE: “Somos ricos em gás e minérios e seremos referência para o país agora e nos próximos anos”, diz Belivaldo na inauguração d…",belivaldo,,,290275542,SueliCarvalho1,,,1,0,Wed Aug 04 2021 22:13:59 GMT-0300 (Brasilia Standard Time),Tue Aug 03 2021 02:44:25 GMT-0300 (Brasilia Standard Time)
"“Somos ricos em gás e minérios e seremos referência para o país agora e nos próximos anos”, diz Belivaldo na inaugu… https://t.co/4R0KYvm5jo",belivaldo,,,876536346432688100,EvidencieSE,,,1,0,Wed Aug 04 2021 22:13:59 GMT-0300 (Brasilia Standard Time),Mon Aug 02 2021 22:54:11 GMT-0300 (Brasilia Standard Time)
"RT @governosergipe: ""Somos ricos em gás e minérios e seremos referência para o país agora e nos próximos anos"", diz Belivaldo na inauguraçã…",belivaldo,,,125454858,salesneto1,,,3,0,Wed Aug 04 2021 22:13:59 GMT-0300 (Brasilia Standard Time),Mon Aug 02 2021 22:23:33 GMT-0300 (Brasilia Standard Time)
O governador Belivaldo Chagas assinou decretos e protocolos de intenção que tratam das iniciativas do Governo Estad… https://t.co/2OVw1BwJKH,belivaldo,,,102254248,PimentelLuciano,,,0,1,Wed Aug 04 2021 22:13:59 GMT-0300 (Brasilia Standard Time),Mon Aug 02 2021 19:18:42 GMT-0300 (Brasilia Standard Time)
"“Somos ricos em gás e minérios e seremos referência para o país”, diz Belivaldo na inauguração da Unigel. Leia no https://t.co/BwGGaYKFst",belivaldo,,,305585197,JoedsonTelles,,,0,0,Wed Aug 04 2021 22:13:59 GMT-0300 (Brasilia Standard Time),Mon Aug 02 2021 18:17:13 GMT-0300 (Brasilia Standard Time)
"RT @governosergipe: ""Somos ricos em gás e minérios e seremos referência para o país agora e nos próximos anos"", diz Belivaldo na inauguraçã…",belivaldo,,,1305485196310052900,SEdesenvolve,,,3,0,Wed Aug 04 2021 22:13:59 GMT-0300 (Brasilia Standard Time),Mon Aug 02 2021 17:44:02 GMT-0300 (Brasilia Standard Time)
"""Somos ricos em gás e minérios e seremos referência para o país agora e nos próximos anos"", diz Belivaldo na inaugu… https://t.co/R4mWaAE15g",belivaldo,,,57341747,governosergipe,,,3,8,Wed Aug 04 2021 22:13:59 GMT-0300 (Brasilia Standard Time),Mon Aug 02 2021 17:40:23 GMT-0300 (Brasilia Standard Time)
"RT @BLOGRSNOTICIA: Fábrica da Unigel em Laranjeiras é oficialmente inaugurada. Com as presenças do prefeito Juca e seu vice Janio, do minis…",belivaldo,,,94940020,BLOGdoREGINALDO,,,2,0,Wed Aug 04 2021 22:13:59 GMT-0300 (Brasilia Standard Time),Mon Aug 02 2021 17:26:06 GMT-0300 (Brasilia Standard Time)
"RT @BLOGRSNOTICIA: *FÁBRICA DA UNIGEL EM LARANJEIRAS É OFICIALMENTE INAUGURADA. Com as presenças do prefeito Juca e seu vice Janio, do mini…",belivaldo,,,94940020,BLOGdoREGINALDO,,,2,0,Wed Aug 04 2021 22:13:59 GMT-0300 (Brasilia Standard Time),Mon Aug 02 2021 17:26:03 GMT-0300 (Brasilia Standard Time)
"RT @BLOGRSNOTICIA: Fábrica da Unigel em Laranjeiras é oficialmente inaugurada. Com as presenças do prefeito Juca e seu vice Janio, do minis…",belivaldo,,,220332700,BLOGRSNOTICIA,,,2,0,Wed Aug 04 2021 22:13:59 GMT-0300 (Brasilia Standard Time),Mon Aug 02 2021 16:52:11 GMT-0300 (Brasilia Standard Time)
"RT @BLOGRSNOTICIA: *FÁBRICA DA UNIGEL EM LARANJEIRAS É OFICIALMENTE INAUGURADA. Com as presenças do prefeito Juca e seu vice Janio, do mini…",belivaldo,,,220332700,BLOGRSNOTICIA,,,2,0,Wed Aug 04 2021 22:13:59 GMT-0300 (Brasilia Standard Time),Mon Aug 02 2021 16:52:02 GMT-0300 (Brasilia Standard Time)
"*FÁBRICA DA UNIGEL EM LARANJEIRAS É OFICIALMENTE INAUGURADA. Com as presenças do prefeito Juca e seu vice Janio, do… https://t.co/2eH2KeO1Fr",belivaldo,,,220332700,BLOGRSNOTICIA,,,2,0,Wed Aug 04 2021 22:13:59 GMT-0300 (Brasilia Standard Time),Mon Aug 02 2021 16:51:53 GMT-0300 (Brasilia Standard Time)
"Fábrica da Unigel em Laranjeiras é oficialmente inaugurada. Com as presenças do prefeito Juca e seu vice Janio, do… https://t.co/aKWNJCjgRv",belivaldo,,,220332700,BLOGRSNOTICIA,,,2,0,Wed Aug 04 2021 22:13:59 GMT-0300 (Brasilia Standard Time),Mon Aug 02 2021 16:51:10 GMT-0300 (Brasilia Standard Time)
"“Somos ricos em gás e minerais e seremos referência para o país agora e nos próximos anos”, diz Belivaldo na inaugu… https://t.co/KHbm885a76",belivaldo,,,713836792,NoticiasAracaju,,,0,1,Wed Aug 04 2021 22:13:59 GMT-0300 (Brasilia Standard Time),Mon Aug 02 2021 16:19:17 GMT-0300 (Brasilia Standard Time)
Minha tia é agente de saúde e falou que na sexta chegaram só 1000 doses de vacina pra São Cristóvão e que o Belival… https://t.co/kKeQF3THIi,belivaldo,,,1082038371499864000,afroposte,,,0,9,Wed Aug 04 2021 22:13:59 GMT-0300 (Brasilia Standard Time),Mon Aug 02 2021 15:41:06 GMT-0300 (Brasilia Standard Time)
O governo de Sergipe promove uma nova etapa de adequação das regras estaduais ao Novo Mercado de Gás. Além de assin… https://t.co/xppT47u9hS,belivaldo,,,180916320,F5Sergipe,,,0,1,Wed Aug 04 2021 22:13:59 GMT-0300 (Brasilia Standard Time),Mon Aug 02 2021 15:35:53 GMT-0300 (Brasilia Standard Time)
"Se eu morasse em Aracaju... 🤡 

vá se fuder Belivaldo e Inaldo https://t.co/ptJtlQmkXF",belivaldo,,,398919379,umapsico,,,0,2,Wed Aug 04 2021 22:13:59 GMT-0300 (Brasilia Standard Time),Mon Aug 02 2021 14:04:23 GMT-0300 (Brasilia Standard Time)
"RT @governosergipe: Em Simão Dias, Belivaldo assina Ordem de Serviço da segunda etapa do Canal Remanso https://t.co/7vwsEkoYgg",belivaldo,,,1305485196310052900,SEdesenvolve,,,1,0,Wed Aug 04 2021 22:13:59 GMT-0300 (Brasilia Standard Time),Mon Aug 02 2021 10:25:52 GMT-0300 (Brasilia Standard Time)
"Em Simão Dias, Belivaldo assina Ordem de Serviço da segunda etapa do Canal Remanso https://t.co/7vwsEkoYgg",belivaldo,,,57341747,governosergipe,,,1,3,Wed Aug 04 2021 22:13:59 GMT-0300 (Brasilia Standard Time),Mon Aug 02 2021 10:23:19 GMT-0300 (Brasilia Standard Time)
O governador Belivaldo Chagas (PSD) vai lançar um plano tributário para o setor de petróleo e gás natural… https://t.co/DFik9EsmFZ,belivaldo,,,901833989606051800,epbr,,,0,0,Wed Aug 04 2021 22:13:59 GMT-0300 (Brasilia Standard Time),Mon Aug 02 2021 09:36:36 GMT-0300 (Brasilia Standard Time)
André afirmou que o elogio de Belivaldo Chagas é fruto do reconhecimento do trabalha que fez e vem fazendo por Serg… https://t.co/oJwd1Y74op,belivaldo,,,893116265098862600,portalfanf1,,,0,0,Wed Aug 04 2021 22:13:59 GMT-0300 (Brasilia Standard Time),Mon Aug 02 2021 07:24:48 GMT-0300 (Brasilia Standard Time)
"“Sergipe retomou a sua capacidade de investimentos”, diz Belivaldo ao autorizar obras da rodovia que liga a BR-101… https://t.co/OfXKs53oSx",belivaldo,,,89722380,sitedobareta,,,0,0,Wed Aug 04 2021 22:13:59 GMT-0300 (Brasilia Standard Time),Sun Aug 01 2021 18:30:05 GMT-0300 (Brasilia Standard Time)
Valadares diz que Belivaldo e ingrato terça feira ele diz o resto https://t.co/7oaWkObFdC,belivaldo,,,1421907267377680400,WebRiachao,,,0,0,Wed Aug 04 2021 22:13:59 GMT-0300 (Brasilia Standard Time),Sun Aug 01 2021 16:25:23 GMT-0300 (Brasilia Standard Time)
"Meu Deus eliminaram Ágatha e Duda que inferno belivaldo chagas faça alguma coisa, mande um cheque, um pix qualquer… https://t.co/z2i6kC65JX",belivaldo,,,1001371467727233000,pocsofrida,,,0,0,Wed Aug 04 2021 22:13:59 GMT-0300 (Brasilia Standard Time),Sun Aug 01 2021 07:19:09 GMT-0300 (Brasilia Standard Time)
"Governador do Estado de Sergipe Belivaldo Chagas e o prefeito da capital Aracaju Edvaldo Nogueira, esse é o resulta… https://t.co/PACqIRC7JE",belivaldo,,,1345558324209713200,DanielDantasDr2,,,0,1,Wed Aug 04 2021 22:13:59 GMT-0300 (Brasilia Standard Time),Sun Aug 01 2021 02:06:33 GMT-0300 (Brasilia Standard Time)
"“Sergipe retomou a sua capacidade de investimentos”, diz Belivaldo https://t.co/eV1W7vYM6q",belivaldo,,,249299549,imprensa1se,,,0,2,Wed Aug 04 2021 22:13:59 GMT-0300 (Brasilia Standard Time),Sat Jul 31 2021 22:17:08 GMT-0300 (Brasilia Standard Time)
"Governador Belivaldo Chagas elogia trabalho do ex-deputado André Moura.

Para ler a matéria, acesse:… https://t.co/LxbzVBv5yL",belivaldo,,,217592807,Senoticias,,,0,1,Wed Aug 04 2021 22:13:59 GMT-0300 (Brasilia Standard Time),Sat Jul 31 2021 14:49:39 GMT-0300 (Brasilia Standard Time)
"Cumprindo agenda em Lagarto, visitei o deputado federal @fabioreis1515, agradeci a receptividade, e reforcei minha… https://t.co/aC6KppxCSL",belivaldo,,,130696242,LaercioFederal,,,0,5,Wed Aug 04 2021 22:13:59 GMT-0300 (Brasilia Standard Time),Sat Jul 31 2021 13:11:12 GMT-0300 (Brasilia Standard Time)
"Em Simão Dias, Belivaldo assina Ordem de Serviço da segunda etapa do Canal Remanso https://t.co/KMWNp68RbH",belivaldo,,,1428890886,LagartoComoVejo,,,0,1,Wed Aug 04 2021 22:13:59 GMT-0300 (Brasilia Standard Time),Sat Jul 31 2021 09:22:21 GMT-0300 (Brasilia Standard Time)
"@Fiodanavalha1 se o candidato grudar em lula tem boa chance de ganhar, só ver belivaldo que ngm conhecia e foi eleito",belivaldo,,,2615992970,gustavonunesrio,,,0,1,Wed Aug 04 2021 22:13:59 GMT-0300 (Brasilia Standard Time),Sat Jul 31 2021 01:15:02 GMT-0300 (Brasilia Standard Time)
esse belivaldo 🙈 https://t.co/7HCJNocSjH,belivaldo,,,1213106966991495200,puppysccp,,,0,1,Wed Aug 04 2021 22:13:59 GMT-0300 (Brasilia Standard Time),Fri Jul 30 2021 22:33:54 GMT-0300 (Brasilia Standard Time)
"Belivaldo confunde com Edvaldo e ""lança"" André - NE Notícias https://t.co/QWY7xX3hlP",belivaldo,,,165937406,gaspeufontes,,,0,0,Wed Aug 04 2021 22:13:59 GMT-0300 (Brasilia Standard Time),Fri Jul 30 2021 19:42:46 GMT-0300 (Brasilia Standard Time)
"Em Simão Dias, Belivaldo assina Ordem de Serviço da segunda etapa do Canal Remanso https://t.co/7vwsEkoYgg",belivaldo,,,57341747,governosergipe,,,0,1,Wed Aug 04 2021 22:13:59 GMT-0300 (Brasilia Standard Time),Fri Jul 30 2021 18:33:10 GMT-0300 (Brasilia Standard Time)
"Encerrando nossa agenda em Simão Dias, participei hoje da solenidade de assinatura da ordem de serviço para implant… https://t.co/UJLZVqhIad",belivaldo,,,102254248,PimentelLuciano,,,0,4,Wed Aug 04 2021 22:13:59 GMT-0300 (Brasilia Standard Time),Fri Jul 30 2021 17:53:00 GMT-0300 (Brasilia Standard Time)
"“Sergipe retomou a sua capacidade de investimentos”, diz Belivaldo. Leia no https://t.co/QOND28N87A",belivaldo,,,305585197,JoedsonTelles,,,0,0,Wed Aug 04 2021 22:13:59 GMT-0300 (Brasilia Standard Time),Fri Jul 30 2021 17:44:08 GMT-0300 (Brasilia Standard Time)
"Ao ser questionado sobre o atual governador de Sergipe, o ex-senador declarou: ""Belivaldo (Chagas) é a imagem da in… https://t.co/uPfXQjYQj0",belivaldo,,,29148889,nenoticias,,,0,1,Wed Aug 04 2021 22:13:59 GMT-0300 (Brasilia Standard Time),Fri Jul 30 2021 17:20:01 GMT-0300 (Brasilia Standard Time)
"“Sergipe retomou a sua capacidade de investimentos”, diz Belivaldo ao autorizar obras da rodovia que liga a BR-101… https://t.co/GaIr9V3Sf8",belivaldo,,,57341747,governosergipe,,,0,6,Wed Aug 04 2021 22:13:59 GMT-0300 (Brasilia Standard Time),Fri Jul 30 2021 16:23:55 GMT-0300 (Brasilia Standard Time)
Pertinho da eleição o Belivaldo começou a assinar tudo que é ordem de serviço. Que mistério hein,belivaldo,,,1057733716859084800,miranhacrf,,,0,0,Wed Aug 04 2021 22:13:59 GMT-0300 (Brasilia Standard Time),Fri Jul 30 2021 13:48:22 GMT-0300 (Brasilia Standard Time)
RT @BLOGRSNOTICIA: Belivaldo faz nova redução na duração do toque de recolher em Sergipe. Governador Belivaldo Chagas em nova reunião do Co…,belivaldo,,,220332700,BLOGRSNOTICIA,,,2,0,Wed Aug 04 2021 22:13:59 GMT-0300 (Brasilia Standard Time),Thu Jul 29 2021 22:20:39 GMT-0300 (Brasilia Standard Time)
RT @BLOGRSNOTICIA: *BELIVALDO FAZ NOVA REDUÇÃO NA DURAÇÃO DO TOQUE DE RECOLHER EM SERGIPE. Governador Belivaldo Chagas em nova reunião do C…,belivaldo,,,220332700,BLOGRSNOTICIA,,,2,0,Wed Aug 04 2021 22:13:59 GMT-0300 (Brasilia Standard Time),Thu Jul 29 2021 22:20:36 GMT-0300 (Brasilia Standard Time)
RT @BLOGRSNOTICIA: Belivaldo faz nova redução na duração do toque de recolher em Sergipe. Governador Belivaldo Chagas em nova reunião do Co…,belivaldo,,,94940020,BLOGdoREGINALDO,,,2,0,Wed Aug 04 2021 22:13:59 GMT-0300 (Brasilia Standard Time),Thu Jul 29 2021 22:18:19 GMT-0300 (Brasilia Standard Time)
RT @BLOGRSNOTICIA: *BELIVALDO FAZ NOVA REDUÇÃO NA DURAÇÃO DO TOQUE DE RECOLHER EM SERGIPE. Governador Belivaldo Chagas em nova reunião do C…,belivaldo,,,94940020,BLOGdoREGINALDO,,,2,0,Wed Aug 04 2021 22:13:59 GMT-0300 (Brasilia Standard Time),Thu Jul 29 2021 22:18:15 GMT-0300 (Brasilia Standard Time)
"@Sen_Alessandro Já hackearam a cia, NASA, pentágono, Amazon, Microsoft, etc... Mas a urna eletrônica é segura sim.… https://t.co/9pXbBPdJXr",belivaldo,,,1407050447668535300,Andrade4882,,,0,28,Wed Aug 04 2021 22:13:59 GMT-0300 (Brasilia Standard Time),Thu Jul 29 2021 21:33:24 GMT-0300 (Brasilia Standard Time)
*BELIVALDO FAZ NOVA REDUÇÃO NA DURAÇÃO DO TOQUE DE RECOLHER EM SERGIPE. Governador Belivaldo Chagas em nova reunião… https://t.co/mWQyLdg42b,belivaldo,,,220332700,BLOGRSNOTICIA,,,2,0,Wed Aug 04 2021 22:13:59 GMT-0300 (Brasilia Standard Time),Thu Jul 29 2021 19:49:48 GMT-0300 (Brasilia Standard Time)
Belivaldo faz nova redução na duração do toque de recolher em Sergipe. Governador Belivaldo Chagas em nova reunião… https://t.co/FpzmroOsZI,belivaldo,,,220332700,BLOGRSNOTICIA,,,2,0,Wed Aug 04 2021 22:13:59 GMT-0300 (Brasilia Standard Time),Thu Jul 29 2021 19:48:23 GMT-0300 (Brasilia Standard Time)
"RT @SergipeFolha: “Acho que perdemos o timing para a compra das vacinas Sputnik”, diz Belivaldo https://t.co/ySAOY1J1He",belivaldo,,,199431574,elder31,,,1,0,Wed Aug 04 2021 22:13:59 GMT-0300 (Brasilia Standard Time),Thu Jul 29 2021 19:16:54 GMT-0300 (Brasilia Standard Time)
GOVERNADOR BELIVALDO CHAGAS FAZ NOVA REDUÇÃO NA DURAÇÃO DO TOQUE DE RECOLHER EM TODO ESTADO -… https://t.co/DCFC39wm6x,belivaldo,,,1041831564437532700,EspacoMilitar,,,0,0,Wed Aug 04 2021 22:13:59 GMT-0300 (Brasilia Standard Time),Thu Jul 29 2021 18:28:11 GMT-0300 (Brasilia Standard Time)
"“Acho que perdemos o timing para a compra das vacinas Sputnik”, diz Belivaldo https://t.co/ySAOY1J1He",belivaldo,,,1370044624568455200,SergipeFolha,,,1,1,Wed Aug 04 2021 22:13:59 GMT-0300 (Brasilia Standard Time),Thu Jul 29 2021 17:39:55 GMT-0300 (Brasilia Standard Time)
Belivaldo autoriza reestruturação de rodovia que liga a BR-101 a São Cristóvão https://t.co/YFapmPFakv,belivaldo,,,57341747,governosergipe,,,0,4,Wed Aug 04 2021 22:13:59 GMT-0300 (Brasilia Standard Time),Thu Jul 29 2021 17:26:16 GMT-0300 (Brasilia Standard Time)
"Sabendo o que todos sabem, que o PT lançará o senador Rogério Carvalho como seu candidato a governador, Laércio é o… https://t.co/3We02YbZHT",belivaldo,,,29148889,nenoticias,,,0,1,Wed Aug 04 2021 22:13:59 GMT-0300 (Brasilia Standard Time),Thu Jul 29 2021 13:01:23 GMT-0300 (Brasilia Standard Time)
"@oradioboy 🥺🥺🥺 
petição pra Belivaldo fazer o BRT destino Pink Elze-Lagarto",belivaldo,,,329917306,wolfferson,,,0,1,Wed Aug 04 2021 22:13:59 GMT-0300 (Brasilia Standard Time),Thu Jul 29 2021 11:45:46 GMT-0300 (Brasilia Standard Time)
"RT @shayna_bl: Belivaldo, nunca vou te perdoar por me fazer ir trabalhar durante as olimpíadas",belivaldo,,,1150217520038719500,eajexs,,,1,0,Wed Aug 04 2021 22:13:59 GMT-0300 (Brasilia Standard Time),Thu Jul 29 2021 08:20:17 GMT-0300 (Brasilia Standard Time)
"Belivaldo, nunca vou te perdoar por me fazer ir trabalhar durante as olimpíadas",belivaldo,,,1016739550859800600,shayna_bl,,,1,13,Wed Aug 04 2021 22:13:59 GMT-0300 (Brasilia Standard Time),Thu Jul 29 2021 08:08:31 GMT-0300 (Brasilia Standard Time)
@portaIfab Tô achando  que é esquema de desvio de dinheiro pro belivaldo meter lockdown sem medo de errar,belivaldo,,,1392568112516583400,soyjoaopedro,,,0,0,Wed Aug 04 2021 22:13:59 GMT-0300 (Brasilia Standard Time),Thu Jul 29 2021 05:15:32 GMT-0300 (Brasilia Standard Time)
"Belivaldo reúne gestores para alinhar estratégia de desenvolvimento do estado
https://t.co/0C4ukKZneB https://t.co/EesHVaVHAd",belivaldo,,,727178400201343000,SergipeMais1,,,0,0,Wed Aug 04 2021 22:13:59 GMT-0300 (Brasilia Standard Time),Wed Jul 28 2021 19:53:51 GMT-0300 (Brasilia Standard Time)
"Sobre a indicação de candidato a vice-governador, pode ficar para o ano das eleições https://t.co/Idhrc3S0dI #Eleicoes2022 #Sergipe",belivaldo,,,29148889,nenoticias,,,0,0,Wed Aug 04 2021 22:13:59 GMT-0300 (Brasilia Standard Time),Wed Jul 28 2021 17:40:01 GMT-0300 (Brasilia Standard Time)
RT @BlogClaudioNun: Laércio é o primeiro aliado de Belivaldo a declarar que não vota em Rogério para governador - Imprensa 24h https://t.co…,belivaldo,,,102134005,AntonioSamarone,,,1,0,Wed Aug 04 2021 22:13:59 GMT-0300 (Brasilia Standard Time),Wed Jul 28 2021 16:37:10 GMT-0300 (Brasilia Standard Time)
"""O PT não tem sido justo com Belivaldo Chagas"", diz Laércio Oliveira https://t.co/RZYk7hxuF5 https://t.co/LP5WtGDrBk",belivaldo,,,40384615,clicksergipe,,,0,1,Wed Aug 04 2021 22:13:59 GMT-0300 (Brasilia Standard Time),Wed Jul 28 2021 14:55:22 GMT-0300 (Brasilia Standard Time)
Belivaldo reúne gestores para alinhar estratégia de desenvolvimento do estado https://t.co/GWCBCKtlbf,belivaldo,,,57341747,governosergipe,,,0,5,Wed Aug 04 2021 22:13:59 GMT-0300 (Brasilia Standard Time),Wed Jul 28 2021 14:12:59 GMT-0300 (Brasilia Standard Time)
Laércio é o primeiro aliado de Belivaldo a declarar que não vota em Rogério para governador - Imprensa 24h https://t.co/5rQbeVEJY2,belivaldo,,,165085723,BlogClaudioNun,,,1,9,Wed Aug 04 2021 22:13:59 GMT-0300 (Brasilia Standard Time),Wed Jul 28 2021 13:05:22 GMT-0300 (Brasilia Standard Time)
"RT @portalfanf1: “Quanto antes definir, melhor”, diz Laércio Oliveira sobre a escolha do nome que vai suceder Belivaldo Chagas. Sintonize n…",belivaldo,,,831229759124303900,JornaldaFan,,,1,0,Wed Aug 04 2021 22:13:59 GMT-0300 (Brasilia Standard Time),Wed Jul 28 2021 07:57:51 GMT-0300 (Brasilia Standard Time)
"“Quanto antes definir, melhor”, diz Laércio Oliveira sobre a escolha do nome que vai suceder Belivaldo Chagas. Sint… https://t.co/kxw20v8DvY",belivaldo,,,893116265098862600,portalfanf1,,,1,3,Wed Aug 04 2021 22:13:59 GMT-0300 (Brasilia Standard Time),Wed Jul 28 2021 07:51:15 GMT-0300 (Brasilia Standard Time)
"RT @shayna_bl: Beleza, Belivaldo, temos uma sergipana jogando hoje e nós não poderemos desfrutar desse jogo em casa???? Cadê o patriotismo…",belivaldo,,,1167243184398917600,3ana_banana,,,14,0,Wed Aug 04 2021 22:13:59 GMT-0300 (Brasilia Standard Time),Wed Jul 28 2021 06:57:27 GMT-0300 (Brasilia Standard Time)
"Enquanto muitos aceleravam o rumo, destacavam ""demissões"", Belivaldo comia, fora de Aracaju, quiabada, carne frita… https://t.co/8iym8afxmx",belivaldo,,,29148889,nenoticias,,,0,0,Wed Aug 04 2021 22:13:59 GMT-0300 (Brasilia Standard Time),Tue Jul 27 2021 22:00:00 GMT-0300 (Brasilia Standard Time)
