text,query,country,city,userId,username,quote_count,reply_count,retweet_count,favorite_count,timestamp,createdAt
"Muito honrado com a visita do cacique Ninawa Huni Kuin da Aldeia Txanauri, no Acre, Tarauaca. Obrigado pelo lindo c… https://t.co/1A3lPTVEXQ",64706049,,,64706049,jdoriajr,,,52,1355,Mon Sep 20 2021 20:28:04 GMT-0300 (Brasilia Standard Time),Tue Aug 17 2021 15:59:21 GMT-0300 (Brasilia Standard Time)
É para isso que trabalhamos. Para levar mais qualidade de vida e dignidade para a população de SP.,64706049,,,64706049,jdoriajr,,,8,405,Mon Sep 20 2021 20:28:04 GMT-0300 (Brasilia Standard Time),Tue Aug 17 2021 14:07:15 GMT-0300 (Brasilia Standard Time)
"Palavras de apoio e carinho, como as que recebi da Luciana, fazem valer nosso esforço. Ela mora na Brasilândia e ho… https://t.co/T8XtEZr8lb",64706049,,,64706049,jdoriajr,,,42,1022,Mon Sep 20 2021 20:28:04 GMT-0300 (Brasilia Standard Time),Tue Aug 17 2021 14:07:15 GMT-0300 (Brasilia Standard Time)
"Mais de três mil pessoas já estão trabalhando nesta construção, que foi paralisada em 2016 e retomada em 2020 por n… https://t.co/QqFCWbYtCK",64706049,,,64706049,jdoriajr,,,22,378,Mon Sep 20 2021 20:28:04 GMT-0300 (Brasilia Standard Time),Tue Aug 17 2021 11:30:00 GMT-0300 (Brasilia Standard Time)
Vim até a Freguesia do Ó acompanhar a descida do primeiro tatuzão que fará as escavações da Linha 6-Laranja do Metr… https://t.co/lYTNgAITS5,64706049,,,64706049,jdoriajr,,,49,1216,Mon Sep 20 2021 20:28:04 GMT-0300 (Brasilia Standard Time),Tue Aug 17 2021 11:29:53 GMT-0300 (Brasilia Standard Time)
"Bom dia! A partir de amanhã, dia 18, iniciaremos a imunização dos adolescentes entre 12 e 17 anos com deficiência e… https://t.co/7ixNqyWUJd",64706049,,,64706049,jdoriajr,,,265,6378,Mon Sep 20 2021 20:28:04 GMT-0300 (Brasilia Standard Time),Tue Aug 17 2021 07:19:11 GMT-0300 (Brasilia Standard Time)
"Confirmada Fórmula 1 em SP, no Autódromo de Interlagos, nos próximos 10 anos 🏎🏎🏎🏎 

O GP SP de Fórmula 1 em 2021 va… https://t.co/7G9cWSpGRO",64706049,,,64706049,jdoriajr,,,160,2823,Mon Sep 20 2021 20:28:04 GMT-0300 (Brasilia Standard Time),Mon Aug 16 2021 17:43:10 GMT-0300 (Brasilia Standard Time)
"@WanmingYang Obrigado por todo apoio, Embaixador @WanmingYang. 🇧🇷🇨🇳",64706049,,,64706049,jdoriajr,,,29,1276,Mon Sep 20 2021 20:28:04 GMT-0300 (Brasilia Standard Time),Mon Aug 16 2021 16:39:38 GMT-0300 (Brasilia Standard Time)
@shen_shiwei Butantan and Sinovac had worked before creating vaccines for influenza and hepatitis and the agreement… https://t.co/DQusjoaTNG,64706049,,,64706049,jdoriajr,,,0,4,Mon Sep 20 2021 20:28:04 GMT-0300 (Brasilia Standard Time),Mon Aug 16 2021 16:36:04 GMT-0300 (Brasilia Standard Time)
"@shen_shiwei Mr. Shen, the vaccine is produced in partnership with The Butantan Institute (a branch of the São Paul… https://t.co/QyY9OLPDAr",64706049,,,64706049,jdoriajr,,,0,4,Mon Sep 20 2021 20:28:04 GMT-0300 (Brasilia Standard Time),Mon Aug 16 2021 16:35:56 GMT-0300 (Brasilia Standard Time)
RT @governosp: https://t.co/YKttwOWiMV,64706049,,,64706049,jdoriajr,,,10,0,Mon Sep 20 2021 20:28:04 GMT-0300 (Brasilia Standard Time),Mon Aug 16 2021 13:08:54 GMT-0300 (Brasilia Standard Time)
"Daqui a pouco, a partir do meio-dia, faremos coletiva de imprensa para apresentar informações sobre a realização do… https://t.co/5wB5FZ4QYC",64706049,,,64706049,jdoriajr,,,28,601,Mon Sep 20 2021 20:28:04 GMT-0300 (Brasilia Standard Time),Mon Aug 16 2021 11:38:40 GMT-0300 (Brasilia Standard Time)
"Conseguimos antecipar em dois meses a vacinação. Seguiremos vacinando, com agilidade e eficiência, até que todos te… https://t.co/59RMUltqm9",64706049,,,64706049,jdoriajr,,,49,1439,Mon Sep 20 2021 20:28:04 GMT-0300 (Brasilia Standard Time),Mon Aug 16 2021 10:27:22 GMT-0300 (Brasilia Standard Time)
Hoje é o Dia da Esperança em SP. O dia em que concluiremos a vacinação da 1ª dose em todos os adultos com mais de 1… https://t.co/fQnpH4cGQm,64706049,,,64706049,jdoriajr,,,169,3990,Mon Sep 20 2021 20:28:04 GMT-0300 (Brasilia Standard Time),Mon Aug 16 2021 10:27:22 GMT-0300 (Brasilia Standard Time)
"Mais vacinas para acelerar a imunização em todo o Brasil

Nesta manhã liberamos mais 4 milhões de doses da vacina d… https://t.co/bP23qIiU6o",64706049,,,64706049,jdoriajr,,,86,2091,Mon Sep 20 2021 20:28:04 GMT-0300 (Brasilia Standard Time),Mon Aug 16 2021 09:20:57 GMT-0300 (Brasilia Standard Time)
Mais um lote com 2 milhões de doses prontas da vacina do Butantan chegou esta noite ao aeroporto de Guarulhos. Elas… https://t.co/fPeuCAdrSX,64706049,,,64706049,jdoriajr,,,104,2934,Mon Sep 20 2021 20:28:04 GMT-0300 (Brasilia Standard Time),Sun Aug 15 2021 22:48:37 GMT-0300 (Brasilia Standard Time)
"Aqui respeitamos o meio ambiente. Na última década, aumentamos em 5% a cobertura vegetal em SP. Durante nossa gestã… https://t.co/nE0SQuQ1wz",64706049,,,64706049,jdoriajr,,,37,677,Mon Sep 20 2021 20:28:04 GMT-0300 (Brasilia Standard Time),Sun Aug 15 2021 13:38:56 GMT-0300 (Brasilia Standard Time)
Vivemos um período onde é imprescindível a adoção de medidas concretas em defesa da sustentabilidade e proteção do… https://t.co/gNGi6Mgudu,64706049,,,64706049,jdoriajr,,,74,1369,Mon Sep 20 2021 20:28:04 GMT-0300 (Brasilia Standard Time),Sun Aug 15 2021 13:38:55 GMT-0300 (Brasilia Standard Time)
O estado de SP atingiu novo recorde de aplicação de vacinas contra Covid-19. Foram 717 mil doses nos 645 municípios… https://t.co/c6FHzhTxnx,64706049,,,64706049,jdoriajr,,,354,8909,Mon Sep 20 2021 20:28:04 GMT-0300 (Brasilia Standard Time),Sun Aug 15 2021 10:37:08 GMT-0300 (Brasilia Standard Time)
🙏💉 https://t.co/b9XJUBjBUX,64706049,,,64706049,jdoriajr,,,160,4228,Mon Sep 20 2021 20:28:04 GMT-0300 (Brasilia Standard Time),Sat Aug 14 2021 19:30:35 GMT-0300 (Brasilia Standard Time)
@biancalsm Vacinada! 🙏😃💉,64706049,,,64706049,jdoriajr,,,6,789,Mon Sep 20 2021 20:28:04 GMT-0300 (Brasilia Standard Time),Sat Aug 14 2021 17:37:54 GMT-0300 (Brasilia Standard Time)
