text,query,country,city,userId,username,quote_count,reply_count,retweet_count,favorite_count,timestamp,createdAt
Chegaram nessa noite a São Paulo mais 1 milhão 914 mil doses prontas da vacina Coronavac. Com esse lote alcançamos… https://t.co/vAPGcjT001,64706049,,,64706049,jdoriajr,,,60,1322,Mon Sep 20 2021 20:28:04 GMT-0300 (Brasilia Standard Time),Thu Sep 02 2021 10:50:27 GMT-0300 (Brasilia Standard Time)
Anunciamos investimento recorde de R$ 145 milhões para modernização e compra de novos equipamentos para as Etecs e… https://t.co/uNvipG2uvz,64706049,,,64706049,jdoriajr,,,70,1458,Mon Sep 20 2021 20:28:04 GMT-0300 (Brasilia Standard Time),Thu Sep 02 2021 08:09:21 GMT-0300 (Brasilia Standard Time)
"Mais da metade da população adulta de São Paulo está totalmente imunizada, com as duas doses ou dose única da vacin… https://t.co/HK1DdLIeOT",64706049,,,64706049,jdoriajr,,,51,848,Mon Sep 20 2021 20:28:04 GMT-0300 (Brasilia Standard Time),Wed Sep 01 2021 18:56:03 GMT-0300 (Brasilia Standard Time)
"São Paulo é o estado mais seguro do Brasil segundo o Atlas da Violência do IPEA

- Menor taxa de homicídios do Bras… https://t.co/l5nLOlRbor",64706049,,,64706049,jdoriajr,,,144,2296,Mon Sep 20 2021 20:28:04 GMT-0300 (Brasilia Standard Time),Wed Sep 01 2021 17:31:42 GMT-0300 (Brasilia Standard Time)
"💉 Iniciaremos segunda-feira em SP, 06/09, aplicação da dose adicional da vacina contra Covid p/ pessoas acima de 60… https://t.co/xq9MoszmrV",64706049,,,64706049,jdoriajr,,,197,2954,Mon Sep 20 2021 20:28:04 GMT-0300 (Brasilia Standard Time),Wed Sep 01 2021 12:56:06 GMT-0300 (Brasilia Standard Time)
RT @governosp: https://t.co/rnKocEvGDC,64706049,,,64706049,jdoriajr,,,22,0,Mon Sep 20 2021 20:28:04 GMT-0300 (Brasilia Standard Time),Wed Sep 01 2021 12:43:45 GMT-0300 (Brasilia Standard Time)
"Daqui a pouco, a partir das 12H45, faremos coletiva de imprensa com informações sobre vacinação e atualização dos n… https://t.co/awhqw0ydw4",64706049,,,64706049,jdoriajr,,,8,187,Mon Sep 20 2021 20:28:04 GMT-0300 (Brasilia Standard Time),Wed Sep 01 2021 11:26:53 GMT-0300 (Brasilia Standard Time)
"Esporte é vida! 

O Governo de SP está investindo R$ 5,4 milhões e vai transferir o Centro de Excelência Esportiva… https://t.co/eoe75TUYWB",64706049,,,64706049,jdoriajr,,,28,632,Mon Sep 20 2021 20:28:04 GMT-0300 (Brasilia Standard Time),Wed Sep 01 2021 08:22:23 GMT-0300 (Brasilia Standard Time)
(+) obras em 8 colégios e R$ 17 milhões e 300 mil em recursos para as escolas estaduais do município. Estamos inves… https://t.co/KZEmfFhL5l,64706049,,,64706049,jdoriajr,,,16,271,Mon Sep 20 2021 20:28:04 GMT-0300 (Brasilia Standard Time),Tue Aug 31 2021 20:20:21 GMT-0300 (Brasilia Standard Time)
"Em São Bernardo do Campo, autorizamos a construção do Viaduto Estaiado Robert Kennedy, que liga o município a Diade… https://t.co/aHdH9bZJil",64706049,,,64706049,jdoriajr,,,39,801,Mon Sep 20 2021 20:28:04 GMT-0300 (Brasilia Standard Time),Tue Aug 31 2021 20:20:20 GMT-0300 (Brasilia Standard Time)
"Novas medalhas e histórias de superação dos nossos atletas paralímpicos 🇧🇷👏

🥇🥇Carol Santiago - Natação
🥇Yeltsin Ja… https://t.co/ZoSf3jtM7k",64706049,,,64706049,jdoriajr,,,19,447,Mon Sep 20 2021 20:28:04 GMT-0300 (Brasilia Standard Time),Tue Aug 31 2021 15:11:15 GMT-0300 (Brasilia Standard Time)
Uma contribuição de SP para a preservação da história do nosso país. 🇧🇷,64706049,,,64706049,jdoriajr,,,9,398,Mon Sep 20 2021 20:28:04 GMT-0300 (Brasilia Standard Time),Tue Aug 31 2021 12:31:01 GMT-0300 (Brasilia Standard Time)
Hoje começamos a contagem regressiva para a reabertura do Novo Museu do Ipiranga. O Museu está sendo totalmente ref… https://t.co/tpfrNidPIb,64706049,,,64706049,jdoriajr,,,111,1761,Mon Sep 20 2021 20:28:04 GMT-0300 (Brasilia Standard Time),Tue Aug 31 2021 12:31:01 GMT-0300 (Brasilia Standard Time)
"Homenageamos o time de atletas olímpicos de SP, que representou o Brasil em Tóquio. Muitos desses atletas conquista… https://t.co/XnQDSjdvAt",64706049,,,64706049,jdoriajr,,,33,1142,Mon Sep 20 2021 20:28:04 GMT-0300 (Brasilia Standard Time),Tue Aug 31 2021 08:35:26 GMT-0300 (Brasilia Standard Time)
"Gestão Municipalista

Lançamos hoje novo programa do Governo de SP que oferece R$ 1 bilhão em linha de crédito para… https://t.co/i6pWzWytYe",64706049,,,64706049,jdoriajr,,,24,347,Mon Sep 20 2021 20:28:04 GMT-0300 (Brasilia Standard Time),Mon Aug 30 2021 16:45:17 GMT-0300 (Brasilia Standard Time)
Nosso time paralímpico segue enchendo os brasileiros de orgulho pelas conquistas em Tóquio. Parabéns aos novos meda… https://t.co/aKgeyL9X2p,64706049,,,64706049,jdoriajr,,,25,461,Mon Sep 20 2021 20:28:04 GMT-0300 (Brasilia Standard Time),Mon Aug 30 2021 15:20:39 GMT-0300 (Brasilia Standard Time)
As cenas de terror vivenciadas pela população de Araçatuba não ficarão impunes. Dois criminosos foram presos e um t… https://t.co/2wlD8aVcox,64706049,,,64706049,jdoriajr,,,150,3613,Mon Sep 20 2021 20:28:04 GMT-0300 (Brasilia Standard Time),Mon Aug 30 2021 13:28:59 GMT-0300 (Brasilia Standard Time)
O Governo de SP vai abrir novo escritório em Nova York para atrair investimentos e fomentar a exportação de empresa… https://t.co/A5QgNOdq1I,64706049,,,64706049,jdoriajr,,,168,3897,Mon Sep 20 2021 20:28:04 GMT-0300 (Brasilia Standard Time),Mon Aug 30 2021 12:01:10 GMT-0300 (Brasilia Standard Time)
Fizemos nesta manhã a maior entrega de vacinas ao Ministério da Saúde desde o início da pandemia. São 10 milhões de… https://t.co/KD3G5SXr1w,64706049,,,64706049,jdoriajr,,,99,1879,Mon Sep 20 2021 20:28:04 GMT-0300 (Brasilia Standard Time),Mon Aug 30 2021 08:35:56 GMT-0300 (Brasilia Standard Time)
"Investimento histórico, 34 vezes maior do que era disponibilizado anteriormente, para garantir melhores condições d… https://t.co/vZQPT2am1g",64706049,,,64706049,jdoriajr,,,16,442,Mon Sep 20 2021 20:28:04 GMT-0300 (Brasilia Standard Time),Sun Aug 29 2021 15:05:35 GMT-0300 (Brasilia Standard Time)
"Essa foi uma semana muito importante para a  educação em SP. Anunciamos R$ 1,2 bilhão para reformas e projetos peda… https://t.co/TMyYL3wZVu",64706049,,,64706049,jdoriajr,,,62,912,Mon Sep 20 2021 20:28:04 GMT-0300 (Brasilia Standard Time),Sun Aug 29 2021 15:05:35 GMT-0300 (Brasilia Standard Time)
"Nosso time Paralímpico segue enchendo o Brasil de emoção, orgulho e medalhas 👏👏🇧🇷

🥇Gabrielzinho - Natação
🥇Carol S… https://t.co/FnUfb6Sz6M",64706049,,,64706049,jdoriajr,,,39,1519,Mon Sep 20 2021 20:28:04 GMT-0300 (Brasilia Standard Time),Sun Aug 29 2021 08:45:31 GMT-0300 (Brasilia Standard Time)
"Mais uma obra parada retomada

Assinamos acordo p/ concluir as obras dos contornos da Tamoios de Caraguatatuba e Sã… https://t.co/wk5vNjSwg8",64706049,,,64706049,jdoriajr,,,34,794,Mon Sep 20 2021 20:28:04 GMT-0300 (Brasilia Standard Time),Sat Aug 28 2021 17:59:05 GMT-0300 (Brasilia Standard Time)
"Visitando a Feira de Caruaru, me deparei com essa frase escrita em um muro. Ela me lembrou um dos grandes ensinamen… https://t.co/aM3X93NBbI",64706049,,,64706049,jdoriajr,,,278,6580,Mon Sep 20 2021 20:28:04 GMT-0300 (Brasilia Standard Time),Sat Aug 28 2021 14:58:27 GMT-0300 (Brasilia Standard Time)
"Nossos atletas paralímpicos seguem dando show em Tóquio 👏
🥈Thalita Simplício - Atletismo
🥉 Gabriel Bandeira, Ana Ka… https://t.co/sy6f7D6xON",64706049,,,64706049,jdoriajr,,,34,1002,Mon Sep 20 2021 20:28:04 GMT-0300 (Brasilia Standard Time),Sat Aug 28 2021 11:17:12 GMT-0300 (Brasilia Standard Time)
GovernoSP lançou programa inédito no Brasil p/ evitar evasão escolar. Estudantes da rede pública q vivem em extrema… https://t.co/cn10nrrog0,64706049,,,64706049,jdoriajr,,,68,832,Mon Sep 20 2021 20:28:04 GMT-0300 (Brasilia Standard Time),Sat Aug 28 2021 08:59:57 GMT-0300 (Brasilia Standard Time)
Parabéns Wallace Santos pela medalha de ouro com direito a novo recorde mundial no arremesso de peso. E João Victor… https://t.co/GfMRQ1lfk1,64706049,,,64706049,jdoriajr,,,18,702,Mon Sep 20 2021 20:28:04 GMT-0300 (Brasilia Standard Time),Fri Aug 27 2021 16:50:45 GMT-0300 (Brasilia Standard Time)
"Ops, cometi um equívoco e falei no vídeo que o café da manhã será servido por 50 reais e na verdade será servido por 50 centavos 😉",64706049,,,64706049,jdoriajr,,,7,325,Mon Sep 20 2021 20:28:04 GMT-0300 (Brasilia Standard Time),Fri Aug 27 2021 16:13:05 GMT-0300 (Brasilia Standard Time)
@GiovannySPMinas Verdade. Desculpe. Cometi um equívoco e falei no vídeo que o café da manhã será servido por 50 rea… https://t.co/lZeCYSQ1Ne,64706049,,,64706049,jdoriajr,,,0,1,Mon Sep 20 2021 20:28:04 GMT-0300 (Brasilia Standard Time),Fri Aug 27 2021 16:12:28 GMT-0300 (Brasilia Standard Time)
Também anunciamos a instalação de uma unidade Bom Prato em Cotia e distribuímos vouchers do programa Vale Gás para… https://t.co/ayJ3IkfB54,64706049,,,64706049,jdoriajr,,,14,346,Mon Sep 20 2021 20:28:04 GMT-0300 (Brasilia Standard Time),Fri Aug 27 2021 15:14:52 GMT-0300 (Brasilia Standard Time)
"Boas notícias para Cotia!

Autorizamos investimento de R$ 96 milhões para obras na Rodovia Raposo Tavares. Estas ob… https://t.co/xG6VB5POop",64706049,,,64706049,jdoriajr,,,48,923,Mon Sep 20 2021 20:28:04 GMT-0300 (Brasilia Standard Time),Fri Aug 27 2021 15:14:51 GMT-0300 (Brasilia Standard Time)
"Vale a pena estar do lado certo, defender o que é correto e lutar pela vida. Obrigado, Cotia pelo carinho! 🙏 https://t.co/8xFEEDICdH",64706049,,,64706049,jdoriajr,,,78,1530,Mon Sep 20 2021 20:28:04 GMT-0300 (Brasilia Standard Time),Fri Aug 27 2021 12:55:33 GMT-0300 (Brasilia Standard Time)
"O Brasil paralímpico deu mais um show nas piscinas e nas pistas de atletismo em Tóquio. Ouro para Yeltsin Jacques,… https://t.co/zu84ADsYJ2",64706049,,,64706049,jdoriajr,,,19,733,Mon Sep 20 2021 20:28:04 GMT-0300 (Brasilia Standard Time),Fri Aug 27 2021 10:43:26 GMT-0300 (Brasilia Standard Time)
Trabalhamos pela desburocratização e para garantir mais autonomia aos dirigentes escolares na gestão dos recursos.… https://t.co/a1b4y0IauR,64706049,,,64706049,jdoriajr,,,25,648,Mon Sep 20 2021 20:28:04 GMT-0300 (Brasilia Standard Time),Thu Aug 26 2021 21:34:53 GMT-0300 (Brasilia Standard Time)
"Hoje é um dia histórico para a educação em SP. Anunciamos a destinação de R$ 1 bilhão e 200 milhões para reformas,… https://t.co/S4bfi2m8Ev",64706049,,,64706049,jdoriajr,,,101,2153,Mon Sep 20 2021 20:28:04 GMT-0300 (Brasilia Standard Time),Thu Aug 26 2021 21:34:53 GMT-0300 (Brasilia Standard Time)
"Vacinas salvam vidas!

Nas últimas três semanas, o estado de São Paulo registrou queda de 54% nos casos de Covid-19… https://t.co/c4lL9cAyhl",64706049,,,64706049,jdoriajr,,,151,3874,Mon Sep 20 2021 20:28:04 GMT-0300 (Brasilia Standard Time),Thu Aug 26 2021 19:51:26 GMT-0300 (Brasilia Standard Time)
Lançamos hoje a Delegacia da Diversidade Online. A iniciativa do Governo de SP vai ampliar o combate aos crimes de… https://t.co/cQ4i18Z6J2,64706049,,,64706049,jdoriajr,,,70,698,Mon Sep 20 2021 20:28:04 GMT-0300 (Brasilia Standard Time),Thu Aug 26 2021 16:22:46 GMT-0300 (Brasilia Standard Time)
Ótima notícia. Mais uma fábrica que produzirá vacinas contra Covid-19 no Brasil. Finalmente o Governo Federal passo… https://t.co/HTSEJLK1xE,64706049,,,64706049,jdoriajr,,,136,3516,Mon Sep 20 2021 20:28:04 GMT-0300 (Brasilia Standard Time),Thu Aug 26 2021 11:33:52 GMT-0300 (Brasilia Standard Time)
"Parabéns Jovane Guissone 🥈(esgrima) e Rodolpho Riskalla 🥈(hipismo). E nosso fenômeno das piscinas Daniel Dias 🥉🥉, a… https://t.co/nw4s5P9hn6",64706049,,,64706049,jdoriajr,,,23,732,Mon Sep 20 2021 20:28:04 GMT-0300 (Brasilia Standard Time),Thu Aug 26 2021 09:55:41 GMT-0300 (Brasilia Standard Time)
"A partir de 08/09, o GovSP vai retomar o programa Mulheres de Peito. Carretas vão circular por todo o estado, reali… https://t.co/MYpfOrEMXK",64706049,,,64706049,jdoriajr,,,44,716,Mon Sep 20 2021 20:28:04 GMT-0300 (Brasilia Standard Time),Thu Aug 26 2021 07:51:17 GMT-0300 (Brasilia Standard Time)
"Pior que a incompetência do Governo Federal em administrar a economia, é a tentativa de colocar a população contra… https://t.co/taBwNr47TV",64706049,,,64706049,jdoriajr,,,531,11130,Mon Sep 20 2021 20:28:04 GMT-0300 (Brasilia Standard Time),Wed Aug 25 2021 18:23:24 GMT-0300 (Brasilia Standard Time)
"A culpa do aumento dos combustíveis não é do ICMS.

Valor histórico do litro de gasolina, segundo dados da ANP:
201… https://t.co/4V9bxpnumO",64706049,,,64706049,jdoriajr,,,4279,36551,Mon Sep 20 2021 20:28:04 GMT-0300 (Brasilia Standard Time),Wed Aug 25 2021 18:23:24 GMT-0300 (Brasilia Standard Time)
Estado de SP iniciará aplicação da 3ª dose de vacina para pessoas com mais de 60 anos a partir de 06/09. Diversos p… https://t.co/OW0Zn97fvh,64706049,,,64706049,jdoriajr,,,256,3913,Mon Sep 20 2021 20:28:04 GMT-0300 (Brasilia Standard Time),Wed Aug 25 2021 17:52:54 GMT-0300 (Brasilia Standard Time)
RT @governosp: https://t.co/UURVCIBkcC,64706049,,,64706049,jdoriajr,,,17,0,Mon Sep 20 2021 20:28:04 GMT-0300 (Brasilia Standard Time),Wed Aug 25 2021 12:48:41 GMT-0300 (Brasilia Standard Time)
Hoje é dia de coletiva de imprensa com anúncios ao vivo sobre a vacinação e novas medidas na área da saúde. A parti… https://t.co/20LB1NKSNo,64706049,,,64706049,jdoriajr,,,23,376,Mon Sep 20 2021 20:28:04 GMT-0300 (Brasilia Standard Time),Wed Aug 25 2021 11:16:38 GMT-0300 (Brasilia Standard Time)
"Mais 4 milhões de doses entregues ao PNI nesta manhã, totalizando 82 milhões 850 mil doses encaminhadas ao Ministér… https://t.co/ZFoIVyJinT",64706049,,,64706049,jdoriajr,,,85,1533,Mon Sep 20 2021 20:28:04 GMT-0300 (Brasilia Standard Time),Wed Aug 25 2021 08:41:42 GMT-0300 (Brasilia Standard Time)
"Parabéns Gabriel Geraldo, Gabriel Bandeira e Phelipe Rodrigues! Nossos três primeiros medalhistas nas Paralimpíadas… https://t.co/Ij9yqIvBB8",64706049,,,64706049,jdoriajr,,,59,2056,Mon Sep 20 2021 20:28:04 GMT-0300 (Brasilia Standard Time),Wed Aug 25 2021 08:06:41 GMT-0300 (Brasilia Standard Time)
Sancionamos as Leis que criam as Regiões Metropolitanas de São José do Rio Preto e Piracicaba. Os municípios vão se… https://t.co/TDA4DCmlyi,64706049,,,64706049,jdoriajr,,,43,534,Mon Sep 20 2021 20:28:04 GMT-0300 (Brasilia Standard Time),Tue Aug 24 2021 19:58:55 GMT-0300 (Brasilia Standard Time)
"Rostos por trás dos números

Conheça a história da dona Evelina, uma das contempladas pelo programa Vale Gás. O Gov… https://t.co/gcn0uDUUZU",64706049,,,64706049,jdoriajr,,,30,311,Mon Sep 20 2021 20:28:04 GMT-0300 (Brasilia Standard Time),Tue Aug 24 2021 15:56:35 GMT-0300 (Brasilia Standard Time)
#Planejamento #Trabalho #Gestão #RodaViva https://t.co/4nj95FCh45,64706049,,,64706049,jdoriajr,,,62,1353,Mon Sep 20 2021 20:28:04 GMT-0300 (Brasilia Standard Time),Tue Aug 24 2021 12:25:24 GMT-0300 (Brasilia Standard Time)
"Com o avanço da vacinação em SP e no Brasil, outros países devem seguir o caminho da Espanha. A retomada gradativa… https://t.co/nHZOx9riog",64706049,,,64706049,jdoriajr,,,188,3407,Mon Sep 20 2021 20:28:04 GMT-0300 (Brasilia Standard Time),Tue Aug 24 2021 10:24:42 GMT-0300 (Brasilia Standard Time)
"Trabalho, trabalho e trabalho https://t.co/7nD6DTFzqJ",64706049,,,64706049,jdoriajr,,,70,943,Mon Sep 20 2021 20:28:04 GMT-0300 (Brasilia Standard Time),Tue Aug 24 2021 00:29:25 GMT-0300 (Brasilia Standard Time)
#RodaViva #NemLulaNemBolsonaro https://t.co/EsatSgK1pi,64706049,,,64706049,jdoriajr,,,275,4664,Mon Sep 20 2021 20:28:04 GMT-0300 (Brasilia Standard Time),Mon Aug 23 2021 23:02:55 GMT-0300 (Brasilia Standard Time)
#RodaViva https://t.co/NzHKpUzcwe,64706049,,,64706049,jdoriajr,,,223,3387,Mon Sep 20 2021 20:28:04 GMT-0300 (Brasilia Standard Time),Mon Aug 23 2021 22:41:31 GMT-0300 (Brasilia Standard Time)
"Daqui a pouco, às 22h, no @rodaviva https://t.co/lTbWuQUAV2",64706049,,,64706049,jdoriajr,,,56,1177,Mon Sep 20 2021 20:28:04 GMT-0300 (Brasilia Standard Time),Mon Aug 23 2021 21:55:51 GMT-0300 (Brasilia Standard Time)
"GovSP fez a lição de casa e vai investir, neste ano, R$ 21 bilhões com recursos próprios. Isso só foi possível graç… https://t.co/65Z1mBGBFi",64706049,,,64706049,jdoriajr,,,131,2036,Mon Sep 20 2021 20:28:04 GMT-0300 (Brasilia Standard Time),Mon Aug 23 2021 19:48:48 GMT-0300 (Brasilia Standard Time)
"Anunciamos hoje 20 novas unidades da Casa da Mulher no estado de SP. Espaços dedicados ao acolhimento, proteção, su… https://t.co/txHzJcZOal",64706049,,,64706049,jdoriajr,,,66,742,Mon Sep 20 2021 20:28:04 GMT-0300 (Brasilia Standard Time),Mon Aug 23 2021 15:52:01 GMT-0300 (Brasilia Standard Time)
Reunião entre 22 Governadores para tratar a defesa da democracia brasileira. Estamos diante de um momento gravíssim… https://t.co/92VNE8vrJS,64706049,,,64706049,jdoriajr,,,426,7016,Mon Sep 20 2021 20:28:04 GMT-0300 (Brasilia Standard Time),Mon Aug 23 2021 14:21:03 GMT-0300 (Brasilia Standard Time)
"Governo Federal precisa parar de sabotar o Brasil. O resultado dessa gestão está aí: inflação nas alturas, disparad… https://t.co/zDHn7oNcE1",64706049,,,64706049,jdoriajr,,,999,14350,Mon Sep 20 2021 20:28:04 GMT-0300 (Brasilia Standard Time),Mon Aug 23 2021 11:20:31 GMT-0300 (Brasilia Standard Time)
"Mais 4 milhões de doses da Vacina do Butantan para acelerar a imunização em todo o Brasil. Com esse novo lote, já s… https://t.co/ghOeHhnZ6b",64706049,,,64706049,jdoriajr,,,111,2464,Mon Sep 20 2021 20:28:04 GMT-0300 (Brasilia Standard Time),Mon Aug 23 2021 08:35:18 GMT-0300 (Brasilia Standard Time)
"Bom dia! Hoje, às 22h, participo do Roda Viva da TV Cultura. Boa semana a todos! https://t.co/vVc1MhL2Tu",64706049,,,64706049,jdoriajr,,,180,3430,Mon Sep 20 2021 20:28:04 GMT-0300 (Brasilia Standard Time),Mon Aug 23 2021 07:30:41 GMT-0300 (Brasilia Standard Time)
Viva a música. Viva a cultura. Viva os nossos jovens! https://t.co/fPSUxyOPcZ,64706049,,,64706049,jdoriajr,,,83,1818,Mon Sep 20 2021 20:28:04 GMT-0300 (Brasilia Standard Time),Sun Aug 22 2021 12:28:56 GMT-0300 (Brasilia Standard Time)
"Vacinas salvam vidas

Nenhuma das 645 cidades de SP registra UTI lotada pela 1ª vez desde abril/2020. Hoje, há meno… https://t.co/WRCgaA9oxU",64706049,,,64706049,jdoriajr,,,292,5380,Mon Sep 20 2021 20:28:04 GMT-0300 (Brasilia Standard Time),Sun Aug 22 2021 08:50:15 GMT-0300 (Brasilia Standard Time)
@EuWeiler 🤘🏻🤘🏻🤘🏻💉😂👖,64706049,,,64706049,jdoriajr,,,10,660,Mon Sep 20 2021 20:28:04 GMT-0300 (Brasilia Standard Time),Sat Aug 21 2021 18:03:32 GMT-0300 (Brasilia Standard Time)
"Lamentavelmente, o Governo Federal reduziu em 98% o orçamento da habitação. Mas aqui em SP não ficamos de braços cr… https://t.co/ith6vjQCnt",64706049,,,64706049,jdoriajr,,,26,494,Mon Sep 20 2021 20:28:04 GMT-0300 (Brasilia Standard Time),Sat Aug 21 2021 15:33:32 GMT-0300 (Brasilia Standard Time)
"No Dia Nacional da Habitação, destaco o empenho da nossa gestão para realizar o sonho da casa própria da população… https://t.co/TS0L3W7SEX",64706049,,,64706049,jdoriajr,,,25,710,Mon Sep 20 2021 20:28:04 GMT-0300 (Brasilia Standard Time),Sat Aug 21 2021 15:33:09 GMT-0300 (Brasilia Standard Time)
"Honrado em participar da reunião de secretariado da Prefeitura do Rio de Janeiro, a convite do meu amigo, prefeito… https://t.co/yOMSPncLub",64706049,Brasil,Centro de Convenções SulAmérica,64706049,jdoriajr,,,86,2881,Mon Sep 20 2021 20:28:04 GMT-0300 (Brasilia Standard Time),Sat Aug 21 2021 13:44:43 GMT-0300 (Brasilia Standard Time)
Mentira tem perna curta. E vai precisar ter bolso grande. https://t.co/BnYCAQFNU7,64706049,,,64706049,jdoriajr,,,365,7679,Mon Sep 20 2021 20:28:04 GMT-0300 (Brasilia Standard Time),Sat Aug 21 2021 07:56:06 GMT-0300 (Brasilia Standard Time)
"SP extinguiu 3 estatais: CODASP, CPOS e EMPLASA. Fizemos também a fusão de outras 2 empresas públicas: IMESP e PROD… https://t.co/OivulJ26nv",64706049,,,64706049,jdoriajr,,,114,1640,Mon Sep 20 2021 20:28:04 GMT-0300 (Brasilia Standard Time),Fri Aug 20 2021 18:40:52 GMT-0300 (Brasilia Standard Time)
"Desde o início da nossa gestão, adotamos diversas medidas na área: criamos o aplicativo SOS Mulher, ampliamos de 1… https://t.co/v1Vlh83Ntm",64706049,,,64706049,jdoriajr,,,26,393,Mon Sep 20 2021 20:28:04 GMT-0300 (Brasilia Standard Time),Fri Aug 20 2021 12:22:26 GMT-0300 (Brasilia Standard Time)
"“Sinal Vermelho” para a violência contra a mulher em SP

O Estado de SP aderiu à campanha Sinal Vermelho, de combat… https://t.co/8Wxk1gCGJa",64706049,,,64706049,jdoriajr,,,97,1717,Mon Sep 20 2021 20:28:04 GMT-0300 (Brasilia Standard Time),Fri Aug 20 2021 12:22:25 GMT-0300 (Brasilia Standard Time)
Sexxxtou com obra retomada! 😎 https://t.co/d4Z8QFgqlf,64706049,,,64706049,jdoriajr,,,74,1258,Mon Sep 20 2021 20:28:04 GMT-0300 (Brasilia Standard Time),Fri Aug 20 2021 08:34:10 GMT-0300 (Brasilia Standard Time)
"Em parceria com as prefeituras, hoje lançamos o maior programa de asfaltamento de ruas de terra da história de SP.… https://t.co/vDmVlyzF2S",64706049,,,64706049,jdoriajr,,,60,895,Mon Sep 20 2021 20:28:04 GMT-0300 (Brasilia Standard Time),Thu Aug 19 2021 20:36:41 GMT-0300 (Brasilia Standard Time)
Aprovamos a contratação de 1.034 Agentes de Segurança Penitenciária remanescentes de concurso público vigente. Refo… https://t.co/cB3kOhGLVP,64706049,,,64706049,jdoriajr,,,43,878,Mon Sep 20 2021 20:28:04 GMT-0300 (Brasilia Standard Time),Thu Aug 19 2021 16:57:11 GMT-0300 (Brasilia Standard Time)
"#TBT Diretas Já 1984

Brasil viveu duas décadas sob a ditadura do regime militar. Relembro de cada passo dessa luta… https://t.co/K1su6Ppo9m",64706049,,,64706049,jdoriajr,,,59,796,Mon Sep 20 2021 20:28:04 GMT-0300 (Brasilia Standard Time),Thu Aug 19 2021 16:39:14 GMT-0300 (Brasilia Standard Time)
"@FeCastanhari 👏🏻👏🏻👏🏻 
💉💉
🐊
👖",64706049,,,64706049,jdoriajr,,,9,1391,Mon Sep 20 2021 20:28:04 GMT-0300 (Brasilia Standard Time),Thu Aug 19 2021 16:19:39 GMT-0300 (Brasilia Standard Time)
"Devido a pandemia, muitos jovens precisaram optar entre escola ou trabalho para ajudar no sustento familiar. Uma tr… https://t.co/Git0xQn8me",64706049,,,64706049,jdoriajr,,,39,925,Mon Sep 20 2021 20:28:04 GMT-0300 (Brasilia Standard Time),Thu Aug 19 2021 12:27:32 GMT-0300 (Brasilia Standard Time)
"Lugar de jovens é na escola 👩‍🏫🧑‍🏫

Lançamos programa inédito no Brasil para evitar a evasão escolar. Estudantes da… https://t.co/PU8rewy9Mi",64706049,,,64706049,jdoriajr,,,144,2946,Mon Sep 20 2021 20:28:04 GMT-0300 (Brasilia Standard Time),Thu Aug 19 2021 12:27:31 GMT-0300 (Brasilia Standard Time)
"Emocionante ouvir depoimentos como o da Regiane de Paula, coordenadora do Plano Estadual de Imunização em SP. Defen… https://t.co/FCSXtPxetq",64706049,,,64706049,jdoriajr,,,94,1524,Mon Sep 20 2021 20:28:04 GMT-0300 (Brasilia Standard Time),Thu Aug 19 2021 08:41:00 GMT-0300 (Brasilia Standard Time)
Mais 4 mil litros de insumos acabam de desembarcar no Aeroporto Internacional de Guarulhos. A quantidade é suficien… https://t.co/22b0aZDnRu,64706049,,,64706049,jdoriajr,,,199,6472,Mon Sep 20 2021 20:28:04 GMT-0300 (Brasilia Standard Time),Wed Aug 18 2021 22:24:44 GMT-0300 (Brasilia Standard Time)
"Iniciamos hoje a vacinação dos adolescentes de 16 e 17 anos com deficiência e comorbidades, além das gestantes e pu… https://t.co/QdUXD3Izqh",64706049,,,64706049,jdoriajr,,,52,899,Mon Sep 20 2021 20:28:04 GMT-0300 (Brasilia Standard Time),Wed Aug 18 2021 19:18:47 GMT-0300 (Brasilia Standard Time)
"@CesarColnago Querido César. Muito obrigado pelo apoio e, acima de tudo, pelas palavras. Estamos juntos nessa caminhada 👊🏻🇧🇷",64706049,,,64706049,jdoriajr,,,7,165,Mon Sep 20 2021 20:28:04 GMT-0300 (Brasilia Standard Time),Wed Aug 18 2021 17:31:38 GMT-0300 (Brasilia Standard Time)
"Anunciamos hoje a abertura de 30 mil vagas do Programa Bolsa Trabalho. 

É mais uma iniciativa do GovSP p/ oferecer… https://t.co/HyJ1zaur3i",64706049,,,64706049,jdoriajr,,,44,522,Mon Sep 20 2021 20:28:04 GMT-0300 (Brasilia Standard Time),Wed Aug 18 2021 17:12:34 GMT-0300 (Brasilia Standard Time)
"Ministério da Saúde, bora consertar o erro e enviar as doses de SP. 😉 https://t.co/y4P2DKq4jp",64706049,,,64706049,jdoriajr,,,255,4204,Mon Sep 20 2021 20:28:04 GMT-0300 (Brasilia Standard Time),Wed Aug 18 2021 14:18:19 GMT-0300 (Brasilia Standard Time)
RT @governosp: https://t.co/VboDynwftR,64706049,,,64706049,jdoriajr,,,13,0,Mon Sep 20 2021 20:28:04 GMT-0300 (Brasilia Standard Time),Wed Aug 18 2021 12:47:10 GMT-0300 (Brasilia Standard Time)
"Daqui a pouco, a partir das 12H45, acompanhe nossa coletiva de imprensa com transmissão ao vivo diretamente do Palá… https://t.co/PCVX5xrb9u",64706049,,,64706049,jdoriajr,,,25,446,Mon Sep 20 2021 20:28:04 GMT-0300 (Brasilia Standard Time),Wed Aug 18 2021 11:08:52 GMT-0300 (Brasilia Standard Time)
"Liberamos nesta manhã mais 2 milhões de doses da vacina do Butantan para o Ministério da Saúde. Desde janeiro, já e… https://t.co/FlmynTEQlA",64706049,,,64706049,jdoriajr,,,128,3339,Mon Sep 20 2021 20:28:04 GMT-0300 (Brasilia Standard Time),Wed Aug 18 2021 08:46:29 GMT-0300 (Brasilia Standard Time)
"Logo mais, às 20H30, participarei do @Podcast011 da @KondZilla Records, apresentado pelos MC's Jottape, M10 e DJ Bu… https://t.co/Tkk8Xj3twe",64706049,,,64706049,jdoriajr,,,25,417,Mon Sep 20 2021 20:28:04 GMT-0300 (Brasilia Standard Time),Tue Aug 17 2021 19:37:44 GMT-0300 (Brasilia Standard Time)
"Cumprimento o Min Ricardo Lewandowski pela decisão anunciada há pouco, que determina que o Min da Saúde entregue o… https://t.co/IERPZzKRaP",64706049,,,64706049,jdoriajr,,,287,5964,Mon Sep 20 2021 20:28:04 GMT-0300 (Brasilia Standard Time),Tue Aug 17 2021 18:10:16 GMT-0300 (Brasilia Standard Time)
