text,query,country,city,userId,username,quote_count,reply_count,retweet_count,favorite_count,timestamp,createdAt
Seguimos a vacinação dos adolescentes de 12 a 17 anos no Estado de SP. 78% da molecada já está vacinada com a primeira dose 💉💉💉,64706049,,,64706049,jdoriajr,,,113,2795,Mon Sep 20 2021 20:28:04 GMT-0300 (Brasilia Standard Time),Mon Sep 20 2021 18:23:01 GMT-0300 (Brasilia Standard Time)
"É com orgulho, humildade e senso de dever público que registro minha candidatura nas prévias do PSDB à disputa pres… https://t.co/BZnprZAdPi",64706049,,,64706049,jdoriajr,,,100,2047,Mon Sep 20 2021 20:28:04 GMT-0300 (Brasilia Standard Time),Mon Sep 20 2021 15:51:41 GMT-0300 (Brasilia Standard Time)
São Paulo valoriza e respeita as mulheres. Confira iniciativas da nossa gestão nas mais diversas áreas para protege… https://t.co/RT88tbjZo2,64706049,,,64706049,jdoriajr,,,21,230,Mon Sep 20 2021 20:28:04 GMT-0300 (Brasilia Standard Time),Mon Sep 20 2021 12:58:21 GMT-0300 (Brasilia Standard Time)
"Corujão está de volta! 

Vamos retomar o Corujão da Saúde em SP. Nesta 1ª etapa, serão priorizados exames de pacien… https://t.co/fhO1yfWmDr",64706049,,,64706049,jdoriajr,,,89,1333,Mon Sep 20 2021 20:28:04 GMT-0300 (Brasilia Standard Time),Mon Sep 20 2021 09:57:21 GMT-0300 (Brasilia Standard Time)
Começamos às 8h mais uma reunião de secretários com boas notícias: ultrapassamos 50% da população imunizada com as… https://t.co/Tsj78aSZKs,64706049,,,64706049,jdoriajr,,,98,1376,Mon Sep 20 2021 20:28:04 GMT-0300 (Brasilia Standard Time),Mon Sep 20 2021 08:52:52 GMT-0300 (Brasilia Standard Time)
Neste sábado tive a honra de estar ao lado de mulheres que fazem política com garra e competência. Foi emocionante!… https://t.co/6z0WKRHTdY,64706049,,,64706049,jdoriajr,,,57,1314,Mon Sep 20 2021 20:28:04 GMT-0300 (Brasilia Standard Time),Sun Sep 19 2021 11:19:21 GMT-0300 (Brasilia Standard Time)
"Lugar de mulher é onde ela quiser estar!

Assinei carta compromisso com o PSDB Mulher para ampliar a participação d… https://t.co/imuKuHGNfh",64706049,,,64706049,jdoriajr,,,74,1189,Mon Sep 20 2021 20:28:04 GMT-0300 (Brasilia Standard Time),Sat Sep 18 2021 18:07:41 GMT-0300 (Brasilia Standard Time)
"Reunião aqui em SP com a ex-governadora do Rio Grande do Sul, Yeda Crusius, presidente nacional do PSDB Mulher, ao… https://t.co/XQ8bWViom5",64706049,,,64706049,jdoriajr,,,39,762,Mon Sep 20 2021 20:28:04 GMT-0300 (Brasilia Standard Time),Sat Sep 18 2021 13:09:53 GMT-0300 (Brasilia Standard Time)
O Brasil é maior que Lula e Bolsonaro https://t.co/qnVds9LWcN,64706049,,,64706049,jdoriajr,,,303,3918,Mon Sep 20 2021 20:28:04 GMT-0300 (Brasilia Standard Time),Sat Sep 18 2021 09:19:58 GMT-0300 (Brasilia Standard Time)
"• 3.096 vouchers do Vale Gás para famílias carentes
• Mais de R$ 30 milhões p/ 176 escolas pelo PDDE-Paulista
• 4.1… https://t.co/0HwoNnG801",64706049,,,64706049,jdoriajr,,,12,132,Mon Sep 20 2021 20:28:04 GMT-0300 (Brasilia Standard Time),Fri Sep 17 2021 17:39:29 GMT-0300 (Brasilia Standard Time)
"Ainda em Campinas, anunciamos uma série de investimentos para beneficiar toda a região:

• 4 unidades das Casas da… https://t.co/rjX14gjVnJ",64706049,,,64706049,jdoriajr,,,15,301,Mon Sep 20 2021 20:28:04 GMT-0300 (Brasilia Standard Time),Fri Sep 17 2021 17:39:28 GMT-0300 (Brasilia Standard Time)
Alegria em ir a Campinas para o lançamento regional do Retoma SP. É muito bom ver o brilho nos olhos de empreendedo… https://t.co/J5urJyqawl,64706049,,,64706049,jdoriajr,,,43,616,Mon Sep 20 2021 20:28:04 GMT-0300 (Brasilia Standard Time),Fri Sep 17 2021 16:03:48 GMT-0300 (Brasilia Standard Time)
"Ilustre visita da minha sogrinha, Dona Terezinha. 😀❤️ https://t.co/Q7VNtzTtSS",64706049,,,64706049,jdoriajr,,,36,1451,Mon Sep 20 2021 20:28:04 GMT-0300 (Brasilia Standard Time),Fri Sep 17 2021 14:42:42 GMT-0300 (Brasilia Standard Time)
"O nome do crescimento econômico é VACINA! Com as pessoas protegidas, a economia é aquecida. Portanto, aqueles que n… https://t.co/VaiG544jul",64706049,,,64706049,jdoriajr,,,96,1879,Mon Sep 20 2021 20:28:04 GMT-0300 (Brasilia Standard Time),Fri Sep 17 2021 13:40:57 GMT-0300 (Brasilia Standard Time)
"Em 2020, a economia nacional caiu 4,1% e SP cresceu 0,4%. Já em 2021, a previsão de crescimento do PIB em SP é de 7… https://t.co/AhRgmhJAa4",64706049,,,64706049,jdoriajr,,,105,1787,Mon Sep 20 2021 20:28:04 GMT-0300 (Brasilia Standard Time),Fri Sep 17 2021 13:40:57 GMT-0300 (Brasilia Standard Time)
"Muitos nos criticaram durante a pandemia, dizendo que estávamos esquecendo a economia para priorizar vidas. Mas os… https://t.co/sNJpPnBlP9",64706049,,,64706049,jdoriajr,,,309,5680,Mon Sep 20 2021 20:28:04 GMT-0300 (Brasilia Standard Time),Fri Sep 17 2021 13:40:57 GMT-0300 (Brasilia Standard Time)
"Em Campinas, para lançamento regional do programa Retoma SP. Apoio à geração de empregos e o fortalecimento das ati… https://t.co/TmXUxPyvmT",64706049,,,64706049,jdoriajr,,,25,368,Mon Sep 20 2021 20:28:04 GMT-0300 (Brasilia Standard Time),Fri Sep 17 2021 12:38:00 GMT-0300 (Brasilia Standard Time)
"A partir do dia 19, brasileiros vacinados com a Vacina do Butantan não precisarão fazer quarentena em viagens para… https://t.co/cYIV3G8u0f",64706049,,,64706049,jdoriajr,,,428,7384,Mon Sep 20 2021 20:28:04 GMT-0300 (Brasilia Standard Time),Fri Sep 17 2021 09:59:46 GMT-0300 (Brasilia Standard Time)
É a Vacina do Butantan protegendo vidas. 💉🙏 https://t.co/ctovcgdaDR,64706049,,,64706049,jdoriajr,,,191,3419,Mon Sep 20 2021 20:28:04 GMT-0300 (Brasilia Standard Time),Fri Sep 17 2021 09:23:29 GMT-0300 (Brasilia Standard Time)
"Ministério da Saúde prometeu  entregar 3ª dose de vacinas aos estados para imunização dos brasileiros, acima de 70… https://t.co/NbZV2JDPtK",64706049,,,64706049,jdoriajr,,,665,8473,Mon Sep 20 2021 20:28:04 GMT-0300 (Brasilia Standard Time),Thu Sep 16 2021 20:32:41 GMT-0300 (Brasilia Standard Time)
"Liberamos R$ 12,4 milhões para recuperação da vicinal ARA-134, em Araraquara. O anúncio faz parte do maior programa… https://t.co/R49HAlbmOQ",64706049,,,64706049,jdoriajr,,,21,391,Mon Sep 20 2021 20:28:04 GMT-0300 (Brasilia Standard Time),Thu Sep 16 2021 19:50:51 GMT-0300 (Brasilia Standard Time)
SP está ao lado da ciência e ao lado de pais e mães de adolescentes que querem ver seus filhos imunizados. https://t.co/P4W6iSDOC1,64706049,,,64706049,jdoriajr,,,283,3212,Mon Sep 20 2021 20:28:04 GMT-0300 (Brasilia Standard Time),Thu Sep 16 2021 17:33:14 GMT-0300 (Brasilia Standard Time)
"Estamos em Araçatuba p/ ampliação da fábrica da Salsaretti. A expansão vai gerar 2 mil empregos, principalmente com… https://t.co/xJdIdn1A8j",64706049,,,64706049,jdoriajr,,,43,525,Mon Sep 20 2021 20:28:04 GMT-0300 (Brasilia Standard Time),Thu Sep 16 2021 15:50:59 GMT-0300 (Brasilia Standard Time)
A vacinação dos adolescentes de 12 a 17 anos vai continuar em SP. 72% desse público já tomou a 1ª dose. A decisão d… https://t.co/zLW9vN2R7N,64706049,,,64706049,jdoriajr,,,630,8580,Mon Sep 20 2021 20:28:04 GMT-0300 (Brasilia Standard Time),Thu Sep 16 2021 14:34:10 GMT-0300 (Brasilia Standard Time)
"Sancionamos Projeto de Lei 108/2020 da Alesp, que obriga condomínios a comunicarem casos de violência doméstica às… https://t.co/YLInNKbLjl",64706049,,,64706049,jdoriajr,,,113,2261,Mon Sep 20 2021 20:28:04 GMT-0300 (Brasilia Standard Time),Thu Sep 16 2021 12:14:57 GMT-0300 (Brasilia Standard Time)
Dados do Ministério da Saúde confirmam que a vacinação com a Coronavac reduziu em 88% o número de mortes em idosos… https://t.co/SOMcFJubPb,64706049,,,64706049,jdoriajr,,,315,4553,Mon Sep 20 2021 20:28:04 GMT-0300 (Brasilia Standard Time),Thu Sep 16 2021 09:49:04 GMT-0300 (Brasilia Standard Time)
São Paulo está de volta! 👊 https://t.co/ZRtQDHNwsL,64706049,,,64706049,jdoriajr,,,39,576,Mon Sep 20 2021 20:28:04 GMT-0300 (Brasilia Standard Time),Thu Sep 16 2021 08:54:45 GMT-0300 (Brasilia Standard Time)
@CinthiaCRibeiro @EduardoLeite_ 👍👍👊👊,64706049,,,64706049,jdoriajr,,,1,116,Mon Sep 20 2021 20:28:04 GMT-0300 (Brasilia Standard Time),Wed Sep 15 2021 18:25:03 GMT-0300 (Brasilia Standard Time)
RT @laurojardim: Doria reduz ICMS de bares e restaurantes. https://t.co/E7b3YW4wa5 https://t.co/6AimfEmblM,64706049,,,64706049,jdoriajr,,,44,0,Mon Sep 20 2021 20:28:04 GMT-0300 (Brasilia Standard Time),Wed Sep 15 2021 17:23:47 GMT-0300 (Brasilia Standard Time)
"Ultrapassamos R$ 2 bilhões em recursos, produtos e serviços arrecadados junto ao Comitê Empresarial Solidário. Uma… https://t.co/NQTwulRPks",64706049,,,64706049,jdoriajr,,,47,465,Mon Sep 20 2021 20:28:04 GMT-0300 (Brasilia Standard Time),Wed Sep 15 2021 17:09:37 GMT-0300 (Brasilia Standard Time)
"Apresentamos hoje o Pró-SP, o maior programa de obras da história de SP. São 8 mil obras que vão gerar 200 mil empr… https://t.co/AGC51Vd7uU",64706049,,,64706049,jdoriajr,,,64,614,Mon Sep 20 2021 20:28:04 GMT-0300 (Brasilia Standard Time),Wed Sep 15 2021 14:50:04 GMT-0300 (Brasilia Standard Time)
"Hoje, 15/09, é o Dia Internacional da Democracia. Que ela seja eterna! 🇧🇷",64706049,,,64706049,jdoriajr,,,99,1925,Mon Sep 20 2021 20:28:04 GMT-0300 (Brasilia Standard Time),Wed Sep 15 2021 14:03:58 GMT-0300 (Brasilia Standard Time)
"Completamos hoje a entrega das 100 milhões de doses da vacina do Butantan para o Governo Federal. Com isso, antecip… https://t.co/bS6N3ZWYpt",64706049,,,64706049,jdoriajr,,,198,4264,Mon Sep 20 2021 20:28:04 GMT-0300 (Brasilia Standard Time),Wed Sep 15 2021 12:48:35 GMT-0300 (Brasilia Standard Time)
RT @governosp: https://t.co/kirufN3yWJ,64706049,,,64706049,jdoriajr,,,18,0,Mon Sep 20 2021 20:28:04 GMT-0300 (Brasilia Standard Time),Wed Sep 15 2021 12:47:30 GMT-0300 (Brasilia Standard Time)
Teremos mais boas notícias na coletiva de imprensa de hoje. Confira ao vivo às 12h45. https://t.co/dw5LSG2T4u,64706049,,,64706049,jdoriajr,,,21,342,Mon Sep 20 2021 20:28:04 GMT-0300 (Brasilia Standard Time),Wed Sep 15 2021 11:55:20 GMT-0300 (Brasilia Standard Time)
"Anunciaremos hoje a redução no ICMS do setor de bares e restaurantes para 3,2%. A medida vai beneficiar cerca de 25… https://t.co/z9q91vbptI",64706049,,,64706049,jdoriajr,,,178,4288,Mon Sep 20 2021 20:28:04 GMT-0300 (Brasilia Standard Time),Wed Sep 15 2021 09:42:25 GMT-0300 (Brasilia Standard Time)
"O Governo de São Paulo bateu recorde de investimentos na saúde em 2020. Na pior pandemia dos últimos 100 anos, prep… https://t.co/Kw16C9K63V",64706049,,,64706049,jdoriajr,,,65,762,Mon Sep 20 2021 20:28:04 GMT-0300 (Brasilia Standard Time),Wed Sep 15 2021 08:23:23 GMT-0300 (Brasilia Standard Time)
"11ª concessão pública realizada pelo Governo de SP na Bolsa de Valores - B3

Pelos próximos 30 anos, os parques est… https://t.co/9KOutPRImu",64706049,,,64706049,jdoriajr,,,60,954,Mon Sep 20 2021 20:28:04 GMT-0300 (Brasilia Standard Time),Tue Sep 14 2021 17:07:29 GMT-0300 (Brasilia Standard Time)
"Desoladora a morte do empresário Celso Silveira Mello, da sua esposa Maria Luiza e seus 3 filhos, em acidente de av… https://t.co/75BhuC6rY4",64706049,,,64706049,jdoriajr,,,86,3189,Mon Sep 20 2021 20:28:04 GMT-0300 (Brasilia Standard Time),Tue Sep 14 2021 13:15:31 GMT-0300 (Brasilia Standard Time)
Uma das perguntas mais inusitadas que já me fizeram em entrevista. Me sensibiliza lembrar dessa fase da minha vida.… https://t.co/OJhFDZth4O,64706049,,,64706049,jdoriajr,,,65,855,Mon Sep 20 2021 20:28:04 GMT-0300 (Brasilia Standard Time),Tue Sep 14 2021 10:36:49 GMT-0300 (Brasilia Standard Time)
Justiça sendo feita 🙏💉 https://t.co/cz9AzwFqNq,64706049,,,64706049,jdoriajr,,,168,2837,Mon Sep 20 2021 20:28:04 GMT-0300 (Brasilia Standard Time),Tue Sep 14 2021 09:16:31 GMT-0300 (Brasilia Standard Time)
Eu estudei em escola pública e pude transformar a minha vida através do ensino. Se queremos um país justo e prósper… https://t.co/F2q58Ofhep,64706049,,,64706049,jdoriajr,,,35,600,Mon Sep 20 2021 20:28:04 GMT-0300 (Brasilia Standard Time),Mon Sep 13 2021 19:18:43 GMT-0300 (Brasilia Standard Time)
São Paulo fez a maior ampliação no número de Escolas de Tempo Integral da história. Saímos de 115 mil vagas para qu… https://t.co/fbIztzo0pH,64706049,,,64706049,jdoriajr,,,61,816,Mon Sep 20 2021 20:28:04 GMT-0300 (Brasilia Standard Time),Mon Sep 13 2021 19:18:42 GMT-0300 (Brasilia Standard Time)
"A vacinação segue avançando rapidamente pelo estado de SP. Já aplicamos 56 milhões 463 mil doses. Hoje, 4 em cada 5… https://t.co/JihsDFfD3M",64706049,,,64706049,jdoriajr,,,122,2794,Mon Sep 20 2021 20:28:04 GMT-0300 (Brasilia Standard Time),Mon Sep 13 2021 11:20:34 GMT-0300 (Brasilia Standard Time)
"Metrô

• 2-Verde
• 4-Amarela
• 6-Laranja
• 15-Prata
• 17-Ouro

CPTM

• 9-Esmeralda

EMTU

• VLT da Baixada Santista",64706049,,,64706049,jdoriajr,,,13,279,Mon Sep 20 2021 20:28:04 GMT-0300 (Brasilia Standard Time),Mon Sep 13 2021 09:32:38 GMT-0300 (Brasilia Standard Time)
"Retomamos todas as obras de expansão do Metrô, CPTM e EMTU que estavam paradas em SP. Muitas com entraves jurídicos… https://t.co/l6zOu2ATNa",64706049,,,64706049,jdoriajr,,,49,976,Mon Sep 20 2021 20:28:04 GMT-0300 (Brasilia Standard Time),Mon Sep 13 2021 09:32:37 GMT-0300 (Brasilia Standard Time)
12/09/2021 - Em defesa do Brasil e da democracia na Av. Paulista! 🇧🇷🇧🇷 https://t.co/Srpq2yyc9j,64706049,,,64706049,jdoriajr,,,391,6711,Mon Sep 20 2021 20:28:04 GMT-0300 (Brasilia Standard Time),Sun Sep 12 2021 17:40:27 GMT-0300 (Brasilia Standard Time)
@Boscardin SP tá de volta! 💪,64706049,,,64706049,jdoriajr,,,2,143,Mon Sep 20 2021 20:28:04 GMT-0300 (Brasilia Standard Time),Sun Sep 12 2021 09:33:53 GMT-0300 (Brasilia Standard Time)
Olha só quem tá de volta! 💪 https://t.co/xotMD1bULM,64706049,,,64706049,jdoriajr,,,139,1529,Mon Sep 20 2021 20:28:04 GMT-0300 (Brasilia Standard Time),Sun Sep 12 2021 09:09:44 GMT-0300 (Brasilia Standard Time)
"Pensando em famílias como a da Dona Helena, hoje o Governo de SP está beneficiando 2 milhões de pessoas em todo o E… https://t.co/zCp8d7KMTM",64706049,,,64706049,jdoriajr,,,22,623,Mon Sep 20 2021 20:28:04 GMT-0300 (Brasilia Standard Time),Sat Sep 11 2021 15:07:02 GMT-0300 (Brasilia Standard Time)
"Já vivi isso na pele, num período muito duro da minha infância ao lado da minha mãe Maria Sylvia e do meu irmão Rau… https://t.co/RJnLgeetkC",64706049,,,64706049,jdoriajr,,,27,557,Mon Sep 20 2021 20:28:04 GMT-0300 (Brasilia Standard Time),Sat Sep 11 2021 15:07:01 GMT-0300 (Brasilia Standard Time)
"Conheci Dona Helena, que vive com seu neto Luís, no Jd. Iporã, sul da capital de SP, quando fomos distribuir cestas… https://t.co/XNQYhNE0K0",64706049,,,64706049,jdoriajr,,,42,1141,Mon Sep 20 2021 20:28:04 GMT-0300 (Brasilia Standard Time),Sat Sep 11 2021 15:07:01 GMT-0300 (Brasilia Standard Time)
@maurobonna Muito bom estar com vocês hoje. Obrigado pelo carinho 🙏,64706049,,,64706049,jdoriajr,,,0,88,Mon Sep 20 2021 20:28:04 GMT-0300 (Brasilia Standard Time),Sat Sep 11 2021 12:10:32 GMT-0300 (Brasilia Standard Time)
RT @g1saopaulo: Governo de SP lança programa para auxiliar empreendedores informais com bolsa de R$ 1 mil ==&gt; https://t.co/fgJTgRQD2B #G1SP,64706049,,,64706049,jdoriajr,,,19,0,Mon Sep 20 2021 20:28:04 GMT-0300 (Brasilia Standard Time),Sat Sep 11 2021 11:20:37 GMT-0300 (Brasilia Standard Time)
"O programa prioriza mulheres, jovens, negros, indígenas e pessoas com deficiência.",64706049,,,64706049,jdoriajr,,,17,337,Mon Sep 20 2021 20:28:04 GMT-0300 (Brasilia Standard Time),Fri Sep 10 2021 16:37:00 GMT-0300 (Brasilia Standard Time)
Lançamos o Bolsa do Povo Empreendedor p/ apoiar 100 mil autônomos informais em situação de vulnerabilidade. Com inv… https://t.co/gRBVhQlvXH,64706049,,,64706049,jdoriajr,,,51,855,Mon Sep 20 2021 20:28:04 GMT-0300 (Brasilia Standard Time),Fri Sep 10 2021 16:36:59 GMT-0300 (Brasilia Standard Time)
"Aos poucos, a vida está voltando nos córregos que estamos despoluindo através do programa Novo Rio Pinheiros. A mel… https://t.co/G0Tn2hVlIY",64706049,,,64706049,jdoriajr,,,281,5768,Mon Sep 20 2021 20:28:04 GMT-0300 (Brasilia Standard Time),Fri Sep 10 2021 12:06:19 GMT-0300 (Brasilia Standard Time)
"Cuidar do futuro dos nossos jovens é prioridade! Resultados da rede pública de SP do Ideb, indicador da qualidade d… https://t.co/XKpe9hlk0C",64706049,,,64706049,jdoriajr,,,60,1064,Mon Sep 20 2021 20:28:04 GMT-0300 (Brasilia Standard Time),Fri Sep 10 2021 10:43:03 GMT-0300 (Brasilia Standard Time)
"#TBT - Fui secretário de turismo de Mário Covas, então prefeito de São Paulo, entre 1982/84. Covas era um homem ínt… https://t.co/53hcjaOvOR",64706049,,,64706049,jdoriajr,,,44,1578,Mon Sep 20 2021 20:28:04 GMT-0300 (Brasilia Standard Time),Thu Sep 09 2021 20:39:00 GMT-0300 (Brasilia Standard Time)
"O leão virou um rato 🐀
Grande dia! 👍",64706049,,,64706049,jdoriajr,,,4228,39063,Mon Sep 20 2021 20:28:04 GMT-0300 (Brasilia Standard Time),Thu Sep 09 2021 17:08:36 GMT-0300 (Brasilia Standard Time)
"Surto de sanidade 🙌
Viva a vacina 💉💉💉 https://t.co/wt6oTapecz",64706049,,,64706049,jdoriajr,,,796,13700,Mon Sep 20 2021 20:28:04 GMT-0300 (Brasilia Standard Time),Thu Sep 09 2021 14:44:53 GMT-0300 (Brasilia Standard Time)
"Em Sumaré, região de Campinas, anunciamos importantes ações em benefício da população:

• Construção de nova Etec
•… https://t.co/ufQVnb4Zid",64706049,,,64706049,jdoriajr,,,33,453,Mon Sep 20 2021 20:28:04 GMT-0300 (Brasilia Standard Time),Thu Sep 09 2021 14:26:33 GMT-0300 (Brasilia Standard Time)
"Sou um liberal democrata, mas não podemos esquecer que vivemos em um país com muita pobreza. Precisamos equilibrar… https://t.co/UDjzN7AczQ",64706049,,,64706049,jdoriajr,,,71,1189,Mon Sep 20 2021 20:28:04 GMT-0300 (Brasilia Standard Time),Thu Sep 09 2021 10:36:26 GMT-0300 (Brasilia Standard Time)
Mais de 700 mil estudantes com vulnerabilidade social passarão a receber merenda extra na rede pública estadual de… https://t.co/WnEY7reIPz,64706049,,,64706049,jdoriajr,,,57,964,Mon Sep 20 2021 20:28:04 GMT-0300 (Brasilia Standard Time),Wed Sep 08 2021 16:23:22 GMT-0300 (Brasilia Standard Time)
RT @governosp: https://t.co/ccILUiGFmK,64706049,,,64706049,jdoriajr,,,25,0,Mon Sep 20 2021 20:28:04 GMT-0300 (Brasilia Standard Time),Wed Sep 08 2021 12:44:52 GMT-0300 (Brasilia Standard Time)
"Na coletiva de imprensa de hoje, vamos tratar sobre vacinação, merenda escolar e apoio aos estudantes em situação d… https://t.co/fMRPWLcON4",64706049,,,64706049,jdoriajr,,,22,405,Mon Sep 20 2021 20:28:04 GMT-0300 (Brasilia Standard Time),Wed Sep 08 2021 12:03:47 GMT-0300 (Brasilia Standard Time)
Chile aprovou Coronavac para vacinação de adolescentes e crianças a partir de 6 anos. Decisão levou em consideração… https://t.co/EIwaO93ACw,64706049,,,64706049,jdoriajr,,,121,1796,Mon Sep 20 2021 20:28:04 GMT-0300 (Brasilia Standard Time),Wed Sep 08 2021 11:52:43 GMT-0300 (Brasilia Standard Time)
Compartilho números do programa de despoluição do Novo Rio Pinheiros. O trabalho vai muito além das margens do rio.… https://t.co/T7aeSQD8sb,64706049,,,64706049,jdoriajr,,,83,1683,Mon Sep 20 2021 20:28:04 GMT-0300 (Brasilia Standard Time),Wed Sep 08 2021 07:48:54 GMT-0300 (Brasilia Standard Time)
"Independência só é plena quando há respeito às Leis, à Constituição e à Democracia. #ForaBolsonaro",64706049,,,64706049,jdoriajr,,,1547,20847,Mon Sep 20 2021 20:28:04 GMT-0300 (Brasilia Standard Time),Tue Sep 07 2021 17:37:01 GMT-0300 (Brasilia Standard Time)
Foi num grito de independência há 199 anos. Não podemos tolerar retrocessos. Que o Estado Democrático de Direito e… https://t.co/2417mgX6KU,64706049,,,64706049,jdoriajr,,,354,6857,Mon Sep 20 2021 20:28:04 GMT-0300 (Brasilia Standard Time),Tue Sep 07 2021 09:39:09 GMT-0300 (Brasilia Standard Time)
Amanhã o Brasil completa 199 anos de independência. País vive seu pior momento desde a ditadura. Precisamos de paz.… https://t.co/PbjHlpocE9,64706049,,,64706049,jdoriajr,,,584,11194,Mon Sep 20 2021 20:28:04 GMT-0300 (Brasilia Standard Time),Mon Sep 06 2021 17:10:32 GMT-0300 (Brasilia Standard Time)
O avanço da vacinação nos traz esperança de dias melhores e a volta da nossa liberdade. #VacinaPraTodos 💉🙏 https://t.co/bNH8AR1e3Y,64706049,,,64706049,jdoriajr,,,62,877,Mon Sep 20 2021 20:28:04 GMT-0300 (Brasilia Standard Time),Mon Sep 06 2021 10:05:42 GMT-0300 (Brasilia Standard Time)
"A toda comunidade judaica, meus votos para que 5.782 seja um ano de saúde, de união, esperança e realizações! Shaná… https://t.co/CoPYERKz3z",64706049,,,64706049,jdoriajr,,,86,2517,Mon Sep 20 2021 20:28:04 GMT-0300 (Brasilia Standard Time),Sun Sep 05 2021 19:25:04 GMT-0300 (Brasilia Standard Time)
RT @BelaMegale: Coronavac reduziu em 86% média de mortes de pessoas com mais 70 anos em SP https://t.co/aZfkzjiaek,64706049,,,64706049,jdoriajr,,,366,0,Mon Sep 20 2021 20:28:04 GMT-0300 (Brasilia Standard Time),Sun Sep 05 2021 15:55:59 GMT-0300 (Brasilia Standard Time)
"Hoje é o Dia da Amazônia. Data para refletirmos nossa responsabilidade ambiental, combate ao desmatamento e às muda… https://t.co/2KJzQDYud1",64706049,,,64706049,jdoriajr,,,62,1057,Mon Sep 20 2021 20:28:04 GMT-0300 (Brasilia Standard Time),Sun Sep 05 2021 11:28:53 GMT-0300 (Brasilia Standard Time)
"Orgulho do nosso time Paralímpico em Tóquio! Brasil ficou em 7º lugar no quadro geral de medalhas, com🥇22,🥈20 e🥉30.… https://t.co/b4HRKutOlT",64706049,,,64706049,jdoriajr,,,102,3159,Mon Sep 20 2021 20:28:04 GMT-0300 (Brasilia Standard Time),Sun Sep 05 2021 09:06:12 GMT-0300 (Brasilia Standard Time)
Estão abertas as inscrições para o programa Bolsa do Povo Educação - Ação Estudantes. O GovSP pagará bolsa de R$ 1.… https://t.co/6LC6kFPi2l,64706049,,,64706049,jdoriajr,,,59,533,Mon Sep 20 2021 20:28:04 GMT-0300 (Brasilia Standard Time),Sat Sep 04 2021 10:59:58 GMT-0300 (Brasilia Standard Time)
"Ao lado da @GabrielaPrioli e do Bolt, para lembrar que daqui a pouco, às 10h, vai ao ar minha entrevista para o pro… https://t.co/IX9V7WeiCj",64706049,,,64706049,jdoriajr,,,63,2629,Mon Sep 20 2021 20:28:04 GMT-0300 (Brasilia Standard Time),Sat Sep 04 2021 09:25:39 GMT-0300 (Brasilia Standard Time)
"Emocionante a final do futebol de 5 nas Paralimpíadas! Brasil venceu a Argentina por 1 X 0, conquistou o 22º ouro e… https://t.co/nbBffNR9VQ",64706049,,,64706049,jdoriajr,,,30,1310,Mon Sep 20 2021 20:28:04 GMT-0300 (Brasilia Standard Time),Sat Sep 04 2021 09:16:40 GMT-0300 (Brasilia Standard Time)
"A @Policia_Civil identificou e apreendeu uma gigantesca quantidade de drogas em Cerquilho, região de Sorocaba. Quas… https://t.co/4VA7ATDTxJ",64706049,,,64706049,jdoriajr,,,29,596,Mon Sep 20 2021 20:28:04 GMT-0300 (Brasilia Standard Time),Fri Sep 03 2021 17:53:51 GMT-0300 (Brasilia Standard Time)
Segue o fio https://t.co/RLbe84sBhe,64706049,,,64706049,jdoriajr,,,30,361,Mon Sep 20 2021 20:28:04 GMT-0300 (Brasilia Standard Time),Fri Sep 03 2021 15:43:55 GMT-0300 (Brasilia Standard Time)
Compartilho conteúdo na íntegra da capa da IstoÉ desta semana sobre os avanços da nossa gestão à frente do Governo… https://t.co/FI3nmuLAwS,64706049,,,64706049,jdoriajr,,,133,1437,Mon Sep 20 2021 20:28:04 GMT-0300 (Brasilia Standard Time),Fri Sep 03 2021 15:43:51 GMT-0300 (Brasilia Standard Time)
"Obrigado a todos pelas palavras de carinho 🙏
A cirurgia foi bem-sucedida e estou bem. Breve terei alta.
Sigo despac… https://t.co/qHhLiPt1me",64706049,,,64706049,jdoriajr,,,126,8163,Mon Sep 20 2021 20:28:04 GMT-0300 (Brasilia Standard Time),Fri Sep 03 2021 10:40:03 GMT-0300 (Brasilia Standard Time)
"Em Barretos, sede da maior Festa do Peão do Brasil, anunciamos investimentos em infraestrutura urbana, turismo e aç… https://t.co/8kJIrvQZdj",64706049,,,64706049,jdoriajr,,,27,538,Mon Sep 20 2021 20:28:04 GMT-0300 (Brasilia Standard Time),Fri Sep 03 2021 09:23:51 GMT-0300 (Brasilia Standard Time)
Lutamos pela vacina contra os negacionistas da ciência. Agora vamos lutar para reinaugurar o Museu do Ipiranga cont… https://t.co/kuBXDPzUjL,64706049,,,64706049,jdoriajr,,,373,7320,Mon Sep 20 2021 20:28:04 GMT-0300 (Brasilia Standard Time),Thu Sep 02 2021 19:01:44 GMT-0300 (Brasilia Standard Time)
"Excelente notícia! 
A Toyota anunciou contratação de mais 850 funcionários para produzir veículos em três turnos na… https://t.co/JP71HoIKyC",64706049,,,64706049,jdoriajr,,,124,2175,Mon Sep 20 2021 20:28:04 GMT-0300 (Brasilia Standard Time),Thu Sep 02 2021 18:41:22 GMT-0300 (Brasilia Standard Time)
"Viemos a Olímpia, interior de SP, para inaugurar um novo hotel resort, com investimento de R$ 400 milhões. O hotel… https://t.co/lh1qU9vf4g",64706049,,,64706049,jdoriajr,,,38,564,Mon Sep 20 2021 20:28:04 GMT-0300 (Brasilia Standard Time),Thu Sep 02 2021 18:10:09 GMT-0300 (Brasilia Standard Time)
Lançamos o Bolsa do Povo Educação para contratar 2.370 pais e mães de alunos do Centro Paula Souza que vivem em vul… https://t.co/jyVlmkngtw,64706049,,,64706049,jdoriajr,,,58,919,Mon Sep 20 2021 20:28:04 GMT-0300 (Brasilia Standard Time),Thu Sep 02 2021 16:21:24 GMT-0300 (Brasilia Standard Time)
O Estado de São Paulo tem cerca de 22% da população. Esse é o número de vacinas que temos direito de receber.,64706049,,,64706049,jdoriajr,,,60,1309,Mon Sep 20 2021 20:28:04 GMT-0300 (Brasilia Standard Time),Thu Sep 02 2021 13:55:43 GMT-0300 (Brasilia Standard Time)
"O Governo Federal insiste em atrapalhar quem trabalha. Enquanto fazem bravatas, compram cloroquina e pregam contra… https://t.co/aIEnQv0ulW",64706049,,,64706049,jdoriajr,,,253,4114,Mon Sep 20 2021 20:28:04 GMT-0300 (Brasilia Standard Time),Thu Sep 02 2021 13:55:43 GMT-0300 (Brasilia Standard Time)
