text,query,country,city,userId,username,quote_count,reply_count,retweet_count,favorite_count,timestamp,createdAt
Em reunião no Juruá Gladson Cameli e classe empresarial firmam pacto pela retomada do crescimento econômico no pós-… https://t.co/VAVOlofD1c,cameli,,,53193772,juruaonline,,,0,0,Wed Aug 25 2021 19:47:27 GMT-0300 (Brasilia Standard Time),Wed Aug 25 2021 17:40:27 GMT-0300 (Brasilia Standard Time)
New Post: “Moleques de recados do Cameli não merecem resposta”- reage Mara Rocha à nota do PSDB… https://t.co/AOrS0hL8lX,cameli,,,1374492052117811200,AcreinF,,,0,2,Wed Aug 25 2021 19:47:27 GMT-0300 (Brasilia Standard Time),Wed Aug 25 2021 16:07:03 GMT-0300 (Brasilia Standard Time)
"George Pinheiro recebeu uma placa de reconhecimento, entregue pelo governador do estado, Gladson Cameli, e pelo pre… https://t.co/1FVABKXMvy",cameli,,,612886674,CACBNoticias,,,0,0,Wed Aug 25 2021 19:47:27 GMT-0300 (Brasilia Standard Time),Wed Aug 25 2021 16:02:02 GMT-0300 (Brasilia Standard Time)
"Exclusivo: Maternidade de Feijó pode ser interditada por conta do abandono do Governo Gladson Cameli, diz vereador… https://t.co/xxcjd1vzJy",cameli,,,714990550462644200,3dejulhonoticia,,,0,0,Wed Aug 25 2021 19:47:27 GMT-0300 (Brasilia Standard Time),Wed Aug 25 2021 14:30:41 GMT-0300 (Brasilia Standard Time)
Gladson nomeia mais um Cameli para assumir cargo de gerência no governo https://t.co/UupCuyQp6T,cameli,,,83294591,ContilNet,,,0,0,Wed Aug 25 2021 19:47:27 GMT-0300 (Brasilia Standard Time),Wed Aug 25 2021 12:27:53 GMT-0300 (Brasilia Standard Time)
"Alguém vai levar rasteira: Plano de tirar Alysson Bestene do PP e filiar em outra sigla para ser o vice, ainda é o… https://t.co/JzjoApLwtw",cameli,,,714990550462644200,3dejulhonoticia,,,0,0,Wed Aug 25 2021 19:47:27 GMT-0300 (Brasilia Standard Time),Wed Aug 25 2021 12:19:01 GMT-0300 (Brasilia Standard Time)
"Malabarismo: Dez comissionados da Sesacre, são deslocados para Secretaria de Comunicação do governo Cameli.

https://t.co/kHDk13y3E4",cameli,,,714990550462644200,3dejulhonoticia,,,0,0,Wed Aug 25 2021 19:47:27 GMT-0300 (Brasilia Standard Time),Wed Aug 25 2021 10:59:54 GMT-0300 (Brasilia Standard Time)
"Com expectativa de colheita recorde de grãos no Acre, Gladson Cameli lança Plano Safra 2021/2022 https://t.co/UE5Hikcclr",cameli,,,53193772,juruaonline,,,0,0,Wed Aug 25 2021 19:47:27 GMT-0300 (Brasilia Standard Time),Wed Aug 25 2021 10:32:08 GMT-0300 (Brasilia Standard Time)
"Com expectativa de colheita recorde de grãos no Acre, Gladson Cameli lança Plano Safra 2021/2022 https://t.co/35ykhdl5Z6",cameli,,,3044646035,diariodoac,,,0,0,Wed Aug 25 2021 19:47:27 GMT-0300 (Brasilia Standard Time),Wed Aug 25 2021 09:28:31 GMT-0300 (Brasilia Standard Time)
@alguem20200791 Dou 8 pro governador Gladson Cameli.,cameli,,,833905356170461200,rocs_83,,,0,0,Wed Aug 25 2021 19:47:27 GMT-0300 (Brasilia Standard Time),Tue Aug 24 2021 22:28:54 GMT-0300 (Brasilia Standard Time)
"Os números comprovam que o Acre vive uma nova era na área do agronegócio. Para este ano, a estimativa é que um novo… https://t.co/wry8blKLg5",cameli,,,23798169,GovernoAcre,,,0,0,Wed Aug 25 2021 19:47:27 GMT-0300 (Brasilia Standard Time),Tue Aug 24 2021 20:29:05 GMT-0300 (Brasilia Standard Time)
RT @dimacgarcia: AC - Mailza Gomes (PP) assumiu o cargo na renúncia de Gladson Cameli (PP). Elá é uma das senadoras que deixam o Senado em…,cameli,,,1024358102882299900,Siliane18,,,197,0,Wed Aug 25 2021 19:47:27 GMT-0300 (Brasilia Standard Time),Tue Aug 24 2021 20:20:52 GMT-0300 (Brasilia Standard Time)
"‘Estamos fazendo de tudo para que as pessoas invistam na agricultura’, diz Gladson Cameli durante lançamento do Pla… https://t.co/7feA0JUNfA",cameli,,,1385384442622009300,AcrenewsN,,,0,0,Wed Aug 25 2021 19:47:27 GMT-0300 (Brasilia Standard Time),Tue Aug 24 2021 20:19:54 GMT-0300 (Brasilia Standard Time)
"Governo Gladson Cameli optou pelo discurso fácil, irresponsável e leviano e fica aqui o meu repúdio, diz vereador J… https://t.co/iWdwkB5FDi",cameli,,,714990550462644200,3dejulhonoticia,,,0,0,Wed Aug 25 2021 19:47:27 GMT-0300 (Brasilia Standard Time),Tue Aug 24 2021 17:26:24 GMT-0300 (Brasilia Standard Time)
"Ao aceitar nomeação no governo Cameli, professora Degmar Ferreti põe em risco aposentadoria por invalidez na Ufac… https://t.co/2hWNsTbQo7",cameli,,,71278577,leonildorosas,,,0,0,Wed Aug 25 2021 19:47:27 GMT-0300 (Brasilia Standard Time),Tue Aug 24 2021 11:58:04 GMT-0300 (Brasilia Standard Time)
"Nomeada pelo governador Gladson Cameli, esposa de Minoru Kimpara foi aposentada da UFAC por invalidez, ganhou um ca… https://t.co/EJcA5Om3IG",cameli,,,714990550462644200,3dejulhonoticia,,,0,0,Wed Aug 25 2021 19:47:27 GMT-0300 (Brasilia Standard Time),Tue Aug 24 2021 10:16:08 GMT-0300 (Brasilia Standard Time)
Gladson Cameli descarta voltar a fechar comércio no Acre https://t.co/F8XIAEcZQC,cameli,,,3044646035,diariodoac,,,0,0,Wed Aug 25 2021 19:47:27 GMT-0300 (Brasilia Standard Time),Tue Aug 24 2021 09:59:36 GMT-0300 (Brasilia Standard Time)
Cameli diz que críticas de deputada Mara Rocha são ‘ cíumes ‘ https://t.co/TsP9ujHKWo,cameli,,,3044646035,diariodoac,,,0,0,Wed Aug 25 2021 19:47:27 GMT-0300 (Brasilia Standard Time),Tue Aug 24 2021 09:50:19 GMT-0300 (Brasilia Standard Time)
Cameli diz que críticas de deputada Mara Rocha são ‘ cíumes ‘ https://t.co/S6cziZGZAp,cameli,,,3044646035,diariodoac,,,0,0,Wed Aug 25 2021 19:47:27 GMT-0300 (Brasilia Standard Time),Tue Aug 24 2021 09:49:21 GMT-0300 (Brasilia Standard Time)
Governador Gladson Cameli entrega 28 novas ambulâncias para servirem o povo do Acre https://t.co/vpIL1Go8Bp,cameli,,,3044646035,diariodoac,,,0,0,Wed Aug 25 2021 19:47:27 GMT-0300 (Brasilia Standard Time),Tue Aug 24 2021 09:25:39 GMT-0300 (Brasilia Standard Time)
Gladson Cameli suspende desfile do 7 de setembro no estado - https://t.co/YturbpnWcb https://t.co/iGQDzwmGTb,cameli,,,33512934,agazetanet,,,0,0,Wed Aug 25 2021 19:47:27 GMT-0300 (Brasilia Standard Time),Tue Aug 24 2021 09:08:33 GMT-0300 (Brasilia Standard Time)
Vontade de sumir,cameli,,,847240901382463500,Jim_Cameli,,,0,0,Wed Aug 25 2021 19:47:27 GMT-0300 (Brasilia Standard Time),Tue Aug 24 2021 01:48:21 GMT-0300 (Brasilia Standard Time)
RT @matraqueando: Importante destacar os governadores e estados que NÃO assinam a carta em defesa da democracia: ACRE (Gladson Cameli - PP)…,cameli,,,161277996,belluccis,,,206,0,Wed Aug 25 2021 19:47:27 GMT-0300 (Brasilia Standard Time),Tue Aug 24 2021 01:45:52 GMT-0300 (Brasilia Standard Time)
"RT @erasmolbj: Ou seja, foda-se se você tá pagando 7 reais no litro da gasolina, 50 no kilo da carne, 100 no gás de cozinha, o importante é…",cameli,,,847240901382463500,Jim_Cameli,,,47,0,Wed Aug 25 2021 19:47:27 GMT-0300 (Brasilia Standard Time),Tue Aug 24 2021 01:43:21 GMT-0300 (Brasilia Standard Time)
Ouça os áudios: Moradores de Xapuri dizem que Gladson Cameli e Antônio Pedro só prestam para tirar fotos e prometer… https://t.co/7oxd4Kb4KC,cameli,,,714990550462644200,3dejulhonoticia,,,0,0,Wed Aug 25 2021 19:47:27 GMT-0300 (Brasilia Standard Time),Mon Aug 23 2021 22:51:36 GMT-0300 (Brasilia Standard Time)
"Para evitar aumento de casos da Covid-19, Cameli decide cancelar desfile de 7 de Setembro https://t.co/6tAH6ScweX",cameli,,,218895649,Ecos_da_Noticia,,,0,2,Wed Aug 25 2021 19:47:27 GMT-0300 (Brasilia Standard Time),Mon Aug 23 2021 22:32:45 GMT-0300 (Brasilia Standard Time)
O governador Gladson Cameli colocou à disposição aeronaves da Secretaria de Estado de Segurança Pública (Sejusp) pa… https://t.co/xiNhXsC0EL,cameli,,,23798169,GovernoAcre,,,0,0,Wed Aug 25 2021 19:47:27 GMT-0300 (Brasilia Standard Time),Mon Aug 23 2021 16:11:23 GMT-0300 (Brasilia Standard Time)
"E eu que sonhei que no Cameli tava com uma promoção maravilhosaaaaa
Tudo custando centavos, eu me acabei na promoçã… https://t.co/3wcxW6UbmS",cameli,,,1259667650210340900,dressanascy,,,0,3,Wed Aug 25 2021 19:47:27 GMT-0300 (Brasilia Standard Time),Mon Aug 23 2021 13:11:06 GMT-0300 (Brasilia Standard Time)
"Por falta de segurança por parte do Governo Cameli, 4ª unidade de saúde é invadida por bandidos na capital em menos… https://t.co/K7uAJfnvaR",cameli,,,714990550462644200,3dejulhonoticia,,,0,1,Wed Aug 25 2021 19:47:27 GMT-0300 (Brasilia Standard Time),Mon Aug 23 2021 12:41:47 GMT-0300 (Brasilia Standard Time)
De nada adiantou recriar o IMC para assegurar os recursos. Com o desmatamento recorde vivenciado desde a chegada de… https://t.co/CL9DFN8WNG,cameli,Brazil,"Rio Branco, Brazil",54880885,fabiospontes,,,0,1,Wed Aug 25 2021 19:47:27 GMT-0300 (Brasilia Standard Time),Mon Aug 23 2021 12:20:53 GMT-0300 (Brasilia Standard Time)
"@Patriotaonline_ Os menos piores seriam
1 - Cameli, no Acre
2 - Marcos Rocha, de Rondônia
3 - Denarium, de Roraima",cameli,,,1063941506795536400,DeyvinLudi,,,0,0,Wed Aug 25 2021 19:47:27 GMT-0300 (Brasilia Standard Time),Mon Aug 23 2021 12:18:31 GMT-0300 (Brasilia Standard Time)
Veja o Vídeo: Rocha diz que seu único proposito é combater a corrupção que tem em quase todos os setores do governo… https://t.co/FFWtWsqc05,cameli,,,714990550462644200,3dejulhonoticia,,,0,0,Wed Aug 25 2021 19:47:27 GMT-0300 (Brasilia Standard Time),Mon Aug 23 2021 11:14:20 GMT-0300 (Brasilia Standard Time)
RT @dimacgarcia: AC - Mailza Gomes (PP) assumiu o cargo na renúncia de Gladson Cameli (PP). Elá é uma das senadoras que deixam o Senado em…,cameli,,,1347212567115133000,LagerthaSaint,,,197,0,Wed Aug 25 2021 19:47:27 GMT-0300 (Brasilia Standard Time),Mon Aug 23 2021 04:58:04 GMT-0300 (Brasilia Standard Time)
RT @dimacgarcia: AC - Mailza Gomes (PP) assumiu o cargo na renúncia de Gladson Cameli (PP). Elá é uma das senadoras que deixam o Senado em…,cameli,,,1232801252670615600,mariambbrasill,,,197,0,Wed Aug 25 2021 19:47:27 GMT-0300 (Brasilia Standard Time),Mon Aug 23 2021 04:53:57 GMT-0300 (Brasilia Standard Time)
RT @dimacgarcia: AC - Mailza Gomes (PP) assumiu o cargo na renúncia de Gladson Cameli (PP). Elá é uma das senadoras que deixam o Senado em…,cameli,,,1245413642817896400,Helena30679024,,,197,0,Wed Aug 25 2021 19:47:27 GMT-0300 (Brasilia Standard Time),Mon Aug 23 2021 01:26:19 GMT-0300 (Brasilia Standard Time)
RT @pensologoehisto: Síntese de quem se diz representante do pobre no Brasil https://t.co/fhVB2P8NQw,cameli,,,847240901382463500,Jim_Cameli,,,172,0,Wed Aug 25 2021 19:47:27 GMT-0300 (Brasilia Standard Time),Sun Aug 22 2021 01:21:55 GMT-0300 (Brasilia Standard Time)
"A primeira-dama Ana Paula Cameli participou nesta quinta-feira, 19, no Palácio da Alvorada, em Brasília, da  3ª Reu… https://t.co/BmBEejVyEL",cameli,,,23798169,GovernoAcre,,,0,1,Wed Aug 25 2021 19:47:27 GMT-0300 (Brasilia Standard Time),Sat Aug 21 2021 11:23:40 GMT-0300 (Brasilia Standard Time)
Governador Gladson Cameli trata de ativos ambientais em São Paulo https://t.co/rl7ezWaQu7,cameli,,,83294591,ContilNet,,,0,0,Wed Aug 25 2021 19:47:27 GMT-0300 (Brasilia Standard Time),Fri Aug 20 2021 20:13:31 GMT-0300 (Brasilia Standard Time)
Gladson Cameli faz nova aliança com Minoru https://t.co/COliyxOe9g,cameli,,,116949597,AGazetadoAcre,,,0,0,Wed Aug 25 2021 19:47:27 GMT-0300 (Brasilia Standard Time),Fri Aug 20 2021 16:35:09 GMT-0300 (Brasilia Standard Time)
"Ao trazer Socorro Neri e Minoru Kimpara para junto de si, Gladson Cameli se distancia ainda mais do Prefeito Tião B… https://t.co/7N9B6olmf1",cameli,,,714990550462644200,3dejulhonoticia,,,0,1,Wed Aug 25 2021 19:47:27 GMT-0300 (Brasilia Standard Time),Fri Aug 20 2021 14:43:05 GMT-0300 (Brasilia Standard Time)
O governo do estado do Acre pretende publicar o edital do novo concurso para o Instituto Socioeducativo do AC em se… https://t.co/1032GYaQW7,cameli,,,1417228951181738000,EmAudioConcurso,,,0,2,Wed Aug 25 2021 19:47:27 GMT-0300 (Brasilia Standard Time),Fri Aug 20 2021 13:20:47 GMT-0300 (Brasilia Standard Time)
"Exmo. Senhor, Governador do Estado do Acre, Gladson Cameli:
é pá queimá ou num é pá queimá? Confuso aqui. Cada hora… https://t.co/m7m3UUReG6",cameli,,,72665610,David_SentoSe,,,0,1,Wed Aug 25 2021 19:47:27 GMT-0300 (Brasilia Standard Time),Fri Aug 20 2021 11:42:17 GMT-0300 (Brasilia Standard Time)
"Sem os bilhões prometidos pelo governador Gladson Cameli, construção civil do Acre se contenta com as pequenas obra… https://t.co/ff9ZmrZKR6",cameli,,,714990550462644200,3dejulhonoticia,,,0,1,Wed Aug 25 2021 19:47:27 GMT-0300 (Brasilia Standard Time),Fri Aug 20 2021 11:20:56 GMT-0300 (Brasilia Standard Time)
"RT @leonildorosas: Alô, Roberto Duarte! Alíquota de 25% de ICMS da gasolina vem desde o governo Orleir Camel https://t.co/1TzxbUvvE4 via @l…",cameli,,,19710619,rodrigoforneck,,,1,0,Wed Aug 25 2021 19:47:27 GMT-0300 (Brasilia Standard Time),Fri Aug 20 2021 11:02:03 GMT-0300 (Brasilia Standard Time)
"A presidente do TJAC, desembargadora Waldirene Cordeiro, e o governador do Estado, Gladson Cameli, assinaram Termo… https://t.co/hpZNAWmbmO",cameli,,,61499198,tjacoficial,,,0,1,Wed Aug 25 2021 19:47:27 GMT-0300 (Brasilia Standard Time),Fri Aug 20 2021 10:34:07 GMT-0300 (Brasilia Standard Time)
"RT @fabiospontes: Bota pra moer com a Amazônia, Cameli 

Em julho deste ano, o total de área desmatada no Acre chegou a 313 km2; na compara…",cameli,,,1383828087675121700,HaroldoMoraesd2,,,12,0,Wed Aug 25 2021 19:47:27 GMT-0300 (Brasilia Standard Time),Fri Aug 20 2021 08:56:03 GMT-0300 (Brasilia Standard Time)
"RT @fabiospontes: Bota pra moer com a Amazônia, Cameli 

Em julho deste ano, o total de área desmatada no Acre chegou a 313 km2; na compara…",cameli,,,1391333954754580500,RikaomTupinamba,,,12,0,Wed Aug 25 2021 19:47:27 GMT-0300 (Brasilia Standard Time),Fri Aug 20 2021 07:40:23 GMT-0300 (Brasilia Standard Time)
"RT @fabiospontes: Bota pra moer com a Amazônia, Cameli 

Em julho deste ano, o total de área desmatada no Acre chegou a 313 km2; na compara…",cameli,,,1256547501827666000,RFB_Ricardo,,,12,0,Wed Aug 25 2021 19:47:27 GMT-0300 (Brasilia Standard Time),Fri Aug 20 2021 06:16:26 GMT-0300 (Brasilia Standard Time)
"“Mazinho é uma pessoa que soma”, diz governador Gladson Cameli https://t.co/1yPUnk3Wpa",cameli,,,218895649,Ecos_da_Noticia,,,0,0,Wed Aug 25 2021 19:47:27 GMT-0300 (Brasilia Standard Time),Fri Aug 20 2021 01:21:46 GMT-0300 (Brasilia Standard Time)
"RT @fabiospontes: Bota pra moer com a Amazônia, Cameli 

Em julho deste ano, o total de área desmatada no Acre chegou a 313 km2; na compara…",cameli,,,757708045925376000,ed_demigod,,,12,0,Wed Aug 25 2021 19:47:27 GMT-0300 (Brasilia Standard Time),Fri Aug 20 2021 00:39:34 GMT-0300 (Brasilia Standard Time)
"RT @fabiospontes: Bota pra moer com a Amazônia, Cameli 

Em julho deste ano, o total de área desmatada no Acre chegou a 313 km2; na compara…",cameli,,,459546565,ADRIANADEOLIV49,,,12,0,Wed Aug 25 2021 19:47:27 GMT-0300 (Brasilia Standard Time),Thu Aug 19 2021 22:10:41 GMT-0300 (Brasilia Standard Time)
"RT @fabiospontes: Bota pra moer com a Amazônia, Cameli 

Em julho deste ano, o total de área desmatada no Acre chegou a 313 km2; na compara…",cameli,,,706913688750583800,pesquisador_m,,,12,0,Wed Aug 25 2021 19:47:27 GMT-0300 (Brasilia Standard Time),Thu Aug 19 2021 22:03:18 GMT-0300 (Brasilia Standard Time)
"RT @fabiospontes: Bota pra moer com a Amazônia, Cameli 

Em julho deste ano, o total de área desmatada no Acre chegou a 313 km2; na compara…",cameli,,,25126370,naosoumaismess,,,12,0,Wed Aug 25 2021 19:47:27 GMT-0300 (Brasilia Standard Time),Thu Aug 19 2021 22:02:00 GMT-0300 (Brasilia Standard Time)
"RT @fabiospontes: Bota pra moer com a Amazônia, Cameli 

Em julho deste ano, o total de área desmatada no Acre chegou a 313 km2; na compara…",cameli,,,1318412992069980200,gabduacre,,,12,0,Wed Aug 25 2021 19:47:27 GMT-0300 (Brasilia Standard Time),Thu Aug 19 2021 21:13:10 GMT-0300 (Brasilia Standard Time)
"RT @fabiospontes: Bota pra moer com a Amazônia, Cameli 

Em julho deste ano, o total de área desmatada no Acre chegou a 313 km2; na compara…",cameli,,,15578130,EuSouTerrivel,,,12,0,Wed Aug 25 2021 19:47:27 GMT-0300 (Brasilia Standard Time),Thu Aug 19 2021 21:12:31 GMT-0300 (Brasilia Standard Time)
"RT @fabiospontes: Bota pra moer com a Amazônia, Cameli 

Em julho deste ano, o total de área desmatada no Acre chegou a 313 km2; na compara…",cameli,,,78217031,arisonjardim,,,12,0,Wed Aug 25 2021 19:47:27 GMT-0300 (Brasilia Standard Time),Thu Aug 19 2021 21:08:37 GMT-0300 (Brasilia Standard Time)
"RT @fabiospontes: Bota pra moer com a Amazônia, Cameli 

Em julho deste ano, o total de área desmatada no Acre chegou a 313 km2; na compara…",cameli,,,1249364123802120200,andante40428500,,,12,0,Wed Aug 25 2021 19:47:27 GMT-0300 (Brasilia Standard Time),Thu Aug 19 2021 16:03:20 GMT-0300 (Brasilia Standard Time)
"Bota pra moer com a Amazônia, Cameli 

Em julho deste ano, o total de área desmatada no Acre chegou a 313 km2; na c… https://t.co/7zs6nuYqEK",cameli,,,54880885,fabiospontes,,,12,27,Wed Aug 25 2021 19:47:27 GMT-0300 (Brasilia Standard Time),Thu Aug 19 2021 16:00:52 GMT-0300 (Brasilia Standard Time)
Roxinho deve assumir direção financeira da COAHB no governo Cameli https://t.co/txfXvzcQNI,cameli,,,218895649,Ecos_da_Noticia,,,0,0,Wed Aug 25 2021 19:47:27 GMT-0300 (Brasilia Standard Time),Thu Aug 19 2021 14:45:41 GMT-0300 (Brasilia Standard Time)
RT @3dejulhonoticia: Vereadores denunciam descaso caótica do governador Gladson Cameli com a situação da saúde pública de Cruzeiro do Sul.…,cameli,,,1404469839050297300,cruzeirozip,,,1,0,Wed Aug 25 2021 19:47:27 GMT-0300 (Brasilia Standard Time),Thu Aug 19 2021 14:05:15 GMT-0300 (Brasilia Standard Time)
Vereadores denunciam descaso caótica do governador Gladson Cameli com a situação da saúde pública de Cruzeiro do Su… https://t.co/HUXOfIS4Kv,cameli,,,714990550462644200,3dejulhonoticia,,,1,0,Wed Aug 25 2021 19:47:27 GMT-0300 (Brasilia Standard Time),Thu Aug 19 2021 14:05:10 GMT-0300 (Brasilia Standard Time)
"Em reunião com governador Cameli, prefeita de Brasiléia consegue reforçar parceria e deixa encontro “feliz da vida” https://t.co/M6N3xaX0ro",cameli,,,1385384442622009300,AcrenewsN,,,0,0,Wed Aug 25 2021 19:47:27 GMT-0300 (Brasilia Standard Time),Thu Aug 19 2021 12:35:20 GMT-0300 (Brasilia Standard Time)
"Alô, Roberto Duarte! Alíquota de 25% de ICMS da gasolina vem desde o governo Orleir Camel https://t.co/1TzxbUvvE4 via @leonildorosas",cameli,,,71278577,leonildorosas,,,1,4,Wed Aug 25 2021 19:47:27 GMT-0300 (Brasilia Standard Time),Thu Aug 19 2021 11:11:51 GMT-0300 (Brasilia Standard Time)
"As promessa de Cameli: Vereador Tiago Matos, pede que Governador cumpra as promessas feitas ao Município de Rodrigu… https://t.co/ftSAJT7uIB",cameli,,,714990550462644200,3dejulhonoticia,,,0,1,Wed Aug 25 2021 19:47:27 GMT-0300 (Brasilia Standard Time),Thu Aug 19 2021 10:54:10 GMT-0300 (Brasilia Standard Time)
Gladson Cameli visita Clínica do Rim em Brasiléia e diz que espera parecer administrativo https://t.co/dxmHRBOLG6,cameli,,,78807310,oaltoacre,,,0,0,Wed Aug 25 2021 19:47:27 GMT-0300 (Brasilia Standard Time),Thu Aug 19 2021 04:12:39 GMT-0300 (Brasilia Standard Time)
@derralfbaer Cameli contra carrum currunt. 😂,cameli,,,389617337,Murmel13,,,0,0,Wed Aug 25 2021 19:47:27 GMT-0300 (Brasilia Standard Time),Thu Aug 19 2021 02:41:37 GMT-0300 (Brasilia Standard Time)
Gladson Cameli anuncia convocação de 100 aprovados no concurso do Idaf https://t.co/if8nU3VHHp,cameli,,,53193772,juruaonline,,,0,0,Wed Aug 25 2021 19:47:27 GMT-0300 (Brasilia Standard Time),Wed Aug 18 2021 22:22:22 GMT-0300 (Brasilia Standard Time)
A união vai continuar: Senadora Mailza e deputado Bestene se unem com o senador Petecão para derrotar Gladson Camel… https://t.co/q67w20z04T,cameli,,,714990550462644200,3dejulhonoticia,,,0,0,Wed Aug 25 2021 19:47:27 GMT-0300 (Brasilia Standard Time),Wed Aug 18 2021 17:46:34 GMT-0300 (Brasilia Standard Time)
"Enquanto isso, Gladson Cameli no novenário… https://t.co/dB7DijbEOt",cameli,,,116949597,AGazetadoAcre,,,0,0,Wed Aug 25 2021 19:47:27 GMT-0300 (Brasilia Standard Time),Wed Aug 18 2021 17:13:35 GMT-0300 (Brasilia Standard Time)
"O homem tem moral no governo Cameli!! Sem qualificação técnica, Roxinho é nomeado pelo governo Gladson para direção… https://t.co/hVq7S5skCW",cameli,,,714990550462644200,3dejulhonoticia,,,0,0,Wed Aug 25 2021 19:47:27 GMT-0300 (Brasilia Standard Time),Wed Aug 18 2021 17:12:53 GMT-0300 (Brasilia Standard Time)
@folha Modernidade que lembra o tempo dos coronéis . Em 13/5/ 97 a Folha publica : Ronivon https://t.co/rcmUCtF7NU… https://t.co/mRjicg6guv,cameli,,,1176605966839799800,ricardo1_leoni,,,0,0,Wed Aug 25 2021 19:47:27 GMT-0300 (Brasilia Standard Time),Wed Aug 18 2021 17:04:30 GMT-0300 (Brasilia Standard Time)
Gladson Cameli anuncia convocação de 100 aprovados no concurso do Idaf https://t.co/S4oH3b9BT0,cameli,,,78807310,oaltoacre,,,0,0,Wed Aug 25 2021 19:47:27 GMT-0300 (Brasilia Standard Time),Wed Aug 18 2021 16:12:43 GMT-0300 (Brasilia Standard Time)
"Tome vergonha na cara, governador!! Vem para um desfile e sai requebrando no meio da rua, inaugura tomógrafo em Bra… https://t.co/6xYQb58cOE",cameli,,,714990550462644200,3dejulhonoticia,,,0,0,Wed Aug 25 2021 19:47:27 GMT-0300 (Brasilia Standard Time),Wed Aug 18 2021 08:43:23 GMT-0300 (Brasilia Standard Time)
Preciso dormir e não conseguindo bosta,cameli,,,847240901382463500,Jim_Cameli,,,0,0,Wed Aug 25 2021 19:47:27 GMT-0300 (Brasilia Standard Time),Wed Aug 18 2021 01:02:56 GMT-0300 (Brasilia Standard Time)
Em qualquer foto de perfil https://t.co/zvHHddpmpE,cameli,,,847240901382463500,Jim_Cameli,,,0,1,Wed Aug 25 2021 19:47:27 GMT-0300 (Brasilia Standard Time),Wed Aug 18 2021 00:59:44 GMT-0300 (Brasilia Standard Time)
"Jogar the last of us da uma ansiedade inexplicável
Parece mais uma agonia",cameli,,,847240901382463500,Jim_Cameli,,,0,1,Wed Aug 25 2021 19:47:27 GMT-0300 (Brasilia Standard Time),Wed Aug 18 2021 00:49:28 GMT-0300 (Brasilia Standard Time)
Tem um ex-comunista atacando antigo companheiros e camaradas. Não tem moral. O açougueiro Rui Birico tem muito mais… https://t.co/9S6WMI4hZe,cameli,,,71278577,leonildorosas,,,0,1,Wed Aug 25 2021 19:47:27 GMT-0300 (Brasilia Standard Time),Tue Aug 17 2021 20:26:55 GMT-0300 (Brasilia Standard Time)
PSDB e Kinpara decidem apoiar candidatura de Gladson Cameli https://t.co/jSH417GoEj,cameli,,,218895649,Ecos_da_Noticia,,,0,0,Wed Aug 25 2021 19:47:27 GMT-0300 (Brasilia Standard Time),Tue Aug 17 2021 19:57:26 GMT-0300 (Brasilia Standard Time)
Obras do governo Gladson Cameli garantem futuro promissor para o município de Xapuri https://t.co/8z8a0Mrlj9 https://t.co/DJrtT3a016,cameli,,,1078140235,Pagina20online,,,0,0,Wed Aug 25 2021 19:47:27 GMT-0300 (Brasilia Standard Time),Tue Aug 17 2021 19:54:46 GMT-0300 (Brasilia Standard Time)
Defendam aí o pau no cu do Tião Bocalom e do Gladson Cameli que não movem uma palha por essa merda. Doentes.,cameli,,,1163424913,PedroBSchattat,,,0,0,Wed Aug 25 2021 19:47:27 GMT-0300 (Brasilia Standard Time),Tue Aug 17 2021 19:37:32 GMT-0300 (Brasilia Standard Time)
"O respeito por Cameli e pelas CECs: Com medo de perder os cargos da família no governo, Fernanda Hassem grava vídeo… https://t.co/txhUQZLkbN",cameli,,,714990550462644200,3dejulhonoticia,,,0,0,Wed Aug 25 2021 19:47:27 GMT-0300 (Brasilia Standard Time),Tue Aug 17 2021 18:59:04 GMT-0300 (Brasilia Standard Time)
"Lista dos governadores contra o STF:

Gladson Cameli (AC)
Wilson Lima  (AM)
Caiado (GO)
Mauro Mendes (MT)
Reinaldo… https://t.co/FOLCdSeNO9",cameli,,,1415046072838332400,Avery89586650,,,0,2,Wed Aug 25 2021 19:47:27 GMT-0300 (Brasilia Standard Time),Tue Aug 17 2021 18:34:26 GMT-0300 (Brasilia Standard Time)
RT @fabiofelixdf: A informação mais importante dessa notícia é: 13 governadores não assinaram a carta em solidariedade ao STF contra os ata…,cameli,,,280699961,folkloresadness,,,85,0,Wed Aug 25 2021 19:47:27 GMT-0300 (Brasilia Standard Time),Tue Aug 17 2021 17:42:30 GMT-0300 (Brasilia Standard Time)
"#PCAC Na última semana, o governador Gladson Cameli anunciou um novo concurso e afirmou que motivo seria pela inexi… https://t.co/B9kcpH8LxB",cameli,,,825688585605173200,rolandonaposse,,,0,1,Wed Aug 25 2021 19:47:27 GMT-0300 (Brasilia Standard Time),Tue Aug 17 2021 17:05:06 GMT-0300 (Brasilia Standard Time)
"RT @curimim: Não endossaram o manifesto os governadores Gladson Cameli (PP) do Acre, Wilson Lima (PSC) do Amazonas, Ronaldo Caiado (DEM) de…",cameli,,,1918176578,cludio_top02,,,3,0,Wed Aug 25 2021 19:47:27 GMT-0300 (Brasilia Standard Time),Tue Aug 17 2021 15:19:48 GMT-0300 (Brasilia Standard Time)
"RT @curimim: Não endossaram o manifesto os governadores Gladson Cameli (PP) do Acre, Wilson Lima (PSC) do Amazonas, Ronaldo Caiado (DEM) de…",cameli,,,1256394769808404500,SoaresBaima,,,3,0,Wed Aug 25 2021 19:47:27 GMT-0300 (Brasilia Standard Time),Tue Aug 17 2021 14:50:22 GMT-0300 (Brasilia Standard Time)
"RT @curimim: Não endossaram o manifesto os governadores Gladson Cameli (PP) do Acre, Wilson Lima (PSC) do Amazonas, Ronaldo Caiado (DEM) de…",cameli,,,1254800869801017300,FabioIzFe,,,3,0,Wed Aug 25 2021 19:47:27 GMT-0300 (Brasilia Standard Time),Tue Aug 17 2021 14:46:14 GMT-0300 (Brasilia Standard Time)
"Não endossaram o manifesto os governadores Gladson Cameli (PP) do Acre, Wilson Lima (PSC) do Amazonas, Ronaldo Caia… https://t.co/kQ9nva9GyU",cameli,,,216515869,curimim,,,3,11,Wed Aug 25 2021 19:47:27 GMT-0300 (Brasilia Standard Time),Tue Aug 17 2021 14:45:30 GMT-0300 (Brasilia Standard Time)
