text,query,country,city,userId,username,quote_count,reply_count,retweet_count,favorite_count,timestamp,createdAt
"Duas pautas que precisam ser retomadas, o fim do foro privilegiado e a volta da execução da condenação em segunda i… https://t.co/1gJjZPnflL",1113094855281008641,,,1113094855281008600,SF_Moro,,,1732,14617,Mon Aug 09 2021 13:40:37 GMT-0300 (Brasilia Standard Time),Thu Aug 05 2021 20:57:37 GMT-0300 (Brasilia Standard Time)
"Obrigado a todos pelas mensagens de carinho, incentivo e de #ParabensMoro
Desejo o dobro para cada um, vida longa e próspera.",1113094855281008641,,,1113094855281008600,SF_Moro,,,998,21366,Mon Aug 09 2021 13:40:37 GMT-0300 (Brasilia Standard Time),Sun Aug 01 2021 16:29:35 GMT-0300 (Brasilia Standard Time)
"Meu artigo da semana na @RevistaCrusoe . Alguns dizem que,para se ter governabilidade,precisa-se ceder à corrupção.… https://t.co/Y4dtPXIjBB",1113094855281008641,,,1113094855281008600,SF_Moro,,,1409,11530,Mon Aug 09 2021 13:40:37 GMT-0300 (Brasilia Standard Time),Fri Jul 30 2021 13:08:44 GMT-0300 (Brasilia Standard Time)
Cool for Brazilians https://t.co/mG43mpbJj8,1113094855281008641,,,1113094855281008600,SF_Moro,,,1031,12306,Mon Aug 09 2021 13:40:37 GMT-0300 (Brasilia Standard Time),Mon Jul 26 2021 22:42:45 GMT-0300 (Brasilia Standard Time)
"RT @paulo_avante10: Thomas Edison fez 2.000 mil experiências para conseguir
inventar a lâmpada.
Um jovem repórter o perguntou o que ele ach…",1113094855281008641,,,1113094855281008600,SF_Moro,,,306,0,Mon Aug 09 2021 13:40:37 GMT-0300 (Brasilia Standard Time),Sun Jul 18 2021 22:21:07 GMT-0300 (Brasilia Standard Time)
Vou imitar parcialmente o grande Ministro ⁦@LRobertoBarroso⁩ . Dica da semana para leitura (viagens são uma boa oca… https://t.co/PpcYx6yIuB,1113094855281008641,,,1113094855281008600,SF_Moro,,,728,9288,Mon Aug 09 2021 13:40:37 GMT-0300 (Brasilia Standard Time),Sun Jul 18 2021 14:35:52 GMT-0300 (Brasilia Standard Time)
"RT @alvarodias_: R$ 5,7 bilhões dariam pra imunizar totalmente mais de 84% dos brasileiros. Mas o Congresso quer disponibilizar este valor…",1113094855281008641,,,1113094855281008600,SF_Moro,,,638,0,Mon Aug 09 2021 13:40:37 GMT-0300 (Brasilia Standard Time),Sat Jul 17 2021 22:35:10 GMT-0300 (Brasilia Standard Time)
"As pessoas que se arriscam a denunciar crimes de corrupção ou fraudes corporativas, os chamados whistleblowers, pre… https://t.co/cN29nGxWUd",1113094855281008641,,,1113094855281008600,SF_Moro,,,951,8372,Mon Aug 09 2021 13:40:37 GMT-0300 (Brasilia Standard Time),Fri Jul 02 2021 15:00:26 GMT-0300 (Brasilia Standard Time)
"Parabéns ao Governador @EduardoLeite_ pela declaração corajosa, ainda incomum no Brasil. É importante quebrar barreiras e preconceitos.",1113094855281008641,,,1113094855281008600,SF_Moro,,,1064,21307,Mon Aug 09 2021 13:40:37 GMT-0300 (Brasilia Standard Time),Fri Jul 02 2021 10:01:03 GMT-0300 (Brasilia Standard Time)
"RT @Ricamconsult: Quadra central de Wimbledon, hoje, quando houve o anúncio da presença de Sarah Gilbert, desenvolvedora da vacina de Oxfor…",1113094855281008641,,,1113094855281008600,SF_Moro,,,736,0,Mon Aug 09 2021 13:40:37 GMT-0300 (Brasilia Standard Time),Tue Jun 29 2021 00:27:08 GMT-0300 (Brasilia Standard Time)
"No projeto de lei anticrime,propusemos que presos perigosos só obteriam progressão de regime se presentes condições… https://t.co/6NvcN5J6Dt",1113094855281008641,,,1113094855281008600,SF_Moro,,,2518,20370,Mon Aug 09 2021 13:40:37 GMT-0300 (Brasilia Standard Time),Mon Jun 28 2021 16:48:54 GMT-0300 (Brasilia Standard Time)
Participei de painel sobre o papel do setor privado na prevenção e repressão à corrupção. Há uma tendência internac… https://t.co/9MAwveyQuD,1113094855281008641,,,1113094855281008600,SF_Moro,,,974,10200,Mon Aug 09 2021 13:40:37 GMT-0300 (Brasilia Standard Time),Fri Jun 25 2021 13:30:37 GMT-0300 (Brasilia Standard Time)
"Os votos dos Mins.Fachin, Barroso, Marco Aurélio e Fux,não reconhecendo vícios ou parcialidade na condenação por co… https://t.co/9EYuYC71sD",1113094855281008641,,,1113094855281008600,SF_Moro,,,3546,32127,Mon Aug 09 2021 13:40:37 GMT-0300 (Brasilia Standard Time),Wed Jun 23 2021 16:36:54 GMT-0300 (Brasilia Standard Time)
Trato na @RevistaCrusoe das alterações na lei de improbidade. As mudanças aprovadas pela Câmara passaram do ponto d… https://t.co/7jki2Lv6QF,1113094855281008641,,,1113094855281008600,SF_Moro,,,953,6233,Mon Aug 09 2021 13:40:37 GMT-0300 (Brasilia Standard Time),Fri Jun 18 2021 10:12:04 GMT-0300 (Brasilia Standard Time)
Mais de cem lideranças de quarenta países assinaram manifesto pela criação de uma Corte Internacional Anticorrupção… https://t.co/QWfQHYD4Sw,1113094855281008641,,,1113094855281008600,SF_Moro,,,934,7246,Mon Aug 09 2021 13:40:37 GMT-0300 (Brasilia Standard Time),Fri Jun 11 2021 15:20:49 GMT-0300 (Brasilia Standard Time)
Sobre silêncios ou mentiras em depoimentos em processos ou em CPI. https://t.co/a6F6R2rSVN,1113094855281008641,,,1113094855281008600,SF_Moro,,,804,7411,Mon Aug 09 2021 13:40:37 GMT-0300 (Brasilia Standard Time),Mon Jun 07 2021 10:39:29 GMT-0300 (Brasilia Standard Time)
Triste o falecimento do ex-Prefeito e ex-Governador Jaime Lerner. Minha solidariedade aos familiares. Como arquitet… https://t.co/PxWGHIlEKd,1113094855281008641,,,1113094855281008600,SF_Moro,,,297,4115,Mon Aug 09 2021 13:40:37 GMT-0300 (Brasilia Standard Time),Thu May 27 2021 09:28:45 GMT-0300 (Brasilia Standard Time)
"Como tenho dito, é hora do setor privado assumir a liderança em programas de integridade e na prevenção à corrupção… https://t.co/hDyDFVyQey",1113094855281008641,,,1113094855281008600,SF_Moro,,,868,10428,Mon Aug 09 2021 13:40:37 GMT-0300 (Brasilia Standard Time),Thu May 27 2021 09:15:05 GMT-0300 (Brasilia Standard Time)
@lfdavilaoficial @Kennedy_School Parabéns @lfdavilaoficial . Importante reconhecimento.,1113094855281008641,,,1113094855281008600,SF_Moro,,,7,141,Mon Aug 09 2021 13:40:37 GMT-0300 (Brasilia Standard Time),Sun May 23 2021 14:49:39 GMT-0300 (Brasilia Standard Time)
Boa matéria no OGlobo de hoje sobre o avanço na adoção de políticas anticorrupção pelas empresas independentemente… https://t.co/aZ4M9hudiy,1113094855281008641,,,1113094855281008600,SF_Moro,,,773,7377,Mon Aug 09 2021 13:40:37 GMT-0300 (Brasilia Standard Time),Sun May 23 2021 11:40:36 GMT-0300 (Brasilia Standard Time)
"Em meu artigo da Revista Crusoé, trato do movimento pela criação de uma Corte Internacional Anticorrupção, um mecan… https://t.co/L8jVGXI4Df",1113094855281008641,,,1113094855281008600,SF_Moro,,,1017,9317,Mon Aug 09 2021 13:40:37 GMT-0300 (Brasilia Standard Time),Fri May 21 2021 09:07:18 GMT-0300 (Brasilia Standard Time)
Registro meus pesares pelo falecimento do Procurador da República Alessandro José Fernandes de Oliveira que estava… https://t.co/9QrAMB6h8t,1113094855281008641,,,1113094855281008600,SF_Moro,,,442,6796,Mon Aug 09 2021 13:40:37 GMT-0300 (Brasilia Standard Time),Thu May 20 2021 21:48:32 GMT-0300 (Brasilia Standard Time)
Tive uma boa conversa no podcast (H)Ola Compliance com Matt Ellis e Gregory Bates sobre tendências de compliance e… https://t.co/V478JjNdub,1113094855281008641,,,1113094855281008600,SF_Moro,,,664,6775,Mon Aug 09 2021 13:40:37 GMT-0300 (Brasilia Standard Time),Fri May 14 2021 11:31:33 GMT-0300 (Brasilia Standard Time)
Parabéns à Revista Crusoé pelos três anos de existência. Precisamos cultivar mais a liberdade de imprensa e a impre… https://t.co/1iYmQiQaj6,1113094855281008641,,,1113094855281008600,SF_Moro,,,644,7639,Mon Aug 09 2021 13:40:37 GMT-0300 (Brasilia Standard Time),Fri May 07 2021 09:13:48 GMT-0300 (Brasilia Standard Time)
"Fique firme @DaniloGentili . Melhoras. Todos precisam se cuidar, máscara, distanciamento social e higienização. Mas… https://t.co/K5crr3msQD",1113094855281008641,,,1113094855281008600,SF_Moro,,,667,15628,Mon Aug 09 2021 13:40:37 GMT-0300 (Brasilia Standard Time),Tue May 04 2021 08:55:06 GMT-0300 (Brasilia Standard Time)
"O avanço mundial e progressivo de políticas anticorrupção é infalível. É necessário ter um pouco de fé, mesmo em mo… https://t.co/qU8vNm4wHg",1113094855281008641,,,1113094855281008600,SF_Moro,,,968,9795,Mon Aug 09 2021 13:40:37 GMT-0300 (Brasilia Standard Time),Thu Apr 29 2021 21:01:08 GMT-0300 (Brasilia Standard Time)
"@paulo_avante10 Olá Paulo, recebi o seu vídeo, obrigado pelas palavras gentis. Sigo firme nos meus ideais, fique tr… https://t.co/2iS7W313zK",1113094855281008641,,,1113094855281008600,SF_Moro,,,371,9517,Mon Aug 09 2021 13:40:37 GMT-0300 (Brasilia Standard Time),Sat Apr 10 2021 22:07:01 GMT-0300 (Brasilia Standard Time)
Recebi com satisfação um exemplar do novo livro do Prof Modesto Carvalhosa defendendo “Uma nova Constituição para o… https://t.co/IByUPjfLt2,1113094855281008641,,,1113094855281008600,SF_Moro,,,1497,20015,Mon Aug 09 2021 13:40:37 GMT-0300 (Brasilia Standard Time),Sat Apr 03 2021 12:33:46 GMT-0300 (Brasilia Standard Time)
Importante mensagem in memoriam do Senador @majorolimpio https://t.co/LnIWrqbGgt,1113094855281008641,,,1113094855281008600,SF_Moro,,,1309,16032,Mon Aug 09 2021 13:40:37 GMT-0300 (Brasilia Standard Time),Sat Mar 27 2021 17:49:59 GMT-0300 (Brasilia Standard Time)
Sobre a Lava Jato e o combate à corrupção https://t.co/8KaVhiBKjM,1113094855281008641,,,1113094855281008600,SF_Moro,,,8400,63950,Mon Aug 09 2021 13:40:37 GMT-0300 (Brasilia Standard Time),Wed Mar 24 2021 14:57:02 GMT-0300 (Brasilia Standard Time)
"Registro as minhas homenagens pessoais ao Senador Major Olímpio, um grande homem público. Minha solidariedade à fam… https://t.co/A7NWtue1rY",1113094855281008641,,,1113094855281008600,SF_Moro,,,1182,17338,Mon Aug 09 2021 13:40:37 GMT-0300 (Brasilia Standard Time),Thu Mar 18 2021 16:34:47 GMT-0300 (Brasilia Standard Time)
RT @RevistaCrusoe: Leia o artigo de @SF_Moro na nova edição da revista Crusoé. https://t.co/0O4IfDhTJG https://t.co/G2qfEznh6R,1113094855281008641,,,1113094855281008600,SF_Moro,,,402,0,Mon Aug 09 2021 13:40:37 GMT-0300 (Brasilia Standard Time),Fri Mar 12 2021 23:53:46 GMT-0300 (Brasilia Standard Time)
"Repudio ofensas e ataques pessoais ao Ministro Edson Fachin do STF, magistrado técnico e com atuação destacada na O… https://t.co/9nl40iOaoL",1113094855281008641,,,1113094855281008600,SF_Moro,,,2179,31559,Mon Aug 09 2021 13:40:37 GMT-0300 (Brasilia Standard Time),Fri Mar 12 2021 13:22:51 GMT-0300 (Brasilia Standard Time)
Estarei hoje conversando com o Promotor Affonso Ghizzo Neto sobre o papel do cidadão e do setor privado no combate… https://t.co/7YDdt1mDLY,1113094855281008641,,,1113094855281008600,SF_Moro,,,877,9551,Mon Aug 09 2021 13:40:37 GMT-0300 (Brasilia Standard Time),Mon Mar 01 2021 14:53:28 GMT-0300 (Brasilia Standard Time)
Manifestação de apoio à Operação Lava Jato em Curitiba. https://t.co/ggqDtXHOll,1113094855281008641,,,1113094855281008600,SF_Moro,,,2337,27756,Mon Aug 09 2021 13:40:37 GMT-0300 (Brasilia Standard Time),Sat Feb 20 2021 23:39:31 GMT-0300 (Brasilia Standard Time)
"Nenhum país pode se envergonhar de combater a corrupção. A vergonha reside na tolerância, não na correção.
https://t.co/Pf6oGkOBn0",1113094855281008641,,,1113094855281008600,SF_Moro,,,1861,13516,Mon Aug 09 2021 13:40:37 GMT-0300 (Brasilia Standard Time),Mon Feb 15 2021 18:39:47 GMT-0300 (Brasilia Standard Time)
Reponho no artigo da Crusoé desta semana a verdade sobre a Operação Lava Jato. Apesar das tentativas de desacreditá… https://t.co/mM4t1LjC49,1113094855281008641,,,1113094855281008600,SF_Moro,,,1707,12624,Mon Aug 09 2021 13:40:37 GMT-0300 (Brasilia Standard Time),Fri Feb 12 2021 18:29:42 GMT-0300 (Brasilia Standard Time)
Registro minhas homenagens ao grande advogado e jurista paranaense René Dotti. Minha solidariedade à família pelo f… https://t.co/zDozcppSl2,1113094855281008641,,,1113094855281008600,SF_Moro,,,395,6180,Mon Aug 09 2021 13:40:37 GMT-0300 (Brasilia Standard Time),Thu Feb 11 2021 12:22:20 GMT-0300 (Brasilia Standard Time)
Participarei do webinar acadêmico promovido pelo Prof. Samuel Mamede da Universidade Mackenzie sobre lições e legad… https://t.co/rmzhWc6HIz,1113094855281008641,,,1113094855281008600,SF_Moro,,,814,7515,Mon Aug 09 2021 13:40:37 GMT-0300 (Brasilia Standard Time),Mon Feb 08 2021 17:41:20 GMT-0300 (Brasilia Standard Time)
Sobre as supostas mensagens obtidas por meios criminosos nas incessantes tentativas de anular condenações por crime… https://t.co/ph2O5vdUVt,1113094855281008641,,,1113094855281008600,SF_Moro,,,1562,12652,Mon Aug 09 2021 13:40:37 GMT-0300 (Brasilia Standard Time),Mon Feb 01 2021 17:54:07 GMT-0300 (Brasilia Standard Time)
"Forte e correto discurso do Presidente do STF, Min. Luiz Fux, a luz da ciência é imprescindível para vencer a pande… https://t.co/0vddhoMnYM",1113094855281008641,,,1113094855281008600,SF_Moro,,,853,8126,Mon Aug 09 2021 13:40:37 GMT-0300 (Brasilia Standard Time),Mon Feb 01 2021 13:15:53 GMT-0300 (Brasilia Standard Time)
"Meu novo artigo na Crusoé é sobre as esperanças com a chegada de 2021, mas tem algumas ressalvas.
https://t.co/CzC7iOwfUp",1113094855281008641,,,1113094855281008600,SF_Moro,,,696,6729,Mon Aug 09 2021 13:40:37 GMT-0300 (Brasilia Standard Time),Fri Jan 29 2021 13:45:24 GMT-0300 (Brasilia Standard Time)
"Assistindo o ⁦Manhattan Connection, agora na TV Cultura. Excelente. #ManhattanConnection https://t.co/tEA7ZRwtjX",1113094855281008641,,,1113094855281008600,SF_Moro,,,545,10244,Mon Aug 09 2021 13:40:37 GMT-0300 (Brasilia Standard Time),Wed Jan 20 2021 23:16:39 GMT-0300 (Brasilia Standard Time)
A aprovação da Coronavac pela Anvisa e o início da vacinação contra a Covid pelo Governo de São Paulo mostram que p… https://t.co/Cee8Cy9eky,1113094855281008641,,,1113094855281008600,SF_Moro,,,1859,26823,Mon Aug 09 2021 13:40:37 GMT-0300 (Brasilia Standard Time),Sun Jan 17 2021 19:01:42 GMT-0300 (Brasilia Standard Time)
Consternado com a situação de Manaus. Minha solidariedade às vítimas e às famílias. Manaus é o Brasil amanhã se não… https://t.co/Grth4zSQLi,1113094855281008641,,,1113094855281008600,SF_Moro,,,2035,26802,Mon Aug 09 2021 13:40:37 GMT-0300 (Brasilia Standard Time),Fri Jan 15 2021 22:08:37 GMT-0300 (Brasilia Standard Time)
Leio há semanas no Lauro Jardim informações sobre o que eu supostamente irei fazer da minha vida no futuro e public… https://t.co/a6Jud44xdF,1113094855281008641,,,1113094855281008600,SF_Moro,,,1396,23381,Mon Aug 09 2021 13:40:37 GMT-0300 (Brasilia Standard Time),Sun Jan 10 2021 11:30:36 GMT-0300 (Brasilia Standard Time)
De se comemorar os resultados dos testes da vacina Coronavac desenvolvida pelo Instituto Butantan e congratular o G… https://t.co/FjDTMJycdl,1113094855281008641,,,1113094855281008600,SF_Moro,,,1489,22259,Mon Aug 09 2021 13:40:37 GMT-0300 (Brasilia Standard Time),Thu Jan 07 2021 16:06:08 GMT-0300 (Brasilia Standard Time)
"Vejo que o Gov do RJ escolheu Luciano Mattos como novo Procurador Geral de Justiça, o mais votado da lista tríplice… https://t.co/ZL4Eb8Pc7J",1113094855281008641,,,1113094855281008600,SF_Moro,,,889,14900,Mon Aug 09 2021 13:40:37 GMT-0300 (Brasilia Standard Time),Wed Jan 06 2021 21:59:35 GMT-0300 (Brasilia Standard Time)
"Ano novo é tempo de olhar o futuro sem esquecer do passado. Abaixo, homenagem a minha cidade natal, Maringá, música… https://t.co/LkbvQ4e81I",1113094855281008641,,,1113094855281008600,SF_Moro,,,567,9007,Mon Aug 09 2021 13:40:37 GMT-0300 (Brasilia Standard Time),Thu Dec 31 2020 10:16:15 GMT-0300 (Brasilia Standard Time)
"Ministro, o senhor nem teve autonomia de escolher o Diretor da PF ou de defender a execução da pena da condenação e… https://t.co/L2Z45Bp6h4",1113094855281008641,,,1113094855281008600,SF_Moro,,,2099,23848,Mon Aug 09 2021 13:40:37 GMT-0300 (Brasilia Standard Time),Mon Dec 28 2020 20:43:03 GMT-0300 (Brasilia Standard Time)
"Vários países, inclusive da América Latina, já estão vacinando seus nacionais contra a COVID-19. Onde está a vacina… https://t.co/DYJwZySToS",1113094855281008641,,,1113094855281008600,SF_Moro,,,3858,35871,Mon Aug 09 2021 13:40:37 GMT-0300 (Brasilia Standard Time),Mon Dec 28 2020 16:57:29 GMT-0300 (Brasilia Standard Time)
"RT @SamPancher: As vezes acompanhar certas coisas de perto faz a gente perder um pouco do senso do absurdo.

Bem, esse vídeo ajuda muito a…",1113094855281008641,,,1113094855281008600,SF_Moro,,,12151,0,Mon Aug 09 2021 13:40:37 GMT-0300 (Brasilia Standard Time),Mon Dec 28 2020 14:13:08 GMT-0300 (Brasilia Standard Time)
"Aos amigos e amigas, um Feliz Natal, cheio de paz e esperança, e que tenhamos a vacina como o maior presente em 2021.",1113094855281008641,,,1113094855281008600,SF_Moro,,,937,25969,Mon Aug 09 2021 13:40:37 GMT-0300 (Brasilia Standard Time),Thu Dec 24 2020 18:25:05 GMT-0300 (Brasilia Standard Time)
"Em novo artigo na Crusoé, destaco a importância para o Estado moderno de uma burocracia profissional e que tenha pr… https://t.co/CqF16Y6wSR",1113094855281008641,,,1113094855281008600,SF_Moro,,,660,6776,Mon Aug 09 2021 13:40:37 GMT-0300 (Brasilia Standard Time),Sat Dec 19 2020 22:10:10 GMT-0300 (Brasilia Standard Time)
A Verdade e não a propaganda prevalecerá.,1113094855281008641,,,1113094855281008600,SF_Moro,,,1744,20548,Mon Aug 09 2021 13:40:37 GMT-0300 (Brasilia Standard Time),Fri Dec 18 2020 17:00:22 GMT-0300 (Brasilia Standard Time)
"Projeto de lei mal feito tecnicamente, que prejudica a advocacia honesta e que não precisa de blindagem jurídica. M… https://t.co/D3mbVyasXQ",1113094855281008641,,,1113094855281008600,SF_Moro,,,948,9307,Mon Aug 09 2021 13:40:37 GMT-0300 (Brasilia Standard Time),Tue Dec 15 2020 22:49:32 GMT-0300 (Brasilia Standard Time)
Registro minha solidariedade à @TI_InterBr em relação aos ataques injustos contra ela realizados. A Transparência I… https://t.co/v7Y1sg1XeI,1113094855281008641,,,1113094855281008600,SF_Moro,,,439,4770,Mon Aug 09 2021 13:40:37 GMT-0300 (Brasilia Standard Time),Fri Dec 11 2020 09:38:13 GMT-0300 (Brasilia Standard Time)
O dia 09 de dezembro é o Dia Internacional de Combate à Corrupção. Pouco a comemorar em avanços no setor público no… https://t.co/d1iacmPtfp,1113094855281008641,,,1113094855281008600,SF_Moro,,,883,15525,Mon Aug 09 2021 13:40:37 GMT-0300 (Brasilia Standard Time),Wed Dec 09 2020 22:23:30 GMT-0300 (Brasilia Standard Time)
Parabéns ao grupo @BrasConsciente . A luta contra a corrupção e pela integridade na gestão da coisa pública segue n… https://t.co/n2sYMckW5G,1113094855281008641,,,1113094855281008600,SF_Moro,,,432,4677,Mon Aug 09 2021 13:40:37 GMT-0300 (Brasilia Standard Time),Tue Dec 08 2020 10:47:16 GMT-0300 (Brasilia Standard Time)
"“Breve interlúdio”, meu novo artigo na Crusoé. Empresas podem fazer a diferença em políticas anticorrupção e  de in… https://t.co/0w86gPXhus",1113094855281008641,,,1113094855281008600,SF_Moro,,,475,5625,Mon Aug 09 2021 13:40:37 GMT-0300 (Brasilia Standard Time),Fri Dec 04 2020 09:46:28 GMT-0300 (Brasilia Standard Time)
"Dividirei, logo mais, com Laura Alonso e outros painel na NY City Bar (o equivalente deles à OAB) sobre os desafios… https://t.co/zc5la3XfgX",1113094855281008641,,,1113094855281008600,SF_Moro,,,491,7450,Mon Aug 09 2021 13:40:37 GMT-0300 (Brasilia Standard Time),Wed Dec 02 2020 20:06:44 GMT-0300 (Brasilia Standard Time)
A agenda anticorrupção continua no setor privado. Auxiliar as empresas em políticas de integridade e em fazer o que… https://t.co/EocAG0TLSj,1113094855281008641,,,1113094855281008600,SF_Moro,,,724,13603,Mon Aug 09 2021 13:40:37 GMT-0300 (Brasilia Standard Time),Wed Dec 02 2020 08:59:18 GMT-0300 (Brasilia Standard Time)
Ingresso nos quadros da renomada empresa de consultoria internacional Alvarez&amp;Marsal para ajudar as empresas a faze… https://t.co/bHuywesqwM,1113094855281008641,,,1113094855281008600,SF_Moro,,,645,11046,Mon Aug 09 2021 13:40:37 GMT-0300 (Brasilia Standard Time),Mon Nov 30 2020 10:19:12 GMT-0300 (Brasilia Standard Time)
@depjpassarinho Obrigado Deputado. Sucesso no Congresso.,1113094855281008641,,,1113094855281008600,SF_Moro,,,0,41,Mon Aug 09 2021 13:40:37 GMT-0300 (Brasilia Standard Time),Sun Nov 29 2020 15:57:09 GMT-0300 (Brasilia Standard Time)
Livro da minha escritora favorita e um café. https://t.co/SjwpOhpaTY,1113094855281008641,,,1113094855281008600,SF_Moro,,,699,17792,Mon Aug 09 2021 13:40:37 GMT-0300 (Brasilia Standard Time),Sat Nov 28 2020 10:29:05 GMT-0300 (Brasilia Standard Time)
"Mais tarde, uma conversa com aqueles que nunca desistem de lutar pela integridade. https://t.co/ucHOqLoZPG",1113094855281008641,,,1113094855281008600,SF_Moro,,,533,7412,Mon Aug 09 2021 13:40:37 GMT-0300 (Brasilia Standard Time),Wed Nov 25 2020 10:45:59 GMT-0300 (Brasilia Standard Time)
Agora https://t.co/FTUzLTFBZK,1113094855281008641,,,1113094855281008600,SF_Moro,,,302,5467,Mon Aug 09 2021 13:40:37 GMT-0300 (Brasilia Standard Time),Tue Nov 24 2020 17:56:35 GMT-0300 (Brasilia Standard Time)
"Hoje, 23/11, no Conversa com Bial, depois do Jornal da Globo. https://t.co/7NadTPfukD",1113094855281008641,,,1113094855281008600,SF_Moro,,,311,5768,Mon Aug 09 2021 13:40:37 GMT-0300 (Brasilia Standard Time),Mon Nov 23 2020 22:57:52 GMT-0300 (Brasilia Standard Time)
"Como uma das medidas necessárias para proteger a democracia, defendo, neste último artigo da Revista Crusoé, o fim… https://t.co/leQApFHzgC",1113094855281008641,,,1113094855281008600,SF_Moro,,,782,10003,Mon Aug 09 2021 13:40:37 GMT-0300 (Brasilia Standard Time),Mon Nov 23 2020 12:11:52 GMT-0300 (Brasilia Standard Time)
"20 de novembro,dia da Consciência Negra,e o destaque do noticiário é o espancamento e morte de João Alberto Silveir… https://t.co/JROvTn1bok",1113094855281008641,,,1113094855281008600,SF_Moro,,,864,16178,Mon Aug 09 2021 13:40:37 GMT-0300 (Brasilia Standard Time),Fri Nov 20 2020 12:21:11 GMT-0300 (Brasilia Standard Time)
"@curtaramiro Muito bem vereador. A causa anticorrupção é internacional, mas as ações relevantes começam nas cidades.",1113094855281008641,,,1113094855281008600,SF_Moro,,,63,1076,Mon Aug 09 2021 13:40:37 GMT-0300 (Brasilia Standard Time),Wed Nov 18 2020 18:03:20 GMT-0300 (Brasilia Standard Time)
"@luciakind Não sei dizer o que aconteceu, Lucia. Mas obrigado pelo apoio.",1113094855281008641,,,1113094855281008600,SF_Moro,,,7,398,Mon Aug 09 2021 13:40:37 GMT-0300 (Brasilia Standard Time),Wed Nov 18 2020 17:19:00 GMT-0300 (Brasilia Standard Time)
Precisamos retomar a agenda anticorrupção com urgência. Faz parte das reformas de modernização do setor público e d… https://t.co/M4nkGCo55o,1113094855281008641,,,1113094855281008600,SF_Moro,,,698,9206,Mon Aug 09 2021 13:40:37 GMT-0300 (Brasilia Standard Time),Wed Nov 18 2020 15:55:15 GMT-0300 (Brasilia Standard Time)
"@GenSantosCruz é general de divisão do Exército,com várias condecorações.Comandou forças da ONU no Haiti e no Congo… https://t.co/re54jyN18r",1113094855281008641,,,1113094855281008600,SF_Moro,,,513,4355,Mon Aug 09 2021 13:40:37 GMT-0300 (Brasilia Standard Time),Mon Nov 16 2020 22:21:32 GMT-0300 (Brasilia Standard Time)
"O resultado das eleições municipais foi fragmentado,sem um claro vencedor nacional,o que sinaliza a prevalência do… https://t.co/PAUecr0pa7",1113094855281008641,,,1113094855281008600,SF_Moro,,,912,19874,Mon Aug 09 2021 13:40:37 GMT-0300 (Brasilia Standard Time),Sun Nov 15 2020 20:40:09 GMT-0300 (Brasilia Standard Time)
É simbólico que a eleição deste 15/11 ocorra no mesmo dia do aniversário da República.O eleitor é responsável pelo… https://t.co/ZDhV1VFexq,1113094855281008641,,,1113094855281008600,SF_Moro,,,1407,22356,Mon Aug 09 2021 13:40:37 GMT-0300 (Brasilia Standard Time),Sun Nov 15 2020 07:44:26 GMT-0300 (Brasilia Standard Time)
"A Gazeta do Povo faz reportagens jornalísticas relevantes, como a série Diários Secretos contra a corrupção, sendo… https://t.co/KSdDzDpwll",1113094855281008641,,,1113094855281008600,SF_Moro,,,334,7691,Mon Aug 09 2021 13:40:37 GMT-0300 (Brasilia Standard Time),Thu Nov 12 2020 18:28:32 GMT-0300 (Brasilia Standard Time)
"As declarações de Rodrigo Constantino no caso Mariana Ferrer merecem total repúdio, mas não se justifica a campanha… https://t.co/RH1hWom7oR",1113094855281008641,,,1113094855281008600,SF_Moro,,,663,14472,Mon Aug 09 2021 13:40:37 GMT-0300 (Brasilia Standard Time),Thu Nov 12 2020 18:28:32 GMT-0300 (Brasilia Standard Time)
"Poderia falar sobre a polêmica envolvendo a vacina coronavac, mas prefiro retweetar um general muito respeitado por… https://t.co/sQIA0ObTCN",1113094855281008641,,,1113094855281008600,SF_Moro,,,1450,18755,Mon Aug 09 2021 13:40:37 GMT-0300 (Brasilia Standard Time),Wed Nov 11 2020 18:16:47 GMT-0300 (Brasilia Standard Time)
"With malice toward none, with charity for all. Aqueles, no Brasil, que tripudiam contra o Presidente Trump cometem… https://t.co/blgBq7JZAa",1113094855281008641,,,1113094855281008600,SF_Moro,,,707,15105,Mon Aug 09 2021 13:40:37 GMT-0300 (Brasilia Standard Time),Sat Nov 07 2020 20:09:15 GMT-0300 (Brasilia Standard Time)
A democracia norte-americana continua forte. Parabéns ao presidente eleito @JoeBiden . Brasil e US têm muito em comum e continuarão tendo.,1113094855281008641,,,1113094855281008600,SF_Moro,,,1175,27360,Mon Aug 09 2021 13:40:37 GMT-0300 (Brasilia Standard Time),Sat Nov 07 2020 16:44:51 GMT-0300 (Brasilia Standard Time)
"Novo artigo na Crusoé sobre vacinas, nova Constituição, eleições norte-americanas e política de meio ambiente. Gove… https://t.co/cjzTyBbjBy",1113094855281008641,,,1113094855281008600,SF_Moro,,,455,5297,Mon Aug 09 2021 13:40:37 GMT-0300 (Brasilia Standard Time),Fri Nov 06 2020 10:05:34 GMT-0300 (Brasilia Standard Time)
