text,query,country,city,userId,username,quote_count,reply_count,retweet_count,favorite_count,timestamp,createdAt
"Hoje, mais tarde, na Conferência Estadual da Advocacia do Mato Grosso do Sul. https://t.co/eB5xIuudRz",1113094855281008641,,,1113094855281008600,SF_Moro,,,408,6359,Mon Aug 09 2021 13:40:37 GMT-0300 (Brasilia Standard Time),Wed Nov 04 2020 07:35:52 GMT-0300 (Brasilia Standard Time)
Acompanhar a eleição norte-americana requer prudência diplomática. Não somos eleitores naquele país. Os laços entre… https://t.co/8E8Z01bwAg,1113094855281008641,,,1113094855281008600,SF_Moro,,,1185,24495,Mon Aug 09 2021 13:40:37 GMT-0300 (Brasilia Standard Time),Tue Nov 03 2020 12:06:41 GMT-0300 (Brasilia Standard Time)
"@kimpkat No among us, os impostores/assassinos vão presos no final ou é como no Brasil?",1113094855281008641,,,1113094855281008600,SF_Moro,,,1377,11779,Mon Aug 09 2021 13:40:37 GMT-0300 (Brasilia Standard Time),Sat Oct 31 2020 14:12:38 GMT-0300 (Brasilia Standard Time)
"@kimpkat Jogo eletrônico tipo “Pong”? Esse é da minha época. Se for mais recente, melhor não.",1113094855281008641,,,1113094855281008600,SF_Moro,,,62,2440,Mon Aug 09 2021 13:40:37 GMT-0300 (Brasilia Standard Time),Sat Oct 31 2020 14:01:44 GMT-0300 (Brasilia Standard Time)
@kimpkat Jogar o que?,1113094855281008641,,,1113094855281008600,SF_Moro,,,136,4828,Mon Aug 09 2021 13:40:37 GMT-0300 (Brasilia Standard Time),Sat Oct 31 2020 13:40:20 GMT-0300 (Brasilia Standard Time)
"Participarei, logo mais, de debate on line sobre o movimento anticorrupção na América Latina, promovido pelo Stigle… https://t.co/WaRPQiNWiK",1113094855281008641,,,1113094855281008600,SF_Moro,,,580,6864,Mon Aug 09 2021 13:40:37 GMT-0300 (Brasilia Standard Time),Thu Oct 29 2020 13:37:04 GMT-0300 (Brasilia Standard Time)
Participei de conferência da @ANAJURE_Oficial sobre o exercício da liberdade religiosa em tempos do Covid.Deveríamo… https://t.co/VDt180AI7o,1113094855281008641,,,1113094855281008600,SF_Moro,,,443,6269,Mon Aug 09 2021 13:40:37 GMT-0300 (Brasilia Standard Time),Thu Oct 29 2020 11:15:27 GMT-0300 (Brasilia Standard Time)
"Participei de debate da Câmara sobre a PEC199,que restabelece a execução da condenação criminal em 2ª instância,com… https://t.co/B8ZLDDTXE8",1113094855281008641,,,1113094855281008600,SF_Moro,,,599,6470,Mon Aug 09 2021 13:40:37 GMT-0300 (Brasilia Standard Time),Tue Oct 27 2020 13:05:50 GMT-0300 (Brasilia Standard Time)
O que dificultou a governabilidade do Brasil nos últimos anos foi a corrupção desenfreada e a irresponsabilidade fi… https://t.co/VU5mdGKou0,1113094855281008641,,,1113094855281008600,SF_Moro,,,2329,29496,Mon Aug 09 2021 13:40:37 GMT-0300 (Brasilia Standard Time),Mon Oct 26 2020 19:14:44 GMT-0300 (Brasilia Standard Time)
"Em novo artigo na Crusoé, trato do aumento da criminalidade no primeiro semestre de 2020 e de suas possíveis causas.
https://t.co/7D2X9nqcEp",1113094855281008641,,,1113094855281008600,SF_Moro,,,621,7392,Mon Aug 09 2021 13:40:37 GMT-0300 (Brasilia Standard Time),Fri Oct 23 2020 11:28:42 GMT-0300 (Brasilia Standard Time)
"A opinião do @joaoamoedonovo sobre vacina pode ser discutível, mas deve ser respeitada. É preciso respeitar as opin… https://t.co/BZear4lMYu",1113094855281008641,,,1113094855281008600,SF_Moro,,,931,12274,Mon Aug 09 2021 13:40:37 GMT-0300 (Brasilia Standard Time),Sun Oct 18 2020 18:38:38 GMT-0300 (Brasilia Standard Time)
"Sou, com muito orgulho, filho de professores. Fizeram do ensino a sua vida. Uma boa educação é o começo para tudo.… https://t.co/WNUXmkdhb8",1113094855281008641,,,1113094855281008600,SF_Moro,,,907,13495,Mon Aug 09 2021 13:40:37 GMT-0300 (Brasilia Standard Time),Thu Oct 15 2020 13:43:37 GMT-0300 (Brasilia Standard Time)
"O debate sobre a soltura do traficante deveria incentivar a votação de boas propostas no Congresso, como a que prev… https://t.co/kdQmuep8n4",1113094855281008641,,,1113094855281008600,SF_Moro,,,2539,25035,Mon Aug 09 2021 13:40:37 GMT-0300 (Brasilia Standard Time),Tue Oct 13 2020 15:00:35 GMT-0300 (Brasilia Standard Time)
"RT @jose_neumanne: Corrupção prejudica democracia, diz Moro: Na sétima edição da série Nêumanne Entrevista no canal José Nêumanne Pinto no…",1113094855281008641,,,1113094855281008600,SF_Moro,,,460,0,Mon Aug 09 2021 13:40:37 GMT-0300 (Brasilia Standard Time),Sun Oct 11 2020 21:27:33 GMT-0300 (Brasilia Standard Time)
Importante iniciativa do STF de levar ao Plenário os inquéritos e ações penais. Essa mudança dará mais homogeneidade às decisões da Corte.,1113094855281008641,,,1113094855281008600,SF_Moro,,,1799,21531,Mon Aug 09 2021 13:40:37 GMT-0300 (Brasilia Standard Time),Thu Oct 08 2020 08:45:18 GMT-0300 (Brasilia Standard Time)
As tentativas de acabar com a Lava Jato representam a volta da corrupção. É o triunfo da velha política e dos esque… https://t.co/ChGKnmAMST,1113094855281008641,,,1113094855281008600,SF_Moro,,,7577,62522,Mon Aug 09 2021 13:40:37 GMT-0300 (Brasilia Standard Time),Wed Oct 07 2020 22:08:42 GMT-0300 (Brasilia Standard Time)
@BorgesJMarcelo @jairbolsonaro Não,1113094855281008641,,,1113094855281008600,SF_Moro,,,72,1310,Mon Aug 09 2021 13:40:37 GMT-0300 (Brasilia Standard Time),Thu Oct 01 2020 22:19:35 GMT-0300 (Brasilia Standard Time)
Participando hoje do debate sobre o fim do foro privilegiado com a Frente Ética contra a Corrupção no Congresso. https://t.co/M4U46hcFdh,1113094855281008641,,,1113094855281008600,SF_Moro,,,904,10239,Mon Aug 09 2021 13:40:37 GMT-0300 (Brasilia Standard Time),Thu Oct 01 2020 09:29:31 GMT-0300 (Brasilia Standard Time)
Congratulações à PF por esta Operação. O que avançou nos últimos anos foi o combate ao crime organizado. https://t.co/e6ItW60Wb1,1113094855281008641,,,1113094855281008600,SF_Moro,,,1188,14527,Mon Aug 09 2021 13:40:37 GMT-0300 (Brasilia Standard Time),Wed Sep 30 2020 19:22:02 GMT-0300 (Brasilia Standard Time)
Lamentável o falecimento da Justice Ruth Bader Ginsburg. Um ícone na Suprema Corte norte-americana e lutadora em pr… https://t.co/9pXL7UWNwH,1113094855281008641,,,1113094855281008600,SF_Moro,,,775,17126,Mon Aug 09 2021 13:40:37 GMT-0300 (Brasilia Standard Time),Sat Sep 19 2020 02:53:32 GMT-0300 (Brasilia Standard Time)
"Discurso muito animador do novo Presidente do STF, Ministro Luiz Fux. Independência do Judiciário, respeito a outro… https://t.co/t2RV7hsUaQ",1113094855281008641,,,1113094855281008600,SF_Moro,,,1709,21793,Mon Aug 09 2021 13:40:37 GMT-0300 (Brasilia Standard Time),Thu Sep 10 2020 18:20:12 GMT-0300 (Brasilia Standard Time)
Parabenizo toda essa brava gente brasileira que não desiste de lutar por dias melhores. https://t.co/3PL2Vv3ejM,1113094855281008641,,,1113094855281008600,SF_Moro,,,1842,27297,Mon Aug 09 2021 13:40:37 GMT-0300 (Brasilia Standard Time),Mon Sep 07 2020 14:13:23 GMT-0300 (Brasilia Standard Time)
Carreata em favor da continuidade da Lava Jato e contra a corrupção. https://t.co/0FY58PTpfC,1113094855281008641,,,1113094855281008600,SF_Moro,,,2564,26662,Mon Aug 09 2021 13:40:37 GMT-0300 (Brasilia Standard Time),Sun Sep 06 2020 16:39:17 GMT-0300 (Brasilia Standard Time)
"Concedi entrevista ao @correio e ao ⁦@em_com⁩ . Falei sobre as ameaças contra a Lava Jato, os esforços dos servidor… https://t.co/Oc0rfQXXdk",1113094855281008641,,,1113094855281008600,SF_Moro,,,1138,8648,Mon Aug 09 2021 13:40:37 GMT-0300 (Brasilia Standard Time),Sun Sep 06 2020 12:13:55 GMT-0300 (Brasilia Standard Time)
"Convido para a live ""Caminhos contra a Corrupção"", da qual participarei na 2ª feira, às 19h.É organizada pelo ⁦⁦⁦… https://t.co/5g2jetckS5",1113094855281008641,,,1113094855281008600,SF_Moro,,,1100,8845,Mon Aug 09 2021 13:40:37 GMT-0300 (Brasilia Standard Time),Fri Sep 04 2020 16:46:48 GMT-0300 (Brasilia Standard Time)
"Parabenizo o Procurador Deltan Dallagnol pela dedicação à frente da Força Tarefa da Lava Jato em Curitiba, trabalho… https://t.co/RlPqyv8Bkw",1113094855281008641,,,1113094855281008600,SF_Moro,,,2022,26377,Mon Aug 09 2021 13:40:37 GMT-0300 (Brasilia Standard Time),Tue Sep 01 2020 14:26:57 GMT-0300 (Brasilia Standard Time)
"Na minha opinião, não se justifica encerrar as Forças Tarefas do Ministério Público que atuam na Lava Jato e que ob… https://t.co/acXlU6yKmJ",1113094855281008641,,,1113094855281008600,SF_Moro,,,1908,22719,Mon Aug 09 2021 13:40:37 GMT-0300 (Brasilia Standard Time),Mon Aug 31 2020 17:17:09 GMT-0300 (Brasilia Standard Time)
"Com o empate de 2x2 no STF, fica anulada minha sentença que condenou um doleiro no caso Banestado -um marco do comb… https://t.co/SpWgjtrIbq",1113094855281008641,,,1113094855281008600,SF_Moro,,,2819,28531,Mon Aug 09 2021 13:40:37 GMT-0300 (Brasilia Standard Time),Wed Aug 26 2020 12:34:01 GMT-0300 (Brasilia Standard Time)
"Inicio nesse semestre aulas no Uniceub, em Brasília. Hoje tem uma prévia, com palestra sobre Corrupção e Estado de… https://t.co/ruBaSILqtq",1113094855281008641,,,1113094855281008600,SF_Moro,,,787,9897,Mon Aug 09 2021 13:40:37 GMT-0300 (Brasilia Standard Time),Wed Aug 26 2020 08:58:29 GMT-0300 (Brasilia Standard Time)
"A Constituição estabelece prerrogativas para os membros do MP, como a de não ser removido. Essa é a garantia para p… https://t.co/96LnOKJCUs",1113094855281008641,,,1113094855281008600,SF_Moro,,,2037,19319,Mon Aug 09 2021 13:40:37 GMT-0300 (Brasilia Standard Time),Mon Aug 17 2020 11:15:42 GMT-0300 (Brasilia Standard Time)
"Carreatas no Brasil em favor da Lava Jato. O legado da Lava Jato é do povo brasileiro que não admite corrupção, des… https://t.co/V8HafEpZF1",1113094855281008641,,,1113094855281008600,SF_Moro,,,2587,26772,Mon Aug 09 2021 13:40:37 GMT-0300 (Brasilia Standard Time),Sat Aug 15 2020 15:48:35 GMT-0300 (Brasilia Standard Time)
Novo artigo na Crusoé. https://t.co/OCGeh0QPDR,1113094855281008641,,,1113094855281008600,SF_Moro,,,1096,9066,Mon Aug 09 2021 13:40:37 GMT-0300 (Brasilia Standard Time),Fri Aug 14 2020 16:55:36 GMT-0300 (Brasilia Standard Time)
"É verdade. Política como ela é, talvez não como deveria ser. Mas talvez seja querer demais. Ou não? https://t.co/8nlOWQbQhg",1113094855281008641,,,1113094855281008600,SF_Moro,,,1784,13515,Mon Aug 09 2021 13:40:37 GMT-0300 (Brasilia Standard Time),Thu Aug 13 2020 21:46:53 GMT-0300 (Brasilia Standard Time)
"Mais tarde, no YouTube, estaremos discutindo com os Deputados Federais Alex Manente e Fábio Trad a PEC 199/2019 que… https://t.co/og28ZzV8ew",1113094855281008641,,,1113094855281008600,SF_Moro,,,915,8441,Mon Aug 09 2021 13:40:37 GMT-0300 (Brasilia Standard Time),Tue Aug 11 2020 16:10:23 GMT-0300 (Brasilia Standard Time)
"Não podemos nos conformar, nem apenas dizer #CemMilEdaí. São mais de 100 mil mortos; 100 mil famílias que perderam… https://t.co/yEThKJEhRd",1113094855281008641,,,1113094855281008600,SF_Moro,,,2916,31121,Mon Aug 09 2021 13:40:37 GMT-0300 (Brasilia Standard Time),Sat Aug 08 2020 13:55:32 GMT-0300 (Brasilia Standard Time)
"É muito importante para o combate à corrupção no país a atuação efetiva de parlamentares em defesa da Lava Jato, na… https://t.co/WODbYQYWdq",1113094855281008641,,,1113094855281008600,SF_Moro,,,1992,20406,Mon Aug 09 2021 13:40:37 GMT-0300 (Brasilia Standard Time),Thu Aug 06 2020 17:45:03 GMT-0300 (Brasilia Standard Time)
@Luciaabadia3 @majorolimpio Obrigado @Luciaabadia3 pelo apoio,1113094855281008641,,,1113094855281008600,SF_Moro,,,49,1136,Mon Aug 09 2021 13:40:37 GMT-0300 (Brasilia Standard Time),Sun Aug 02 2020 14:21:24 GMT-0300 (Brasilia Standard Time)
"Hoje, às 23h30, serei entrevistado pelo ⁦@majorolimpio⁩ . Falaremos sobre um pouco sobre a minha carreira e sobre S… https://t.co/zljtPzeWew",1113094855281008641,,,1113094855281008600,SF_Moro,,,1112,11601,Mon Aug 09 2021 13:40:37 GMT-0300 (Brasilia Standard Time),Sun Aug 02 2020 12:15:43 GMT-0300 (Brasilia Standard Time)
Viva a Lava Jato https://t.co/znjOMV9yzZ,1113094855281008641,,,1113094855281008600,SF_Moro,,,1772,16406,Mon Aug 09 2021 13:40:37 GMT-0300 (Brasilia Standard Time),Sat Aug 01 2020 19:09:31 GMT-0300 (Brasilia Standard Time)
Agradeço as mensagens positivas que chegam por meio da tag #ParabensMoro,1113094855281008641,,,1113094855281008600,SF_Moro,,,1230,25351,Mon Aug 09 2021 13:40:37 GMT-0300 (Brasilia Standard Time),Sat Aug 01 2020 15:37:52 GMT-0300 (Brasilia Standard Time)
"Novo artigo na Crusoé, “Fatos teimosos”. https://t.co/yGa1sgrQl5",1113094855281008641,,,1113094855281008600,SF_Moro,,,998,8278,Mon Aug 09 2021 13:40:37 GMT-0300 (Brasilia Standard Time),Fri Jul 31 2020 12:06:10 GMT-0300 (Brasilia Standard Time)
"PGR vai à imprensa sugerir desvios da Força Tarefa do MPF da Lava Jato, mas confrontado nada tem de concreto. “A ba… https://t.co/bTldmqIhHc",1113094855281008641,,,1113094855281008600,SF_Moro,,,2420,17218,Mon Aug 09 2021 13:40:37 GMT-0300 (Brasilia Standard Time),Wed Jul 29 2020 20:51:04 GMT-0300 (Brasilia Standard Time)
"Desconheço segredos ilícitos no âmbito da Lava Jato. Ao contrário, a Operação sempre foi transparente e teve suas d… https://t.co/9chAKbfivN",1113094855281008641,,,1113094855281008600,SF_Moro,,,2143,17956,Mon Aug 09 2021 13:40:37 GMT-0300 (Brasilia Standard Time),Wed Jul 29 2020 10:50:00 GMT-0300 (Brasilia Standard Time)
"Minha solidariedade aos familiares e amigos do apresentador do SporTV Rodrigo Rodrigues, que morreu vítima de compl… https://t.co/JJ9CNKxksk",1113094855281008641,,,1113094855281008600,SF_Moro,,,1257,25276,Mon Aug 09 2021 13:40:37 GMT-0300 (Brasilia Standard Time),Tue Jul 28 2020 14:00:55 GMT-0300 (Brasilia Standard Time)
Registro meu apoio e solidariedade ao Procurador da República Deltan e ao trabalho realizado na Lava Jato. Tempos e… https://t.co/J4GmbJhklc,1113094855281008641,,,1113094855281008600,SF_Moro,,,1628,14316,Mon Aug 09 2021 13:40:37 GMT-0300 (Brasilia Standard Time),Mon Jul 27 2020 19:53:36 GMT-0300 (Brasilia Standard Time)
Falei da importância da agenda anticorrupção nessa matéria do jornal britânico FinancialTimes https://t.co/XwJcVEs8cY,1113094855281008641,,,1113094855281008600,SF_Moro,,,1194,11537,Mon Aug 09 2021 13:40:37 GMT-0300 (Brasilia Standard Time),Sun Jul 26 2020 09:59:13 GMT-0300 (Brasilia Standard Time)
A aprovação da PEC da execução da segunda instância será um teste moral para o país. De que lado você está?… https://t.co/9bJh2KMjx2,1113094855281008641,,,1113094855281008600,SF_Moro,,,1905,14602,Mon Aug 09 2021 13:40:37 GMT-0300 (Brasilia Standard Time),Sat Jul 25 2020 16:19:49 GMT-0300 (Brasilia Standard Time)
"Na Unicuritba, instituição na qual leciono na pós-graduação. https://t.co/QrKYaX5C2o",1113094855281008641,,,1113094855281008600,SF_Moro,,,718,7872,Mon Aug 09 2021 13:40:37 GMT-0300 (Brasilia Standard Time),Wed Jul 22 2020 17:11:19 GMT-0300 (Brasilia Standard Time)
Vídeo explicativo. https://t.co/ghcjA97iXe,1113094855281008641,,,1113094855281008600,SF_Moro,,,1752,12038,Mon Aug 09 2021 13:40:37 GMT-0300 (Brasilia Standard Time),Tue Jul 21 2020 18:12:51 GMT-0300 (Brasilia Standard Time)
"No Dia do Amigo, toda a minha solidariedade aos familiares e amigos das mais de 80 mil vítimas no País pelo coronavírus. Sinto.",1113094855281008641,,,1113094855281008600,SF_Moro,,,1517,27964,Mon Aug 09 2021 13:40:37 GMT-0300 (Brasilia Standard Time),Mon Jul 20 2020 19:46:42 GMT-0300 (Brasilia Standard Time)
"Entrevista no Jornal El Comercio, do Peru. https://t.co/048fFRRxGN https://t.co/LO6O73zdDa",1113094855281008641,,,1113094855281008600,SF_Moro,,,582,5164,Mon Aug 09 2021 13:40:37 GMT-0300 (Brasilia Standard Time),Sun Jul 19 2020 12:27:02 GMT-0300 (Brasilia Standard Time)
"Ponta Grossa, terra de meus pais. https://t.co/pVMZnf4t0N",1113094855281008641,,,1113094855281008600,SF_Moro,,,484,6536,Mon Aug 09 2021 13:40:37 GMT-0300 (Brasilia Standard Time),Fri Jul 17 2020 19:58:03 GMT-0300 (Brasilia Standard Time)
De volta para o passado. https://t.co/e9HNOBn0x7,1113094855281008641,,,1113094855281008600,SF_Moro,,,1827,13840,Mon Aug 09 2021 13:40:37 GMT-0300 (Brasilia Standard Time),Fri Jul 17 2020 17:37:25 GMT-0300 (Brasilia Standard Time)
"Novo artigo na Crusoé, de hoje. https://t.co/wTyKzMR0iN",1113094855281008641,,,1113094855281008600,SF_Moro,,,888,7265,Mon Aug 09 2021 13:40:37 GMT-0300 (Brasilia Standard Time),Fri Jul 17 2020 12:48:43 GMT-0300 (Brasilia Standard Time)
Espero que a juíza não seja punida por devolver dinheiro da corrupção aos cofres públicos. #AvanteLavaJato https://t.co/rljIQ8aRAf,1113094855281008641,,,1113094855281008600,SF_Moro,,,1884,17736,Mon Aug 09 2021 13:40:37 GMT-0300 (Brasilia Standard Time),Thu Jul 16 2020 19:42:49 GMT-0300 (Brasilia Standard Time)
"Mais do que olhar para o passado, devemos olhar para o futuro. Mandatos para Diretor da Polícia Federal e para Dire… https://t.co/chwNAlXCa2",1113094855281008641,,,1113094855281008600,SF_Moro,,,795,7025,Mon Aug 09 2021 13:40:37 GMT-0300 (Brasilia Standard Time),Thu Jul 16 2020 18:58:59 GMT-0300 (Brasilia Standard Time)
Uma boa iniciativa do Instituto Não Aceito Corrupção. https://t.co/4CGnAdCw7R,1113094855281008641,,,1113094855281008600,SF_Moro,,,864,7128,Mon Aug 09 2021 13:40:37 GMT-0300 (Brasilia Standard Time),Thu Jul 16 2020 16:39:20 GMT-0300 (Brasilia Standard Time)
Obrigado pelo apoio @joaoamoedonovo . Sigo firme acreditando nos meus princípios mesmo arcando com as consequências. https://t.co/wWr7IKMTFb,1113094855281008641,,,1113094855281008600,SF_Moro,,,1529,20108,Mon Aug 09 2021 13:40:37 GMT-0300 (Brasilia Standard Time),Tue Jul 14 2020 17:49:18 GMT-0300 (Brasilia Standard Time)
"@caragualucia @Justiceiro367 Sou eclético no gosto musical, mas, citando uma, gosto de É uma partida de futebol, do Skank.",1113094855281008641,,,1113094855281008600,SF_Moro,,,51,540,Mon Aug 09 2021 13:40:37 GMT-0300 (Brasilia Standard Time),Mon Jul 13 2020 14:31:31 GMT-0300 (Brasilia Standard Time)
"@Justiceiro367 Immigrant Song, Led Zeppelin.",1113094855281008641,,,1113094855281008600,SF_Moro,,,77,796,Mon Aug 09 2021 13:40:37 GMT-0300 (Brasilia Standard Time),Mon Jul 13 2020 13:38:12 GMT-0300 (Brasilia Standard Time)
"""Se eu fico, eu jogo tudo fora do que eu fiz em minha carreira e jogo fora minha consciência"".",1113094855281008641,,,1113094855281008600,SF_Moro,,,666,9155,Mon Aug 09 2021 13:40:37 GMT-0300 (Brasilia Standard Time),Mon Jul 13 2020 11:50:57 GMT-0300 (Brasilia Standard Time)
"""É um peso para mim,a gente acaba ficando sujeito a ataques das mais variadas ordens.É um peso para minha família,m… https://t.co/y2qqbczK5n",1113094855281008641,,,1113094855281008600,SF_Moro,,,581,8594,Mon Aug 09 2021 13:40:37 GMT-0300 (Brasilia Standard Time),Mon Jul 13 2020 11:50:56 GMT-0300 (Brasilia Standard Time)
"""Se não pode dizer em voz alta porque que está trocando o diretor da PF ou superintendente da PF do Rio, então você… https://t.co/0hsNiE2vZd",1113094855281008641,,,1113094855281008600,SF_Moro,,,177,1367,Mon Aug 09 2021 13:40:37 GMT-0300 (Brasilia Standard Time),Mon Jul 13 2020 11:50:56 GMT-0300 (Brasilia Standard Time)
"Entrevista à Rádio Metrópole: ""Eu não posso concordar. Sempre defendi que para ter combate à corrupção, é important… https://t.co/yoDoNQVMol",1113094855281008641,,,1113094855281008600,SF_Moro,,,1131,11227,Mon Aug 09 2021 13:40:37 GMT-0300 (Brasilia Standard Time),Mon Jul 13 2020 11:50:56 GMT-0300 (Brasilia Standard Time)
Sobre apoios e agradecimentos. https://t.co/tQJydNF9Ib,1113094855281008641,,,1113094855281008600,SF_Moro,,,1633,17259,Mon Aug 09 2021 13:40:37 GMT-0300 (Brasilia Standard Time),Sat Jul 11 2020 11:56:08 GMT-0300 (Brasilia Standard Time)
https://t.co/bsudwYtxiH,1113094855281008641,,,1113094855281008600,SF_Moro,,,542,5801,Mon Aug 09 2021 13:40:37 GMT-0300 (Brasilia Standard Time),Thu Jul 09 2020 17:22:43 GMT-0300 (Brasilia Standard Time)
"RT @lhmandetta: Que feio! Então eram vocês...
Quem poderia  imaginar? O Facebook  tirou do ar. Descobriu hoje? Demorou hein! Solidariedade…",1113094855281008641,,,1113094855281008600,SF_Moro,,,3570,0,Mon Aug 09 2021 13:40:37 GMT-0300 (Brasilia Standard Time),Thu Jul 09 2020 08:25:17 GMT-0300 (Brasilia Standard Time)
Fui alvo da rede de mentiras que age por motivos político-partidários. Pessoas que perderam qualquer senso de decên… https://t.co/QPU4yvbeWp,1113094855281008641,,,1113094855281008600,SF_Moro,,,1866,21308,Mon Aug 09 2021 13:40:37 GMT-0300 (Brasilia Standard Time),Wed Jul 08 2020 17:46:42 GMT-0300 (Brasilia Standard Time)
"Sobre as origens de várias investigações e ações atuais contra a corrupção, além de outras coisas. https://t.co/CQChYR29MZ",1113094855281008641,,,1113094855281008600,SF_Moro,,,870,7841,Mon Aug 09 2021 13:40:37 GMT-0300 (Brasilia Standard Time),Wed Jul 08 2020 13:10:22 GMT-0300 (Brasilia Standard Time)
Boa conversa hoje com @FMouraBrasil no Antagonista. https://t.co/qlP8barsKC,1113094855281008641,,,1113094855281008600,SF_Moro,,,676,7541,Mon Aug 09 2021 13:40:37 GMT-0300 (Brasilia Standard Time),Tue Jul 07 2020 21:26:54 GMT-0300 (Brasilia Standard Time)
Daqui a pouco. https://t.co/Ws9hLftdSS,1113094855281008641,,,1113094855281008600,SF_Moro,,,311,3599,Mon Aug 09 2021 13:40:37 GMT-0300 (Brasilia Standard Time),Tue Jul 07 2020 18:32:30 GMT-0300 (Brasilia Standard Time)
"@Justiceiro367 Obrigado pela homenagem @Justiceiro367 . Tentei fazer o melhor, junto com outros. Je ne regrette rien.",1113094855281008641,,,1113094855281008600,SF_Moro,,,199,3495,Mon Aug 09 2021 13:40:37 GMT-0300 (Brasilia Standard Time),Tue Jul 07 2020 16:58:49 GMT-0300 (Brasilia Standard Time)
"Sobre a informação de que o Presidente testou positivo para Covid19, só cabe desejar a ele plena recuperação.",1113094855281008641,,,1113094855281008600,SF_Moro,,,1259,34582,Mon Aug 09 2021 13:40:37 GMT-0300 (Brasilia Standard Time),Tue Jul 07 2020 13:22:42 GMT-0300 (Brasilia Standard Time)
"O Peru, onde a Lava Jato teve grande repercussão, é um dos países que mais têm avançado na agenda anticorrupção com… https://t.co/8r4ygMa1zU",1113094855281008641,,,1113094855281008600,SF_Moro,,,1446,12968,Mon Aug 09 2021 13:40:37 GMT-0300 (Brasilia Standard Time),Mon Jul 06 2020 11:52:32 GMT-0300 (Brasilia Standard Time)
"Entrevista da esposa no Estadão, livro sobre doenças raras, doação de EPIs contra covid, saúde e solidariedade. https://t.co/d1ArtiDNYZ",1113094855281008641,,,1113094855281008600,SF_Moro,,,650,6969,Mon Aug 09 2021 13:40:37 GMT-0300 (Brasilia Standard Time),Mon Jul 06 2020 09:00:48 GMT-0300 (Brasilia Standard Time)
"Live dia 07 sobre Doenças raras e políticas públicas: Entender, acolher e atender. https://t.co/jjlaWF8yp3",1113094855281008641,,,1113094855281008600,SF_Moro,,,588,5302,Mon Aug 09 2021 13:40:37 GMT-0300 (Brasilia Standard Time),Sun Jul 05 2020 13:40:05 GMT-0300 (Brasilia Standard Time)
@Deusa_Hela_ Obrigado @Deusa_Hela_ . Bom rever esses momentos no vídeo.,1113094855281008641,,,1113094855281008600,SF_Moro,,,167,3647,Mon Aug 09 2021 13:40:37 GMT-0300 (Brasilia Standard Time),Sun Jul 05 2020 10:39:54 GMT-0300 (Brasilia Standard Time)
"Não fosse a Lava Jato, não haveria acordo de colaboração da Odebrecht e jamais ficaríamos sabendo de possíveis caso… https://t.co/WsCnQjJlpT",1113094855281008641,,,1113094855281008600,SF_Moro,,,2046,17705,Mon Aug 09 2021 13:40:37 GMT-0300 (Brasilia Standard Time),Fri Jul 03 2020 19:07:32 GMT-0300 (Brasilia Standard Time)
Live no Estadão. https://t.co/lyJ80je2yO,1113094855281008641,,,1113094855281008600,SF_Moro,,,465,3635,Mon Aug 09 2021 13:40:37 GMT-0300 (Brasilia Standard Time),Fri Jul 03 2020 15:30:06 GMT-0300 (Brasilia Standard Time)
“Rumo a Nogales” é o título da nova coluna na Crusoé. É sobre instituições e reformas. https://t.co/27yKuFAP2m,1113094855281008641,,,1113094855281008600,SF_Moro,,,1037,9612,Mon Aug 09 2021 13:40:37 GMT-0300 (Brasilia Standard Time),Fri Jul 03 2020 08:29:35 GMT-0300 (Brasilia Standard Time)
"Convém ficar de olho.O melhor é que a PEC da execução da condenação em segunda instância,regra de processo penal, s… https://t.co/euGmq2CmLF",1113094855281008641,,,1113094855281008600,SF_Moro,,,1194,8386,Mon Aug 09 2021 13:40:37 GMT-0300 (Brasilia Standard Time),Thu Jul 02 2020 14:51:13 GMT-0300 (Brasilia Standard Time)
Insisto no tema. Vale a pena ser insistente por boas causas. https://t.co/iFey4CySsm,1113094855281008641,,,1113094855281008600,SF_Moro,,,1156,11746,Mon Aug 09 2021 13:40:37 GMT-0300 (Brasilia Standard Time),Wed Jul 01 2020 23:15:39 GMT-0300 (Brasilia Standard Time)
"@Cassinana Obrigado @Cassinana , verdade e princípios independem de classe social.",1113094855281008641,,,1113094855281008600,SF_Moro,,,192,4876,Mon Aug 09 2021 13:40:37 GMT-0300 (Brasilia Standard Time),Wed Jul 01 2020 21:06:45 GMT-0300 (Brasilia Standard Time)
Ao vivo no https://t.co/cmsujZUOeO para participar do Webinar de 5 anos do @institutoinac. Discutiremos com… https://t.co/CdaJUy5gg3,1113094855281008641,,,1113094855281008600,SF_Moro,,,489,4358,Mon Aug 09 2021 13:40:37 GMT-0300 (Brasilia Standard Time),Wed Jul 01 2020 18:02:58 GMT-0300 (Brasilia Standard Time)
"@RenanJo03294556 Em que pese o fato de não ser o momento para discutir candidaturas, porque temos questões urgentes… https://t.co/AEKIjlr5FX",1113094855281008641,,,1113094855281008600,SF_Moro,,,208,1002,Mon Aug 09 2021 13:40:37 GMT-0300 (Brasilia Standard Time),Wed Jul 01 2020 14:01:48 GMT-0300 (Brasilia Standard Time)
"Nesse momento no qual a Lava Jato está sob ataque, será bom contra-atacar com propostas de aprimoramento para o com… https://t.co/HkcVAq5LzC",1113094855281008641,,,1113094855281008600,SF_Moro,,,1383,10741,Mon Aug 09 2021 13:40:37 GMT-0300 (Brasilia Standard Time),Wed Jul 01 2020 11:31:17 GMT-0300 (Brasilia Standard Time)
