text,query,country,city,userId,username,quote_count,reply_count,retweet_count,favorite_count,timestamp,createdAt
"@VanessaNich @YouTube Obrigado @VanessaNich, diálogos democráticos e reformas são fundamentais para o Brasil voltar… https://t.co/YyObQzBhJJ",1113094855281008641,,,1113094855281008600,SF_Moro,,,76,578,Mon Aug 09 2021 13:40:37 GMT-0300 (Brasilia Standard Time),Tue Jun 30 2020 19:59:00 GMT-0300 (Brasilia Standard Time)
"@DjalmaBarra @YouTube Obrigado @DjalmaBarra Precisamos nos guiar sempre pelos mesmos valores e convicções, e não mu… https://t.co/6GX2mVCqq6",1113094855281008641,,,1113094855281008600,SF_Moro,,,74,359,Mon Aug 09 2021 13:40:37 GMT-0300 (Brasilia Standard Time),Tue Jun 30 2020 19:58:27 GMT-0300 (Brasilia Standard Time)
"Vídeo da live com a IstoÉ, sobre a propaganda abaixo, ressalvo apenas que não utilizaria a palavra ""desafeto"", já q… https://t.co/iAa6NZbwZQ",1113094855281008641,,,1113094855281008600,SF_Moro,,,613,5140,Mon Aug 09 2021 13:40:37 GMT-0300 (Brasilia Standard Time),Tue Jun 30 2020 16:09:50 GMT-0300 (Brasilia Standard Time)
É hoje https://t.co/0gF9I4SnPx,1113094855281008641,,,1113094855281008600,SF_Moro,,,991,9853,Mon Aug 09 2021 13:40:37 GMT-0300 (Brasilia Standard Time),Tue Jun 30 2020 08:22:52 GMT-0300 (Brasilia Standard Time)
Será que o Governo é favorável ou contra a PEC da execução da condenação criminal em segunda instância? Sempre fui… https://t.co/AbofF0cbfY,1113094855281008641,,,1113094855281008600,SF_Moro,,,2207,19901,Mon Aug 09 2021 13:40:37 GMT-0300 (Brasilia Standard Time),Mon Jun 29 2020 21:25:32 GMT-0300 (Brasilia Standard Time)
"Aparentemente, vivemos uma fase anti-lava jato e contra o que ela representa. Não seria melhor o País focar em agen… https://t.co/zw1zYdKtZ4",1113094855281008641,,,1113094855281008600,SF_Moro,,,1994,19465,Mon Aug 09 2021 13:40:37 GMT-0300 (Brasilia Standard Time),Mon Jun 29 2020 09:53:19 GMT-0300 (Brasilia Standard Time)
"@mariajoseleitao Não perca a fé! Podemos estar passando por maus momentos, mas a luta contra a corrupção segue. Render-se, jamais!",1113094855281008641,,,1113094855281008600,SF_Moro,,,670,8726,Mon Aug 09 2021 13:40:37 GMT-0300 (Brasilia Standard Time),Sun Jun 28 2020 23:22:18 GMT-0300 (Brasilia Standard Time)
"@barbaragancia Prezada senhora, penso que suas críticas poderiam ser mais polidas e melhor embasadas, mas não sou a… https://t.co/apJJBPO45b",1113094855281008641,,,1113094855281008600,SF_Moro,,,229,1936,Mon Aug 09 2021 13:40:37 GMT-0300 (Brasilia Standard Time),Sat Jun 27 2020 16:25:56 GMT-0300 (Brasilia Standard Time)
Registro minha solidariedade aos Procuradores da República competentes que deixaram seus postos em Brasília. https://t.co/sH9c5lpVgm,1113094855281008641,,,1113094855281008600,SF_Moro,,,1960,20316,Mon Aug 09 2021 13:40:37 GMT-0300 (Brasilia Standard Time),Sat Jun 27 2020 13:32:17 GMT-0300 (Brasilia Standard Time)
"A culpa é do Departamento de Justiça dos EUA, da CIA ou do FBI quando alguns líderes latino-americanos são surpreen… https://t.co/8yLT5a3AQV",1113094855281008641,,,1113094855281008600,SF_Moro,,,1603,15846,Mon Aug 09 2021 13:40:37 GMT-0300 (Brasilia Standard Time),Fri Jun 26 2020 21:15:05 GMT-0300 (Brasilia Standard Time)
Os recentes acontecimentos favorecem reformas para diminuir o número de cargos de assessores em órgãos legislativos… https://t.co/t4GkcSsN1p,1113094855281008641,,,1113094855281008600,SF_Moro,,,1254,11471,Mon Aug 09 2021 13:40:37 GMT-0300 (Brasilia Standard Time),Fri Jun 26 2020 15:43:41 GMT-0300 (Brasilia Standard Time)
"@DanyVFVieira @robertolivianu @InstitutoInac Obrigado pessoal, o nome do grupo não tem importância, leio como apoio… https://t.co/rJ7F3HfuJe",1113094855281008641,,,1113094855281008600,SF_Moro,,,105,696,Mon Aug 09 2021 13:40:37 GMT-0300 (Brasilia Standard Time),Thu Jun 25 2020 20:59:18 GMT-0300 (Brasilia Standard Time)
"Na próxima quarta-feira (1), às 18h, participo de um webinar ao vivo com os colegas @robertolivianu e Rodrigo Berto… https://t.co/yRojkxp9Ps",1113094855281008641,,,1113094855281008600,SF_Moro,,,970,7842,Mon Aug 09 2021 13:40:37 GMT-0300 (Brasilia Standard Time),Thu Jun 25 2020 13:56:23 GMT-0300 (Brasilia Standard Time)
"@claudiolucasrg Obrigado Cláudio, o mais importante foi demonstrar que não estamos condenados ao fracasso na área d… https://t.co/7fLAmrRYMm",1113094855281008641,,,1113094855281008600,SF_Moro,,,95,707,Mon Aug 09 2021 13:40:37 GMT-0300 (Brasilia Standard Time),Wed Jun 24 2020 22:14:41 GMT-0300 (Brasilia Standard Time)
"@kelen_rossi Kelen, combater o crime com inteligência e ciência é o caminho que dá resultado. Foi o que fizemos ao… https://t.co/Vclk9sVqnY",1113094855281008641,,,1113094855281008600,SF_Moro,,,101,793,Mon Aug 09 2021 13:40:37 GMT-0300 (Brasilia Standard Time),Wed Jun 24 2020 22:07:36 GMT-0300 (Brasilia Standard Time)
"Caso investigado no Brasil, com coleta de perfil genético de 457 vestígios no local do roubo da Prosegur em Ciudad… https://t.co/iLIuMqoEvN",1113094855281008641,,,1113094855281008600,SF_Moro,,,993,10116,Mon Aug 09 2021 13:40:37 GMT-0300 (Brasilia Standard Time),Wed Jun 24 2020 11:30:49 GMT-0300 (Brasilia Standard Time)
Grande evento internacional de Ciências Forenses organizado pela ABCF-Academia Brasileira de Ciências Forenses.Será… https://t.co/T6CxBgCGE2,1113094855281008641,,,1113094855281008600,SF_Moro,,,761,7520,Mon Aug 09 2021 13:40:37 GMT-0300 (Brasilia Standard Time),Wed Jun 24 2020 10:16:56 GMT-0300 (Brasilia Standard Time)
"De um fã do tênis, cabe elogio ao grande atleta por reconhecer o erro. https://t.co/FgQXezmnzB",1113094855281008641,,,1113094855281008600,SF_Moro,,,984,15821,Mon Aug 09 2021 13:40:37 GMT-0300 (Brasilia Standard Time),Tue Jun 23 2020 18:33:54 GMT-0300 (Brasilia Standard Time)
"@RenataMorelli18 @SenadoFederal Renata, sou favorável à mudança já que o modelo atual não tem funcionado para unive… https://t.co/qJ29PpBby0",1113094855281008641,,,1113094855281008600,SF_Moro,,,107,695,Mon Aug 09 2021 13:40:37 GMT-0300 (Brasilia Standard Time),Tue Jun 23 2020 17:13:43 GMT-0300 (Brasilia Standard Time)
"É necessário retomar a agenda de reformas, entre elas a votação e aprovação da PEC da segunda instância, que prevê… https://t.co/J4kb0y3Ytq",1113094855281008641,,,1113094855281008600,SF_Moro,,,1592,14565,Mon Aug 09 2021 13:40:37 GMT-0300 (Brasilia Standard Time),Tue Jun 23 2020 16:33:19 GMT-0300 (Brasilia Standard Time)
Participei de uma live da XP Investimentos e destaquei a necessidade de retomarmos o espírito de reformas para supe… https://t.co/NpLyWWgUKa,1113094855281008641,,,1113094855281008600,SF_Moro,,,1053,12231,Mon Aug 09 2021 13:40:37 GMT-0300 (Brasilia Standard Time),Tue Jun 23 2020 13:06:08 GMT-0300 (Brasilia Standard Time)
"Publicada no Brasil tradução de excelente livro sobre a luta da magistratura italiana contra a Máfia siciliana, com… https://t.co/AqkFjHcaOF",1113094855281008641,,,1113094855281008600,SF_Moro,,,1697,19586,Mon Aug 09 2021 13:40:37 GMT-0300 (Brasilia Standard Time),Mon Jun 22 2020 12:34:44 GMT-0300 (Brasilia Standard Time)
Concedi entrevista hoje na Jovem Pan e a veículos do Grupo RIC. Um pouco sobre tudo. https://t.co/kIYlhJoel0,1113094855281008641,,,1113094855281008600,SF_Moro,,,765,8601,Mon Aug 09 2021 13:40:37 GMT-0300 (Brasilia Standard Time),Mon Jun 22 2020 09:26:38 GMT-0300 (Brasilia Standard Time)
"@jussara_crispim No que for possível cuidem-se vocês também, que estão no sacrifício para salvar vidas.",1113094855281008641,,,1113094855281008600,SF_Moro,,,99,739,Mon Aug 09 2021 13:40:37 GMT-0300 (Brasilia Standard Time),Sun Jun 21 2020 18:41:22 GMT-0300 (Brasilia Standard Time)
Mais de 50.000 vítimas pelo novo coronavírus. Muito triste. Cuidem-se. Lembro que já tivemos Ministro da Saúde. https://t.co/ggUC3HhKkJ,1113094855281008641,,,1113094855281008600,SF_Moro,,,2939,38146,Mon Aug 09 2021 13:40:37 GMT-0300 (Brasilia Standard Time),Sat Jun 20 2020 20:44:13 GMT-0300 (Brasilia Standard Time)
Some informations about current situation in Brazil and anticorruption efforts. https://t.co/eifQJj673F,1113094855281008641,,,1113094855281008600,SF_Moro,,,1201,14131,Mon Aug 09 2021 13:40:37 GMT-0300 (Brasilia Standard Time),Sat Jun 20 2020 12:39:33 GMT-0300 (Brasilia Standard Time)
"“Honra e fuzis”, minha coluna de estreia na Crusoé, é sobre como precisamos no momento mais de honra do que de fuzi… https://t.co/khBK3pSSlT",1113094855281008641,,,1113094855281008600,SF_Moro,,,2154,24272,Mon Aug 09 2021 13:40:37 GMT-0300 (Brasilia Standard Time),Fri Jun 19 2020 08:05:28 GMT-0300 (Brasilia Standard Time)
Entrevista com o Prof. Marco Antônio Villa. https://t.co/SlZIuNWl1W,1113094855281008641,,,1113094855281008600,SF_Moro,,,1028,12068,Mon Aug 09 2021 13:40:37 GMT-0300 (Brasilia Standard Time),Thu Jun 18 2020 14:46:07 GMT-0300 (Brasilia Standard Time)
"O importante é que polícias, Ministério Público e Cortes de Justiça possam trabalhar de maneira independente e que… https://t.co/FXROf1muZq",1113094855281008641,,,1113094855281008600,SF_Moro,,,2905,45415,Mon Aug 09 2021 13:40:37 GMT-0300 (Brasilia Standard Time),Thu Jun 18 2020 10:34:00 GMT-0300 (Brasilia Standard Time)
"@Leninhadecastr1 Leninha, fico feliz que tenha gostado. Precisamos falar lá fora e reiterar que nossa democracia é… https://t.co/xVAVaqjoCF",1113094855281008641,,,1113094855281008600,SF_Moro,,,232,5321,Mon Aug 09 2021 13:40:37 GMT-0300 (Brasilia Standard Time),Wed Jun 17 2020 19:24:08 GMT-0300 (Brasilia Standard Time)
"@LuizctbaII Obrigado Luiz, precisamos todos nos unir e apoiar uns aos outros para acabar com essa polarização exces… https://t.co/8Lm8D7USuW",1113094855281008641,,,1113094855281008600,SF_Moro,,,93,800,Mon Aug 09 2021 13:40:37 GMT-0300 (Brasilia Standard Time),Wed Jun 17 2020 19:21:34 GMT-0300 (Brasilia Standard Time)
"Concedi entrevista ao El País, jornal espanhol. Democracia brasileira está consolidada e não sofre riscos. Mas pass… https://t.co/7r1TDJWuIy",1113094855281008641,,,1113094855281008600,SF_Moro,,,1932,23255,Mon Aug 09 2021 13:40:37 GMT-0300 (Brasilia Standard Time),Wed Jun 17 2020 07:41:22 GMT-0300 (Brasilia Standard Time)
